musical_title,rate,review_title,review_text,review_date
뮤지컬 〈마틸다〉,5,마틸다는 천재예요,구더기 친구들도 너무 멋져요. 제 생일 기념으로 봤는데 정말 최고의 선물이었어요. 특히 소명친구가 콰이어트 부를 때 전율이...! 여러번봐도 질리지 않을 뮤지컬이라고 감히 말해봅니다. 다음 티켓 오픈 때도 노려볼래요ㅅ??,2018.12.17
뮤지컬 〈마틸다〉,5,참 좋은 공연,마틸다 너무 좋아요 짱짱 수준높은 공연,2018.12.17
뮤지컬 〈마틸다〉,5,재밌습니다,재밌어요재밌어요 재밌어요재밌어요 재밌어요재밌어요 재밌어요재밌어요 재밌어요재밌어요 재밌어요재밌어요 재밌어요재밌어요 재밌어요재밌어요 재밌어요재밌어요 재밌어요재밌어요 재밌어요재밌어요 재밌어요재밌어요 재밌어요재밌어요 재밌어요재밌어요 재밌어요재밌어요 재밌어요재밌어요 재밌어요재밌어요 재밌어요재밌어요 재밌어요재밌어요 재밌어요재밌어요 재밌어요재밌어요 재밌어요재밌어요 재밌어요재밌어요 재밌어요재밌어요 재밌어요재밌어요 재밌어요재밌어요 재밌어요재밌어요 재밌어요재밌어요 재밌어요재밌어요 재밌어요재밌어요 재밌어요재밌어요 재밌어요재밌어요 재밌어요재밌어요 재밌어요재밌어요 재밌어요재밌어요 재밌어요재밌어요 재밌어요재밌어요 재밌어요재밌어요 재밌어요재밌어요 재밌어요재밌어요 재밌어요재밌어요 재밌어요재밌어요,2018.12.17
뮤지컬 〈마틸다〉,5,뮤지컬 〈마틸다〉,뮤지컬 〈마틸다〉 2018.12.02 14:00 안소명 / 김우형 / 박혜미 / 최정원 / 현순철,2018.12.17
뮤지컬 〈마틸다〉,5,뮤지컬 〈마틸다〉,뮤지컬 〈마틸다〉 2018.12.02 19:00 황예영 / 김우형 / 박혜미 / 최정원 / 현순철,2018.12.17
뮤지컬 〈마틸다〉,3,생각만큼 감동은...,노래가 잘 안들리고 쫌 어수선함,2018.12.17
뮤지컬 〈마틸다〉,5,너무 좋았어요.,어린시절이 떠오르며 뭔가 울컥하게 되는 뮤지컬인 것 같아요.,2018.12.17
뮤지컬 〈마틸다〉,5,"환희와 감동, 그리고 순수함이 가득했던 무대",작은 몸짓들이 모여 거대하고 완벽한 무대를 만들고그 안에서 어린이들은 환희를 느끼고 어른들은 감동을 느낄 것 같다,2018.12.17
뮤지컬 〈마틸다〉,5,최고의 뮤지컬,꼭보세요,2018.12.17
뮤지컬 〈마틸다〉,5,마틸다ㅠㅠ어른들을 위한 동화,볼 때마다 늘 새로워! 짜릿해!,2018.12.17
뮤지컬 〈마틸다〉,2,관람 후기,배우들이 어리다 보니  다소 연기 가 아쉬움,2018.12.17
뮤지컬 〈마틸다〉,5,신나요 옳지않아,독서충 옳지 않아,2018.12.17
뮤지컬 〈마틸다〉,5,기적같은 뮤지컬 마틸다,"100회차 공연 잘 봤습니다. 100회까지 공연한 마틸다 축하드리고, 앞으로도 4명의 마틸다 배우들 아프지않고 무사히 공연 마치길 바랍니다. 정말 최고의 공연 마틸다!! 추천합니다.",2018.12.17
뮤지컬 〈마틸다〉,4,생각보다,트런치불이 그렇게 매력있지 않았어요,2018.12.17
뮤지컬 〈마틸다〉,5,말도 안됩니다.,너무 대단해요,2018.12.17
뮤지컬 〈마틸다〉,4,우리애들,너무잘해 이모가 사랑한다ㅜㅠㅠㅠ,2018.12.17
뮤지컬 〈마틸다〉,5,100회,스페셜 커튼콜 아쉬웠지만..마틸다 배우님들  아프지  마세요.,2018.12.17
뮤지컬 〈마틸다〉,5,99회,3층이어도 좋아라~,2018.12.17
뮤지컬 〈마틸다〉,5,트런치불 교장선생님이 말씀하셨어요,"트런치불 교장선생님이 말씀하셨어요 애들 없는 세상에 살고 싶다고  그 순간 저는 트런치불 선생님께 감정 이입할 수 밖에 없었어요 제 앞뒤에 어린이들만 30명 정도 앉아서 1,2부 동안 미치는 줄 알았거든요  집에 가고 싶다 언제 끝나냐 졸리다고 140분 동안 이야기하더라고요 휴대폰 보고 앞으로 수그리고 페트병을 손에 들어 계속 찌그러트리고 좌석 발로 차고 수시로 몸을 흔들어댔어요 본인들이 생각하기에 웃긴 대사가 있으면 그걸 듣자마자 돌림 노래처럼 따라 불렀습니다  마틸다에 애들만 들여보내신 어머니 아버지들 이건 애들을 위한 길이 아니에요 님들의 자기만족입니다 님들의 애들은 극장에 갇혀 긴 시간 고통받고 있어요 그리고 저는 그 사이에 껴서 큰 돈을 쓰고도 졸라 고통 받았고요",2018.12.17
뮤지컬 〈마틸다〉,5,좋아요,좋아요,2018.12.17
뮤지컬 〈마틸다〉,5,설가은 마틸다 보고 왔어요,"배우들의 발음이 잘 안 들린다는 말을 듣고, 걱정을 좀 했는데 설가은 배우님 딕션이 너무 좋아서 걱정 안 하셔도 될것 같아요. 연기도 좋았고 감동 받았습니다. 작은 몸에서 큰 에너지와 열정이 느껴졌어요. 초등학생 관람객이 많아서 시끄럽진 않을까 했는데, 오늘 공연에 전혀 해되지 않았어요.",2018.12.16
뮤지컬 〈마틸다〉,5,가족과 함께하는 소중한 시간,가족들과 공연을 보고 마틸다를 벌써 3번째 보네요 볼때마다 감동과  소중한시간이 됩니다,2018.12.16
뮤지컬 〈마틸다〉,3,기분좋은 뮤지컬,내용도 좋고 아이들은 귀엽고 무대도 예쁜데 간혹 노래 넘버에서 발음상의 문제인지 가사를 알아듣기 어렵습니다. 어린 연기자들 뿐아니라 성인 연기자들 사이에도 발생하는 바 가사 번안의 문제가 아닌가 생각됩니다.,2018.12.16
뮤지컬 〈마틸다〉,5,대단한 마틸다,연기력 대단합니다~감동의감동~나도마틸다처럼~,2018.12.16
뮤지컬 〈마틸다〉,5,딸아이가 넘 좋아하네요~,딸이랑 즐겁게 관람했어요~~방학때 또 한번 보기로 약속했어요^^,2018.12.16
뮤지컬 〈마틸다〉,5,정말 정말 좋아요,넘버들도 배우들도 다 정말 좋아요 특히 2막 그네씬 사랑합니다,2018.12.16
뮤지컬 〈마틸다〉,5,최고의 뮤지컬을 보았습니다.,"정말 말이 필요없는 최고의 뮤지컬이었습니다.  공연 내내 시간 가는 줄 모르고 즐겁게 관람할 수 있었습니다.  배우들의 노래와 연기 모두 일품이었고, 이런 공연을 볼 수 있었다는 것이 행운처럼 느껴집니다.  이 공연을 위해 애써주신 모든 분들께 감사합니다.",2018.12.16
뮤지컬 〈마틸다〉,5,멋진 공연,모든 배우님들에게 박수를 보냅니다.,2018.12.16
뮤지컬 〈마틸다〉,5,마틸다,안소명 마틸다 정말 좋았습니다.,2018.12.16
뮤지컬 〈마틸다〉,5,환타스틱 ~~한 공연,초등3학년 여자아이가 반해버려 마틸다원서와 27일 평일공연 또 보기로~~말이 없네요,2018.12.16
뮤지컬 〈마틸다〉,5,굿굿,어린춘구들 똘똘뭉쳐서 좋은 작품 보고 갔던 기억이 지금까지 생생합니다,2018.12.16
뮤지컬 〈마틸다〉,5,몇번을 봐도 재밌어요,집에 와서도 계속 흥얼거리게 되네요~,2018.12.16
뮤지컬 〈마틸다〉,5,진짜 재밌어요,처음 공연장 들어갔을때부터 세트랑 넘 예뻐서 감탄했는데 배우님들 다 정말 잘하고 재밌네요 특히 옳지 않다고 외치는 마틸다가 넘 당차고 좋았습니다 또 보러 가고싶어요,2018.12.16
뮤지컬 〈마틸다〉,5,포기하지 않는 아이를 위한 기적같은 뮤지컬,한명한명 다 너무 열정적이고 함께해 즐거웠습니다,2018.12.16
뮤지컬 〈마틸다〉,5,감동입니다!,"배우들, 연출 모두 감동입니다~!",2018.12.16
뮤지컬 〈마틸다〉,5,너무너무 멋진 공연~,모든 배우분들의 호흡이 너무 좋았어요^^너무 너무 멋진 무대~재관람 하고 싶네요~,2018.12.15
뮤지컬 〈마틸다〉,5,"재미,감동,연기력 짱~~",아이들이 나오는 것이라 연기력등이 걱정이었으나 함께 간 지인들께 덕분에 즐거운 시간이었다는 얘기를 들었습니다. 힐링되는 시간이었습니다~~  강추~~우리 딸과 다시 재 관람 예매했습니다~~,2018.12.15
뮤지컬 〈마틸다〉,5,너무 좋았어요ㅠ 재관람하게되는 뮤지컬!,"안소명, 박혜미 배우 회차로 봤는데 정말 좋았습니다. 항상 마틸다  프레스콜 영상만 보다가 직접 보니까 느낌이 너무 다르고 보는 내내 미소가 떠나질 않았어요. 박혜미 배우님은 다른 작품에서 봤을 때랑 캐릭터가 정말 다른데 허니쌤 정말정말 좋았어요ㅠ 허니쌤 넘버마다 그냥 눈물이 줄줄 흐르더라구요...?? 사촌동생들이 초등학생인데 꼭 같이 보고싶은 작품이에요. 즐겁게 보고 나오는 어린이 관객분들이 정말 많더라고요!!  너무 아쉬웠던 건 공연 중에 어른 관객들이 너무 시끄러웠다는 점입니다. 머글극에 단체로 오는 관객들이 많은 만큼 무대 진행중에도 서로 떠들거나 과한 기침소리로 몰입을 방해하는 어른 관객들이 많았어요.",2018.12.15
뮤지컬 〈마틸다〉,2,"아동학대, 폭언장면이 너무많아 불편했어요","그 긴 시간동안 폭언, 무시, 고성 장면이 필요했는지 의문입니다. 거의 90퍼센트였던듯..  아이들이 그런 말, 단어들을 배울까 걱정되네요. 50퍼센트 미만으로 설정해도 좋았을듯.  그에 비에 결말이 넘 쉽고 급하게 끝난것같아 아쉽네요. 비추입니다",2018.12.15
뮤지컬 〈마틸다〉,5,에릭꾸,에릭배우 ㅠㅠㅠㅠㅠㅠ 그냥 천재만재,2018.12.14
뮤지컬 〈마틸다〉,5,예영틸다,모든 배우님들께 박수를 보냅니다,2018.12.14
뮤지컬 〈마틸다〉,5,감동입니다,너무좋았어요,2018.12.14
뮤지컬 〈마틸다〉,4,너무 멋진 마틸다!!,혼자 외로운 상황에서도 옳지않은것에 맞서 싸우는 마틸다를 보고 많은 것을 느끼게 됩니다!!!  공연내내 볼거리가 풍부하고 너무 재미있어요,2018.12.14
뮤지컬 〈마틸다〉,3,뮤지컬 〈마틸다〉,대배우님들 다들 아프지 마시고 건강하시길.... 남은 2달 잘 버텨주세요 ㅜㅜㅜㅜ,2018.12.14
뮤지컬 〈마틸다〉,5,좋아요,그네씬 너무 좋다,2018.12.14
뮤지컬 〈마틸다〉,4,아이들의 역량이 잘 보이는 공연,작은 아이들이 보여주는 강력한 힘이 돋보이는 공연이었습니다. 성인 배우분들의 합은 말할 수 없을 정도로 좋았습니다. 더군다나 신시컴퍼니 30주년에 가서 많은 혜택을 받은것도 좋았습니다,2018.12.14
뮤지컬 〈마틸다〉,4,추천합니다,공연은 정말 좋습니다. 하지만 관객들이 조금만 주의를 했으면 좋겠습니다.,2018.12.14
뮤지컬 〈마틸다〉,5,자꾸자꾸 또 보고 싶어요ㅠㅠ,마틸다들 4명 다 만나고 싶네요,2018.12.14
뮤지컬 〈마틸다〉,5,매일매일 보고 싶은 무한 감동 뮤지컬~!!,"아직도 뮤지컬마틸다를 본 여운이 가시질 않아요.  정말 최고 최고!  2018 최고의 뮤지컬답습니다.  올해 꼭 보고 싶은 뮤지컬 중 하나였는데  볼 수 있어서 얼마나 기쁘던지요.  늦은 시간이었지만 그래도 볼 수 있어서 정말 다행이었어요.    Matilda Shop을 운영하고 있어요.  액자가 제일 탐나긴 했는데...  그냥 보는 걸로 만족했어요.  줄을 서서 살만큼 인기가 많더라고요.   윤이 커갈수록 아쉬움은 남지만  이렇게 같이 좋은 뮤지컬을 볼 수 있다는 것은  참 좋아요.    뮤지컬 마틸다의 시그니처 제스처죠!  포토존에서 많은 분들이 요거 따라하시더라고요ㅋㅋ     이것을 보는 것 자체만으로 감동의 물결입니다.  사실 윤은 보기 전에는 살짝 시큰둥하긴 했는데  공연 후에는 정말 재미있었다고 하더라고요.    역삼역 7번출구와 연결되어 있는 LG아트센터!  일찍 와서 아직 티켓박스가 오픈을 안했어요.  오픈도 하기 전에 줄 서서 기다리는 분들이 많아서  윤맘도 줄 서서 기다렸어요.   티켓은 공연 1시간 전부터 배부가 됩니다.  티켓팅하려고 기다리는데  뮤지컬마틸다의 인기를 실감하겠더라고요.  줄이 쫙~!!   리플렛 찾으러 삼매경~!  그러나 모두 소진되었다는 슬픈 소식이...ㅠㅠ  Matilda의 인기가 이렇게나 높을 줄이야.  리플렛이라도 갖고 싶었는데ㅠ    S석이라 2층에서 보았는데  무대가 한 눈에 보이더라고요.  그래도 1층이 아니어서 아쉽긴 했어요.  맨앞줄 정말 부럽더라고요.  2층에서는 배우들의 얼굴이 잘 안보였어요.      로알드 달의 동화를 원작으로 한 뮤지컬인데  윤맘은 영화도 동화도 읽지 않은 백지상태로 갔어요.  줄거리만 알고 있었어요.  하지만 워낙 작품이 좋다보니 영화나 동화를 보고 가든   그렇지 않든 전혀 문제가 되지 않았어요.    어린이들의 비중이 이렇게 큰 줄은 몰랐어요.  하지만 성인연기자들을 압도하는 놀라운 실력에  감탄하고 말았답니다.  귀엽고 깜직한 어린이다운 모습과  뛰어난 실력의 조화는 뮤지컬마틸다를 더욱 돋보이고  완성도 높게 만들었어요.    미스 트런치불의 최재림을 기대했는데  김우형이 나와서 조금 실망했지만  와~ 정말 100% 미스 트런치불의 악랄함을  소화해내는 모습에 흡입력 100%로 압도당하고 말았어요.  투포환 선수의 그 모습 그대로, 정말 엄지척이었어요.    마틸다의 베스트 프렌드, 라벤더의 깜찍함에  풍덩 빠져버렸어요.  어쩜 이렇게 연기를 잘하죠?!  혼자서 무대에 섰을 때도 전혀 주눅들어하지 않고  당당하고 귀여운 모습은 참으로 인상깊었어요.   마틸다는 정말 진심 최고 중의 최고입니다.  딕션이 정말 좋더라고요.  특히나, 이야기를 들려줄 때 탈출마술사와   함께 대사를 하는 부분은 정말 최고였어요.  갖은 학대에도 ""옳지 않아!""를 당당하고 자신있게 외치는  8살 소녀의 당찬 모습은 계속 생각이 나더라고요.  어리지만 극을 이끌어가는 능력에 우리 나라 뮤지컬계의  미래가 참 밝다라는 생각까지 들었어요.   가장 인상적인 장면은 교문과 그네신이었어요.  알파벳을 통해 무대를 멋지게 변화시켜가면서  대사도 찰떡같이 붙이고ㅎㅎ 정말 완벽했어요.  그네신은 2층에서 봐서 더 멋있게 보였을지도 모르겠어요.  비교를 위해 1층에서도 한번 더 보고 싶다는~ㅎㅎ  그렇게 높이 올라가는지 몰랐는데 어린이들도 전혀 무서워하지 않고  쓩쓩 잘 타더라고요.  뭔가 노하우가 있겠죠?!    2018 최고의 뮤지컬, Matilda!!   기립박수가 나올 정도로 열광적인 무대였어요.  평일에는 8시 시작에 160분이라는 긴~ 공연이라  집에 가니 12시였지만 힘들어도 볼만한 가치가 충분했어요.  특히, 윤은 일찍 자기 때문에 10시가 넘어가면 꾸벅꾸벅 조는데  마틸다를 볼 때는 안자더라고요.  그만큼 집중하며 재미있게 봤다는 거겠죠.     사진은 음악이 끝난 뒤 커튼콜 때만 담을 수 있어요.  미리 안내 방송을 해주시더라고요.  어린이 캐스팅은 미리 공지가 되어 있지 않아서  누가 나올까 굉장히 궁금했는데요, 4인의 마틸다를  다 보고 싶다는 생각이 저절로 들더라고요.  각자 다 특색과 매력이 있을 것 같아요.  역시 스케일이 큰 뮤지컬은 다르구나! 라는 것을   다시 한번 느끼게 되었어요.  기회가 된다면 VIP석에서 다시 한번 뮤지컬마틸다의  멋진 매력을 느껴보고 싶어요.",2018.12.14
뮤지컬 〈마틸다〉,5,예영틸다 짱♡,오늘 3시 공연을 보고왔는데 너무좋았어요~~예영틸다 노래도 잘하고 어쩜 대사도 다 외웠는지~소명틸다 지나틸다 가은틸다까지 다 보고 싶을 정도 에요~ 그래서 또 보러 가려구요~,2018.12.14
뮤지컬 〈마틸다〉,5,어린아이의 연기력??,뮤지컬해봤던 사람으로써 아이들의 끼와 노력이 대단하다고 생각하고 스토리도 아주 좋았습니다!,2018.12.13
뮤지컬 〈마틸다〉,5,기대이상 기대이상,아역배우들 연기가 정말  처음부터 끝까지 감동적이었습니다 아쉽다면 자막을 보았더라면 하는 아쉬움은 가사 내용 전달이 잘 되지않아서 인데요  가사를 듣고싶다는건 그만큼 가사까지 빼먹고 싶지않을만큼 모든게 좋았기에 다음에 또 기회된다면 자막을 고려해주십시오재관람 하고싶습니다ㅎㅎ,2018.12.13
뮤지컬 〈마틸다〉,5,마틸다,재미있게잘보았습니다,2018.12.13
뮤지컬 〈마틸다〉,5,아이들에게 강추합니다.,아이들에게 추천해주고 싶습니다.  그러나 아주 신나거나 그렇지는 안습니다.  그래도 동심을 다시 느낄 수 있는 시간입니다.   공연 팁으로는  무조건 앞자리에 앉으세요~~~ ^^,2018.12.13
뮤지컬 〈마틸다〉,5,학대받는 아이의 이야기..,"가장 좋아하는 사람 앞에서 자신의 가장 약한 부분을 보여주는 것은 얼마나 어려울까. 마틸다가 자신이 가족들에게 외면당하는 아이라는 걸 도서관 펠프스 선생님께 말하지 못한 이유는 뭘까요. 늘, 선생님이 하는 말을 따라서 자신이 사랑받는 아이라고 꾸며 이야기했지만 늘 도움을 청하고 싶었을 거에요. 하지만 또 동정받고 싶지는 않았기 때문에 차마 말하지 못했겠죠. 어떤 면으로는 가정에서도, 학교에서도 괴롭힘 당하는 아이들... 중 침묵하는 아이들이 생각나는 공연이었습니다. 주변에서 전혀 그런 상황을 눈치채지 못한 것은 그런 티를 내지 않기 때문이라고 했죠. 하지만 대놓고 괴롭힘 당하는게 눈에 보이게 될 정도가 되면 이미 그건 심하고 심하고 심한 수준까지 갔을겁니다.  그래서 주변 어른들이 좀 더 아이들에게 관심을 가져야하죠. 말을 하지 않더라도 유독 친구나 가족 이야기를 피한다거나 말을 돌린다거나.. 그런 소소한 관심이 아이들의 괴로운 시간을 줄여줄 수 있지 않을까요?",2018.12.13
뮤지컬 〈마틸다〉,5,기적같은 아이 마틸다.,"이야기를 들려드릴까요 할 때의 반짝이는 눈빛. 부당한 일을 당했을 때 그저 참지 않고 작은 복수를 하는 아이. 책을 좋아하고 이야기를 들려주길 좋아하고 놀랍도록 뛰어난, 그리고 꿈꾸는 아이. 막상 가장 가까운 가족들이 그런 마틸다의 기적같은 면을 보지 못한다는 것이 참 아쉽습니다.  태어나면서부터 남자가 아니라고 외면당하고 남들이 좋아하는 게 아니라 조금 다른 걸 좋아한다고 별종이라고 취급받았던 마틸다가 엇나가지 않고 저렇게 예쁘게 큰 게 얼마나 다행스럽던지요..  작다면 작은 기적을 일으킨 마틸다. 하지만 그 기적은 마틸다에게 꼭 필요한 기적이었죠. 어쩌면 신께서 마틸다를 불쌍히 여겨서 잠깐 힘을 주신건지도. 네 마틸다를 전부 만나보았는데 다들 너무 매력적이에요. 작지만 큰 거인 마틸다. 막이 내리기 전에 한번 더 보러 가야겠어요^^",2018.12.13
뮤지컬 〈마틸다〉,4,볼만했다~,아역들의 연기는 다소 과장스러운 부분이 있었는데 세트와 노래와  그 어린 나이에 모든 것을 완벽하는 아역배우들에게 존경심마저 들었다.,2018.12.13
뮤지컬 〈마틸다〉,5,아이들이 최고에요,정말 아이들의 연기 춤 노래가 많은 것을 생각하게 하는 작품이다 나는 옳지않아라고 외치며 당당 할 수 있을까,2018.12.13
뮤지컬 〈마틸다〉,4,옳지 않아...,귀에 맴맴.... 아이들이 호연이 돋보이는...  연말에 좋은 공연봐서 좋았다,2018.12.13
뮤지컬 〈마틸다〉,5,마틸다,마틸다마틸다,2018.12.13
뮤지컬 〈마틸다〉,5,작지만 꽉찬 무대,아역배우들 중심으로 이끌어가는 내용이어서 기대를 하지 않고 관람했는데 무대가 정말 가득찬 느낌을 받았습니다. 연출로서 무대를 항상 채우고 아역배우 전부 연기 및 노래를 훌륭하게 소화해서 인상 깊은 무대였습니다.,2018.12.13
뮤지컬 〈마틸다〉,5,아이들의 열정이 대단합니다~~,딸들과 함께 봤는데 너무 재미있다고 하네요~ 어린친구들이 정말 열정적으로 연기하더라고요~~ 즐거운 시간였습니다~^^,2018.12.13
뮤지컬 〈마틸다〉,5,많은 생각을하게되는 극이였어요,애기들이 너무 예뻣어요또 보고싶었어요,2018.12.12
뮤지컬 〈마틸다〉,3,아이가 너무 연기가 안되네요,생각보단 별로였어요.빌리 엘리엇이랑 비교되네요,2018.12.12
뮤지컬 〈마틸다〉,4,재미있었어요,좋은 공연이었습니다,2018.12.12
뮤지컬 〈마틸다〉,4,좋았어요,다만 주인공 아역이 너무 국어책읽는 것 같은 느낌도.. 노래나 전체적인 극은 좋았습니다.,2018.12.12
뮤지컬 〈마틸다〉,3,재밌어요,허니선생님 말고는 발음이 잘 안들리지만 재밌어요,2018.12.12
뮤지컬 〈마틸다〉,5,역시!!! 굳,굳굳굳,2018.12.12
뮤지컬 〈마틸다〉,5,올해 최고의 뮤지컬,또 보러 가거에요 이미 30일 예매해뒀답니다 너무 재밌어용,2018.12.12
뮤지컬 〈마틸다〉,5,때론 너무 필요한,약간의 똘끼! 마틸다의 용기에 박수치고 갑니다!,2018.12.12
뮤지컬 〈마틸다〉,5,딸에게 가르쳐 주고 싶은 용기,"태어난 순간부터 사랑받지 못하고 또 환영받지 못한 마틸다~~ 마틸다는 자신의 환경을 받아들이기 보다는  자신만의 방법으로 이겨내며 헤쳐 나갑니다.  엄마로서 마틸다를 보는 내내 대견하면서도 마음 한 켠이 참 아팠어요. 아이가 환상적인 힘을 가지지 않으면 도저히 이겨낼 수 없는 현실이 아프게 다가왔기 때문입니다. 그러나 부당함에 대응하며 씩씩하게 이겨내는 마틸다에게는  마틸다를 소중히 여기는 따뜻한 어른이 있었음을 보며 눈 밑이, 코 끝이 찡해지기도 했고요. ^^  공연을  보고 돌아오는 내내 딸과 함께 기억에 남는 멜로디를 흥얼거리며 환상적인 무대 장치를 떠올리며 흥분해서 이야기를 나누었어요.  하지만 무엇보다 제 딸의 마음에 남았으면 하는 것은  바로 마틸다의 용기 입니다. ^^   좋은 공연으로 저와 딸의 마음에 용기를 심어주셔서 감사합니다.",2018.12.11
뮤지컬 〈마틸다〉,5,뮤지컬 〈마틸다〉,뮤지컬 〈마틸다〉,2018.12.11
뮤지컬 〈마틸다〉,5,사랑,이 기적같은 아이는 마틸다 사랑해요,2018.12.11
뮤지컬 〈마틸다〉,5,감동 가득한 마틸다 뮤지컬,"아이와 함께 마틸다 책을 읽고 처음으로 같이 관람한 뮤지컬 이었는데 주인공들 연기에 감탄하고, 긴 시간 집중할 수 있는 여러 장치들이 있어 공연내내 즐겁게 볼수 있었어요. 아이도 공연을 얼마나 집중해서 보는지 집에와서도 프로그램 북이며 주인공들이 출연한 영재발굴단 프로그램까지 다시 보기 했답니다.",2018.12.11
뮤지컬 〈마틸다〉,5,마틸다,어린 마틸다의 열연에 큰 박수를 보냅니다 ㆍ 무대도 색 다르고 지금까지 봐 왔던 다른 그 어떤  뮤지컬 보다 감명 깊게 보았습니다ㆍ 혹자는 우리나라 정서와는 안 맞는거 같다고 말하지만 저는  색다른. 주제와 아이들의 열연&#4514;그리고 아직도 남아있는 남아 선호 사상을 강렬하게 꼬집은 공연이라 생각합니다ㆍ 온갖 굴욕을 이겨내고 거친 파도위에 홀로. 살아 남은듯한 마틸다에게 다시 한번 큰 박수를 보냅니다ㆍ 제작진 여러분 출연자 여러분 모두모두 감사합니다!,2018.12.11
뮤지컬 〈마틸다〉,5,너무 인상적이였습니다~~,아역배우들의 연기가 너무 인상깊었고 무대 짜임새도 너무 좋았습니다~~ 마침 보던날이 마틸다100회 공연이라 더욱 뜻깊은 시간이였던것 같아요~~,2018.12.11
뮤지컬 〈마틸다〉,4,마틸다!,진짜 아이배우들이 너무너무 귀엽고 잘했어용 ㅠㅠㅠㅠ누구나 볼 수 있는 재미 있는 공연이에용!!! 추천!!!,2018.12.11
뮤지컬 〈마틸다〉,5,기적같은 아이 마틸다,울 엄마는 내가 짱이래! 하는 아이들을 보며 저도 힘이 나요,2018.12.11
뮤지컬 〈마틸다〉,5,정말로 행복했던 3시간,진짜... 최고... 왕천재....,2018.12.11
뮤지컬 〈마틸다〉,5,잼잼,넘 비싸긴함,2018.12.11
뮤지컬 〈마틸다〉,5,너무 재밋다,애들 힘들게 하지마세요,2018.12.11
뮤지컬 〈마틸다〉,5,사랑스러운 공연,너무 사랑스러운 마틸다!!! 또 보고싶어요!!,2018.12.10
