musical_title,rate,review_title,review_text,review_date
뮤지컬 〈마틸다〉,3,생각보다..ㅠㅠ,기대가 컸었는지 후반부가 너무 두리뭉실 넘어가네요 극이라도 많이 재미있었으면 뒷좌석 언제끝나냐고 자꾸 묻던 아이의 목소리가 참아졌을텐데 극도 만족스럽지 않다 보니 생각보다 그랬어요 그래도 앙상블 아이들이 연습을 많이 했겠다는 생각도 들고 김우형 배우 새로운 모습 재미있게 봤어요  아이가 75분 가만히 못볼거 같으면 공연장에 데리고 오지 마세요 제발.. 이건 아동극이 아니에요..,2019.02.03
뮤지컬 〈마틸다〉,5,환상적이고 감동적이네요,아이들과 보았는데 어른들이 봐도 감동적이고 재미있는 내용에 감탄이 절로 나왔습니다. 아이들의 연기가 엄청 대단합니다. 개인적으로는 그네 장면과 마지막 장면이 기억에 남네요... 아이들과 또는 어른끼리 와서 보기에 전혀 부족함이 없습니다. 다시 보고 싶은 뮤지컬이네요...,2019.02.03
뮤지컬 〈마틸다〉,5,여운이 있는 어른 동화,"사실 지난 달에 처음에 마틸다를 봤을 때는 배우들(성인들, 아역분들 모두!)이 잘하긴 하는데, 내용은 약간 무거운 게 아닌가 싶기도 했어요. 아무리 동화스럽게 그렸다 해도 결국 마틸다가 학대받았다는 사실은 남아있으니까요.ㅜㅠ  하지만 첫번째 관람 이후에도 노래와 배우분들의 에너지가 자꾸만 생각나서 어제 다시 봤는데, 정말 너무너무 좋더라구요ㅜㅠㅠㅠㅠㅠㅠㅠㅠ 이 뮤지컬이 블랙코미디라는 걸 생각하고 다시 찬찬히 곱씹으니 ''마틸다''라는 기적 같은 아이는 스스로의 삶을 개척했을 뿐만 아니라 허니선생님의 삶까지 용기있게 이끌어준 사람이었던 거에요. 왠지 넘버 하나하나 나올 때마다 눈물을 참을 수가 없었습니다.  아, 마틸다마다, 어린이팀마다의 특징이 있는 것도 너무 좋더라구요. 심지어 모두 성인인 저보다 프로답게 너무 잘 하고...... 그래서 결국 마틸다 4명 다 보기로 결정했어요ㅜㅠㅋㅋㅋㅋㅋㅋㅋㅋ 막공 주에 빠지게 되다니 이게 무슨 슬픈 일...",2019.02.03
뮤지컬 〈마틸다〉,5,최고의 뮤지컬,언제나 울면서 나옵니다ㅠㅠ 자주 올라오길 바라는 간절한 마음!!,2019.02.03
뮤지컬 〈마틸다〉,4,좋아요,그네 씬이 정말 생각한것보다 너무너무 예뻤습니다. 사진으로 보는거랑 다르네요 정말 감탄하고 봤어요아이들 너무 예쁘고 귀여워요 잘봤어요,2019.02.03
뮤지컬 〈마틸다〉,5,기쁨과 웃음과 슬픔과 감동.....,보고 싶었던 마틸다를 늦게서야 보았다. 솔직히 아이들이 부모님과 같이 와서 보게되면 아이들이 오랜시간 동안 앉아서 보는것이 힘들어..... 옆에서 집중해서 볼 수 없는게 ..... 안 보았으면 후회 했을것이다. 뒤늦게 본것이 아쉽고 또 보고 싶은데 며칠 있으면 끝나는데 볼 시간이 없어서 더 더 더 아쉽다. 다음에 또 다시 했으면 좋겠다.아역배우들 참여한 모든 배우들이 너무 잘 해서 감탄사가 절로 나오네요. 아이를 키우는 부모는 아니지만 자기 자식을 사랑하지도 않고 말을 함부로하여 어린아이에게 큰상처를 주는것이 ...,2019.02.03
뮤지컬 〈마틸다〉,5,마틸다 사랑해,갠적인 일로 포기하고 싶고 가장 힘든 요즘 포기하지 않게 해준 공연♡,2019.02.02
뮤지컬 〈마틸다〉,5,세 번을 봐도 너무 좋은 마틸다 ㅠㅠ,애기들아 넘 잘한다... 정원쌤 사랑해요...,2019.02.02
뮤지컬 〈마틸다〉,4,감동적이었어요!,"마틸다가 너무 기대되서, 개막하기 전에 기획사에서 하는 ""신입생""도 가입했었는데.. 시간이 안 맞아서 못 보고 있다가.. 이제야 겨우 봤는데...   지나틸다가... 뭔가 감기걸린거 같은 약간 맹맹한 소리가 났지만 역할에 빠져서 진짜 열심히하는게 눈에 보였고, 또 사랑스러웠습니다.  허니선생님 목소리 너무 예뻐요!!ㅎㅎㅎ  그리고 다른 아역 앙상블들, 성인 앙상블들 모두 각자 자신의 역할에 맞춰서 열심히 하는게 보여서 더 좋았구요!  그리고 when I Grow up 그네 탈때는 울컥했습니다!!",2019.02.02
뮤지컬 〈마틸다〉,5,멋진공연!,아이들이 몇개월동안 훈련받으며 그많은 대사와 연기력  칭찬합니다 대단해요,2019.02.02
뮤지컬 〈마틸다〉,5,최고,진짜 배우들 최고입니다,2019.02.02
뮤지컬 〈마틸다〉,4,이제 곧 끝난다니 아쉬워요,마틸다 볼 때마다 행복했는데 이제 곧 막공이네요 매공연마다 각종 관크 때문에 힘들었지만ㅜㅜ 그래도 정말 애정하는 공연이었어요,2019.02.02
뮤지컬 〈마틸다〉,5,따뜻한 공연,위로가 되주는 눈물나게 해주는 공연,2019.02.02
뮤지컬 〈마틸다〉,5,천재같은 아역 배우들,어린배우들의 놀라운 연기에 감탄하며 보았습니다. 특히 안소명 마틸다분은 정말 대단하더군요. 처음에 노래를 하는데 소름이 돋으며 시작됩니다! 강추에요.,2019.02.02
뮤지컬 〈마틸다〉,5,배우님들,어린배우님들이 연기했기에 더욱 와닿았던 것 같아요ㅠㅠ 잘 보고 갑니다ㅠㅠ,2019.02.01
뮤지컬 〈마틸다〉,5,연기가너무좋았어요,5감이 즐거웠습니다 ㅎㅎㅎㅎㅎ,2019.02.01
뮤지컬 〈마틸다〉,5,동화같은 이야기,황예영 이뽀이뽀~ 아이들이 너무 잘하네요~ 가슴이 따뜻한극 잘봤어요^^,2019.02.01
뮤지컬 〈마틸다〉,5,재미있었습니다!!,너무 잘 보고 왔어요!!ㅠㅠ또 보고싶어요~~!!,2019.02.01
뮤지컬 〈마틸다〉,5,넘나 재밌는 것,REVOLTING!!!! 크으으 잼나요!! 초딩극은 아니지만 에너지넘치는 초딩들 넘나 귀엽고 ㅋㅋ 잘하고 ㅋㅋ 장하고 ㅋㅋ 마틸다는 사랑입니당,2019.02.01
뮤지컬 〈마틸다〉,5,마틸다와 환상 여행!,"이제 초3 올라가는 아이 강요로? 보게 되었어요. 어른인 제가 더 감동적이고 재밌었어요~ 웃고 울고 화나고 ... 환상적인 이야기로 풀어내는 마틸다 뮤지컬.. 정말 정말 잊지 못할 것 같아요. 무대며 배우들의 실감나는 연기며 노래, 액션, 조명 등...모든 게 다 매력적이네요. 또! 보고 싶어요~",2019.02.01
뮤지컬 〈마틸다〉,4,다른 배우 다른 느낌,"마틸다 역으로 안소영 배우 두번 보고 이번에 황혜영, 미세스 웜우드 역으로 최정원 배우 두번 보고 이번에 강운곤 배우, 허니 선생님 역으로 박혜미 배우 두번 보고 이번에 방진의 배우 공연을 보게 되었습니다.  마틸다는 두 배우 다 발성이 좋았으나, 안소영 배우가 더 마틸다의 느낌을 잘 살렸던 것 같아요. 목소리에 힘도 있구요. 하지만 미세스 웜우드 역과 허니 선생님 역으로 나오시는 분들은 확실히 먼저 두분 연기가 훨씬 호소력 있고, 분명하게 들리더라구요.  세번째 보지만, 먼저 본 티켓을 안챙겨간 이유로 28000원을 더 내게 되었는데, 꼭 실물 티켓을 가져와야하는지가 의문입니다.  그걸 해결해주셨으면 합니다.",2019.02.01
뮤지컬 〈마틸다〉,5,우리 식구 모두 마틸다에 빠졌어요,먼저 영화를 보고 책을 읽고 뮤지컬을 관람했습니다. 등장인물과 스토리라인을 알고 가니 소설과는 차이가 있지만 아이들이 쉽게 이해를 하고 극에 집중하며 빠지게 되어 두 번 관람했습니다. 아이들 아빠도 아동 뮤지컬 중에는 단연코 최고라며 아이들과 함께 유트브를 시청하고 거의 모든 노래를 부릅니다. 일부 곡은 가족 떼창이 가능하구요. 지난주부터는 원어로 시청하고 있습니다~^^ 조금 여유가 되면 일층서도 관람하고 싶네요!,2019.02.01
뮤지컬 〈마틸다〉,5,좋았어요,좋았어요~ 재밌었습니다. 아이도 많이 좋아했어요,2019.02.01
뮤지컬 〈마틸다〉,5,환상적인 무대 !!!!  대단한 아역 배우들~~,공연 전 로비에서 아동 관객이 너무 많아 어수선한 공연장 분위기로 집중이 안될까 걱정했는데... 멋진 무대에 모두 감동하여 함께 즐길 수 있는 분위기여서 우리의 공연 관람 태도가 많이 성숙해 졌음을 다시 한번 실감했어요~~  그리고 멋진 우리 미스 트런치불 교장선생님 연기에 웃고 흥분할 수 있어 진짜 재미있었어요~~ 의상이 참 인상적이었읍니당~~!!^^,2019.02.01
뮤지컬 〈마틸다〉,5,환상적인 공연!,어린시절 좋아했던 책이자 영화로 만들어진 작품! 아이들이 너무 사랑스럽게 연기를 한다!,2019.02.01
뮤지컬 〈마틸다〉,4,정말정말 좋은데 약간의 아쉬움...,"정말 이쁜 무대! 깜찍한데 노래와 어려운 안무를 훌륭하게 소화하는 어린이 배우들! 각자의 역할을 맛깔나게 살리는 어른 배우들 (트런치불 못지 않게 마틸다의 부모님도 멋졌습니다!)! 덕분에 내내 엄마미소 지으면서 즐겁게 관극했어요. 그런데 클라이막스 노래의 가사가 잘 전달되지 않아서 너무 아쉬웠습니다. 사실 클라이막스 부분이 원작에 비해 급전개라서 그 점도 좀 당황스러웠는데, 클라이막스 노래의 내용이 잘 들리지 않아서 더 아쉬웠습니다. 개사도 전체적으로 기발하게 해서 감탄했는데, 그걸 마지막 노래에선 듣지 못해서 아쉽....  그래도 정말 즐거웠어요!",2019.02.01
뮤지컬 〈마틸다〉,5,너무 마음에 들어요,봐도봐도 질리지않는 최고의 공연입니다,2019.02.01
뮤지컬 〈마틸다〉,4,즐거운 공연^^,연말에 가슴 훈훈한 공연~,2019.02.01
뮤지컬 〈마틸다〉,5,꼭봐야할 뮤지컬,어린이 어른이를 위한 정말 최고의 작품!! 힐링되어 돌아올수있는 정말 그어떤 작품에서도 볼수없던 무대! 내인생 최고의 작품이라고 할 정도로 최고였습니다!!,2019.02.01
뮤지컬 〈마틸다〉,5,연기 최고! 무대 최고! 음향 최고!,"아역배우들이 너무나 잘해서 깜짝 놀랐어요!! 춤과 노래 뿐만 아니라, 동선이며 가끔 소품들까지 옮기고 하던데, 정말 하나도 안놓치고 하는게 대단했어요!!! 그리고, 음향도 정말 대단하셨어요!!! 그냥 녹음된 것들 쓰는게 아닐까라는 생각이 들만큼 음향이 다채롭고 깔끔했는데, 나중에 커튼콜때.. 관악기 드신 분들보고 깜짝 놀랐습니다..  또한, 다른 뮤지컬보다 조명이 많이 화려했어요! 미러볼에, 레이저에 ... 지루할 틈이 없던 공연이었습니다! 적극 추천 드려요~",2019.02.01
뮤지컬 〈마틸다〉,4,즐거운 시간이었습니다.,즐거운 시간이었습니다.즐거운 시간이었습니다.즐거운 시간이었습니다.즐거운 시간이었습니다.즐거운 시간이었습니다.즐거운 시간이었습니다.즐거운 시간이었습니다.즐거운 시간이었습니다.즐거운 시간이었습니다.즐거운 시간이었습니다.,2019.02.01
뮤지컬 〈마틸다〉,5,정말 좋았습니다!,정말 좋았습니다!,2019.02.01
뮤지컬 〈마틸다〉,4,"사실 기대 안하고 갔었던 뮤지컬, 하지만 웃으면서 나왔던 행복했던 공연",아이들이 주인공이라서 그랐을까요. 크게 기대를 안하고 갔었던 것 같습니다. 저는 3층이라서 특히 초반에는 아역배우들 대사가 잘 안들려서 내용을 이해하기가 좀 어려웠어요.  끝까지 사실 대사는 좀 듣기가 어려웠던 건 사실인데 ... ㅠ 무대나 나머지 스토리 노래 나머지는 만족스러웠고 재미있었습니다~^^,2019.02.01
뮤지컬 〈마틸다〉,5,마틸다!!,배우분들이 노래도 너무 잘 부르고 ~ 재미있었어요~,2019.02.01
뮤지컬 〈마틸다〉,5,마틸다ㅠㅠㅠㅠ,ㅠㅠㅠㅠㅠㅠㅠㅠ마틸다들 너무 잘하는거 아닌가요이제 가은대배우님만 보면 다 보는데ㅠㅠㅠㅠ 다들 너무 잘해ㅠㅠㅠㅠㅠ,2019.02.01
뮤지컬 〈마틸다〉,5,마틸다 공연 봤어요,넘 재미나게 공연 봤어요 내가 마치 어린아이가 된것 처럼 하하 호호 하면서 관람했네요  존재라는건 참 소중한거에요,2019.02.01
뮤지컬 〈마틸다〉,5,옳지 못한 것을 옳지 못하다고 말 못하는 어른에게,마틸다는 제목처럼 어른들에게 메세지를 던져줬습니다.배우들의 호흡이 너무나 좋았습니다.좋은 공연 보여주셔서 감사합니다.,2019.02.01
뮤지컬 〈마틸다〉,5,추찬합니다.,다시 보려고 오늘 예매했습니다.,2019.02.01
뮤지컬 〈마틸다〉,5,좀전에 보고 왔어요(이지나),이지나 아역배우의 마틸다 공연을 좀전에 보고 왔어요. 정말 열정적인 무대 퍼포먼스와 아이들의 모습에 눈물이 흘러나왔답니다. 어른이 되면~~ 이라면서 부를 때 지금의 우리 현실을 돌아보게 되고 다시금 생각하게 되었지요. 아이들이 어른이 되었을 때 보다 좋은 세상이 되도록 만드는게 우리 어른들의 몫이 아닐까 생각해봅니다. 열정적인 무대를 선보인 마틸다 팀에 감사드립니다.,2019.02.01
뮤지컬 〈마틸다〉,5,다시봐도 최고입니다!,다른 마틸다를 만나볼수있어 좋았고모든 장면이 사랑스럽고 고마웠어요행복한 시간이었어요!,2019.01.31
뮤지컬 〈마틸다〉,5,막공이 다가온다는게 슬퍼요 ㅠ,"2월 10일날 막공 끝나면, 이제 다음 마틸다 보려고 일이년간 기다려야 한다는게 슬프네요 ㅠ마틸다 출연한 아역배우들 조만간 빌리엘리어트로 다시 만날 수 있기를!",2019.01.31
뮤지컬 〈마틸다〉,5,마틸다,딸과 함께 본 마틸다 즐거웠습니다~,2019.01.31
뮤지컬 〈마틸다〉,4,아. 짜증.,거 애엄마. 이런데 자식 데려왔으면 미리 교육시켰어야죠. 어린애가 공연중에 궁금한거 물어본다고 일일이 답해주고 그런거 아닙니다.애가 뭘배우겠습니까?,2019.01.31
뮤지컬 〈마틸다〉,5,어른이되면...,어른이되면~계속 귀에서 마음으로 메아리리고 치고있네요. 뭉클뭉클아이들에게도 어른에게도 참 좋은 작품이예요^^,2019.01.31
뮤지컬 〈마틸다〉,5,틀려먹은 세상에 뒤틀려먹은 애들-!,"재런치볼의 인터뷰를 보고 꼭 봐야겠다 결심하던 구더기(ㅋㅋ) 였습니다. 친구들에게 열심히 영업하며 같이 보러갔는데 정말 후회없는 선택이었고 절 매우 칭찬합니다. 정말 동화같은 무대에 아역배우님들의 연기도 멋졌고, 그네타는 장면과 교장선생님의 예쁜 리본선이 기억에 많이 남더라구요ㅋㅋ 다만 앞좌석의 분들이 점점 앞으로 숙이시고 난간에 기대보시면서 시야에 방해되는게 조금 아쉬웠습니다ㅠㅠ 안내를 강하게 해주셔야 할 것 같습니다. 너무 즐거웠고 재미있었습니다. 이런 공연을 올려주셔서 볼 수 있게 해 주셔서 감사합니다!!",2019.01.31
뮤지컬 〈마틸다〉,5,재관람입니다!,처음 봤을때 느꼈던 경이로움이 재관람에서도 이어지네요!  다시봐도 압도적인 배우들의 연기! 그리고 미술 음악 조명 뭐하나 부족한것이 없어요! 어린 친구들의 연기가 이렇게 탄탄하다니! 정말 놀랍습니다(마틸다뿐 아니라 친구들까지!!!!)  3차 4차 관람하고싶은 마음이네요~,2019.01.31
뮤지컬 〈마틸다〉,1,어린이뮤지컬,지루해서 1부 보고 인터미션에 나왔어요제 스타일은 아닌거 같아요회사에서 단체로 갔는데 지루하고 아이들 발음이 무슨 말 하는지 못알아 듣겠더라구요 ㅠ,2019.01.31
뮤지컬 〈마틸다〉,4,이별준비..,"가장 사랑했던 소명마틸다를 마지막으로 보는 시간이라 한장면도 놓치지 않으려 노력했다.  뮤지컬 막바지가 되어가니.. 그사이 많이 자란거 같다. 처음 봤을때 또랑또랑 딕션에 반했는데 이제는 뭔가 감정이 음색에서 느껴짐.  어린이가 여자아이가 된 느낌..  개인적으로 1번의 관람을 남겨두고 있는 지금 출연진,스텝들 모두모두 정말 정말 수고했다고 감사하다고 말해주고 싶다.",2019.01.31
뮤지컬 〈마틸다〉,5,마틸다 관람 후기,정말 강력 추천합니다!,2019.01.31
뮤지컬 〈마틸다〉,5,정말 좋았던 시간,노래도 무대도 좋고 아역배우님들 퍼포먼스가 보기 좋았습니다ㅠㅠ 본격 출산장려뮤지컬이네요...,2019.01.31
뮤지컬 〈마틸다〉,5,소중한 사람과 함께 보고싶은 공연,행복한 시간이었습니다.,2019.01.31
뮤지컬 〈마틸다〉,5,어른이가 어린이가 되는 시간,저는 마틸다를 보면서 어린 시절 제모습과 함께 어른이 된 제 모습을 함께 보게 되었네요. 재밌었어요.,2019.01.31
뮤지컬 〈마틸다〉,5,정말 최고의 뮤지컬,마틸다 분 연기 정말 잘하시구 진짜 좋았어요ㅜㅜ,2019.01.31
뮤지컬 〈마틸다〉,5,생각보다 더 좋았던 마틸다,관크에 대해서 걱정이 많았는데 관객 분위기는 생각보다 괜찮았습니다. 오히려 어린이들보다는 성인들이 핸드폰을 떨어뜨리는 행위가 더 소란스러웠던 것 같네요. 어린이용 뮤지컬이라기 보다는 블랙코미디 느낌이 낭낭한 어른이용 뮤지컬이었네요. 잘 보았습니다~,2019.01.31
뮤지컬 〈마틸다〉,5,보는 중에도 끝난 뒤에도 행복한 뮤지컬,사랑해요 마틸다,2019.01.31
뮤지컬 〈마틸다〉,5,★★★★★,탄탄한 스토리와 배우들의 열연으로 몰입감있게 잘 봤습니다.,2019.01.31
뮤지컬 〈마틸다〉,5,좋은 공연입니다,좋은 공연추천합니다,2019.01.31
뮤지컬 〈마틸다〉,5,bb,bbbbb,2019.01.31
뮤지컬 〈마틸다〉,5,재미있는 공연,"공연시간이 다른 뮤지컬 시간에 비해서 좀 길었지만  아이들이 공연을 이끌어나가고, 흥미롭게 집중 할 수 있는 시간이었습니다.",2019.01.31
뮤지컬 〈마틸다〉,5,굿굿!!,아이들이 생각보다잘해서 깜짝놀랐어요볼거리풍성했던 무대연출도 좋았구요무엇보다 카리스마 뽐내던 최재림 완전좋아~~,2019.01.31
뮤지컬 〈마틸다〉,5,너무 좋았어요,"쬐그마하지만 온 힘을 다해 세상에 외치는 마틸다, 그리고 마틸다로 인해 더 이상 침묵하지 않게 된 선생님과 아이들을 보며 벅차서 많이 울었어요ㅠㅜ조명이랑 영상, 무대, 음악, 안무 배우분들 연기, 극이 가지는 메시지.. 모든게 완벽했습니다????",2019.01.31
뮤지컬 〈마틸다〉,5,최고의 뮤지컬!,"안소명 배우님! 정말 멋졌어요. 엉엉 울다 나왔네요. 본의아니게(?) 훌쩍훌쩍 관크를 ㅠㅠ 무대 너무너무 멋지고 넘버, 스토리 모두모두 완벽한 뮤지컬이었어요. 뒤늦게 봐서 아쉬웠지만 한 번은 더 보려고요.",2019.01.31
뮤지컬 〈마틸다〉,5,행복했습니다.,"마틸다라는 작품을 만날 수 있어 참 행복했습니다.어린 친구들에게서 엄청나게 큰 에너지를 얻을 수 있는 시간들이였고, 작품을 볼 때마다 마음이 너무나 따뜻해지는 작품이였습니다. 장면 하나하나 계속 생각날 것 같아요. 함께 울고 웃을 수 있는 작품이라 더욱 더 기억에 남을 것 같구요..마틸다와 함께 할 수 있었던 시간들이 참 행복했고 이 작품을 만날 수 있어 많이 고마웠습니다.",2019.01.31
뮤지컬 〈마틸다〉,5,마틸다!!!!,"어른이 뮤지컬!!!환상적인 무대, 서사가 돋보이는 흐름, 어리지만 진짜 배우들!! 재밌습니다.",2019.01.31
뮤지컬 〈마틸다〉,5,한번 더 보고싶어요,아역배우들이 너무 잘해요.정말 한번 더 보고싶은데 갈 수 있는 날이 없어서 너무 아쉬워요ㅠㅠ 그리고 최재림배우님!!마틸다 캐스팅발표 때부터 최재림배우님회차를 보고싶었는데 시간이 없아서 이제야 봤어요.최고였습나다ㅋㅋㅋ역시 남우주연상!!!마틸다 추천합니다~^^,2019.01.31
뮤지컬 〈마틸다〉,5,너무 좋았어요,이렇게 좋을줄 몰랐네요. 환상적인 뮤지컬이었어요.,2019.01.31
뮤지컬 〈마틸다〉,5,재밌어요,기대 이상으로 재밌게 봤어요,2019.01.31
뮤지컬 〈마틸다〉,1,어린이뮤지컬,어린이뮤지컬 보고 온 거 같아요 ㅎㅎ;;가족단위가 대부분이라 그런지 애들 소리와 추임새로 가득한 뮤지컬이에요평소 조용히 보는 걸 좋아하시는 분은 다른 뮤지컬을 보시는 게 건강에 좋을 거 같아요,2019.01.30
뮤지컬 〈마틸다〉,5,예상을뛰어넘는 masterpiece,솔직히 말해서 엄청나게 기대했던 작품은 아니다하지만 어린 친구들의 정확한 딕션과 섬세한 감정연기 아름다운 목소리가 화려하고 멋지고 웅장한 무대세트 조명 음향 사소한 소품 하나하나 그 모든것과 어우러져 만들어내는 하모니가 완벽했다이상하게 울 포인트가 아님에도 중간중간 계속 눈물이 흐르곤 했다단순한 동화를 넘어선 마음 속 깊은 곳까지 울림이 전해지는 가히 명작이다,2019.01.30
뮤지컬 〈마틸다〉,4,영국에서의 감동이 그대로...,"2015년, 딸 아이 1학년때 영국 여행을 하면서 캠브리지 극장에 마틸다를 예매하고 벅찬 감동과 함께 어린아이들의 연기와 노래에 극찬을 했었던 기억이 있어 진짜 우리 나라에서는 마틸다를 소화해낼 아역 배우가 없을것이라 확신했었는데 2019년 딸 아이가 5학년이 되는데 딸 아이와 나이도 같은 안소명 마틸다를 보고 제 확신이 잘못이었다는것을 느꼈답니다. 아이도 그 당시에는 영어 대사이다보니 잘 몰랐던 부분도 아! 저런 내용이었구나 하면서 정말 정말 재밌었다고 연신 최고라고 엄지 척을 해주었답니다. 다만 아쉬웠던 점은 영국에서 봤을때는 정말 감쪽 같았던 교장 선생님이 학생을 해머 던지듯이 날려버리는 장면이었는데 2 보다 훨씬 더 부족할만큼 어설프더라구요. 원작과 비교되는 부분도 있었지만 그래도 마틸다 넘나 멋진 작품이었답니다~~~^^",2019.01.30
뮤지컬 〈마틸다〉,5,어릴적 추억이 새록새록 하네요,"책으로 정말 재밌게 읽었던터라 혼자라도 뮤지컬 보러 갔었는데무대도 다채롭고 표현도 너무 예쁘고,어린 배우들도 나이가 무색하게 너무 잘해줘서정말 감동이었습니다! 진짜 추천이에요!!!",2019.01.30
뮤지컬 〈마틸다〉,5,보는 내내 감동!,"뮤지컬이 처음인데, 책으로 읽었을 때 재밌게 봤던 기억이 있어 마틸다를 첫 뮤지컬로 선택하게 되었습니다. 아이들이 돋보이는 뮤지컬이었기 때문에 보기 전엔 엄청난 스케일을 보여주진 못할거라고 생각했습니다. 하지만 공연이 시작하자마자 제 편견을 깨고 아이들끼리 웅장한 성량과 움직임, 행동 모두가 어설프지 않고 엄청난 공연을 보여주었습니다. 마틸다와 선생님의 스토리를 보며 울컥했던 부분도 있고 괜찮은척 하는 마틸다를 보며 안쓰럽기도 했습니다. 정말 기대를 뛰어넘은 최고의 공연을 보여주신 배우분들께 너무 감사하고, 뮤지컬이 끝나기전에 다시 보고싶다는 생각이 들게해준 뮤지컬입니다! 꼭 보시길 추천드립니다!!",2019.01.30
뮤지컬 〈마틸다〉,3,마틸다,일막은 좀 지루했는데 이막은 재밌었어요-! 어린 아이들이라 말이 잘은 안 들렸지만 정말 대단하더라구요 즐겁게 잘 봤습니다:),2019.01.30
뮤지컬 〈마틸다〉,5,마틸다보고 잔잔한감동과 재미가,"마틸다에 나오는 어린아이들의 용기와 행동에 잔잔한 감동 받았어요   나쁜역할이긴하지만 트런치블교장의 행동들때문에 재미도 있었어요  중간중간 볼거리들도 많고, 어린이 관객들이 많았지만 전혀 신경쓰이지 않을만큼 관람태도도 좋아서   또한번 감동이었어요",2019.01.30
뮤지컬 〈마틸다〉,5,날이갈수록 발전하는 공연,날이갈수록 발전하는 공연 우연한기회로 마틸다를 이번기회에 또 보게되었는데 날이갈수록 아역배우들의 실력이나 연기가 많이 발전하는 것 같았다..  거기에 성인배우분들의 힘이 더해지니 탄탄한 극이 완성되었는데.. 곧 내려간다는 것이 아쉬울 뿐이다.,2019.01.30
뮤지컬 〈마틸다〉,5,그네타는 장면 아이가 좋아 하네요~^^,저도 좋았구요 다른분들도 그랬나봐요 다같이 와~~  하면서 봤어요^^알파벳송 가사 너무 신박하니 좋더라구요  새삼스레 한글에 우수성을 다시 느꼈어요,2019.01.30
뮤지컬 〈마틸다〉,5,넘 좋은 뮤지컬,배우들이 어찌 그렇게 잘하는지! 보면서도 너무 놀라운 작품이였습니다,2019.01.30
뮤지컬 〈마틸다〉,5,생동감 넘치는 무대,그네 장면 잊지 못할거예요 ㅠㅠ,2019.01.30
