musical_title,rate,review_title,review_text,review_date
뮤지컬 〈시카고〉,5,너무 좋았습니다~!,"우연히 좋은자리를 예매하게 되었는데 너무 좋았습니다. 배우님들 모두 훌륭했지만 김영주 배우님, 최정원 배우님 그리고 앙상블에 서만석 배우님 정말 최고였습니다~!",2018.07.05
뮤지컬 〈시카고〉,5,너무 좋았습니다~!,"우연히 좋은자리를 예매하게 되었는데 너무 좋았습니다. 배우님들 모두 훌륭했지만 김영주 배우님, 최정원 배우님 그리고 앙상블에 서만석 배우님 정말 최고였습니다~!",2018.07.05
뮤지컬 〈시카고〉,5,식카고,요즘 덥고 습해서 하루 종일 헐떡이고 짜증이 너무나는데 시카고를 보고 나오는 지금 집에가는 길에..입가에 미소가 절로 나옵니다. 진정한 록시는 바로 나라고 외치는 우리 아이비..표정 연기부터 발성..넘버까지 너무나 완벽한..너무 좋아요..시카고 너무 사랑스럽습니다.,2018.07.04
뮤지컬 〈시카고〉,5,아이비♥?최정원!,정말 환상의 조합입니다!너무 재밌게 잘 봤어요~ 믿고 보는 페어입니다!,2018.07.04
뮤지컬 〈시카고〉,5,역시 아이비~~♡,시카고의 록시는 누구? ? 아이비 항상 믿고 보는 아이비의 록시~~♡ 오늘도 시카고는 저의 피로를 확 날려주었습니다..,2018.07.04
뮤지컬 〈시카고〉,5,아이비 최고~^^,아이비 귀염귀염~ 최정원 역쉬 짱~^^전체적으로 능숙하고 최고의 배우들이 만든 멋진 무대입니다~브로드웨이 것보다 더 잘하는 둣~^^,2018.07.04
뮤지컬 〈시카고〉,5,최고의 공연,춤과노래 모두 완벽했습니다! 재밌어요~,2018.07.04
뮤지컬 〈시카고〉,5,아이비최고,재밌게봤어요,2018.07.04
뮤지컬 〈시카고〉,4,재미있었습니다.,첫공으로 봤었는데 첫날임에도 배우들이 연기도 노래도 정말 잘하시더라구요. 예전에 영화 시카고를 봐서 내용과 대부분의 넘버를 알았음에도 즐겁게 보았습니다. 무대구성이 다른 나라의 버전으로 알고있던 것과 달리 오케스트라를 전면에 노출시키는 방식이던데 이를 통해 감상자들의 극의 몰입을 방해해 인물들을 객관적으로 판단하게 하는 것이 범죄가 난무하는 극의 내용과 잘 어울리는것 같았습니다. 조금 아쉬웠던건 제가 앙상블들을 많이 활용해 무대 대부분을 항상 인물들로 가득 채우는 극을 주로 봐서 그런지 주조연배우분들의 솔로 넘버가 있을때마다 무대가 좀 비어보이기도 했습니다. 그리고 다들 섹시하고 치명적이게 춤을 추시는데 남자배우분들의 화장이 너무 옅어서 극 분위기와 조금 안 맞는것 같다는 생각을 했네요. 그외에는 다 좋았습니다^^,2018.07.04
뮤지컬 〈시카고〉,5,시카고 강추 ㅋㅋ,"안재욱 빌리와 아이비 &#47225;시, 박칼린 벨마, 김영주 마마가 출연하는 공연이었는데, 다들 아주 스스로인듯 잘 하십니다. 특히 그동안의 빌리와는 차별화된 멋짐을 더 장착한 안재욱 빌리!!  사람을 함락시키는 기술의 진수를 보여주더군요. ^^ 강추합니다.",2018.07.04
뮤지컬 〈시카고〉,5,적극추천드려요,두번째관람이었던 시카고 ♥ 다른캐스팅이 궁금해서 두번봤는데두번봐도 새롭고 신나요,2018.07.04
뮤지컬 〈시카고〉,5,시카고는 사랑입니다??,두번째 관람인데 또 새로워요! 정원벨마님 애드립도 진짜 찰지고 재미있었고 지우배우님은 록시찰떡이시고 경주빌리님도 능청스럽고 어찌나 딕션이 정확하신지 진짜 귀에 쏙쏙 박혀요. 그리고 무엇보다 앙상블 배우님들! 진짜 멋있으세요..시카고는 앙상블 배우님들 보는 재미에 또 가는것 같아요. 진짜 시간과 돈만 있으면 무한회전문돌고싶은 극입니다!,2018.07.04
뮤지컬 〈시카고〉,4,재밌었어요.,두번째보는건데 역시는 역시에요. 매력적인 마마 캐릭터가 넘 좋아요 ㅎㅎㅎ,2018.07.04
뮤지컬 〈시카고〉,4,재밌었습니다:),"째즈를 좋아하는 사람들은, 오케스트라의 음악에 저절로 들썩일거라 확신합니다:) 언니들의 화끈한 의상과 깜짝놀랄만한 반전이있는 스토리도 좋았습니다!  다만 실제 담배피는 부분이 다소 기니 참고해주시면 될 듯 싶어요!  눈과 귀가 즐거웠던 공연이었습니다:)",2018.07.03
뮤지컬 〈시카고〉,5,생애 첫 뮤지컬,"미녀 살인마 록시와 벨마의 만남과 재판까지의 사건을 그린, 영화원작의 뮤지컬이다. 록시는 푼수같고 ㅎㅎㅎ 너무 예쁘고...(아이비..미모..) 벨마는 선머슴같더라 ㅎㅎ 성격이랑 이미지가 정말 잘어울린다 남편 아모스도 정말 뛰어난 연기로 착하지만 모자란ㅋㅋ 캐릭터라는걸 정말 잘 느꼈다. 둘이 이리저리 사건에 휘말리는걸 보니  꼭 영화를 보는듯 재밌더라만, 영화가 원작이라니!  그냥 단~순히 가장 내 기억에 남던 장면은 헝가리 여자의 밧줄 전통쇼 >교수형<파트........  그리고, 마지막에 모두가 나와 대열을 갖췄을때 느꼈던 감동. 왜인지 눈물이 났었다. 종종, 작품감상하면서 전율을 느끼는데 오랜만에 받는 감동이었어서 정말 기뻣다. 시작할때는 그냥 전신스타킹 ㅗㅜㅑ이랬는데ㅋㅋㅋㅋㅋ엌ㅋㅋㅋㅋ   우연한 기회로 사전정보 없이 생애 첫 뮤지컬로 시카고를 접하게 되었는데 끝나고 나니 생각보다 유명했고...!!! 뮤알못인 나는 놀라버린 것이다...  뮤지컬 배우들은 정말 다들 목소리 자체가 다르구나를 느꼈다. 꿀보이스 ㅗㅜㅑ 목소리도 정말 멋지고 성량도 좋고  알기야 했지만 직접 보니까 너무너무 신기했다.  처음으로 본 뮤지컬이었는데 정말 재밌었고 이제 발리우드 말고 뮤지컬도! 내 인생에 추가해서 즐기고싶단 생각이 들었다.",2018.07.03
뮤지컬 〈시카고〉,5,드디어 보게된 뮤지컬 <시카고>,"세상에 이렇게 관능적이고 섹시한 뮤지컬을 보게 되다니, 정말 영광이었습니다. 게다가 최정원 배우의 공연을 보게되어 특히 더 감동이 배가 되었습니다. 손짓, 몸짓 하나 하나 어쩜 그렇게 매력적이던지... 김지우 배우도 다시 보게 되었습니다.  다음에 또 보고 싶네요 :)",2018.07.03
뮤지컬 〈시카고〉,5,최고,너무 즐겁게 관람했습니다. 최고였어요!,2018.07.03
뮤지컬 〈시카고〉,5,뮤지컬 시카고:: 다시봐도 섹쉬해,"진짜 오랜만에 공연이라 기분이 ㅎㅎㅎ 전에 아리랑 서포 같이 했던 동생들과 다시 신시공연으로 뭉친 ㅎㅎㅎ  제일 좋아하는 디큐브에서 보는 공연은 뭔들!  암튼 이번 시즌에도 빠지지 않고 뮤지컬 시카고를 봤습니다. 록시 김지우 벨마 최정원 빌리 남경주 마마 김경선 처음 보는 지우 록시가 기대기대 푼수에 약간 귀요미 스타일인 아이비와는 다를거라 생각하면서 ㅎㅎㅎ  그래, 역시 공연은 앞에서 봐줘야해 ㅎㅎ 아리랑 동생 찬스로 빠르게 앞자리로 예매! 거의 3달전에 한거라 가물 가물 하려던 찰나에 보는 공연.  노래도 다 까먹었을 거라 생각했는데 역시 노래 따라 벙긋 거리는(소리 안냄) 나님 발견 ㅎㅎ 섹시한 앙상블은 어디다 눈을 맞춰야 할지 모르는 그런 시츄에이션이 발생했지만 자연스럽게 시선을 돌린 ㅎㅎㅎㅎ  바닥 구를때마다 마주침 ㅋㅋㅋㅋ  록시 김지우 킹키나 다른 공연에서 봤는데, 록시에도 잘 어울릴거라 생각은 했어요. 아이비랑 비슷한 이미지인데, 뭐랄까 덜 백치미가 느껴진달까? 성숙한 록시?(그래도 록시 특유의 캐릭터는 있어요) 벨마 최정원 워낙 나름 많이 봤어서 편안히 봤답니다. 노란 머리의 벨마가 낯설었지만, 그래도 벨마 is 최정원 ㅎㅎ 칼린 벨마도 궁금해짐 ㅎㅎ 빌리 남경주 보니까 남경주 배우의 빌리는 처음인거 같아요. 그동안 성기윤, 이종혁 등등 봤는데 ㅎㅎ 근데 보면서 이 낯설지 않은 그 느낌은 뭘까 ㅎㅎㅎㅎ 아 정말 오랜만에 보는 공연인데다가, 애정하는 동주배우의 춤선도 보고 너무 좋았어요 ㅎㅎ  덧. 동주배우이야기 ㅋㅋㅋ 원래 애기 애기한 앙상블이랑, 검사 했었는데 이번에는 의사랑 배심원 했어요. 깨알같이 바꾸는 배심원을 보는 재미가 있는데, 주연배우 말고 시선 살짝 돌려서 보면 재밌답니다 ㅎㅎㅎㅎㅎㅎ",2018.07.03
뮤지컬 〈시카고〉,5,시카고,아이비 롹시는 장인이네요 사랑입니다 너무 좋아요,2018.07.03
뮤지컬 〈시카고〉,5,간만에 친구와 함께본 뮤지컬 최정원님 너무 멋있습니다,몰입도 장난아니게 끌어주시더라고요~~끝나가는 시간이 아까울만큼 너무 만족도 있는 공연 이었습니다 마마~~~님도~~♡♡,2018.07.03
뮤지컬 〈시카고〉,5,Good!,배우들과 앙상블이 모두 열연을 하네요.  너무 재미있게 봤습니다.  내년에도 돌아왔으면 좋겠네요.,2018.07.02
뮤지컬 〈시카고〉,5,죽어도 싸지!,교도소 수감중인 여섯명의 재소자들이 부르는 넘버가 제일 기억에 남아요. 앙상블팀도 매력적이고 실력이 출중해요. 오케도 좋고 주연배우들은 물론 최고죠. 꼭 보세요.,2018.07.02
뮤지컬 〈시카고〉,5,정말 멋진 무대!,저번에 아이비.안재욱 배우님 공연 보고 너무 신나고 내적댄스유발로  이번엔 김지우.남경주 배우님 공연을 보았습니다. 다른 배우님들 공연하는거 보니까 왜 같은 공연 재관람하는지도 알것같고 2층에서 봤는데 1층으오 왔더니 더 신나고 좋음b 최정원 배우님은 진짜 걸크러쉬 놓치지 않을거야. 배우님들 공연 쫓아다닐래요,2018.07.02
뮤지컬 〈시카고〉,4,유명한 뮤지컬이라 그런지.,"최정원의 잘근 잘근 씹어줌이,  아이비의 발악거림이, 고러스들의 뛰어난 노래 실력과 더불어 정확한 발음이,  보는 내내 집중할 수 있게 해 주었을뿐만 아니라, 감탄을 자나내더군요.  즐거운 시간이었습니다.",2018.07.02
뮤지컬 〈시카고〉,5,역시는 역시!,계속 벨마와 록시역을 연기할 수 있었던 것에는 이유가 있는 것 같아요! 정말 최고!!,2018.07.02
뮤지컬 〈시카고〉,4,모든게 완벽했던 뮤지컬,오케분들이 가운에 있고 지휘자도 뮤지컬에 참여 하는 부분이 처음 보는 장식이라 좋았고  배우님들 모두 어쩜 그리 연기들을 잘하시는지!!! 넘버들도 하나같이 다 좋았어여!!,2018.07.02
뮤지컬 〈시카고〉,5,최고의 공연!,"너무 재미있었어요! 어쩜 볼 때마다 더 재미있어지고, 배우님들도 더 잘하시는지 너무 놀랐습니다 재미있는 공연 볼 수 있어서 너무 좋았어요! 여자배우님들을 주연으로 한 극들이 더 많아졌으면 좋겠습니다 최정원 배우님 너무너무 멋있었고 좋은 공연 너무 감사드려요",2018.07.02
뮤지컬 〈시카고〉,5,"처음본 시카고, 대만족!","약간은 야릇한 복장으로 진행되는 눈요깃거리도 있지만ㅎㅎㅎ  전체적인 무대에서 노래의 전환과 이따금씩 들리는 비속어의 유쾌함.  개그포인트까지 너무 잘 어우러져 너무나 만족스러운 공연이 진행되네요!  최정원, 최지우, 남경주 배우들의 열연으로 보는 눈, 듣는 귀까지 완전 좋았던 공연입니다~!",2018.07.02
뮤지컬 〈시카고〉,5,그저 행복,정말 좋은 공연 재밌는 공연 또보고싶습니다ㅠ♡,2018.07.02
뮤지컬 〈시카고〉,4,화끈하게 즐겁다,아름답고 정열적인 여자들이 가득한 무대였어요. 쇼뮤지컬의 매력을 제대로 보여주는 공연이네요.,2018.07.02
뮤지컬 〈시카고〉,5,신나고 재밌어요!,시카고 영화를 보면서 정말 인상 깊에 남은 터라 정말 기대하며 보러 갔습니다. 기대가 크면 만족하기도 어려운데 그 어려운 걸 뮤지컬 시카고가 해내더라구요~ 특히나 아이비 님의 연기가 정말 멋졌습니다~,2018.07.02
뮤지컬 〈시카고〉,5,너무 재밌었어요~,한 번 더 보려구요 ㅎㅎ 너무 즐겁고 멋진공연~!,2018.07.02
뮤지컬 〈시카고〉,5,믿고보는 시카고,괜히 시카고가아니네요 공연연출과 더불어 말할필요도 없는 배우들의 연기와 춤 강력추천합니다,2018.07.02
뮤지컬 〈시카고〉,5,역시 시카고,"아이비 박칼린 안재욱 김영주 캐스팅 이었습니다  아이비, 안재욱, 김영주 배우님들은 항상 봐오던 분들이라  역시 실망시키지 않으셨구요~  박칼린님은... 나쁘지 않았지만  혹시라도 담에 보게 되면 최정원배우님껄로 보고 싶네요 ^^",2018.07.02
뮤지컬 〈시카고〉,5,감동적 무대,역시 최정원입니다. 박진감 넘치는 율동과 풍부한 성량에 감동했습니다. 모든 출연진의 호흡이 환성적인 무대입니다. 꼭 보세요~,2018.07.02
뮤지컬 〈시카고〉,5,감동적인 시카고,20대에 보았던 시카고를 40대에 다시 보니 새루운 감동으로 다가왔습니다. 남편을 둔 부인의 입장에서 그녀들의 마음을 느낄 수 있었습니다. 멋진 공연을 보여주신 모는 분든께 너무 감사드립니다. 훌륭한 공연이었습니다~♡,2018.07.02
뮤지컬 〈시카고〉,5,너무 완벽했던 주말을 선물해준 시카고,오랜만에 뮤지컬을 보는 거라 정말 재밌었으면 좋겠다는 마음으로 예매를 했었고 역시나 최고였습니다.   출연진들이 너무 연기를 잘하고 노래도 잘해서 제 일요일을 꽉 채워준 뮤지컬 시카고팀에게 감사하단 말씀 드리고 싶습니다.   감사합니다.,2018.07.02
뮤지컬 〈시카고〉,4,즐거웠어요.~,재즈 음악과 화려한 쇼를 보고싶다면 강추입니다..,2018.07.02
뮤지컬 〈시카고〉,5,역시 최고네요!!,"보는 내내 눈을 뗄 수 없을 정도로 멋진 공연이었습니다.  배우분들의 실력은 말 할 것도 없고, 음악도 최고였습니다.   다시 보고 싶을 정도로 멋진 공연 감사합니다.",2018.07.02
뮤지컬 〈시카고〉,3,아쉬운 공연,"시카고는 이미 영화로도 상영되어 이미 알고 있는 내용인데, 출연진이 빵빵해 기대가득 품고 관람했는데, 기대가 커서인지 아쉬움이 많이 남는 공연 이었습니다. 박칼린, 안재욱, 아이비 출연 작품인데, 심지어는 아이비 파트에서 졸립기까지 하더라구요.. 임팩트도 없고, 하여간 최근에 본 작품들중 가격대비 비추입니다.",2018.07.02
뮤지컬 〈시카고〉,5,시카고 네번째,넘버가 너무 좋고 배우들도 좋고 앙상블 또한 너무 좋은 시카고..보면 볼 수록 빠져드는 시카고. 네번째 관극이지만 지루할 틈 없이 이뤄져서 너무 좋아요..공연 너무 신나고 즐겁게 그리고 저에게 힘찬 기운을 언저 주어서 너무 기분이 좋습니다.비오는 오늘 시카고 올 댓 재즈 흥얼거리며 발걸음을 옴깁니다~~♡,2018.07.02
뮤지컬 〈시카고〉,3,좋은공연이었습니다~,좋은공연이었습니다좋은공연이었습니다좋은공연이었습니다,2018.07.02
뮤지컬 〈시카고〉,5,명불허전 뮤지컬,박칼린의 연기변신이 무척이나 기대되는 뮤지컬 시카고 명성은 익히 들었기에 기대감 높았고 공연내내 재미와 노래의 감동이 이어 졌으며 만족감 높았던 공연 이었다,2018.07.02
뮤지컬 〈시카고〉,5,역시 !,정원벨마 최고!!!!!경주배우님도 여전히 빌리다!경선배우님의 마마는 카리스마 유머 다 갖춤 지우록시 잘한다~,2018.07.02
뮤지컬 〈시카고〉,5,넘 좋아요,너무 좋았어요~지방에 있는 터라 날짜 잡고 올라가야해서스케줄상 원하는 페어는 선택하지 못했어요그래서 이번에 박칼린-아이비-안재욱 배우님으로 보게되었는데다들 너무 멋지셨어요!!그 외 배우님들 모두 잘하시더라구요중간중간 코믹한 요소도 있고처음부터 끝까지 볼거리가 많아서눈을 뗄 수 없었어요!무대전환이나 의상변화가 없어서 좀 아쉬웠지만 이 뮤지컬만의 특징이니까요암튼 전체적으로 만족합니다^^,2018.07.02
뮤지컬 〈시카고〉,5,!,너무 잘 봤어요,2018.07.02
뮤지컬 〈시카고〉,5,최고의 뮤지컬,최정원 김영주 아이비 배우 모두 잘하셨고 다른 분들도 최고였습니다!!,2018.07.02
뮤지컬 〈시카고〉,5,공연 너어어어무 좋았습니다,최정원 벨마 김지우 록시 남경주 빌리플린  다 넘 맘에 드는 캐스팅 이었고요  앙상블 배우님들도 너무 멋지고 너무 재밌어요  진짜 맨날 보고싶어요,2018.07.02
뮤지컬 〈시카고〉,5,시카고 세번째 관극,어느덧 시카고 세번째 관극....록시역의 김지우 배우님 첫관극..록시 배역 처음이라고 하시는데 우아 대박~~~넘 잘하셔서 놀랬습니다...믿고보는 최정원 배우님 항상 방겨주시는. 김경선 배우님 그리고 친형처럼 든든한 남경주 배우님 오늘 공연 정말 짱 짱 짱 멋진 공연 감사드립니다..시카고 언제 보나 너무 좋아요..~~^^,2018.07.02
뮤지컬 〈시카고〉,3,좀 아쉬웠던...,"했던 말 또 하고, 또 하고. 혼잣말도 반복해서 좀 지루했어요. 노래나 춤도 반복이라서 특별한 걸 못 느꼈어요. 말 한마디를 몇 분씩 늘린 느낌? 반복을 3분의 1로 줄이기만 했어도 좀 더 괜찮았을 것 같아요. 쏘쏘.",2018.07.01
뮤지컬 〈시카고〉,3,생각했던 느낌이랑 많이 달랐어요~,"춤이 굉장히 중요한 뮤지컬이라 생각하는데, 메인배우가 춤을 잘추신다는 느낌이 안들어서... 집중이 떨어지고 오케스트라(?) 분들이 무대 중앙에 떡하니 계시니까 자꾸 배우들에게로 시선이 안가고 그분들에게로 가지는게 좀 아쉬웠어요 ㅠㅠ 평소에 보던 드라마식으로 이어지는 뮤지컬공연이 아니어서 색다르고 아직은 낯선 느낌이었습니다..! 중간중간 유쾌하게 표현하려는 포인트들은 좋았지만 그 외는 잘 모르겠어요. 아이비, 안재욱, 차정현, S.J.KIM(완전대박) 이분들 너무 좋았습니다! 공연준비하시느라 수고하시는 모든 분들 화이팅입니다...!",2018.07.01
뮤지컬 〈시카고〉,4,아주 굿,아주 굿 입니다. 공연장도  넓고 편해서 즐겁ㄱㅔ 관람했습니다,2018.07.01
뮤지컬 〈시카고〉,4,괜춘,큰 기대 안하고 갔지만 괜찮았던 공연 화려한 의상에 재즈풍의 넘버들이 잘어울렸고 언니들 하나같이 넘 이쁨,2018.07.01
뮤지컬 〈시카고〉,5,여러번 봐도 참 좋은 작품,다른 작품과는 달리 앙상블들이 항상 무대에 함께하면서 섹시하고 멋진 춤과 화합이 좋아서 좋구~^^ 박칼린배우님 초반보다 정말 많이 좋아져서 편하게 즐기며 볼 수 있었고~^^ 메리션사인의 김서준배우님은 남자라는 걸 알면서도 볼 때마다 놀라게 하구~^^ ㅎㅎ 아이비의 롹시도 김영주의 마마모트도 차정현의 에이모스도 정말 잘 해서... 공연시간이 그리 빨리 흘러가는지 모를 정도로 잼나게 봤당~^^ 그리고 특히 안재육빌리는 예전에 했던 작품과는 완전 다른 케릭인데...정 빌리가 등장해서 ''내겐 오직 사랑뿐~''이라고 하지만 그게 거짓이고... 정말 돈만 밝히는 비열하고 냉정하고 야비하고 능글맞은 변호사란걸 엄쩜그리 잘 표현해 주던지... ''안재욱한테 저런면이 있었어???''하며 깜짝 놀랬다~!!! 춤은 염청 잘 춘다기 보다는 살짝 귀여운 매력이 있어서 좋았구~^^ ㅎㅎㅎ  암튼 ''시카고''  시간 가는 줄 모르고 잼나게 잘 모고 나올 때 웃으며 나올 수 있었구... 기억에 남아서 또 보고 싶은 작품이다~^^,2018.07.01
뮤지컬 〈시카고〉,5,너무 즐거웠습니다,굿굿굿굿굿!!!!!!!,2018.07.01
뮤지컬 〈시카고〉,3,완성도가 별로...,뭔가 좀 아쉬운 모습. 시작할때부터 남자 무용수들 특히 젊은 분들은 전혀ㅠ연기가 되질않음..... 춤은 섹시하게 추는데 표정은 무표정. 시작한지 좀 됐는데도 연기가 이렇게 안되다니.........여자 무용수들에 비해 너무 모자람.외국인여자로 나오는 여자배우분도 좀 별로..인지도있는 역이면 연습좀... 연출도 별로... 무대에서 하는건데 너무 90도 로 마주보는 장면이 많아서 양쪽에 앉으면 한명은 뒤통수만 보임. 마주보다가도 대사는 앞을 좀 보면서ㅜ해야되는데...둘이마주보면서 계속 연기함... 혼자 나와도 한쪽 끝에서 하는 연기가 좀 많은듯. 서서 연기가 별로 없이 노래만 하니 지루함 ㅜㅜ박칼린씨도 좀 힘에 부치는 느낌.. 아이비는 좋았음,2018.07.01
뮤지컬 〈시카고〉,4,화려한 퍼포먼스,첨엔 의상 때문에 초큼 민망ㅎㅎㅎ화려한 퍼포먼스로한시도 눈을 땔 수 없었습니다오케 사운드가 좀 크게 들려서배우들 목소리가 조금씩 뭍히는 경우도 있었지만 전반적으로는 괜찮았어요아이비씨 연기 자연스럽고 노래 너무 잘해서놀랬습니다 굳~,2018.06.30
뮤지컬 〈시카고〉,4,눈과 귀를 시원하게 해준 공연...,"섹시한 공연이란 인사말에 별 생각이 없었는데,  첫 등장하는 배우의 옷차림에 깜짝 놀랐어요... 시간이 갈수록 다들 넘나 멋진 몸매의 소유자들이 역동적으로 움직임 , 춤 등등  모습이 한껏 흥겨운 분위기에 취할수 있도록 해줍니다.  말이 필요없는 유명한 배우님들의 노래음성이 귓가에서 가슴으로 파고 들어 충분히 노랫속에 빠지게 해주네요.  공연장을 벗어나니 비현실적인 현상을 만나고온듯 혼란스러움에  또다시 보고싶다는 생각으로 인상깊었다는걸 알았어요. ^^",2018.06.30
뮤지컬 〈시카고〉,5,추천합니다,추천합니다,2018.06.30
뮤지컬 〈시카고〉,5,시카고 뻔하지않아~! 눈을뗄수없음,"영화로도 기존뮤지컬로도 성공한 작품이고 많이 봐왔기에 뻔한 스토리와 익숙한 음악에 기대에 못미치면 어쩌지라는 우려를 갖고있었다. 특히 주연배우 최정원님이야 워낙 많이 봐왔지만 김지우에 대한 우려, 내안에서 아이비와 비교가되어 불편하진 않을지 걱정됐는데 정말 매력있다. 기대이상이다. 록시하트가 가진 통통튀는매력에 시간가는줄 모르고 빠져들게됐다. 춤도 노래도 멋지다. 다른 조연들도 한명한명 에너지가너무 좋고 호흡이 훌륭하다.",2018.06.30
뮤지컬 〈시카고〉,5,대작입니다,노래를 듣는 것 만으로 섹시함읗 느낄 수 있다는 것을 깨닫게해준 뮤지컬...,2018.06.30
뮤지컬 〈시카고〉,5,멋진 공연이였어요~!,"벨마 최정원, 록시의 김지우,마마 김경선, 빌리 남경주 연기로 공연을 봤어요~ 후회없는 공연을 만나게 해주셔서 감사합니다, 김지우씨 공연은 처음이였는데 매력적인 목소리와 연기와 노래에 감명깊게 봤어요. 시카고는 오랜동안 사랑 받는 뮤지컬이라는 걸 볼때마다 느끼게 해주네요, 강추합니다~ 또 보러 가고파요ㅎㅎㅎ",2018.06.30
뮤지컬 〈시카고〉,5,역시 시카고,"기대를 저버리지 않는 뮤지컬 시키고원작에 충실하고 배우님들의 다채로운 무대로운 무대로 채워져 시간이 어떻게 기는지 몰랐어요한가지 아쉬웠던 점은 공연 중간 흡연에 대한 공지가 미흡했던 것 같습니다, 앞자리에 앉았었는데 담배냄새때문에 관람에 조금 지장이갔어요! 커튼콜이 다른 공연에 비해서 짧아요.. 그점이 너무너무 아쉽네요",2018.06.30
뮤지컬 〈시카고〉,5,시카고는 갓극입니다,"모든 순간들의 연출방식부터 엔딩까지 모두 만족스러웠습니다. 올댓재즈도 셀블럭탱고도 너무 멋졌습니다. 여자들이 모두 ""남자""를 살해하고 그 남자 없이도 당당한 이야기를 하는 셀블럭탱고에서 란제리룩과 댄스만 보면서 남자관객들이 감탄하고 좋아하는 것도 아주 웃겼고요!",2018.06.30
뮤지컬 〈시카고〉,5,시카고 관람,정말 오래간만에 엄마와 보는 뮤지컬이였다 뭐라 표현하지 못할 전율과 최정원님의 파워풀한 목소리는 모녀의 심장을 터지정도로 감동적이였다 김지우님 그 작은 체구에서 뿜어나오는 에너지와 끼로 다시한번 보게 되었다 정말 다시한번 관람하고 싶을정도로 감동 그자체였다 강추한다,2018.06.30
뮤지컬 〈시카고〉,4,강추합니다,기대만큼 좋은 공연입니다,2018.06.29
