musical_title,rate,review_title,review_text,review_date
뮤지컬 〈마틸다〉,4,한국에서 볼수 있다는 것만으로도 좋은 뮤지컬,영화로 먼저 보고 책으로도 읽어서 뮤지컬에서 각색한 부분이 매우 흥미로웠습니다. School song은 아직도 흥얼거릴정도로 진짜 신선한 충격이었어요  다만ㅠㅠ 발음이 부정확한건지..  제가 잘 못들은건지.. 대사를 알아들을수가 없었습니다. 저만 그렇게 느낀줄 알았는데 같이 관람한 친구도 그렇게 느꼈다고 하더군요.  영재발굴단에서 봤을땐 아역배우들의 발음을 굉장히 많이 신경쓰는거 같던데.. 대사전달이 이렇게 안되는거 보면 음향에 문제 있는게 아닐까 싶습니다.,2019.01.16
뮤지컬 〈마틸다〉,5,마틸다!,다 다 다 다 싹 다 깨부셔!!,2019.01.16
뮤지컬 〈마틸다〉,5,최고!,"마지막 공연이 한달여 남은 시점이라 그런지, 배우님들의 연기가 정말 물올랐네요! 끝나기 전에 모두들 보러가세요~~",2019.01.16
뮤지컬 〈마틸다〉,5,힘들땐 마틸다를!!,친한 친구에게 보답으로 보여준 마틸다 유치하다고 하면 어쩌지? 어이없다고 하면 어쩌지? 지루하다고 하면 어쩌지? 나만 재밌으면 어쩌지?  기우였습니다 친구는 연신 싱글벙글 애들이 귀엽다 어쩜 저렇게 잘하지?  그리고 제일 친구에게 보여주고 싶었던 장면인 2막 그네씬....친구 입에서 나온 감탄사를 들으며 같이 우와우와  볼때는 아무생각없었는데 보고난뒤 계속 생각나는 뮤지컬이라고 친구하 하더군요ㅎㅎ 취준으로 힘들었는데 힘을 얻었다고 고맙단 이야기도 들었습니다 주변에 힘들어하는 친구가 있다면 같이 마틸다 어떨까요ㅎㅎ??,2019.01.16
뮤지컬 〈마틸다〉,5,최고입니다,슬퍼서 분해서 기뻐서 행복해서 눈물이 나요,2019.01.16
뮤지컬 〈마틸다〉,5,정말최고!!!,너무너무너무 재밌었고 무엇보다 배우들이 연기를 너무너무 잘하네요!!!짱이였습니다!!!인생뮤지컬이였어요!!!,2019.01.16
뮤지컬 〈마틸다〉,5,정말최고!!!,너무너무너무 재밌었고 무엇보다 배우들이 연기를 너무너무 잘하네요!!!짱이였습니다!!!인생뮤지컬이였어요!!!,2019.01.16
뮤지컬 〈마틸다〉,4,즐거운 시간이었어요,아이들이 대단하다고 느꼈구요 아이들과 엄마 혹은 아빠와 보러 온 아이들이 많았는데도 시끄럽지 않게 즐거운 시간 보냈습니다,2019.01.15
뮤지컬 〈마틸다〉,5,최고였어요!!,더 말할 것도 없네요 배우들 모두 너무 좋았어요 ㅠㅠ 바로 앞에 앉아서 어른이 되면 그네씬이 위층에서 봤을 때보다 더 벅찼네요 근데 정말... 저세상 관크밭... 앞에 애들이 잠시도 가만히 있질 않고...ㅠㅠ 너무 힘들었네요,2019.01.15
뮤지컬 〈마틸다〉,4,마틸다 또 보고 싶어요,초4 딸아이가 너무 좋아해요 프로그램북도 사 달래서 사 주고 집 오는 길에 정독 하고 집에 와선 2틀 내내 마틸다 노래를 흥얼거립니다.  가사도 좋고 실감나는 배우들의 연기도 너무 재밌게 잘 봤어요 또 보고 싶다 해서 티켓 재구매를 알아봤을 만큼 좋았어요 추천합니다,2019.01.15
뮤지컬 〈마틸다〉,5,아역배우 열연,배우들이 정말 열연하네요 꼭 보세요 ~ 무대도 장관이고 배우들 너무잘합니다 ~,2019.01.15
뮤지컬 〈마틸다〉,5,갓 극이다,뮤지컬 마틸다는 꼭 봐야합니다 여러분. 진짜 안보면 안됩니다.,2019.01.15
뮤지컬 〈마틸다〉,5,기적같은.아이.마틸다,어른이되면 을 보면..늘 놀라면서 알수없는 감동이 밀려오네요..마틸다ㅡ하세요~,2019.01.15
뮤지컬 〈마틸다〉,5,"160분, 짧은 겨울밤의 꿈",먼저 2남 4녀의 형제 자매를 만들어주신 부모님께 감사드린다. 남자 형제들과의 우애는 끈끈하기가 쉽지 않아 여자 형제들끼리만 뭉치기로~ 넷 다 장남과 결혼한 탓에 큰며느리 노릇들하느라 부모님 살아계실 때 짧은 여행이나마 추억을 만들지 못함이 늘 아쉬웠다.  두 분이 다 돌아가신 연후에야 우리들에게도 여유가 생겼고 우리만의 시간을 틈틈이 갖기로 했다. 그나마 사정이 여의치 않아 만든 서울투어 2박 3일 계획. 첫날 세운 계획 <마틸다> 관람이 가장 핵심이 되었고... 어린 아이들의 놀라운 연기와 어른 배우들과의 매끄러운 조화가 160분간을 몰입하게 만들어 뮤지컬 시작 전에 가졌던 지루함에 대한 불안감을 날려버렸다. 마틸다역의 이지나양의 발음이 약간 정확도가 떨어진 부분이 있었지만 연기는 흠잡을 데 없었고 담임선생님과 교장선생님의 연기가 또렷하게 기억에 남는다. 무엇보다 어린 나이에도 불구하고 자신의 불우한 환경을 헤쳐나가는 주인공의 활약에서 초긍정에너지를 가득 받았다.  한겨울밤의 꿈같은 달콤함으로 네 자매는 행복했다.  <마틸다> 응원합니다. 수고많으셨어요!,2019.01.15
뮤지컬 〈마틸다〉,4,재미있었어요~,보면서 아동용 뮤지컬이 아닌 것 같다는 생각을 했어요.근데 어린 아이들이 너무 많아서 좀 놀람...아이들도 아이들인데 데리고오신 부모님들 보시면서 얘기를 어찌나 나누시던지...아이들보다 어른들이 공연예절을 지켜야할 것 같아요,2019.01.15
뮤지컬 〈마틸다〉,5,감동입니다.,두 번째 관람인데 앙상블 합이 더 좋아져서 더 만족합니다.,2019.01.15
뮤지컬 〈마틸다〉,3,그럭저럭 괜찮았던공연,"안무와 연출이 돋보였고, 배우들의 열연도 뛰어났다. 하지만 원작소설의 가학적인 것과 영 몰입되지 않는 스토리가 발목을 잡았다.",2019.01.15
뮤지컬 〈마틸다〉,5,뮤지컬입문자도 좋은 뮤지컬,"뮤지컬 처음보는 친구랑 갔는데 같이 즐겁게 볼수있는 공연이었어요! 스토리도 신선하고, 뮤지컬 넘버들도 너무 좋아서, 공연후 무한재생하면서 뮤지컬 마틸다 여운을 느끼고있어요!!",2019.01.15
뮤지컬 〈마틸다〉,5,재밋었어요!!!!,"뮤지컬 처음보는 친구랑 갔는데 같이 즐겁게 볼수있는 공연이었어요! 스토리도 신선하고, 뮤지컬 넘버들도 너무 좋아서, 공연후 무한재생하면서 뮤지컬 마틸다 여운을 느끼고있어요!!",2019.01.15
뮤지컬 〈마틸다〉,5,당찬 아이들의 우렁찬 외침,"당찬 아이들의 우렁찬 외침이 인상적이었던 공연.  예영마틸다가 너무너무 궁금해서 보고 왔는데 정말 어쩜 이렇게 잘하는지 모르겠어요 ㅎㅎㅎ  아역, 성인배우들 나눌 것없이 다들 너무너무 잘해줘서 정말 재미있게 보고 왔습니다.  ''어른이 되면''만 나오면 왜이렇게 눈물이 나오는지 감정이 동요하는 걸 보면 저도 진짜 어른이 된 거 같기도 하고...ㅎㅎㅎ  좋은 공연 선물 받은 기분입니다. 감사합니다.",2019.01.15
뮤지컬 〈마틸다〉,5,좋았어요ㅜㅜㅜ,"10월달에 보고나서 친구들과 함께 다시 보고 왔는데 여전히 좋았어요 ㅜㅜㅜㅜㅜㅜ 제가 좋아 하는 몇몇 장면들이 있는데 그 중 최고가 그네씬이에요,,, 그네싼을 제대로 보고 싶어서 중블 뒤쪽으로 잡았는데 정말 잘한거 같아요 같이간 친구들도 너무 좋았다며 애기들 넘 사랑스럽고 잘 한다고 어떻게 저렇게 할 수 있는지 대단한 배우들이라고요!보고 나서 집 가는 내내 넘버 부르면서 마틸다얘기하면서 가는데 정말 행복하더라구요  이렇게 관객들에게 감동과 행복함을 주는거는 대단하다고 생각이 들어요 이제 얼마 남지 않았는데 배우님들 모두 부상없이 행복하고 즐겁게 마무리 했으면 좋겠습니다!보실때 주의 할점은,,, 아무래도 아이들이 많이오는 극이다 보니,,,,, 많이 거슬리는 부분이 많았어요 ㅜㅜ 어느정도 예상은 하고 간거긴 하지만 이렇게 집중 흐트러질 정도로 산만했던건 확실하네요 ㅜㅜㅜ 아이를 자제 시키는 분들도 있긴 했지만 그렇지 않은 부분들이 더 많았어요 ㅜㅜㅜㅜㅜ ,,,,",2019.01.15
뮤지컬 〈마틸다〉,5,눈물 날 정도로 너무 좋았던 뮤지컬,영국에서 봤던 마틸다보다 공연장의 규모는 작았지만 그래도 감동을 느끼기에는 충분했어요! 원작을 몰라도 재밌는 뮤지컬!,2019.01.15
뮤지컬 〈마틸다〉,5,초등아들이 뮤지컬을 알아버렸습니다.ㅋ,"어린이뮤지컬 보면 시큰둥하던  아들이 또 보러가고싶다고~~넘버들이 유투브에 간단하게 나오긴 했는데 다 나온건 아니고 음원은 한국어로는 없고~~또 보여 주자니 지갑이 울고~~저는 어쩔~~ㅜㅜ ㅋㅋ어린 아역 배우들이라 기대없이 봤는데,제가 옳지 않았습니다~~ㅋㅋ잘 봤습니다~~",2019.01.15
뮤지컬 〈마틸다〉,5,어린 배우들이 너무 멋져요!,옳지않아! ㅎㅎ 배우들과 작품은 옳았습니다. 너무너무 잘하고 재미있었습니다. 용감한 마틸다 화이팅!,2019.01.14
뮤지컬 〈마틸다〉,3,흠.... 재미없었던건 아니지만 두번은 안볼 뮤지컬!,재밌었지만... 글쎄요...,2019.01.14
뮤지컬 〈마틸다〉,3,가족이 함께 보느 뮤지컬,가족과 망설임없이 볼만한 뮤지컬,2019.01.14
뮤지컬 〈마틸다〉,5,재미있어요,재미있어요.그런데 어린이 관객이 많아서그 점은 고려하셔야...,2019.01.14
뮤지컬 〈마틸다〉,5,진짜 재밌어요 강력추천!,노래도 좋고 내용도 따듯하고 무엇보다 아역 배우들 춤이 넘 귀엽네여 ㅋㅋㅋ,2019.01.14
뮤지컬 〈마틸다〉,4,최고의 연기,"아이들을 위한 뮤지컬인 줄 알고 갔는데, 생각보다 너무 퀄리티가 좋아서 즐겁게 보았습니다.  발성에 비해 발음이 정확하지 않아 대사 전달이 제대로 되지 않는 곡들도 간혹 있었지만,  마틸다 역을 맡은 아역배우와 탈출마법사를 맡은 배우간의 호흡은 정말 환상적이었네요.  전체적인 연출과 곡들도 모두 좋아서 끝난 후에도 계속 멜로디를 흥얼거리게 됩니다.",2019.01.14
뮤지컬 〈마틸다〉,3,마틸다,캐스팅 변경 안내가 없어서 아쉬웠어요..,2019.01.14
뮤지컬 〈마틸다〉,5,"두번 봤는데, 후회없어요","아이들과 너무 즐겁게 봐서 한번 더 관람했습니다. 두번째는 잎자리를 운좋게 예매해서 바로 앞에서 배우들을 볼 수있었습니다. 마틸다는 물론이고, 출연하는 아이들 모드 어쩜 그렇게 잘들하는지.   ""침묵"" 이랑 ""어른이 되면"" 이 두 넘버는 정말 가슴이 두근거렸습니다.  우리말 가사도 잘 들려서 가족이 보기에 강력 추천할만한 작품입니다.",2019.01.14
뮤지컬 〈마틸다〉,4,재밌었습니다.,그네씬이 압권이네요.,2019.01.14
뮤지컬 〈마틸다〉,5,사랑스런 딸과의 데이트,"중학교 1학년 딸이 학교 뮤지컬 반에서 1년 동안 활동흘 해왔다. 몇 달 전부터 마틸다 뮤지컬 음악을 듣고 거의 외우다시피 좋아한다. 중학교 1학년이 되도록 단 한 번도 뮤지컬을 딸과 함께 감상하지 못한 죄로 가장 좋은 VIP 석을 예약하여 한 달 가까이 기다려 드디어 딸과 엘지아트센터를 찾았다. 한 눈에 무대 전체가 들어와서 감상하기 좋을 것 같았다.  그러나, 영화관에만 가면 꾸벅 거리고 조는 내가 장장 3시간여를 버틸 수 있을까 걱정이 되었다. 공연이 시작되었다. 졸리면 어떡하나 걱정을 하는 사이에 나는 마틸다가 있는 교실 속으로 들어 가고 있었다. 내가 가장 사랑하는 나의 막내 딸과 함께... 이제 겨우 10분이나 지났을까? 십오분의 휴식 시간이라고 한다. 헐~~~ 나머지 2막도 마찬가지로 눈 깜짝 사이에 끝났다. 옆에서 감상하고 있는 딸의 모습이 너무 진지하였다. ""저 녀석, 저렇게 공부하면 못할 공부가 없겠다.""라고 속으로 생각하며 사랑하는 막내 딸은 무엇을 하던지 자기가 하고 싶은 것을 하면 틀림없이 행복하게 살 수 있겠다는 희망을 보았다.  특히 어린 연기자들의 연기가 나를 자기들의 교실로 마구 집어 넣었다. 연기라기보다는 현재 내가 동화 속으로 빨려 들어가는 환상 같은 것을 느꼈다. 왜 가슴이 이리 뭉클해지고 눈이 촉촉해지는 걸까? 아... 아름다움은 이렇게 다 굳어버린 초로(初老)의 마음도 녹일 수 있구나. 정말, 아름다움 그 자체였다.  아직도 난, 동화 속에 들어갔다 나온 것 같다. 그런 아름다운 세계로 안내해준 나의 늦둥이 막내 딸에게 한없는 감사와 사랑을 보낸다.  이런 여유와 행복을 맛보게 해주신 나의 하느님께도  영광과 찬미를 드린다.",2019.01.14
뮤지컬 〈마틸다〉,5,마틸다- 후회없는 선택입니다^^,"어른,아이 모두들 감동시킨 뮤지컬입니다!! 마틸다역을 맡은 아역뿐 아니라 아역,어른배우들 모두 연습시간과 노력이 빛을 바라는 공연이었던것 같아요^^ 초3 딸아이와 함께 보았는데 정말 너무 재미있고 감동적이었습니다..",2019.01.14
뮤지컬 〈마틸다〉,4,한국에서 볼수 있어서 행복했어요.,"성인배우들의 연기가 뒷받침되어서 아역배우들의 연기가 더 살았던 것 같았어요. ''마틸다'' 의 연습량을 가늠할 수 있는 공연이어서 긴 공연이었는데도 괜찮았었요. 다만 넘버를 같이 부를때 대사전달이 조금 안되어서 아쉬웠고, 관람석의 애기들의 산만함이 아쉬웠지만 전체적으로 좋았습니다. 알파벳타고 오르는 장면과 그네타는 장면 기억에 남네요. 궁금했던 마틸다. 정말 잘봤습니다.",2019.01.14
뮤지컬 〈마틸다〉,4,역쉬~~마틸다,"처음 마틸다를 접한건  영재발굴단에서마틸다배우를  뽑는걸보고  알게되었다.아이들이  열심히하는 모습을 보고넘 멋져보였고,   그때문에  마틸다뮤지컬을 보기로하였다.우린 안소명틸다를 봤는데넘  잘하고 당차서  기대이상이였다.같이 본   딸내미도  연신 멋지다고  노래를따라부를만큼  마틸다의 감동은대단했다.",2019.01.14
뮤지컬 〈마틸다〉,5,너무 좋은 극,너무 좋은 극이에요,2019.01.14
뮤지컬 〈마틸다〉,4,좋았습니다,공연도 좋았고 공연장도 좋았고 관람객들의 관람문화도 좋았고 좋은 공연 감사합니다^^,2019.01.14
뮤지컬 〈마틸다〉,5,너무 재밌었어요~**,아이와 함께 볼수 있는 뮤지컬이 많지 않았는데 아이의 눈높이에맞게 너무 재밌게 볼 수있어 뜻깊었어요~,2019.01.14
뮤지컬 〈마틸다〉,5,가은 틸다 조그만 체구에서 나오는 파워가 놀라웠음,가은틸다 회차 관람했는데 가은 틸다는 체구가 더 작고 쪼꼬미여서 거대한 트렌치불이 옆에 서있는 것 만으로도 큰 위협으로 보였음ㅋㅋㅋ 그런데 정말 당당하고 똑부러지게 그건 옳지않아 할 때 쪼꼬만 체구에서 나오는 기운에 가은 틸다가 트렌치불보다 더 큰 거인으로 보임.10월에 보고 두번째 관람인데 다른 친구들도 한뼘 더 성장하고 발전된게 보여서 마음이 뭉클했고 대사랑 넘버도 전보다 잘 들려서 좋았음!! 다른 넘버도 다 정말 정말 좋지만 When I grow up 그네 씬은 언제보아도 너무 좋음. Abc song은 어디서 들을 수 없어서 더 집중하고 봄.. 결론은 ost나왔으면 좋겠다.,2019.01.14
뮤지컬 〈마틸다〉,3,훈훈하게 봤네요,"공연장 처음 들어섰을 때 아이들이 너무 많아서 ,,,어린이 뮤지컬을 잘못예매했나하고,, 갑자기 실망스러운생각이 머릿속을 스쳤었어요 금액대가 있는 공연이라,,기대를 많이했던탓인지라.. 같이보는 남자친구한테도 괜히 미안한생각도 들었구요~ 근데,,신기하게도 보면볼수록 빠져들더군요.. 다른공연처럼 엄청난 스케일과 전율을 울리는 음악은 없었지만.. 아이들이 이렇게 해낸다는게 대단하단생각과,,엄청난노력을 했겠구나라 생각에 절로 박수가 나오더군요~ 아이들이라 발음이 조금 알아듣기 힘든부분이 있었지만..그어린아이들이 대사를 외우는것만으로도 대단하단생각이 들었네요,, 한번쯤은 볼만한 뮤지컬이였습니다.",2019.01.14
뮤지컬 〈마틸다〉,5,재미있었어요,재미있었어요,2019.01.14
뮤지컬 〈마틸다〉,5,지나틸다의 대사톤,''난 여자라구요''에서 드러나는 지나틸다의 특징이 정말 인상적이었어요 마틸다는 볼 때마다  울게 되네요ㅠㅠㅠ,2019.01.14
뮤지컬 〈마틸다〉,4,모두의 뮤지컬,다소 아쉬운 부분들이 있었지만 아역 배우들의 엄청난 열기로 공연 즐겁게 봤습니다.,2019.01.14
뮤지컬 〈마틸다〉,5,"어른이 되면, 정말 많은 걸 할 수 있을 줄 알았는데..",정말 오랜만에 눈과 마음이 즐거운 공연을 봤습니다. 어린 배우들의 무대를 보면서 정말 얼마나 노력했을까 괜스레 기특한 마음까지 들었습니다. 잘봤습니다. 감사합니다^^,2019.01.14
뮤지컬 〈마틸다〉,5,"아이에겐 용기를, 어른에겐 동심을 주는 작품","힘든 환경속에서도 자기 자신을 잃지않는 마틸다를 보며 제 자신을 돌아봤습니다.  신나고 감동적은 넘버들과 눈치챌 틈도 없이 바뀌는 무대장치들! 연출에 정말 놀랐습니다.  When i grow up 넘버가 시작되고 나도 모르게 눈물이 흐르더라구요ㅜㅜ 어른이 되면, 하고 바랐던 것들은 정말 아직도 내가 좋아하는 것이고 어떤 것들은 어른이 되어도 힘들다는 것을 아이들도 크면 알게되겠죠  그렇더라고 아이 때 나의 모습이 지금 내 모습과 많이 다르지 않다는 것에 눈물이 멈추지 않았습니다ㅜㅜ  내 주변 소중한 사람과 다시 보고 싶은 뮤지컬 마틸다 또 보러 가게 될것같습니다.  좋은 공연 감사합니다.",2019.01.14
뮤지컬 〈마틸다〉,5,소녀들을 꿈꾸게 하는 이야기,두딸아이와의 첫 뮤지컬 관람이었습니다. 아주 강한 추억이 되었어요.8세 관람 나이에 아슬아슬 통과한 둘째를 데리고 다른 관객에 피해안주고 봐야할텐데 미리 한 걱정은 날아갔네요. 이야기가 진행될수록 점점 집중하여 같이 웃고 같이 걱정하고 같이 흥분했던 시간이었어요.주인공 마틸다뿐 아니라 친구들 아이들도 한명한명 어쩜 눈길을 그리 끄는지. 배우 모두 보석같이 빛나는 작품이었습니다. 끝나고 집에 오는 길 큰 아이는 마틸다가 되겠다고 둘째는 뮤지컬 배우가 되겠다는 꿈을 꿉니다.,2019.01.14
뮤지컬 〈마틸다〉,5,역시는 역시,"예전부터 보고싶었던 마틸다를 이제야 봤습니다.무대장치와 조명, 스토리가 흥미로웠는데넘버도 좋아서 눈과 귀가 호강했네요.안 봤으면 어쩌나 싶을 정도로 감명 깊었습니다.고민 중이신 분들 꼭 보세요!!",2019.01.14
뮤지컬 〈마틸다〉,4,"자신의 이야기를 써내려가려는 아이, 마틸다.",쓰여진대로가 아니라 자신의 이야기는 자신이 써내려가겠다는 마틸다의 모습이 너무 귀엽고 이쁘더군요. 마틸다 뿐 아니라 친구들과 제니선생님이 변해가는 모습을 보며 행복한 시간을 보냈습니다.,2019.01.14
뮤지컬 〈마틸다〉,4,딸들과 엄마가 함께 봐서 더 좋았던,"이제 11세 ,9세된 두딸과의 첫 뮤지컬 관람이었어요. 긴 러닝타임 다른 관객에 폐끼치지않고 잘 견딜수 있을까 고민이 많았는데 점점 이야기가 진행될수록 막내아이도 내용을 이해하며 웃고 걱정하고 신나하고 집중할수 있었던 공연이었어요. 우리 세모녀의 좋은 경험, 좋은 추억이 되었습니다.",2019.01.14
뮤지컬 〈마틸다〉,5,아이들이 너무 좋아해요,아이들이 책이나 영화를 통해 이미 알고있는 내용이였음에도 뮤지컬이라 새롭게 집중해서 보는 모습이 매우 뿌듯했습니다 엄마가 보기에도 너무 신나는 뮤지컬이였는데 아이들은 또래 친구들이 무대에서 공연하는 모습이 더욱더 신기하고 부럽기까지 했다고하네요 본인도 한번 무대에서 연기를 해보싶다는 생각을 들게하는 직업체험을 하고온듯한 뮤지컬이였습니다 어린아이들이 실수도없이 짜임새있게 하는 모습이 너무도 인상적였습니다,2019.01.14
뮤지컬 〈마틸다〉,4,다시보고 싶네요!~~,"주말에 딸아이와 같이 마틸다를 보았네요! 딸아이가 원작을 읽고나서 뮤지컬로도 보고싶다해서 바로 예매하고 갔는데.... 기대도 하고 있었지만 기대보다 휠씬 좋았아요! 무대도 너무 화려했고, 마틸다 아역도 좋았지만 같이 나오는 아역배우들의 연기와 무대가  너무 마음이 벅찼습니다! 이지나양이 하는 마틸다...그 많은 대사와 감정연기 무대를 즐기는 모습이 너무 좋았던지라 다른 아역들이 하는 마틸다도 전부 보고싶더라고요! 방학때 기회가 있으면 다시 한번 볼 예정이랍니다! 딸과 즐거운 주말 데이트였답니다!~",2019.01.14
뮤지컬 〈마틸다〉,5,최고,최고!!,2019.01.14
뮤지컬 〈마틸다〉,5,좋아요,어른이 배우보다 멋진 어린이 배우들,2019.01.14
뮤지컬 〈마틸다〉,5,즐거웠습니다,또 보고싶어요!,2019.01.14
뮤지컬 〈마틸다〉,5,잘 봤습니다.,모두가 웃고 있는데 계속해서 알 수 없는 울음이 나오는 극. 어렸을 때 읽던 로알드달의 그 작품과는 또 다른 느낌,2019.01.14
뮤지컬 〈마틸다〉,5,놀라운 아이 마틸다!,몇 번을 봐도 어른이 되면 넘버의 감동은 진해지면 더 진해졌지 묽어지지는 않네요.  가사부터 연출 배우들의 열연까지 늘 진한 감동을 주는 극입니다,2019.01.14
뮤지컬 〈마틸다〉,5,"정말 인상깊었고, 앞으로도 기억에 남을 뮤지컬","먼저 아역배우들의 연기가 그냥 프로입니다! 탄탄한 원작스토리에 음악, 춤, 배우들의 연기 하나하나가 너무 감동적이였어요. 저절로 재관람이 생각나는 뮤지컬입니다..강력추천!!",2019.01.14
뮤지컬 〈마틸다〉,4,좋아요,좋아요,2019.01.14
뮤지컬 〈마틸다〉,5,아이와 어른 모두에게 잊을 수 없는 추억을 남겨줄 최고의 뮤지컬,"어릴적 부모님께서 보여주신 뮤지컬 <맘마미아>를 보고 느꼈던 전율을 조카에게도 느끼게 해주고 싶어 찾게 된 LG 아트센터의 뮤지컬 <마틸다>  아이라고 믿어지지 않는 섬세한 감정연기와 춤, 노래, 표정연기... 마틸다를 비롯한 앨리스, 라벤더 모두에게 순식간에 반해버렸답니다  함께 간 조카는 <모든 장면이 기억에 남는다>며 집으로 돌아오는 길에 또 보고 싶다고 아우성이었답니다  공중그네와 낙하연기 등 볼거리까지 많은 뮤지컬 감동과 즐거움 모든 감정을 느낄 수 있게 해준 공연 조카와 좋은 시간 보낼 수 있어서 좋았습니다",2019.01.14
뮤지컬 〈마틸다〉,5,가은틸다,보고 와도 또 보고 싶은 뮤지컬 마틸다! 진의허니님 감정선 최고고 너무 사랑합니다.ㅠㅠㅠㅠㅠ 이제 한 달도 안 남았네요. 재연 때도 또 보러 올게요~!,2019.01.14
뮤지컬 〈마틸다〉,5,최고최고,너무 재밌어요!!!,2019.01.14
뮤지컬 〈마틸다〉,5,너무좋아요,최고예요 우리 마틸다,2019.01.14
뮤지컬 〈마틸다〉,3,잘봤어요,너무 기대를 했어서 그런가 기대에 미치지는 못하는 공연이었지만 우리나라에서 볼 수 있어서 좋았습니다.,2019.01.14
뮤지컬 〈마틸다〉,5,마틸다,마음속을 찡하게 울리는 감동이 있습니다.,2019.01.14
뮤지컬 〈마틸다〉,5,즐거운 문화체험,이었습니다. 아역들 너무 잘하네요,2019.01.14
뮤지컬 〈마틸다〉,5,재밌었어요!!!,넘버도 귀에 맴돌고 애기들 너무 귀여웠습니다.,2019.01.14
뮤지컬 〈마틸다〉,5,재미있었어요,설가은 배우 잘하더라고요,2019.01.14
뮤지컬 〈마틸다〉,5,기적같은 아이 마틸다,영화와 책과 다른 부분이 조금씩 있어 더 재밌던거 같디ㅡ. 가은 마틸다 너무 귀엽고 잘하고 어린이 배우들이 아주 열심히 해서 귀여웠다.,2019.01.14
