musical_title,rate,review_title,review_text,review_date
뮤지컬 〈시카고〉,4,록시!!,화려한 캐스팅!! 으로 우선 한번 사로잡혔고.. 너무 기대를 했던가..ㅠㅠ 초반에 좀 지루함에 하품을.. 그런데 공연장이 너~어무 추워서 집중력이 좀 떨어졌어요 ㅠㅠ 한여름에 바들바들 떨면서 봤네요 ㅠㅠ 배우분들도 추워하시는 것 같던데.. 냉방을 조금 줄여주시면 어떨련지.... (의도적으로 춥게하신게 아니라면!)  역시! 화려한 캐스팅! 믿고보는 배우들! 극에 달할수록 물개박수!!!!!!  사실 시카고에 대해 아무런 정보가 없었던 1인.. 그래서 후에 기회가 된다면 원작 시카고도 보고 싶어졌어요.  아무튼 덕분에 즐거운 문화생활 했습니다 ㅎㅎ 뮤지컬 시카고 화이팅!,2018.06.12
뮤지컬 〈시카고〉,5,뮤지컬시카고,시카고는 워낙 유명한 뮤지컬이라 기대하다 드디어 보았습니다!!역시 믿고 보는 최정원&남경주 조합ㅎㅎ거기에 김지우님 너무 귀엽고 멋있었습니다!!다음에 기회가 된다면 또 보고싶네요^^,2018.06.12
뮤지컬 〈시카고〉,2,"명실상부 록시 아이비, 기대이상 안재욱, 불안불안 박칼린","믿고보는 아이비라 역시 좋은 공연이었습니다. 안재욱씨의 발음 전달력에 놀랐고  19금 의상과 춤들 정말 멋있었습니다. 다음엔 최정원의 벨마를 봐야겠다는 생각만 드네요 박칼린의 벨마 느린 춤, 노래 정말 아쉬웠습니다",2018.06.12
뮤지컬 〈시카고〉,5,섹시한 뮤지컬,록시는 아이비죠~^^정말 러블리한 아이비와 관능미 넘치는 박칼린의 멋진 무대였어요~빌리 안재욱은 목소리만으로 무대를 꽈악 채워줍니다~시카고는 2번봐도 3번봐도 재밌어요~,2018.06.12
뮤지컬 〈시카고〉,5,눈도 호강하고 귀도 호강하는 좋은 공연이었습니다!,"화려한 쇼 뮤지컬인건 익히 들어서 알고 있었지만 막상 관람하니 눈도 즐겁고 귀도 즐거운 시간이었습니다!!ㅎㅎ 연기도 너무 잘하시고, 노래도 다 잘하셔서 소름도 여러번 돋았어요 ㅎㅎㅎ 공연이 끝나자마자 재관람하고 싶다는 생각이 마구마구 들게 만들었던 공연이었습니다 ㅎㅎ 좋은 공연 만들어주셔서 감사해요! 여름에 또 보러가려구요 ㅎㅎㅎ",2018.06.12
뮤지컬 〈시카고〉,4,시카고,즐겁게봤어요 중간에조금 루즈해지는감이있긴하지만 중간중간 코믹한부분도잇엇고 배우들의 멋진 춤과노래 무대에 반했네요,2018.06.12
뮤지컬 〈시카고〉,4,좋아요,기대이상으로 만족스런 공연이었습니다,2018.06.12
뮤지컬 〈시카고〉,5,얍,재즈를.좋아한다! 하시면 꼭보세요ㅠㅠㅠ 시작전부터 심장을 그냥 폭행해버리는 극입니다!!!,2018.06.11
뮤지컬 〈시카고〉,5,생생한 느낌으로,정말 재미있게 봤어요,2018.06.11
뮤지컬 〈시카고〉,5,재밌어요~,시카고 두번째 관람이에요~ 너무 재밌어요^^ 최고최고~커플 친구 누구나 함께 관람가능한 유쾌한 뮤지컬이에요~,2018.06.11
뮤지컬 〈시카고〉,5,뮤지컬 〈시카고〉,"유명한 배우들의 안정감 있는 연기에 박수를 보냅니다. 잘 알려진 내용이지만 가슴에 와 닿는 감동이 있었습니다. 흐트러짐 없는 연기를 위해서 엄청난 노력을 했을것 같습니다. 출연 배우님들 모두에게 박수를 보냅니다. 그러나, 의자는 불편 했습니다. 음향 시설 역시 조금 실망 했습니다. 티켓 가격에도 거품이 많이 있는 것 같습니다. 모든 분들 수고 하셨어요.",2018.06.11
뮤지컬 〈시카고〉,5,재밌었습니다,화려한 안무 멋진 배우님들  정말 좋았습니다,2018.06.11
뮤지컬 〈시카고〉,5,다시찾은 시카고,재관람을 하게 만드는 마성의 시카고  언제 또 만나게 될지 모르기에 마니 보고 싶다.,2018.06.11
뮤지컬 〈시카고〉,5,역시 시카고!!!,오래도록 사랑받는 작품엔 역시 특별함이 있었다  가까이서 느껴지는 배우들의 몸짓과 숨소리 그리고 라이브 밴드연주  시간 가는줄 모르고 극에 완전 몰입.  끝나는게 너무나 아쉬웠다.,2018.06.11
뮤지컬 〈시카고〉,5,C H I C A G O,말이 필요없습니다. ㅠㅠ 최정원배우님 나오시는데 그냥 자체 소오름이 쏴~아악 돋더군요. 그 아우라는 정말 말이필요없는 열정의 무대였습니다. 시카고 막내리기 전에 또 보러 가려고 합니다. ㅠㅠ 한번만 봐서는 너무 아쉬운 뮤지컬이였거든요.  김지우님의 음성과 무대도 새로운 시각을 갖게하는 충분한 무대였습니다. 무대연기하시는건 처음봤는데 팬됐습니다. ㅠㅠ  다들 정말이지 최고의 무대 선사해주셔서 감사합니다.~~,2018.06.11
뮤지컬 〈시카고〉,5,정말 기대 이상입니다,벨마 장인 최정원배우님도 정말 대박!! 말잊못 ㅠㅠㅠㅠ.... 지우록시도 찰떡입니닼ㅋㅋㅋ 기대 이상!!! 역시 시카고 ㅠㅠ,2018.06.11
뮤지컬 〈시카고〉,5,배우들의 연기와 매력이 흘러 넘쳐요!,"뮤지컬 시카고 이야기는 많이 들어봤지만 정확히는 잘 몰랐었는데, 최정원 남경주 아이비 캐스팅이어서 미리 몇달 전에 예매하고 관람하고 왔는데 배우 분들 연기며 목소리며 너무 좋았어요!!!!!!",2018.06.11
뮤지컬 〈시카고〉,5,재밌었습니다!,원하는 캐스팅이 아니었지만 다들 너무 잘하셨고 재밌었습니다! 자리는 생각보다 멀어서 아쉬웠구요.,2018.06.11
뮤지컬 〈시카고〉,5,연기 + 노래 + 군무 + 재즈음향이 한데 어우러진 멋진 무대였습니다 추천합니다,유명한 뮤지컬인 시카고를 한국어버전으로 관람했습니다 주요 배역인 아이비님과 박칼린님의 연기가 인상적이었고 간수 역할인 마마님의 목소리도 멋있고 배역에 잘맞는다고 생각이 드네요  아이비님은 해당배역을 표현하는데 발랄하기다하며 능청스러운 연기를 하는데 정말 잘어울린것 같습니다   다른 뮤지컬에 비해 인상적이었던 부분은 음향팀의 연주를 정면에서 볼수있었던점입니다 모든 소리를 구별하진 못했지만 각 악기별로 연주자분들의 연주장면은 악기에도 관심이 많았던 제게 흥미로운 부분이었습니다  중앙 좌우측 피아노 연주자분과 우측 상단의 드럼연주자분의 실력이 상당했고 드럼 연주자분은 드럼외에도 다양한 악기를 자유자재로 사용하시며 뮤지컬연주를 해주신 덕분에 음악적 완성도가 더욱 높았을것이라 생각됩니다 더불어 모든 소리를 이끌어주신 지휘자분도 멋지셨습니다  스토리 전개상 다른 뮤지컬에 비해 극적인 절정부분이 모호한 느낌을 받았지만 전체적인 전개는 이해가 잘됐습니다 세계적인 뮤지컬에는 이유가 있었던것 같네요  매력적인 배우분들과 기악 군무가 조화를 이루는 시카고 추천합니다,2018.06.11
뮤지컬 〈시카고〉,5,연기 + 노래 + 군무 + 재즈음향이 한데 어우러진 멋진 무대였습니다,유명한 뮤지컬인 시카고를 한국어버전으로 관람했습니다 주요 배역인 아이비님과 박칼린님의 연기가 인상적이었고 간수 역할인 마마님의 목소리도 멋있고 배역에 잘맞는다고 생각이 드네요  아이비님은 해당배역을 표현하는데 발랄하기다하며 능청스러운 연기를 하는데 정말 잘어울린것 같습니다   다른 뮤지컬에 비해 인상적이었던 부분은 음향팀의 연주를 정면에서 볼수있었던점입니다 모든 소리를 구별하진 못했지만 각 악기별로 연주자분들의 연주장면은 악기에도 관심이 많았던 제게 흥미로운 부분이었습니다  중앙 좌우측 피아노 연주자분과 우측 상단의 드럼연주자분의 실력이 상당했고 드럼 연주자분은 드럼외에도 다양한 악기를 자유자재로 사용하시며 뮤지컬연주를 해주신 덕분에 음악적 완성도가 더욱 높았을것이라 생각됩니다 더불어 모든 소리를 이끌어주신 지휘자분도 멋지셨습니다  스토리 전개상 다른 뮤지컬에 비해 극적인 절정부분이 모호한 느낌을 받았지만 전체적인 전개는 이해가 잘됐습니다 세계적인 뮤지컬에는 이유가 있었던것 같네요  매력적인 배우분들과 기악 군무가 조화를 이루는 시카고 추천합니다,2018.06.11
뮤지컬 〈시카고〉,5,뮤지컬 〈시카고〉,대본과 안무가 정말 최고 입니다 꼭 한 번 보세요,2018.06.11
뮤지컬 〈시카고〉,4,재밌네요,시간 가는줄 모르고 봤네요  배우들 한명 한명이 눈을 끄네요 몰입해서 잘 봤구요 재미있었어요,2018.06.11
뮤지컬 〈시카고〉,5,믿고보는 배우들과 화려한 무대,"무대 연출 측면에서는 오케스트라를 무대 가운데 배치하고 지휘자분을 이야기에 끌어들인 구성이 독특하게 다가왔습니다.  배우들의 연기와 호흡은 믿고 보는 배우들의 캐스팅이라 별다른 할말이 없네요 최고였습니다.  다만 아쉬운 점은 뮤지컬 자체가 아닌 뮤지컬을 보는 관객들의 태도였습니다. 공연중 핸드폰 벨소리가 울리고, 큰소리로 옆사람과 이야기하며, 몸을 앞으로 기울여 뒷사람의 관람을 방해하고, 인터미션 타임에 앞자리 헤드레스트에 발을 올리고 있는...왜 이런분들은 40대~50대 나이 드실만큼 드신 분인건지...  공연 스태프가 주의를 주지도 않았으며 기본적으로 이런 행동들은 관람객이 하면 안되는 행동임에도 매우 아쉬웠습니다.",2018.06.11
뮤지컬 〈시카고〉,5,최고!,최고의 공연,2018.06.11
뮤지컬 〈시카고〉,5,재밌어요,역시 롱런하는 뮤지컬은 이유가 있는듯,2018.06.11
뮤지컬 〈시카고〉,5,뮤지컬 <시카고>,All That JAZZ~~~!!!!!,2018.06.11
뮤지컬 〈시카고〉,5,역시는 역시,아이비의 밝고 경쾌한 연기가 아주 좋았던 공연이었습니다.,2018.06.11
뮤지컬 〈시카고〉,5,가장 즐거운 쇼뮤지컬,"최정원/아이비 이젠 시카고 장인이라고 부를 수 있는 2분을 다시 볼 수 있어 행복했습니다. 단한순간도 지루하지않게 관객들을 무대에 집중할 수 있고, 즐겁게 이끌어주어서 고맙습니다.",2018.06.11
뮤지컬 〈시카고〉,2,기대보단 별루였어요,"원래 무대 장치가 화려한? 스타일의 뮤지컬은 좋아하는편이라서그런지  시카고는 무대변화도 없고해서 특별히 재미있게 느껴지진않았습니다.  뮤지컬은 보는 느낌이라기 보단 뭔가 쇼보여주는 레스토랑에서 보는 공연같은 느낌이...  이런스타일의 뮤지컬 보면서 이런생각 든적이 없었는데,  시카고는 뭔가 테이블에서 요리먹으면서 옆사람과 대화하면서 곁들여보고싶은? 공연이였습니다.  전 박칼린씨와 아이비씨 공연을 봤는데, 박칼린씨 역할이 좀 안어울리는 것같아요.  뭔가 배우의 카리스마가 안느껴지고,, 춤추는 모습이 멋져보이는게 아니고  힘들어보이게 느껴졌어요ㅠㅠ   개인적으로 추천하고싶은 공연은 아니였습니다.",2018.06.11
뮤지컬 〈시카고〉,4,오리지널과는 또 다른 매력,"시카고 영화도 보고 오리지널 공연도 본 사람입니다. 사실 번역을 어떻게 했을지 너무 궁금해서 밤잠 설쳤어요. 군데군데 한국에 맞게 번역도 잘 되고, 공연 구성도 살짝 변경한 것이 정말 좋았습니다. 박칼린님의 젊은 시절 연기를 더더욱 보지 못해 아깝다고 생각했고 김지우님 너무 귀여웠습니다. 마마 역을 하신 김경선님 정말 오리지널과 가장 비슷하게 연기하시고, 제일 무게감을 잘 잡아주셨어요!!!! 흐어... 안재욱님, 연기는 정말 물 흐르듯 자연스러워요!  좋은 공연 정말 고맙습니다!!!!",2018.06.11
뮤지컬 〈시카고〉,5,좋아요,잼있었어요,2018.06.11
뮤지컬 〈시카고〉,5,잼있어요,잘봤어요감사햅니다,2018.06.11
뮤지컬 〈시카고〉,5,시카고관람후기,기대만큼 훌륭했습니다,2018.06.11
뮤지컬 〈시카고〉,4,아이비님은 최고였네요!,"다른분들 후기를 보고 아이비님을 기대하며 관람했습니다. 공연하시는걸 처음 뵈었는데,, 앞으론 다른 공연도 찾아다녀야 할거 같아요, 너무 잘하심 乃乃 박칼린님의 변신을 기대하고 갔는데, 음.. 솔로이실때는 생각보다 잘하셨습니다. 하지만 다른분들과의 합이나, 성량이 음량을 뚫고 나오지 못하는 부분은 어쩔수 없지 않앗나 싶습니다.. 하지만 노래는 정말 잘하시던.. ^^ 안재욱님도 예상대로셧고.. 개인적으론 추천 정도 드립니다. ㅎ",2018.06.11
뮤지컬 〈시카고〉,4,즐거운 공연이었습니다~,워낙 명성 있는 작품이라 잘 봤어요~  다음에 기회가 된다면 다시 보고 싶네요,2018.06.11
뮤지컬 〈시카고〉,5,시카고관람후기,"뮤지컬배우연기와 빅밴드의 연주는 정말 훌륭했습니다.  남경주.최정원. 김지우의 연기또한 말할것도 없이 정말 감동 그 자체였습니다. 기회가 된다면 안재욱,박칼린,아이비 공연도 보고싶네여~",2018.06.11
뮤지컬 〈시카고〉,5,좋은 공연이었어요,좋은 공연이었어요,2018.06.11
뮤지컬 〈시카고〉,5,좋은 공연이었어요,좋은 공연이었어요,2018.06.11
뮤지컬 〈시카고〉,5,"아이비, 록시 그자체였다.",막을 올린지 오래된 공연인만큼 매번 같은 에너지로 관객을 감동시킬 수 있다는건 그만큼 완벽하게 소화를 했기 때문이라고 생각합니다. 공연 보러 가기 전에 많은 배우들의 프레스콜 공연과 영화 감상으로 입체적으로 록시와 벨마를 느끼고 공연을 보러갔는데.. 한국에서 표정연기로는 제일 맛깔나게 표현한다고 생각하는데 아이비님은 록시 그 자체였습니다. 제 눈 앞에서 록시가 정말 나타난것 같아 너무 행복한 공연이었습니다. 강추드립니다.,2018.06.11
뮤지컬 〈시카고〉,4,살짝 지루했지만 멋있네요.,"예전부터 보고 싶었던 시카고를 드디어 봐서 설레였습니다. 재즈가 바탕이어서 지루하게 느껴졌지만, 2부부터는 재밌었네요. 최정원님과 남경주님의 연기도 보고 싶어졌어요.  잘 봤습니다.",2018.06.11
뮤지컬 〈시카고〉,4,좋은 시간 보내고 왔습니다^^,스토리도 탄탄하고 음악도 너무 좋았습니다. 최정원님이 출연하는 뮤지컬은 역시나 최고입니다bb,2018.06.11
뮤지컬 〈시카고〉,5,오랜만에 감동이였어요,"결혼하고 정말 오랜만에 공연다운 공연 관람하였어요. 최정원,김지우,남경주 역시 다르더라구요.. 기회가 되면 또다른 더블캐시팅 배우들의 공연도 보고싶어요...",2018.06.11
뮤지컬 〈시카고〉,4,잘 보고 왔습니다.,공연 잘 보고 왔습니다.,2018.06.11
뮤지컬 〈시카고〉,4,아이비님 짱~~,본명이 &#47225;시여도 어울릴거 같은 아이비님~~~~  볼때마다 매번 반하고 있습니다~~~~,2018.06.11
뮤지컬 〈시카고〉,5,믿고보는 캐스팅과 볼거리 가득한 최고의공연!,"소문으로만 들었던 뮤지컬 시카고 드디어 관람했네요.  흠잡을곳 없는 배우들의 연기와 실력, 탄탄한 시나리오, 화려한 무대연출  그 무엇하나 빠지질않네요. 시간이 어떻게 흐른지도 모르게 관람했습니다.  못보신분들! 강추입니다!",2018.06.11
뮤지컬 〈시카고〉,4,너무 즐거운 공연이었습니다,시카고 공연은 처음 관람했었는데 역시 오래가는 공연엔 이유가 있더라구요 스토리도 탄탄하고 음악도 너무 좋았어요~ 지휘자분이 무대에서 극의 한부분이 되어 하는 공연은 처음이었는데 너무 신나게 지휘하시는 모습을 보니 덩달아 신나더라구요 즐겁고 유쾌한 공연이었습니다,2018.06.11
뮤지컬 〈시카고〉,5,최고의 엔터테인먼트,"옛날에 영화를 봤을 땐 전체적으로 어두워서 그만 본 기억이 남아있어서 뮤지컬도 그런 거였으면 어떡하지... 라고 걱정했었는데 막상 보니까 지금까지 본 뮤지컬 중에 개인적으로는 최고의 작품이었습니다. 보통 뮤지컬이라면 연주자들이 안 보이는 데에 계시는데 시키고는 무대 바로 가운데에 계시고 연주하는 모습도 즐기면서 연기, 노래를 관람할 수 있은 이 방식도 정말 좋았습니다. 이번엔 관람석 뒷쪽에서 봤는데 다음엔 앞부분에서 다시 보고 싶은정도 정말 완벽한 뮤지컬... 아니 ‘쇼’였습니다.",2018.06.11
뮤지컬 〈시카고〉,5,블랙 코미디의 정수!!!,내용도 블랙! 착의도 블랙! 블랙으로 도배한 블랙을 표현한 극이다!! 재즈를 좋아하시는 분에겐 추천! 아메리카 스타일 좋아하시는 분에게도 또 추천!! 저는 다 좋아해서 회전각입니다!!!,2018.06.11
뮤지컬 〈시카고〉,4,좋아요,정원벨마 최고네요!!,2018.06.11
뮤지컬 〈시카고〉,4,스테디셀러에는 이유가 있다 아이비 배우 좋아요,스테디셀러에는 이유가 있다 아이비 배우 좋아요 노래도 연기도 춤도 너무 사랑스럽고 잘함,2018.06.11
뮤지컬 〈시카고〉,5,Good!!,Good,2018.06.11
뮤지컬 〈시카고〉,5,아이비 최고,아이비 배우님 록시 정말 사랑스러워요!,2018.06.11
뮤지컬 〈시카고〉,5,너무 재밌었어요~!,한국판 시카고는 처음이었는데 너무 재밌었어요~~박칼린님 너무 멋있고..아이비님 너무 사랑스럽고ㅜ무죄님도 너무 귀엽고~ 반전의 파리넬리님도ㅋㅋ 예상치 못해서 더 재밌게 본 것 같아요!,2018.06.10
뮤지컬 〈시카고〉,5,시카고 재밌었어요,"최정원, 김지우 배우님들 공연을 봤는데 정말 재밌게 봤어요 친구들과 함께 가서 봤는데 친구들도 역시 잘봤다구 후회없다고 하더라구요 오피석에서 봐서 목이 좀 아파서 다시 보라고 하면 1열 뒤로 가려구요 중간에 담배연기가 좀 있는데 비흡연자라 그런지 조금 힘들더라구요 그래도 담배연기가 나오는 시간은 짧으니까 괜찮았어요~",2018.06.10
뮤지컬 〈시카고〉,5,다시 못볼 캐스팅이겠죠,무대위의 카리스마를 보기위해 예매한공연다음부턴 처음 보는 지인에겐 꼭 내용 설명해주고 가야지 ㅎㅎ 생각보다 더 민망해하시네요 ㅋ전 너무너무 잘 봤습니다,2018.06.10
뮤지컬 〈시카고〉,5,"최정원, 김지우 조합이 멋집니다",최정원 배우님은 올초 빌리엘리어트에서 김지우 배우는 킹키부츠에서 보고 시카고에서 다시보니 더 좋았구요.  김지우 배우님 볼때마다 기대이상이니 다음엔 기대를 잔뜩하고 봐야겠습니다~♡,2018.06.10
뮤지컬 〈시카고〉,3,솔직히 지루했어요,VIP티켓구매해서 갔는데 좀 실망했어요좀 지루하게 느껴졌어요 무대도 너무 바뀌는거 없이 단조롭고 배우들의 폭발적인 성량을 기대하고 갔는데 좀 실망했고 담배피는 탭댄스는 도대체 무슨의미인지 모르겠어요,2018.06.10
뮤지컬 〈시카고〉,4,유쾌한 시간,아이비 대단해요~,2018.06.10
뮤지컬 〈시카고〉,5,아이비 &#47225;시 역시 굿,아이비 &#47225;시 역시 굿.. 칼린쌤은 ㅠㅠ,2018.06.10
뮤지컬 〈시카고〉,5,정원벨마 최고,정말 최고네요,2018.06.10
뮤지컬 〈시카고〉,5,엄청기대됩니다,아직보진않았지만엄청기대하고있습니다~배우님들에모습에한껏기대중이에요~~^^,2018.06.10
뮤지컬 〈시카고〉,3,기대에 미치지 못한 공연,"화려한 뮤지컬을 기대한게 잘못인걸까요..음향이 부족한걸까요..가슴을 울리는 소리는 안들리고 걍 티비소리같음, 무대도 화려한 편은 아니었고, 차라리 연극이었던 아마데우스가 훨씬 웅장하고 화려했었어요ㅠ스토리도 흥미롭진 않았네요 VIP석으로 세명이나 결제한거 아까워요. (유명한 뮤지컬이라 실패안할줄 알았는데)",2018.06.10
뮤지컬 〈시카고〉,4,솔직히 벨마가..,벨마가 아쉬워요..앙상블이 더 인상에 남네요,2018.06.10
뮤지컬 〈시카고〉,4,마이크 소리를 좀더 키워주셨으면..,지휘자분이 참여하는게 정말 인상깊었어요! 연주도 너무너무 멋있었어요 ㅠ 그런데 멋진 연주소리에 배우분들 목소리가 묻히는 느낌이었어요 ㅠ 그래서 사실 노래하실때 뭐라고 하는지 잘 안들렸어요.. 밴드연주소리를 줄이지마시구.. 배우분들 마이크 음량을 조금만 더 키워주셨으면 좋겠어요! 박칼린.아이비.안재욱 캐스팅으로 봤는데 너무 재밌게 즐기다 왔어요^^ 다음달에 다른 캐스팅으로 부모님이랑 같이 보러가려구요! 그때에도 멋진연주 기대할게요!!!!,2018.06.10
뮤지컬 〈시카고〉,5,롹시 너무 예뻐요+.+,오랜만에 정말 제대로 된 뮤지컬 봤다고 생각되네요~ 인간의 탐욕스러움과 부정부패된 법조계를 풍자해 풀어놓은.. 2시간 넘는 시간동안 한 시도 눈을 뗄 수 없는 작품이었습니다. 다음에 또 보고싶네요,2018.06.10
뮤지컬 〈시카고〉,5,훌륭합니다 최고,볼거리가 참 많아요 눈이 바쁘게 돌아갑니다 음악도 멋지고 지휘자님이 극에 참여하는건 처음봤는데 너무 재밌었어요 콩트요소도 많고 관객과의 소통 호흡도 놓치지 않아요 호흡하고 웃고 즐기느라 관객인 제가 끝날무렵 살짝 피로했을 정도니 얼마나 열정적인 공연입니까? 작은 반전요소도 있고 최고지만 생각보다 더 선정적인건 좀 아쉽네요 미투니 뭐니 여성인권 신장 시대에 엇나가는 과한 의상 ㅠㅠ? 아이비님의 표정연기와 노래 몸짓 표현력 단연 압권입니다 모든것이 환상적이었으나 아이비님이 유독 기억에 남았네요 좋은공연 감사합니다,2018.06.10
뮤지컬 〈시카고〉,5,비용이 안아까웠던 멋진 공연!,"엄마와 다녀왔습니다. 예매를 늦게 하는 바람에 2층에서 관람했음에도 굉장히 잘 보였고요, 무엇보다 가장 중요한  공연의 질이 너무나 좋아서 시간 가는 줄 모르고 즐겁게 봤습니다. 강추합니다!",2018.06.10
뮤지컬 〈시카고〉,5,색다른 뮤지컬,역시  노래와 연기 그리고 멤버들의 팀웍이 멋짐을 발휘한 공연이엿습니다 또 한번 기회가 되면 보고 싶네요~ 덕분에 오랜만에 뮤지컬 보고 힘이 났답니다!!  최정원. 남경주. 김지우.김경선 공연 멤버님들 화이링!!,2018.06.10
뮤지컬 〈시카고〉,5,잘 봤습니다,역시 화려한 볼거리 멋진 시카고밴드!잘 봤습니다.,2018.06.10
뮤지컬 〈시카고〉,5,지우록시,김지우.안재욱.최정원역시명불허전 최정원벨마.설명필요없습니다.최고.그리구 기대이상이었던 지우록시.앙상블 하신분들.직접연주하신 오케스트라 ? 분들.최고.무대에오르신모든분들   최고,2018.06.10
뮤지컬 〈시카고〉,5,너무 멋있었어요,"앙상블부터 조연, 주연배우님들 등장마다 좋았고요. 연주자분들 볼 수 있어서 더 좋았어요!!재관람하고싶은 공연이었어요.",2018.06.10
뮤지컬 〈시카고〉,5,멋있어요,록시 벨마 역 배우들도 너무 잘하고 앙상블분들도 정말 멋있었어요 몸매도 좋고.. 특히 아이비의 록시 정말 너무 깜찍하고 섹시했어요^^,2018.06.10
뮤지컬 〈시카고〉,4,최고 최고 최고!!,재밌게 봤습니다 감사함니다!!,2018.06.10
뮤지컬 〈시카고〉,3,잘봤습니다,처음봤는데 개그물인줄,2018.06.10
뮤지컬 〈시카고〉,5,또보고싶은 뮤지컬!,너무 멋졌어요 ㅋㅋ음악이 귀에 계속 맴돌아요!배우분들 하나하나 표정까지엄청났어요 또보고싶어여,2018.06.10
뮤지컬 〈시카고〉,5,뮤지컬 시카고,다음에 또 관람하려고 합니다. 재밌었어요.,2018.06.10
뮤지컬 〈시카고〉,5,재밌게 관람했습니다.,전반적으로 다 마음에 들었어요. 지인과 함께 관람했는데 재관람 희망합니다! :),2018.06.10
뮤지컬 〈시카고〉,5,최고였어요.,"<복면가왕>, <고스트>, <빌리엘리어트>의 최정원도 멋지지만, 역시 <시카고>하면 최정원이네요. 다른 배우들도 모두 좋았어요. 정말 즐겁고 신나는 하루를 보냈네요.",2018.06.10
뮤지컬 〈시카고〉,5,시카고 관람후기,시작부터 끝날때까지 눈을뗄수없을만큼 화려하고 눈과 귀가 최고로 즐거운 뮤지컬이였어요 최고에요 강력추천해요,2018.06.10
