,musical_title,rate,review_title,review_text,review_date
70,친정엄마,5,감동감동,처음부터 끝까지 너무 재미있는 공연이였어요앙상블 하시는분들 열정과 밝은 기운이 느껴져서 더 감동이였어요^^김수미배우님도 너무 멋지시고 시어머니 역할로  나온 최정화 배우님 첫 등장신 카리스마가 대단 하셔서 깜짝 놀랬어요 공연 마지막에 얼마나 울었는지...좋은공연 만들어주셔서 너무 감사합니다,2023.04.02
71,친정엄마,5,와..진짜 감동적이에요,엄마 너무 보고싶었어요김수미 짱,2023.04.01
72,친정엄마,5,재미와감동있는뮤지컬입니다,오랫만에 엄마랑 힐링이되는 뮤지컬이였어요재미와감동이있는 ..누구나 공감할수있는내용이네요김수미님외 출연하시는 모든배우님들이 다 잘하셔서시간가는줄몰랐어요강추입니다~~,2023.04.01
73,친정엄마,5,이거보고 엄마랑 전화통화 2시간 넘게 했어요.,"원래는 엄마랑 함께 보려고 했는데아무래도 엄마랑 보게 될 때 눈물 펑펄 흘릴까봐미리 보고 나중에 엄마랑 보면 감정을 좀 누르면서 볼 수 있을 것 같아 3/31 일 혼자 op석 중앙에 앉아서 봤네요.너도 나도 다 겪은 친정엄마와의 스토리였어요.너무나도 뻔한 스토리지만 그랬기 때문에 더 감정이입이 잘됐고, 모든 배우분들의 연기때문에 가슴 절절히 아팠어요.신나는 부분도 많았고, 다들 너무 열정적이셨고, 에너지가 넘치셔서 관객이 오히려 그 에너지를 받는 느낌이었습니다.배우분 한 분 한 분 기억에 남을 정도로 다들 너무 멋지셨어요.랩 부분에서는 소리내어 웃었어요 ㅎㅎ관색분들은 부모님대 나이도 많으셔서, 뮤지컬 분위기도 딱딱한 분위기보다는 편한 분위기셨고, 웃음도 터지고 호응도 터지는 정말 너무 즐거운 뮤지컬이었습니다.막바지에 눈물 계속 쏟고, 콧물 계속 훌쩍이느라고 정말 미치는 줄 알았네요.옛날부터 김수미선생님이 너무 좋아 이번에 처음으로 뵈었어요. 너무 욕도 찰지시고, 정말 엄마같아서 너무 맘이 아팠어요.이거보고 눈은 부어서 눈뜨는 것도 힘들었어요.남편이 제 얼굴보고 당신도 울 줄 아는 사람이었냐고 엄청 놀리더군요 ㅠㅠ뮤지컬보고 엄마에게 전화했는데 “왠일로 전화를 했댜?”“걍 엄마 뭐하나 싶어 궁금해서 전화했지”“세상에 내가 뭐하는지 궁금해 하는 사람이 한 명이라도 있어서 다행이네 호호호”이 말을 엄마는 웃으시면서 하셨는데 전 눈물이 또 터지고 목은 메이고 감정을 누르면서 정말 오랜만에 엄마랑 수다를 두시간 넘게 했습니다.그 동안 엄마에게 신경쓰지 못한 제가 못나보이고, 뭐라도 빨리 해드려야겠다는 생각이 들어서 엄마에게 이 뮤지컬을 보자고 데이트신청했네요. 엄마가 너무 좋다고 신나하시는 모습보면서 또 맘이 아립니다.모두 꼭 부모님과 보러가세요!!노래도 귀에 익숙한 노래에 가사를 다시 입힌거라서 너무 좋아요!!! 꼭 흥행했음 좋겠어요!!!!!!!",2023.04.01
74,친정엄마,5,재미와감동이있는뮤지컬 ,오랫만에 엄마랑 뮤지컬보러갔는데너무너무재밌었습니다.누구나공감할수있는내용이고 재미와감동이있는말로표현할수없을만큼만족했어요김수미님뿐만아니라 모든배우분들이 다들 잘하시고흥미진진합니다강추예요~~,2023.03.31
