,musical_title,rate,review_title,review_text,review_date
911,"실비아, 살다",4,답답하면서도 생각이 깊어지는 극,"실비아 플라스라는 인물의 생애를 드라마틱한 요소를 추가하여 잘 만든 작품인 것 같다. 실비아의 삭막하고 숨막히는 환경과 답답한 상황,캐릭터때문에 극을 보기가 좀 힘들기도 했지만 그때문에 몰입은 더 잘됐던 것 같다.",2023.03.12
912,"실비아, 살다",5,자꾸 다른 장면이 생각 나네요.,"어느 날은 엔딩, 어느 날은 시작, 어느 날은 또 다른 어느 장면.어쩔수 없이 다시 봐야할 것 같아요.",2023.03.12
913,"실비아, 살다",4,잘 만든 극,잘 만들었고 연기나 내용도 좋습니다. 하지만 개인의 삶을 가지고 온 부분이라 공감대 형성이 관객마다 차이가 날 수 밖에 없을듯해여 개인적으로 확 와닿진 않았지만 이런 뮤지컬이 많아지면 좋겠습니다.,2023.03.12
914,"실비아, 살다",5,자꾸 생각나는 극,많은 생각을 하게 되는 작품이였어요,2023.03.12
915,"실비아, 살다",5,그래도 엄마 난 엄말 배신할 수 없어,ㅠㅠㅠ 세상의 모든 딸이 그리고 엄마가 들었으면 좋겠어요 ㅠㅠㅠ,2023.03.12
916,"실비아, 살다",5,"내 글은 나, 내 자신이니까",ㅠㅠㅠㅠㅠㅠㅠ 너의 글이 누군가에게 목도리가 되어줄거야,2023.03.12
917,"실비아, 살다",5,멋지게 근사하게 훌륭하게,아니 있는 그대로 받아들여지길,2023.03.12
918,"실비아, 살다",5,무엇과도 바꿀 수 없는 살아있던 순간,"그럼에도 불구하고, 살아내야 하는 그런 순간",2023.03.12
919,"실비아, 살다",5,"하지만 아빠, 이제 완전히 끝났어",내가 한 사람 죽인다면 나는 둘을 죽이는 셈이야!!!!!!,2023.03.12
920,"실비아, 살다",5,너무나 잘만든 작품이라고 생각해요 ㅠㅠㅠㅠㅠ,롱런했으면 좋겠다 제발 ㅠㅠㅠㅠㅠ,2023.03.12
921,"실비아, 살다",5,우린 모두 술 탄 물을 마신거야~,술 마시면 술 취하지 어쩌겠어 !!!!!!!,2023.03.12
922,"실비아, 살다",5,그냥 그렇게 나 살고 싶었어 ㅠㅠㅠㅠㅠㅠㅠ,살고싶어 ㅠㅠㅠㅠㅠㅠㅠㅠㅠㅠㅠㅠㅠㅠ,2023.03.12
923,"실비아, 살다",5,도마뱀들이 나오더라도!!!,멈추지 말고 가자 ㅠㅠㅠㅠㅠㅠㅠ,2023.03.12
924,"실비아, 살다",5,어두운 계단을 올라가자ㅠㅠㅠ,멈추지 말고 ㅠㅠㅠㅠㅠㅠㅠㅠㅠ,2023.03.12
925,"실비아, 살다",5,너에게는 그런 힘이 있단다,ㅠㅠㅠㅠㅠㅠㅠ 내가 너의 글을 알아 ㅠㅠㅠㅠㅠㅠ,2023.03.12
926,"실비아, 살다",5,"실비아,살다 갓극",ㅠㅠㅠㅠㅠ 울면서 나왔지만 힐링을 받았다 ㅠㅠㅠㅠ,2023.03.12
927,"실비아, 살다",5,너무 재밌게 봤습니다,이런 극은 널리 알려 이롭게 해야해요,2023.03.12
928,"실비아, 살다",5,많이 보셨으면 좋겠다 ㅠㅠㅠㅠㅠ,예민함 ㅠㅠ 순수함 ㅠㅠ 치열함 ㅠㅠㅠㅠㅠ,2023.03.12
929,"실비아, 살다",5,저한테는 트리거보다는 힐링이었네요,많은 위로를... 받았어요 정말 모두에게 목도리가 있기를,2023.03.12
930,"실비아, 살다",5,배우분들 차력쇼 ㅠㅠㅠㅠ,너무나 좋은 이야기 배우분들 너무 열심히 해주셔서 괜찮으신가 싶다가도 너무 좋고 그랬어요 ㅠㅠ,2023.03.12
931,"실비아, 살다",5,제발 모두 보셨으면 좋겠는 극,힐링이 됩니다 정말,2023.03.12
932,"실비아, 살다",5,리딩공 초연을 거쳐 재연까지,"리딩공연을 보고 본공연이 올라오는 걸 목격한 공연은 ’실비아, 살다‘가 처음인데 초연을 뜨겁게 사랑하고 재연까지 보게 됐네요. 조금씩 연출이나 대사 가사는 바뀌어도 결국 돌아가도 같은 선택을 하고 모든 순간을 살아내겠다는 커다란 메시지와 울림이 변하지 않아서 너무 사랑하고 있습니다... 보러 갈 때마다 안전한 고향에 돌아온듯한 기분이에요. 소중한 공연 만들어주셔서 감사합니다 큰 위로를 받았어요! 세상이 아주 따뜻해지는 그날까지♡",2023.03.12
933,"실비아, 살다",5,너의 글은 따뜻한 목도리가 되어줄거야,"너무 잘만든극이고 주는 메세지도, 배우분들 연기도 너무 좋았습니다...",2023.03.12
934,"실비아, 살다",5,따뜻한 목도리,드디어 전캐 찍었다! 최고,2023.03.12
935,"실비아, 살다",5,자꾸 생각나는 극,관람일 당일엔 멍했는데  계속 생각나고 넘버도 가사도 좋았어요 연출도 너무 좋았고 배우님들도 너무 대단했고  스스로 생각하는 것도 많아지고... 이런게 좋은 극이구나 싶네요 내려가기 전에 한 번 더 보고싶은 극이에요,2023.03.11
936,"실비아, 살다",5,너무 좋은 극,이런 여성극이 대학로에 더 많아졌으면 좋겠습니다. 눈물나도록 좋은 극!,2023.03.11
937,"실비아, 살다",5,슬프지만 행복한 극,초연 막공즈음 자첫하고 재연 회전돌고 있는데 매회차 행복하네요… 좋은 대본과 음악과 멋있는 배우님들의 조화 너무 좋습니다ㅎㅎ,2023.03.11
938,"실비아, 살다",5,"갓극, 갓배우, 갓제작진","세계 여성의 날을 기념할 겸 실비아 플라스의 생애를 다룬 뮤지컬을 보고 왔는데 정말 펑펑 울고 나왔어요. 정말정말 위로가 많이 됐습니다. 서로가 서로에게 실비아와 빅토리아였던 친구와 함께라서 더 좋았어요. 듣고 싶었던 말들을 정확하게 해주었고, 실비아 플라스의 작품도 읽어봐야겠다는 생각이 들었습니다.",2023.03.10
939,"실비아, 살다",5,세계여성의날에 봐서 더욱 좋았던 공연!,세계여성의날에 봐서 뭔가 더 뜻 깊게 다가왔습니다. 하지만 언제봐도 좋았을 것 같은 공연이에요!,2023.03.10
940,"실비아, 살다",5,공감과 위로가 되는 작품,진짜 꼭 한 번씩 봤으면 좋겠는 작품이다. 가서 펑펑 울고 나왔다,2023.03.10
941,"실비아, 살다",4,한번쯤 봤으면 하는 공연,"중앙1열이었는데 무대와 객석 1열 단차가 없어서 목이 아프다거나 하지는 않아요! 배우님들 연기력이 너무너무 좋았고, 주제가 주제인지라 사람마다 다르겠지만 전 보는데 크게 힘들지는 않았어요. 러닝타임을 생각하면 충분히 기승전결을 다 풀 수 있을 것 같은데 중간중간 기(승)전결로 느껴지는 부분이 있어 그건 좀 아쉬웠어요. 오히려 신나는 넘버 없이 정말 딥하게 풀었다면 어땠을지도 궁금해지는? 그치만 충분히 만족스러웠던 관극이었습니다!! 자리는 가능하면 좀 뒤로 가더라도 공연장 작아서 괜찮으니 중앙블럭이나 최소한 사이드블럭 통로쪽이면 더 좋을 것 같아요!!!",2023.03.09
942,"실비아, 살다",5,저 실비아가 좋아요,실비아 너무 좋습니다정말 좋아요… 왜 좋은지 말로 설명하긴 참 어려운데정말 좋어요ㅠㅠㅠㅠㅠㅠㅠ,2023.03.08
943,"실비아, 살다",5,실비아,"여러번 보고도 볼 때마다 가슴 매여 울고 나오게 되는 극입니다. 정말 모든 여성들이 한 번은 봤으면 하는 마음에 어떻게든 한 명씩 데리고 와 함께 보고 있어요. 엄청난 고통과 괴로움이 숨 막히게 밀려들어 함께 괴롭지만, 그와 동시에 해방감과 가슴 아픈 위로를 받게 됩니다.",2023.03.08
944,"실비아, 살다",5,우리의 실비아,안쓰러운 우리 실비아를 감싸주고 싶었고 안아주고 싶었다 그래도 살아가는 우리 실비아가 참 대견했고 이제는 너의 마음대로 죄책감 없이 살아가도 돼,2023.03.07
945,"실비아, 살다",5,실비아,처음부터 끝까지 집중을 잃지 않고 완전히 몰입해서 봤어요 ...뭐부터 칭찬해야 할지 모르겠네요 정말 실비아를 붙잡고 같이 오열하고 싶었던... 이거 정말 모든 여성이 봐야 하는 뮤지컬입니다 ... ㅠㅠ,2023.03.06
946,"실비아, 살다",5,펑펑,배우도 울고 관객도 울고…커튼콜까지도 눈물 펑펑이었던 잊지 못할 공연,2023.03.06
947,"실비아, 살다",5,대학로에서 꼭 봐야하는 뮤지컬,분위기며 노래며 빼놓을것 하나없이 꽉찬 공연이었어요,2023.03.06
948,"실비아, 살다",5,큰일났네.. 감겼습니다..,1회차는 극 자체에는 몰입이 됐지만 기억에 남는 넘버가 하나 정도밖에 없었는데.. 2회차에 제대로 감겼네요. 여러 넘버들이 머리속에 떠나질 않아요.  주다온배우 보러 또 가야겠습니다.,2023.03.06
949,"실비아, 살다",5,테드 번디... 아니 테드 휴즈!!,참 나뿐 테드 휴즈 ㅜㅠ 사실 당대에는 정말로 천재시인으로 불렸었다지만... 바람기로 유명했고.... 실비아 사후에 그 작품에 멋대로 손대려 했던... 결국 실비아를 버리고 바람폈던 상대마저 실비아와 똑같은 모양의 자살로 몰아넣은... 정말 나뿐 테드 휴즈...,2023.03.06
950,"실비아, 살다",5,도움이 필요한 게 아닌... 확인 받고 싶은...,"꿈과 희망, 재능으로 충만하던 실비아... 그녀가 세상과 부딪히고 흔들리고 좌절할 때 필요했던 건 도움이나 동정이 아니었습니다. 그녀에게 필요했던 건 있는 그대로의 자신에 대한 인정, 자신의 삶과 노력에 대한 확인이었습니다. 뮤지컬 실비아 플라스는 그래서 실존에 대한 물음표이며, 또 자존을 회복하기 위한 느낌표입니다. 그녀의 지독했던 인생이 누군가에게 위로가 되는 것은 그러한 이유 때문인 것 같습니다.",2023.03.06
951,"실비아, 살다",5,실비아살다,배우들의 열연 너무 잘봤습니다~!!!!!!,2023.03.06
952,"실비아, 살다",5,완전 추천.,배우님들 열일. 완전 몰입했어요.,2023.03.06
953,"실비아, 살다",4,박란주 짱,감명깊은 연기였습니다.,2023.03.06
954,"실비아, 살다",5,아 박란주...,박란주라는 배우를 알게돼서 너무 좋다작은 체구에서 뿜어져 나오는 에너지..최고,2023.03.06
955,"실비아, 살다",5,실비아,재밌었어요,2023.03.06
956,"실비아, 살다",5,감동을주는 뮤지컬,위로와 감동을 주는 뮤지컬!!,2023.03.06
957,"실비아, 살다",5,연출이 흥미롭습니다,관념캐들 연기 재밌어요!,2023.03.06
958,"실비아, 살다",5,실비아 플라스의 생애,"실비아 플라스에 대해서는 언뜻 알고 있었는데 이렇게 치열하게 살아온 사람인줄은 몰랐네요사실 그녀가 아닌 그녀를 둘러싼 환경이 문제였던 것인데, 그렇게 가버린게 안타깝기도 합니다자살이 죽음이 아닌 삶을 위한 시도라는게 신선한 관점으로 느껴졌어요 비록 실패하고 말았지만...",2023.03.06
959,"실비아, 살다",5,좋았어요,다시 보고 싶어요,2023.03.06
960,"실비아, 살다",5,실비아,ㅠㅠ 초연 재밌게 봐서 기대하고 있었는데 일정때문에 조금 늦게 도착해서 입장을 못했어요... 다음에 다시 보러갈게요,2023.03.06
961,"실비아, 살다",5,너무 좋았어요..,주다온 실비아 천재시인,2023.03.06
962,"실비아, 살다",5,너무 좋았어요,주다온 빅토리아 짱짱걸,2023.03.06
963,"실비아, 살다",5,우리 모두 술 탄 물을 마신 거야,비슷한 삶을 살고 비슷한 생각을 했던 때가 있어서 그런지 장면 하나하나 넘버 하나하나 많은 생각이 들었어요 위로를 받음과 동시에 끌어올려지는 여러 기억에 가끔 현실이 원망스럽기도 하고...... 비상정차를 생각하는 분들이 꼭 보셔야 하는 극입니다,2023.03.06
964,"실비아, 살다",5,좋았어요,진심으로 쓴 극인것같아요,2023.03.06
965,"실비아, 살다",5,실비아살다,스콜까지 완벽,2023.03.06
966,"실비아, 살다",5,실비아 살다,여성이라면 꼭 봐야할 갓극입니다. 비록 극장의 의자가 너무너무 불편하지만 그것 또한 잊게하는 극입니다. 실비아의 모든 상황들이 각자의 인생과 비슷한 부분들이 있어 좋았습니다. 응원을 불어넣어주는 극이에요.,2023.03.06
967,"실비아, 살다",5,몇 반을 보는 건지,실비아 캐릭터가 입체적이라 좋다. 사회적 여성성을 수행하려 하다가도 야생마처럼 날뛰고 솔직하게 외로움을 인정하고... 솔직히 예민한 인간이라 이런 캐릭터를 온전히 사랑하기 힘든 관객들도 있을 법한데 실비아랑 빅토리아가 하는 얘기를 들어보면 그냥 실비아한테 몰입해서 같이 울게 된다.초연 캐스팅이 너무 좋았어서 재연 캐스팅에 별 기대를 안 하고 갔는데 너어무 좋았다. 상도 많이 받고 매년 하면 좋겠다.,2023.03.05
968,"실비아, 살다",5,"날 전율하게 한 실비아 살다, 그리고 주다온 배우..","영화 ''거래완료''에서 보고 팬이 된 이규헌 배우 보러 갔다가, 엄청난 문화적 충격을 받았습니다..  예전에 옥주현 배우의 뮤지컬 데뷔작 ''아이다'' 에서 그녀가 극중 인물로 완전히 빙의 되어, 사랑하고 울고 노래할 때 나도 같이 공명하며 전율하던 기억이 있습니다..  그 이후 옥주현 배우 공연 거의 다 봤지만 모두 ''50% 정도의 힘만 들여서 노련하게 되게 잘한다'' 정도의 느낌 뿐 100%의 미친 연기는 더 이상 없더군요..   그런데 이 작은 뮤지컬 ''실비아 살다'' 의 주다온 배우에게서 그 100%의 연기를 다시 발견하였습니다..  주다온 배우 뿐 아니라 5명의 배우 모두가 그들의 이야기, 음악, 갈등, 슬픔으로 어떤 블랙홀을 만들었고, 관객들도 그 속에 완전히 빨아들여지는 걸 느낄 수 있었습니다.. (고유니 배우는 아직은 평가 제외 ^^;)  아니 이런 연기를 거의 매일 한다고?  저러면 몸이 가루가 되어 재처럼 사라져 버릴 것 같은데? 그리고 이런 뮤지컬이 이렇게 그냥 묻혀 있다고? 어떤 미소도 슬픔도 감동도 느끼지 못했고, 크기만 했던 엘리자벳은 그렇게 좋은 평가를 받고 있는데??  실비아 플라스의 슬픔까지는 아니겠지만, 이런 현실도 저에게는 좀 슬프네요..",2023.03.05
969,"실비아, 살다",5,재미와 감동까지,실비아플라스의 삶을 시계로 나타낸 연출이 너무 좋았어요,2023.03.04
970,"실비아, 살다",5,진짜최고,정말 오랜만에 눈물참느라 머리가 아팠던 극이였어요 너무 최고 엄청난 갓극..,2023.03.03
971,"실비아, 살다",5,재밌어요,재밌다는 후기를 보고 갔는데 정말 재밌어서 또 보고싶어요!,2023.03.02
972,"실비아, 살다",5,지독히 참담하고 지극히 치열하고 또 지그시 포근한...,실비아의 삶을 내려누르는 세계와 운명과 주변인은 지독하게 참담합니다 하지만 실비아는 좌절하지 않고 지극한 치열함으로 오롯이 시의 완성을 향해 나아갑니다 그러나 이런 실비아의 이야기는 단지 탐미적인 예술주의가 아니라 그러한 경험을 공유하고 서로에게 의지가 되어주자는 다짐으로 지그시 포근한 온기가 됩니다. 실비아=빅토리아는 우리의 자화상이며 상처이며 옹이입니다. 끝없이 내일로 나아가는 오늘의 우리입니다.,2023.03.02
973,"실비아, 살다",5,자첫하고 집가서 다시 예매한...다시 돌아올게 실비아,"두 번째는 더 몰입해서 볼 수 있었어요. 내용을 아니까. 넘버가 중독성이 강해서 유튜브에 맨날 찾아보고 ㅎㅎ 당일에 커튼콜도 아빠, 이 개자식이라서 자꾸 맴도네요. 저에게는 실비아와 빅토리아가 많은 위로를 줬고 어쩌면 또 보러갈지도 모르겠네요. 곧 다시 돌아올게 실비아!",2023.03.02
974,"실비아, 살다",5,모든 딸들을 향한 위로,"희생하는 엄마에게 애증을 느끼는, 위압적인 아빠로 인해 트라우마를 가지고 있는 딸들을 향한 강렬한 위로를 건네는 작품이었습니다.배우님들 다 흠잡을 데 없었습니다. 실비아 역 박란주 배우님, 빅토리아 역 이지숙 배우님 정말 너무너무 좋았습니다. 다른 배우님들도 훌륭했고요.넘버도 좋았어요. 계속 뮤비를 돌려보게 되네요.다만 좌석은 진짜 심하게 불편했네요... 이건 어쩔순 없지만요. 무대가 아래에 있어서 2열에 앉으면 앞열 사람들 머리에 가려 배우들 하반신쪽은 보이지가 않았어요.",2023.03.01
975,"실비아, 살다",5,대학로에서 본 뮤지컬중 최고.. ,엄마랑 남편이랑 오랜만에 관람하는거라 신중히 결정했어요 .  워낙 저렴한 뮤지컬들도 많고 공연의 선택의 폭이 넓어서 ..가벼운건 싫어해서 결정했는데정말 인생 뮤지컬이였네요정말 오열하면서 받어요 엉엉 울고싶은거 시끄러우니까 꾹꾹 참으면서  봤네요 .진심으로 감사드립니다 .,2023.03.01
976,"실비아, 살다",5,세상의 모든 빅토리아에게,"빅토리아. 너 역시 신경쇠약에 걸린 니가 잘못한 게 아니라, 그 상황에 놓여 있는 것 뿐이야. 나에게 마지막이 아닌 내일을 위해 따뜻한 목도리가 되어준 너에게 고마워. 아홉 번째 왕국에서 만나게 되길 기도하며 살아갈게. 또 만나.",2023.02.28
977,"실비아, 살다",5,좋아요!,배우분들 다 너무 잘하시고 너무너무 좋았습니다.,2023.02.28
978,"실비아, 살다",5,란주 실비아,"연기 너무잘한다.. 은영 빅토리아님이랑 문테드님, 앙상블분들도 호흡이 너무 잘맞았어요",2023.02.28
979,"실비아, 살다",5,실비아 살다 관극후기,더뮤지컬어워즈에서 대상 후보에 오른 작품이라 한번 보러가고 싶어진 뮤지컬 실비아 살다.첫번째 공연은 무슨 내용인지도 모르고 가서 솔직히 좀 당황했다. 하지만 배우들이 연기를 진짜 너무너무 잘해서 더 좋게 볼수 있었던 것 같다. 그 작은 무대에서 조명과 연출로 전혀 한 공간이 아닌것처럼 느껴졌고 넘버들도 하나같이 좋아서 너무 만족스러웠다. 두 번째 보러갔을때도 첫공을 되새기며 그 벅차오름을 다시 한번 느낄 수 있었다. 아마 막공까지 3~4번은 더 보러가지 않을까 싶다.,2023.02.28
980,"실비아, 살다",5,미쳐버리겠다..,일요일 두시 타임 관람했는데.. 하.. 진짜 월요일인 오늘 하루종일 거짓말 안하고 실비아 생각 만이에요.. 여러분 꼭 보세요 마지막에 눈물 펑펑.. 삶이 조금 힘들다 느껴질 때 봐서 인지 더욱 위로가 되는 뮤지컬이었어요,2023.02.28
981,"실비아, 살다",5,다온 실비아 너무 좋아요,다온 실비아 너무 좋아요! 빅토리아 연기하신 배우분도 너무 좋고 울면서 나왔어요,2023.02.27
982,"실비아, 살다",5,또봤어요,처음 보고 너무 좋아서 또봤습니다,2023.02.27
983,"실비아, 살다",5,좋아요,내용이 너무 좋습니다,2023.02.27
984,"실비아, 살다",5,눈물과 감동의 도가니탕!!,"뮤지컬 실비아, 살다! 두시간의 짧지 않은 러닝타임이 순식간으로 느껴질 정도로 푹~ 빠져서 보았습니다. 어느 순간에 슬프고 벅차고 감동하여 울고있는 자신을 발견했습니다. 너무나 멋지고 사랑스러운 실비아! 그녀의 맹렬한 야수 같은 무대가 힘차게 이어지길 바랍니다!! 감사합니다!!!",2023.02.27
985,"실비아, 살다",5,강철무지개에 오른 초인 실비아!,"마치 어느 시인의 시에 나온 것처럼... 강철무지개에 오른 초인을 보는 것 같은 실비아 플라스의 모습이었습니다. 사랑하지만 증오하는 어머니의 그늘을 떨쳐내고, 아버지와 테드로 반복되어 생을 짓누르는 억압을 벗어나서, 자신을 인정하지 않거나 오해하는 세상에 흔들리지 않는... 심지어 자기 자신으로부터도 해방된... 오로지 내면에서 울려퍼지는 순수한 외침, 맹렬한 야수의 울부짖음 같은 그것만이 남은... 아마 이를 두고 지극한 어떤 경지라고 하는 것이 아닐까요? 아마 예전에 이백이 강에서 달을 건지려던 그 순간, 어느 악사가 연주하여 전쟁이 멎고 장님이 눈을 뜨던 그 순간, 의인이 역사에서 꼬레아 우라를 외치던 그 순간... 바로 그런 순간을 저는 실비아 살다에서 느꼈습니다. 좋은 작품으로 큰 감동을 준 제작진 분들, 땀과 눈물로 무대를 빛나게 해주신 배우분들, 특히 실비아 플라스로 마치 신내린 것 같은 연기를 보여주신 주다온 배우님... 모두 감사합니다!! 행복하세요!!",2023.02.27
986,"실비아, 살다",5,재여보길잘했다,재연올려줘서 감사합니다 더열심히볼게요,2023.02.27
987,"실비아, 살다",5,실비아,작가님 천재 작곡가님 천재,2023.02.27
988,"실비아, 살다",5,최고의뮤지컬ㅜㅠㅠ,엄청울다왔어요ㅠㅠㅠㅠ그리구 박란주 배우님 너무너무너무너무 잘하세요ㅠㅠㅠ 란주배우님 앞으로 하시는 공연 다 따라다니면서 보고 싶음ㅠㅠㅠ,2023.02.27
989,"실비아, 살다",5,좋아요,좋은 공연,2023.02.27
990,"실비아, 살다",5,우린 모두 술탄물을 마신 거야,그녀가 어떻게 살아가는지 그의 삶을 봐주세요,2023.02.27
991,"실비아, 살다",5,주다온이 장르다,쭈다 실비아 쭈다 빅토리아 둘 다 꼭 보세요 이 사람은 실비아의 환생이고 빅토리아예요. 글을 쓸 때 가장 자유롭고 행복해보입니다. 천재여요,2023.02.27
992,"실비아, 살다",5,그러니까 계속 글을 써줘,"실비아를 살려내줘서, 따뜻한 목도리가 되어줘서 고맙습니다.",2023.02.27
993,"실비아, 살다",5,잘봤습니다:),재미있게 봤어요!!,2023.02.27
994,"실비아, 살다",5,재미있어요!,오랜만에 잘 봤습니다.,2023.02.27
995,"실비아, 살다",5,재밌어요,재밌어요,2023.02.27
996,"실비아, 살다",5,실비아 살다,"새로운 삶을 살기 위한 자살이라니. 성공해버린 세 번째 시도를 조금더 치밀하게 준비했다면 좋았을텐데 안타깝다. 그녀의 작품을 잘 모르지만, 극에서 보여지는 글을 쓰고자하는 열정이 참 매력적이었고 그런 그녀가 좀더 뜻을 자유롭고 충분하게 펼치지 못하게 된 것이 참 안타깝다.결혼한 여성이 필연적으로 맡게되는 엄마와 아내라는 역할때문에 실비아 자신으로서 하고싶은 일을 할 수 없는 상황을 보면서 참 숨막혔다. 거기에 크게 한 몫하는 부모와 테드. 시대가 변하고 여성의 역할이 변화하였다하더라도 잠재적으로 교육되어버린 구시대어머니의 가르침 덕분에 답답함을 느끼고 있는 현시대를 살아가는 딸에게 엄마를 배신해도 된다는 말은 무척이나 속 시원하게 해주는 동시에 눈물을 왈칵 쏟아내게 했다.",2023.02.27
997,"실비아, 살다",5,정말,정말 좋은 극입니다 다시 보고 싶어요,2023.02.27
998,"실비아, 살다",5,실비아,내용이 너무 좋아요. 배우님들도 다들 너무 잘하시고 짱이예요ㅠㅠ,2023.02.27
999,"실비아, 살다",5,갓극도 이런 갓극이 없네요,실비아의 삶에서 제 삶이 보이고 이 세상 여자들의 삶이 보여요. 술탄물은 진짜 최고의 넘버같아요. 이렇게 신나는데 의미있는 넘버라니...!그리고 모든 배우들이 정말 혼신의 힘을 다해 연기하는 모습에 정말 감탄했어요.실비아살다 두번보세요 세번보세요 회전도세오,2023.02.27
1000,"실비아, 살다",5,실비아 역이었던 배우가,빅토리아 배우도 한다는 게 너무 궁금해서 보러갔습니다! 배우들이 다 너무 잘해서 좋았어요,2023.02.27
1001,"실비아, 살다",5,실비아ㅠ,실비아 인생이 ㅠ,2023.02.27
1002,"실비아, 살다",5,최고,추천합니다,2023.02.27
1003,"실비아, 살다",5,아빠 다 끝났어,볼 때마다 펑펑 울고 나오는 극....??이 세상의 모든 실비아들이 행복해지길 바라며..??,2023.02.27
1004,"실비아, 살다",5,다온실비아,진짜잘해요!!,2023.02.27
1005,"실비아, 살다",5,실비아 ㅠㅠㅠ,실비아,2023.02.27
1006,"실비아, 살다",5,멋져요,욕도 나오는 극이고 자극저인 부분도 있지만 내가 나를 위로해주러 오는거 멋있다고 생각해요,2023.02.27
1007,"실비아, 살다",5,많은 생각을 하게 하네요,"죽어야만 살 수 있는 작가, 실비아. 작가인 실비아가 아닌 여성으로서 아내로서의 존재만 부각되는 관계속에서 실비아가 느꼈고 생각했을 무언가가 너무 와닿는 공연이네여",2023.02.27
1008,"실비아, 살다",5,위로가 되어주는 공연,실비아 살다 지숙여신 너무 잘해요,2023.02.27
1009,"실비아, 살다",5,실비아의 인생을 엿볼 수 있는 극,너무너무 재밌게 봤습니다 ㅠㅠ 원래 좋아하던 시인이라 기대가 많았는데 너무 재밌게 잘 관람했어요!,2023.02.26
1010,"실비아, 살다",5,란주 실비아 최고 된다ㅠㅠ,란주 실비아 그 에너지가 어디서 나오는지..어떤 작품에서 볼때마다 늘 감탄해요덕분에 실비아라는 인물을 알게 됐습니다 고마워요,2023.02.26
