musical_title,rate,review_title,review_text,review_date
뮤지컬 〈영웅〉 10주년 기념공연,3,생각보다 쫀쫀하지는 않은 이야기,"사실 영웅이라는 뮤지컬의 name value를 많이 기대하고 갔는데 그 기대보다는 이하였습니다. 서사가 쫀쫀하지 않은 듯 느껴졌고, 본래 극이라고 하는 것이 등장인물의 감정 흐름선을 따라 와야하는데 그러한 점에서 서사가 더욱 부족했다고 느껴지는 것 같습니다. 가령 마지막에 안중근 의사가 감옥에서 간수와 이야기를 나누는 장면에서 갑자기 간수가 안중근 의사에게 감동을 받고 스승으로 모신다는 것이 그럴 수 있는 일이기는 하지만, 이전에 한 번도 등장하지 않았던 인물이 마지막에 갑자기 등장한다고 해서 그 인물의 행동이 이해가 되는 것은 아닙니다. 너무나도 많은 등장인물이 등장하여 각 인물에 집중하지 못하였고 그 인물을 연기하는 배우들 또한 짧은 시간 안에 굵직한 서사를 보여주어야 하기에 그 순간적으로 몰입하는 것이 힘들 것이라 생각합니다. 많이 쳐내야하고, 또 많은 부분 집중해야 할 것 같습니다. 아직 영웅이 가야할 길은 먼 것 같습니다.",2019.04.09
뮤지컬 〈영웅〉 10주년 기념공연,4,올 해 봐야하는 뮤지컬 중 하나,3.1 운동 100주년을 맞이하여 혹은 나중에라도 봐야 할 뮤지컬 특히 중고등학교 학생들이 부모님과 함께 보면 더욱 좋을 것 같다,2019.04.09
뮤지컬 〈영웅〉 10주년 기념공연,5,올해의 마지막 뮤지컬,"출산전 마지막 뮤지컬이었는데, 감동의 공연이었습니다.  영웅은 두번째인데, 역시 정성화 배우의 안중근 역할은 누가 해도 대체가 불가할 것 같습니다.  또 보고 싶네요!!!!!",2019.04.09
뮤지컬 〈영웅〉 10주년 기념공연,5,두번을 봐도 정말 좋은작품!!,"앙상블들의 쫓고 쫓기는 군무가 이번에도 특히 기억에 남네요, 장부가, 그날을 위하여 등 주옥같은 넘버들도 역시나 좋고요. 정성화 배우님은 역시나! 최고였습니다!!조마리아배우님은 좀 아쉬웠어요.... 너무 가성이어서 가사전달이 잘 안됐습니다.4월7일 저녁6시30분 공연이었는데 앞에 앉은 커플분들 쉴새없이 움직이시고 얘기하셔서 1막은 집중이 좀 어려웠네요....ㅠㅜ 영웅은 무대도 좋고, 넘버들도 정말 좋아서 많은 분들이 보셨으면 좋겠습니다",2019.04.09
뮤지컬 〈영웅〉 10주년 기념공연,5,다시보고 또봐도,"세번째보는 공연이지만 역시나 감동적이고 여운이 남는 멋진공연이였습니다. 엎으로 기회가 된다면 또다시 볼예정입니다.!,,",2019.04.08
뮤지컬 〈영웅〉 10주년 기념공연,4,배우들은 다 잘 하는데,이상하게 지루한 극,2019.04.08
뮤지컬 〈영웅〉 10주년 기념공연,5,뮤지컬 영웅 감동의 도가니였네요 ㅠㅠ,강력추천합니다!! 최고!!,2019.04.08
뮤지컬 〈영웅〉 10주년 기념공연,4,배우들의 진심이 느껴지는 무대,"오랫동안 보고 싶었던 영웅을 드디어 관람했습니다. 아쉽게도 함께 예매했던 낮공은 개인사정으로 취소를 했지만 다행히 양준모 배우님의 안중근을 볼수 있어서 참 좋았습니다. 공연하는 내내 넷째 손가락을 접고 계신듯 하더라구요 불편했겠다 싶었지만 배우님은 아랑곳하지 않고 오롯이 안중근 의사님을 연기하셨습니다. MR이 아닌 오케스트라 라이브 연주로 더 하나된 듯한 무대였습니다. 무대, 미술, 안무, 연기, 노래 뿐만아니라 무대를 스크린 삼아 조명을 그림삼아 만들어낸 무대도 정말 멋졌습니다. 임팩트 있게 다가온 넘버는 익히 잘 알고 있는 ''누가 죄인인가'' 였으나 그 외에는 크게 튀는 넘버는 없었던듯 합니다. 그러나 그 것이 오히려 극을 흐리지 않는 강점이 된 것 같아요.. 물 흐르듯 흘러가는 공연이라 3시간 가량 함께 동화되어 관람했고 안중근 의사님과 여러 독립투사들, 그리고 그 것을 무대에 옮겨놓은 그간의 노고와 모두의 마음이 느껴져 박수를 아낌없이 보낼수 있었습니다.",2019.04.08
뮤지컬 〈영웅〉 10주년 기념공연,5,너무행복했습니다,너무너무 완벽했습니다2년전에 인천공연왔을때 부모님모시고 같이보고이번엔 세종으로 모시고갔는데갈때부터 설레이신다는 부모님 보면서 뿌듯햇고공연보시고 나와서 더좋았다고 너무행복했다고 부모님께서 말씀해주셔서 더좋았던 공연이었습니다누가죄인인가부터 동양평화 장부가까지모든걸 아낌없이 쏟아내주신 정성화배우님께 감사드리고이런 작품을 볼수있는 시대에 살수있어서 너무너무 감사합니다10주년 영웅 100주년까진 함께하진못하겠지만제가 함께할수있는 시간내내 놓치지않고싶습니다남은공연까지 모든 배우님들 다힘내세요♡,2019.04.08
뮤지컬 〈영웅〉 10주년 기념공연,5,대한민국 국민이라면 필관입니다,그 희생 잊지않겠습니다,2019.04.08
뮤지컬 〈영웅〉 10주년 기념공연,4,멋진 무대였습니다,양준모 배우님 기대하고 갔는데 역시나 기대를 저버리지 않으시네요웅장한 무대에 어울리는 안중근의사의 모습을 잘 표현해 주셨어요 잘 봤습니다싸움인듯 춤인듯 앙상블배우님들 연출도 멋졌어요특히 기차 장면은 무대가 일품이었어요 신기하기도 하고,2019.04.08
뮤지컬 〈영웅〉 10주년 기념공연,2,"너무나 쎈 캐릭터, 영웅 뮤지컬",- 정의로운 상황 연출 - 여자를 끌어안은 남자. 여자는 앞을 보며 죽고 남자는 옆을 보며 슬퍼함.  - 악역 디테일이 너무 없음 - 주인공은 너무 정의롭기만 함. 약점이 없다. - 3차원으로 공간을 다 활용. 아크로바틱 쩐다.  -상황극: 연인을 구하는 여전사. 슬퍼하는 아킬레우스.,2019.04.08
뮤지컬 〈영웅〉 10주년 기념공연,5,최고의 공연입니다!!,정성화님의 연기가 보고싶어 예매전부터 기다리고... 자리가 없어 실망하려던 그때 좋은 자리가 나타나고ㅠㅠ 정말 예매하고 손꼽아 기다리가 설레는 마음으로 공연장 앞에 간 어제.. 너무 행복하고.. 3&#8226;1절날 100주년 공연으로 티비에서 봤던 시작무대임에도... 눈물이 차오르던.... 잊을 수 없는 공연입니다!!! 다음엔 더 좋은 자리에서 또 볼 의사가 있어요!!! 김문정 음악감독님의 지휘도 보고ㅠㅠ 정성화님 뿐 아니라 함께하신 모든 배우분들에게 푹 빠지는... 그런 공연이였습니다~ 감사합니다♥,2019.04.08
뮤지컬 〈영웅〉 10주년 기념공연,5,잘봤습니다,배우들이 다들 열연하시고 음악도좋고역사도 다시한번 알게되었습니다,2019.04.08
뮤지컬 〈영웅〉 10주년 기념공연,5,대표 한국뮤지컬 그 명성 대로 입니다,좋은 작품을 보게 되서 너무 좋았습니다.  대한민국을 대표할만한 작품이라고 들어서 잔뜩 기대하고 관람에 들어갔는데  역시 저의 기대를 완벽히 만족시켜 주었습니다.  같이 간 아내도 재미있었다고 좋아하네요.  안보신 분들은 꼭 보시기 바랍니다. 추천드려요.,2019.04.08
뮤지컬 〈영웅〉 10주년 기념공연,5,감동감동,최고였어요 배우님들!!  다만 세종 음향이 ㅠㅠ 뭔가 답답한 느낌? 이얐어요,2019.04.08
뮤지컬 〈영웅〉 10주년 기념공연,5,넘나 좋았어요,넘나 좋았어요,2019.04.08
뮤지컬 〈영웅〉 10주년 기념공연,5,너무너무 감사합니다.,"4월6일 토요일 7시공연을 봤습니다. 선생님들과 초등학생7명, 학부모 등 총14명이 관람하였습니다. 안중근관련 책을 읽고 ...연극을 하고난 후 본 뮤지컬이라 감동이  더 배가 되었던거 같습니다. 제아들은 초등학교 2학년인데 .. 계속 우와~ 대박~ 이러면서 보고.. 저는 장부가 음악이 나올때마다 눈물이 나오고.. 안중근어머니 조마리아가 나왔을때 눈물이 나왔던거 같습니다. 뮤지컬을 만들어주셔서 너무 감사하고.. 정성화님 너무 멋있습니다. 그리고 안중근의사님 존경합니다",2019.04.08
뮤지컬 〈영웅〉 10주년 기념공연,5,부모님께 좋은 선물이 되었어요!,"웅장한 무대장치, 배우들의 열연, 마지막 법정신에선 엄마가 감탄을 내뱉으시더라구요. 자식인 저보다 부모님이 먼저 일어나서 기립박수????치시는데 정말 기뻤습니다! 이번 서울여행에서 가장 좋은 일정이 뮤지컬이었다고 하시네요. 빛나는 청춘을 바쳐 지켜준 나라에 감사했습니다!",2019.04.08
뮤지컬 〈영웅〉 10주년 기념공연,5,최고였다,세종문화회관 공연은 처음이었는데 무대장치도 좋았고 특히 노래들이 너무 좋았다. 눈물을 주룩주룩 흘리며 봄.,2019.04.08
뮤지컬 〈영웅〉 10주년 기념공연,3,감동적인 뮤지컬,뮤지컬 영웅 굉장히 기대 많이 했어요. 원래 뮤지컬을 보다보면 화려하고 신나는 그런 씬이 있는데 영웅은 감동적인 역사를 담고있어서 그런 부분은 없었어요. 그래서 조금 지루하다고 느껴질 수 있긴 했는데 그래도 감동적이고 나름 재밌었어요. 마지막에는 눈물도 찔끔! 넘버도 좋고 괜찮은 뮤지컬이었네요~,2019.04.08
뮤지컬 〈영웅〉 10주년 기념공연,5,완전 최고입니다.,뮤지컬중에 탑,2019.04.08
뮤지컬 〈영웅〉 10주년 기념공연,5,sdfsdfsd,fgsdsfs,2019.04.08
뮤지컬 〈영웅〉 10주년 기념공연,5,감동적이지만 마음아픈..,뮤지컬 너무 좋았습니다! 안중근 선생님의 어머니께서 직접 만드신 수의를 보는 순간 눈물이 안날수가 없었어요.. ㅠ 가슴아픈 우리의 역사를 잊지않고 기억해야겠다고 생각했습니다.,2019.04.08
뮤지컬 〈영웅〉 10주년 기념공연,5,"최고의 뮤지컬 ""영웅"" 을 보고 나서","혼자 뮤지컬 보러 가는것이 취미여서 이번 ""영웅"" 뮤지컬도 혼자 보러 다녀왔습니다. 사실 2017년 아버지랑 함께 본 첫 번째 뮤지컬이 ""영웅"" 입니다. 그때 처음 뮤지컬을 보기 시작하고, 그 뒤로 뮤지컬만 보면 행복해져서 스트레스 받는일이 있거나, 아무 생각 없이 기분이 좋아 지고 싶을때 종종 보고 다닙니다. 그중에서도 뮤지컬 ""영웅""은 독립투사 안중근 의 이야기를 잘 설명해주고있고, 각 각의 넘버들도 정말 최고입니다. 세종문화회관 대극장 엄청 넓은데도 불구하고, 배우님들의 가창력이 정말 지붕을 뚫습니다... 내용뿐만 아니라 넘버들, 배우님들도 최고이고, 연출,조명,무대 등 도 훌륭한 뮤지컬 입니다. 제 꿈이 공연콘텐츠기획자 인 만큼 이러한 뮤지컬을 보며 꿈을 키워나가고 있습니다 정말 강력 추천하고 살면서 한 번쯤은 꼭 봐야하는 뮤지컬 이라고 생각합니다!",2019.04.08
뮤지컬 〈영웅〉 10주년 기념공연,5,재밌어요,기대 안하고 봤는데 너무 감동적이고 재밌었어요또보고싶어요??,2019.04.08
뮤지컬 〈영웅〉 10주년 기념공연,5,커튼콜까지 감동이 밀려 오네요,기대했던 것 만큼 정성화씨의 안중근역할은 정말 멋졌어요특히나 2부 누가죄인인가부터 감옥에서 수감된 장면은 정말 감동적이었습니다 커튼콜에서까지 그 전율이 느껴져 눈물이 울컥했네요,2019.04.08
뮤지컬 〈영웅〉 10주년 기념공연,4,양준모씨 역시! 넘 좋았어요!,지난 시즌 다른 안중근을 보았고 사실 더 볼 마음은 없었는데 양준모 배우는 꼭 보고싶어서 다녀왔습니다!  아 정말 너무너무 보길 잘한 것 같아요 ㅠㅠ,2019.04.08
뮤지컬 〈영웅〉 10주년 기념공연,3,웅장함이 주는 아쉬움,"2층에서 관람 했는데, 아무래도 무대와 거리 때문에 약간 아쉬움이 남았습니다. 아이와 함께 관람한 첫 뮤지칼인데 앞으론 기회가 있으면 소규모 무대나 좀 더 비싼 좌석을 예약해야 배우들의 생생함이  느낄 수 있을 것 같네요.",2019.04.08
뮤지컬 〈영웅〉 10주년 기념공연,4,정성화 배우의 안중근,기대한 만큼 좋았습니다.,2019.04.08
뮤지컬 〈영웅〉 10주년 기념공연,5,한국인이라면 꼭 봐야할 뮤지컬,정성화 배우님은 어떤 역할도 잘 소화하지만영웅의 안중근 의사 역할이 가장 잘 맞는 옷 같아요오랜만에 힐링되고 좋았습니다감사합니다,2019.04.08
뮤지컬 〈영웅〉 10주년 기념공연,5,뮤지컬 〈영웅〉 10주년 기념공연,정말 가슴이 뭉클해지는 뮤지컬이었습니다.,2019.04.08
뮤지컬 〈영웅〉 10주년 기념공연,5,열정적인 공연,"아이들과 함께한 멋진공연이었습니다. ""누가 죄인인가?""를 외치는 안중근의 마지막 법정 진술에서  희열과 감동을 받았네요,, 출연하신 모든 배우들의 열정에도 다시한번  박수를 보냅니다.",2019.04.08
뮤지컬 〈영웅〉 10주년 기념공연,5,너무 멋있어요,배우분들의 안무와 음악이 정말 완벽한 호흡을 보여주세요! 정말정말 멋있고 특히 누가 죄인인가는 엄청난 전율을 주었어요!!,2019.04.08
뮤지컬 〈영웅〉 10주년 기념공연,5,너무 잘봤습니다.,"역시 정성화는 정성화다웠습니다. 뮤지컬 영웅에서 내뿜으시던 카리스마는 전율로 다가왔습니다. 오랜만에 뮤지컬을 봤는데, 같이 본 여자친구도 너무 좋아했습니다.  앞으로 기회가 된다면 또 보고 싶어요!",2019.04.08
뮤지컬 〈영웅〉 10주년 기념공연,5,아이와 즐거운시간,"역사를 좋아하는 아이와 매우 뜻깊은 관람이었습니다좌석이 뒤라 배우들 표정이 안보여 아쉬움이 있었지만, 무대효과와 노래에 있어서는 정말 최고입니다 !!!!",2019.04.08
뮤지컬 〈영웅〉 10주년 기념공연,5,너무 감동적이에요,너무 가슴이 먹먹하고 감동스럽습니다,2019.04.08
뮤지컬 〈영웅〉 10주년 기념공연,5,와......,진짜 말이 안나오네요. 세자매랑 남자친구랑 입도 못다물고 소름끼치면서 봤습니다. 대박이예요 꼭 보세요!!!!!!!!!!!,2019.04.08
뮤지컬 〈영웅〉 10주년 기념공연,5,재관람을 불러오는 뮤지컬이에요.,"개인적으로는 이번 영웅 뮤지컬은 ''꼭 봐야겠다!!'' 하는 리스트에 있지는 않았어요.. 그래도 볼 수 있는 시간이 생겨 토요일 7시타임 [정성화, 김도형, 정재은, 임정모, 임선애] 배우분들로 보고왔습니다. 영웅하면 늘 먼저 생각나는것이 정성화와 누가죄인인가 였는데, 이번에는 모든 배우분들의 열연으로 인터미션시간에 다른배우분들 막 검색해보고 그랬습니다. 정재은님도 초반부터 끝까지 어찌나 잘하시던지,, 쫄깃해하면서 봤어요. 후반에 여기저기서 훌쩍이면서 더 유명해져도 이상하지 않을 넘버들 들으며 갠소하고 싶었.....ㅎㅎㅎㅎ  홀은 사운드 좋다는 얘기 많이 있는데, 역시 문화회관대극장!!ㅎㅎ 오케스트라도 너무 좋았어요. 개인적인 의견이지만 지휘자분 영상화면이 뒤에서 너무 환해서 암막일때 좀 환하다..느꼈었어요 그래도, 끝나고 나오는데 이거 안봤으면 어쩔뻔했냐며, 또 보고싶다고 공연 좌석을 보며나왔네요^^",2019.04.08
뮤지컬 〈영웅〉 10주년 기념공연,5,공연 추천합니다.,정성화배우님이 출연하는 작품은 다 봅니다. 이번 작품도 역시나 기대이상으로 좋았습니다. 그런데 제가 관람한 날짜에 제가 원하는 배우들이 캐스팅이 될수 없듯이 하나를 얻으면 하나를 버려야 하는 공연이었습니다. 설희역(린지) 때문에 공연에 집중할 수 없었습니다. 편견을 가지고 바라보는건 아니지만 가수보다는 순수 뮤지컬 배우님들이 무대에 더 올라올 수 있는 상황이 되었으면 좋겠습니다. 한국인이라면 알아야할 내용이고 서브 배우님들도 너무 만족스러웠습니다. 그중 김현진 배우님 링링역활여자배우님 새로 기대되는 배우님들입니다. 목소리가 너무 청아하고 맑아서 귀를 사로 잡았습니다. 활동 많이 해주세요^^!,2019.04.08
뮤지컬 〈영웅〉 10주년 기념공연,5,볼까말까 고민+반신반의 하면서 갔는데,뻔하고 신피적이긴해도 볼거리가 풍성하고 생각보다 넘버가 좋아서 좋았던 극입니다 정성화 정성화하는데는 이유가있네용 가족끼리 보면 좋을 듯 합ㄴ다~,2019.04.08
뮤지컬 〈영웅〉 10주년 기념공연,5,믿고 보는 정성화 안중근..,항상 최고입니다.,2019.04.08
뮤지컬 〈영웅〉 10주년 기념공연,5,모든것이 좋았습니다.,"안중근 의사의 이야기 <영웅>, 정말 모든것이 좋았습니다.  1. 탄탄한 스토리와 연기력 정성화 캐스팅을 너무 보고싶어서 큰맘먹고 중앙 VIP석을 잡았습니다. 10번째줄에 앉았는데, 시야도 좋고 배우들의 표정까지 볼 수 있어서 좋았어요. 창작 뮤지컬이라 그런지 지금까지 본 그 어떤 공연보다 좋았습니다.  2. 연출 조명 연출이 특히 좋았어요. 일본군과 우리나라 독립군의 추격전을 그릴 때의 빨간색과 파란색을 섞어 긴장감있게 만든 씬, 조명으로 표현한 안중근의사의 사형씬 등 조명을 적절하게 섞어 쓴 것이 인상깊었습니다.  역사를 잘 모르는 저였지만, 보고서 역사를 좀 알아야겠다는 깨달음까지 얻을 수 있었던 공연이었습니다. 중간에 우시는 분도 많았고, 저 또한 훌쩍이면서 봤습니다. 시간이 된다면 끝나기 전에 또 보고싶네요.",2019.04.08
뮤지컬 〈영웅〉 10주년 기념공연,5,좋았어요..,지난 시즌에 비해 뭔가 좀 허전한듯 느껴졌지만 그래도 정성화 안중근은 여전히 좋았어요..,2019.04.08
뮤지컬 〈영웅〉 10주년 기념공연,5,강추드립니다!!!!,꼭 한번씩 보셨으면 하는 공연이에요. 다시한번 역사에 대해 생각해보게 해주며 깊은 울림을 받았습니다. 정성화님의 연기뿐아니라 모든 배우님들의 연기에 감탄하였습니다. 감동적인 뮤지컬입니다.,2019.04.08
뮤지컬 〈영웅〉 10주년 기념공연,5,"또, 보고싶어요!!","아이와 집사람이 정성화 배우님의 연기를 보고 싶어해서 관람 예정 이었으나 아이는 시간이 되지않아 아이만 빼고 보았습니다. 이나라를 지켜낸 역사적인 인물의 진정한 영웅 들이었고 감사합니다. 보는내내 가슴이 먹먹 했습니다. 아이와 같이 보지 못해 아쉽습니다. 집사람은 아직도 정성화 배우님의 연기에 침이 마르고 닳도록 칭찬하고 계속해서 듣고 있습니다. 기회가 된다면 다시 한번 꼭 볼려구요!! 아이들과 같이 보세요 강추합니다,",2019.04.08
뮤지컬 〈영웅〉 10주년 기념공연,5,다시 봐도 역시 명작!,2015년도에 처음 영웅을 보고 올해 10주년 기념으로 다시 재관람 했는데 역시 최고의 명작입니다!,2019.04.08
뮤지컬 〈영웅〉 10주년 기념공연,5,대한민국 사람이라면 꼭 봐야 하는 공연,연령 무관 /  성별 무관 대한민국 사람이라면 꼭 봐야 하는 공연인거 같아요 뮤지컬 공연을 많이 보진 않았지만 배우 정성화 공연은 꼭 봐야 한다는 말이 왜 나왔는지 알게 되고 마지막에 조마리아여사님의  노래에 여운이 가시지 않는 최고의 뮤지컬 입니다. 넘나 좋은 뮤지컬 강추 입니다.,2019.04.08
뮤지컬 〈영웅〉 10주년 기념공연,5,감사하는 마음으로 살아가야겠네요,공연보는 내내 먹먹한 기분으로 보았습니다.그들의 희생에 대해 생각해보게되는 공연이였네요.마지막 조마리아여사가 부른 노래는 정말 너무 슬펐습니다.,2019.04.08
뮤지컬 〈영웅〉 10주년 기념공연,5,감사하는 마음으로 살아가야겠네요,공연보는 내내 먹먹한 기분으로 보았습니다.그들의 희생에 대해 생각해보게되는 공연이였네요.마지막 조마리아여사가 부른 노래는 정말 너무 슬펐습니다.,2019.04.08
뮤지컬 〈영웅〉 10주년 기념공연,4,멋진 공연이었어요,"무엇보다 모든 배우님들 훌륭했지만, 양준모배우님이 정말정말 최고였습니다!!!",2019.04.08
뮤지컬 〈영웅〉 10주년 기념공연,5,역시 레전드 뮤지컬...!!,"항상 방송을 통해 간접적으로 뮤지컬 영웅에 대해 접했었는데 꼭 보러가야겠다는 생각을 했었습니다! 이번에 좋은 기회로 보러 가게 되었는데 역시나 기대한 만큼 엄청난 공연이었네요 ㅎㅎ 특히, 정성화씨를 다시 보게 된 계기입니다... 노래 뿐만 아니라 장악력이라 해야할까요? 포스가 대단하십니다 ㅎㅎ 애국심이 불타오르는 뮤지컬 영웅 적극 추천합니다~",2019.04.08
뮤지컬 〈영웅〉 10주년 기념공연,4,2주 연속 감상평...,저번주에도 보고 이번주에도 안중근역은 정성화 배우님껄 보고 조연들은 다른 배우껄 보았다.  두 회차를 보면서 느낀 점은 뭔가 주변 조연들이 겉도는 느낌을 받았다.  배우들이 역할에 제대로 합일이 안된 느낌..  하지만 역시 장수한 뮤지컬 답게 무대장치와 조명으로 그런 아쉬움은 조금은 잡았던 뮤지컬  정성화 배우님의 영웅은 절대 강추입니다.,2019.04.08
뮤지컬 〈영웅〉 10주년 기념공연,5,정성화배우님의 안중근,세심한 연기와 그로부터 밀려오는 감동과  울림이였습니다.,2019.04.08
뮤지컬 〈영웅〉 10주년 기념공연,5,최고의 감동!,정말 최고였습니다! 정말정말 최고였어요! 정성화 배우는 =_=하...감히 평가할 수 있을까요?? 감동 그 자체였습니다 ㅠ_ㅠ 울면서 나왔네요! 모든 배우분들의 최고의 연기! 최고의 노래! 완벽한 공연이었습니다~ 너무 좋은 시간 보냈습니다! 너무나 많은 분들의 피와 땀으로 만들어진 지금을 값지고 소중하게 살아야겠다고 생각했습니다! 이런 마음을 다시 한 번 느낄 수 있도록 해주셔서 감사합니다!,2019.04.08
뮤지컬 〈영웅〉 10주년 기념공연,5,역시 ..,역사의 소재 그리고 정성화최고의 조합입니다,2019.04.08
뮤지컬 〈영웅〉 10주년 기념공연,5,가슴이 뜨거운 공연!,역시 믿고보는 정성화배우의 띵작 영웅!!!  그 진한 감동이 아직도 느껴지는 것 같습니다!  10주년 축하드리고 20년 30년 그 이상으로 계속 흥해라~!!!,2019.04.08
뮤지컬 〈영웅〉 10주년 기념공연,5,굿,너무 좋았습니다! ! 두번째 뮤지컬이였는데 뮤지컬은 볼수록 빠져드는 매력이 있어요.,2019.04.08
뮤지컬 〈영웅〉 10주년 기념공연,5,뮤지컬 〈영웅〉 10주년 기념공연,뮤지컬 〈영웅〉 10주년 기념공연뮤지컬 〈영웅〉 10주년 기념공연뮤지컬 〈영웅〉 10주년 기념공연뮤지컬 〈영웅〉 10주년 기념공연뮤지컬 〈영웅〉 10주년 기념공연뮤지컬 〈영웅〉 10주년 기념공연뮤지컬 〈영웅〉 10주년 기념공연뮤지컬 〈영웅〉 10주년 기념공연뮤지컬 〈영웅〉 10주년 기념공연뮤지컬 〈영웅〉 10주년 기념공연뮤지컬 〈영웅〉 10주년 기념공연뮤지컬 〈영웅〉 10주년 기념공연뮤지컬 〈영웅〉 10주년 기념공연뮤지컬 〈영웅〉 10주년 기념공연뮤지컬 〈영웅〉 10주년 기념공연뮤지컬 〈영웅〉 10주년 기념공연,2019.04.08
뮤지컬 〈영웅〉 10주년 기념공연,5,너무 좋았어요!,"TV에 나올때마다 너무 궁금하고 보고싶었던 영웅 뮤지컬이었는데요. 이번에 10주년 기념 공연 하게 된다는 걸 알고나서는 신나서 2달전부터 예매해놓고 공연날만을 손꼽아 기다렸습니다. 두번째 뮤지컬 관람하는거라 기대도 더 컸고 설렘도 가득이였어요. 노래 하나하나 끝날 때 마다 계속 소름 돋았고, 너무 몰입했는지 눈물도 날뻔했어요. 정말 멋있는 공연이였습니다. 다음번에 기회가 된다면 또 보러 가고 싶어요. 지금도 계속 누가 죄인인가가 머릿속에 맴맴 도네요 ㅎㅎ",2019.04.08
뮤지컬 〈영웅〉 10주년 기념공연,5,영웅,정말 최고의 뮤지컬이고 듣는 내내 소름이 돋았습니다. 배우 분들 한 분마다 열정을 다해 부르시는 모습이 정말 감동적이여서 슬펐습니다. 다시 꼭 또 보러갈 것 입니다. 영웅 화이팅!,2019.04.08
뮤지컬 〈영웅〉 10주년 기념공연,4,세번째 봐도 매번 감동,조마리아 여사님 나오실 때마다 울컥울컥 ㅠㅠ세번째 관람인데도 그 감동은 변함이 없습니다!린지님 가창력 너무 좋으셔서 깜짝놀랐네요??,2019.04.08
