musical_title,rate,review_title,review_text,review_date
뮤지컬 〈영웅〉 10주년 기념공연,5,영웅은....정말 최고!,영웅은....정말 최고! 감동의 눈물....,2019.03.21
뮤지컬 〈영웅〉 10주년 기념공연,5,깊은 울림의 영웅,양준모는 안중근이다.. 깊은 울림이 있는 영웅.. 세종문화회관이 최적의 공연장인듯!,2019.03.21
뮤지컬 〈영웅〉 10주년 기념공연,5,배우분들의 멋진 연기 잘 보고왔습니다!,"꼭 보고싶었던 뮤지컬인 영웅 엄마와 단둘이 오랜만에 나선 문화생활이었는데,보면서 배우분들의 연기와 노래에 감동하고,또 웅장한 오캐스트라의 연주까지 너무나 좋았습니다.한국사를 공부하면서 배운 안중근의사를 좀 더 자세히알게 된 것 같아서 좋은 시간이었습니다.이렇게 잠깐이나마 그분을 기억하고 또 그 마음을잊지 않고 살아갈 수 있게 좋은 뮤지컬을 만들어주셔셔 감사해요!",2019.03.21
뮤지컬 〈영웅〉 10주년 기념공연,5,정말 잘 보고왔습니다! 앙상블 최고!,"공연 정말 잘봤어요! 양준모님 타임이라 예매한거였는데 배역 하나하나 앙상블까지 정말 멋졌습니다! 중간에 기술상의 오류로ㅎㅎ 멈추긴했지만, 정말 멋진 공연 감사했습니다",2019.03.21
뮤지컬 〈영웅〉 10주년 기념공연,5,언제보아도 최고인 영웅,"초연 이후 10년만에 다시 만난 우리의 안중근은 여전히 패기 넘치고 단단한 우리의 영웅이었습니다.31살 젊은 나이에 스스로 선택하기에는 어려운 길을 가는 그의 여정이 보는내내 뭉클하고 안쓰럽고 위대해보였습니다.같이 동행한 동료들에게는 벅찬 감동을 주었고, 저에겐 감동 뿐만 아니라 큰 깨달음 또한 주었습니다.매 공연때마다 혼신의 힘을 다하시는 정성화 배우님.배우님이 있어 뮤지컬을 사랑하는 사람의 한 사람으로 너무 행복합니다. 앞으로도 오래도록 좋은 공연으로 저희를 만나주세요.어제 공연에서 좋은 연기 보여주셨던 모든 배우님들께 감사의 인사를 전합니다.",2019.03.21
뮤지컬 〈영웅〉 10주년 기념공연,5,창작뮤지컬이 이렇게 좋을 수 있다니,"별 기대 없이 명성이 있길래 한 번 보려고 갔는데, 다른 라이센스 공연들에 견줘도 손색 없을 정도였습니다. 창작뮤지컬이 이렇게 좋을 수 있구나를 느꼈고, 넘버 이외에도 안무 씬도 많아 눈이 돌아갈 정도로 열심히 봤습니다. 양준모 배우님 공연을 이번에 처음 보고 공연 내내 계속 감탄을 금치 못했습니다. 1막에서 2막 치닫을 수록 점점 배우님이 아니라 도마 안중근 그 자체 같은 느낌이었고, 마지막에 쏟아부으시는 넘버가 인상적이었네요!",2019.03.21
뮤지컬 〈영웅〉 10주년 기념공연,5,역시는 역시!!!,초연 공연 이후 10년만에 관람한 영웅!! 이미 관람함 공연이라 절대 울지 않을 가라고 호언 장담 했으나.... 결국......T^T아들의 수의를 지어보낸 안중근 의사의 어머님이 등장하는 씬은 정말 말로 표현 할 수가 없다. 수의를 지어보낸 어미도 그 수의를 입는 아들의 마음도 이해 할 수 없기에 ..... 그저 존경스러운 마음만 깊어질 뿐 극을 정말 잘 표현해 주신 정성화님을 비롯해 배우님들의 성량과 연기에 감동했고 김 여운이 남는 공연이었다,2019.03.21
뮤지컬 〈영웅〉 10주년 기념공연,5,무한 감동 받고 왔습니다,정성화 배우님 보러 갔는데 정말 기대 이상이었습니다출연하시는 모든 배우분들 대단합니다특히 일본군과 독립군의 쫓고 쫓기는 장면은 넋을 놓고 감상하였습니다앞으로도 좋은 공연 부탁드려요~♥,2019.03.21
뮤지컬 〈영웅〉 10주년 기념공연,5,꼭보세요,무대연출과 배우들의 연기 최고몸에 소름이 퍼집니다감동적입니다ㅜㅜ 저는 마지막에 눈물폭발..,2019.03.21
뮤지컬 〈영웅〉 10주년 기념공연,3,강렬했던 1부에 비해 급격히 지루한 요소가 다분했던 2부,그러나 1부의 강렬함에 남은 별들을 드립니다. 10주년이라는 뜻깊은 공연이었기도 했구요. 귀에 익은 노래들과 무대장치나 구성이 좋았구요. 2부에 지루한 요소는 자칫 좋았던 1부를 다 망칠 수도 있었지만 긍정적으로 생각하려고 합니다. 좋았네요.,2019.03.21
뮤지컬 〈영웅〉 10주년 기념공연,5,최고였고 감동이었고 감사한 시간이었어요.ㅠㅠ,"어제 20일 낮공 양준모 배우님으로 이제야 보게 된 영웅!! 너무 잘봤습니다. 눈물콧물 범벅돼서 힘들기도 했지만  나라를 위해 희생했던 많은 순국선열 분들에 대한 감사함과  혼신을 다한 열연으로 공연을 올려주신 모든 배우분께 감동받고 감격했던 귀한 시간이었습니다. 양준모 배우님 감동스런 열연과 함께 노래 원래도 엄청나시신거 알지만..  (엉뚱한 사담인데 양지킬 컨프롱을 무대에서 다시 보고 싶은..ㅠ) 어젠 정말 세종 지붕 뚫는 줄 알았어요!! 절로 동공확대 심장떨림..!!  혼신을 다해 표현해 주셔서 정말 감사합니다.  정말정말 감동스러웠습니다.ㅠㅠ 최고!! bbdd 그리고 이정열 배우님 역시역시 믿보배 최고시고!!  재은 배우님도 너무 좋았고.. 아~~ 다~~  모든 배우님들이 정말 다 너무 좋았네요.  무엇보다 앙상블 배우님들!! 박수에 또 박수를 드려요. 진짜진짜 최고셨습니다. 대단했습니다.!!  체력적으로 많이 힘들텐데 몸조심, 안전하게 공연하시길..  좋은 공연 올려주셔서 다시한번 감사드리고 어제 감동이 넘 컸어서 양중근의 영웅 한번 더보려고 또 예매를 했습니다.  많은 사람들이 봤음 좋겠어요. ^^ 강력 추천합니다.",2019.03.21
뮤지컬 〈영웅〉 10주년 기념공연,5,한국창작뮤지컬의 빛,한국 창작 뮤지컬이 브로드웨이 뮤지컬에 견주어 손색이 없는다는 것을  입증하게 한 작품입니다. 정말  훌륭하고 감동적인  뮤지컬입니다.,2019.03.21
뮤지컬 〈영웅〉 10주년 기념공연,5,좋았습니다,좋았습니다 특히 추적씬은 너무 좋더라구요! 다음에 또 보러갈 생각입니다,2019.03.21
뮤지컬 〈영웅〉 10주년 기념공연,5,정성화배우님 너무 좋았습니다,최고의 공연 감사합니다.,2019.03.21
뮤지컬 〈영웅〉 10주년 기념공연,5,퀄리티 높은 공연이었습니다~,예매할 때 원하는 좌석이 없어서 앞에서 5번째 좌석에 앉게 되었는데요.. 엄청 가까웠지만  고개를 들고 봐야하는 거아닌가 힘들겠네..라고 처음에 생각했어요.. 그런데 공연 시작된 후로는 별 무리 없이 재밌게 관람할 수 있었습니다.  배우분들 모두 노래도 잘 부르시고 연기도 잘하시네요. 어머니 모시고  좋은 경험한 것 같아 기분이 좋았습니다.   참!! 아쉬웠던점은 공연 시작한지 좀 됐는데 프로그램북이 없다고 해서 아쉬웠어요.. 그래도  3월 21일 부터는 판매한다고 하니 오늘 이후부터 보시는 분들 기념으로 한부 구매하시는 것도 나쁘지 않을 듯 합니다.,2019.03.21
뮤지컬 〈영웅〉 10주년 기념공연,5,재미있게 봤습니다.,당시 안중근의사의 나이와 비슷해서  나라면 저렇게 할 수 있을까  비교해보며 보다보니 더 몰입해서 볼 수 있었던거 같습니다.  많은 분들이 보시면 좋을 거 같아요,2019.03.21
뮤지컬 〈영웅〉 10주년 기념공연,5,꼭 봐야할 뮤지컬 영웅,정성화 배우님 캐스팅 일정에 맞춰 예매했고  아주 재밌게 뮤지컬 관람했습니다.,2019.03.21
뮤지컬 〈영웅〉 10주년 기념공연,4,10주년 영웅,좋았네요,2019.03.21
뮤지컬 〈영웅〉 10주년 기념공연,5,남편과 잊지못할 추억♥,"한국에 휴가 차 남편 생일 겸 특별한 선물을 하고 싶어서 친구가 강추 한 영웅 뮤지컬을 보게 됬습니다.  믿고보는 정성화 배우님의 첫 뮤지컬을 보게 됬는데 말로는 설명 할 수 없을정도로 다른 배우분들과 캐미 뿐만 아니라 무대  장악력까지 2시간 반이 어떻게 지나갈지 모를정도로 흠뿍 빠진 뮤지컬이였어요!&#9786;  한국에서 처음 뮤지컬을 본 남편도 기대 이상으로 감동이였다고 얘기해줘서 제가 더 뿌듯했답니다.  음악을 사랑하시는 부모님 꼭 모시고 다시 한번 관람하고 싶어요! 아직 관람 전이신 분들은 사랑하는 가족,친구분들과 꼭 한번 보시길 강추 드려요:)",2019.03.21
뮤지컬 〈영웅〉 10주년 기념공연,5,안중근=정성화,살아 돌아온듯한 연기,2019.03.21
뮤지컬 〈영웅〉 10주년 기념공연,4,최고 최고,"많은 뮤지컬을 보았지만,후기 남기고 싶은 뮤지컬장면 하나하나가 음악과 연기 혼연일체가 돋보였다.있지말아야할 소중한 작품",2019.03.21
뮤지컬 〈영웅〉 10주년 기념공연,2,조금은 남들과 다른 후기..,"3개월 전 나는 영웅 뮤지컬을 우연히 검색하고는 다시한번 무대가 시작된다는 말에 바로 예매를 했다. 일전에 영웅 뮤지컬을 보고싶었으나 사정과 일정이 여의치 못해서 결국 막을 내릴때 까지 볼 수 없었다.  그러던 어느날 우연히 열린음악회에서 ''누가 죄인인가''를 보게되었고, 그 때 느낀 전율과 감동은 결국 다음에 기회가 된다면 반드시 보리라는 다짐을 하게 되었다.  그리고 3월 20일자의 공연을 예매하고 3개월을 기대하며 또 기대하며 기다렸다.  그러나 기대가 크면 실망이 큰것일까.. 단지 애국심만으로 안중근 선생님의 민족적 영웅의 모습으로 이 뮤지컬 전체를 미화하기에는 너무 아쉬움이 많았다.  우선 영상처리와 음향시설, 오케스트라는 매우 뛰어났다. 그러나 이 공연은 3명의 프로가 40명의 아마추어를 끌고가는 느낌을 지울 수가 없었다.  집중하려고 하면 들려오는 불안한 음정 몰입하려하면 들리는 노래의 불협화음 주연 배우의 억지스럽고 과도한 바이브레이션(주연배우가 몰입을 방해할 줄은 상상도 못했다..) 전달되지 않는 가사 지속 반복적으로 노치는 가사 불안한 호흡처리  몇몇 정말 뛰어난 배우들의 솔로에서 감동하고 몰입하려고 하면 어김없이 등장하는 불안한 모습들..  그러나 그 가운데서 ''누가 죄인인가'' 이 파트는 정말이지 TV에서 보던 모습보다도 더욱 감동적이었다. 이 파트만 열심히 연습했나 싶은 비약이 들 정도로....  그리고 한가지 강하게 비판하고 싶은 것은 옥중에서 꼭 담배불을 붙여주고 피우는 모습이 필요했을까 하는 점이다. 아이들도 볼 수 있는 것으로 아는데 꼭 그 장면이 필요했을까. 내가 본게 맞다면 실제로 피운것 같던데 코의 점막이 예민해서 평소 절대로 흡연을 하지 않는 입장에서, 1층 적당히 뒷열에 앉은 나에게까지 담배의 냄새가 퍼져와서 매우 불쾌했다.  기대가 너무 컷던것일까... 아니면 오늘 하필 배우들의 컨디션이 좋지 않았던 것일까..  아쉬운 마음을 감출 수 없었다.",2019.03.21
뮤지컬 〈영웅〉 10주년 기념공연,5,내 인생은 영웅을 보기 전과 후로 나뉜다,"게으른 제가 후기를 쓰게 만드네요 기어이.. 돈은 제가 냈지만 이런 공연 만들어주셔서 감사합니다. 고3이라 이번 뮤지컬을 마지막으로 올해는 공연 안보기로 다짐했는데, 아무래도 그냥 회전문 돌아야겠습니다. 그땐 꼭 프로그램북도 살거에요. 오늘 너무너무 사고싶었는데 안 팔길래 속상했어요. 왜 돈을 쥐어드리고싶어도 받아주질 않으세요ㅠㅠ 공연은 진짜 흠잡을 곳이 없었습니다. 아, 내가 이맛에 뮤지컬 보는구나 오늘 새삼 다시 느꼈습니다. 넘버도 정말 버릴게 하나도 없어요. 그러니까 음원 내주세요. 그리고 연출 정말 기가 막혔습니다. 특히 독립투사들이 일본 순사들에게 쫓기는 장면을 안무로 표현한 부분은 침흘리면서 봤어요. 게이샤들이 부채춤 추는 씬도 인상깊었고, 누가 죄인인가는 당연히 정말 최고입니다. 그리고 조명 활용도 정말 기가 막혔어요. 내용은 대한민국 국민이라면 다 알법한 내용이라 오히려 이해나 공감을 통한 몰입이 쉬웠던게 장점 같습니다. 그리고 정성화 배우님은 뭐 당연히 쩌는거 알고 있었고, 다른 배우분들도 실력구멍이 하나도 없어서 좋았습니다. 또한 앙상블이 얼마나 중요한 역할인지 깨달았습니다. 앙상블 분들이 진짜 멋지고 그렇습니다.. 사실 원래 나름 제 인생 뮤지컬이라고 생각하는 뮤지컬이 있었습니다. 하지만 제가 영웅을 봐버린 이상, 영웅은 제 인생 뮤지컬이 될 수밖에 없습니다. 횡설수설 한 것 같습니다. 이새끼는 왜이렇게 오버하지?라는 생각이 들 것 같은 후기입니다. 그런데 어쩔 수 없어요 자꾸 무대가 눈앞에 아른거려요. 빨리 재관람해야겠습니다. 그냥 오픈런 해주시면 안돼요?ㅠㅠ",2019.03.21
뮤지컬 〈영웅〉 10주년 기념공연,4,솔직히 처음엔 기대가 하나도 안되더라구요,근데 정성화 배우님 너무 멋있었어요,2019.03.21
뮤지컬 〈영웅〉 10주년 기념공연,5,좋으네요 김문정 마에스트로,중간에 멈춤이 있었지만 좋았네용김문정 마에스트로 짱 입니다,2019.03.21
뮤지컬 〈영웅〉 10주년 기념공연,4,조마리아 역을 맡은 배우님의 넘버가 인상적,"2막이 좋았어요. 특히 안중근이 재판장에서 발언하는 씬, 옥중에서 동양평화론 집필하는 씬, 원래 조마리아 여사께서 아들에게 남긴 편지를 노래로 재탄생시킨 씬이 좋았어요.",2019.03.20
뮤지컬 〈영웅〉 10주년 기념공연,5,"감동, 당연 적극 추천합니다!","정성화 님의 팬이어어 다른 뮤지컬은 많이 봤지만 이상하게 영웅과는 연이 닿지 않았었어요. 그래서 정배우님 영웅 보는 것이 버킷리스트였는데 드디어 성공했네요!정성화 님의 감동적인 연기와 노래는 물론이고 다른 배우님들, 스토리도 대박이었습니다. 그리고 일본역 배우님들과 앙상블 분들도 참 잘하셨는데, 괜히 일본이 얄미워서 박수가 안 나오더라고요. 뒤늦게 감사의 박수 보내드립니다!영웅 10주년 공연 잘 마무리 하시고, 좋은 공연 준비해주신 모든 분들 감사합니다♡",2019.03.20
뮤지컬 〈영웅〉 10주년 기념공연,5,전율과 감동 !! 꼭 보세요^^,"정성화배우님 노래도 잘하시고 정말 멋지세요^^매 순간 전율과 감동이 느껴졌고 울기도 했답니다 ㅠ지금 우리가 이렇게 살아갈 수 있게 해준 안중근의사에게잠시나 감사의 인사를 맘속에서 했네요,,다른 배우님들도 모두 멋지게 연기하셔서 감동이 배가 되었습니다^^ 다시보고싶네요~ 10주년 멋지게 마무리하시구요^^ 모두 수고많으셨습니다^^ 홧팅!!",2019.03.20
뮤지컬 〈영웅〉 10주년 기념공연,5,최고최고!!,"영웅 메인곡들, 군무도 웅장하고세종문화회관 음질도 역시 최고!!정성화 배우님도 최고십니다!!그날을 위하여~~~~~~",2019.03.20
뮤지컬 〈영웅〉 10주년 기념공연,5,정중근 정설희,"방금 정중근 보고 나왔습니다.연출이며 배우들이며 진짜 완벽한 뮤지컬이네요.킹키부츠의 성화롤라, 성화팬텀도 짱이였는데 졍중근은 진짜 최고중의 최고입니다. 정재은 배우님도 넘 잘하시구 앙상블팀도 훌륭하시고.. 사랑해요 정성화~♡♡♡",2019.03.20
뮤지컬 〈영웅〉 10주년 기념공연,5,진짜 꼭보세요 꼭이요!,작년부터 보고 싶었는데 표 없어서 못 보고 이번에 운좋게양준모배우님 회차랑 정성화배우님 회차 둘다 예매했습니다. 오늘 양준모님 회차봤는데 진짜 안보신분들 꼭꼭 보세요. 진짜 시간순삭이예요! 진짜 최근에 본 뮤지컬들 중에 극 퀄리티며 배우님들 연기이며 어디 나무랄 곳이 없는 최고의 뮤지컬이였어요! 배우님 및 스태프분들 남은 기간도 힘내셔서 10주년 잘 마무리 하시길 바랍니다!  : ),2019.03.20
뮤지컬 〈영웅〉 10주년 기념공연,5,뮤지컬 본것중 최고,정말 전체적으로 완벽하다고 느꼈어요 최고입니다,2019.03.20
뮤지컬 〈영웅〉 10주년 기념공연,5,오랜만에 인생극봤네요,"이건 정말이지 갓극이네요~ 양준모배우님과 정재은배우님은 말할것도없고 모든배우님과 앙상블배우님들까지 제가 본 어떤공연보다 완벽했어요~ 이런극을 이제서야 접한 제가 답답하네요~ 연기, 스토리, 넘버, 무대 모든면에서 완벽한 공연이였습니다~ 이런 완벽한공연을 볼수있게해주셔서 감사합니다~ 담주에 재관람할게요~^^",2019.03.20
뮤지컬 〈영웅〉 10주년 기념공연,5,흐르는  눈물,흐르는  눈물을 주체할수  없었음우리  아들에게  꼭 보여주고  싶음,2019.03.20
뮤지컬 〈영웅〉 10주년 기념공연,5,다시 한번 좀 더 가까이에서 보고 싶은 뮤지컬,세종문화회관 대극장에 울려퍼지던 정성화 배우님의 목소리가 아직도 생생하네요. VIP였지만 맨 끝자리라 배우님들 얼굴이 잘 안보여서 조금 아쉬웠어요. 다시 재관람 하고 싶어 예매했습니다. 감옥에서 어머니의 편지는 눈물이 나올만큼 슬펐어요.강추합니다. 인생에서 꼭 한번은 봐야할 뮤지컬 같아요.,2019.03.20
뮤지컬 〈영웅〉 10주년 기념공연,4,영웅 10주년,역시 양준모........라는 말이 저절로 나오네요ㅜ 큰 세종문화회관을 양준모 배우님의 성량으로 가득 채웠어요.앙상블배우님들도 무술(?)같은 큰 액션동작들이 많아서 엄청 고생하셨을거같아요,2019.03.20
뮤지컬 〈영웅〉 10주년 기념공연,5,감동입니다ㅜㅜ,대한독립을 위해 희생하신 모든분들께 감사합니다,2019.03.20
뮤지컬 〈영웅〉 10주년 기념공연,5,죽은 심장을 뜨겁게!!!!,"해마다 올해는 꼭 봐야지 하다가 무슨 이유에선지 늘 놓쳤다. 그래서인지 숙제같은 공연이였는데 이번에 드디오어 그 숙제를 마무리했다.  한동안 무기력증에 스스로 힘들어했는데,,,, 이 공연으로 나의 숨죽인 심장은 제대로 움직이기 시작했다. 쿵쾅! 쿵쾅!  내 인생을 다시 한번 열정적으로 살게 할 심장을 살려줘서 고맙고 눈물나는 공연이다. 인제는 해마다 심폐소생술로 ""영웅"" 을 보게 될 것 같다.",2019.03.20
뮤지컬 〈영웅〉 10주년 기념공연,5,지금 우리가 있기까지,많은 분들의 희생이 있었다는 것을 ! 연기와 노래로 그리고 무대장치까지 너무 잘 표현되어서 좋았습니다.  첫 도입부터 가슴이 먹먹해서 시간 가는줄 모르고 몰입해서 봤어요.  &#128077;&#128077;,2019.03.20
뮤지컬 〈영웅〉 10주년 기념공연,5,눈물만낫네요,정말..,2019.03.20
뮤지컬 〈영웅〉 10주년 기념공연,4,양준모가 신의 한수,다른 인물들의 서사가 너무 많아서 루즈합니다. 게다가 제가 본 날은 공연중에 사고까지 있었죠..ㅠㅠㅠ 하지만 모든것을 양준모 배우가 날려주네요  양준모 최고 양준모 포에버,2019.03.20
뮤지컬 〈영웅〉 10주년 기념공연,5,강추합니다,폭발적인 가창력과 빠르게 진행되는 모든 배우들의 활기찬 모습까지 한시도 눈을 뗄 수 없게 만들었으며 중간에 기계적인 오류로 공연이 잠시 중단되었지만 그 시간마저 감동의 여운을 뺏을순 없었다시간이 너무 빨리 지나간듯 한 느낌까지 들게하였다 음악과 조명 무대 배우들의 연기가 혼연일체가 되었다고 감히 말하고 싶다아직 관람하지 못하신 분에게는 꼭 추천드리고 싶다그리고 되도록이면 꼭 좋은 좌석을 추천한다그만큼 감동이 클테니까요,2019.03.20
뮤지컬 〈영웅〉 10주년 기념공연,5,강추합니다,폭발적인 가창력과 빠르게 진행되는 모든 배우들의 활기찬 모습까지 한시도 눈을 뗄 수 없게 만들었으며 중간에 기계적인 오류로 공연이 잠시 중단되었지만 그 시간마저 감동의 여운을 뺏을순 없었다시간이 너무 빨리 지나간듯 한 느낌까지 들게하였다 음악과 조명 무대 배우들의 연기가 혼연일체가 되었다고 감히 말하고 싶다아직 관람하지 못하신 분에게는 꼭 추천드리고 싶다그리고 되도록이면 꼭 좋은 좌석을 추천한다그만큼 감동이 클테니까요,2019.03.20
뮤지컬 〈영웅〉 10주년 기념공연,5,시작과 끝을 온몸의 전율과 함께,정말 보고싶었던 작품 입니다후회하지않을 감동과 환희와 전율과정성화 배우님을 비롯한 모든 배우분들과스탭진 분들께 제가 이 작품을 만날 수 있게 해주셔서감사하다는 말씀 드립니다남은 공연도 잘 부탁 드립니다저는 재관람 다시 예매하러 갑니다,2019.03.20
뮤지컬 〈영웅〉 10주년 기념공연,5,처음으로 울면서 봤던 뮤지컬,youtube 동영상으로 정성화 배우님께서 부르신 누가 죄인인가를 보고 예매했던 기억이 납니다. 안중근 의사 역을 맡으신 정성화 배우님을 포함해서 다른 분들 모두 보는 내내 배역을 연기하는 것이 아닌 배역 그 자체가 되셨던 것 같다는 생각이 드네요.,2019.03.20
뮤지컬 〈영웅〉 10주년 기념공연,5,대한민국 국민이라면 꼭 봐야합니다,"뮤지컬 주연배우만의 실력으로 이끌어가는 뮤지컬이 아닌, 모든 배우들, 음악, 조명, 안무가 모두 어우러지는놀라운 공연이었습니다벌어진 입을 다물 수가 없었어요..",2019.03.19
뮤지컬 〈영웅〉 10주년 기념공연,5,정말 꼭 한 번쯤은 봐야할 작품입니다!,"모든 넘버들이 버릴게 하나도 없는 최고의 넘버들이었으며, 조마리아 역의 배우님께서 노래하실 때는 저를 포함한 많은 관객들이 눈물을 훔치느라 바빴습니다. 시작부터 끝까지 먹먹한 작품이었습니다. 다음에도 또 관극하고 싶어요!!",2019.03.19
뮤지컬 〈영웅〉 10주년 기념공연,5,양준모배우니은 사랑이죠,3년전 본 내용과 달랐고내용적인면은 조금 지루함이 느껴졌는데양준모배우닝가창력으로 이겨냈어요,2019.03.19
뮤지컬 〈영웅〉 10주년 기념공연,5,진짜 최고입니다!!!,"영웅 진짜 대박 최고 입니다~!! 공연보는 내내 가슴이 벅찼고, 애국자가 된것 같습니다! 이러한 뮤지컬을 제작해주셔서 정말 감사합니다!!! 대한민국 만세!!!! 그리고 양준모 배우님 고맙습니다~!",2019.03.19
뮤지컬 〈영웅〉 10주년 기념공연,5,꼭 보세요!!!ㅠㅠ,너무 감동입니다양준모 배우님 그리고 모든 배우분들 대박입니다 ㅠㅠ우리나라의 역사를 잊지 않겠습니다 대한민국만세!!!!,2019.03.19
뮤지컬 〈영웅〉 10주년 기념공연,5,진짜 최고였어요,역시 역시!! 왜 정중근 하는지 알 수 있었어요. 정성화님의 공연은 처음이었는데 정말 소름이 쫙~~~ 더불어 남앙상블들의 박진감 넘치는 연기까지 어느 것 하나 놓치지 않고 눈과 귀에 담으려 엄청 노력했어요 ^^ 모두들 최고였어요!!,2019.03.19
뮤지컬 〈영웅〉 10주년 기념공연,5,누가 죄인인가,도마 안중근은 이야기 한다.  누가 죄인인가?  옥사에 있는 독립운동가가 죄인인지? 그들이 그렇게 할 수 밖에 없게 만든 이들이 죄인인지 도마 안중근의 어머니의 인간적 내면을 보게 만든 노래에 참았던 눈물이 흐른다.   아직도 돌아오지 못하여 비여 있는 가묘에 다시 돌아오시기를 바란다.   정성화 주연의 뮤직컬 영웅은 그 뿐만 아니라 출연진 모두의 힘과 절망과 고뇌가 느껴진다.  다시 관람하고싶은 몇 안되는 뮤직컬 목록으로 정리해야 할 듯하다.,2019.03.19
뮤지컬 〈영웅〉 10주년 기념공연,5,1년만에 재관람인데 역시나 감동입니다!,정성화님 역시.. 작년에 보고 또 봐도 국내 정상급 뮤지컬배우답게 역할 소화를 잘 하시네요~! 우리나라 역사의 한 획을 이렇게 멋진 뮤지컬로 옮겨담아주셔서 감사합니다^^,2019.03.19
