musical_title,rate,review_title,review_text,review_date
뮤지컬 〈디아길레프〉,5,너무 재밌는 페어,"민찬 니진이 매번 안무 바꿔오고 연습하는게 눈에 보여서 너무 좋습니다. 매주 부족한 부분들이 점점 없어지고 발레나 연기, 노래 하나 빠짐없이 하는게 너무 좋아서 계속 보게 되네요",2022.04.23
뮤지컬 〈디아길레프〉,5,너무너무 재밌어요,이런 극이 올라온다는게 너무 재밌고 소중한 것 같아요,2022.04.23
뮤지컬 〈디아길레프〉,5,최고의 배우 최고의관극,최고의 배우 최고의관극,2022.04.23
뮤지컬 〈디아길레프〉,5,최고!!!,나와서 다음 표 예매함! 최고!!!,2022.04.23
뮤지컬 〈디아길레프〉,5,미쳤다,진짜 오늘 미쳤어요 완전 디아길레프 진짜 다 미쳤어요ㅠㅠㅠ 와ㅠㅠ 어떻게 이럴 수 있죠ㅠㅠㅠ 마지막에 조명 늦게 꺼주는 것 까지 그냥 다 완벽!! 하ㅠㅠㅠ 진짜 이럼 안돼요ㅠ 이렇게 잘하고 재밌고 세상 멋진거 다 하면 안돼요ㅠ,2022.04.23
뮤지컬 〈디아길레프〉,5,이 돈 주고 봐도 되나요,넘버도 좋고 특히 니진스키 캐스팅은 정말 탁월했던거 같아요. 스페설 커튼콜 무대 짧은거 말고 더 보고 싶어요..,2022.04.23
뮤지컬 〈디아길레프〉,5,미치겠어 브누아 너 때문에,눈빛은 별처럼 빛나고 순수하지만 어둡고 발랄하지만 기괴한 연기 가능한 박정원 브누아♡   낭만보다 현실이 중요하다고 외치면서도 디아길레프가 니진스키 후원자 막아버리려고 할 때 난 그렇게 못해! 하고 화내주고 니진스키 찾아가서 미안해하고 진심으로 걱정해주는 브누아 너무 따듯하고 누구보다 낭만적인 사람   그리고 박정원이 무대에서 부르는 길 진짜 엄청 심각하게 좋아요... 왜 어떻게 세상에 박정원도 브누아도 한명 뿐일까...슬퍼요.. 니진스키 뮤지컬엔 왜 브누아 없어요 내놔요ㅜㅜ,2022.04.23
뮤지컬 〈디아길레프〉,5,디아길레프,이런 극들이 대학로에 더 많이 올라오길,2022.04.23
뮤지컬 〈디아길레프〉,5,디아길레프,정말... 너무 좋은 공연이에요,2022.04.23
뮤지컬 〈디아길레프〉,5,좋아요!,카톡 쿠폰받고 충동예매 했는데 역시나 최고였습니나,2022.04.23
뮤지컬 〈디아길레프〉,5,재밌어요,브누아 보러 두번 오세요. 세번 오세요!!,2022.04.23
뮤지컬 〈디아길레프〉,5,최고의 공연,짱입니다 다들 많이 보러오세요,2022.04.23
뮤지컬 〈디아길레프〉,4,좋은작품,잘 봤습니다,2022.04.22
뮤지컬 〈디아길레프〉,4,재밌어요~,그런데 실존인물 이야기 아예 모르고 가면 조금 갑분 연애느낌 들수도....,2022.04.22
뮤지컬 〈디아길레프〉,4,추천,추천합니다.,2022.04.22
뮤지컬 〈디아길레프〉,5,ㅏㅏㅏ,ㅏㅏㅏ,2022.04.22
뮤지컬 〈디아길레프〉,5,ㅏㅏㅏ,ㅏㅏㅏ,2022.04.22
뮤지컬 〈디아길레프〉,5,ㅏㅏㅏ,ㅏㅏㅏ,2022.04.22
뮤지컬 〈디아길레프〉,5,ㅏㅏㅏ,ㅏㅏㅏ,2022.04.22
뮤지컬 〈디아길레프〉,5,ㅏㅏㅏ,ㅏㅏㅏ,2022.04.22
뮤지컬 〈디아길레프〉,5,성떼~성떼~,애드리브 진짜 역대급이엇어요,2022.04.22
뮤지컬 〈디아길레프〉,5,좋아요,넘버가 취향이었어요 무대도 예쁘게 쓰고,2022.04.21
뮤지컬 〈디아길레프〉,5,김종구 배우님,무대 서주셔서 감사해요 ㅠㅠ,2022.04.21
뮤지컬 〈디아길레프〉,5,재밌어요,무대가 너무 예쁩니다,2022.04.21
뮤지컬 〈디아길레프〉,5,재밌어요,중독되는 멜로디에 짱짱한 가창력에 너무 재밌게 잘봤어요,2022.04.21
뮤지컬 〈디아길레프〉,5,디아길레프 부어드세요,이렇게 재밌는데,2022.04.21
뮤지컬 〈디아길레프〉,5,참 좋다,"디아길레프 너무 좋다  감정표현, 서사, 넘버 멜로디까지 완벽!!!",2022.04.20
뮤지컬 〈디아길레프〉,5,디아길레프,재밌었어요,2022.04.20
뮤지컬 〈디아길레프〉,3,잘 봤습니다,한번쯤 보기에는 좋았던 것 같습니다,2022.04.20
뮤지컬 〈디아길레프〉,5,김종구 배우님 최고,배우님 진짜 천재신가요...?,2022.04.20
뮤지컬 〈디아길레프〉,5,미치겠어 디아길레프 너 땜에,요즘 들어 다른 극을 본 적이 없어~,2022.04.20
뮤지컬 〈디아길레프〉,5,단장님이 아름답습니다,그 아름다움~~~~,2022.04.20
뮤지컬 〈디아길레프〉,5,재밌어요,너무 재밌어요,2022.04.20
뮤지컬 〈디아길레프〉,4,재밌어요,재밌어요,2022.04.20
뮤지컬 〈디아길레프〉,4,다아길레프,조성윤배우의 깊은 감정연기와 제작진의 애정이 보이는 작품,2022.04.20
뮤지컬 〈디아길레프〉,5,추천합니다!,추천합니다!,2022.04.20
뮤지컬 〈디아길레프〉,5,재미있어요,배우분들의 열연이 인상깊었던 뮤지컬이었습니다,2022.04.20
뮤지컬 〈디아길레프〉,5,,&#128077;&#127995;&#128077;&#127995;&#128077;&#127995;&#128077;&#127995;,2022.04.20
뮤지컬 〈디아길레프〉,5,배우님들이,연기를 너무 잘하셔요 시간가는줄 모르고 집중해서 봤네요 다음엔 다른 디아길배우도 보러가고싶어요,2022.04.19
뮤지컬 〈디아길레프〉,5,넘버 최고!,배우분들 케미도 좋고 넘버도 최고였어요!!,2022.04.19
뮤지컬 〈디아길레프〉,5,잘 봤습니다,폴라도 받고 좋았어요,2022.04.19
뮤지컬 〈디아길레프〉,5,재밌었습니다.,굳굳잘 봤습니다.폴라까지 잘 받았어요.,2022.04.19
뮤지컬 〈디아길레프〉,5,강력추천합니다.,무대 연출이 너무 좋아요 조명사용도 넘 맘에 들구 버릴 넘버가 하나도 없네요!!,2022.04.19
뮤지컬 〈디아길레프〉,4,좋았습니다.,좋았습니다.,2022.04.19
뮤지컬 〈디아길레프〉,4,좋았습니다.,좋았습니다.,2022.04.19
뮤지컬 〈디아길레프〉,5,윱디아 너무 너무... ㅠㅠㅠ 최고예요,어쩜 이렇게 디아길레프의 삶에 공감하도록 표현하는지 윱디아 보러 오세요 짱짱맨,2022.04.18
뮤지컬 〈디아길레프〉,5,종구밴님 디아길레푸....,"자첫이었는데 정말 너어무 좋았습니다 ㅠㅠㅠㅠ 종구밴님 달리 보였어요 당신께 감사를, 네가 있는 밤, 길......등 넘버들도 정말 좋았어요 왜 이제 봤죠 ㅠㅠ 또 보러 와야지.....",2022.04.18
뮤지컬 〈디아길레프〉,5,꼭 보세요!,일단 넘버가 너무 좋고 조명 맛집입니다. 배우분들은 너무 잘하셔서 믿고 누구든 다 보시면 됩니다! 1층에서 한 번 보시고 2층에서도 한 번 더 보셨으면 좋겠어요 아무래도 조명 맛집이다 보니 2층에서가 더 조명이 잘 보이고 2층 무대가 있습니다!,2022.04.18
뮤지컬 〈디아길레프〉,5,발레뤼스의 별,그 아래 잠들수만 있다면 그걸로 됐어,2022.04.18
뮤지컬 〈디아길레프〉,5,발레에 남긴 발자취,사랑이 그를 움직였음을 너무 잘 보여주는 조성윤 디아길레프 신이다,2022.04.18
뮤지컬 〈디아길레프〉,5,니진스키의 입장도 들어보고싶다,너무 디아길 입장 극 아니냐며,2022.04.18
뮤지컬 〈디아길레프〉,5,이렇게 완성도 높은 작품이,대학로에 있다니 감동스러움,2022.04.18
뮤지컬 〈디아길레프〉,5,단장님 너무 좋아요 최고,단장님 너무 좋아요 최고,2022.04.18
뮤지컬 〈디아길레프〉,5,단장님 너무 좋아요 최고,단장님 너무 좋아요 최고,2022.04.18
뮤지컬 〈디아길레프〉,5,단장님 너무 좋아요 최고,단장님 너무 좋아요 최고,2022.04.18
뮤지컬 〈디아길레프〉,5,디아길레프,현석브누아랑 어쩌면 그렇게 매번 찐친모드인건지 ㅋㅋㅋㅋ 너무 좋아요! 순딩한 것 같지만 강한 브누아도 좋아요!,2022.04.18
뮤지컬 〈디아길레프〉,5,좋았습니다,정말 좋았습니다!! 또 보고싶어요ㅠㅠㅠㅠ,2022.04.18
뮤지컬 〈디아길레프〉,5,좋았습니다,"정말 좋았습니다! 제발 ost, dvd 내주세요ㅠㅠㅠㅠㅠㅠㅠㅠ",2022.04.18
뮤지컬 〈디아길레프〉,5,또 보고싶어요,또 보고 잇지만.... 디아길레프 보세요..,2022.04.18
뮤지컬 〈디아길레프〉,5,디아길레프 짱 ㅠ,"단장님사랑해요,, ㅠ ㅠ ㅠ ㅠ ㅠ ㅠ",2022.04.18
뮤지컬 〈디아길레프〉,5,좋았어요,좋았어요,2022.04.18
뮤지컬 〈디아길레프〉,5,추천합니다,추천합니다,2022.04.18
뮤지컬 〈디아길레프〉,5,찾았다 내 디아길,"마지막 티켓팅 때 성윤배우님 회차로 다 잡았어요ㅎㅎ 그냥 아, 이사람은 발레를 좋아할 것 같은 사람이다라고 느껴졌음ㅎ",2022.04.18
뮤지컬 〈디아길레프〉,5,다른 캐스팅도 궁금해요,공연 니진스키 이후에 디아길레프 라는 인물에도 관심이 생겼었는데 이렇게 뮤지컬로 또 만들어 주셔서 너무 좋네요 배우분들도 너무 잘하고 노래도 좋구요 악역인줄만 알았던 디아길레프한테도 감정이입을 할 수 있네요.. 너무 슬프고 재밌었어요,2022.04.18
뮤지컬 〈디아길레프〉,4,배경이 예뻐요.,흥미로운 내용이었고 배경이 예뻤습니다.,2022.04.18
뮤지컬 〈디아길레프〉,5,보면 볼수록~빠져들어,무대도 넘이쁘고 보면 볼수록 빠져드는극,2022.04.18
뮤지컬 〈디아길레프〉,5,좋았어요,좋았습니다.,2022.04.18
뮤지컬 〈디아길레프〉,5,좋아요!,좋아요!,2022.04.18
뮤지컬 〈디아길레프〉,5,좋아요!,좋아요!,2022.04.18
뮤지컬 〈디아길레프〉,5,좋아요!,좋아요!,2022.04.18
뮤지컬 〈디아길레프〉,5,&#120199;&#120199;&#120199;&#120199;&#120199;&#120199;&#120199;,&#120199;&#120199;&#120199;&#120199;&#120199;&#120199;&#120199;&#120199;&#120199;,2022.04.18
뮤지컬 〈디아길레프〉,5,연출이 아름다워요,특히 2층에서 한 눈에 보이니까 정말 아름다웠어요!,2022.04.18
뮤지컬 〈디아길레프〉,5,넘버좋아요,무대가 예쁘고 넘버도 아름다워서 계속 기억에 남는 공연입니다,2022.04.18
뮤지컬 〈디아길레프〉,4,무대가 너무 이쁜 공연,"한번쯤은 보세요~ 무대,연기 다 훌륭합니다",2022.04.18
뮤지컬 〈디아길레프〉,5,막이 올라가는 순간~,난 이별을 준비하네~,2022.04.18
뮤지컬 〈디아길레프〉,5,너무 좋았어요,너무 좋았어요너무 좋았어요너무 좋았어요너무 좋았어요너무 좋았어요너무 좋았어요너무 좋았어요너무 좋았어요너무 좋았어요너무 좋았어요너무 좋았어요너무 좋았어요너무 좋았어요너무 좋았어요너무 좋았어요너무 좋았어요너무 좋았어요너무 좋았어요너무 좋았어요너무 좋았어요너무 좋았어요너무 좋았어요너무 좋았어요,2022.04.18
뮤지컬 〈디아길레프〉,5,잘봤어요,니진스키도 기대돼요! 다들 디아길레프 많이 봐줬으면ㅠㅠ,2022.04.18
뮤지컬 〈디아길레프〉,5,잘봤어요,종구 단장님 너무 좋다....,2022.04.18
뮤지컬 〈디아길레프〉,4,재밌어요!,잘 봤습니다,2022.04.18
뮤지컬 〈디아길레프〉,5,니진스키의 3부작중의 디아길레프,니진스키보다 훨씬 더 채워진 서사들과 연출들이 모두 마음에 들었습니다. 이 극을 보니 다시 니진스키가 그리워지네요.,2022.04.18
뮤지컬 〈디아길레프〉,4,좋아요,좋아요,2022.04.18
뮤지컬 〈디아길레프〉,5,추천합니다!!추천합니다!!추천합니다!!추천합니다!!,추천합니다!!추천합니다!!추천합니다!!추천합니다!! 추천합니다!!추천합니다!!추천합니다!!추천합니다!! 추천합니다!!추천합니다!!추천합니다!!추천합니다!! 추천합니다!!추천합니다!!추천합니다!!추천합니다!! 추천합니다!!추천합니다!!추천합니다!!추천합니다!! 추천합니다!!추천합니다!!추천합니다!!추천합니다!! 추천합니다!!추천합니다!!추천합니다!!추천합니다!! 추천합니다!!추천합니다!!추천합니다!!추천합니다!! 추천합니다!!추천합니다!!추천합니다!!추천합니다!! 추천합니다!!추천합니다!!추천합니다!!추천합니다!!,2022.04.18
뮤지컬 〈디아길레프〉,5,제 단장님 찾은 것 같아요...,가벼운 느낌이 많아서 당황스럽긴 했지만 오늘 페어 유독 마음이 많이 갔던ㅠ,2022.04.18
뮤지컬 〈디아길레프〉,5,재밌게 잘 봤어요!,너무 재밌게 잘 봤습니다.,2022.04.18
뮤지컬 〈디아길레프〉,5,돈값하는 뮤지컬,조명이 너무 예쁘고 배우들이 너무 잘합니다!! 특히 정민찬 발레리노... 춤은 물론 연기도 노래도 정말 자연스러워요 니진스키 3연에서는 주연으로 보고 싶을 정도입니다!!,2022.04.18
뮤지컬 〈디아길레프〉,5,뮤지컬 디아길레프 최고의 페어,텐션부터 감정선까지 정말 너무 좋은 페어의 공연이었습니다. 뮤지컬 디아길레프는 구성이 참 좋은 극입니다.  앞으로 이 구성의 페어가 더 있다면 꼭 다시 보고싶습니다.,2022.04.18
뮤지컬 〈디아길레프〉,5,뮤지컬 디아길레프,재밌어요~,2022.04.18
뮤지컬 〈디아길레프〉,5,단장님..!,단장님이 너무멋있고 니진스키분이 춤을 너무 잘추셔서 좋았어요,2022.04.18
뮤지컬 〈디아길레프〉,5,디아길레프,내가 사랑했던 것들이 사랑받을수 있다면그걸로 충분해 모두 나를 떠나도 두렵지않아 그걸로 됐어,2022.04.18
뮤지컬 〈디아길레프〉,5,디아길레프,커튼콜은 끝났어 관객은 떠났고,2022.04.18
뮤지컬 〈디아길레프〉,5,넘버가 너무 좋아요,진짜 넘버만 들어도 2시간이 훅...,2022.04.18
뮤지컬 〈디아길레프〉,5,재미있어요~,노래도 좋고 발레도 멋져요~ 추천합니다.,2022.04.18
뮤지컬 〈디아길레프〉,5,넘버ㅜ넘 좋은,오슷내주세요,2022.04.18
뮤지컬 〈디아길레프〉,5,ㅠㅠㅠ,존잼... 영상 넘 이뻐여,2022.04.18
뮤지컬 〈디아길레프〉,5,대학로에서 3만원 주고 발레를 볼 수 있다?,민찬니진...정말 아름다움,2022.04.18
뮤지컬 〈디아길레프〉,5,무대 조명 넘버 맛집,2층에서 봐도 잘 보이고 무대 조명 너무 예쁩니다,2022.04.18
뮤지컬 〈디아길레프〉,5,너무 좋아요,재밌고 넘버랑 영상이 최고!,2022.04.18
뮤지컬 〈디아길레프〉,5,좋은공연 감사합니다,좋은공연 감사합니다,2022.04.18
뮤지컬 〈디아길레프〉,5,좋은공연 감사합니다,좋은공연 감사합니다,2022.04.18
뮤지컬 〈디아길레프〉,5,좋은공연 감사합니다,좋은공연 감사합니다,2022.04.18
뮤지컬 〈디아길레프〉,5,짱이에요,짱짱맨,2022.04.18
뮤지컬 〈디아길레프〉,5,또 보고 싶다,이 페어 너무 재밌다 자주 보고싶다,2022.04.18
뮤지컬 〈디아길레프〉,5,최고의 공연,마티네인데도 이렇게 재밌다니 보길 잘한 것 같습니다,2022.04.18
뮤지컬 〈디아길레프〉,5,멋있는 무대 좋은 넘버,극장에 들어가는 순간 무대에 압도되고 배우님들의 열연과 넘버에 빠져들게 됩니다.,2022.04.18
뮤지컬 〈디아길레프〉,5,미치겠어 디아길ㄹㅔ프..,너때ㅁㅐ......... 조성윤 디아길레프 짱..... 정민찬 니진스키 짱.....,2022.04.18
뮤지컬 〈디아길레프〉,5,댜길렢,연극 뮤지컬계의 벤츠는 브누아 이전과 이후로 나뉜다,2022.04.18
뮤지컬 〈디아길레프〉,4,대박나세요,나는 죽어있던 도화지에만개한 꽃들은 심어놨네 극장이 열리는 순간 이 향기가 관객을 홀리도록,2022.04.18
뮤지컬 〈디아길레프〉,4,발레뤼스,디아길레프니진스키브누아스트라빈스키천재들!!!,2022.04.18
뮤지컬 〈디아길레프〉,5,발레뤼스~~~ 러시아 발레단~~~~,아름다운 죽음 원시적인 생명~~~~~아트원 발레뤼스엔 천재들만 있다는 말이 사실인가봐요?  넘버랑 조명 다 너무 좋아요 ㅠㅠㅠ,2022.04.18
뮤지컬 〈디아길레프〉,5,하지만 네가 있는 밤,너의 모든게 날 위로 하네~~~~ 네가 있는 밤 넘버 진짜 너무 좋은ㅠㅠㅠㅠㅠ,2022.04.18
뮤지컬 〈디아길레프〉,4,디아길레프,무대랑 조명이 정말 예뻐요 2층도 잘 보입니다,2022.04.18
뮤지컬 〈디아길레프〉,5,미치겠어 디아길레프 너땜에~~~,아니 단장님 뭔데 이렇게 잘해요.... 성윤 현석 민찬 지훈 이 페어 뭔데 이렇게 잘 해요....? 이 페어 뭐지....?,2022.04.18
뮤지컬 〈디아길레프〉,5,조성윤 배우,조성윤 배우 정말 최고에요!!,2022.04.18
뮤지컬 〈디아길레프〉,5,조명이 너무 아름다워요,조명이 정말 최고네요,2022.04.18
뮤지컬 〈디아길레프〉,5,조성윤 디아길레프!!!,갈수록 촘촘해지는 디테일에 감동이 엄청납니다. 디아길레프를 이해하고 니진스키를 이해하고 그 담에 스트라빈스키를 이해하고...브누아의 극까지 기대해봅니다.,2022.04.18
뮤지컬 〈디아길레프〉,5,울지마,바보야나정말괜찮아,2022.04.18
뮤지컬 〈디아길레프〉,5,디아길레프에중.독.되.다,헤어나올수업는중독같은디아길래프대학로가허락한유일한마약,2022.04.18
뮤지컬 〈디아길레프〉,5,단장님 짱,미치겠어디아길레프너때매,2022.04.18
뮤지컬 〈디아길레프〉,5,디아길레프,미치겠어! 너때문에 너무 좋아요,2022.04.18
뮤지컬 〈디아길레프〉,5,재밌어요,미치겠어디아길레프너때문에,2022.04.18
뮤지컬 〈디아길레프〉,5,최고였어요,윱민찬 짱,2022.04.18
뮤지컬 〈디아길레프〉,5,지금 이순간은,온전한 나의 것~,2022.04.18
뮤지컬 〈디아길레프〉,5,너무 좋아요!!!,네가 있는 밤 너무 좋네요!!!,2022.04.18
뮤지컬 〈디아길레프〉,5,잘 보고왔습니다~,이벤트를 해서인지 극장이 가득차있으니 제가 다 기분이 좋네요ㅎ 그러니까 할인 좀 더 플어서 극장좀 메워주세요.. 저는 너무 재미있는데 맘이 좀 안좋네욮,2022.04.18
뮤지컬 〈디아길레프〉,5,태어나긴 했을까 존재하긴 할까,나는 앞으로 A열을 갈 수 있을까...,2022.04.18
뮤지컬 〈디아길레프〉,5,잘 보고왔습니다 넘버들도 너무 좋네요,"디아길레프 제외하면 다른 배우들은 솔로곡이 많지않은게 조금아쉽긴한데 이건 디아길레프 뮤지컬이니까,, 하우스 음악도 너무 좋아요 이공연이 더 잘됐으면 좋겠어요",2022.04.18
뮤지컬 〈디아길레프〉,3,디아길레프,잘 봤습니다 근데 페어별 공연시간이 좀... 그러네요 직장인들은 평일 마티네 가기 어려워요.,2022.04.18
뮤지컬 〈디아길레프〉,5,넘버 너무 좋아요,무대도 아름답고 안무도 아름답고... 발레를 왜 그렇게 사랑하게 됐는지 절로 알게되는 아름다움,2022.04.18
뮤지컬 〈디아길레프〉,5,디아길레프,"쇼플레이의 인물 연작이 무척 흥미롭네요 작년에 니진스키도 봤는데, 이번 디아길레프는 넘버나 짜임이 더 좋은 것 같아요 캐스팅 거의 유지한 채 곧 니진스키도 온다고 들었는데 보러 갈게요",2022.04.18
뮤지컬 〈디아길레프〉,5,잘 모르던 발레에 대해,관심이 생기고 찾아보게 되었어요,2022.04.18
뮤지컬 〈디아길레프〉,4,디아길레프,김종구 배우 최고,2022.04.18
뮤지컬 〈디아길레프〉,5,미치겠어 디아길레프,너땜에,2022.04.18
뮤지컬 〈디아길레프〉,4,디아길레프,넘버가 너무 좋습니다.,2022.04.18
뮤지컬 〈디아길레프〉,5,너무 아름다운 무대,영상과 조명 최고,2022.04.18
뮤지컬 〈디아길레프〉,5,무대영상과 조명이 정말 아름답고 넘버도 좋고,연기도 말해 뭐해요 추천합니다,2022.04.18
뮤지컬 〈디아길레프〉,4,디아길레프,김종구 배우님 너무 잘합니다.,2022.04.18
뮤지컬 〈디아길레프〉,5,나 발레 사랑하네....,마지막 넘버를 들으면 나 발레 사랑하네 하면서 나오게 돼요....,2022.04.18
뮤지컬 〈디아길레프〉,5,기대돼요,재밌어요,2022.04.18
뮤지컬 〈디아길레프〉,5,와아,와아ㅏㅏㅏㅏㅏㅏㅏㅏㅏㅏㅏㅏㅏ,2022.04.18
뮤지컬 〈디아길레프〉,5,세르게이...,역시 러시아 사람이 맞군요! 저도 러시아에서 태어났어요~!,2022.04.18
뮤지컬 〈디아길레프〉,5,네가 있는 밤,조명과 발레와 노래 전부 인상적인 무대였어요~!!,2022.04.18
뮤지컬 〈디아길레프〉,5,재밌어요,또 볼거에요,2022.04.18
뮤지컬 〈디아길레프〉,5,재밌었습니다!,"이전 니진스키를 좋아했던 사람이라면 분명 디아길레프도 좋아할것 같아요, 니진에서 본 디아길레프와는 조금 다른 면을 볼 수 있어서 재미있게 관람했습니다!",2022.04.18
뮤지컬 〈디아길레프〉,5,발레와 뮤지컬의 만남!,뮤지컬을 보러 갔는데 발레 퀄리티가 높아서 좋았어요!!,2022.04.18
뮤지컬 〈디아길레프〉,5,잘 보았습니다,잘 보았습니다,2022.04.18
뮤지컬 〈디아길레프〉,5,디아길레프,내가 진짜 디아길레프 처음 볼때만 해도 이렇게 회전 돌 줄은 꿈에도 몰랐다,2022.04.18
뮤지컬 〈디아길레프〉,5,뮤지컬 〈디아길레프〉,정말 재미있게 봤어요!!!!!!!,2022.04.18
뮤지컬 〈디아길레프〉,5,발레뤼스 사랑해요,발레뤼스 사랑해요디아길레프 단장님 사랑해요니진스키 사랑해요브누아 사랑해요스트라빈스키 사랑해요,2022.04.18
뮤지컬 〈디아길레프〉,5,디아,김종구 디아길레프 개짱임 왜안봐?,2022.04.18
뮤지컬 〈디아길레프〉,5,디아길레프,재밌어요 진짜 재밌어요 너무 재밌어요 진짜 재밌어요 이랗게 재밌어도 되나요? 완전 짱이에요,2022.04.18
뮤지컬 〈디아길레프〉,5,배우분들 합이 괜찮았습니다,재미있게 잘 봤고 넘버도 좋았어요 무대랑 영상도 예쁘고 너무 좋았습니다,2022.04.18
뮤지컬 〈디아길레프〉,5,발레뤼스,오슷주세요...,2022.04.18
뮤지컬 〈디아길레프〉,5,영상이랑 바닥 조명 너무 예쁘네요,진짜 매 장면마다 예쁜 영상과 조명이 너무 많아서... 눈호강 하는 기분이에요 넘버랑 어울리는...정말 예쁩니다!!,2022.04.18
뮤지컬 〈디아길레프〉,5,재밌어요,노래좋아요  김종구 박정원 최호승 정민찬배우님 최고예요,2022.04.18
뮤지컬 〈디아길레프〉,5,디아길레프,발레는 재판과 비슷해 생각을 증명하는 길,2022.04.18
뮤지컬 〈디아길레프〉,5,무대 영상 연출이 정말 아름다워요,넘버도 아름답습니다. 그리고 캐릭터들이 어떤 고민으로 어떻게 작품을 올렸고 어떤 식으로 극단을 이끌어나가는지 알 수 있어서 정말 좋았어요. 배우들의 연기가 인상적입니다...,2022.04.18
뮤지컬 〈디아길레프〉,5,공연 재미있게 잘 봤습니다,조금 변화를 주었으면 한 캐릭터는 변하지 않고  다른 캐릭터의 변화를 보았던... 그래도 좋았습니다 너무 재미있었어요!!,2022.04.18
뮤지컬 〈디아길레프〉,5,단장님 화이팅!!!!!!!,단장님들 너무 좋아요... 발레뤼스 짱!,2022.04.18
뮤지컬 〈디아길레프〉,4,"훌륭한 무대, 니진스키의 프리퀄",디아길레프와 발레뤼스의 역사니진스키를 통해 디아길레프를 알았고디아길레프는 다 없이 매력적이고정민찬배우의 니진스키 공연은발레를 보는 것 같았다,2022.04.18
뮤지컬 〈디아길레프〉,3,무대가 엄청 멋지네요,중소극장에서 보기드문 무대세트 굉장히 좋았습니다!,2022.04.18
뮤지컬 〈디아길레프〉,5,디아길레프,재미있어요,2022.04.18
뮤지컬 〈디아길레프〉,5,정말 재밌어요,"스토리도, 넘버도 다 너무 좋아요 짱짱",2022.04.18
뮤지컬 〈디아길레프〉,5,옙. 또봤습니다^^,하지만 네가 있는밤~~~~~~~~~~~~~~~~~~ 공연장 나오면서 계속생각나고.. 다음날도 생각나고.. 그다음날도생각나고.. 다시 볼수밖에없어요..,2022.04.18
뮤지컬 〈디아길레프〉,5,최고 최고!!!! 진짜 너무 만족했어요 ㅠㅠㅠㅠ,진짜 재미있게 봤고 민찬배우님 춤선 너무 예쁘네요 ㅠㅠㅠㅠ 영상이랑 넘버 너무 좋아요!!,2022.04.18
뮤지컬 〈디아길레프〉,5,디아길레프,재미있어요,2022.04.18
뮤지컬 〈디아길레프〉,5,너무좋아요 ㅠㅠ,단장님 진짜 최고에여.. 너무좋아요ㅠㅠㅠ 넘버진짜 너무좋고 뒤에영상이 진짜 예쁘거든요?? 약간 뒤에서 봐도 좋을것같아요.,2022.04.18
뮤지컬 〈디아길레프〉,5,디아길레프,브누아같은 친구 한명만 있어도 성공한 인생!,2022.04.18
뮤지컬 〈디아길레프〉,5,너무 좋아요 ㅠㅠㅠ,진짜 열일제쳐두고 달려와서 보길잘했어요.. 오늘 페어 너무좋았어요ㅠㅠㅠ,2022.04.18
뮤지컬 〈디아길레프〉,5,발레뤼~~~~~스 러시아 발레단!,넘버 중독성 쩔어요....,2022.04.18
