musical_title,rate,review_title,review_text,review_date
뮤지컬 지킬앤하이드 (Jekyll＆Hyde),5,신성록,스토리나 개연성은 정말루 내 취향 아니었지만 넘버는 좋았어요기대 안 했는데 연기도 좋고 성량도 나쁘지 않았음그리구 무대가 가까워서 그런지 오글 없이도 표정 잘 보였어요 (5열 중블),2022.02.04
뮤지컬 지킬앤하이드 (Jekyll＆Hyde),5,류지킬 역시는 역시~,류지킬 최고의 배우 입니다,2022.02.03
뮤지컬 지킬앤하이드 (Jekyll＆Hyde),5,감격과 감동 그 자체였습니다.,"청소년 딸과 함께여서 더 감격,감동이였습니다. 20대 조승우 배우님의 지킬앤 하이드를 너무너무 보고싶었는데요...20년도 더 지나 엄마가 되어 딸과 함께 ""지금 이 순간""을 보고 듣노라니 ㅎ 감격 그 자체였습니다.  어렵게 구한 티켓, 딸이 좋아하는 홍광호 배우님의 지킬 앤 하이드는 최고였어요 어느 공연보다도 대사 한마디 한마디가 또렷하게 들렸던 공연 이였구요~  엠마와 아버지의 주고 받는 장면에서는 걱정하는 자상한 아버지와  엠마의 부드러우면서도 걱정하지 말라는 다부진 표현에 눈물이 ㅎ 주르륵~ 엄마가 되어 보니 더 그런것 같았습니다.  이번 공연은 특히~~ 관람 중에도, 관람 후에도 내 안에 지킬과 하이드를 되돌아 보게 되었던 것 같아요 여운이 현재까지도 가시지 않아 구입하지 못한 CD를 후회했는데 재발매 소식을 접하고 바로 구매!! 오매불망 도착되기를 기다리고 있는 중입니다. 딸아이가 엄마 생일 선물로 결제해준 cd~~ㅎ 언능 듣고 싶습니당~  다음에 기회가 된다면 제가 좋아했던!! 지금도 믿고 보는 조승우님의 공연을 딸과 남편과 함께 꼭 볼 계획입니다^^",2022.02.03
뮤지컬 지킬앤하이드 (Jekyll＆Hyde),5,재미있게 관람했습니다,뮤지컬 지킬앤하이드 정말 재미있게 관람하고 왔습니다. 추천합니다!,2022.02.03
뮤지컬 지킬앤하이드 (Jekyll＆Hyde),5,홍지킬 압권,홍광호의 공연은 늘 그렇지만실망시키지 않는다. 개인적으로 힘든일 암선고를 받고 곧 검사와 수술을 앞두고 있는 나에게 내현실을 조금이라도 잊게 해준 시간이었어요.하이드로 변하게 되는 그순간 팔에 오소소 돋는 소름 남편은 그 순간 머리카락이 쭈뼛 서는 느낌이라고 말하더군요 ~ 멋진공연이었고데스노토도 기대합니다,2022.02.03
뮤지컬 지킬앤하이드 (Jekyll＆Hyde),5,홍광호 조정은 선민 짱,제가 좋아하는 캐스트를 드디어 보게되었는데  기대했던거만큼 재밌게 잘봤습니다,2022.02.03
뮤지컬 지킬앤하이드 (Jekyll＆Hyde),5,지킬앤하이드 A구역 9열,홍지킬을 드디어봤습니다 너무 좋았는데 좌석이 좀 아쉬웠어요 단차가 낮아서 앞사람 머리에 다 가려져 배우들 상반신만 봤습니다 ㅎㅎ,2022.02.03
뮤지컬 지킬앤하이드 (Jekyll＆Hyde),4,굿입니다~,홍광호 최고,2022.02.03
뮤지컬 지킬앤하이드 (Jekyll＆Hyde),5,홍광호 짱,홍광호 짱,2022.02.03
뮤지컬 지킬앤하이드 (Jekyll＆Hyde),5,강력추천합니다.,컨프롱은 진짜 최고예요!,2022.02.03
뮤지컬 지킬앤하이드 (Jekyll＆Hyde),5,마지막홍조선,못보는줄알고 두근거렸네 ㅜㅜ,2022.02.03
뮤지컬 지킬앤하이드 (Jekyll＆Hyde),5,지킬앤하이드 두번째 관람 입니다,역시 홍광호 배우님 ㅠㅠ  입벌리고 봤어요..무슨 말이 필요하겠습니까.. 최고..,2022.02.03
뮤지컬 지킬앤하이드 (Jekyll＆Hyde),5,너무 좋은 공연 봤습니다,류정한님의 공연은 역시 최고네요. 너무 좋은 공연 추천합니다,2022.02.03
뮤지컬 지킬앤하이드 (Jekyll＆Hyde),5,홍지킬 레전드,홍광호는 신이다. 연기 노래 모두 완벽해서 너무 감동했습니다!!!,2022.02.03
뮤지컬 지킬앤하이드 (Jekyll＆Hyde),5,홍지킬 레전드,뮤린이가 홍광호님의 지킬을 성공해서 보고왔습니다.왜 다들 홍지킬을 외치는지 알게되는 무대였습니다.처음 하이드만 단독으로 나오는 때에 10초 정도 하이드를 뚫어지게 쳐다봤습니다.저게 정말 홍광호님인지 헷갈렸기 때문입니다.다른 사람이라고 착각할만큼 목소리는 물론이고 체형과 키도 달라보였습니다.덕분에 잊을 수 없는 추억을 하나 더 만들고갑니다.,2022.02.02
뮤지컬 지킬앤하이드 (Jekyll＆Hyde),5,매우좋았습니다,오래간만에 본무지컬인데 정말 좋았네요. 류정한님 너무 잘하고 루시역맡으신분도 정말 잘하시고. 모처럼 힐링했네요,2022.02.02
뮤지컬 지킬앤하이드 (Jekyll＆Hyde),4,정말 재밌게 봤어요.,홍광호님이 아니면 안 보겠다는 의지로 몇 개월 기다려서예매 성공! 처음 등장할 때 살짝 실망했지만 엄청난 연기와 가창력으로 완전 무대를 평정하시네요. 홍광호님 다음 작품도 기대할게요. 피켓팅 한 보람이 있었어요. 여주인공은 엠마보다는 루시가 돋보이는 역할이긴한데 워낙 다른 캐릭터니까요. 민경아님도 좋았지만 저는 선민님이 더 기억엔 남네요. 잘 봤습니다. 근데 샤롯데씨어터 기대했는데 시설이 별로네요. 별 하나 뺀 건 다 샤롯데씨어터 때문입니다.,2022.02.02
뮤지컬 지킬앤하이드 (Jekyll＆Hyde),5,처음이라서 어쩔줄 몰랐던 나,객석 3층에서 봤는데 무대가 한눈에 다들어와요 배우님 얼굴은 어느정도 유추는 할수있었습니다 그래도 오글 가져가는게 필수겠죠..오글있는거랑 없는거랑 차이가 있습니다의자도 푹신해서 2시간 50분 공연 앉자있을만 했습니다 소극장 같은경우는 엉덩이가 아프더라고요 그리고 무대를 보면서 깜짝깜짝 놀라기도 했습니다..쫌 살짝 무섭기도 했고요..류정환 배우님은 연륜이있는 지킬을 연기한것 같아서 뭔가 초급부터 봐야 하는데 고급부터 본것 같은 느낌이 들었고요 연기는 두말할것 없이 잘하셨습니다 노래도 잘부르시고..선민배우님은 진짜 공연장가서 보고싶었는데 직접 보게 되서 너무 너무 좋았습니다 목소리도 좋은시고 연기도 잘하시고 할말이 없었어요..최고 진짜…조정은 배우님은 목소리가 우와 진짜..좋으시고 배우님 직접보고 관람하고 싶었는데 꿈을 이뤘네요~ㅎㅎ 연기는 당연히 잘하셨습니다…진짜 공연보면서 시간가는줄도 모르고 봤습니다 인터미션도 금방 돌아오더라고요..샤롯데를 처음가서 3~1층까지 사진찍으러 바빴습니다 그리고 공연보고 나와서 플북하고 스트립 샀는데 너무너무 행복했어요 다음달에 전동석배우님과 박은태 배우님 지킬하신다는 것에 공연을 못보러간다는것에 아쉬움이 남지만 후원라이브로 집에서 공연볼수 있는 날이 있기를 기대하겠습니다.. 진짜 공연보시면 후회는 안하실거에요!! 꼭보세요!!,2022.02.02
뮤지컬 지킬앤하이드 (Jekyll＆Hyde),4,지앤하,엄마랑 너무 오랜만에 보는 뮤지컬이었어요. 가변석 예약이 없어서 일층 뒤쪽이었던 저는 조금 더 쾌적하게 연극을 관람하였습니다. 그리고 지킬앤 하이드는 무조건 중앙이라고 해서 중앙에서 봤는데..멋졌어요.  모든 배우분들의 노래로 귀가 맑아진 기분이에요!  선민님 공연은 처음인데.. 팬 됐어요 ㅠㅠ 반하고 갑니다^^!,2022.02.01
뮤지컬 지킬앤하이드 (Jekyll＆Hyde),1,당일에 취소되면,어떻게 하라는건지.....,2022.02.01
뮤지컬 지킬앤하이드 (Jekyll＆Hyde),5,최고의 뮤지컬을 보여주셔서 감사합니다.,제일 보고 싶던 뮤치컬인데 겨우 보게 되었네요. 기대한 것 이상으로 눈과 귀가 호강하고 갔습니다. 감사합니다~,2022.02.01
뮤지컬 지킬앤하이드 (Jekyll＆Hyde),5,역시 최고,너무 재미있게 잘 봤습니다,2022.01.31
뮤지컬 지킬앤하이드 (Jekyll＆Hyde),3,배우들의 열연이 돋보였으나 음향사고 심각했던 공연,1부 초입부터 1부 내내 음향사고가 심각했어요. 계속 배우들 마이크가 꺼졌다 켜졌다 하고 불쾌한 지지직 소리도 나서 몹시 거슬렸습니다. 하지만 이에 당황하지 않고 열연을 펼친 배우들에게 감동했습니다. 부모님 모시고 다녀왔는데 공연장의 음향문제로 인해 아쉬웠네요.,2022.01.31
뮤지컬 지킬앤하이드 (Jekyll＆Hyde),5,아..신성록 앓이 시작..,아니..이렇게 매력 쩌는 분인지 이제사 알았다니.!너무 너무 멋찐거 아닙니꽈~~~연기도 연기지만노래도 늠 잘하시고최고네용~~ 완전 짱! 짱!,2022.01.31
뮤지컬 지킬앤하이드 (Jekyll＆Hyde),3,멋있었음,역시 ''지금 이 순간''은 현장에서 들어야함,2022.01.31
뮤지컬 지킬앤하이드 (Jekyll＆Hyde),5,믿고보는 홍지킬 &#128077;,16열 중앙에서 봤는데도 눙물이 앞을 가려 표정을 못보고 노래만 들었는데.. 이건 뭐 .. 오페라 글라스 안가져간게 천추의 한이 될거같아서 또 보러갑니다.. 기다려요 홍지킬...,2022.01.31
뮤지컬 지킬앤하이드 (Jekyll＆Hyde),3,마이크 상태가..,음향이 한두번도 아니고 10~20번 계속 끊어지고 ... 신성록 배우는 지킬일땐 평범했지만 하이드일땐 좋았습니다,2022.01.31
뮤지컬 지킬앤하이드 (Jekyll＆Hyde),5,역시 후회없는 관극이었어요,배우님들도 훌륭했고 재미있었어요,2022.01.31
뮤지컬 지킬앤하이드 (Jekyll＆Hyde),5,최고의 뮤지컬,가족 다 같이 보러 간 첫번째 뮤지컬인만큼 인지도 있고 재밌는 뮤지컬로 시작하고 싶었는데 지킬 앤 하이드를 선택하길 잘 한것 같습니다 배우님들도 너무 연기 잘하시고 하나 같이 무대장악력이 엄청나셔서 처음부터 끝까지 눈을 땔수가 없었어요 기회만 된다면 다시 예매해서 또 보러 가고싶네요 재밌게 잘봤습니다 :),2022.01.31
뮤지컬 지킬앤하이드 (Jekyll＆Hyde),5,연기에 빠져들고 노래에 감탄하였습니다,가족끼리 보고왔습니다 ㅎㅎ 신성록 배우님의 마스크가 지킬 박사와 너무 잘 어울렸습니다.  연기 뿐만아니라 귀도 즐거웠던 뮤지컬 이었습니다!,2022.01.31
뮤지컬 지킬앤하이드 (Jekyll＆Hyde),5,배우가 다 하는 공연,홍광호 배우님 포함해서 모든 배우님의 역량이 뛰어나고 눈호강 귀호강이 가능합니다극 자체는 그렇게 재밌나? 싶은데 노래 하나만 보고 가도 충분히 만족스러운 공연이에요,2022.01.31
뮤지컬 지킬앤하이드 (Jekyll＆Hyde),5,역시 지킬앤하이드,홍광호님 열연에 감동 받네요,2022.01.31
뮤지컬 지킬앤하이드 (Jekyll＆Hyde),2,연기가 어설퍼서 보기 힘들었습니다,대사가 이어지지 않고 전체적으로 다 어색해서 집중이 안됐어요.,2022.01.31
뮤지컬 지킬앤하이드 (Jekyll＆Hyde),5,홍광호 배우 잘 봤습니다.,내용은 기대이하였는데 배우가 잘해서 좋았어요!,2022.01.31
뮤지컬 지킬앤하이드 (Jekyll＆Hyde),5,우리 가족의 첫 감동뮤지컬,지방서 생활하고 있어 자주 볼수없는 작은 아들과 남편과 처음 뮤지컬을 보게 되었습니다 원래는 남편과 둘이 보려고 예약했었는데 아들이 갑자기 시간이 되서 명절을 집에서 보낼수 있게. 되었고 부랴부랴 추가로 표를 예약해서 같이 보게 되었지요 배우들의 열연과 빠져들수밖에 없는 노래들은 때론 충격도 주며 감동도추며 그 시간이 너무 짧게 느껴졌네요 세가족과 함께한 지킬앤 하이드 두고두고 잊지못할 공연이었습니다 고맙습니다,2022.01.31
뮤지컬 지킬앤하이드 (Jekyll＆Hyde),5,최고!!!!!!,봐도봐도 질리지 않는 홍광호 배우님의 지킬앤하이드!!!!,2022.01.31
뮤지컬 지킬앤하이드 (Jekyll＆Hyde),3,음.....,재밌는데 재미없는... 고전이라 넘어가긴 하지만 너무 시대착오적인 장소와 캐릭터 사용법 그와중에 넘버는 좋지만 박자 무시하고 널뛰는 오케스트라,2022.01.31
뮤지컬 지킬앤하이드 (Jekyll＆Hyde),3,지킬앤하이드,극이 왜이리 낡게 느껴지던지  ㅠㅠ  극중 여성 캐릭터는 모두  보기 불편하고 ㅠㅠ 그럼에도 불구하고 홍광호 성대는 박수받아 마땅하다가 결론임,2022.01.31
뮤지컬 지킬앤하이드 (Jekyll＆Hyde),5,홍광호!!!!!!!,3년만에 본 지킬이었는데 홍광호 배우님 더 더더더더더 좋네요 정말 말해모햐,2022.01.31
뮤지컬 지킬앤하이드 (Jekyll＆Hyde),5,지킬앤하이드,꼭 보세요!!!!!,2022.01.31
뮤지컬 지킬앤하이드 (Jekyll＆Hyde),5,모두가 봐야하는 고전 뮤지칼,홍지킬 못사가 없어야 합니다. 오로라를 보면 인생이 바뀐다고 말하듯 당신의 인생은 홍지킬을 만나기 전/후로 나뉠 것입니다. 물론 엠마와 루시도요…,2022.01.31
뮤지컬 지킬앤하이드 (Jekyll＆Hyde),5,역시 홍지킬입니다.,"역시 홍지킬입니다. 친구랑 보러갔는데, 너무 멋지고 재미있어어요. 배우님의 연기도 멋지고 넘버는 더 강렬하고 멋지더라구요. 특히 하이드의 그 그르렁하는 연기가 무섭게 멋지더라구요. 엠마와 루시 맡으신 배우님들도 너무 아름다우세요. 제 친구가 같은 공연 두 번 안 보는데, 홍광호 배우님 지킬앤 하이드는 다시 한 번 보고 싶다고 하더라구요.  아직 안 보셨으면 꼭 보세요.",2022.01.31
뮤지컬 지킬앤하이드 (Jekyll＆Hyde),5,재밌어요,얼랍2 짱....,2022.01.31
뮤지컬 지킬앤하이드 (Jekyll＆Hyde),5,역시 최고,역시 최고입니다.  다음공연을 기대합니다.,2022.01.31
뮤지컬 지킬앤하이드 (Jekyll＆Hyde),4,잘 봤습니다,잘 봤습니다,2022.01.31
뮤지컬 지킬앤하이드 (Jekyll＆Hyde),5,홍지킬 최고~~~,홍지킬 최고~~~,2022.01.31
뮤지컬 지킬앤하이드 (Jekyll＆Hyde),5,홍지킬 최고~~~,홍지킬 최고~~~,2022.01.31
뮤지컬 지킬앤하이드 (Jekyll＆Hyde),5,홍지킬은 신이에요,살아있는 뮤지컬계의 전설을 영접했다는 사실에 감격해 집 가서 맥주 한 캔 때렸습니다. 홍지킬 홍하이드 짱!,2022.01.31
뮤지컬 지킬앤하이드 (Jekyll＆Hyde),5,재밌게 봤습니다,재밌게 봤습니다,2022.01.31
뮤지컬 지킬앤하이드 (Jekyll＆Hyde),5,지금이순간,홍광호배우님 진짜 최고였어요 볼 수 있어 영광이었습니다ㅠㅠㅠㅠㅠㅠ,2022.01.31
뮤지컬 지킬앤하이드 (Jekyll＆Hyde),5,컨프롱과 지킬,지킬ㅇ내하이드,2022.01.31
뮤지컬 지킬앤하이드 (Jekyll＆Hyde),5,나는 에드워드,하이드~~~~,2022.01.31
뮤지컬 지킬앤하이드 (Jekyll＆Hyde),5,오슷 바로삿어요,끝나고 나오는 길에 바로 구입했어요. 내용은 정말 구닥다리에 바꿔야할게 많지만 넘버는 최고입니다.,2022.01.31
뮤지컬 지킬앤하이드 (Jekyll＆Hyde),3,지킬,"류지킬은 하이드로~~~ 정은엠마 너무 좋고,,, 선민루시는.... ㅠㅜ",2022.01.31
뮤지컬 지킬앤하이드 (Jekyll＆Hyde),5,홍지킬,최고에요,2022.01.31
뮤지컬 지킬앤하이드 (Jekyll＆Hyde),5,오래 남는 여운과 짜릿함,"10년만에 보는 지킬앤하이드였어서, 약간 가물가물하기도 해서 사실 이 정도의 기대를 하고 본 것은 아니었는데요, 홍광호 배우 공연 자체도 7년만이라 잘하는건 알았지만 이 정도일 줄은 몰랐습니다. 말 그대로 계속 발전하는 배우네요.세트 자체도 실험실 세트가 너무 예뻐져서 시각적으로도 좋았고, 앙상블이 이 정도 규모인 극도 오랜만이라 다채로웠습니다만, 역시 지킬앤하이드 극 특성상 주연인 홍광호 배우가 끌고가는 연기가 보고나서도 정말 오랜 여운이 남았고, 돌아가는 길 내내 정말 오랜만에 좋은 아드레날린과 두근거림을 느꼈습니다.이후 며칠을 홍광호 배우 영상을 찾아봤는지... 하지만 현장감의 5분의 1도 안 되는것 같아요... 계속 이 배우의 공연을 제가 보기 위해선 경쟁률이 낮았으면 좋겠지만 한편으론 공익을 위해 너무 더 알리고 싶은...흥분해서 길어졌습니다만, 좋은 공연이었고 잘 봤습니다!",2022.01.31
뮤지컬 지킬앤하이드 (Jekyll＆Hyde),4,최고의 넘버와 목소리,홍지킬이 최고인건 누구나 다 알고있는 사실이지만 지앤하 극은 앙상블들의 합도 최고인 듯! 이젠 지킬역 배우 보러가기보단 앙상블들이 부르는 넘버 보러가는 느낌ㅎㅎㅎ,2022.01.30
뮤지컬 지킬앤하이드 (Jekyll＆Hyde),4,배우분들 넘 좋고 잘해주셨는데 음향이ㅜㅜ,제 생애 첫 지킬앤하이드 뮤지컬 관람이었는데 하필 1부때 음향이 자꾸 끊겨 몰입이 끊겨 넘 아쉬웠습니다ㅠㅠ큰 맘 먹고 보러간건데 사과도 없으시고 너무 아쉽네요ㅜㅜ무대에서 고생해주신 배우분들 넘 수고 많으셨고 너무 다 잘 해주셨습니다!!감사합니다!!!앞으로 이런 사고 없게 조치 부탁드립니다ㅠ,2022.01.30
뮤지컬 지킬앤하이드 (Jekyll＆Hyde),1,낡고 낡은 극,그래도 한국에 태어났는데 지금 이 순간은 봐야지하고 예매해서 봤었는데 내용과 연출이 너무 낡아서 실망스러웠고 보는 내내 머리만 아팠습니다. 배우님들 노래 잘하는 건 다른 극들에서도 얼마든지 볼 수 있으니 다신 안 볼 것 같아요.,2022.01.30
뮤지컬 지킬앤하이드 (Jekyll＆Hyde),2,마이크,오늘 1부(?)할때 마이크 중간중간 나가서 소리가 안들리니몰입도 안됐어요ㅠㅠ돈도 영화값도 아닌데 이런부분은 신경좀 잘 써주샸으면..중간 인터미션때 언급이라도 있을 줄 알았는데그것도 없었고…흠,2022.01.30
뮤지컬 지킬앤하이드 (Jekyll＆Hyde),1,오늘 마이크 고장. . ,돈을 13만원 내고 보러갔는데마이크 튀는소리가 20여분 지속되고주연배우들 마이크가 꺼진채로노래를 부르질않나. . 한두번도아니고 네다섯번입니다.책임자 누구신가요?환불받고싶었어요,2022.01.30
뮤지컬 지킬앤하이드 (Jekyll＆Hyde),5,신성록 배우님 최고!,연기와 노래 모두 잘하시는 신배우님 최고입니다!다만 1/30 (일) 14시 공연 1부에 음향이 자꾸 끊겨서 몰입에 방해가 되었어요.,2022.01.30
뮤지컬 지킬앤하이드 (Jekyll＆Hyde),4,류지킬 잘 보고 왔습니다,류정한 님이야 뭐 한국을 대표하는 뮤지컬 배우니 두말할 것도 없고요. 루시 역 선민 배우님 첨 보는데 예쁘시고 노래도 너무 잘 하시네요 아주 오래전에 지킬 보고 아주 간만에 보는 건데 프로덕션이 다이내믹하고 훨씬 다채로와 눈이 즐거웠습니다.,2022.01.30
뮤지컬 지킬앤하이드 (Jekyll＆Hyde),5,역시 홍광호 배우님,"뮤알못 시절부터 유일하게 알고 있던 뮤지컬 배우는 홍광호 배우님이었는데, 유명한 이유는 어제 공연으로 설명이 다 되었네요! 정말 감탄하면서 봤습니다! 홍광호 배우님의 노래, 지킬과 하이드를 오가는 연기력만 봐도 정말 대단한 공연이었어요! 여운이 오래갈 작품으로 기억 될 거 같아요",2022.01.30
뮤지컬 지킬앤하이드 (Jekyll＆Hyde),5,신성록 레전드 공주루시 레전드,28일 공연 두분 다 레전드ㅜㅡㅜ,2022.01.29
뮤지컬 지킬앤하이드 (Jekyll＆Hyde),2,너무 기대를 했나봐요 ㅠ,지금은순간~ 이 노래 너무 기대가 컸나봐요. 웅장하고 감동적일거라고 생각했는데 힘없이 불러 실망감이 큽니다. 이 노래때문에 가서 봤는데 아쉬움이 넘실넘실 ㅠㅠ   류배우는 하이드의 굵은 목소리가 더 카리스마가 있어 어울리는 배우라고 생각해요. 지킬은 그냥그러네요. 사람마다 감동은 다르니 저는 그렇게 봤네요. 오히려 다른 엑스트라 배우들의 합창이 더 좋더라구요. 루시 목소리 좋아요.,2022.01.29
뮤지컬 지킬앤하이드 (Jekyll＆Hyde),5,신성록 배우님,신성록 배우님 보는 순간 심장 멎는 줄 알았습니다,2022.01.29
뮤지컬 지킬앤하이드 (Jekyll＆Hyde),5,류지킬 ..내통장 다 바치는 중..,4번째 회전문 돌러 갑니다!!!,2022.01.29
뮤지컬 지킬앤하이드 (Jekyll＆Hyde),5,진짜 너무너무너무 좋았어요!!!,몇번을 봐도 볼때마다 좋네요,2022.01.28
뮤지컬 지킬앤하이드 (Jekyll＆Hyde),5,홍지킬은 홍지킬,웨이백에서 기절할 뻔 했다가 정신줄 붙잡고 일어나서 루시데스 때 다시 혼절했다가 깨어나서 컨푸롱 때 결국 쓰러지고 말았습니다 예 홍지킬 만수무강하시고 은퇴할 때까지 지킬하세요,2022.01.28
뮤지컬 지킬앤하이드 (Jekyll＆Hyde),4,조카에게 선물~,"딸랑구, 조카와 즐거운 데이트를 지킬앤하이드로 했습니다. 저희 딸랑구와 조카는 이번이 첫 관람이여서 기대반 설렘반으로 관람을 했습니다.  저도 지킬앤하이드는 첫 관람이네요. 샤롯데는 좌석선택이 중요한듯해요. 매번 갈때마다 만족이 어러워요. 방학때 딸랑구와 조카에게 선물할 수 있어서 행복했습니다. 2년가까이 코로나를 겪으면서 예전에 마스크없이 관람했던 시절을 그리워하며 행복한 시간을 보낼수있어서 감사했습니다.",2022.01.28
뮤지컬 지킬앤하이드 (Jekyll＆Hyde),5,11년먄에 다시 본 공연,"2011년에  홍광호씨 공연을 보고 11년이 흐른 후 다시 본 홍광호씨는 정말 다른 사람 같네요. 음색 연기 모두 깊이가 더해져 보는 내내 고개를 절레절레 흔들수밖에 없었어요. 표가 없어 비록 2층이었지만 시야도 냐름 좋았구요, 공연을 위해 pcr검사를 해야하는 번거로움이 있었으나 충분히 감수할만한 공연이었어요.  코로나창궐만 아니면 한번더  보고 싶지만 요즘 몇만명씩 나오는 추세라  예매대기를 걸었다 취소 했네요. 그 아쉬움은 데스노트에서...제발 그때는 코로나가 잠잠해지길.",2022.01.28
뮤지컬 지킬앤하이드 (Jekyll＆Hyde),5,홍지킬은 못 참지,홍지킬 이번에도 너무 좋았어요 ㅎㅎㅎ,2022.01.28
뮤지컬 지킬앤하이드 (Jekyll＆Hyde),5,너무 재밌게 잘봤습니다 :),남자친구 보컬 선생님께서 추천해주셔서 예매하게 되었어요!! 근데 정말 추천 너무 잘 받은거같아요 ㅎㅎ 뮤지컬 처음 봤는데 너무너무 재밌어요&#128077;&#128077; 지킬앤하이드의 다른 모습을 너무나도 잘표현해주시고 열정적인 모습들이 너무 멋있어보였어요! 그 외 다른 배역을 맡으신 배우분들 또한 너무 찰지게 연기해주신거같아요!!  다음에 또 다른 여러가지 뮤지컬을 찾아보려구요&#128522;,2022.01.28
뮤지컬 지킬앤하이드 (Jekyll＆Hyde),5,와....,진심 모든게 완벽했음. 홍광호....와....갓광호... 경아엠마 성량이 진짜 대박이구요 공주루시는 드라마틱하고 좋았어요! 다만 여기 극장직원들 2층객석에서 등받이에 기대서 보라는 안내 왜 안하지.... 인터미션때 공지해달라고했는데 개미목소리만하게 말하면 하나 마나 아닌가.... 진심 관크 씨게 당했어요 2층 A구역 2열에 앉은 남자 3분들....,2022.01.28
뮤지컬 지킬앤하이드 (Jekyll＆Hyde),5,여러분 꼭 보세요ㅠㅠ,홍광호님 유명한건 다 이유가 있었습니다 여러분ㅠㅠ 꼭 보세요ㅠㅠ 사실 다른 뮤지컬 배우분들은 잘 모르고 갔었는데 연기구멍이 한곳도 없어서 너무 잘보고 왔어요??,2022.01.28
뮤지컬 지킬앤하이드 (Jekyll＆Hyde),5,이제는 그 자체.,지난 시즌엔 홍광호 배우가 지킬&하이드를연기 했다면 이번 시즌은 그 자체가되어 버린 느낌.공주루시의 절절함과 경아엠마의애절함도 홍지킬과 함께여서 더욱빛난 무대였음.,2022.01.27
뮤지컬 지킬앤하이드 (Jekyll＆Hyde),5,톡지킬 최고~,톡지킬 때문에 또 봤어요. 톡지킬 또 왔으면 좋겠습니다!,2022.01.27
뮤지컬 지킬앤하이드 (Jekyll＆Hyde),5,신성록 지킬앤하이드 너무 좋았어요!,절제된 지킬과 강렬한 하이드 연기 최고였어요!,2022.01.27
뮤지컬 지킬앤하이드 (Jekyll＆Hyde),5,신성록 지킬앤하이드,다음에도 꼭 제발요 신성록 최고예요 ㅠㅠㅠ,2022.01.27
뮤지컬 지킬앤하이드 (Jekyll＆Hyde),4,지킬 앤 하이드,신성록 배우의 연기가 좋았습니다. 시간이 가는줄 모르고 관람했네요~!,2022.01.27
뮤지컬 지킬앤하이드 (Jekyll＆Hyde),5,2차 캐스팅도 기대됩니다,재밌었어요,2022.01.27
뮤지컬 지킬앤하이드 (Jekyll＆Hyde),5,홍지킬 최고의 연기,"스토리는 원작의 흐름을 따라가지만 넘버나 배우들의 연기, 그리고 무대 세트가 예뻐서 즐겁게 봤습니다.",2022.01.27
뮤지컬 지킬앤하이드 (Jekyll＆Hyde),5,홍광호님... 저 미치게 하시려구요...?,꼭 보세요 ㅠㅠ,2022.01.27
