musical_title,rate,review_title,review_text,review_date
뮤지컬 〈서편제〉,5,서편제,150분이 정말 순식간에 지나가네요.  배우분들 다 너무 잘하고 무대 넘버 조명 다 너무 예쁘고 좋아요.,2022.08.29
뮤지컬 〈서편제〉,5,나의 ''소리''를 찾아가는 세 사람의 이야기,"나의 정체성과 사랑, 꿈 등등 다양한 적용이 가능했던 주인공들의 ''소리''. 그 소리를 찾아가는 아빠와 아들과 딸의 처절한 모습들이 참 마음이 아파서 많이 울었습니다. 이번이 마지막이라는 게 너무 아쉽네요. 계속 유지되었으면 좋겠는 우리의 뮤지컬입니다.",2022.08.29
뮤지컬 〈서편제〉,5,유리아 송화 송원근 동호...,유리아 송화 송원근 동호 최고였습니다.,2022.08.29
뮤지컬 〈서편제〉,5,양지은 은 곧 양송화 였다,양지은 서편제  최고의 감동이었습니다 보는내내  숨이 멎을것 같은 감동은 처음 이었습니다  처음이라고는 믿기지 않는 연기 실력과20년 수련으로 다져진 판소리는 그야말로 판소리의 진수를 보여주었습니다 양지은  다시 보게 됩니다,2022.08.29
뮤지컬 〈서편제〉,5,"양지은, 소리의 진수를 맛보다!",트롯퀸 양지은에서 완벽한 변신을 통해 소리꾼 양송화로 태어나 감동을 주는 양지은님에 의한 서편제는 감동이었습니다.국악을 전공한 양지은님을 통해 서편제에서 소리의 진수를 맛볼 수 있었어요~♡,2022.08.29
뮤지컬 〈서편제〉,5,울림과 여운 가득한 공연,"친구 추천으로 가벼운 마음으로 보러갔습니다. 영화 서편제에 대한 어렴풋한 기억으로 가서 그런지 초반 내용 조금 헷갈렸습니다. 하지만 내용이 중점이 아니고 그 ""소리의 한""을 중점으로 보았어야 했다는 것을 공연이 끝난 후에 깨달았습니다. 어떤 방향으로 감사해야 하는지 이제야 알 것 같아 한번 더 공연을 봐야겠다는 생각이 들었습니다.  차지연 배우님 연기는 처음 보는데 너무 잘 하셔서 입 벌리면서 봤습니다. 커튼콜 때도 공연이 끝난 후 후련한 모습이 아니라 송화 그대로 나와서 인사하시는 것 같았습니다. 그 슬픈 얼굴을 보고 다시한번 감동받았습니다. 공연이 끝난 후 이게 뭐지? 가슴에 뭔가 훅 들어오는게 이게 무슨 감정인지 잠깐 혼동스러웠습니다. 그리고 아 이게 감동이구나 하고 가슴 뭉클함을 느꼈습니다. 그 여운이 이 글을 쓰는 지금도 계속되고 있습니다.",2022.08.29
뮤지컬 〈서편제〉,5,송화 홍자 동호 원근님 편,노래만 그리 애절하게 잘 하시는 줄 알았는데 연기도 잘하시고 눈물없이 볼수 없는 감명깊은 연기력에 다시금 다음 송화가 어떻게 변할까라는 생각이 들어서 다시한번 더 보러 가렵니다. 추천합니다. 후회 안하실듯,2022.08.29
뮤지컬 〈서편제〉,5,차지연 송원근 서범석,넘 멋졌어요,2022.08.29
뮤지컬 〈서편제〉,5,양지은 서편제 강력추천합니다,"뮤지컬은 생전 두번째입니다. 양지은 서편제 프리뷰관람. 그리고 8.28.두번째 관람입니다. 먼저, 우리 국악 뮤지컬의 위대함을 절절히  느꼈습니다. 뮤지컬 배우들의 위대함도 느꼈습니다. 혼신을 다한 배우들의 노력이 빛났습니다. 특히 주인공들의 연기에 감탄했습니다. 물론 그 중에서도 양지은의 연기는 농익었고, 소리는 폐부를 찔렀고,  천둥소리같이 휘몰아  쳤으며, 눈물샘을 자극해 눈물을 흐르게만들 정도로  감성적이었습니다. 차지연 배우공연을 보고 비교해 보고싶은 욕심이 생겼습니다. 양지은 가수가 서편제를 선택한 것은 신의 한수였습니다. 우리 국악 수련자들의 위대한 헌신에 경의를 표합니다. 안보면 후회합니다.",2022.08.29
뮤지컬 〈서편제〉,5,유봉과 송화의 눈물에 흠뻑~~,오늘은 유봉과 송화가 소리를 지키기 위해 흘린 눈물로 위로 받고 우리  것은 좋은 것이라는 믿음을 다짐니다.다음 회차는 또 어떤 감동으로 서편제가 나에게  말할련지?  이미 완숙해진 양지은님의 발전의 끝은 어디까지 일지 궁금합니다.,2022.08.29
뮤지컬 〈서편제〉,5,차송화 송동호 서유봉ㅠㅠㅠ,레전드 조합을 봐버렸다 마지막이라니 아쉽네요 ㅠㅠㅠ 이자람배우님꺼도 한번 더 봐야겠어요,2022.08.29
뮤지컬 〈서편제〉,5,아름다운 공연이었습니다.,무대도 아름답고 무대 위의 배우가 뿜어내는 에너지도 너무 좋았습니다. 스토리는 제 상식상 이해 불가하나 넘버로 이해해보려구요.,2022.08.29
뮤지컬 〈서편제〉,5,양지은 서편제 보고 놀랐어요~,처음도전이라 믿기지 않을 정도로 연기가 자연스럽고 맛깔납니다~국악전공자라 그런지 판소리에 깊이가 남다르신거 같아요 ~넘 잘보고 많이 울고 갑니다^^,2022.08.29
뮤지컬 〈서편제〉,4,잘봤어요,잘봤어요,2022.08.29
뮤지컬 〈서편제〉,5,잘봤어요,재밌어요,2022.08.29
뮤지컬 〈서편제〉,5,어메이징!  양송화!!,양송화 혼신의 소리에 숨멎!! 양송화의 소리는 들을수록 마음 깊은 곳까지 들어와 울림을 주고 아득한 심연의 슬픈 감성까지 마구마구 흔들어 댄다.양송화에 빼앗긴 나의 마음은 양송화가 나 인듯내가 양송화 인듯 양송화가 울면 따라 울고양송화가 웃으면 따라 웃으며 극 속으로 빨려 들어간다.뮤지컬 신인 배우라고 볼 수 없을 정도로 노련하고 자연스러운 양송화의 연기에 흠뻑 빠져들고 천상의 울림같은 양송화의 소리에 취해 울고 웃으며 시간이 잠시라도 멈추길 바랬던 양송화의 서편제는 감동이고 행복이었다~♡,2022.08.29
뮤지컬 〈서편제〉,5,차지연 만세,말해뭐합니까 최고,2022.08.29
뮤지컬 〈서편제〉,5,서편제,최고예요!! 감동ㅠㅠㅠㅠ,2022.08.29
뮤지컬 〈서편제〉,5,좋아요,음악도 연출도 역시 좋아요.,2022.08.29
뮤지컬 〈서편제〉,5,마지막 시즌,번복해주세요ㅠㅠ 송원근 배우님 동호 정말 잘하시고 다정 배우님이랑 붙는 씬마다 슬퍼요... 딱 한 가지 배우분들도 많이 울어주시면 더 몰입하기 좋을 것 같습니다 자람송화 차송화는 말할 것도 없이 장인이세요!,2022.08.29
뮤지컬 〈서편제〉,5,곡조차 한이 담긴 소리,유리아 배우의 온 몸을 받친 연기에 진심을 담은 박수로 보답할 수 있어 행복했습니다,2022.08.29
뮤지컬 〈서편제〉,5,너무 재밌어요!,성아인 짱!!!!,2022.08.29
뮤지컬 〈서편제〉,5,좋았어요,좋았어요,2022.08.29
뮤지컬 〈서편제〉,4,재밌어요,재밌어요,2022.08.29
뮤지컬 〈서편제〉,5,재미있어요,재미있어요,2022.08.29
뮤지컬 〈서편제〉,5,재미있어요,재미있어요,2022.08.29
뮤지컬 〈서편제〉,5,"세상은 희생이라 했고,",그녀는 인생이라 했다.220818 유리아 배우의 첫 판소리 무대는 충격적이었어요커튼콜에서 유리아 배우와 관객들이 같은 감정을 느꼈고 진심이 가득 담긴 박수였어요극이 끝난 이후에도 이렇게 긴 여운은 처음이었어요마지막 시즌에 이렇게 좋은 무대를 보여주셔서 감사해요율송화를 볼 수 있어 행복했어요,2022.08.29
뮤지컬 〈서편제〉,5,서편제 너무 좋아요,"차지연배우님 혼신의 연기 정말 녹았습니다. 그저 송화 그 자체....! 노래,판소리 말해모해지만 연기 너무너무 좋았어요. 많은 체력이 필요할거같은데 몸건강하시길. 오래오래 무대위에 서주세요!!!!",2022.08.29
뮤지컬 〈서편제〉,5,깊은 추억이 될 뮤지컬 서편제,"대성통곡하지않았습니다. 펑펑울지도 않았어요 다만,처음부터 끝까지 가슴이 아프기도하고 아련하기도하고 뜨겁기도하고 울컥한부분도있다가 다시 잔잔하기도하고... 이 감정이 무엇인진 모르겠지만 처음부터 끊기지않고 계속되었습니다. 그래서 기억에 오래남을거같아요. 큰 힐링이 된거같아요. 혼신의 힘을 다하신 배우님들 뜻깊은 추억주셔서 감사합니다 고생하셨습니다^^",2022.08.29
뮤지컬 〈서편제〉,4,재밌어요!!,재밌어요!!,2022.08.29
뮤지컬 〈서편제〉,5,많은 생각하게 된 공연입니다,정말 한국의 ''한''을 제대로 보여주는 아주 좋은 공연입니다. 배우님들 다 실력파이셔서 진짜 두 말 필요없이 멋지시고 너무나도 잘 봤습니다~!,2022.08.29
뮤지컬 〈서편제〉,5,추천합니다,재윤배우의 동호와 차지연 배우님의 송화가 무척 재밌었습니다,2022.08.29
뮤지컬 〈서편제〉,5,추천해요,감동과 재미가 있어요 그리고 자람배우의 판소리가 굉장히 좋습니다.,2022.08.29
뮤지컬 〈서편제〉,5,살다보면,오랜 극임에도 오는 찡함 ㅠㅠ,2022.08.29
뮤지컬 〈서편제〉,5,여운이 이렇게 깊은 극은 지금껏 처음,"정말 공연이 끝나고 한참뒤까지 여운이 가시질 않아 너무 힘들었던 극이었습니다. 그만큼 울림이 크고 스토리, 넘버, 무엇보다도 배우분들의 연기가 대단한 극입니다.  유리아 배우님의 씩씩하고 올곧은 누이의 모습. 그리고 마지막의 심청가까지 송원근 배우님의 마음속 한. 자신의 소리를 찾고 결국 누이를 만나기까지  너무나도 좋았습니다. 이 울림은 오직 현장에서만 느낄 수 있습니다.  이번이 서편제 마지막 시즌이라고하니 고민 중이신 분들 꼭꼭 보시길 추천드립니다!!!",2022.08.29
뮤지컬 〈서편제〉,5,양지은 양송화 감동과 웃음을 동시에~,배우 양지은을 만나는 행운^^ 아버지 상여 뒤따르며 부르는 구음은 심장을 찢는 듯?? 마지막 심청가는 명불허전,2022.08.29
뮤지컬 〈서편제〉,5,좋아요,잘 보고 왔어요~,2022.08.29
뮤지컬 〈서편제〉,4,즐거웠습니다,즐거웠어요,2022.08.29
뮤지컬 〈서편제〉,5,마지막 시즌 서편제,볼때마다 눈물나요 ㅠㅅㅠ,2022.08.29
뮤지컬 〈서편제〉,5,서편제..,역시 명작이에요..오래되었지만 늘 최고입니다..,2022.08.29
뮤지컬 〈서편제〉,5,배우 유리아의 내일이 기대되던 공연,배우의 스펙트럼이 얼마나 더 넓어지고 커질 수 있는지 확인할 수 있었던 시간,2022.08.29
뮤지컬 〈서편제〉,4,"내용은 낡았으나, 마지막 장면이 다하는 극","개인적으로 2022년도에 어울리는 극은 아니라고 생각했는데, (스토리 면에서나, 연출 면에서나)유리아 배우 명창 수준으로 판소리도 너무 잘하고 감정연기까지 좋아서 감탄했습니다.",2022.08.29
뮤지컬 〈서편제〉,5,멋진 공연이었습니다,다시 보고싶네요,2022.08.29
뮤지컬 〈서편제〉,5,역시 자람신...ㅠ.ㅠ,진짜 여전히 최고...최고...ㅠ.ㅠ 그모습 그대로..아니 더 좋은모습으로 송화로 볼 수 있어서 진짜 행복했어요!  범석유봉도 여전하고..ㅠ.ㅠ 재윤동호 생각보다 노래가 좋아서 잘 보고 나왔어요..  내 아픈손가락...서편제..ㅠ.ㅠ 여전히 너무 슬프고 좋았어요!,2022.08.29
뮤지컬 〈서편제〉,5,자신의 소리를 찾아서,모든 순간에 공감했다고는 할 수 없지만각각의 인물들이 저마다의 소리를 찾기위해 걸은 걸음이 아름다웠습니다. 송화의 목소리는 특히나 더 마음을 크게 울렸어요.,2022.08.29
뮤지컬 〈서편제〉,5,좋았어요,어머님과 데이트를 했습니다 즐거웠어요,2022.08.29
뮤지컬 〈서편제〉,5,차황제,차황제한태 나라가 없다는건 말도 안된다 진짜,2022.08.29
뮤지컬 〈서편제〉,5,좋았어요,처음 본 서편제였는데 이자람 배우님의 소리가 너무 좋았어요. 동호의 시선으로 풀어가는 서편제도 좋았지만 송화의 시선으로 풀어가는 것이 중심인 것도 궁금해졌어요.,2022.08.29
뮤지컬 〈서편제〉,5,ㅠㅠㅠ너무 좋았어요,"ㅠㅠㅠ너무 좋았어요..연출, 넘버, 장면 다 취향이었네요..슬프고 가슴아리는 극이에요",2022.08.29
뮤지컬 〈서편제〉,5,갓지연…,역시…..뮤지컬 배우는 진짜 ㅠㅠㅠ,2022.08.29
뮤지컬 〈서편제〉,5,정말 인상적인 공연이었습니다!!,최고의 공연이었습니다!!!,2022.08.29
뮤지컬 〈서편제〉,5,각자의 소릿길이 얽혀가는 것이 인생,너무 좋았어요,2022.08.29
뮤지컬 〈서편제〉,5,차송화최고,진짜 역대급,2022.08.29
뮤지컬 〈서편제〉,5,살다보면 살아진다,노래 너무 좋아요,2022.08.29
뮤지컬 〈서편제〉,5,최고였습니다..,한의 정서.. 대단하네요..,2022.08.29
뮤지컬 〈서편제〉,5,잘 봤습니다,잘 봤습니다,2022.08.29
뮤지컬 〈서편제〉,5,차지연 송원근 서범석 최고의캐스팅,최고의 공연이었습니다 이 배우들로 또 볼거에요,2022.08.29
뮤지컬 〈서편제〉,5,서편제 마지막,서편제 마지막 시즌 절대 놓칠 수 없는데 율송화 진짜 미쳤고요ㅠㅠㅠㅠㅠ,2022.08.29
뮤지컬 〈서편제〉,5,서편제,유리아송화와 송원근동호까지 그냥 어디서 막올리고 온 것 같음 로딩이 뭐예요…?유리아 동공연기 꼭 봐야됩니다 소리하던 사람같아요…,2022.08.29
뮤지컬 〈서편제〉,4,심청가최고,이자람은 신입니다,2022.08.29
뮤지컬 〈서편제〉,5,서편제,잼잇네요 배우들 연기가 좋았습니다,2022.08.29
뮤지컬 〈서편제〉,5,ㅠㅠ 너무 좋아요,마음이 흘러가는대로 울다보면  위로를 받는 것 같아요,2022.08.29
뮤지컬 〈서편제〉,5,차송화 최고,2017년 이 극을 보고 뮤지컬에 빠지게 됐는데 역시... 서편제네요. 너무 좋아요 근대 머지먹 시즌이라니ㅠㅠㅠㅠㅠ 재고해주세요ㅠㅠㅠㅠ,2022.08.29
뮤지컬 〈서편제〉,5,최고..,율송화 최고...,2022.08.29
뮤지컬 〈서편제〉,5,재관람,공연 보고 계속 아른거려서 재관람 했는데 너무 만족스러웠어요! 공연장이 좀만 더 가까웠더라면 좋겠지만...ㅠ 그래도 또 예매 해놨어요!,2022.08.29
뮤지컬 〈서편제〉,5,서편제,최고~~,2022.08.29
뮤지컬 〈서편제〉,5,친척언니들이랑 함께 갔는데 다들 만족했어요!,감동이었어요,2022.08.29
뮤지컬 〈서편제〉,5,오랜만에 보니까 너무 좋았습니다,오랜만에 봐도 감동이 여전하더라구요ㅠㅠ 마지막 시즌이라니 너무 아쉽습니다 또와주세요ㅠㅠㅠㅠㅠ,2022.08.29
뮤지컬 〈서편제〉,5,서편제,꼭 보세요!,2022.08.29
뮤지컬 〈서편제〉,5,잘봤어요,유리아 배우님 너무 최고네요,2022.08.29
뮤지컬 〈서편제〉,5,미쳤다,와 걍 미쳤어요 어떻게 이러지...? 배우분들 연기가 장난 아니에요 ㅠㅠㅠㅠㅠㅠㅠ 보는 내내 소름 돋았습니다. 또 볼거예요!!!!!,2022.08.29
뮤지컬 〈서편제〉,5,넘 서정적인,슬픔이 가득한 뮤지컬 ㅠㅠㅠㅠ,2022.08.29
뮤지컬 〈서편제〉,5,명창,명창들만 나오는 뮤지컬인가요 귀호강하고 갑니다.,2022.08.29
뮤지컬 〈서편제〉,5,슬퍼요,유리아배우님 정말루 믿보배세요,2022.08.29
뮤지컬 〈서편제〉,5,강추강추,프리뷰로 서편제를 처음으로 봤는데 왜이리 슬픈지... 배우들 연기와 넘버들이 너무 좋아서 계속 머릿속을 맴도네요. 다른 배우들로 또 예매해서 볼 예정입니다!,2022.08.29
뮤지컬 〈서편제〉,5,김동완 동호 좋네요,아버지 유봉을 원망하는 마음과 송화를 위하는 마음 둘다 좋았어요 달아나요 엄마 엄만 묶인 끈이 없잖아 하는 넘버도 좋았고 2막에서 연가도 넘 좋았어요,2022.08.29
뮤지컬 〈서편제〉,5,뮤지컬 서편제,뮤지컬 서편제 또 보고 싶어요!,2022.08.29
뮤지컬 〈서편제〉,5,서편제 홍지윤,서편제 완전 감동이었어요!!! 송화역의 홍지윤~~~ 소리도 잘하고~ 연기도 잘하고~ 조금 웃고~많이 울었습니다ㅠㅠ,2022.08.28
뮤지컬 〈서편제〉,5,홍지윤 서편제 관람,송화역의 홍지윤~~ 소리와 연기 둘다로 웃기고 울렸네요 서편제 완전 감동이었습니다!!!,2022.08.28
뮤지컬 〈서편제〉,5,좋아요,좋았습니다,2022.08.28
뮤지컬 〈서편제〉,5,네번째 관극~~,"참으로 애정하는 작품의 굿바이 시즌이라 다시 보게 됨!차지연 배우는 송화 그 자체였고,오랜만에 보는 서범석 배우도 굿굿~~동호역의 송원근 배우가 생각보다 잘 해서 놀람꼭 서편제를 다시 볼 수 있기를 바랍니다!!!",2022.08.28
뮤지컬 〈서편제〉,5,정말 잘 봤습니다!! ,감동과 여운이 오래 가네요 시간이 없어서 이번 회차 밖에 못 보는데...ㅠㅠ다음에 시간이 된다면 꼭 다시 한 번 보고 싶네요!,2022.08.28
뮤지컬 〈서편제〉,5,양지은씨 소리에는 깊은 울림이 있네요,"송화역 양지우씨는 이번이 첫 뮤지컬이라고 하여 큰 기대없이 관람했다가 신선한 감동을 받았습니다. 역시 우리소리를 낼줄 아는 분이 송화역을 하니, 소리의 깊이가 달라지네요.관람 내내 제 두 귀가 고급져지는 느낌이었습니다.대단하네요",2022.08.28
뮤지컬 〈서편제〉,5,서편제 후기,마지막 시즌을 놓칠 수 없었기에 선택한 뮤지컬 뮤지컬 최애배우 차지연님과 아이돌 최애 재윤페어로 맞춰서 관람했습니다. 차지연 배우님은 성량부터 어나더레벨..어쩜 그렇게 잘하세요...? 재윤 배우님은 사실 뮤지컬에서는 처음봐서 별 기대안하고 봤는데 너무 잘하셔서 깜짝놀랐습니다. 좋은 공연 감사드려요,2022.08.28
뮤지컬 〈서편제〉,5,역시 차송화,차송화는 정말 넘사벽 클라스인것같습니다. BBCH홀이었는데도 음향 정말 잘 잡으신것같아서 좋았습니다.,2022.08.28
뮤지컬 〈서편제〉,5,멋진공연,마지막 시즌은 함께 할 수 있어서 너무나도 좋았습니다 9월에 한번 더 보러 가네요,2022.08.28
뮤지컬 〈서편제〉,5,잘보고왔어요,어제 커튼콜데이라서 너무 좋았습니다 어제는 맨눈으로 보고 손으로만 촬영 하느라 아쉬워서 한번더 커튼콜 있으면 좋겠다는 생각입니다 홍지윤 송화 깨발랄하게 뛰어나오는 모습 너무 사랑스러웠어요,2022.08.28
뮤지컬 〈서편제〉,5,잘보고왔어요,차지연님은 워낙 유명하셔서 한번 보고싶었던 송화입니다 왜 유명하셨는지 알것같은 공연이었어요 어제는 2층이라 좀 멀어서 다음에 가까이서 한번 더 보고싶다는 생각을 해보았습니다,2022.08.28
뮤지컬 〈서편제〉,5,감동깊게 잘 봤습니다 ^^,너무 한국적이고 연출도 좋고 넘버가 너무 좋습니다. 배우분들도 다 잘 하시고 감명깊게 잘 봤습니다 ^^,2022.08.28
뮤지컬 〈서편제〉,5,최고,잘 보고 왔습니다,2022.08.28
뮤지컬 〈서편제〉,5,홍송화 최고입니다^^,너무 사랑스럽고 아름답고 소리는 더 최고입니다홍지윤 최고입니다^^,2022.08.28
뮤지컬 〈서편제〉,5,최고에요!,최고에요!,2022.08.28
뮤지컬 〈서편제〉,5,최고에요!,최고에요!,2022.08.28
뮤지컬 〈서편제〉,5,최고에요!,최고에요!,2022.08.28
뮤지컬 〈서편제〉,5,홍지윤님 공연 잘봤습니다,좋은 공연 감사합니다다시보고 싶은 공연입니다,2022.08.28
뮤지컬 〈서편제〉,5,홍지윤 서편제  잘 보고 왔네요,연기도 잘하고  노래도 잘하고 심청가 최고였어요 ^^,2022.08.28
뮤지컬 〈서편제〉,5,유리아 올마이티!!,"이번 시즌에 송화 캐스팅이 6인이나 되서 참 많은 고민이 되었습니다. 그렇지만 리지, 모래시계에서 유리아 배우님에 대한 확신이 생겨서 유리아 송화로 고고!! 연습 중계영상을 보면서 기대감이 뿜뿜했었고, 그걸 실제로 느꼈습니다. 이제는 하다하다 ''창'' 까지 잘 하시다니요 ㅎ 깨긋한 고음역대와 안정적인 연기는 물론이고, 다양한 발성까지 들을 수 있는 작품이었네요.  믿보배 송원근 배우는 다들 왜 더 잘생겨진거냐고 의아해들 하는데 ㅎ 원래 키크고 멋있고 잘생기고 노래잘하고 연기잘하던 배우였던거 다 아시잖아요 ㅎ 이번 동호에서 최고라고 생각합니다 ㅎ  서범석배우는 경력직이란 이런것이다를 보여주는 유봉이었습니다. 정말 그 따뜻하지만 냉정함. 그래서 너무 나쁜 사람이라고 욕하고 싶지만 결국엔 가장 눈물 쏟게 만드는 사람 ㅠㅠ 이래서 다들 서범석 배우를 기다리는구나 라는 생각을 하게 만들었습니다.  같이갔던 지인은 여지없이 눈화장 다 지워지도록 울어서 판다가 되서 나왔습니다 ㅎ 보러가실분들 다 손수건 챙겨가시기를 ㅠㅠ",2022.08.28
뮤지컬 〈서편제〉,2,전 별로였어요~~~,생각보다 전 별로였어요~~,2022.08.28
뮤지컬 〈서편제〉,5,홍송화 감동입니다,홍지윤 이라는분을 다시 알게 되어 기쁩니다.정말 힐링 되는시간이었고 홍지윤 눈물에 함께 울었네요.좋은 뮤지컬입니다,2022.08.28
뮤지컬 〈서편제〉,5,서편제 대박입니다^^ ,홍지윤님 소리와 연기 소름돋았습니다ㆍ^^울고 또 울고 감동의 연속이었습니다ㆍ,2022.08.28
뮤지컬 〈서편제〉,5,여운이 아직도,솔직히 몇장면 울컥해서 지인몰래 눈물 훔치느라 애먹었네요 150분 긴시간이다라고 생각했는대 몰입해서 그런지 너무나 짧은시간이라 느껴졌고 그리고 송화 배역이 너무 적은거 갚기도 하고 홍지윤 배우님은 그냥 송화캐릭터가 딱인듯  시간이 얼마 지나지도 않았는대 한번더 보고 싶네요  서편제 추천합니다,2022.08.27
뮤지컬 〈서편제〉,5,뮤지컬 서편제,넘버도 너무 좋고~ 배우님들의 연기와 노래도 넘 좋았어요 &#128077;,2022.08.27
뮤지컬 〈서편제〉,4,참 귀한 뮤지컬,"역사 속으로 사라지기 전에, 차송화 꼭 한 번 보고 싶어 관람했습니다. 차지연 배우님, 송원근 배우님 정말 기대 이상이었어요! 연기와 노래에 정말 감탄했습니다. 다만 고전적인 스토리인지라, 내용에 있어서는 큰 매력을 느끼지 못했던 것 같아요. 하지만 한국적인 소재와 음악을 아름답게 풀어낸 작품이라는 사실만으로도 서편제는 그 가치를 다하는 것 같습니다. 존재만으로 귀한 작품이에요. 이제 끝난다니 아쉽지만, 그 맥을 이을만한, 서편제를 뛰어넘을 더 멋진 한국적인 매력의 뮤지컬 작품이 탄생하길 바랍니다.",2022.08.27
뮤지컬 〈서편제〉,5,마지막 시즌 서편제~,동호역의 송원근 배우~~♡^.^♡  역시 좋은 호소력이 극을 이끌고 감~~~  1막 끝나고 너무 충격적인 스토리라 인터미션이 반드시 필요한 뮤지컬이다,2022.08.27
뮤지컬 〈서편제〉,5,힐링이 되었습니다.,"업무스트레스가 극심했는데, 힐링이된 시간이었습니다.",2022.08.27
뮤지컬 〈서편제〉,4,오늘 뮤지컬 관람 후기,뮤지컬 서편제마지막 시즌이라고 하는 가운데 송화역-홍지윤동호역-김동완 유봉역-남경주씨가 나온 회차로 봤습니다 우리 고유의 소리와 팝송을 섞어서 이야기를 풀어내는 가운데 나름 울컥하게 하는 지점도 있었고어떻게 보면 유봉의 행동이 지금 이 시대엔 이해가 안될수도 있겠지만 진짜 소리를 찾고자 하는 것 역시 송화 역시 찾을려고 했기에 유봉을 따라간게 아닐까라는 생각을 하게 해주었습니다 아쉬운 점이 없다고는 할수는 없지만 그래도 잘 봤습니다,2022.08.27
뮤지컬 〈서편제〉,5,율송화,율송화 진짜 꼭 한번은 봐야함.. 유리아 때문에 눈물 광광 운다 ㅠㅠㅠ,2022.08.27
뮤지컬 〈서편제〉,1,후기도 아깝다,영화서편제에 너무 감동을 받았기 때문일까 실망 그자체! 1.관람석은 너무 앞좌석과 좁았다 다리가 관람내내 불편할정도로 2.무대 셋팅과 배경은 아마도 최저의 예산을투입한듯 단조롭고 변화없음 그자체였다 3.배우들은 노래를 하는건지 악을 쓰는건지 쉬는 시간에 나왔다. 중간에 나오는 사람들이 꽤있었다 4.최근의관람중에서 최악의공연이다 S석 끊고 나온게 그나마 다행 이다.,2022.08.27
뮤지컬 〈서편제〉,5,너무 좋았어요,송원근배우님 날이 갈수록 감정선이 더 좋아지시네요...  유리아배우님은 눈동자 연기도 하시는데 감탄만 하다 나왔습니다. 잘 봤어요.,2022.08.27
뮤지컬 〈서편제〉,5,감동적인 공연이었습니다,울컥하는 순간이 세번정도 있었네요  강추하는 뮤지컬입니다,2022.08.27
뮤지컬 〈서편제〉,5,송원근 동호 최고다요!!,송원근 동호 최고다요!!  유리아 송화 말해 뭐해ㅠㅠㅠㅠ 서편제 가지마ㅠㅠㅠㅠㅠㅠ,2022.08.27
