musical_title,rate,review_title,review_text,review_date
뮤지컬 〈웨스턴 스토리〉,5,웨스턴 스토리,종환조니 너무 웃김,2022.05.09
뮤지컬 〈웨스턴 스토리〉,5,오랜만에 봐서인지 너무 재밋엇어요!!,조니링고 너무웃곀ㅋㅋㅋㅋㅋㅋ,2022.05.09
뮤지컬 〈웨스턴 스토리〉,5,웨스턴스토리,조니링고가 올리라는  관람후기! 너무 재밌어요!!,2022.05.09
뮤지컬 〈웨스턴 스토리〉,5,좋아요,좋아요,2022.05.09
뮤지컬 〈웨스턴 스토리〉,5,재밌어요,너무 웃겨요 잘봤습니다,2022.05.09
뮤지컬 〈웨스턴 스토리〉,5,재밌어요,너무 웃겨요 잘봤습니다,2022.05.09
뮤지컬 〈웨스턴 스토리〉,5,서부최고,깔깔극의 최고는 역시 서부,2022.05.09
뮤지컬 〈웨스턴 스토리〉,5,기대해 나의 웨스턴스토리,이런 코믹극 너무 소중하네요 배우들이 다 했다 정말ㅋㅋㅋㅋ 모두가 주인공이라고 말해주는 웨스턴스토리 덕분에 오눌도 힘내보겠습니다 기대해 나의 웨수턴스토리!!!!,2022.05.09
뮤지컬 〈웨스턴 스토리〉,5,기대해~,나의~ 웨스턴 스토리!,2022.05.09
뮤지컬 〈웨스턴 스토리〉,5,너무좋아요,너무좋아요!!!짱~너무좋아요!!!짱~너무좋아요!!!짱~너무좋아요!!!짱~너무좋아요!!!짱~너무좋아요!!!짱~너무좋아요!!!짱~너무좋아요!!!짱~너무좋아요!!!짱~너무좋아요!!!짱~너무좋아요!!!짱~너무좋아요!!!짱~너무좋아요!!!짱~너무좋아요!!!짱~너무좋아요!!!짱~너무좋아요!!!짱~너무좋아요!!!짱~너무좋아요!!!짱~너무좋아요!!!짱~너무좋아요!!!짱~너무좋아요!!!짱~너무좋아요!!!짱~너무좋아요!!!짱~너무좋아요!!!짱~너무좋아요!!!짱~너무좋아요!!!짱~너무좋아요!!!짱~,2022.05.09
뮤지컬 〈웨스턴 스토리〉,5,서부!,너무 재미있어요ㅠㅠ,2022.05.09
뮤지컬 〈웨스턴 스토리〉,5,배빌리,아니 진짜 귀여운데 또 엄청 웃김ㅋㅋㅋㅋㅋㅋㅋ,2022.05.09
뮤지컬 〈웨스턴 스토리〉,5,슬펐는데,힐링하고 갑니다감사해요,2022.05.09
뮤지컬 〈웨스턴 스토리〉,5,신성민,잘생겼다,2022.05.09
뮤지컬 〈웨스턴 스토리〉,5,단장님이.... 왜...,김종구 배우님 회차로 봤는데.... 분명 전 날에는 멋있는 단장님이였는데.... 그 다음날 서부에 가보니 애교 많은 연하 키링남이 존재하더라구요...... 역시 배우란 뭘까? 라는 생각과 함께 코미디 공연이여서 아무생각 없이 실컷 웃고 나올 수 있어서 좋았어요!,2022.05.09
뮤지컬 〈웨스턴 스토리〉,5,웨스턴 스토리가 짱이다!!!!!!!!!!,웨스턴 스토리가 짱이다!!!!!!!!!!,2022.05.09
뮤지컬 〈웨스턴 스토리〉,5,너무 웃겨요 ,마음껏 웃기고 웃어도 되는 극 좋네요 오랜만의 웃음 힐링,2022.05.09
뮤지컬 〈웨스턴 스토리〉,5,웨스턴 스토리가 짱이다!!!!!!!!!!,웨스턴 스토리가 짱이다!!!!!!!!!!,2022.05.09
뮤지컬 〈웨스턴 스토리〉,5,웨스턴 스토리가 짱이다!!!!!!!!!!,웨스턴 스토리가 짱이다!!!!!!!!!!,2022.05.09
뮤지컬 〈웨스턴 스토리〉,5,웨스턴,편하게 웃으며 볼수있어서 좋음,2022.05.09
뮤지컬 〈웨스턴 스토리〉,5,어린이날 관극,너무 재밌었어요 어린이날 기념 서부여행 즐거오따,2022.05.09
뮤지컬 〈웨스턴 스토리〉,5,너무 멋진 극!!!,너무너무 훌륭한 작품 좋아요좋아요좋아오  좋아요 좋아요  좋아요  좋아요 !!!!!!!!!,2022.05.09
뮤지컬 〈웨스턴 스토리〉,5,좋어요,좋아요좋아요 좋아요 좋아요  좋아요  좋아요!!!!!!!!!!!,2022.05.09
뮤지컬 〈웨스턴 스토리〉,5,서부!,황량한 사막 무한한 가능성 수 많은 사람들이 일확천금을 노리는 곳!,2022.05.09
뮤지컬 〈웨스턴 스토리〉,5,또 보고싶어요,다시보고 싶어요재연 빨리 올거죠..,2022.05.09
뮤지컬 〈웨스턴 스토리〉,5,좋아요,너무 멋진 극이에요 모두들 예매 고고 ~~~~,2022.05.09
뮤지컬 〈웨스턴 스토리〉,5,어버이날이라고 어머님 목소리를 다 듣네요 ㅋㅋㅋ,예상치도 못한 출연배우 어머님 목소리 ㅋㅋㅋ 진짜 하루하루 공연을 많이 준비하시는 거 같아요 ㅋㅋ 덕분에 정말 재밌게 봤습니다 ㅎ,2022.05.09
뮤지컬 〈웨스턴 스토리〉,5,제발.. 제발 진짜 살려주세요(긍정,ㄴㅓ무 웃김 ㅠㅠ 어떻게 이런 극이....?? 진ㅁ자 너무 웃기고 재밌어요 ㅠㅠ 엉엉,2022.05.09
뮤지컬 〈웨스턴 스토리〉,5,최고,너무재밌어요 ㅜㅜ,2022.05.09
뮤지컬 〈웨스턴 스토리〉,5,너무 멋진극이에여,좋아요 좋앙요 좋아요 좋아요 좋아요 ?!!!!!,2022.05.09
뮤지컬 〈웨스턴 스토리〉,5,웨스턴,자꾸 생각나더라고요..? 그럴 줄 알고 표를 미리 잡아뒀죠 하하,2022.05.09
뮤지컬 〈웨스턴 스토리〉,5,사랑한다 웨스턴 사랑한다 사랑해,사랑한다 웨스턴 사랑한다 사랑해,2022.05.09
뮤지컬 〈웨스턴 스토리〉,5,사랑한다 웨스턴 사랑한다 사랑해,사랑한다 웨스턴 사랑한다 사랑해,2022.05.09
뮤지컬 〈웨스턴 스토리〉,5,매일매일봐도,재미있는 극 !!!  추천 드립니다 !!!,2022.05.09
뮤지컬 〈웨스턴 스토리〉,5,사랑한다 웨스턴 사랑한다 사랑해,사랑한다 웨스턴 사랑한다 사랑해,2022.05.09
뮤지컬 〈웨스턴 스토리〉,5,웨스턴스토리,너무너무재밌어요,2022.05.09
뮤지컬 〈웨스턴 스토리〉,5,유쾌한 뮤지컬,재밌게 봤어요,2022.05.09
뮤지컬 〈웨스턴 스토리〉,4,웨스턴스토리,웨스턴스토리는 편안히 누구나 즐길수 있는 공연이다,2022.05.09
뮤지컬 〈웨스턴 스토리〉,5,유쾌한 뮤지컬,재밌게 봤어요,2022.05.09
뮤지컬 〈웨스턴 스토리〉,5,웨스턴스토리,너무웃어서 힘들어요ㅜㅜ재밌어요!!,2022.05.09
뮤지컬 〈웨스턴 스토리〉,5,너무잘봤습니다,너무 잘봤습니다 최고최고최고!!!!!재밌어요,2022.05.09
뮤지컬 〈웨스턴 스토리〉,5,진짜 재밌어요,정말 후회없는 극 .. 다들 웨스턴 스토리 보고 스트레스 날리고 가세요 ..... !!!!!!!! 진짜 짱짱,2022.05.09
뮤지컬 〈웨스턴 스토리〉,5,뮤지컬 웨스턴스토리,배우들 애드립도 그렇고  즐겁게 볼수있는 뮤지컬,2022.05.09
뮤지컬 〈웨스턴 스토리〉,5,태!권!도!,태권브이 와이어트 ㅋㅋㅋ 태권도가 뭐라고 이렇게 계속 웃기는 거죠 ㅋㅋㅋ,2022.05.09
뮤지컬 〈웨스턴 스토리〉,4,웨스턴,재밌고 유쾌하고 즐거운 공연이다,2022.05.09
뮤지컬 〈웨스턴 스토리〉,5,유쾌한 뮤지컬,재밌게 봤어요,2022.05.09
뮤지컬 〈웨스턴 스토리〉,5,너무 재밌어요!!,매번 달라지는 애드립 너무 재밌고 넘버도 너무 좋아요 ~!!! 재밌게 잘 봤습니다♡,2022.05.09
뮤지컬 〈웨스턴 스토리〉,5,너무 재밌어요,엄마랑 같이 봤는데 엄마도 너무 재밌다고 하고 ㅠㅠㅠㅠㅠㅠㅠㅠ 점점 재밌어지는데 왜 막공을 향해 달려가고 있는지 ......... ㅠㅠㅠㅠㅠㅠ 웨슷 없는 살 말도 안 돼ㅐㅐㅐㅐㅐㅐㅐ,2022.05.09
뮤지컬 〈웨스턴 스토리〉,5,존잼 ㅋㅋㅋㅋ,넘 재밌어요 ㅋㅋ,2022.05.09
뮤지컬 〈웨스턴 스토리〉,5,유쾌한 뮤지컬,재밌게 봤습니다,2022.05.09
뮤지컬 〈웨스턴 스토리〉,5,너무 재밌고 웃겨요,본지 일주일 가까이 되는데도 남궁빌리가 자꾸 생각나서 웃겨요 진짜 배우들 너무 잘하고 웃겨서 기분좋게 관극하고 나왔습니다 공연 너무 재밌어요 강추 본지 일주일 가까이 되는데도 남궁빌리가 자꾸 생각나서 웃겨요 진짜 배우들 너무 잘하고 웃겨서 기분좋게 관극하고 나왔습니다 공연 너무 재밌어요 강추본지 일주일 가까이 되는데도 남궁빌리가 자꾸 생각나서 웃겨요 진짜 배우들 너무 잘하고 웃겨서 기분좋게 관극하고 나왔습니다 공연 너무 재밌어요 강추본지 일주일 가까이 되는데도 남궁빌리가 자꾸 생각나서 웃겨요 진짜 배우들 너무 잘하고 웃겨서 기분좋게 관극하고 나왔습니다 공연 너무 재밌어요 강추본지 일주일 가까이 되는데도 남궁빌리가 자꾸 생각나서 웃겨요 진짜 배우들 너무 잘하고 웃겨서 기분좋게 관극하고 나왔습니다 공연 너무 재밌어요 강추본지 일주일 가까이 되는데도 남궁빌리가 자꾸 생각나서 웃겨요 진짜 배우들 너무 잘하고 웃겨서 기분좋게 관극하고 나왔습니다 공연 너무 재밌어요 강추본지 일주일 가까이 되는데도 남궁빌리가 자꾸 생각나서 웃겨요 진짜 배우들 너무 잘하고 웃겨서 기분좋게 관극하고 나왔습니다 공연 너무 재밌어요 강추본지 일주일 가까이 되는데도 남궁빌리가 자꾸 생각나서 웃겨요 진짜 배우들 너무 잘하고 웃겨서 기분좋게 관극하고 나왔습니다 공연 너무 재밌어요 강추본지 일주일 가까이 되는데도 남궁빌리가 자꾸 생각나서 웃겨요 진짜 배우들 너무 잘하고 웃겨서 기분좋게 관극하고 나왔습니다 공연 너무 재밌어요 강추본지 일주일 가까이 되는데도 남궁빌리가 자꾸 생각나서 웃겨요 진짜 배우들 너무 잘하고 웃겨서 기분좋게 관극하고 나왔습니다 공연 너무 재밌어요 강추본지 일주일 가까이 되는데도 남궁빌리가 자꾸 생각나서 웃겨요 진짜 배우들 너무 잘하고 웃겨서 기분좋게 관극하고 나왔습니다 공연 너무 재밌어요 강추본지 일주일 가까이 되는데도 남궁빌리가 자꾸 생각나서 웃겨요 진짜 배우들 너무 잘하고 웃겨서 기분좋게 관극하고 나왔습니다 공연 너무 재밌어요 강추,2022.05.09
뮤지컬 〈웨스턴 스토리〉,5,웨스턴 스토리,보고있으면 즐겁고 행복해지는 극! 잘봤어요ㅋㅋ,2022.05.09
뮤지컬 〈웨스턴 스토리〉,4,서부이야기,재밌어욬ㅋㅋㅋㅋㅋㅋㅋ,2022.05.09
뮤지컬 〈웨스턴 스토리〉,5,서부의 왕,난 이 세상을 가진 서부의 왕 누구든 따라올테면 따라와봐 여기 개척의 시대 황금의 세상,2022.05.09
뮤지컬 〈웨스턴 스토리〉,5,재밌어요,재밌어요,2022.05.09
뮤지컬 〈웨스턴 스토리〉,5,그냥 조니가 눈만 부릅뜨고 있어도 너무 웃겨요 ㅋㅋㅋㅋ,그냥 표정만으로도 웃긴데 말투도 웃기고 꽃 떨어지면 온몸으로 사수를 하질 않나 와이어트랑 미친듯이 티격태격 대지를 않나 ㅋㅋㅋ 너무 웃겨요 조니 링고 ㅋㅋ,2022.05.09
뮤지컬 〈웨스턴 스토리〉,5,영웅이 필요할 땐 나를 불러,공연 내내 깔깔거리며 웃었네요 너무 재밌었습니다 배우님들 천재예요,2022.05.09
뮤지컬 〈웨스턴 스토리〉,5,보석반지도 선물받은,더 선물 같았던 공연!!,2022.05.09
뮤지컬 〈웨스턴 스토리〉,5,빌리는 결국 오렌지 농장으로...,우리 착한 빌리는 악당은 커녕 오렌지 아저씨를 따라 쫄래쫄래 농장으로 가네요 해맑게 땀 뻘뻘 흘리며 오렌지를 따고 있을듯ㅋㅋㅋㅋㅋ,2022.05.09
뮤지컬 〈웨스턴 스토리〉,5,웨스턴 스토리,가볍게 웃으면서 볼 수 있는 몇 안 되는 극이라 보는 내내 행복해요 서부 사람들 모두를 사랑하게 되어버렸습니다.......,2022.05.09
뮤지컬 〈웨스턴 스토리〉,5,신나는 어린이날!!,어린이날에 서부에 와서 신나게 보내고 갔어요^^,2022.05.09
뮤지컬 〈웨스턴 스토리〉,5,재밌어요,넘버랑 애드립 너무 좋아요,2022.05.09
뮤지컬 〈웨스턴 스토리〉,5,끝나가서 아쉬워요,넘 재밌어요,2022.05.09
뮤지컬 〈웨스턴 스토리〉,5,배우들 합 최고ㅋㅋㅋㅋㅋ,오늘 어버이날이라고 원종환 배우님 어머님(진짜인지는 잘 모르겠지만) 나레이션 등장에 한참 웃었네요ㅋㅋㅋㅋㅋㅋㅋ 커튼콜 때 원종환배우님 다시 등장하셨을 때도 너무 웃겼어요ㅋㅋㅋㅋ관객분과 호중이 던지고 받는 부분도 생각나네요ㅋㅋㅋㅋ배우들 합은 정말 최고라고 생각합니다!!자기소개 넘버들이 머리에서 안 빠져요ㅋㅋㅋㅋ극 시작과 끝부분은 어느 극보다 최고인것 같아요 온 몸에 전율이...사이드 무대 활용하는 것도 너무 좋구요!!,2022.05.09
뮤지컬 〈웨스턴 스토리〉,5,웃다가 기절할 듯,"이렇게 배우님들과 관객들 모두가 내내 즐거운 작품은 오래간만인 것 같아요!! 별 5개도 부족한 공연!! 어버이 날이라 종환조니 어머님 목소리도 듣고, 애드리브 폭발한 회차 ㅋㅋㅋ 즐거웠습니다!!",2022.05.09
뮤지컬 〈웨스턴 스토리〉,5,사랑하는 페어,정말 좋아하는 페어였어요!! 짱,2022.05.09
뮤지컬 〈웨스턴 스토리〉,4,우당탕탕 스펙터클한 서부의 이야기,쉴새없이 몰아치는 개그와 신나는 넘버들로 시간가는 줄 모르고 봤습니다. 애드립인지 대본인지 분간이 안 갈 정도로 너무 웃겼어요. 중간중간 사의 찬미나 렌트 패러디?!도 너무 재밌게 잘 봤습니다.,2022.05.09
뮤지컬 〈웨스턴 스토리〉,5,서부 붙박이중입니다,봐도 봐도 질리지않습니다ㅠㅠㅠ 매번 애드립이 새로워요 ㅋㅋㅋ,2022.05.09
뮤지컬 〈웨스턴 스토리〉,5,기대해 나의 웨스턴 스토리,서부! 황량한 사막 무한한 가능성 수많은 사람들이 일확천금을 노리는 곳!,2022.05.09
뮤지컬 〈웨스턴 스토리〉,5,왠지 뭉클해지는,마지막에는 왠지 모르게 뭉클한 기분이 들어요ㅠ,2022.05.09
뮤지컬 〈웨스턴 스토리〉,5,재미있어요,재미있어요!,2022.05.09
뮤지컬 〈웨스턴 스토리〉,5,아 걍 너무 웃겨요,짱...ㅜ,2022.05.09
뮤지컬 〈웨스턴 스토리〉,5,재미있어요~,재미있어요,2022.05.09
뮤지컬 〈웨스턴 스토리〉,5,신나는 서부 탕탕,배우분들 열연이 최고입니다!!,2022.05.09
뮤지컬 〈웨스턴 스토리〉,5,달새야~~,나의 종달새~~,2022.05.09
뮤지컬 〈웨스턴 스토리〉,5,지독한 서부살이중,서부살이중 너무 행복함 ㅠ ㅠㅠㅠㅠㅠ 랄라라라라라라~~~~~~~~~,2022.05.09
뮤지컬 〈웨스턴 스토리〉,5,지독한 서부살이중,서부살이중 너무 행복함 ㅠ ㅠㅠㅠㅠㅠ 랄라라라라라라~~~~~~~~~,2022.05.09
뮤지컬 〈웨스턴 스토리〉,5,지독한 서부살이중,서부살이중 너무 행복함 ㅠ ㅠㅠㅠㅠㅠ 랄라라라라라라~~~~~~~~~,2022.05.09
뮤지컬 〈웨스턴 스토리〉,5,지독한 서부살이중,서부살이중 너무 행복함 ㅠ ㅠㅠㅠㅠㅠ 랄라라라라라라~~~~~~~~~,2022.05.09
뮤지컬 〈웨스턴 스토리〉,5,좋은 공연 감사합니다,"항상 웃다 갑니다 감사해요 창작진, 오늘의 배우분들 그리고 같이 웃어준 오늘의 관객들까지",2022.05.09
뮤지컬 〈웨스턴 스토리〉,5,지독한 서부살이중,서부살이중 너무 행복함 ㅠ ㅠㅠㅠㅠㅠ 랄라라라라라라~~~~~~~~~,2022.05.09
뮤지컬 〈웨스턴 스토리〉,5,즐거운 서부극!,사람들이 왜 서부극을 좋아하는지 느낄 수 있었어요,2022.05.09
뮤지컬 〈웨스턴 스토리〉,5,지독한 서부살이중,서부살이중 너무 행복함 ㅠ ㅠㅠㅠㅠㅠ 랄라라라라라라~~~~~~~~~,2022.05.09
뮤지컬 〈웨스턴 스토리〉,5,정말 재밌게 보고 왔습니다!!,정말 배우님들의 활약이 엄청난 극이었습니다 ! 배우분들의 애드립이 극 전체의 반은 차지한 것 같았어요! 그래도 재밌어서 잘 보고 나왔습니다! 정말 쉴 수 없이 계속 웃었던 것 같아요!!,2022.05.09
뮤지컬 〈웨스턴 스토리〉,5,짱!!,최고였어요!!항상볼때마다 신나게 웃고나옵니다.ㅋㅋㅋㅋ,2022.05.09
뮤지컬 〈웨스턴 스토리〉,5,지독한 서부살이중,서부살이중 너무 행복함 ㅠ ㅠㅠㅠㅠㅠ 랄라라라라라라~~~~~~~~~,2022.05.09
뮤지컬 〈웨스턴 스토리〉,5,배우들의 애드립과 합이 짱,갓페어 보고 왔습니다정말 쉬지 않는 그들의 애드립에 정신을 못 차렸습니다좋단 의미죠어쩜 이렇게 재밌게 그것도 매번!! 재밌게!?!최고에요 원종환 <<어버이날공연 정말 최고였습니다 짱,2022.05.09
뮤지컬 〈웨스턴 스토리〉,5,웨스턴은 볼때마다 재밌어요…,시간이 지날수록 배우님들의 페어합이 더 좋아지는 것 같아요!,2022.05.09
뮤지컬 〈웨스턴 스토리〉,5,지독한 서부살이중,서부살이중 너무 행복함 ㅠ ㅠㅠㅠㅠㅠ 랄라라라라라라~~~~~~~~~,2022.05.09
뮤지컬 〈웨스턴 스토리〉,5,웨스턴스토리,추천합니다!!!,2022.05.09
뮤지컬 〈웨스턴 스토리〉,5,^^,뮤지컬 웨스턴스토리 진짜 너무너무 재미있어요  아직 안보신분들 꼭 보세요ㅋㅋㅋㅋㅋ 진짜 너무 재미있어서 표가 계속 늘어나요ㅋㅋㅋㅋㅋㅋ 배우님들 연기도 너무 좋고 넘버도 좋아요 담주에도 또보러 가려구요^^,2022.05.09
뮤지컬 〈웨스턴 스토리〉,5,지독한 서부살이중,서부살이중 너무 행복함 ㅠ ㅠㅠㅠㅠㅠ 랄라라라라라라~~~~~~~~~,2022.05.09
뮤지컬 〈웨스턴 스토리〉,5,웨스턴스토리,여길 허물고 철도가 깔리면~,2022.05.09
뮤지컬 〈웨스턴 스토리〉,5,어린이날에 보는 웨스턴!!!!,표 구하기 진짜 힘들었는데 예대가 터졌어 ㅠㅠㅠㅠㅠ 이 자리 처음인데 그래도 괜찮게 봤다 재밌었어!!!,2022.05.09
뮤지컬 〈웨스턴 스토리〉,5,배우님들 열일하시는 모습에,감동했어요!,2022.05.09
뮤지컬 〈웨스턴 스토리〉,5,서부 황량한 사막 무한한 가능성,황량한 대학로에 내려앉은 무한한 웃포들간만에 크게 웃고 나왔습니다,2022.05.09
뮤지컬 〈웨스턴 스토리〉,5,웨스턴스토리,깅종구 정연 페어 짱ㅋㅋㅋㅋㅋㅋ너무재밌었어요,2022.05.09
뮤지컬 〈웨스턴 스토리〉,5,최고의 웃음,웨스턴 스토리 보고 올 때마다 행복해져요. 웃음도 있고 은근한 감동도 한스푼 있는 극이에요.,2022.05.09
뮤지컬 〈웨스턴 스토리〉,5,꺅 짱지혜!,신성민 개웃김ㅠ,2022.05.09
뮤지컬 〈웨스턴 스토리〉,5,최고의 페어..,1막부터 끝날 때까지 숨도 못쉴정도로 웃었네욬ㅋㅋㅋㅋㅋㅋㅋㅋㅋㅋㅋㅋㅋ 티키타카가 가장 중요한 극이라고 생각이 드는데 오늘 페어가 서로를 잘 보고 서로의 애드립을 정말 잘 받아치는 페어라 쫀쫀해서 정말 재밌었어용!!,2022.05.09
뮤지컬 〈웨스턴 스토리〉,5,웨스턴 스토리,너무 재밌게 봤어요! 유쾌한 뮤지컬 추천합니다!,2022.05.09
뮤지컬 〈웨스턴 스토리〉,5,너무 웃겨요 ㅋㅋㅋㅋㅋ,정말 숨 쉴 틈 없이 웃고 나왔어요 ㅋㅋㅋㅋ 아무 생각 없이 마음껏 웃고 나올수 있어서 너무 행복했어요!,2022.05.09
뮤지컬 〈웨스턴 스토리〉,4,너무 재밌어요~,매일 보는 느낌이 다르네요! 재밌습니다. 배우님들 너무 잘하세요!,2022.05.09
뮤지컬 〈웨스턴 스토리〉,5,재미있어요,한국인지 서부인지 모를 공간에서 펼쳐지는 서부 이야기!,2022.05.09
뮤지컬 〈웨스턴 스토리〉,5,모두가 주인공인 공연 행복해,모두가 주인공인 공연 행복해,2022.05.09
뮤지컬 〈웨스턴 스토리〉,5,웨스턴 스토리,김 골반씨의 골반은..어후야...,2022.05.09
뮤지컬 〈웨스턴 스토리〉,5,아무생각없이 웃고 싶다면 추천합니다,이런 공연이 있어서 너무 좋아요!! 그냥 웃고 싶었는데 딱이에요,2022.05.09
뮤지컬 〈웨스턴 스토리〉,5,아무생각 없이 웃을수있는,현실을 잊고 극에  푹 빠져 아무생각 없이 실컷 웃을수 있는 즐거운 뮤지컬 . 배우님들 도 너무 잘하시고 넘버도 정말 좋았습니다.,2022.05.09
뮤지컬 〈웨스턴 스토리〉,4,점점,점점 원래가 생각이 안나요ㅋㅋㅋ 오늘은 다들 커플들이 아닐까?ㅋㅋㅋ,2022.05.09
뮤지컬 〈웨스턴 스토리〉,5,정말 재밌는 공연,공연보는 내내 웃었네요,2022.05.09
뮤지컬 〈웨스턴 스토리〉,5,.,왜 다들 이렇게 좋아할까 하고 처음엔 그저 궁금했고 두번째엔 그냥 다시 한번 꼭 보고싶다라는 생각이 들었던 ㅋㅋㅋㅋㅋㅋ 걱정 고민 다 떨치고 시원하게 웃을 수 있어 그랬던 것 같다,2022.05.09
뮤지컬 〈웨스턴 스토리〉,5,항상 너무 재밌어요,이 시국에 맘껏 웃을 수 있는 극이 있어서 너무너무 좋네요ㅠㅠ??????????,2022.05.09
뮤지컬 〈웨스턴 스토리〉,5,기깔나는 서부극,1달만에 다시 갔는데 여전히 정말 웃기고 재밌고 감동까지 다 합니다... 호중링고 너무 웃겨요ㅋㅋ 이후제인 고음대단해요!!,2022.05.09
뮤지컬 〈웨스턴 스토리〉,5,웨스턴 스토리,아버님 존함이? 로 버자 트자 ㅋㅋㅋㅋㅋㅋㅋㅋㅋㅋㅋㅋㅋㅋㅋㅋ 여기는 미국 서부!,2022.05.09
뮤지컬 〈웨스턴 스토리〉,5,서부살고싶어요,모래바람~~ 먹구름~~,2022.05.09
뮤지컬 〈웨스턴 스토리〉,5,재미있어요,재미있어요,2022.05.09
뮤지컬 〈웨스턴 스토리〉,5,재밌어요~,너무 웃겨요ㅋㅋㅋ,2022.05.09
뮤지컬 〈웨스턴 스토리〉,5,웨스턴스토리,서부 황량한 사막 무한한 가능성보러 가야함,2022.05.09
뮤지컬 〈웨스턴 스토리〉,5,정맒 재미있게 보았어요~,정맒 재미있게 보았어요~,2022.05.09
뮤지컬 〈웨스턴 스토리〉,5,재미있어요,좋아하는 페어 최고~~ 웃긴 윤소호 사랑해요~!!!,2022.05.09
뮤지컬 〈웨스턴 스토리〉,5,재밌어요,조니링고 덕분에 맘껏 웃었어요,2022.05.09
뮤지컬 〈웨스턴 스토리〉,5,재밌어요,댕로 최고의 깔깔극 인정합니다,2022.05.09
뮤지컬 〈웨스턴 스토리〉,5,웃음이 필요할땐 나를찾아,캐릭터들이 매력적이고 노래도 좋아요 죽는사람없고 절대적인 악당도 없는 해피엔딩인 코미디극이라 편하게볼수있어서 좋아요,2022.05.09
뮤지컬 〈웨스턴 스토리〉,5,실컷 웃다 나왔습니다,"너무 편안하게 실컷 웃으면서 보고 나왔습니다... 자주 뮤지컬을 보지는 못해서 마지막으로 즐거운 극을 보고 싶었는데, 정말 재밌었습니다.!",2022.05.09
뮤지컬 〈웨스턴 스토리〉,5,정맒 재미있게 보았어요~,정맒 재미있게 보았어요~,2022.05.09
뮤지컬 〈웨스턴 스토리〉,5,웨스턴 스토리,오십이만 오천분의 귀한시간들 이걸 여기서 들을 줄이야 ㅋㅋㅋ,2022.05.09
뮤지컬 〈웨스턴 스토리〉,5,미니소연은,최고의페어다. 당장박제를주고...다음에도데려와주새요,2022.05.09
뮤지컬 〈웨스턴 스토리〉,5,어린이날!,어린이날이었어서 그런지 어린이날 관련 애드립이 많았어요! 셋이 묶여있을때오소연 배우님이 맥주얘기하시면서 종구비어 드립 치신거 너무 웃겼어요 ㅋㅋㅋㅋ 그리고 버드해리송때 재현배우님 나라배우님 나오셔서 애기 빌리와 밥아저씨 재현한게 너무 귀엽고 센스있었어요 ㅠㅜ 으앜 돌뿌리!! ....니네 아빠 죽었어...까지 ㅋㅋㅋㅋ 그리고 배나라 배우님 사찬 홍보 진짜 잠깐 하셨는데 너무 잘부르세요 ㅠㅜ 다 너무 멋있으세요!!,2022.05.09
뮤지컬 〈웨스턴 스토리〉,5,정맒 재미있게 보았어요~,정맒 재미있게 보았어요~,2022.05.09
뮤지컬 〈웨스턴 스토리〉,5,매일 매일 보고 싶어요,일상 생활에 큰 힘이 되었어요!정말 재미있게 잘 보았습니다!,2022.05.09
뮤지컬 〈웨스턴 스토리〉,5,정맒 재미있게 보았어요~,정맒 재미있게 보았어요~,2022.05.09
뮤지컬 〈웨스턴 스토리〉,5,웨스턴 스토리,꽉 닫힌 해피엔딩이라 너무 좋아요!,2022.05.09
뮤지컬 〈웨스턴 스토리〉,5,미니소연,최고의페어박제주ㅛㅔ여,2022.05.09
뮤지컬 〈웨스턴 스토리〉,5,웨스턴 스토리,장재웅 잘생겼다,2022.05.09
뮤지컬 〈웨스턴 스토리〉,5,정맒 재미있게 보았어요~,정맒 재미있게 보았어요~,2022.05.09
뮤지컬 〈웨스턴 스토리〉,5,배꼽 도둑들,이 미남미녀들이 제 배꼽을 훔쳐갔습니다,2022.05.09
뮤지컬 〈웨스턴 스토리〉,5,참사잊지못할듯요ㅋㅋ,에녹와이어트님이 의자부셔서ㅋㅋㅋㅋㅋㅋ 그래도 배우님은 안다쳐서 다행이네요 혜인제인이 내재산하는것두 웃겼구요 버드와해리가 뒷수습하는것도ㅋㅋㅋ,2022.05.09
뮤지컬 〈웨스턴 스토리〉,5,즐겁다,마참내,2022.05.09
뮤지컬 〈웨스턴 스토리〉,5,응원치료가 필요한,ENFP... 미쳣냐고여ㅠ 웃다가 쓰러지겟음....,2022.05.09
뮤지컬 〈웨스턴 스토리〉,5,정맒 재미있게 보았어요~,정맒 재미있게 보았어요~,2022.05.09
뮤지컬 〈웨스턴 스토리〉,5,재밌어요!,재밌게봤습니다~,2022.05.09
뮤지컬 〈웨스턴 스토리〉,5,정맒 재미있게 보았어요~,정맒 재미있게 보았어요~,2022.05.09
뮤지컬 〈웨스턴 스토리〉,5,웨스턴 스토리,윤소호 잘생겼다,2022.05.09
