musical_title,rate,review_title,review_text,review_date
뮤지컬 〈웨스턴 스토리〉,5,너무 웃겨욬ㅋㅋㅋㅋㅋㅋ,어제보고 너무 웃겨셔 친구데리고 또왔습니닼ㅋㅋㅋㅋㅋㅋㅋㅋ 친구가 자기친구 또 데려온대옄ㅋㅋㅋㅋㅋㅋㅋㅋ,2022.04.22
뮤지컬 〈웨스턴 스토리〉,5,ㅏㅏㅏ,ㅏㅏㅏ,2022.04.22
뮤지컬 〈웨스턴 스토리〉,5,ㅏㅏㅏ,ㅏㅏㅏ,2022.04.22
뮤지컬 〈웨스턴 스토리〉,5,ㅏㅏㅏㅏ,ㅏㅏㅏ,2022.04.22
뮤지컬 〈웨스턴 스토리〉,5,ㅏㅏㅏ,ㅏㅏㅏ,2022.04.22
뮤지컬 〈웨스턴 스토리〉,5,웨스턴 스토리,너무 웃기고 항상 배우들의 에너지에 파이팅 받고 오는 극인 것 같아요! 무슨 애드립이든 가능한 이곳은 서부이니까~,2022.04.22
뮤지컬 〈웨스턴 스토리〉,5,전페어 못 본 사람 없어야함!!!,무조건 전페어 다 봐야해요!!! 못 본 사람 없어야합니당!!!!! 모든 페어가 다 소중하고 사랑입니다아!!!,2022.04.22
뮤지컬 〈웨스턴 스토리〉,5,잘보고왔습니다,언제 봐도 재밌어요,2022.04.22
뮤지컬 〈웨스턴 스토리〉,5,웨스턴 수토리,서부! 황량한 바람 불어오는 곳~ 넘버 좋고 배우들 좋고 가격만 안좋은 코믹뮤지컬,2022.04.22
뮤지컬 〈웨스턴 스토리〉,5,뮤지컬 세계관에 떨어진 복수남 빌리의 환장쇼,빌리: 노래좀하지마!!!!!!!!!!!!!!  빌리의 오만 환장 표정이 너무 재밌어서 계속 보러가게 됩니다.,2022.04.21
뮤지컬 〈웨스턴 스토리〉,5,재미있어요,재미있게 잘봤습니다..ㅎㅎ,2022.04.21
뮤지컬 〈웨스턴 스토리〉,4,ㅎㅎㅎ,재밌게 봤습니다.,2022.04.21
뮤지컬 〈웨스턴 스토리〉,4,ㅎㅎㅎ,재밌게 봤습니다.,2022.04.21
뮤지컬 〈웨스턴 스토리〉,5,이시국 최고의 뮤지컬,짱이에요 재밌어요 모든 배우들이 너무 잘해요 또 보고싶어요~~~~~ 다음에는 다른 캐스팅으로 보려구요,2022.04.21
뮤지컬 〈웨스턴 스토리〉,5,최고의 뮤지컬,강력추천합니다 개콘이사라진이유 1등,2022.04.21
뮤지컬 〈웨스턴 스토리〉,5,어딘가 이상한 정통서부극,"정통서부극이라는 말이 어딘가 어색한 극이지만 분명 정통,, 서부,,극이 맞다,,! 메타개그, 배우개그를 좋아하는 사람은 꼭 봐야함.",2022.04.21
뮤지컬 〈웨스턴 스토리〉,4,웨스턴스토리,가볍게 웃을 수 있습니다뮤지컬 보면서 가슴깊은 감동을 기대하면 안되요재미있게 가볍게 볼수있어요,2022.04.21
뮤지컬 〈웨스턴 스토리〉,5,이것은 무슨 공연인가!!!,쉴새 없이 쏟아지는 배우들의 어록들!  그 사이에서 춤추고 있는 관객들까지!  쉼 없이 즐기다 왔어요. 너무 행복했습니다.,2022.04.21
뮤지컬 〈웨스턴 스토리〉,4,스트레스받을때 웃음으로 해소할 수 있는극,너무 재밌었어요! 이미 와이어트의 골반돌리기는 많이 들어서 알고 있었는데 역시 현장에서 보는게 너무 웃기더라고요... 케이트와 프레디의 꽁냥씬도 너무 재밌고 조니의 병원놀이도 너무 재밌었어요!! 극을 이끌어가는 제인과 제인을 도와주는 버드와 해리도 짱!! 복수를 위해 찾아온 빌리도 너무 멋있었습니다!! 배우들의 애드립덕분에 진짜 빵빵 터졌어욬ㅋㅋㅋㅋ,2022.04.21
뮤지컬 〈웨스턴 스토리〉,5,처음부터 끝까지 완벽하게 웃김ㅋ,"전통 서부극인데 거기에 B급 갬성이 난무하는 처음부터 끝까지 완벽하게 웃김ㅋ 유쾌한 정도가 아니라 신나게 웃고 나왔음. 내용을 알아도 웃기고 몰라도 웃기고, 스토리 연결이 어색할법도 한데 그런 부분없이 너무 자연스러운 전개는 극본도 좋고 배우들도 찰떡같기 때문인거 같아요. 저게.. 서로 합의된 연기인지 애드립인지 구분이 안되는 부분이 너무 많을정도로... 간만에 신나고 유쾌하고 즐겁게 본 퀄리티 좋은 작품!!",2022.04.21
뮤지컬 〈웨스턴 스토리〉,5,신나게 웃었습니다.,신나게 웃었어요~!!,2022.04.21
뮤지컬 〈웨스턴 스토리〉,5,언제나 즐거운 서부!,공연 너무 재밌어요!  이벤트 있는 날은 티켓창구 나눠져있어도 줄 많은쪽 티켓수령을 옆에서도 같이 처리해주셨으면 좋겠습니다.,2022.04.21
뮤지컬 〈웨스턴 스토리〉,5,ㄴㅓ무 재미있어요,계속 웃으면서 봤어요,2022.04.21
뮤지컬 〈웨스턴 스토리〉,5,배꼽 빠지는 극,처음부터 끝까지 너무너무 신나게 즐길수 있는  오랜만에 맘껏 웃을 수 있는 극이었습니다.  조니링고. 그의 단발.  잊혀지지가 않아요.,2022.04.21
뮤지컬 〈웨스턴 스토리〉,5,웨스턴스토리 최고,여러번 봐도 매번 애드립이 달라져서 너무 재밌어요!,2022.04.21
뮤지컬 〈웨스턴 스토리〉,5,최지혜짱,너무너무너무 재밌고 유쾌한극,2022.04.21
뮤지컬 〈웨스턴 스토리〉,5,웃을수없는시기에 보면 위로받는극,혐생이 지긋지긋하거나 웃을일이 없는 현대인들에게 강력추천합니다!  2시반동안 아무생각없이 볼수 있는 잼있는 공연입니다.,2022.04.21
뮤지컬 〈웨스턴 스토리〉,5,웃다가 눈물 난 뮤지컬 ㅜㅜㅋㅋㅋㅋㅋㅋㅋㅋㅋ,배우분들 애드립에 웃겨서 눈물 흘리고 나왔어요ㅋㅋㅋㅋㅋㅋ 엔딩도 좋고 넘버들도 중독성 있어서 기억에 남네요 강추합니다!,2022.04.21
뮤지컬 〈웨스턴 스토리〉,4,재밌어요,많이 웃고 나옵니다. 정연 배우가 너무 웃기고 연기를 잘해요 ㅋㅋㅋㅋㅋ,2022.04.21
뮤지컬 〈웨스턴 스토리〉,4,추천합니다,"배우님들 모두 너무 잘하셔서 호강하고 옵니다 ^^ ,,,",2022.04.21
뮤지컬 〈웨스턴 스토리〉,5,재밌어용 ㅠㅠㅠ,애드립 ㅠㅠㅠㅠㅠㅠ 너무 재밌어요 ㅠㅠㅠㅠ,2022.04.21
뮤지컬 〈웨스턴 스토리〉,5,진짜 즐거웠어요,노래도 신나고 배우들 연기도 재미나서 많이 웃었어요 진짜 노래가 너무 신나서 박수치며 보고 싶었네요,2022.04.21
뮤지컬 〈웨스턴 스토리〉,5,K-서부 여행 다녀가요,맘껏 웃고 갑니다 너무 재미있었어요 태권도!,2022.04.21
뮤지컬 〈웨스턴 스토리〉,5,안녕 내가 바로 주인공~,"모두가 각자 인생의 주인공인 웨스턴 스토리 그저 유쾌하게 깔깔 웃기는 것만이 아닌, 따뜻한 메세지도 담겨있는 스토리가 좋았습니다.",2022.04.21
뮤지컬 〈웨스턴 스토리〉,5,뮤지컬 콜라보!!,너무 재밌게 본 뮤지컬이라 부모님과 또 왔어요. 프랑켄슈타인에 지킬앤 하이드 까지 이 작품을 보며 생각하게 될줄이얔ㅋㅋㅋㅋ 너무 웃겨요,2022.04.21
뮤지컬 〈웨스턴 스토리〉,5,오렌지 아저씨!!!,서부의 진짜 주인공!! 모두가 주인공!!! 너무 재밌어서 두시간동안 깔깔 웃다가 나왔습니다. 다른 배우들의 연기도 궁금해요!!,2022.04.21
뮤지컬 〈웨스턴 스토리〉,5,진짜 너무 재밌었어요,그 웃긴상황을 웃지 않고 어떻게 참을 수 있는거죠? 너무 신기하고 넘 잘해서 재밌게 봤어요!성민배우님 최고!,2022.04.21
뮤지컬 〈웨스턴 스토리〉,5,동북아시아의 스토리,태권도 ㅎㅎㅎ,2022.04.20
뮤지컬 〈웨스턴 스토리〉,5,배우들 너무 짱이예여 ~,명창이다 !,2022.04.20
뮤지컬 〈웨스턴 스토리〉,5,웨스턴스토리,너무재밌어요 진짜 ㅋㅋㅋㅋㅋㅋ 또 보러갈게요!,2022.04.20
뮤지컬 〈웨스턴 스토리〉,5,재밌었어요!!,요새 대학로에서 가장 핫한 뮤지컬!! 이유가 있네요 너무 재밌게 잘 봤습니다. 등장인물을 하나하나 다 중요하게 다뤄줘서 더 좋았습니다.,2022.04.20
뮤지컬 〈웨스턴 스토리〉,5,존잼,ㅋㅋㅋㅋㅋㅋㅋㅋㅋ 웃음밖에 안나와요 근데 무대 음향이구린건지 대사들이 잘 안들려요 ㅠㅠ그거빼곤  배우님들은 다 최고!!!!,2022.04.20
뮤지컬 〈웨스턴 스토리〉,5,서부시대로의 여행,상큼한 오렌지 보러 다녀왔습니다 너무 행복한 시간이였어요,2022.04.20
뮤지컬 〈웨스턴 스토리〉,5,마냥 웃고 싶을때,아무 생각없이 웃고 싶을 때 보면정말 좋은 극인거 같아요팍팍한 현실을 잠시 잊고 공연 보며머리 식히기가 딱 좋아요배우님들의 연기력도 굿굿!애드립의 재치력도 굿굿!!재밌습니다.,2022.04.20
뮤지컬 〈웨스턴 스토리〉,5,너무 재밌어요,너무너무 잘 웃었어요 재밌어요,2022.04.20
뮤지컬 〈웨스턴 스토리〉,5,서부의 옷을 입은 리틀 썸씽로튼,모든 게 정상,2022.04.20
뮤지컬 〈웨스턴 스토리〉,5,예예 잘생김~☆~,잘생겻다~☆~)~)~)미니,2022.04.20
뮤지컬 〈웨스턴 스토리〉,5,재밌어요,정통 서부극.. 진짜 웃다가 온 기억만 있습니다..^-^ 배우들끼리 티키타카하는게 정말 웃기더라고요. 이번에는 버드와 해리송도 추가됐다고 들었는데 엔딩크레딧까지 올라가는게 정말 서부 영화 보는 느낌이였습니다.,2022.04.20
뮤지컬 〈웨스턴 스토리〉,5,11열에 앉았는데,임준혁 배우님 눈 앞으로 지나가시는거 보고 입 밖으로 심장 튀어나오는 줄 알았어요.. 여러분..11열입니다..11열에 앉으세요....,2022.04.20
뮤지컬 〈웨스턴 스토리〉,5,서부! 황량한~,언제 봐도 재밌고 웃음포인트 가득한 즐거운 공연!,2022.04.20
뮤지컬 〈웨스턴 스토리〉,5,유쾌한 뮤지컬,재밌게 봤어요. 유쾌한 볼거리가 가득!!!,2022.04.20
뮤지컬 〈웨스턴 스토리〉,5,웨스턴스토리 추천,웨스턴스토리 추천,2022.04.20
뮤지컬 〈웨스턴 스토리〉,5,잘봤어요,꿀잼 회차였습니다 배우분들의 센스가 아주 돋보었어요,2022.04.20
뮤지컬 〈웨스턴 스토리〉,5,재미있어요,유쾌하고 즐거운 뮤지컬!! 재밌게 웃다가 왔네요,2022.04.20
뮤지컬 〈웨스턴 스토리〉,5,인생이 재미없다면,최고의 서부극 웨스턴스토리를 보러 유니플렉스1관으로 가세요,2022.04.20
뮤지컬 〈웨스턴 스토리〉,5,최고의 서부극,불편하지 않은 개그와 애드립으로 가득한 공연이었어요 너무 추천합니다,2022.04.20
뮤지컬 〈웨스턴 스토리〉,5,웨스턴 스토리,상황에 따라 치는 애드립들이 다 정말 재밌습니다.,2022.04.20
뮤지컬 〈웨스턴 스토리〉,5,재밌어요,배우분들이 연기를 정말 너무 잘하세요...,2022.04.20
뮤지컬 〈웨스턴 스토리〉,5,너무 재밌어요!!,2022년 대학로 최고의 공연 인정합니다,2022.04.20
뮤지컬 〈웨스턴 스토리〉,5,신성민 짱,오늘도 너무 웃겼어요 태권도!!! 넥슬라이스!!!,2022.04.20
뮤지컬 〈웨스턴 스토리〉,5,배나라 빌리 정연 오세핀  너무 웃겨요 ㅋㅋㅋㅋㅋㅋㅋㅋㅋ,웃다가 지쳐 나오는 극 강추합니다!,2022.04.19
뮤지컬 〈웨스턴 스토리〉,5,서부! 황량한 사막 무한한 가능성!,봐도 봐도 너무 재밌는 웨스턴 스토리 대학로 최고의 힐링 뮤지컬!! 근데 거기에 최고의 캐스팅을 곁들인~  진짜 뉴프로 역사에 길이 남는 명작이라고 생각해요,2022.04.19
뮤지컬 〈웨스턴 스토리〉,5,꺌꺌꺌,아이고 내 배 재밌습니다. 네,2022.04.19
뮤지컬 〈웨스턴 스토리〉,5,잘 봤습니다 조금 아쉽기도,유머코드가 잘 맞는 분들에겐 재미있는 뮤지컬일 듯. 배우들이 매력 넘칩니다 다만 서사는 매우 아쉽네요 재연때는 막판에 바람 빠지는 기분이 안 들게끔 수정됐음 좋겠어요 예전에 사찬이 글루미데이였던 시절 회전문 돌았는데 중간중간 익숙한 넘버와 장면이 연상되는 장치가 많아 개인적으로 좋았습니다 ~,2022.04.19
뮤지컬 〈웨스턴 스토리〉,4,갈수록 더 웃겨짐,배우님들 평소에 웃기고 싶었던거 여기서 다 풀고있음 ㅋㅋㅋ 덕분에 배꼽 줍느라 집에 늦게갑니다요...,2022.04.19
뮤지컬 〈웨스턴 스토리〉,4,너무 웃김,배우들이 정말 하드캐리 하는 극입니다 ㅋㅋ 쓸데없이 잘생기고 쓸데없이 웃긴 사람들,2022.04.19
뮤지컬 〈웨스턴 스토리〉,5,유쾌한 뮤지컬,보는동안 아무 걱정없이 그저 웃을 수 있는 뮤지컬. 누구나 웃을 수 있는 극을 만든게 대단할 따름,2022.04.19
뮤지컬 〈웨스턴 스토리〉,5,웨스턴 스토리,너무 재밌어요 짱,2022.04.19
뮤지컬 〈웨스턴 스토리〉,5,웨스턴 스토리,캐슷 한명만 달라져도 다른재미를 준다  그래서 계속 보게된다,2022.04.19
뮤지컬 〈웨스턴 스토리〉,5,재밌어요,재밌어요,2022.04.19
뮤지컬 〈웨스턴 스토리〉,5,재밌습니다,대학로 대표 깔깔극이라고 생각해요 강력추천합니다.,2022.04.19
뮤지컬 〈웨스턴 스토리〉,5,가볍고 유쾌하게 즐기는 공연,"마음 편히 웃으면서 즐길 수 있는 귀한 공연입니다 불편한 내용 하나 없이 2시간을 웃음으로 채우고, 이미 여러 번 본 사람도 매번 새롭게 웃게 하는... 심지어 갈수록 더 웃겨서 객석에서 박수(코로나 때문에 너무 웃기면 환호 대신 박수를 침)가 끊임없이 터지게 하는.. 그 어려운 일을 두 달이 넘게 해내고 있어요. 모두가 진짜 주인공인 공연, 모두 가짜인 공연! 웃다 보면 감동도 있고, 진지하게 감동할라치면 금방 또 웃기고... 낡고 지친 직장인에게는 너무 소중하네요ㅠㅠ",2022.04.19
뮤지컬 〈웨스턴 스토리〉,5,가볍고 유쾌하게 즐기는 공연,"마음 편히 웃으면서 즐길 수 있는 귀한 공연입니다 불편한 내용 하나 없이 2시간을 웃음으로 채우고, 이미 여러 번 본 사람도 매번 새롭게 웃게 하는... 심지어 갈수록 더 웃겨서 객석에서 박수(코로나 때문에 너무 웃기면 환호 대신 박수를 침)가 끊임없이 터지게 하는.. 그 어려운 일을 두 달이 넘게 해내고 있어요. 모두가 진짜 주인공인 공연, 모두 가짜인 공연! 웃다 보면 감동도 있고, 진지하게 감동할라치면 금방 또 웃기고... 낡고 지친 직장인에게는 너무 소중하네요ㅠㅠ",2022.04.19
뮤지컬 〈웨스턴 스토리〉,5,가볍고 유쾌하게 즐기는 공연,"마음 편히 웃으면서 즐길 수 있는 귀한 공연입니다 불편한 내용 하나 없이 2시간을 웃음으로 채우고, 이미 여러 번 본 사람도 매번 새롭게 웃게 하는... 심지어 갈수록 더 웃겨서 객석에서 박수(코로나 때문에 너무 웃기면 환호 대신 박수를 침)가 끊임없이 터지게 하는.. 그 어려운 일을 두 달이 넘게 해내고 있어요. 모두가 진짜 주인공인 공연, 모두 가짜인 공연! 웃다 보면 감동도 있고, 진지하게 감동할라치면 금방 또 웃기고... 낡고 지친 직장인에게는 너무 소중하네요ㅠㅠ",2022.04.19
뮤지컬 〈웨스턴 스토리〉,5,가볍고 유쾌하게 즐기는 공연,"마음 편히 웃으면서 즐길 수 있는 귀한 공연입니다 불편한 내용 하나 없이 2시간을 웃음으로 채우고, 이미 여러 번 본 사람도 매번 새롭게 웃게 하는... 심지어 갈수록 더 웃겨서 객석에서 박수(코로나 때문에 너무 웃기면 환호 대신 박수를 침)가 끊임없이 터지게 하는.. 그 어려운 일을 두 달이 넘게 해내고 있어요. 모두가 진짜 주인공인 공연, 모두 가짜인 공연! 웃다 보면 감동도 있고, 진지하게 감동할라치면 금방 또 웃기고... 낡고 지친 직장인에게는 너무 소중하네요ㅠㅠ",2022.04.19
뮤지컬 〈웨스턴 스토리〉,5,가볍고 유쾌하게 즐기는 공연,"마음 편히 웃으면서 즐길 수 있는 귀한 공연입니다 불편한 내용 하나 없이 2시간을 웃음으로 채우고, 이미 여러 번 본 사람도 매번 새롭게 웃게 하는... 심지어 갈수록 더 웃겨서 객석에서 박수(코로나 때문에 너무 웃기면 환호 대신 박수를 침)가 끊임없이 터지게 하는.. 그 어려운 일을 두 달이 넘게 해내고 있어요. 모두가 진짜 주인공인 공연, 모두 가짜인 공연! 웃다 보면 감동도 있고, 진지하게 감동할라치면 금방 또 웃기고... 낡고 지친 직장인에게는 너무 소중하네요ㅠㅠ",2022.04.19
뮤지컬 〈웨스턴 스토리〉,5,가볍고 유쾌하게 즐기는 공연,"마음 편히 웃으면서 즐길 수 있는 귀한 공연입니다 불편한 내용 하나 없이 2시간을 웃음으로 채우고, 이미 여러 번 본 사람도 매번 새롭게 웃게 하는... 심지어 갈수록 더 웃겨서 객석에서 박수(코로나 때문에 너무 웃기면 환호 대신 박수를 침)가 끊임없이 터지게 하는.. 그 어려운 일을 두 달이 넘게 해내고 있어요. 모두가 진짜 주인공인 공연, 모두 가짜인 공연! 웃다 보면 감동도 있고, 진지하게 감동할라치면 금방 또 웃기고... 낡도 지친 직장인에게는 너무 소중하네요ㅠㅠ",2022.04.19
뮤지컬 〈웨스턴 스토리〉,5,완전 빵빵 터지는 극!,두번째로 보러 간 거였는데 처음 볼 때보다 훨씬 재밌게 봤습니다. 자리는 1층 12열이었는데 바로 앞에 빌리후커 역을 맡으신 배우님이 지나가셔서 너무 신기하고 재밌었어요~ 출연하는 배우님들 모두 각자의 뚜렷한 매력이 있고 또 다채로운 애드립들과 대사 등을 살리는 능력이 진짜 최고입니다! 또 보러 갈게요!,2022.04.19
뮤지컬 〈웨스턴 스토리〉,4,재미있어요,배우분들의 애드립이 좋네요,2022.04.19
뮤지컬 〈웨스턴 스토리〉,5,서부!!,모두가 영웅이될수있는곳,2022.04.19
뮤지컬 〈웨스턴 스토리〉,5,볼 때마다 행복해지는 본격 힐링극!,넘버도 신나고 캐릭터도 뚜렷하고 결코 선을 넘지 않는 코믹요소까지..! 깔깔대고 나면 걱정 근심 다 잊고 행복해져서 나와요.,2022.04.19
뮤지컬 〈웨스턴 스토리〉,5,유쾌하고 즐거운 뮤지컬,언제봐도 유쾌한 뮤지컬,2022.04.19
뮤지컬 〈웨스턴 스토리〉,5,유쾌하고 재밌어요,언제봐도 유쾌한 뮤지컬,2022.04.19
뮤지컬 〈웨스턴 스토리〉,5,유쾌하고 재밌어요,언제봐도 유쾌한 뮤지컬,2022.04.19
뮤지컬 〈웨스턴 스토리〉,5,너무 재밌었어요,진짜 엄청 웃어서 운 기분이네요 진짜 너무 행복한 시간이었습니다 감사합니다,2022.04.19
뮤지컬 〈웨스턴 스토리〉,4,웨스턴,공연 너무 너무 재미있어요~ 엄청 웃다 나왔습니다 배우님들 너무 잘하시네요!!,2022.04.19
뮤지컬 〈웨스턴 스토리〉,5,너무 재밌어요!,최고의 공연입니다!,2022.04.19
뮤지컬 〈웨스턴 스토리〉,4,역시 재밌네요,역시 재밌네요,2022.04.19
뮤지컬 〈웨스턴 스토리〉,5,재미있어요,짱재미있어요~~~~~~\~,2022.04.19
뮤지컬 〈웨스턴 스토리〉,5,웨스턴 스토리,우울했던 감정도 싹 날려주는 극. 뮤지컬치료 제대로 받아서 좋았습니다.,2022.04.19
뮤지컬 〈웨스턴 스토리〉,4,ㅋㅋㅋㅋㅋㅋㅋㅋㅋㅋㅋㅋㅋㅋㅋㅋㅋㅋㅋㅋㅋ,ㅋㅋㅋㅋㅋㅋㅋㅋㅋㅋㅋㅋㅋㅋㅋㅋㅋㅋㅋㅋㅋㅋㅋㅋㅋㅋㅋㅋㅋㅋㅋㅋㅋㅋㅋㅋㅋㅋㅋㅋㅋㅋㅋㅋㅋㅋㅋㅋㅋㅋㅋㅋㅋㅋㅋㅋㅋㅋㅋㅋㅋㅋㅋㅋㅋㅋㅋㅋㅋㅋㅋㅋㅋㅋㅋㅋㅋㅋㅋㅋㅋㅋㅋㅋㅋㅋㅋㅋㅋㅋㅋㅋㅋㅋㅋㅋㅋㅋㅋㅋㅋㅋㅋㅋㅋㅋㅋㅋㅋㅋㅋㅋㅋㅋㅋㅋㅋㅋㅋㅋㅋㅋㅋㅋㅋㅋㅋㅋㅋㅋㅋㅋ하...,2022.04.18
뮤지컬 〈웨스턴 스토리〉,3,재밌게 봤습니다,우당탕탕 서부극 그 자체라서 보는 내내 즐거웠다 :D,2022.04.18
뮤지컬 〈웨스턴 스토리〉,5,세상에 이런 재밌는 공연이!!,너무 재밌어서 자꾸만 보고 싶어요!배우님들의 애드리브를 이렇게 즐길 수 있다니 최고입니다! 안볼 수 없는 매력적인 극!!,2022.04.18
뮤지컬 〈웨스턴 스토리〉,5,넘나 재밌는 웨스턴스토리 ,어느 캐스트 하나 버릴 것리 없고 신나게 웃고 나올 수 있는 즐거운 극입니다. 짱이예요!,2022.04.18
뮤지컬 〈웨스턴 스토리〉,5,짱재밌는 웨스턴스토리!,배꼽빠지게 웃다가 나왔네요!이렇게 재밋는 극을 누가 안봤나요??,2022.04.18
뮤지컬 〈웨스턴 스토리〉,5,서부 너무 재밌어요! 웨스턴스토리 짱!!,봐고 또 봐도 매번 너무 재밌고 신나게 웃고 나와서 좋아요!! 오래오래 해주셨으면!!,2022.04.18
뮤지컬 〈웨스턴 스토리〉,5,재미져요,추천받아서 간 건데 또 보고싶어요,2022.04.18
뮤지컬 〈웨스턴 스토리〉,5,귭이어트~♡,"하트성애자 귭이어트님 오늘 무대에서 날아다니셨어요 ㅋㅋㅋㅋㅋㅋ 스쿼트 정말.....ㅋㅋㅋㅋㅋㅋㅋ 모든 배우분들 애드립과, 연기, 노래 정말 좋았습니당 웃느라고 극 끝나고 엄청 배고팠어요",2022.04.18
뮤지컬 〈웨스턴 스토리〉,4,재밌습니다.,스토리 음악.. 그리고 어디까지가 애드립인지 모르겠는 대사들 ㅋㅋ 너무재밌습니다! ㅎㅎㅎ,2022.04.18
뮤지컬 〈웨스턴 스토리〉,5,재밌어요,웨스턴 스토리 웃기고 좋아요. 보는 내내 웃으면서 보는 극!,2022.04.18
뮤지컬 〈웨스턴 스토리〉,5,재밌어요,진짜 빵빵 터지고 너무 재밌게 봐써요 또 보고 싶습니다…..,2022.04.18
뮤지컬 〈웨스턴 스토리〉,5,보다보니 정드는 서부,생각할수록 정드는 서부네요,2022.04.18
뮤지컬 〈웨스턴 스토리〉,5,재밌어요,재밌습니다,2022.04.18
뮤지컬 〈웨스턴 스토리〉,5,사랑해요 오소연 ㅋㅋㅋㅋㅋㅋㅋ,웃길땐 확실하게 극 진행할땐 바로 중심잡고 ㅋㅋㅋㅋㅋ  진짜 최고에요,2022.04.18
뮤지컬 〈웨스턴 스토리〉,5,너무 웃겨요 ㅋㅋㅋㅋㅋㅋㅋ,누가 봐도 다 웃을만한 뮤지컬이에요 ㅋㅋㅋ 최고 ㅋㅋㅋ,2022.04.18
뮤지컬 〈웨스턴 스토리〉,5,굿굿,녹와이어트 너무 웃겨요ㅋㅋㅋㅋㅋ,2022.04.18
뮤지컬 〈웨스턴 스토리〉,5,레전드 코믹극~!!,너무너무너무 재밌었습니다ㅠㅠㅠ  평일에 힘들고 지친 마음.. 웃음으로 싹 날려주는 작품!,2022.04.18
뮤지컬 〈웨스턴 스토리〉,5,좋아ㅆ어요,좋았어요,2022.04.18
뮤지컬 〈웨스턴 스토리〉,5,좋았어요,좋았어요,2022.04.18
뮤지컬 〈웨스턴 스토리〉,5,너무 재미있게 잘 봤습니다.,서부의 뮤뱅! 진짜 대본인지 애드립인지 구분도 안되고 동생이랑 너무 재미있게 잘 보고 왔습니다! 아직 안 보신분들은 얼른 예매하고 꼭 보러가시길 바래요!!,2022.04.18
뮤지컬 〈웨스턴 스토리〉,5,못봤는데,재밌었을거같음,2022.04.18
뮤지컬 〈웨스턴 스토리〉,5,배우별 조합에 따라 달라지는 그 느낌,또라이x또라이 붙으면 개또라이..... 많은 사람들이 이 또라이같은 극을 봤으면 좋겠어요,2022.04.18
뮤지컬 〈웨스턴 스토리〉,5,재밌어요,너무 유쾌하고 재미있는 공연이었습니다.,2022.04.18
뮤지컬 〈웨스턴 스토리〉,4,2층1열,배우님들이 사이드동선으로 빠지시면 안보이고버드해리송도 안전바가 올라와서 얼굴이 안보이는 경우가 많았어요.극은 재밌게 봤는데 시야가 많이 아쉬웠어요 ㅠ,2022.04.18
뮤지컬 〈웨스턴 스토리〉,5,종구와이어트,울보컨셉이신거 처음알았네요 ㅋㅋㅋㅋ제일 덩치크신데 제일 많이 울먹거리셔섴ㅋㅋㅋㅋ3와이어트중에 가장 다채로운 춤을 추셔서 넘 웃겨욬ㅋ,2022.04.18
뮤지컬 〈웨스턴 스토리〉,5,졔솧미니정연종환페어,제일 애정합니다 제일 웃기고요제일 잡기 힘든회차기도 해요 ㅠㅠ,2022.04.18
뮤지컬 〈웨스턴 스토리〉,5,녹와이어트,수염을 진작에 떼는건 알았는데 충청도 사투리 쓰실줄은 몰랐어요 ㅋㅋㅋㅋㅋㅋ,2022.04.18
뮤지컬 〈웨스턴 스토리〉,5,첫관극이 너무 웃겨서,계속 예매해서 보는중입니다,2022.04.18
뮤지컬 〈웨스턴 스토리〉,4,즐거워여,생각없이 보기좋은,2022.04.18
뮤지컬 〈웨스턴 스토리〉,5,한바탕 웃고나올 수 있는 극이 있어서 너무 좋아요,우울한 기분을 날려버릴 수 있는 공연입니다,2022.04.18
뮤지컬 〈웨스턴 스토리〉,5,재미있어요!,정말 재미있게 봤습니다!,2022.04.18
뮤지컬 〈웨스턴 스토리〉,5,웨스턴스토리,아니 숨쉴 틈 없이 애드립 대사를 치는 대종조니 ㅋㅋㅋㅋㅋㅋ 소호배우님 진짜 프로예요 ㅋㅋㅋ 1도 웃지 않아 ㅋㅋㅋㅋㅋ 앞으로도.. 종구와이어트의 골반... 지켜줘요 ㅠㅠㅠㅠ,2022.04.18
뮤지컬 〈웨스턴 스토리〉,5,정말 아무 생각 없이 웃고 나왔어요.,정말 아무 생각 없이 웃고 나왔어요. 스트레스 싹 해소하고 많이 행복해진 시간이었습니다.,2022.04.18
