musical_title,rate,review_title,review_text,review_date
뮤지컬 〈디아길레프〉,5,유현석 배우님 천재,유현석 배우님 천재,2022.05.09
뮤지컬 〈디아길레프〉,5,단장님 가지마세요(안감)박민성 강정우 가지마,디아길레프 거지마 뮤지컬 브누아 만즐어주세요,2022.05.09
뮤지컬 〈디아길레프〉,5,재밌어요,발레뤼스 조합 좋아요,2022.05.09
뮤지컬 〈디아길레프〉,5,재밌었어요,뮤지컬 디아길레프 재밌었어요,2022.05.09
뮤지컬 〈디아길레프〉,5,유현석 짱짱,유현석 짱짱맨,2022.05.09
뮤지컬 〈디아길레프〉,5,"배우, 조명, 영상이 만나 이루는 하모니",발레뤼스의 4명이 서로 페트루슈카를 위해 서로의 멜로디를 맞추듯이  디아길레프도 이 배우님들과 연출 그리고 넘버가 서로 맞추어 완전한 극이 되었다.,2022.05.09
뮤지컬 〈디아길레프〉,5,정말 울컥하면서 봤어요,너무 외로워보이던 단장님... 엔딩에서 함께 울었습니다,2022.05.09
뮤지컬 〈디아길레프〉,5,디아길레프,디아길레프디아길레프디아길레프,2022.05.09
뮤지컬 〈디아길레프〉,4,니진스키와 또 다른 매력,디아길래프의 시점에서 극을 볼 수 있어서 새로웠어요,2022.05.09
뮤지컬 〈디아길레프〉,5,곧 끝나는게 너무 마음아차요,정말 너무 재미있는데 사람들이 왜 이런 갓ㅁㅍ지컬을 몰라보는걸까요 너무 재밋어요 안끝났우면 좋겟어요 많이 보러와주새요 존버타면 ㅅ할인도 많이 풀어줘요..,2022.05.09
뮤지컬 〈디아길레프〉,5,재밌는 공연  추천합니다,브누아와 디아길레프의 가장 사랑했던 스콜 너무 재밌었어요ㅠㅠ 앞으로도 이런 스콜 이벤트가 더 많아졌으면 좋겠습니다!! 기대할게요!!,2022.05.09
뮤지컬 〈디아길레프〉,5,감동적인 공연,음악이면 음악 발레면 발레 조명이면 조명 무엇하나 빼놓을 수 없이 아름답게 반짝이는 무대였습니다. 배우님들의 연기합도 너무 잘 맞고 디아길레프의 일대기를 다루면서 그의 인생에 가장 임팩트 있던 순간과 사건들을 반짝이는 순간으로 되돌려 놓은 느낌이에요,2022.05.09
뮤지컬 〈디아길레프〉,5,브누아,너무 좋아요....,2022.05.09
뮤지컬 〈디아길레프〉,5,디아길레프,막이 올라가는 순간 또 이별을 준비하네ㅠㅠㅠ,2022.05.09
뮤지컬 〈디아길레프〉,5,디아길레프 일주일 남았습니다 이건 꼭 봐야합니다,디아길레프 일주일 남았습니다 이건 꼭 봐야합니다,2022.05.09
뮤지컬 〈디아길레프〉,5,복권 당첨 시켜주시겠어요?,진짜 디아길레프 너무 좋다 보내고 싶지 않다 이번주에 또 가지만 그냥 보내고 싶지 않다 그나마 보내줄 수 있는 건... 니진스키에 캐스트가 그대로 온다는 것뿐이 위로가 됨 ㅠ,2022.05.09
뮤지컬 〈디아길레프〉,5,최고의 공연,넷의 조합이 너무 좋네요,2022.05.09
뮤지컬 〈디아길레프〉,5,재미있어요,재미있어요 좋은 공연입니다  추천합니다 추천 강추,2022.05.09
뮤지컬 〈디아길레프〉,5,추천,디아길레프 왜 안봐요? 우리 단장님 우리 브누아 천재들 만세!!!,2022.05.09
뮤지컬 〈디아길레프〉,5,끝나가는게 아쉬운 공연,"스토리, 넘버, 배우들의 연기까지 어느 하나 부족한 것이 없어서 갈 때마다 너무 재밌게 보고옵니다. 15일이 막공인데 끝나가는 게 너무 아쉬워요. 게다가 이번 공연이 이 페어 막공이었다니ㅠㅠ 배우님들 너무 소중해요...",2022.05.09
뮤지컬 〈디아길레프〉,5,최고의 공연,오늘 전작의 니진스키였던 배우의 스콜까지 너무나 완벽했던 공연이었어요 ㅠㅠ!!  니진스키도 기대할게요,2022.05.09
뮤지컬 〈디아길레프〉,5,좋았습니다.,자꾸 조별과제 얘기가 생각나지만...ㅋㅋㅋ 봄의 제전 안무 좋아요!,2022.05.09
뮤지컬 〈디아길레프〉,5,너무 잘봤습니다,발레에 대해서도 관심이 생길만큼 너무 흥미로웠어요. 무대도 정말 아름답고 배우분들도 멋있었어요,2022.05.09
뮤지컬 〈디아길레프〉,4,자둘매직?,"첫 번째 관람보다 좋았어요 발레, 조명, 무대아트가 예뻐요",2022.05.09
뮤지컬 〈디아길레프〉,5,좋은 공연입니다,재미있어요 감동입니다 노래가 좋습니다 추천합니다 좋은 공연입니다 강추합니다,2022.05.09
뮤지컬 〈디아길레프〉,5,정말 좋았어요,음악도 연출도 무대도 모든 것이 아름다운 극이었습니다,2022.05.09
뮤지컬 〈디아길레프〉,5,너무 좋아요,넘버가 너무너무 좋습니다,2022.05.09
뮤지컬 〈디아길레프〉,5,이 페어 정말 사랑입니다 근데....,마지막이라는게 사실인가요ㅠㅠㅠㅠ 디아길레프 오픈런으로 해주시길 바랍니다 정마류ㅠㅠㅠㅠㅠㅠㅠ이 페어는 두고두고 봐야하는데ㅠㅠ 곧 있으면 못 본다는게 너무 슬프네요ㅠㅠㅠㅠ 다음 시즌에도 배유님들 모두 와주셨으면 좋겠습니다 꼭이요ㅠㅠ 제가 이 페어가 꼭 다시 보고싶어요ㅠㅠㅠㅠ 너무 좋았습니다ㅠㅠ 디아길레프 흥해라!!!!,2022.05.09
뮤지컬 〈디아길레프〉,5,결국 그가 가장 사랑 하는 것,가장 사랑했던 넘버에서 마지막 가장 사랑하는 넘버까지 디아길의 그 시간들이 너무 사무치게 좋은 극,2022.05.09
뮤지컬 〈디아길레프〉,5,막이 올라가는 순간,또 이별을 준비하네  관객도 똑같이 느껴요 그 기분 너무 잘 알 거 같아요ㅠㅠㅠㅠㅠㅠㅠㅠㅠㅠㅠㅠ,2022.05.09
뮤지컬 〈디아길레프〉,5,재밌어요,스스콜까지 완벽했어요 다시 보고싶은데 다시 볼수가없는 페어라서ㅠㅠ,2022.05.09
뮤지컬 〈디아길레프〉,5,막이 올라가는 순간 또 이별을 준비하네,가장 사랑했던 모든 것들을 떠나보내고 혼자가 될 준비,2022.05.09
뮤지컬 〈디아길레프〉,3,디아길레프의 제작자적인 면모가 돋보이는..,"극에서 디아길레프가 걸어온 발레뤼스의 제작자 측면의 모습을 극대화해서 올린건 좋았다고 생각합니다만, 디아길레프와 니진스키의 관계가 잘 보이지는 않네요. 그저 극단 단원 이상도 이하도 아닌 관계로 보이고 오히려 브누와와 디아길레프의 믿음의 관계가 더 돋보였습니다.",2022.05.09
뮤지컬 〈디아길레프〉,5,발레뤼스,천재1234,2022.05.09
뮤지컬 〈디아길레프〉,5,재밌어요,영상 장치 활용이 맘에 들어요,2022.05.09
뮤지컬 〈디아길레프〉,5,좋은 공연입니다,재미있어요 좋은 공연입니다 추천합니다 감동입니다 강추!,2022.05.09
뮤지컬 〈디아길레프〉,5,진짜 아름다운 극이에요,배우들도 너무 잘하고  연기도 노래도 조명도 너무 좋아요  연장해주세요!!!!!!!!!!!!!!!!!,2022.05.09
뮤지컬 〈디아길레프〉,5,디아길레프,디아길레프 너무좋아요~ 권기중니진스키 정말 좋았어요!!,2022.05.09
뮤지컬 〈디아길레프〉,5,발레뤼스 너무 좋아요,다음주가 벌써 막공이라니ㅠ 너무너무 아쉽습니다. 너무 재미있었고 마지막 세르게이 넘버 너무ㅠㅠ좋아요ㅠㅠㅠ,2022.05.09
뮤지컬 〈디아길레프〉,5,최고의 스페셜 커튼콜데이,본공도 엄청 좋았는데 스페셜 커튼콜이 진짜 배찢어지는줄 알았어요.. 너무 유쾌하고 재밌었어요.. 디아길레프 최고.. 진심입니다.,2022.05.09
뮤지컬 〈디아길레프〉,5,재밌게 잘 봤어요,사내연애를 하면 안되는 이유 잘 보고 왔습니다,2022.05.09
뮤지컬 〈디아길레프〉,5,뮤지컬 디아길레프,세번째지만 새로운 페어라 또 다른 새로운 재미가 있었어요!! 어쩜 이렇게 매번 새로움을 느끼고 가는지........ 공연이 한달쯤은 더 연장했으면 좋겠다고 아니 계에속 했으면 좋겠다고  느낄 정도로 끝나간다는 게 아쉽습니다 ㅠㅠ,2022.05.09
뮤지컬 〈디아길레프〉,5,디아길레프,설득맆에서 점차 니진스키에 이입되기 시작하는,2022.05.09
뮤지컬 〈디아길레프〉,5,가장 사랑하는,감동오만배… 지훈 스트라빈스키 지휘하는 거 맨날 봐요~~ 봐도봐도 안 질리는 극!!,2022.05.09
뮤지컬 〈디아길레프〉,5,미치겟어 디아길레프 너 땜에,공연을 본 이후로 디아길레프 생각 뿐입니다 0515일 오지마,2022.05.09
뮤지컬 〈디아길레프〉,5,브누아 가지마...,엉엉엉...,2022.05.09
뮤지컬 〈디아길레프〉,5,썽테 썽떼,잔을 섞어~~~,2022.05.09
뮤지컬 〈디아길레프〉,5,김종구 배우님,연기도 노래도 너무 좋아요...,2022.05.09
뮤지컬 〈디아길레프〉,5,스콜 너무 좋았어요,당신께 감사를 스콜있던 회차였는데  공연도 좋았지만 스콜이 단순 공연 장면이 아니라 공연에 없던 이야기를 보여주셔서 더더욱 기억에 남을 거 같아요 감사합니다,2022.05.09
뮤지컬 〈디아길레프〉,4,디아길레프,너무 아름다운 무대 영상과 조명 그리고 넘버들 발레뤼스와 디아길레프가 이렇구나라는 것을 알 수 있어서 좋았고 니진스키역의 배우의 유려한 발레도 돋보였습니다:),2022.05.09
뮤지컬 〈디아길레프〉,5,넘버 마약같아요.,귀에서 계속 하나씩 넘버별로 생각나요  특히 마지막 곡 가장사랑하는 은 최고명곡입니다. 김종구 배우님 커튼콜에서 감정 갈무리 안된 상태로 인사하는데 저도 같이 감정 갈무리 안된 상태로 집에 와서 지금까지도 계속생각나요. 디아길레프 명작입니다. 드들 끝나기 전에 꼭 보셨으면 좋겠어요.,2022.05.09
뮤지컬 〈디아길레프〉,4,디아길레프,넘버 좋아요~~~~,2022.05.09
뮤지컬 〈디아길레프〉,5,갓극이에요,전 페어 전 캐릭터 저는 너무너무 다 좋고 오슷도 바로 사서 듣는중인데 너무 좋아요ㅠ 보내기 아쉬운 발레뤼스,2022.05.09
뮤지컬 〈디아길레프〉,5,넘 좋았어요,영상 음악 전부 다 너무 좋았어요 배우들의 연기도 너무너무 좋았어요 오슷도 사서 게속 듣는중,2022.05.09
뮤지컬 〈디아길레프〉,5,디아길레프,디아길레프~ 재미있었어요~ 권기중 니진스키 정말 예뻐요~,2022.05.09
뮤지컬 〈디아길레프〉,5,펑펑 울렀어여,슬퍼잉...,2022.05.09
뮤지컬 〈디아길레프〉,5,너무 재미있어요,보자마자 반할수밖에 없는 귀를 사로잡는 넘버에ㅠㅠㅠㅠ 자꾸 보고싶어져요 너무 늦게 이 공연을 알게된 것이 아쉬워요,2022.05.09
뮤지컬 〈디아길레프〉,5,좋아요,이제 얼마 남지 않아 너무 아쉬운 디아길ㅠㅠㅠㅠ 넘 재밌어요,2022.05.09
뮤지컬 〈디아길레프〉,5,재밌어요!!!,재밌어요!!!!!,2022.05.09
뮤지컬 〈디아길레프〉,5,발레를 사랑해버린 운명,김지훈 스트라빈스키 ㅠㅠㅠㅠㅠㅠ너무좋아요 ㅜㅜㅜㅜㅜㅜㅠㅠㅠ시작은도 ㅠㅠㅠㅠㅠ너무잘해요 ㅠㅠㅠㅠㅠㅠㅠㅠㅠㅠ 회차가 거듭할수록 실력이 점점 느는 천재대배우…,2022.05.09
뮤지컬 〈디아길레프〉,5,디아길레프 가지마요,막공이 점점 다가오고 있어요.. 이미 단장님들 그리워요&#129402;,2022.05.09
뮤지컬 〈디아길레프〉,5,재밌어요,썽떼 썽떼 잔과 잔을 섞어~~~,2022.05.09
뮤지컬 〈디아길레프〉,5,영원을 꿈꾸는 광끼!!!!!,바슬라프의 안무를 더 보고싶어요,2022.05.09
뮤지컬 〈디아길레프〉,5,디아길레프,썽떼~ 썽떼~,2022.05.09
뮤지컬 〈디아길레프〉,5,디아길레프,조명이랑 무대가 너무 예뻐요 단장님 짱,2022.05.09
뮤지컬 〈디아길레프〉,5,좋아요,좋아요,2022.05.09
뮤지컬 〈디아길레프〉,5,영상미 최고,너무 아름다웠어요^^,2022.05.09
뮤지컬 〈디아길레프〉,5,재밌어요!!!,재밌어요!!!,2022.05.09
뮤지컬 〈디아길레프〉,5,커튼콜은 끝났어,관객은 떠났고,2022.05.09
뮤지컬 〈디아길레프〉,5,재밌어요,강추합니다,2022.05.09
뮤지컬 〈디아길레프〉,5,단장님,이번 주도 잘 부탁드립니다 꾸벅,2022.05.09
뮤지컬 〈디아길레프〉,5,좋아요,잘봤어요,2022.05.09
뮤지컬 〈디아길레프〉,5,사랑이었을까 광기였을까,"서로에 대한 마음이 사랑이었을까 광기였을까 아님,,,, 성공을 위한 수단이진 않았을까 싶어요",2022.05.09
뮤지컬 〈디아길레프〉,5,재밌어요,스토리가 술술 흘러가서 재밌고 배우님들 너무 잘해요...,2022.05.09
뮤지컬 〈디아길레프〉,5,등장인물도 다 좋아여,노래가 다 젛아요!!!,2022.05.09
뮤지컬 〈디아길레프〉,5,뮤지컬 디아길레프 강력추천합니다 ,뮤지컬 디아길레프 강력추천합니다 뮤지컬 디아길레프 강력추천합니다 뮤지컬 디아길레프 강력추천합니다,2022.05.09
뮤지컬 〈디아길레프〉,5,미리볼걸,진작볼걸.. 왜 막공이죠,2022.05.09
뮤지컬 〈디아길레프〉,5,좋아요,진짜로 좋음,2022.05.09
뮤지컬 〈디아길레프〉,5,아무도 가지 않은 길,강정우 브누아 김지훈 스트라빈스키 너무 좋아요 ㅠㅠ 발레뤼스의 보물… 이 둘의 캐릭터가 결이 너무 잘 맞아서 보는 내내 너무 편안했어요,2022.05.09
뮤지컬 〈디아길레프〉,5,이번 할인권종명이 맘에 들어ㅛ\요,사실 이거 치면서 눈물나는거 같네요,2022.05.09
뮤지컬 〈디아길레프〉,5,아름다운 뮤지컬이에요,노래도 무대도 너무 아름다워요!!!,2022.05.09
뮤지컬 〈디아길레프〉,5,넘버좋음,좋아요,2022.05.09
뮤지컬 〈디아길레프〉,5,조성윤 최고,조성윤 최고 단장님 사랑해요 조명실 탕탕 !!,2022.05.09
뮤지컬 〈디아길레프〉,5,디아길레프,"넘버가 너무 취향이고, 네 사람의 다양하고 섬세한 감정 연기가 좋았습니다.",2022.05.09
뮤지컬 〈디아길레프〉,5,미치겠어 디아길레프,상태입니다. 진짜 조성윤 디아길레프 때문에 볼때마다 머리 깨요..ㅠㅠ 어쩜 사람이 꾹꾹 참아온 감정을 그렇게 터트려주는지 볼때마다 미치겠어요.  그리고 유현석 배우님 오랜만에 봤는데 진짜 인간브누아 너무 좋아해요. 유현석브누아!!!!!!!,2022.05.09
뮤지컬 〈디아길레프〉,5,디아길렢,미치겠어~,2022.05.09
뮤지컬 〈디아길레프〉,5,뮤지컬 디아길레프,제가 지금 네 개까 후기를 적고 있어요  일주일에 디아길레프 표만 네 장이라는 게  무슨 의미인지 아십니까...  그만큼 진심이라는 뜻입니다......  정말요 이 극은 정말 재미있어요  사랑해 정민찬 니진스키,2022.05.09
뮤지컬 〈디아길레프〉,5,좋은 공연입니다,할인명에 탐나서 예매했는데 이렇게 대레전을 봤더니…너무 좋았어요..,2022.05.09
뮤지컬 〈디아길레프〉,5,너무 좋아요,아름다운 극이에요,2022.05.09
뮤지컬 〈디아길레프〉,5,너무 슬프지만 아름다운 극,이제 끝이라니... ㅠㅠㅠ 아쉬워요 ㅠㅠㅠㅠㅠㅠㅠㅠㅠㅠㅠㅠㅠ  연장해줘요 ㅠㅠㅠㅠㅠㅠㅠㅠ  니진은 니진이고 디아길레프 더 연장해줘요 ㅠㅠㅠㅠㅠㅠㅠ,2022.05.09
뮤지컬 〈디아길레프〉,5,어버이날에는 역시 디아길레프,말도 안 되는 소리지만 행복했어요,2022.05.09
뮤지컬 〈디아길레프〉,5,디아길레프,발레 뤼스 러시아 발레단,2022.05.09
뮤지컬 〈디아길레프〉,5,좋아요,좋아요,2022.05.09
뮤지컬 〈디아길레프〉,5,가지마요…,전 보내줄 준비가 안됐는데,2022.05.09
뮤지컬 〈디아길레프〉,5,디아길레프,미치겠어 디아길레프 너 때문에~,2022.05.09
뮤지컬 〈디아길레프〉,5,디아길레프,디아길레프가 중심이 되어 진행되는 극이다보니 자연스럽게 잘 따라가게되더라구요. 애드립부분 너무 재밌었고 별조명 예쁘고 ㅠㅠ 발레 공연 보고 온 것 같은 느낌도 들고. 너무 좋았어요. 니진스키도 보러 가려구요~,2022.05.09
뮤지컬 〈디아길레프〉,5,멋진작품!!,무대도 예쁘고 영상연출이 너무너무 예뻐서 홀린듯이 봤어요 무용도 너무 잘하시고 노래도 좋고!! 넘넘 재밌게 잘 봤습니다!!,2022.05.09
뮤지컬 〈디아길레프〉,5,최고의 공연,레전드맞었어요 100분이 아니라 200분 보고싶어요,2022.05.09
뮤지컬 〈디아길레프〉,5,미치겠어 성윤디아 너 때문에,대답 안해? 라고 할 때 맨날 대답하고 싶어짐,2022.05.09
뮤지컬 〈디아길레프〉,5,이거는 진짜 말이 안된다,애드립도 감정선도 진짜 어느하나 흠잡을데가 없네요 정말,2022.05.09
뮤지컬 〈디아길레프〉,5,못 보내..,아트원 문 잠가… 니진 개막 때 다시 열어…,2022.05.09
뮤지컬 〈디아길레프〉,5,재밌어요,니진스키도 볼거에요,2022.05.09
뮤지컬 〈디아길레프〉,5,밤공까지 종일반이었어요,같은 극 다른 느낌 너무 즐거워요,2022.05.09
뮤지컬 〈디아길레프〉,5,여러분 조성윤 디아길레프,꼭 보세요... 진짜 모두가 봐야 합니다... 조성윤 디아길레프는 인생입니다 인생!,2022.05.09
뮤지컬 〈디아길레프〉,5,조성윤 단장님 없이 어떻게 살죠,조성윤 단장님 없이 어떻게 살죠 조성윤 짱 조성윤 최고,2022.05.09
뮤지컬 〈디아길레프〉,5,발레를 더 사랑해,요즘 빠져서 회전 돌고 있는 극인데 보면 볼수록 생겨나는 디테일들이 너무 재밌어요 넘버 조명 뭐하나 빠지지 않고… 곱씹을수록 마음에 깊이 남는 대사들과… 너무 좋은 극입니다! 막공까지 파이팅,2022.05.09
뮤지컬 〈디아길레프〉,5,김종구 디아길레프,너무 재밌습니다 너무 멋있습니다 너무 좋습니다,2022.05.09
뮤지컬 〈디아길레프〉,4,디아길레프,댜길레프 디아길레프디아길렢,2022.05.09
뮤지컬 〈디아길레프〉,5,넘버가 미쳤어요,아니 넘버 멜로디 진짜 좋아여ㅠㅠㅠㅠ 미쳤어요ㅠㅠㅠㅠ 모든 넘벅가 다 좋기 쉽지않은데.. 그리고 브누아 넘버들이 특히 미쳤어요.....,2022.05.09
뮤지컬 〈디아길레프〉,5,뮤지컬 디아길레프,제가 제일 사랑했던 페어인데 이게 페어막이 될 줄은 몰랐어요...  조성윤 강정우 정민찬 김지훈  다시는 없을 최고의 페어입니다...  얼마든 상관 없으니 사고 싶은 거 다 사고 영수증만 첨부하라는 이런 단장님 다시 없어요...  정말요...  그러니 스페셜 커튼콜 영상을 찍으신 게 있다면...  공개해 주세요... 또 보고 싶으니까.......,2022.05.09
뮤지컬 〈디아길레프〉,5,재밌어요,디아길레프 때문에 미치겠어~~ 넘버가 너무 좋고 안무도 아름다워요! 영상도 너무 예뻐요! 꼭 추천합니다!!,2022.05.09
뮤지컬 〈디아길레프〉,5,내 손을 잡고 어디까지 갈 수 있을까,정말 디아길레프의 손을 잡고 어디까지 갈 수 있었을까?? 결국엔 발레 역사상 가장 위대한 작품을 만들었죠!! 극에 잘 나타낸 거 같아 만족스러웠습니다,2022.05.09
뮤지컬 〈디아길레프〉,5,디아길레프,요즘 제가 가장 사랑하는 극입니다. 끝나가서 너무 슬퍼요 ㅠㅠㅠㅠ,2022.05.09
뮤지컬 〈디아길레프〉,5,이거 박제 해주시면 안되나요,미치겠어 디아길레프 너때문에...자첫한후로 디아길레프생각을안한적이없읍니다,2022.05.09
뮤지컬 〈디아길레프〉,5,추천합니다,발레의 매력을 알게 되었어요! 물론 넘버와 연기도 좋았고 조명 활용을 다양하게 해서 지루하지 않았어요,2022.05.09
뮤지컬 〈디아길레프〉,5,너무너무 재미있어요 ㅠㅠ,끝나지 않았으면...,2022.05.09
뮤지컬 〈디아길레프〉,5,디아길렢 미치겠어,너때문에~,2022.05.09
뮤지컬 〈디아길레프〉,5,디아길레프,브누아같은 친구나 동료가 있다면 정말 행복할텐데 부러워요,2022.05.09
뮤지컬 〈디아길레프〉,5,뮤지컬 디아길레프,네가 춤추는 밤 너의 모든 게 날 위로하네  뮤지컬 디아길레프 - 네가 있는 밤 중에서  갓넘버 들으러 오세요..,2022.05.09
뮤지컬 〈디아길레프〉,5,디아길레프 자꾸 생각나요,너무 재미있어서 자꾸 생각나는데ㅠㅠ 더 볼 수가 없네요재연 기다립니다 !,2022.05.09
뮤지컬 〈디아길레프〉,5,정말 너무나도 재밌습니다,최고에요! 진짜!,2022.05.09
뮤지컬 〈디아길레프〉,5,너무너무 재미있어요 ㅠㅠ,끝나지 않았으면...,2022.05.09
뮤지컬 〈디아길레프〉,5,마티네 ..,휴가 쓰고 갔지만서도 아주좋아요,2022.05.09
뮤지컬 〈디아길레프〉,5,아니 이게 정말,왜 이런거라고 아무도 영업해주지 않았죠? 왜 저는 막공이 다가오는데 치였죠?,2022.05.09
뮤지컬 〈디아길레프〉,5,음,2층에서 보는 무대가 참 예쁩니다,2022.05.09
뮤지컬 〈디아길레프〉,5,민찬배우님 짱이예요,정민찬 배우님 정말 니진스키의 환생이신걸까요? 실제 니진스키랑도 너무 닮으셔가지고 무대에서 보고 정말 반했답니다. 당신의 춤은 정말... 니진스키 발레의 신 ...,2022.05.09
뮤지컬 〈디아길레프〉,5,디아길레프 가지 마...,아트원 문 닫아... 아무도 못 가...,2022.05.09
뮤지컬 〈디아길레프〉,5,성윤디아는 최고,"사람들 설득하는거며, 네가 있은 밤에서 표정 짓는거며 최고",2022.05.09
뮤지컬 〈디아길레프〉,5,뮤지컬 디아길레프,"거의 끝나갈 즈음에 본게 아쉬울 정도로 정말 잘 본 뮤지컬이에요!! 여러모로 창작진들이 많이 신경 쓴 뮤지컬이라고 생각합니다. 무대 연출이 이렇게까지 많다고?! 싶을 정도로 눈이 즐거웠고 참 아름답다고 느꼈어요. 넘버도 서정적이고 좋아서 뮤지컬 보고 나서 OST도 구매했네요. 배우님들의 노래와 연기, 발레리노분의 안무도 아름다웠습니다. 재연이 올라오기를 손꼽아 기다리겠습니다!",2022.05.09
뮤지컬 〈디아길레프〉,5,볼수록 재밌음..,질리지가 않아 매일 새로워..어떻게 보내…,2022.05.09
뮤지컬 〈디아길레프〉,5,좋아요ㅠ,넘버도 너무 좋고 배우님들 감정도 좋고 민찬배우님 발레 하시는것도 너무 아름답고ㅠ 조명도 너무 예뻐요ㅠ,2022.05.09
뮤지컬 〈디아길레프〉,5,재밌어요,어린이날에 잘보고갑니다,2022.05.09
뮤지컬 〈디아길레프〉,5,정민찬최고,넘잘하고안무추가되는거 넘나소름,2022.05.09
뮤지컬 〈디아길레프〉,5,완벽한 공연,너무 재미있었습니다... 이제 막공 주간이라는 게 믿기지 않아요 ㅠ,2022.05.09
뮤지컬 〈디아길레프〉,5,디아길레프,디아길레프 단장님 너무 멋있어요 최고,2022.05.09
뮤지컬 〈디아길레프〉,5,어린이는 아니지만 즐거운 관극했습니다,난 디아길레프를 보는 멋진 어른이니까,2022.05.09
뮤지컬 〈디아길레프〉,5,,&#128077;&#127995;&#128077;&#127995;&#128077;&#127995;&#128077;&#127995;&#128077;&#127995;,2022.05.09
뮤지컬 〈디아길레프〉,5,재미있어요 진짜,별 열개 주고싶어요 솔찌,2022.05.09
뮤지컬 〈디아길레프〉,5,뒤를 보는 건 내가 할테니,고갤 들고 이 길을 걸어가자,2022.05.09
뮤지컬 〈디아길레프〉,5,단장님......,올해 봄은 단장님과 함께 했는데 끝나간다니 너무나도 아쉽습니다 ㅠㅠ 빠른 시일 내로 재연 올라오면 참 좋겠습니당 ㅎㅎ,2022.05.09
뮤지컬 〈디아길레프〉,5,하...,내가 사랑했던 것들이 사랑받을 수 있다면 그걸로 충분해ㅠㅠㅠㅠㅠ,2022.05.09
뮤지컬 〈디아길레프〉,5,으악 단장님 ,사랑합니다 단장님 뽀에버,2022.05.09
뮤지컬 〈디아길레프〉,5,음악도 조명도 배우들 연기도,너무 너무 좋네요 진짜 최고에요  보고 싶은 페어가 별로 없는 건 아쉽지만 ㅠㅠㅠㅠㅠㅠㅠ,2022.05.09
뮤지컬 〈디아길레프〉,5,잘봤어요,디아길레프 너무 좋아요,2022.05.09
뮤지컬 〈디아길레프〉,5,뮤지컬 디아길레프,실황 오슷과 스튜디오 오슷 모두 잘 받았습니다  이제 실황 중계나 딥디를 주실 생각은 없는지... 혹시...  이걸 이렇게 컴퍼니 보관용으로만 두기는 아쉽잖아요...  저도 보게 해 주세요... 이제 공연도 얼마 안 남았는데...  니진스키 때처럼 중계 한 번만 해 주시면 제발,2022.05.09
뮤지컬 〈디아길레프〉,5,정발 단 하나의 발레,디아길레프가 모든 외로움을 견디고 단 하나의 발레만을 추구한 그 마지막 넘버가 너무 좋아요 정말 김종구 배우님 당신은 디아길레프의 환생,2022.05.09
뮤지컬 〈디아길레프〉,4,굳,영상이 이쁘게씀,2022.05.09
뮤지컬 〈디아길레프〉,4,너무너무 예뻐요,넘버도 예쁘고 연출도 예쁘고 무대가 색으로 물들때 제일 좋아요!,2022.05.09
뮤지컬 〈디아길레프〉,5,아이고 아이고 ,단장님 좋아해요,2022.05.09
