musical_title,rate,review_title,review_text,review_date
뮤지컬 〈서편제〉,5,자람준수 명창페어!!,소리꾼 김준수님의 뮤지컬 차기작을 볼 수 있어서 정말 행복한 무대였습니다!! 곤투모로우 작품으로 처음 뵌 분이였는데 본 직업이 소리꾼이신 만큼 다른 동호들과는 결이 다른 캐릭터 해석을 볼 수 있어서 이미 n차 관람임에도 새로운 극을 보는 기분이었습니다 창극 무대도 정말 재밌게 끌고나가시는 분이지만 뮤지컬 무대에서 뵙게되면 늘 신선한 캐릭터 해석을 보여주셔서 너무너무 반가웠습니다~!!,2022.09.19
뮤지컬 〈서편제〉,5,자람준수 짱...,찐 소리꾼페어 진짜 짱짱이었어요ㅠㅠ 너무 소름돋고 슬프고 아름다워서 이 페어 또 보러 갑니다ㅠㅠ,2022.09.19
뮤지컬 〈서편제〉,4,최고,국악하는 준수님 나무 잘해요 ㅠㅠㅠ,2022.09.19
뮤지컬 〈서편제〉,5,재밌습니다,재밌어요,2022.09.19
뮤지컬 〈서편제〉,5,진짜 레전드 ㅜㅜ,0915이날로 영상실황 내주세요 ㅠㅠ,2022.09.19
뮤지컬 〈서편제〉,5,서편제,ㅠㅠㅠ자람준수페어 심청가 박제 제발요…,2022.09.19
뮤지컬 〈서편제〉,5,최고,차송화는 언제나 최고에요!,2022.09.19
뮤지컬 〈서편제〉,5,언제든 믿고보는 송원근 배우님!!,"송원근 배우님과 김태한 배우님 조합은 곤투모로우, 킹아더 작품에서도 재밌게 봤었는데 이번이 올해만 세번째 같은 작품이시라 그런지 합이 정말 좋은 느낌입니다!! 태한유봉 정말 밉지만 따뜻한 아버지였어요 ㅎㅎ",2022.09.19
뮤지컬 〈서편제〉,5,최고,"이번이 마지막 시즌인 게 너무너무 아쉬울 정도에요. 극 자체는 낡았지만 그럼에도 불구하고 우리만의 소리를 표현하는 소중한 극. 그리고 넘버가 너무 좋아요. 이자람, 김준수 배우는 진짜 최고였고, 남경주 배우는 연습좀 더 하셨으면.",2022.09.19
뮤지컬 〈서편제〉,5,잘 봤어요,"매 시즌 참여하신 두 분의 송화,, 너무 아름답고 좋습니다",2022.09.19
뮤지컬 〈서편제〉,5,노래 너무 잘해요,그러나 내용은 이시대에 보기엔 어리둥절...왜 그렇게까지...,2022.09.18
뮤지컬 〈서편제〉,4,서편제,재밌어요,2022.09.18
뮤지컬 〈서편제〉,5,최고의 조합 이자람 송원근,두분의 연기 노래 감정 모든것이 조화롭고 아름다웠습니다.   말로 표현 못할 여운과 감정을 느끼고 돌아왔어요. 좋은공연 보여주셔서 감사합니다 …,2022.09.18
뮤지컬 〈서편제〉,5,부모님과 함께한 서편제,너무 좋아하셨어요. 부모님 모시고 한번쯤 보면  참 좋을거라고 생각합니다.  마지막으로..   송원근 최고 !,2022.09.18
뮤지컬 〈서편제〉,5,와...무대를 찢었어요,진짜 무대를 찢었어요... 정말 후회 없습니다.  너무 좋은 페어였어요...,2022.09.18
뮤지컬 〈서편제〉,5,서편제를 보고,배우님들의 열연과 멋진 소리의 한마당 서편제 특히 차지연님의 그 한서린 열연은 절대 잊지못할것 같습니다,2022.09.18
뮤지컬 〈서편제〉,5,섬세한 재윤동호 최고에요.,재윤동호로 관람했는데 섬세하게 표정연기를 잘하고노래도 강할 때는 강하게아련할때는 아련하게....너무 표현을 잘해서 몰입해서 봤습니다.,2022.09.18
뮤지컬 〈서편제〉,5,너무 좋았습니다,엄청 몰입해서 봤고 마지막에 송화가 울어서 저도 같이 울었어요ㅠㅠ,2022.09.18
뮤지컬 〈서편제〉,5,슬퍼요 너무 ㅠㅠㄱ,마음이 찡해지는 체그의 작품!!!!!!,2022.09.18
뮤지컬 〈서편제〉,5,명작!,오랜만에 가족들과 봤습니다. 서편제 영화를 보고 봤는데 엄청난 감동이네요!,2022.09.18
뮤지컬 〈서편제〉,5,율송화 최고,율송화 다들 안보고 뭐해요 꼭 보세요!!!!,2022.09.18
뮤지컬 〈서편제〉,5,너무 좋았습니다,너무 너무,2022.09.18
뮤지컬 〈서편제〉,5,심금을 울리는 공연,공연 보면서 이렇게 눈물 흘린 건 처음인 것 같아요ㅠㅠ 유리아 배우님 공연 초반에도 소리 너무너무 잘 한다 생각 했거든요 근데 눈 멀고 나서 정말 한에 사무친 소리를 내는데 와.. 정말 소름 돋더라구요ㅠㅠㅠ 연기도 너무 잘 하셔서 진짜 감정 전달도 잘되고 .. 이게 정말 마지막 시즌이라니 가지 마요 ㅠㅠㅠ,2022.09.18
뮤지컬 〈서편제〉,5,영화와 또다른 더 빠져드는 애달픈 감동,"이동동선의 틀이 단순하나 집중할 수있어 좋았고, 우리의 소리가 이렇게 깊은 울림과 절제하듯 여운을 주는줄 새삼 느껴보았어요~ 모든 배우님들. 수고많으셨어요",2022.09.18
뮤지컬 〈서편제〉,5,좋았어요,근데 동호? 역할 분 노래가 너무 별로여서ㅠㅠ 다른분들은 정말최고였어요,2022.09.18
뮤지컬 〈서편제〉,5,좋았어요,근데 동호? 역할 분 노래가 너무 별로여서ㅠㅠ 다른분들은 정말최고였어요,2022.09.18
뮤지컬 〈서편제〉,4,차지연 최곱니다 ,모든게 다 좋았습니다특히 차지연 배우 성량 최곱니다다만 김동완 배우는 보완 좀 하셔야 할 듯,2022.09.18
뮤지컬 〈서편제〉,5,믿고 보는 차지연..,2022.09.18 19:30광림아트센터 BBCH홀뮤지컬 - 서편제 어린 송화 - 최연우 배우님목소리가 맑고 깨끗해서 놀랐다.너무 좋다..?? 어린 동호 - 정석준 배우님너무 귀여워ㅋㅋ 동호 엄마 - 이다정 배우님역할에 너무 잘 어울리는 목소리를 가지셨다.다정한 어머니 역할에 딱이다.목소리는 심규선님 같은 느낌이다. 동호 - 김동완 배우님처음 뵀다.앙상블과 같이 하는 넘버에서 앙상블에 목소리가 뭍히는 느낌이 났다.아쉽..솔로 넘버 하실 땐 그냥 노래하는 느낌..?송화 - 차지연 배우님찢었다.. 미친 거 같다..너무 잘한다..왜 차지연 차지연 하는 지 알 거 같다.차지연 배우님의 뮤지컬 - 매디슨 카운티의 다리 꼭 보고 싶어졌다.전문 판소리꾼처럼 너무 잘하잖아.. 진짜 한이 느껴져..제 본진이 되실래요..?*동호가 어린 시절 얘기를 하면서오버랩으로 연출한 장면이 좋았다.연출에서 한국적인 느낌이 잘 느껴졌다. *진짜 소리가 뭘까..왜 자식한테 그러는 거야.못났다 진짜.살다보면 살아진다..*광림아트센터엘베가 두대만 이용할 수 있어서 사람이 미어터진다.다른 공연장보다 일찍 가야 된다.,2022.09.18
뮤지컬 〈서편제〉,5,유리아 언니 사랑해요,제가 봤던 뮤지컬 중 무대 연출이 가장 아름다웠어요 마지막 씬의 조명이 너무 좋았습니다,2022.09.18
뮤지컬 〈서편제〉,5,유리아 언니 사랑해요,제가 봤던 뮤지컬 중 무대 연출이 가장 아름다웠어요 마지막 씬의 조명이 너무 좋았습니다,2022.09.18
뮤지컬 〈서편제〉,5,차송화님 최고였어요!,첨으로 차지연님 뮤지컬을 봤습니다. 역시 명불허전! 초반에 살다보면 나올 때부터 빨려들어갔어요. 마지막에 심봉사 눈 뜨는 대목은 정말 압권입니다. 심청가는 명창들도 어렵다던데 정말 감동적이었어요. 상당히 긴 넘버인데도 지루하지 않았어요. 아버지 역할의 서범석님도 완전 잘하세요. 행복한 시간이었습니다.,2022.09.18
뮤지컬 〈서편제〉,5,서편제를 보고,아직도 심청가가 머릿속에 맴도네요서편제를 볼 수 있어서 행복합니다공연 보고 나와서 바로 담주 또 예매했어요,2022.09.18
뮤지컬 〈서편제〉,5,무조건 보세요,저 막공 또 보러 갑니다...너무 좋아요..,2022.09.18
뮤지컬 〈서편제〉,5,좋아요,재밌게봤습니다.,2022.09.18
뮤지컬 〈서편제〉,5,서편제,최고의 공연...자람준수 소리꾼 페어 너무너무너무너무너무 좋았어요ㅠㅠ... 더 보고 싶음,2022.09.17
뮤지컬 〈서편제〉,5,송화는 역시 이자람!!! 최고!!!,"서편제만 10회이상 관람을 했는데, 많은 송화 역할중에 역시 송화 역은 명실상부 이자람 님이 최고입니다. 국악의 기본기와 발성이 심금을 울리며, 온몸에 전율이 느끼질만큼의 감성이 풍부하여, 사람을 이자람님의 매력에 빠지게 합니다.  서편제가 마지막 공연이란게 너무 아쉽지만, 더 좋은 공연으로 많은 관객들에게 이자람님의 재능이 알려졌으면 좋겠습니다. 감사합니다.",2022.09.17
뮤지컬 〈서편제〉,4,오랜만에 봐도 좋은 작품,2014년에 보고 다시 봤는데 그때도 이번에도 송화는 차지연 배우였어요. 그땐 차지연이라는 배우를 모르고 봤다면 이번엔 일부러 캐스팅일정을 보고 차지연님이 하는 걸로 골랐죠. 자리가 없어서 예매하기 힘들었는데 취소표가 나와서 운좋게 좋은자리에서 봤네요. 진짜 차지연 배우의 서편제는 믿고 봅니다. 이번이 마지막 시즌이라니 아쉬워요.,2022.09.17
뮤지컬 〈서편제〉,5,몇년만에 다시 봤어요,여전히 심금을 울리는 공연이였습니다. 이자람님 소리에 제 슬픔도 터져나왔어요. 좋은공연 즐길 수 있어서 행복했습니다~,2022.09.17
뮤지컬 〈서편제〉,5,유리아 미쳤다!,글자그대로.그녀는 맹인 연기도 되고 명창연기도 되는 뮤지컬 배우다. 많은 분들이 좀 봤으면 .좋겠다,2022.09.17
뮤지컬 〈서편제〉,5,애끓는 한의 소리 서편제!,어느 한소리 깊지않은 소리가 없네요1부 마지막도 너무 깊은 울림이었고2부는 정신없이 몰입하여서 시간 가는줄 몰랐습니다  양송화의  한스러운 소리가 그대로 전해졌습니다 잘봤습니다,2022.09.17
뮤지컬 〈서편제〉,4,서편제 ㅠㅠ 최고,꼭 보세요 역대급 뮤지컬 입니다 눈물이 ㅠㅠ 엄청 나오네요,2022.09.17
뮤지컬 〈서편제〉,5,너무충격적으로 좋아서 바로 두장 더 예매했습니다.,일부러 내용도 모르는상태로 갔는데모든장면이 가슴에 콕콕박혀 눈 감을때마다 아른거리네요.,2022.09.17
뮤지컬 〈서편제〉,5,좋구나~!,소리꾼들이 들려주는 소리이야기라 더 깊이 와닿았어요이자람 김준수 페어 최고네요,2022.09.16
뮤지컬 〈서편제〉,5,영화보다 더 감동이네요,너무 너무 너무 많이 울었어요.  요새 이렇게 오열 하면서 본 극이 없었는데. 역시 유명한데는 다 이유가 있었습니다.,2022.09.16
뮤지컬 〈서편제〉,5,소리 뮤지컬,강추.. 마지막 시즌 ㅠ  이제 안온다니 ㅠㅠ 꼭 보세요 ㅠㅠ  소리가 주인공인 각자의 소리를 찾아가는 과정을 그리며  세명의 주인공들의 서사가 담긴 뮤지컬~  어떤페어든 꼭 한번 보시길~,2022.09.16
뮤지컬 〈서편제〉,5,재밌어요,재밌어요,2022.09.16
뮤지컬 〈서편제〉,5,잘봤습니다:),정말 좋았어요,2022.09.16
뮤지컬 〈서편제〉,5,차재범...최고페어,차재범 조합으로 레전드 경험 했습니다.,2022.09.16
뮤지컬 〈서편제〉,5,마지막시즌에 완성된 동호,매시즌마다 동호역의 비중은 늘어나지만 소리길에 대한 갈등이 이번시즌에 소리꾼 동호의 캐스팅으로소리하는 장면들이 에너지 넘치고 설득력을가지게 되면서 선명해지고 재밌어졌다.국악페어 회차를 보는내내  안성맞춤이란 생각이 들었다.다른 페어로 재관할테지만소리꾼 동호역은 놓지못할듯 하다^^새로운 시즌으로 다시 돌아오길 기원해본다.,2022.09.16
뮤지컬 〈서편제〉,4,추천,추천합니다.,2022.09.16
뮤지컬 〈서편제〉,5,서범석 아부지 유봉 최고,범석유봉님 연기력도 좋지만 노래도 너무 애절하게 잘하시네요 .서편제 초기 맴버 이신걸로 알아요 마지막시즌이라 아쉽겠어요.너무 감동적으로 보고왔습니다.마지막신에 울컥 ??,2022.09.16
뮤지컬 〈서편제〉,5,페어 선택이 한수!,"배우분들 모두 훌륭한데 합이 좋은 배우를 선택하시면 관극하시기 더 좋을 듯 하네요송화가 누나라는걸 꼭 염두에 두고 페어 고려하면 무조건 대만족 인생작이 됩니다.전 이자람,김준수 배우님으로 봤는데 합이 진짜 잘맞아서 너무너무 좋았어요.주연 배우들, 아역배우들 배역 소화를 너무너무 잘 하셔서이야기 설득력이 장난아니었고요.앙상블 분들도 너무너무 멋지시더라고요.사람이 만드는 뮤지컬이라는 느낌이 강하게 들었습니다.화려한 무대장치는 없지만 배우분들을 향해 더 집중할수 있었어요. 연극을 봤나..? 싶을 정도.아 진짜 이번이 마지막이라는게 슬프네요.ㅜㅜ",2022.09.16
뮤지컬 〈서편제〉,5,와 진짜 이작품일 인생작입니다,그야말로 다른뜻으로 대작 명작입니더 차지연 배우 아니면 절대 송화역을 소화못할것 같아요...,2022.09.16
뮤지컬 〈서편제〉,5,"람송화 못본사람 없길,♡",이번생 람송화 심청가 직접들어 참 행복하다♡,2022.09.16
뮤지컬 〈서편제〉,5,차지연님의 소리길,"차지연님의 서편제가 다시 돌아오기를 기다렸어요. 한이 쌓이는 시간, 한을 속으로 삭히는 시간이 지나 다시 듣게 된 차지연님의 소리가 너무 좋아 펑펑 울고 말았습니다. 서편제와 관련된 모든 분들 감사합니다.",2022.09.15
뮤지컬 〈서편제〉,5,자람신! 준수동호 페어 최고,두분이 실제 소리꾼에 남매 케미가 증말증말최고임다첫공보다 확실히 여유있어지고 더 깊어졌어요회전문을 돌수밖에,2022.09.15
뮤지컬 〈서편제〉,5,자람은 신이예요,그저 빛 어떻게 이름도 잘함인거죠?,2022.09.15
뮤지컬 〈서편제〉,5,잘들었습니다,굿!!!,2022.09.15
뮤지컬 〈서편제〉,5,차송화 ㅠㅠㅠㅠ,"준수 동호, 범석 유봉 정말 좋은 시간이었어요. 잘 봤습니다",2022.09.15
뮤지컬 〈서편제〉,4,한서림,밤공연보고 버스 놓칠까봐 배우들 커튼콜때  빨리 나와서 조금 아쉬웠지만 재밌게 본공연입니다,2022.09.15
뮤지컬 〈서편제〉,5,행복한 하루,"처음 접해본 장르의 뮤지컬이었는데, 너무나 아름다운 소리들로 가득찬 이야기였습니다~ 좋은 공연 감사합니다!",2022.09.15
뮤지컬 〈서편제〉,5,서편제,차송화 레전드 서편제..,2022.09.15
뮤지컬 〈서편제〉,5,??,사실 기대 없이 차지연 배우 노래 하나 들으러 갔습니다 배우님 노래는 별 만점… 이로써 모두 끝입니다……,2022.09.15
뮤지컬 〈서편제〉,5,국악페어ㅠㅠㅠ,자람준수 너무 황송했습니다 보고있어도 황송한 페어ㅠㅠㅠㅠ최고에요ㅠㅠ,2022.09.15
뮤지컬 〈서편제〉,4,한 번은 꼭 봐야 할 공연.,"공연이 끝나도 계속 귓가에 맴도는 넘버 배우들의 열연  보기좋은 무대까지 한 번은 꼭 봐야하는 공연입니다. 후회 없구요  말로만 들어왔던 공연인데, 마지막 시즌이라고 해서 예매하여봤는데 보길 잘했다고 생각합니다.",2022.09.15
뮤지컬 〈서편제〉,5,여운이 많이 남는 작품,차지연 배우님 송화 그 자체입니다 ㅠㅠㅠ 배우님의 흡입력 있는 연기로 몰입하면서 볼수있었습니다 김준수 배우님 소리꾼 바이브로 더욱 극에 몰입할수있게되고 유봉 서범석 배우님의 연기와 넘버로 극애 더 몰입되었네요,2022.09.15
뮤지컬 〈서편제〉,5,최고입니다,마지막 시즌 감동과 영광의 오슷 딥디 내주세요~~~,2022.09.15
뮤지컬 〈서편제〉,5,너무 좋아요,오슷 딥디 내주세요~~~,2022.09.15
뮤지컬 〈서편제〉,3,"배우들의 열연, 아쉬운 공연장 환경","차지연 배우의 연기를 보고 싶어 서편제 공연을 보러 갔다. 늦게 매표하는 바람에 표가 거의 매진되어 아쉽게도 2층에서 볼수밖에 없었다. 좌석 선택은 나의 잘못이지만 공연장 환경이 너무 좋지 않았다. 1층으로 쏟아질듯한 좌석, 뮤지컬을 하기에는 역부족인 음향 시설. 배우들의 열연에도 불구하고 공연 뒤의 감동이 덜한 것은 공연장 환경 탓인듯. 조금 더 몰입감을 높일 수 있는 무대 선택이 아쉽다.",2022.09.15
뮤지컬 〈서편제〉,5,말이 필요할까요,지연준수페어 봤으니 자람준수페어도!!,2022.09.15
뮤지컬 〈서편제〉,5,차지연 송화 인생캐,너무 재미있는 공연이었습니다,2022.09.15
뮤지컬 〈서편제〉,5,다양한 길,"많은 길들을 돌아보게 만드는 송화와 동호, 그리고 유봉의 노래",2022.09.15
뮤지컬 〈서편제〉,5,양지은 감동 신화,아버지 죽음 앞에 송화의 곡소리가 지금도 가슴을 아리게 하네요 또 예매했어요,2022.09.15
뮤지컬 〈서편제〉,5,차지연 배우짱,이건머  말해머해.   솔직히 곤심없던국악에대해  차지연배우와 동생으로 나왔던김준수배우님 덕분에 잘알게되었습니다두분의발성과  호소력이  집중을더 할수있도록해주셨습니다,2022.09.14
뮤지컬 〈서편제〉,5,꼭 또 볼거야~,살다 보면 눈물심청가 눈물감동감동꼭 봐야 합니다.,2022.09.14
뮤지컬 〈서편제〉,5,최고.,"초연 이후 십여 년만에 본 서편제.줄줄 울었어요.차송화, 런동호 최고입니다.",2022.09.14
뮤지컬 〈서편제〉,5,늦은 후기ㅠㅠ,너무 좋았어요이때 알았죠 아 서편제 계속 달리겠구나배우분들 연기와 넘버들 너무 좋아요 ㅠㅠ9월 10월에도 또 만나요!!쟁동호 파잇팅,2022.09.14
뮤지컬 〈서편제〉,5,판소리를 직접 들어보길 권합니다.,우리의 소리인 판소리를 직접 들을 기회가 잘 없지만 한번만이라도 들으시면 반하실 겁니다. 맘이 편하지 않은 추석 연휴때 뮤지컬 서편제를 혼자 가서 봤습니다. 이자람님의 소리를 듣는데 그냥 눈물이 주르르 흐르고 언제 시간이 가는 줄 모르게 몰입하다가  심청전을 듣는데 정말 감동적이고 나올때 진짜 보길 잘 했다는 생각과 또 봐야 할 것 같아서 친한 지인에게 같이 가자고 안보면 후회할거라고 강력 추천했습니다. 이자람님 정말 연기 잘하시고 판소리에 타고나신 분이십니다. 기회되면 이자람님의 공연은 계속 볼겁니다.,2022.09.14
뮤지컬 〈서편제〉,5,부모님과 보고 싶은 공연1위!!,공연 진짜 너무 좋았습니다.  가슴이 먹먹해서 많이 울어서 힘들기도 했지만.. 넘버도 무대도 다 너무 좋았고~  배우분들 연기가 정말 최고였어요!!  워낙 유명하기도 하지만.. 부모님과 본다면 너무 좋을것 같아서 부모님 생각이 많이 났어요.  좋은 공연이 왜 마지막인가요 ㅠㅠ 또해주세요 ㅠㅠ,2022.09.14
뮤지컬 〈서편제〉,4,첫서편제,나의첫서편제,2022.09.14
뮤지컬 〈서편제〉,5,첫등장에압도당함,"첫시작부터유리아님의대사 ""소리를청하셨다구요....""를하시며...동공연기기에압도당해 뒷통수맞은느낌이였습니다 재윤동호님의가슴시린애절한반항..너무최고였습니다",2022.09.14
뮤지컬 〈서편제〉,5,심청가 미쳤음,자람송화 살앙해...,2022.09.14
뮤지컬 〈서편제〉,5,좋았어요 여운이 남아요,뮤지컬이 처음인 엄마와 명절연휴에 보고왔어요중간중간 졸기도 하셨는데 끝나고 집에가는길에여운이 남는다 집에가서 일기쓰고 싶다고 하시더라구요 ㅠㅠㅠㅠ 엄청 단조로울줄알았는데 생각보다 화려했고 재밌었어요~ 관객 거의 대부분이 가족단위더라구요 추천해요!,2022.09.14
뮤지컬 〈서편제〉,5,재밌어요~!!!,다시보고 싶은 뮤지컬입니다??,2022.09.14
뮤지컬 〈서편제〉,5,좋았어요,다시보고싶어요,2022.09.14
뮤지컬 〈서편제〉,5,다시보고싶어요,좋았습니다,2022.09.14
뮤지컬 〈서편제〉,5,좋았어요,ㅜ 자리도 좋고 다시보고싶어요,2022.09.14
뮤지컬 〈서편제〉,5,런동호........................,스프링보이즈 팬클럽 가입할라요,2022.09.13
뮤지컬 〈서편제〉,5,재미있게 봤습니다,심청가가 정말 감동적이었어요,2022.09.13
뮤지컬 〈서편제〉,5,소리꾼 페어 너무 좋았습니다.,서편제 소리꾼페어 너무너무 좋았습니다.,2022.09.13
뮤지컬 〈서편제〉,5,넘 재밌게 잘 봤어요~,너무 재밌게 잘봤습니다. 이번 시즌이 마지막 시즌이라고 해서 보고왔는데 재밌게 잘보고왔어요~,2022.09.13
뮤지컬 〈서편제〉,5,그저 살다보면,그저 살다보면...살아진다.. 마지막 시즌 눈물흘리며 보내드립니다ㅠ,2022.09.13
뮤지컬 〈서편제〉,5,아름다웠던 마지막 장면이 오래도록 남습니다.,"한국에 ''소리''가 어떤 의미인지, 말하지 않아도 느낄 수 있었던 시간이었어요. 마음이 먹먹해지도록 감정이입해서 잘 보고 왔습니다. 우리의 소리와 뮤지컬을 잘 접목하여 만들어주셔서 감사하고, 오래도록 공연이 이어지기를 소망합니다.",2022.09.13
뮤지컬 〈서편제〉,5,배우들,열연 최고,2022.09.13
뮤지컬 〈서편제〉,5,한이 무엇이길래...,한국인만 알 수 있는 정서일까...  밝지만 여린 송화가 점점 단단히 굳혀지는 듯 하다가도 동호 앞에서 무너질 듯 다시 맘 잡는 송화의  모습에 오열 그렇게 헤매이다가 이제 다신 찾지 않겠다면서도 가슴의 응어리를 토해내는 동호나  천하의 몹쓸 애비란 인간도 마지막엔... 처가 데려올때 투정부리 듯 토해내는 모습이 감정 과잉같아도 동요될수 밖에 없었다  차지연 재윤 서범석의 조합이 너무 완벽했다 ㅠ,2022.09.13
뮤지컬 〈서편제〉,5,가슴을 파고드는 한의 정서!!,한국인이라면 누구나 ''한''의 정서에 푹 빠져들 수 밖에 없는 것 같아요. 아버지의 못 다 이룬 한 소리를 위해 타의로 너무나 큰 것을 버려야 했던 송화의 한 어머니를 보내며 시작된 아버지와 쌓아올린 동호의 갈등의 한 한사람 한사람이 쏟아내는 한을 그 누구가 편안히 앉아 받아낼 수 있을까요. 단순히 보면 소리의 명맥을 놓고 벌이는 세대의 갈등이지만 깊게 보면 어느 세대에서나 일어나고 있는 우리네의 이야기이기도 합니다. 이 한을 다 쏟아내고 나면 우리 마음에도 위로가 찾아오겠지요?  마지막 시즌이라니 너무 아쉽네요 ㅠㅠ,2022.09.13
뮤지컬 〈서편제〉,5,서편제 마지막시즌....,왜 마지막인가요...,2022.09.13
뮤지컬 〈서편제〉,5,최고입니다,소리꾼 페어ㅠㅠㅠ 사랑가랑 심청가 진짜 최고였어요!!!,2022.09.13
뮤지컬 〈서편제〉,5,매번 관극할때마다 우는 뮤지컬,회전문 도는 내내 눈물 줄줄 흐르게 하는 뮤지컬,2022.09.13
뮤지컬 〈서편제〉,5,서편제 관람후기,"주인공의 연기가 너무 좋았으며, 판소리에 대한 인식을 새롭게 할수 있는 계기가 되었읍니다. 다른 연기자들의 연기 또한 열정이 느껴져서 깊은 감동을 주는 뮤지컬 관람이었습니다.",2022.09.13
뮤지컬 〈서편제〉,5,이청준의 명작과 재해석의 만남,"원작이 좋은 건 두 말할 것두 없고 동호가 주인공이던 작품에서 송화를 끌어올린 점이 정말 좋았어요  자람준수 두 사람의 심청가는 정말로… 그들만의 세상이더군요  소리꾼 고수가 무대 위에 있고, 청중은 동호니까 객석은 낄 틈이 없었습니다.  그 둘이서 주고받는 소리와 “잘헌다, 그라제” 하는 추임새 ㅜㅜ 관객은 지켜보는 거고 그들의 감정이 터지는 게 그 조명인 점이 기억에 남네요..",2022.09.13
뮤지컬 〈서편제〉,5,멋있습니다,멋있습니다,2022.09.13
뮤지컬 〈서편제〉,5,벌써 4번째 관극입니다 .. 그래도 또 봐야겠다면 ..,9월 11일 명절맞이 가족들과 함께 공연 관람 했는데 온 가족이 만족한 공연이었습니다!!!!!!  부모님도 우리소리에 압도 되셨다는 .... 송화를 노래하는 차지연 배우님의 한이 담긴 목소리는 물론 유봉을 노래하는 서범석 배우님은 지금까지 봤던 공연중에 최고였습니다!!!  동호를 노래한 재윤 배우님도 어쩜 그렇게 여러가지를 다 잘할 수 있쥬!?!?!?  (제가 좋아하는 부분은 유봉이 동호 걱정(?)을 하면서 어디가서 밥이나 처먹고 다니는지... 하는 부분입니다 ..  한국 사람은 아무래도 밥심이죠 ...),2022.09.13
뮤지컬 〈서편제〉,5,감동적이면서 가슴 아픈 뮤지컬,유리아 김동완 페어 기대이상이였습니다! 꼭 보세요~,2022.09.13
뮤지컬 〈서편제〉,5,힐링 감동 뮤지컬,연휴 끝 지쳐보이시는부모님 힐링하시라고 예매해 드렸어요. 감동적이고 좋아하셨습니다^^,2022.09.13
