musical_title,rate,review_title,review_text,review_date
뮤지컬 〈마틸다〉,4,앞 자리에서 봐야 전율을 크게 느낄 수 있는 극!,퍼포먼스가 정말 좋기 때문에 앞좌석에서 생생하게 느끼는 편이 좋은 극이에요. 특히 그네 신에서 성인 앙상블 배우들이 날아올 때의 전율이 최고예요. 꼭 앞에서 보세요!,2022.12.23
뮤지컬 〈마틸다〉,5,두번째 관람,프리뷰 기간 이어서 두번째 관람인데요. 보고나니 다시 보길 잘했다 싶네요... 한 번 더 볼 예정입니다.,2022.12.23
뮤지컬 〈마틸다〉,5,뮤지컬 마틸다,다들 한 번은 보셨으면 하는 뮤지컬..,2022.12.23
뮤지컬 〈마틸다〉,5,마틸다 최고의 갓극,마틸다 분량많고 어려운 대사들도 너무 잘 소화해내고연기노래 말해뭐해 너무 잘함.어린친구들이 열심히 춤 추고 노래하는걸 보고있으니...어른인 나보다 열심히하고 더 낫다는 생각도 들게 만드네요.,2022.12.23
뮤지컬 〈마틸다〉,5,나에겐 의외의 꿀잼 마틸다,"아이들 위주의 내용인 극에다가관객 연령도 낮길래 혹시나 하고 봤는데내용도 배우의 연기도 관객과의 호흡(?)도너무너무 최고였던 극!어른이 되고 보니, 어른이 되면 넘버는 듣다가 울컥할 정도..기대보다 더 재밌어서 감동스러웠다!!",2022.12.23
뮤지컬 〈마틸다〉,5,최고의 뮤지컬,"빌리에 이어 마틸다도 최고의 뮤지컬인 것 같아요! 아이들을 데리고 어떻게 이 정도 퀄리티를 만들어내는지,,, 정말 감명깊게 봤고 인생 뮤지컬 바로 등극했어요! 아이들이 뿜어내는 에너지와 전하는 메세지가 이 어른이의 마음을 울리고 너무 좋았습니다!! 앞으로도 더 보러갈 것 같네요! 마틸다 마지막까지 응원하겠습니다!!",2022.12.23
뮤지컬 〈마틸다〉,5,너무 감동적인 뮤지컬,초연 때 공연 못 봐서 너무 아쉬웠었는데 재연 한다고 해서 당장 예매했어요!! 정말 기대만큼 재미있었고 눈물나더라구요.. 아역배우들이 정말 다들 프로답게 한 명도 빠짐없이 다 너무 잘해서 감탄하고 왔습니다!,2022.12.22
뮤지컬 〈마틸다〉,5,동심이란 건 이런것이다,조금 유치할지 몰라도 가슴 따뜻해지는 이야기,2022.12.22
뮤지컬 〈마틸다〉,5,한 번쯤 어린이였다면,어린이가 나온다고 어린이들만의 뮤지컬이아닙니다 어쩌다보니 어른이 된 어린이가 되고픈 어른을 위한 뮤지컬 같아요,2022.12.22
뮤지컬 〈마틸다〉,5,연말에 가족과 함께하기 너무 좋은 공연이에요!,어린이와 어른이가 함께 연말에 좋은 시간 보낼 수 있었습니다.  공연 연출도 화려해서 볼거리와 즐길 거리가 무궁무진하네요.,2022.12.22
뮤지컬 〈마틸다〉,5,아이가 보기에 힘든 내용이 있기는 하지만,아이들 공연 수준은 아주 뛰어났고 주연 배우도 아주 연습을 많이 한 느낌이었습니다. 다만 가사가 클리어하게 들리지 않아 집중하기 어려운 부분도 있어 조금 아쉬웠습니다. 영화 마틸다를 통해 아이에게 이야기 했고 공연 전에도 좀 힘든 내용이 있을 수 있다고 미리 얘기해줬지만 아이가 받아들이기 힘든 부분이 있는 것은 사실이었습니다. 아이가 좀 더 크면 다시 보고 싶습니다.,2022.12.22
뮤지컬 〈마틸다〉,5,감동감동ㅠㅠ,감동감동감동 (맘쓰터치!!ㅠ,2022.12.22
뮤지컬 〈마틸다〉,5,기대 그 이상,"마틸다, 영화도 보았고 최근 넷플릭스에서 뮤지컬 영화 버전으로도 나온다 하여 우리나라 뮤지컬을 어떨까 기대하면서 생각보다 기대를 많이 가지고 보았는데 기대 이상이었습니다.  아역 배우라고 말하기 민망할 정도로 왠만한 배우 이상으로 아이들이 각자의 역할을 잘 수행해주었고 역시 최재림 배우는 이름 값을 하는 배우라는 생각이 들었습니다!!   연말 가족과 함께 보시기 좋은 뮤지컬 같으니 관람, N차 관람 추천합니다.",2022.12.22
뮤지컬 〈마틸다〉,5,여윽시.. 마틸다 ㅠ 탄탄한 스토리 + 아역배우 연기천재,남자친구랑 진짜 3시간가까이 엄마미소를 띄우면서 봤어요ㅠㅠ 세상에 어쩜 아역들이 이리 깜찍뽀쨕하면서 연기까지 잘하죠? 계속 내가 저 배우들엄마라면 얼마나 뿌듯할까 얼마나고생했을까 생각하면서 감정이입이되서 눈물이자꾸 나려고하더라고요 ㅠ 어른이되면 넘버부를때는 진짜 눈물이 나서 참느라 혼났어요 ㅠㅠ 주인공을 포함 모든 아역배우 하나하나가 다 주인공이였고 어른들보다 훨씬 발음도 좋고  잘들리고 연기도 뒤지지않았어요 ㅠㅠ 최재림배우님은..말할것도없어요.. 존재감 자체만으로 그냥 압도하고 그냥 최재림배우님은 평생따라다닐거여요 ㅠㅠ~  아역배우님들 정말 최고 박수 오만번 보냅니다. 감동+재미 모두를 갖춘 마틸다 ㅠ 최고~,2022.10.31
뮤지컬 〈마틸다〉,5,아이랑 꼭 같이보세요,초3 아이가 관람하기에 너무 좋은 뮤지컬 입니다,2022.12.22
뮤지컬 〈마틸다〉,5,동심과 감동 뮤지컬! | 올해 놓치면 <옳지 않아!>,"완전 재밌었습니다! 스테이지 미술감독에게도 반하고뒤에서 많은 사람들이 노력했을것 같습니다2대 마틸다 만나려고 기다렸었는데무대에서 만난 마틸드 너무 찰떡이었습니다!! 스토리도 감동이었습니다,, 몰입해서 눈물난 장면도 있구신나게 노래에 흥나고 동심으로 돌아간 장면도 있습니다.이번 마틸다 공연을 놓친다는건 옳지 않아!!  :))))",2022.12.22
뮤지컬 〈마틸다〉,5,마틸다는,가족과 보기 너무 좋은거같네요~ 추천,2022.12.22
뮤지컬 〈마틸다〉,5,힐링극,뮤지컬 마틸다 초연에 이어 봤는데 볼때마다 참 힐링되는 극이에요은영틸다 처음에 미라클 노래할때 발음이 넘 좋아서 깜짝 놀랐어요 발성도 좋고 노래도 너무 잘하고 대단하네요! 다른 틸다들도 궁금해졌어요,2022.12.22
뮤지컬 〈마틸다〉,5,어른이 되면,평일 퇴근 후 보는 ''어른이 되면'' 넘버는 주말 관극과는 확실히 다른 느낌이 있는듯,2022.12.22
뮤지컬 〈마틸다〉,5,정말 재미있었습니다,전반적으로 배경이 참 예쁘고   배우들의 가창력도 좋았습니다  배우분들의 나이가 어림에도 불구하고 정말 잘하시더라고요  간만에 좋은 뮤지컬 관람했습니다,2022.12.22
뮤지컬 〈마틸다〉,5,마틸다 사랑해요!,너무 재미있어요!,2022.12.22
뮤지컬 〈마틸다〉,5,어른이들을 위한 뮤지컬??,어린이배우님들께 반하구 성인배우님들은 말하것두 없구 연출도 미쳤구 무대도 장난아닌.. 이런 뮤지컬 .. 특히 잶런치불쌤 체고에요...?? 잶님은 사랑입니다?? 신비틸다 진짜 커피콩 닮았어요ㅠㅠ 너무 작고 기엽고 소중한데 무대 장악력도 미쳤구ㅠㅠ 신비틸다 하고싶은거 다해!! 신비틸다의 옳지 않아요!! 아직도 귀에 맴돌아요ㅠㅠ 어른이되면 그네씬은 진짜 미쳤어요ㅠㅠ 다들 꼭 보세요??,2022.12.22
뮤지컬 〈마틸다〉,5,...눈물,애기들이 잘해서 기특해서 눈물 나고진짜 이야기 자체도 넘나 재밌습니다마틸다 화이티잉???????????????,2022.12.22
뮤지컬 〈마틸다〉,5,어른이 되면,"어른이 되면...아이들의 순수한 목소리에절로 눈물이 나더군요.스토리, 연기력, 가창 모두 뛰어난 뮤지컬입니다.추천드립니다. 아이와 어른 모두에게!마틸다 전석 매진 싹 다 깨부숴!!!",2022.12.22
뮤지컬 〈마틸다〉,2,"공연 전 1열 , 9열 방석 제공","1, 9열은 바로 앞 안전 바 때문에 시야가 가려서 아이가 허리를 숙이고 관람했음. 쉬는 시간에 뒷분이 아이가 숙여서 시야가 가려졌다고 하심. 일반적으로 키가 큰 사람이 앉으면 시야가 가려진다고 생각하지 작은 아이가 숙여서 오히려 안 보일 줄은 몰랐음. 안내원들이 공연 시작 전에 1,9열을 둘러보고 아이가 앉은 경우 방석이 필요함을 안내 후 미리 제공했다면 뒷분도 우리도 불편할 일 없었을 듯 함.  예매 페이지에 1,9열은 안전바 때문에 시야 가려진다는 말만으로는 부족한 안내라고 생각됨",2022.12.21
뮤지컬 〈마틸다〉,3,마틸다~~ 그러면안돼요!!,어린이들의 뮤지컬은 첨이네요넘넘 잘해서 놀랬어요많이 호흡맞추고 열심히 한듯하여 뿌듯했네요근데 주제가 좀 넘 그랬어요현시대엔 이런 일이 없어야 겠죠??잘봤어요,2022.12.21
뮤지컬 〈마틸다〉,3,어린이 뮤지컬,어린이뮤지컬같음... 어른들이 보기엔 좀 유치함,2022.12.21
뮤지컬 〈마틸다〉,5,연말 송년회는 마틸다로~,"팀원들과의 의미있는 연말 송년회를 보내는 방법을 고민하다 발견한 뮤지컬 [마틸다]!  어린이들이 출연하는 어린이들을 위한 내용일줄 알았지만, 직접 뮤지컬을 보고나서는 모두가 함께 즐길 수 있는 내용과 다양한 무대연출로 강한 감동을 받았답니다.   무엇보다도 출연배우진들의 탄탄한 연기력, 가창력과 마틸다 역의 하윤양의 엄청난 대사량에 다들 감탄을 했지요.   몰입감있는 넘버들과 중독성 있는 몇몇 대사들은 관람 후 다시금 되새기게 되었습니다.  너무 좋은 공연을 팀원들과 함께 즐기게 해준 마틸다 팀 여러분께 다시한번 감솨드립니다 :)",2022.12.21
뮤지컬 〈마틸다〉,5,하윤틸다를 보고왔습니다.,"저도 아이도 신나게 보느라, 두시간이 넘는 시간임에도 불구하고 시간 순삭이 된 것 같아요~ 열정 넘치는 아이들의 연기에 그동안의 치열했을 연습과정이 보이는 것 같아 짠하면서도 대견하네요. 올한해 마무리를 하는 공연으로 정말 마틸다 만한 것이 없네요. 두번보고, 세번보고 싶어요^^",2022.12.21
뮤지컬 〈마틸다〉,5,여윽시.. 마틸다 ㅠ 탄탄한 스토리 + 아역배우 연기천재,남자친구랑 진짜 3시간가까이 엄마미소를 띄우면서 봤어요ㅠㅠ 세상에 어쩜 아역들이 이리 깜찍뽀쨕하면서 연기까지 잘하죠? 계속 내가 저 배우들엄마라면 얼마나 뿌듯할까 얼마나고생했을까 생각하면서 감정이입이되서 눈물이자꾸 나려고하더라고요 ㅠ 어른이되면 넘버부를때는 진짜 눈물이 나서 참느라 혼났어요 ㅠㅠ 주인공을 포함 모든 아역배우 하나하나가 다 주인공이였고 어른들보다 훨씬 발음도 좋고  잘들리고 연기도 뒤지지않았어요 ㅠㅠ 최재림배우님은..말할것도없어요.. 존재감 자체만으로 그냥 압도하고 그냥 최재림배우님은 평생따라다닐거여요 ㅠㅠ~  아역배우님들 정말 최고 박수 오만번 보냅니다. 감동+재미 모두를 갖춘 마틸다 ㅠ 최고~,2022.10.31
뮤지컬 〈마틸다〉,4,조금 아쉽네요,아이들도 같이 관람하는 뮤지컬이다 보니 아이에게 공연에 대한 에티켓을 알려주고 와서 보는 부모님이 많이 계셨으면 하네요...,2022.12.21
뮤지컬 〈마틸다〉,5,하윤틸다 감동이에요.,"아이와 어른이 함꼐 보기에 좋은 뮤지컬이었습니다.  무대연출과 넘버가 잘 어우러져서 보기 좋았습니다.  어린 아역들이 얼마나 고생했을 지 눈에 선하네요. 물론 딕션이 좀 안좋은 부분도 있었지만 전혀 거슬리거나 관람하는데는 지장이 없었습니다.  어린이들이 배우들의 대사 하나하나에 대꾸를 하는 모습도 재미있었네요.  미리 내용을 보고 가면 좀 더 좋을 것 같네요.   하윤틸다와 어린이 앙상블과 성인배우분들 모두 고생하셨고, 멋진 공연 해주셔서 감사해요~",2022.12.21
뮤지컬 〈마틸다〉,5,기대 이상이네요^^,연말공연으로 마틸다를 선택해서 관람했어요. 4학년 딸아이 다시 보고싶다 하네요.가족공연으로 추천합니다^^,2022.12.21
뮤지컬 〈마틸다〉,5,즐거웠어요~,재밌게 관람했습니다~!,2022.12.21
뮤지컬 〈마틸다〉,4,재미있는 무대가 눈길을 사로잡았어요,"아이들의 멋진 칼군무, 아름다운 아이들의 목소리, 그리고 재미있게 돌아가는 무대들이 눈길을 사로잡았어요. 처음에는 조금 지루한듯 했으나 뒤로 갈수록 점점 더 재밌더라구요. 어린이들의 발음이 조금 아쉽기는 했지만 역할 자체가 어린이라, 오히려 더 현실적이었어요~",2022.12.21
뮤지컬 〈마틸다〉,5,N회차 관람,좋아하는 넘버는 늘 좋네요ㅠ,2022.12.21
뮤지컬 〈마틸다〉,5,즐거웠던 시간,완전 즐거웠던 시간이었네요... 어쩌면 그렇게 어린 배우들이 노래도 연기도 잘할수 있는지...얼마나 연습했을지... 감동적이었고 여러가지 생각해볼만한 것도 많았던 뮤지컬이었습니다.,2022.12.21
뮤지컬 〈마틸다〉,4,마틸다 폭력 속에도 성장하는 어린이,"뮤지컬 예매를 하고 관람 전에 영화를 다시 한번 복습했다 마틸다의 부모와 교장 선생님은 마틸다를 너무나도 혹독하고 가혹하게 괴롭히는 장면이 잔혹동화처럼 느껴졌다. 마지막에 살짝 통쾌한 결말을 위해 전반부 모두 마틸다가 당하는 장면에만 포커스가 맞춰져있어서 불편한 기분이 들었다. 뮤지컬과 영화가 비슷했고 잔인한 마틸다의 부모와 교장 선생님이 이야기의 주를 이루었다. 많은 아이들이 함께 관람했지만, 아이들에게 이게 과연 정서적으로 좋은 뮤지컬인지는 모르겠다. 무수히 많은 폭력 속에도 성장하는 마틸다. 부디 마틸다의 내면도 무탈하게 성장하기를 기원해본다.",2022.12.21
뮤지컬 〈마틸다〉,4,가족과 함께 보기 좋은 공연!,재밌게 열심히 웃다가 왔습니다!  남녀노소 모두 재밌게 즐길 수 있는 공연인듯해요,2022.12.21
뮤지컬 〈마틸다〉,5,넘 재밌어요!,봐도봐도 안질리고 넘 재밌어요ㅠㅠ,2022.12.21
뮤지컬 〈마틸다〉,5,마틸다 최고ㅜㅜ,봐도봐도 넘 재밌고 감동적이에여~!!,2022.12.21
뮤지컬 〈마틸다〉,5,하윤틸다 너무 좋았어요,"비장함이 느껴지는 표정 연기를 보며 캐릭터에 대한 이해도가 높다는 생각이 들었어요. 그 밖의 다른 배우분들이 완성한 캐릭터도 모두 매력이 있었고요. 감명 깊게, 즐겁게 잘 보았습니다.",2022.12.21
뮤지컬 〈마틸다〉,4,마 틸 다,아이들이 굉장히 많이 왔던데 애들이 보기 좋은 극인지는 모르겠어요~ 근데 또 어른이 보기에는 스토리 짜임새가 별로인 것 같고.. 그래도 무대 연출은 좋아서 한번 볼만했습니다!,2022.12.20
뮤지컬 〈마틸다〉,5,어린이들보다 어른이 더 위로받는..??,"어린 배우들이 보여주는 파워와 노력, 거기서 전해지는 위로로 마음이 따뜻해져요. 무대에서 열심히 뛰고 노래 부르는 어린배우들을 보면 내가 이걸 감히 앉아서 봐도 되나 싶지만.. 한편으로는 우리나라의 뮤지컬계가 더욱 기대되는 원천이 되는 뮤지컬이에요!",2022.12.20
뮤지컬 〈마틸다〉,5,????,어린 배우들이 생각보다 훨씬 잘해줘서 재밌게 잘 봤습니당,2022.12.20
뮤지컬 〈마틸다〉,5,여윽시.. 마틸다 ㅠ 탄탄한 스토리 + 아역배우 연기천재,남자친구랑 진짜 3시간가까이 엄마미소를 띄우면서 봤어요ㅠㅠ 세상에 어쩜 아역들이 이리 깜찍뽀쨕하면서 연기까지 잘하죠? 계속 내가 저 배우들엄마라면 얼마나 뿌듯할까 얼마나고생했을까 생각하면서 감정이입이되서 눈물이자꾸 나려고하더라고요 ㅠ 어른이되면 넘버부를때는 진짜 눈물이 나서 참느라 혼났어요 ㅠㅠ 주인공을 포함 모든 아역배우 하나하나가 다 주인공이였고 어른들보다 훨씬 발음도 좋고  잘들리고 연기도 뒤지지않았어요 ㅠㅠ 최재림배우님은..말할것도없어요.. 존재감 자체만으로 그냥 압도하고 그냥 최재림배우님은 평생따라다닐거여요 ㅠㅠ~  아역배우님들 정말 최고 박수 오만번 보냅니다. 감동+재미 모두를 갖춘 마틸다 ㅠ 최고~,2022.10.31
뮤지컬 〈마틸다〉,5,역시 최고,너무 재미있게 잘 봤습니다,2022.12.20
뮤지컬 〈마틸다〉,5,최고,모든마틸다가 다 잘해요,2022.12.20
뮤지컬 〈마틸다〉,5,대배우님들...,모든 넘버가 마음을 울립니더 ㅠㅠㅠㅠㅠ,2022.12.20
뮤지컬 〈마틸다〉,5,재밌어요 ㅎ,생각보다 화려하고 재밌어요 아이들 발음은 좀 아쉬웠지만 재밌어서 또 보고 싶어요 ㅎ,2022.12.20
뮤지컬 〈마틸다〉,5,마틸다 자첫인데 너무 좋아요,사실 어린배우들이 주연인 뮤지컬은 실망할까봐 안보는 타입인데 마틸다는 보길 잘 한것 같아요인생 자첫인데 좋아하는 배우가 나와서 봤는데 좋아하는 배우보다 어린 배우들이 더 눈에 들어오네요볼 거리도 많고 적당히 화려해서 아이들도 질려하지않고 조용히 재밌게 잘 볼것같은 극이에요머글 친구 데려갔는데 너무 재밌다고 또 보고싶다해서 다음에도 또 보려고 예매해놨습니다ㅋㅋㅋ,2022.12.20
뮤지컬 〈마틸다〉,5,어린시절로 돌아가는 기분을 느끼고 싶다면 추천!!!,아역배우들과성인 배우들의 연기가 최고 였고 특히 아역배우들 그네씬에서 어른이 되면을 듣고어린 시절로 돌아가는 기분을 느끼고 감동을 받았습니다!!,2022.12.20
뮤지컬 〈마틸다〉,5,영화보다 더 영화같은 느낌,마틸다의 연기와 노래가 너무나도 뇌리에 남는 뮤지컬이었어요. 최재림 배우님의 연기 또한 여윽시 최고!!!영화보다 더 영화 같았던 마틸다!,2022.12.20
뮤지컬 〈마틸다〉,5,연말 최고의 뮤지컬,가족끼리 다같이 가서 보고오기 너무 좋습니다!!!!강추!,2022.12.20
뮤지컬 〈마틸다〉,5,최고,어른들이 더 봐야할 뮤지컬!,2022.12.20
뮤지컬 〈마틸다〉,5,아이가 행복한 뮤지컬,아이들의 스트레스를 날려주는 뮤지컬 같아요 ?? 집에오면서도 계속 뮤지컬 이야기만 하네요~ 가족 뮤지컬로 강추 ^^,2022.12.20
뮤지컬 〈마틸다〉,5,마틸다는 늘 옳습니다!,"언제봐도 옳은 뮤지컬 마틸다.포틸다는 물론 구더기팀 도롱뇽팀 아역 배우들,트런치블과 허니 쌤, 펠프스 쌤, 마틸다 엄마 아빠,공중곡예사, 탈출마술사를 비롯한 모든 앙상블 배우들그 누구라도 존재감이 넘쳐나는 마법같은 뮤지컬마틸다 최고입니다!!",2022.12.20
뮤지컬 〈마틸다〉,5,눈이 번쩍 뜨이는 공연!,"아역배우들이 나오기 때문에 성인들과는 다르겠지 싶었는데 이게 웬 걸.  정말 깜짝 놀랐습니다. 마지막 불가리아어 할 때에는 경악을 금치 못했다는- 놀라운 점은 이 뿐만이 아닙니다.  1. 배우들의 연기 눈이 즐거웠습니다. 중간 강렬한 춤들이 있는 것도 그렇고 연기가 다들 안정적이어서 빠져들면서 봤습니다. 아역들은 왜 이리도 연기를 잘하는지요. 연기만 하는 것도 아니고 노래, 춤까지 해야 되어서 긴장될 텐데 수준 높은 퍼포먼스 인상적이었습니다.   2. 화려한 무대 연출 옆에서도 보고 최대한 자세히 연출을 어떻게 하는지 보려고 노력했는데 어떻게 하는 건지 된통 모를 정도로, 신기한 연출들이 많았습니다. 위험한 장면에 대한 우려까지도 연기자 분이 재치있게 풀어주셔서 더 재밌었습니다.   3. 연계성 있는 스토리 이게 영화로도 있는 스토리인지 모르고 처음 봤는데 재밌더라고요. 뮤지컬 관람이 이번이 4번째였는데 앞으로 계속해서 뮤지컬 관람을 하려고 합니다. 멋진 공연 준비해 주셔서 감사합니다:)",2022.12.20
뮤지컬 〈마틸다〉,5,마틸다,언제봐도 재밌는 마틸다 다들 보세요!,2022.12.20
뮤지컬 〈마틸다〉,5,화려한 연출 탄탄한 스토리,너무 재미있네요 아역배우들이 너무 잘하고 조명이 화려해서 보는 맛 있어요,2022.12.19
뮤지컬 〈마틸다〉,5,너무재밌게보았어요,너무재밌었고.영화의느낌을어떻게표현할까궁금했고. 아이도 너무즐겁게보았어요.조금아쉬운건.마틸다역친구의발음이솔직히조금아쉬웠어요ㅜㅜㅡ발음이말아들어간다해야할까오?ㅜㅜ 하지만정말멋지고 훌륭한공연이였습니다.,2022.12.19
뮤지컬 〈마틸다〉,5,여윽시.. 마틸다 ㅠ 탄탄한 스토리 + 아역배우 연기천재,남자친구랑 진짜 3시간가까이 엄마미소를 띄우면서 봤어요ㅠㅠ 세상에 어쩜 아역들이 이리 깜찍뽀쨕하면서 연기까지 잘하죠? 계속 내가 저 배우들엄마라면 얼마나 뿌듯할까 얼마나고생했을까 생각하면서 감정이입이되서 눈물이자꾸 나려고하더라고요 ㅠ 어른이되면 넘버부를때는 진짜 눈물이 나서 참느라 혼났어요 ㅠㅠ 주인공을 포함 모든 아역배우 하나하나가 다 주인공이였고 어른들보다 훨씬 발음도 좋고  잘들리고 연기도 뒤지지않았어요 ㅠㅠ 최재림배우님은..말할것도없어요.. 존재감 자체만으로 그냥 압도하고 그냥 최재림배우님은 평생따라다닐거여요 ㅠㅠ~  아역배우님들 정말 최고 박수 오만번 보냅니다. 감동+재미 모두를 갖춘 마틸다 ㅠ 최고~,2022.10.31
뮤지컬 〈마틸다〉,5,재런치불 짱,"처음부터 컷콜까지 배역에 몰입해서 표정 짓는거 정말 킹받아옄ㅋㅋㅋㅋㅋ(너무 좋은뜻)최재림 배우는 배역마다 매우 몰입하는거 진짜 짱이거!!! 신비틸다 쪼꼬만대,,, 노래도 잘하고 연기도 잘하고ㅠㅠㅠ 감정선도 좋고ㅠㅠㅠ 아가들 너모너모 잘해요",2022.12.19
뮤지컬 〈마틸다〉,5,위대한 소녀 마틸다,가족들 데리고 갔는데 반응 최고였다진짜 이 시대 최고의 뮤지컬어린이 배우님들 너무 잘하고 짱,2022.12.19
뮤지컬 〈마틸다〉,5,은영마틸다와 기적같은 아이들,어린이들이 연기하지만 어른들이 생각할 게 더 많은 극이에요.  은영마틸다 똑부러지고 어른보다 더 어른스러운 마틸다더라고요. 끝나고 커튼콜때는 딱 그 나이 어린이로 돌아가던데 ㅎㅎㅎ 너무 귀엽습니다.  이 기적같은 어린이와 또 기적같은 어린이들이 뜨거운 에너지로 열심히 무대 올리고 있는데 너무 감동적이었습니다. 내용도 좋았지만 또 다른 면으로 좋은 기운을 충전하고 온 것 같아요!  연말에 소중한 사람들과 함께 봐도 좋을 것 같아요! 완전 추천합니다.,2022.12.19
뮤지컬 〈마틸다〉,5,마틸다,간만에 너무 재밌고 귀여운 뮤지컬을 볼 수 있어 좋았습니다,2022.12.19
뮤지컬 〈마틸다〉,5,"앙상블의 진가를 보여준 뮤지컬, 마틸다!","제 인생의 첫 회전문 뮤지컬, 바로 마틸다입니다. 초연 때 공연을 못 봐 영상으로만 주구장창 보고 재연 한다는 소식에 공연도 보기 전 10회 이상의 공연을 예매 해놨었습니다. 영상으로는 너무 만족을 했는데 실제론 다르면 어떡하지? 라는 생각도 했었습니다. 제 우려와 걱정과는 달리 첫공을 보자마자 반해버렸고 제 인생 뮤지컬에 등극을 했으며 리벨리온, 어른이 되면, 리볼팅 칠드런 이 세 넘버는 극 중 제가 가장 좋아하는 넘버가 됐습니다. 살면서 그리 많은 뮤지컬을 본 것은 아닙니다. 그치만 그 쟁쟁한 중소, 대극장 뮤지컬 중 단언컨대 제 마음속 0등 뮤지컬로 뽑을 수 있을 것 같습니다. 이유로는 앙상블 배우분들을 뽑고싶네요. 철호 배우님 승일 배우님 찬양 배우님 시영 배우님 등 많은 앙상블 배우분들의 연기가 무대를 더 꽉 차 보이게 하는 시너지 효과를 내는 것 같습니다. 스쿨송을 예로 들자면 여러명이 같이 부름에도 불구하고 귀에 쏙쏙 박히는 가사와 군무를 보시면 납득하실 겁니다. (아직 스쿨송이 뭔지 모르신다구요?? 어떻게 그래요!! 당장 디큐브로 달려가세욧!!)정말 이 갓극 뮤지컬, 뮤지컬 마틸다 아직 안 보신 분이 계신다면 빨리 서둘러 주세요ㅠ 이미 마지막 티켓팅이 끝나고 자리는 이미 사라지구 있다구요!! 매 회차마다 색다른 재미, 슬픔을 느낄 수 있는, 때론 교훈도 얻어가는 뮤지컬 마틸다. 더 늦기 전에 후회하시지 말고 지금 바로 서둘러 예매창으로 ㄱㄱ!!!!!!!(마지막으로 신시컴퍼니 사랑해요??박명성 대표님 사랑합니다?? 인터파크 감사해요??)",2022.12.19
뮤지컬 〈마틸다〉,5,최고의 뮤지컬,즐겁고 행복한 시간이었어요,2022.12.19
뮤지컬 〈마틸다〉,5,동화책을 펼쳐본 느낌,당찬 아역 배우들과 감초 조연들의 이야기로 동화 속 장면을 엿보고 나온 느낌입니다.,2022.12.19
