musical_title,rate,review_title,review_text,review_date
뮤지컬 지킬앤하이드 (Jekyll＆Hyde),5,재밌어요,힘들게 예매했는데 보람 있네요 재밌었어요,2021.12.06
뮤지컬 지킬앤하이드 (Jekyll＆Hyde),5,명불허전 류지킬,뮤린이 임에도 불구하고 들어본 류지킬!!!  기대반 걱정반이었지만 괜한 걱정이었다는걸 보여주신 최강의 지킬 류정한배우님!!!  윤공주님 민경아님 또한 최고의 연기를 보여주셔서 정말 보람찬 관람이었습니다^^!!  앞으로 기회가되면 재관람하고 싶네요ㅜㅜㅜㅜ  류지킬 감사합니다!,2021.12.06
뮤지컬 지킬앤하이드 (Jekyll＆Hyde),5,류정한은 지킬앤하이드의 신이다,류정한 컨프롱 못사가 있으면 안됩니다,2021.12.06
뮤지컬 지킬앤하이드 (Jekyll＆Hyde),5,1888년 가을.,그는 우리 마음속에 있는 선과 악을 분리해 통제하는  과학실험을 시작했습니다. 그때까지는 전혀 알지 못했습니다.  그것이 그의 영혼을 완전히 바꾸어버리리라곤 말이죠. 그리고 제 영혼마저도. -어터슨-,2021.12.06
뮤지컬 지킬앤하이드 (Jekyll＆Hyde),5,좋았어요,좋았어요,2021.12.06
뮤지컬 지킬앤하이드 (Jekyll＆Hyde),5,잘봤습니다.,잘봤습니다.,2021.12.06
뮤지컬 지킬앤하이드 (Jekyll＆Hyde),5,잘봤습니다.,잘봤습니다.,2021.12.06
뮤지컬 지킬앤하이드 (Jekyll＆Hyde),5,기대중,빨리 보내주세용,2021.12.06
뮤지컬 지킬앤하이드 (Jekyll＆Hyde),4,잘 봤습니다.,잘봤습니다. 배우님들은 말해 뭐해요! 바뀐 무대 너무 멋졌어요.,2021.12.06
뮤지컬 지킬앤하이드 (Jekyll＆Hyde),4,와!,톡지킬 좋아졌다. 완벽한 두 여주의 앙상블!,2021.12.06
뮤지컬 지킬앤하이드 (Jekyll＆Hyde),5,재밌어요,홍지킬은 그저 갓..,2021.12.06
뮤지컬 지킬앤하이드 (Jekyll＆Hyde),5,재밌어요,재밌어요,2021.12.06
뮤지컬 지킬앤하이드 (Jekyll＆Hyde),5,뮤지컬 지킬앤하이드를 관람하고..,정말 재밌습니당 ㅜㅜㅜㅜㅜㅜㅜㅜㅜㅜㅜㅜ 류하이드 최고.. 존무.. 짬에서 나오는 바이브 bbb,2021.12.06
뮤지컬 지킬앤하이드 (Jekyll＆Hyde),5,정말 좋습니다!!,정말 좋습니다!!,2021.12.06
뮤지컬 지킬앤하이드 (Jekyll＆Hyde),5,좋앗음,홍지킬 미쳣음 근데 지난 18년도 회차보다 이사회씬이 좀 덜 쫀쫀한 느낌이에요임팩트가 되게 컸었는데 조금 쳐지는 느낌,2021.12.06
뮤지컬 지킬앤하이드 (Jekyll＆Hyde),5,지킬 진짜 재밌어요,홍광호배우 진짜 최고에요ㅋㅋ 와 어떻게 저렇게 부르고 하는지 진짜 너무잘하네요 이거 너무최고에요 진짜 홍지킬은 너무잘하네요,2021.12.06
뮤지컬 지킬앤하이드 (Jekyll＆Hyde),5,지킬 앤 하이드,스토리는 조금 아쉬웠지만 배우들의 노래와 연기가 정말 좋았어요,2021.12.06
뮤지컬 지킬앤하이드 (Jekyll＆Hyde),5,홍지킬은 진짜...,왜 홍광호 홍광호 하는지 알겠어요... 걍 잘함 너무잘함 극자체는 정말 올드한데 배우들이 하드캐리해요 그리고 기분나쁜 연출이 너무많아요 특히야옹,2021.12.06
뮤지컬 지킬앤하이드 (Jekyll＆Hyde),5,최고였어요!,사실 보기도 전에 OST를 주문해놨었는데 정말 어서 왔으면 좋겠네요 배우님들 연기도 최고였고 넘버들도 너무 좋았어요,2021.12.06
뮤지컬 지킬앤하이드 (Jekyll＆Hyde),5,단연 최고 지킬앤하이드,엄마가 뮤지컬을 너무 좋아하시는데 지킬앤하이드 뮤지컬 보여드리게 되어 저도 좋고 너무 뿌듯했습니다 지킬앤하이드 역할이 신성록 배우님이 였는데 발성과 연기력 표현력 모든것이 완벽했습니다 다른 배우분들도 너무너무 잘하셔서 행복했던 감상이였어요! 감사합니다,2021.12.05
뮤지컬 지킬앤하이드 (Jekyll＆Hyde),4,재미있었어요!!,재미있었어요!!,2021.12.05
뮤지컬 지킬앤하이드 (Jekyll＆Hyde),5,좋은 관람,신성록배우님 정말  굳배역다른 배우님들도  놀라왔어요.,2021.12.05
뮤지컬 지킬앤하이드 (Jekyll＆Hyde),3,아쉬웠지만 즐거웠던 관람,"루시 역 아이비 배우하고 앙상블팀 파사드는 최고였어요!!배우들 컨디션이 그다지 좋지 않았던것 같아서 아쉬웠고, 아직도 공연장에서 핸드폰 벨소리가 울리고 앞좌석 발로 차는 수준 낮은 관객들이 있다는게 화가 나네요",2021.12.05
뮤지컬 지킬앤하이드 (Jekyll＆Hyde),5,역시 홍지킬은 레전드이다,연기에서 한번 넘버에서 한번 반함...,2021.12.05
뮤지컬 지킬앤하이드 (Jekyll＆Hyde),5,역시는 역시 ,홍광호 배우님의 홍지킬은 진짜 최고 최고 연기 노래 완벽함 그자체 최애 배우 믿고보는 홍지킬 홍배우님너무너무 멋있으심 조금만 덜 잘하시지 너무너무 잘하시니 자리를 구하기가 너무 너무 힘들 잖아요ㅜㅜ진짜 피 터져요 티켓팅ㅜㅜ아이비 배우님도 최고 였고 최수진 배우님은 좀 노래 할때마다 듣기가 좀 안좋았어요홍지킬님을 보러 간거지만 엠마는 좀 별로 였네요그래도 지킬이랑 루시는 완벽~~~,2021.12.05
뮤지컬 지킬앤하이드 (Jekyll＆Hyde),5,홍광호 배우님 !! ,지킬은 지난번 내한으로 봤던터라 안보려고 했는데 갑자기 홍광호님 노래 듣고 싶어서 한자리 남아 있던 2층 좌석 관람 했습니다!! 와우 진짜 역시는역시!! 제 최애 배우님 답습니다!! 내한때는 지루했는데 다음번에 1층 좌석에서 시야 놓치지 않고 제대로 보고 싶네요 ㅠㅠㅠ,2021.12.05
뮤지컬 지킬앤하이드 (Jekyll＆Hyde),5,류선녀선민,이 날 뭔가 피치가 불안... 그래도 재밌어요,2021.12.05
뮤지컬 지킬앤하이드 (Jekyll＆Hyde),5,샤롯데 공사 다시 해야할것 같네요ㅠ,홍지킬이 맨날 샤롯데 천장 뚫어서 어떡해요 진짜,2021.12.05
뮤지컬 지킬앤하이드 (Jekyll＆Hyde),2,12.4일 오후2시 류정한 배우.. 음이 계속.. ,초반엔 음…? 하고 그냥 몇번 넘어갔지만 극이 진행되면 될수록 … 노래 클라이막스 부분에 계속 음 피치 떨어지고 노래를 .. 왜 저렇게 하지..? 라는 생각에 집중하기 어려웠던 부분을 아이비님이랑 다른 배우분들이 채워주셔서 그나마 재밌게 관람했습니다…  하이드로 변할때 계속 손가락만 연신 쥐었다폈다.. 꿈틀꿈틀.. 지킬앤하이드 자체는 너무 재밌어서 또 보고싶지만 오늘은 좀 그랬네요…,2021.12.05
뮤지컬 지킬앤하이드 (Jekyll＆Hyde),5,코로나를 잊은 열기,코로나로 인해서 오랜만에 본 뮤지컬입니다.  지킬앤하이드 연기 대단하였습니다.  적극 추천입니다.,2021.12.05
뮤지컬 지킬앤하이드 (Jekyll＆Hyde),1,12월1일 공연 류정환 최악,류정환님 목상태가 안좋은건지 정말별로네요음은 계속플랫되서 끝까지 불안한 상태로봤고 소리가 잘 안나오시는지 계속 목 누르는 소리내셔서 불편했습니다환불받고싶은 마음이었습니다 조지킬 생각만 나네요류정환 님만 빼고는 정말 좋은공연이었네요특히 아이비루시님 쵝오였습니다 소름쫙,2021.12.05
뮤지컬 지킬앤하이드 (Jekyll＆Hyde),5,잘봤습니다.,잘봤습니다.,2021.12.04
뮤지컬 지킬앤하이드 (Jekyll＆Hyde),5,잘봤습니다.,잘봤습니다.,2021.12.04
뮤지컬 지킬앤하이드 (Jekyll＆Hyde),5,잘봤습니다.,잘봤습니다.,2021.12.04
뮤지컬 지킬앤하이드 (Jekyll＆Hyde),5,지킬앤하이드,"내생애 첫 뮤지컬이였다. 매우 감동적이였고, 스크린으로 보는 영화와는 사뭇 다른 매력이 있었다. 또 보고 싶다.",2021.12.04
뮤지컬 지킬앤하이드 (Jekyll＆Hyde),5,confrontation &#128077;,&#128077;&#128077;,2021.12.04
뮤지컬 지킬앤하이드 (Jekyll＆Hyde),5,너무 재밌게 봤어요,너무 재밌게 봤어요,2021.12.04
뮤지컬 지킬앤하이드 (Jekyll＆Hyde),5,너무나 좋은 시간이였습니다!,"배우분들을 이렇게 가까이에서 보면서 즐기니 정말 다르구나 느꼈습니다. 박수가 안나올수가 없고, 너무나 재미있고 즐거웠습니다.",2021.12.04
뮤지컬 지킬앤하이드 (Jekyll＆Hyde),5,너무나 좋은 시간이였습니다!,"배우분들을 이렇게 가까이에서 보면서 즐기니 정말 다르구나 느꼈습니다. 박수가 안나올수가 없고, 너무나 재미있고 즐거웠습니다.",2021.12.04
뮤지컬 지킬앤하이드 (Jekyll＆Hyde),5,역시  명불허전~,무대구성이나  출연자의  연기 노래 모두 짜임새가 있고 전문성이 느껴졌음 무리한 스케줄이 아닌 충분한 휴식?(매회 캐스팅 되지 않고)으로 최대의 능력을  발휘할수 있는것 같아 피로도보다는 더 열정이 느껴졌음,2021.12.04
뮤지컬 지킬앤하이드 (Jekyll＆Hyde),5,넘 환상적이었어요~,배우들의 혼신을 다한 연기가 2층 관람석까지 찐~~~하게 느껴졌어요 감동가득 안고 힐링하는 시간이었어요,2021.12.04
뮤지컬 지킬앤하이드 (Jekyll＆Hyde),5,홍하이드!!!??,멋짐!!,2021.12.04
뮤지컬 지킬앤하이드 (Jekyll＆Hyde),5,재밋게 잘 봤어요,재밌게 잘 봣어요 오페라글라스 예약해야되는걸 몰라서 못빌렸네요 아쉬워요 ㅠ,2021.12.04
뮤지컬 지킬앤하이드 (Jekyll＆Hyde),5,꼭 보세요~!!,다들 잘 하시지만 지킬박사 역 홍광호 배우님이랑 루시 역 선민 배우님 댄버스경 역 김봉환 배우님 특히 멋있으셨어요!,2021.12.04
뮤지컬 지킬앤하이드 (Jekyll＆Hyde),3,윤공주 배우 최고,"홍광호 배우분 하이드역 포스가 엄청나네요.  강력한 하이드 재미있었습니다. 과거 몇번의 관람에서 루시역에 대한 감동은 없었는데,, 단연 루시가 최고인 공연이었습니다. 흡입력이 엄청나네요.  전체적으로 관람 추천합니다.",2021.12.03
뮤지컬 지킬앤하이드 (Jekyll＆Hyde),5,역시 지킬은 최고.,지킬앤하이드는 역시 최고  적극 추전합니다.,2021.12.03
뮤지컬 지킬앤하이드 (Jekyll＆Hyde),5,왜 그렇게 지킬앤하이드가 유명한지,새삼 느끼고 왔습니다ㅜㅠㅠ,2021.12.03
뮤지컬 지킬앤하이드 (Jekyll＆Hyde),5,역시나 멋진..^^,믿고보는 홍광호님의 공연~ 기대만큼 잼나게 잘봤어요~^^,2021.12.03
뮤지컬 지킬앤하이드 (Jekyll＆Hyde),5,홍광호 윤공주 민경아 캐슷으로 봤어요!,"마스크는 했지만, 뻥뻥뚫리게 시원한 무대보고왔어요!!! 으- 이조합 너무 찐이네요 찐!!",2021.12.03
뮤지컬 지킬앤하이드 (Jekyll＆Hyde),5,정말 즐겁게 관람했습니다.,"신성록 배우님의 뮤지컬 공연은 처음 관람했는데, 가창력도 정말 훌륭하시고 연기 역시 말할 것 없이 잘 하셔서 시간 가는 줄 모르면서 관람했습니다. 특히 극 후반부에 지킬과 하이드를 동시에 연기하실 때 혼신의 힘을 다하여 연기하시는 모습이 정말 인상깊었고 최고였습니다..ㅠ  드라큘라 때 워낙 기억에 남아서 알고 있었던 선민 배우님도 역시 가창력 bb..지킬앤하이드에서 루시 역을 처음 맡아보신 것으로 알고 있는데 역할 소화를 정말 잘하셨던 것 같습니다. 조정은 배우님의 몰입감 있는 연기도 좋았어요!  그러고보니 세 배우분 모두 드라큘라 나오셨던 배우님들이었네요..ㅎㅎ아무튼 정말 재밌게 관람하였습니다. 또 보러 가고싶습니다!",2021.12.03
뮤지컬 지킬앤하이드 (Jekyll＆Hyde),5,완벽했던 지킬&하이드,정말 완벽했던 공연! 홍광효 배우의 지킬과 하이드는 최고라 할 수 있다,2021.12.03
뮤지컬 지킬앤하이드 (Jekyll＆Hyde),5,강추,지킬 홍광호 최고 또 볼거야ㅠㅠㅠ,2021.12.03
뮤지컬 지킬앤하이드 (Jekyll＆Hyde),4,행복했던 12월 밤.,2년을 주기로 지속적으로 공연이 가능한 이유가 있습니다.  행복했던 12월 밤 이엇습니다.,2021.12.03
뮤지컬 지킬앤하이드 (Jekyll＆Hyde),5,아무래도,포인트 당첨 안된지가 두달이 넘어가는거 같은데,2021.12.03
뮤지컬 지킬앤하이드 (Jekyll＆Hyde),5,1114 회차 보고왔습니다,"홍광호, 선민, 조정은 이렇게 꼭 보고싶었던 조합으로 인생자첫 하고 온 지킬앤하이드는 그냥 전율이었어요. 오래된 스토리의 극인만큼 낡은 느낌은 있었지만 주옥같은 넘버들과 빵빵한 앙상블이 너무 최고였습니다. 홍지킬은 두 말하면 입 아플 정도로 최고였어요ㅜㅜ 진짜 150%를 보여준 홍지킬 .. 샤롯데 뚜껑이고 뭐고 다 날리셔서 덕분에 시원한 관람했네요. 선민루시는 다른 극의 루시로 만났을때 반해서 보러 간 거였는데 지킬루시도 너무 찰떡ㅜㅜ 조정은엠마도 다른 극에서 반해 따라간 거였는데 역시 연기와 넘버가 일품이고 엠마의 비중이 적은게 너무나 아쉬울 따름이였습니다.. 2차 캐스팅도 기대하고있어요",2021.12.02
뮤지컬 지킬앤하이드 (Jekyll＆Hyde),5,관극 매너 좀 지켜주세요,일단 홍지킬은 두말 할 필요 없구요 티케팅도 엄청 어려웠는데 공연보러 와서 폰 자꾸 보는 옆자리 관객 때문에... 어셔분들이 등받이에 붙어서 보라고 시작전에 얘기해주니깐 그건 다들 지키는 것 같던데 공연중 폰 보지 말라고는 얘기를 안하니까 당연한 것도 모르는건지...,2021.12.02
뮤지컬 지킬앤하이드 (Jekyll＆Hyde),5,행복한 시간 ♡,"공연 볼 때마다 결의에 찬 지킬의 고뇌하는 모습과 포효하며 악한 인간의 본성을 드러내는 하이드를 보면 홍광호 배우의 변화무쌍하며 작품에 녹아드는 그 열정에 큰 감동을 받게 됩니다.( 노래나 연기는 말할것도 없구요^^)배우도 아닌 내가 볼때마다 너무 긴장되고 떨린마음으로 보게 됩니다. 물론 기분좋은 떨림이지만요^^엠마나 루시, 앙상블 등 다른 역할의 배우님들 모두의 열정으로 이루어지는 '지킬앤 하이드'공연기간동안 추워진 날씨에 감기 조심하시고 배우님들 모두 건강하세요~^^너무나 행복한 시간이었습니다.",2021.12.02
뮤지컬 지킬앤하이드 (Jekyll＆Hyde),5,지금 이 순간,바로 이순간~  짜릿해 최고야 늘 새로워!,2021.12.02
뮤지컬 지킬앤하이드 (Jekyll＆Hyde),5,류지킬대박,완전 대박추천,2021.12.02
뮤지컬 지킬앤하이드 (Jekyll＆Hyde),5,말이 필요없네요,워낙 유명한 뮤지컬이라 기대반 설렘반으로 갔습니다. 초반 시작부터 온몸에 소름이 돋더라구요 아 이래서 지킬 지킬 하는구나 뮤지컬 초보라 원하는 캐스팅은 없어서 초반에 시간 맞춰서 갔다가 류지킬 보고 놀랬네요 컨프롱은 류지킬 최곱니다. 세분꺼 다 봤지만 각각 다 다른 매력이라 재밌었어요 루시도 세분꺼 다 봤지만 각각 본인들만의 색으로 보여주셔서 세분 다 다른 느낌이라 좋았습니다 엠마는 우연치 않게 조정은 배우님껏만 봤는데 와.. 이분은 말이 필요없네요 등장때마다 온몸에 소름돋을 정도로 연기랑 가창력이 대단하세요,2021.12.02
뮤지컬 지킬앤하이드 (Jekyll＆Hyde),4,눈에도 안들어오던 지킬 첫관람.,"내용도 별로 흥미롭지않앗고넘버도 귀에 때려박는것도 없어서그동안 지킬앤하이드 는 걍 패스 시켯엇는데..지루해보인다는 느낌이 강햇엇음.사람들이 열광하는 지금이순간 넘버는티비에서 연예인들이 주구장창 불러와서감흥도없엇음..넘버가 별로 폭발적이지도않고..그런데 뮤지컬배우 오디션 프로그램에서지킬앤하이드 몇번 나온거보고관심이 가기 시작햇고 루시 넘버 새인생에 매혹당함.한번 보자 결심하게됨.12월1일 홍광호,선민,최수진 조합으로 첫관람.내가 생각햇던것보단 훨씬 좋앗음.불호도 아님..서사들이 좀 간주점프??식의 느낌은 들지만...홍광호,선민배우는 애정이라 선택햇지만최수진배우는 처음 관람하는거라 기대를 별로 안햇는데잘하시는분이구나 ...그 짱짱한 홍광호목소리를 뚫고 나옵니다.엠마 넘버가 젤 어려울것같아 보엿음..배우들 넘버가 다 어려워보이긴하던데...최수진배우는 지킬,루시와의 하모니도 너무나 잘어울렷어요. 듀엣 할때 정말 집중 잘됏고 잘하심.이날의 명장면은 약혼식 지킬 퇴장장면 ㅋㅋㅋㅋㅋㅋㅋ가기싫어 죽겟는,,아련히 엠마를 바라보는 눈빛ㅋㅋㅋㅋ홍광호 귀여워 죽을뻔ㅋㅋㅋㅋㅋㅋㅋㅋㅋㅋ헨리로만 살줘요 ㅋㅋㅋㅋㅋㅋㅋㅋㅋㅋ돈아깝지 않은 관극이엇고한번 더 볼 의향 잇음.",2021.12.02
뮤지컬 지킬앤하이드 (Jekyll＆Hyde),5,선과 악의 분리_지킬 앤 하이드,"지킬과 하이드가 꼭 다른 사람 같았다. 지킬은 정말 신사중의 신사같았는데 하이드는 짐승 그자체였다. 루시에게 다정하게 대해주던 그 모습은 온데간데 없어지고 하이드의 모습으로 루시를 때렸다니 말이다.   엠마는 참 안쓰러웠다. 약혼식때 처럼 언제까지고 기다리고만 있어야하는 처지인것 같았다. 아무리 정말 사랑하는 사람이라 괜찮다고 생각해도 점점 그 일이 계속 될거라고 생각하면 나라면 지킬에게 지칠것 같다.   늘 자신을 길거리여자로 대하고 숙녀처럼 대해주지 않던 남자들만 보았던 루시가 자신을 하나의 인격체로 봐주는 지킬에게 따듯함을 느끼고 사랑에 빠지는게 절대 이상한 것 같지 않았다. 나였어도 자신을 다른 사람듥과 달리 대해 주는 사람에게 금방 사랑에 빠질 것 같다.  모든 사람들에게 착한 사람, 선행을 베푸는 사람으로 알려진 사람이 사실은 쓰레기였다는게 정말 역겨웠다.   엠마와 루시는 서로 다른 사랑을 표현했다. 엠마는 일방적인 사랑으로써 지킬을 사랑했고 루시는 사랑을 받음을 사랑한것 같았다. 그러나 두 사랑이 모두 버림 받는 모습이 너무 안타까웠다. 루시는 계속 지킬을 기다렸는데 결국 하이드에게 죽음을 당하고 엠마는 눈 앞에서 자신의 사랑이 죽는 모습을 지켜볼 수 밖에 없었다는게 안쓰러웠다.   처음엔 위선자를 죽이던 하이드도 뒤로 갈수록 죄 없는 사람을 죽여나갔다. 처음엔 영웅으로 보일 수 있어도 점점 그냥 살인마와 다를바 없어보였다.  하지만 지킬은 사랑하는 사람을 지키기 위해 루시에게는 떠나라고 편지를 작성했고 엠마를 지키기 위해 자신과 함께 하이드를 죽이는 선택을 했다.  결국 지킬이 만들어낸 약은 선과 악 서로를 분리시켜 통제하는것이 아닌 선과 악이 싸워 더 강한 것이 이겨 합쳐지게끔 하는 것 같았다.",2021.12.02
뮤지컬 지킬앤하이드 (Jekyll＆Hyde),2,배우들은 최고,내용이 뻔해도 재밌게 본 뮤지컬 정말 많은데 지킬은 개인적으로 좀 실망스러웠습니다. 장면이 뚝뚝 끊기고 감정선 구축이 없다보니 뜬금없이 느껴질 때가 많았습니다. 그러다보니 이입도 안되고요.. 불필요하게 선정적인 장면도 있어서 보는데 불편했어요. 미완성 극을 본 느낌..배우분들 실력이 정말 좋았는데 너무 아쉽습니다..,2021.12.02
뮤지컬 지킬앤하이드 (Jekyll＆Hyde),5,강.력.추.천,"왜 다들 류지킬 류지킬하는지 깨달았습니다,, 조정은 배우님은 말할 것도 없고 아이비 배우님도 정말 가창력이 대단하셨습니다 다시 보고 싶을 정도였습니다 강력추천!!!",2021.12.02
뮤지컬 지킬앤하이드 (Jekyll＆Hyde),2,배우들은 최고,내용이 뻔해도 재밌게 본 뮤지컬 정말 많은데 지킬은 개인적으로 좀 실망스러웠습니다. 장면이 뚝뚝 끊기고 감정선 구축이 없다보니 뜬금없이 느껴질 때가 많았습니다. 그러다보니 이입도 안되고요.. 불필요하게 선정적인 장면도 있어서 보는데 불편했어요. 미완성 극을 본 느낌..배우분들 실력이 정말 좋았는데 너무 아쉽습니다..,2021.12.02
뮤지컬 지킬앤하이드 (Jekyll＆Hyde),5,역시 지앤하!,너무 좋아요ㅠ 우리나라 뮤지컬중 최고입니다 꼭꼭 보세요,2021.12.02
뮤지컬 지킬앤하이드 (Jekyll＆Hyde),4,추천,유명한 뮤지컬을 드디어 보게 되었어요 뮤지컬의 매력속으로 좀좀 빠져듭니다~~,2021.12.02
뮤지컬 지킬앤하이드 (Jekyll＆Hyde),2,여러번 본 사람으로 이번엔 조금 실망했어요,하이드 류정한 배우와 루시 아이비 배우 빼곤 그닥... 아 엠마 아버지 역할을 하시는 분은 워낙 오래 그역할은 해서 똑같으셨음 일단 조주연을 잘 받쳐줘야하는 앙상블이 별로임 합이 안맞고 음도 안맞음 2015년(2번관람) 2018년(4번관람)했는데  이번 앙상블이 제일 못하네요. 앙상블에서 비중있는 상류층 5번분 합도 별로였고 뭔가 앙상블 노래 할때 귀에서 계속 불편하게 거슬리더라구요. 이번엔 회전문 안돌꺼같아요 ..   2018년 처럼 후에 2차 캐스팅 라인업 뜨게된다면 캐스팅보고 고민할 듯 지금은 회전문 생각이 없음 ㅜㅜ,2021.12.02
뮤지컬 지킬앤하이드 (Jekyll＆Hyde),4,"감동의 물결, 안타까운 지킬","지킬 하이드 1인2역의 류정한 배우님의 연기가 처음에 잔잔한듯 했으나 나중에 터지는 시너지가 정말 어마어마 했습니다! 제가 생각했던 것과 달리 내용을 볼수록 지킬에 대한 안타까움, 슬픔이 커지면서 인생을 되돌아보는 계기가 된 듯 합니다. 인생에 대해 다시 생각이 들게끔 해주신 모든 배우님들께 감사합니다!",2021.12.02
뮤지컬 지킬앤하이드 (Jekyll＆Hyde),5,엄청 오져요,류지킬은 일단 저음이 끝내줬어요. controntation 넘버에서 둘이 싸우는데 1대 1로 싸우는 기세라면홍지킬은 괴물역이 너무 소름돋을 정도로 무서워서 더 돋보였어요 류지킬은 선량한 하이드의 내면이 보이자면 홍지킬은 엄청 소름돋는 괴물? 이 나왔어요아니 근데 저번에 코로나땜애 취소됐을때 저 지방살아서 서울가는 버스 타고있었는데 버스비 보상은 둘째치고 포카라도 안주는건 너무하네요홍지킬 1층좌석 이었는데...어쨌든 회전문 충분히 돌 만 했어요 무대효과도 엄청 좋았고 오케스트라분들도 좋았고 특히 앙상분 분들이 파사드 우산춤 너무 좋았네요 막 에너지가 나오는 느낌,2021.12.02
뮤지컬 지킬앤하이드 (Jekyll＆Hyde),5,사랑해요 홍하이드♡,홍광호님 오래오래 해먹어주세요♡♡♡♡♡♡,2021.12.02
뮤지컬 지킬앤하이드 (Jekyll＆Hyde),5,지킬앤하이드,홍지킬 홍하이드에 압도되었다!!,2021.12.02
뮤지컬 지킬앤하이드 (Jekyll＆Hyde),5,매번 보는 류하이드,볼때마다 전성기 너무 멋진 류하이드!!!!!다음에도  꼭 보러올께요.,2021.12.01
뮤지컬 지킬앤하이드 (Jekyll＆Hyde),5,첫 뮤지컬,다시 또 보고싶은 뮤지컬이였습니다:),2021.12.01
뮤지컬 지킬앤하이드 (Jekyll＆Hyde),4,지킬앤하이드,지킬앤하이드 재미있게 잘 봣어영ㅇ굿굿굿,2021.12.01
뮤지컬 지킬앤하이드 (Jekyll＆Hyde),5,출근 전 위로 받았던 공연,"삼교대를 하는 직업이라 뮤지컬을 보고  출근했어야 했는데, 피로를 잊을 만큼 정말 좋았던 공연이었습니다. 지킬앤하이드가 아무래도 무거운 내용이라 엄마랑 보기 걱정되었는데 화려한 무대 연출과 배우분들의 실력에 놀라고 감동 받았습니다.기회가 된다면 다른 배우 캐스팅도 또 보러 가고 싶어요. 신성록 배우님 너무 멋있었어요ㅠㅠㅠㅠ",2021.12.01
뮤지컬 지킬앤하이드 (Jekyll＆Hyde),5,즐거웠던 관람,뮤지컬은 가끔 보는데 이번에는 신성록 배우님의 공연을 보게 되었다. 역시 연기를 잘하시는 것 같아 잘 보고 왔습니다. 강력 추천합니다,2021.12.01
뮤지컬 지킬앤하이드 (Jekyll＆Hyde),5,제가제일좋아하는,"제가제일 좋아하는 뮤지컬입니다~ 내한공연도 봤었고, 국내공연도 봤구요 너무너무 재밌고 볼떄마다 배우분들 연기, 노래, 무대 등에 감동받습니다 ㅠㅠ 오래오래 자주자주 해줬으면 좋겠어요",2021.12.01
뮤지컬 지킬앤하이드 (Jekyll＆Hyde),4,신성록 배우 연기 짱,하이드 연기도 일품이었지만 약 주사하는 장면도 넘 재밌었어요 민경아 배우 궁금했었는데 임혜영 뺨치는 옥구슬. 윤공주 배우 여전히 카리스마 넘치고 살짝 허스키가 매력적.,2021.12.01
뮤지컬 지킬앤하이드 (Jekyll＆Hyde),5,역시 홍광호 님!!,역시 홍광호 배우님....... 하이드로 변했을 때 느낌 와.........,2021.12.01
뮤지컬 지킬앤하이드 (Jekyll＆Hyde),5,지킬앤하이드 역시,노래 넘 좋아요!,2021.12.01
