musical_title,rate,review_title,review_text,review_date
뮤지컬 〈서편제〉,5,너무 좋아요.,"북 치던 송화 배우와 소리 하는 동호 배우가 무대 위에서는 서로 바뀐 역할이라는 것도 재미있지만, 그 합이 너무나 좋아요.계속 시간을 잡아두고 싶었을 정도였습니다",2022.10.06
뮤지컬 〈서편제〉,5,최고,최고입ㄴ자,2022.10.06
뮤지컬 〈서편제〉,4,차송화 준수동호,너무좋아요처음 세월이 지나 송화와 동호 만나는 장면부터 울컥하게 하네요다정 엄마도 경주아빠도 좋았습니다시즌 마지막이라는게 아쉽네요어떻게든 다시 만날 수 있기를 바랍니다,2022.10.06
뮤지컬 〈서편제〉,5,소리에 대한 희노애락,소리(꿈)에대한 집착 가족의 사랑 모든걸 엿볼수있는작품이었습니다,2022.10.06
뮤지컬 〈서편제〉,5,인터파크 티켓팅 일반인만 잡아대는 거지같은 서버,인터파크 티켓팅 일반인만 잡아대는 거지같은 서버  티켓오픈 시간 정각되서 예매하기 버튼 누르면 왜 맨날 비정상적으로 접근하셨대? 핸드폰으로 인터파크 앱 열어서 빨강색 예매하기 버튼 정각에 누른게 비정상적임? 그건 인터파크 앱이 비정상인거 아님? PC로 가보자. 마찬가지로 오만가지 오류 다 띄움. 그러다 서버터짐. 그러다 그 병신같은 대기가 뜸. 대기 끝나면 또 대기 뜸. 너네 뭐하니????? 겨~~~~~~~~~~~우 접속되면? 매크로들이 다 채가서 없지~ ^^ 매크로 못 잡겠으면 아무것도 하지마 그냥. 예매방식 차라리 그냥 옛날로 돌려놔. 이선좌를 맞아도 내가 맞을테니까. 일반적으로 티켓팅 하러 가면 뭐 해. 들어가는 것 조차 불가능인더. 매크로들한테 뒷 돈 받고 계심??? 티켓팅 때마다 비정상 나부랭이or수만가지 오류 너무 빡침.,2022.10.06
뮤지컬 〈서편제〉,5,인터파크 티켓팅 일반인만 잡아대는 거지같은 서버,인터파크 티켓팅 일반인만 잡아대는 거지같은 서버  티켓오픈 시간 정각되서 예매하기 버튼 누르면 왜 맨날 비정상적으로 접근하셨대? 핸드폰으로 인터파크 앱 열어서 빨강색 예매하기 버튼 정각에 누른게 비정상적임? 그건 인터파크 앱이 비정상인거 아님? PC로 가보자. 마찬가지로 오만가지 오류 다 띄움. 그러다 서버터짐. 그러다 그 병신같은 대기가 뜸. 대기 끝나면 또 대기 뜸. 너네 뭐하니????? 겨~~~~~~~~~~~우 접속되면? 매크로들이 다 채가서 없지~ ^^ 매크로 못 잡겠으면 아무것도 하지마 그냥. 예매방식 차라리 그냥 옛날로 돌려놔. 이선좌를 맞아도 내가 맞을테니까. 일반적으로 티켓팅 하러 가면 뭐 해. 들어가는 것 조차 불가능인더. 매크로들한테 뒷 돈 받고 계심??? 티켓팅 때마다 비정상 나부랭이or수만가지 오류 너무 빡침.,2022.10.06
뮤지컬 〈서편제〉,5,<서편제> 후기!,"이렇게까지 많이 울었던 뮤지컬은 처음이었다.. 너무 감동 ㅠㅠㅠㅠㅠ 차지연 배우님 짱입니다 진짜! 판소리랑 어우러진 뮤지컬이라 신기했고, 배우님들 감정살리는게 너무 인상깊었음!",2022.10.06
뮤지컬 〈서편제〉,4,괜찮은 공연이었습니다,괜찮은 공연이었습니다,2022.10.06
뮤지컬 〈서편제〉,5,마지막 시즌 벌써 3번재 관람,"17년에 차지연 캐스팅으로 보고 이번에는 마지막 시즌이라 3번다 이자람 캐스팅으로 봤네요.  이자람 & 김동완 본 후 두번째는 이자람 & 송원근 이었는데, 전 서편제가 사실 송화(이자람)가 혼자 딕션좋고 넘버도 좋아서, 송화만 신경썼는데, 송원근님 노래 듣고, 동호 넘버도! 소름끼치게 좋다는걸 깨닫게 되었어요. 김동완님도 잘 부르시지미나, 송원근님의 중저음의 울림있는 보이스가 뮤지컬에 좀더 어울리는거 같습니다. (어는 극에 더 어울리느냐 인거같습니다.) 그래서 한번더 들었네요.  E열 가운데 앉았더니 얼굴 표정까지 너무 잘 보여서(시력 1.0) 놀랬습니다.  다만 저는 노래소리가 퍼질때를 좋아해서 음악 감상하기에는 H열쯤이 더 좋았던거같습니다.  어쩌다보니, 처음부터 끝까지 보게된 캐스팅은 이자람님과 채채태인님이었네요.  개인적으로 정말 정말 좋아하는 목소리입니다. 채태인님 목소리 들을때마다 감탄합니다.  이번에 캐스팅은 이자람(차지연), 송원근(국립창극단 멤버인 김준수님도 하신다고 하셔서..그분 공연도 보고싶긴합니다.), 채태인님을 추천드리고 싶습니다.   유봉은...어쩌다 세분 공연을 전부 보게 되었는데..앞자리가 아니면 딕션이 잘 들리지 않아서.....ㅜㅜ그게 좀 아쉬웠지만, 연기적으로는 서범석님, 딕션쪽으로는 김태한님, 둘다 잘하시는 남경주님도좋습니다.  개인적으로 전 김태한님이 좀더 좋았습니다. ㅎㅎ  좋은 공연인데 이번이 마지막이라니 너무 아쉽네요.",2022.10.06
뮤지컬 〈서편제〉,5,서편제는 이자람,서편제는 역시 이자람입니다.최고입니다!!!,2022.10.06
뮤지컬 〈서편제〉,5,이자람 송원근 최고입니다.,이자람님은 송화 그 자체 송원근님도 동호 그 자체 서로가 너무나 애틋했던 남매. 정말 잘 봤습니다. 마지막 시즌이라니 너무 아쉬워요ㅠㅠ,2022.10.06
뮤지컬 〈서편제〉,5,뮤지컬 서편제,정말 최고입니다 ㅜㅜ 판소리+뮤지컬+서양음악(?) 다 섞인 뮤지컬인데 너무좋고 처음 아역배우들 나올때부터 눈물납니다 ㅜㅜㄱ 유리아 송원근 배우로 봤는데 정말루 넘 좋았어용ㅜ이번이 판권만료로 마지막 시즌이라는게 너무너무너무아쉬워요....,2022.10.06
뮤지컬 〈서편제〉,5,한 번쯤 봐야할 뮤지컬,"왜 주연배우가 주연인지 알 수 있고, 한 번쯤 봐야할 뮤지컬",2022.10.06
뮤지컬 〈서편제〉,5,볼수록 좋은 공연,왜 마지막 시즌인가요ㅜㅜ언제들 다시보고싶은공연!!!,2022.10.06
뮤지컬 〈서편제〉,4,완벽한공연,"배우들의 연기와 노래가 너무좋고,음악이 인상적이였어요?",2022.10.06
뮤지컬 〈서편제〉,4,감동적이고 좋은 공연,차지연배우님의 송화를 꼭 보고싶어서 예매했었어요 기대했던 만큼 너무좋았고 행복했어요 사전정보없이 갔는데 생각보다 웃음포인트도 많아서 재밌게 보았습니다,2022.10.05
뮤지컬 〈서편제〉,5,서편제,좋아하는 sf9의 재윤을 보러 간 공연입니다. 재윤니이 멋있었고 무대설치와 조명이 넘 멋졌어요. 그리고 유리아님의 마지막 노래에 깊은 감동을 받았습니다.좋은 공연 감사합니다.,2022.10.05
뮤지컬 〈서편제〉,5,나 판소리 좋아했네..,눈물샘 사막화 진행돼서 잘 안우는데 진짜 대오열했습니다. 배우님들 연기에 절로 눈물이 뿜어져나와요.차지연 배우는 말뭐.. 등장만 해고 슬프고 대체 못하는게 뭘까요ㅠㅠ 김준수배우도 제가 꼭 보고싶었는데 기대이상 너무 멋지셨어요. 서편제...마지막 아니라고 해주세요 ㅠㅠ,2022.10.05
뮤지컬 〈서편제〉,5,엄마를 위해...,"엄마를 위해 예매를 했습니다. 난소암 투병중이라 많이 힘드셨지만 기대는 가득이었죠. 애석하게도 인터미션 시간에 너무 힘들어하셔서 귀가하긴 했지만, 엄마의 소감은... "" 양지은, 내일 몸살 나겠다...""였습니다. 2부를 너무 보고 싶어하셨지만 못보신것도 아쉬워하셨고 양지은씨의 건강을 본인 건강보다 더 걱정하시더군요, 그리고 다음날, 동네방네 자랑이셨습니다.",2022.10.05
뮤지컬 〈서편제〉,5,두 눈을 끔적끔적끔적끔적 거리더니 눈을 번쩍 떴구나,차준수 남매 최고...,2022.10.05
뮤지컬 〈서편제〉,5,너무 재밌었어요,유리아배우님 너무 잘하세요,2022.10.04
뮤지컬 〈서편제〉,5,서편제 홍송화 ,지인포함 7명 관람 설레이는 마음 않고 입장 8월17일 9월2일 관람으로 이번 관람 편하게 즐기며 6명에게 바비공주 홍지윤 자랑 하고자 티켓 끊어줌 지인들 저 체구에서 어떻게 이런 소리 나올수 있는지 불가사의 하다고 칭찬 지인 6인 눈물 흘리며 관람 오늘 공연 종전 내용과 순서가 조금 다름 그러나 내 개인적 으로는 오늘 공연 최고의 감동과 멋진 무대였음 진인들로 부터 바비 공주홍지윤 칭찬 하여 저녁 식사 까지 대접 함 오늘 따라 왜 이리 기분 좋고 뿌든한지 이 고마움 바비공주 홍송화 에게 감사 드립니다,2022.10.04
뮤지컬 〈서편제〉,5,감동적인 무대였습니다,이제 이 무대를 볼 수 있는 기회가 얼마 남지 않은 것이 아쉽습니다. 무대에서 대사가 시작되는 그 순간 울컥하고 노래가 흐르는 순간 울컥한 감동을  놓치고 싶지 않네요.,2022.10.04
뮤지컬 〈서편제〉,5,소리꾼 양지은님,참으로 오래간만에  뮤지컬  공연을 봤습니다.   와우 감탄을 자아내는 양지은님의 소리 와 연기  감동이고 대사 전달력도 최고입니다. 감정선이 말라있는 나에게도  눈물이 있다니~~~감동했습니다. 고맙습니다.^^~,2022.10.04
뮤지컬 〈서편제〉,5,보고 또 봐도,계속 보고파서 현생 불가입니다. 유투브 뒤져보고 음원 찾아봐도 너무 부족해서 지방이라 한번씩 가기가 어려운데 티켓 2장 더 예매했습니다. DVD나 ost라도 출시되길 바래봅니다,2022.10.04
뮤지컬 〈서편제〉,5,배우님들 너무 감사합니다...!!,수상할 정도로 너무 소리를 잘 하는 동호와...ㅎㅎ 목이 터져나갈 듯이 소리를 하는 차지연 배우님... 두 분 정말 친남매 같다가도 세월이 지나감에 따라 사랑으로 변해가는 과정이 너무 잘 보이는 것 같았습니다 두 배우님의 합이 너무 훌륭해서 보는 내내 행복하고 벅찼습니다 정말 이런 훌륭한 공연을 볼 수 있게 해주신 배우님들 모두 감사드립니다...!!,2022.10.04
뮤지컬 〈서편제〉,5,서편제 관람 후기,마지막 시즌인만큼 완성도 있는 공연이었습니다!,2022.10.04
뮤지컬 〈서편제〉,5,재밌네요,차지연배우의 송화는 정말 최고입니다!,2022.10.04
뮤지컬 〈서편제〉,5,최고최고,1막 시작부터 뭉클했는데 뒤로 갈수록 눈물 폭발 ㅠㅜ ㅠ 마지막 시즌이라 너무 아쉬워요,2022.10.04
뮤지컬 〈서편제〉,5,사랑가만 100번듣고싶다,사랑가때문에 10만원 아깝지가 아너,2022.10.04
뮤지컬 〈서편제〉,5,홍송화 쟁동호,송화 동호의 합이 유난히 좋았던 페어였습니다,2022.10.04
뮤지컬 〈서편제〉,5,첫공 보고 왔어요,한복입고 뛰어오면서 웃는 쟁동호에 마음을 빼앗겼네요 ㅎ이자람님. 소리도 너무 잘하시고 진짜 멋진 공연이었습니다,2022.10.04
뮤지컬 〈서편제〉,5,잘 보고 왔어요,자 여섯번째 였는데볼때마다 감동이 다르네요좋은 공연 입니자,2022.10.04
뮤지컬 〈서편제〉,5,넘 즐거운 공연이에요 ,배우들이 연기도 잘하고 내용도 생각하게 하는 그런 공연입니다,2022.10.04
뮤지컬 〈서편제〉,5,다시오면 안될까요,마지막이라는 말은 하지말아주세요 차송화.준수동호 또보고싶어요,2022.10.04
뮤지컬 〈서편제〉,5,차지연 김준수페어 짱,눈물이 줄줄...  감동받고갑니다,2022.10.04
뮤지컬 〈서편제〉,5,구관이 명관 서편제,"서편제 영화는 본 적이 없지만 뮤지컬 서편제를 보면서 우리 소리, 판소리가 이렇게 멋진 노래라는 걸 알 수 있는 시간이었습니다. 연세 있으신 부모님과 같이 관람하기에 최고인 극이고요. 판소리를 주제로 하는 극이지만 판소리만 나오는게 아니고요. 무용도 역동적인 춤이 많아서 보는 재미도 있었습니다.추석이나 설에 부모님 모시고 관람하면 그게 최고의 효도가 아닐까 싶게 서편제 추천합니다!!!여운과 감동이 짙은 극입니다.",2022.10.04
뮤지컬 〈서편제〉,5,역시 믿고보는 배우들!,코로나 터지고나서 간만에 뮤지컬 보러갔었는데 역시나 너무 재미있었고 즐거운 불금을 만끽했습니다. 보고나서 너무 다른배우들도 보고싶어서 또 보고싶더라구요!! 진짜 강추합니다!,2022.10.04
뮤지컬 〈서편제〉,5,서편제를 보면서~,"예전에 영화로 봤던 서편제를 뮤지컬 보고싶어 서울로 상경~ 양송화를 보면서 얼마나 눈물이 나던지 너무 감동이였고 너무 행복했습니다. 표정 하나하나, 행동 하나하나가 너무 잘했고 사랑스러웠습니다.  좋은 뮤지컬 양송화를 만나게 해줘서 감사합니다.",2022.10.04
뮤지컬 〈서편제〉,5,잘 봤습니다,좋은 공연 항상 감사합니다 잘 봤습니다.,2022.10.04
뮤지컬 〈서편제〉,5,추천합니다!,추천합니다!,2022.10.04
뮤지컬 〈서편제〉,5,추천합니다!,추천합니다!,2022.10.04
뮤지컬 〈서편제〉,5,왜 이제 봤는지 ㅠㅠ,정말 너무 마음 아파서 우느라 힘들정도였어요. 하지만 보고 나오면서 또 보고싶어졌어요 다들 한번쯤 보시고 이렇게 마지막 시즌의 서편제 보내셨으면..,2022.10.04
뮤지컬 〈서편제〉,5,차지연은 송화 그자체..,어쩜 그렇게 소리가 나오는걸까요.... 놓치지말고 꼭 보셨으면..,2022.10.04
뮤지컬 〈서편제〉,5,서편제,우리 판소리가 이렇게 듣기 좋은 소리였나 다시 생각하게 됨.,2022.10.04
뮤지컬 〈서편제〉,5,차지연배우님만 3번째 관람이었는데 정말 최고에요!!,"제가 몇년전에 뮤지컬 서편제 차지연 배우님꺼로 보고 너무 좋아서바로 또 보고, 진짜 몇년만에 다시 보고 왔어요.배우진이 너무 좋아서 큰 기대하고 갔는데 역시는 역시였습니다!구성도 그때보다 더 좋아진 거 같고, 더 농익음이 느껴졌습니다. 차지연 배우님은 정말 최고입니다. 연기의 깊이가 달라서 처음 같이 간 남편도 감동이이었다고 계속 말하더라구요. 엄마 역할로 나온 채태인 배우님 목소리 너무 이쁘시고 가창력도 최고네요.마지막 연출 진짜.. 여전히 너무 좋아요. 눈물  펑펑몇년전에 봤을 때는 위에 있는 오케스트라를 보여주셨던 거 같은데 이번에는 커튼콜에서 가르키키만 하고 보이진 않더라구요. 뒤에서는 엠알로 하는 줄 아는 사람도 있어서 속상 했어요 ㅠㅠ전 정말 주변에 뮤지컬  추천해달라고 하면 서편제 꼭 하고 있어요! 더 입소문 나서 많은 분들이 봤으면 좋겠어요. 기회되고 지갑 사정 괜찮으면 N차 관람 꼭 하고 싶네요!",2022.10.04
뮤지컬 〈서편제〉,5,마지막 시즌이라는게 너무 아쉽습니다.,이자람님은 신이시고 송원근님은 동호 그 자체! 너무 재밌게 봤습니다!!,2022.10.04
뮤지컬 〈서편제〉,5,어머니가 너무 좋아하심,마지막 시즌인 이제서야 처음 봤지만 너무 잼있엇습니다 어머니랑 같이 가서 봤는데 너무 좋아하시더라고요,2022.10.04
뮤지컬 〈서편제〉,5,좋았습니다,배우들 연기와 노래 모두 좋았구요. 부모님들 모셔갔는데 엄청 만족하셨어요,2022.10.04
뮤지컬 〈서편제〉,5,뮤지컬 〈서편제〉,감동적인 눈물이 줄줄,2022.10.04
뮤지컬 〈서편제〉,5,재미있어요,재미있어요,2022.10.04
뮤지컬 〈서편제〉,5,강동적인 이야기에요,눈물이 앞을 가리더라구요,2022.10.04
뮤지컬 〈서편제〉,5,차지연 배우님의 송화는 완벽 그자체,돈이 하나도 아깝지않은 선택이었습니다 차지연 배우님의 송화는 완벽했어요... 송화의 눈빛변화가 인상깊었습니다,2022.10.04
뮤지컬 〈서편제〉,2,솔직히 배우들 빼곤 별로 아닌가,"차지연+김준수 배우들 너어어어무 잘해서 감탄하면서 봤다. 어쩜 그렇게 소리들을 잘 하시고 감정 연기도 뛰어난지 완전 몰입이 최고였다. 역시 송화 역으로 배우 차지연님을 보길 잘했다. 레전드. 워낙 넘버가 유명하고 원작 영화도 명작이라 기대가 많았는데, 배우를 제외한 그외는 솔직히 별로. 1막에 내용을 올인해서 2막에 너무 스토리가 없어서 늘어짐. 아역들 진짜 너무 잘하던데 어린 시절 스토리를 좀 더 1막에 쓰고 2막으로 스토리의 일부를 넘겨야하는 거 아닌가 생각. 스프링보이즈 장면들은 극에 활력을 불어넣으려는 시도인 건 알겠으나 너무 퀄리티가 떨어지고 몰입도 안 됨. 그 부분들만 나오면 급 소극장 뮤지컬 분위기. 음향도 반주가 너무 크고 귀 아픈 쨍한 소리들이 많이 나서 아쉬웠음. 7층인데 엘레베이터가 두 대만 운영하는 공연장도 정말 최악.",2022.10.04
뮤지컬 〈서편제〉,2,지루하고 불편하고 마지막짱,1부가 참 지루했습니다 의상 소품 무대 그어떤것도ㅠ없이 오직 판소리와 노래로 승부하는 뮤지컬입니다동호와 아버지의 독무대가 지루해서 잠깐 졸다가 주인공이 동호인줄 착각할뻔 의자가 너무 불편해서 쉬는시간에 허리가 아작나는줄 목도 불편하고 여자화장실은 두칸에 공연시작 3분전까지도 전 2층 좌석이었습니다 공연시작후엔 입장못한다고 계속 안내하는 직원 화장실 줄서다가 못 들어갈뻔… 다른화장실 안내나 그런건 전혀 없이 시간내에 입장하라는 소리만 앵무새처럼.. 2부는 송화의 판소리 매력적이었습니다 엔딩 심청전은 눈물 찔끔. 폭발적인 우리 소리 참 좋았지만 뮤지컬을 배우들의 소리로 날로 먹는 느낌과 불편한 의자 화장실 그리고 2층 올라가는 안내표시가 전혀 없어서 한참을 헤맨 광림아트센터에서하는 뮤지컬은 다신 안보는걸루.. 참고로 어제본 대학로 2층좌석이 더 편했다는(쉬어매드니스)건 안비밀.,2022.10.03
뮤지컬 〈서편제〉,5,두세번 보세요,"서편제 처음에 볼때는 머리가 딩딩해질정도로 유봉에 대한 분노 그러고 송화가 보이더니 점점 동호도 보이게됨,,,, 관계에서 다른길을 택함으로써의 자기꿈을 찾는 이야기 혼자만의 자유 혼자만의 외로움",2022.10.03
뮤지컬 〈서편제〉,5,김하나앙님 최고 !!!!,"히히 김하나 배우님 너무 좋아요  포우, 광화문연가, 썸로, 곤투도 너무 좋았는데!!!!!! 그래도 지금 BBCH홀에서 에드거앨런포할때 첫만남 잊지못해,,,, 뎅포랑 뎅호랑 만났던 지금,,, 오래오래 많은작품 해주세요 !!! 내년 곤투때도 보러갈꺼예요 !!!!!",2022.10.03
뮤지컬 〈서편제〉,5,볼때마다 소름이 돋는 유리아 배우,유리아 배우 캐슷 강추합니다! 연기 넘버소화 모두 너무 잘합니다.,2022.10.03
뮤지컬 〈서편제〉,5,"넘버, 연기, 무대 모두 너무 좋았어요","너무 슬프고, 좋았던 무대 였습니다이제야 보다니...곧 끝나가는 게 너무 아쉬워요ㅠㅠㅠㅠ",2022.10.03
뮤지컬 〈서편제〉,5,정말 한국적인 작품,한국적인 정서가 가득 담겨있는 작품... 표현이 너무 좋네요,2022.10.03
뮤지컬 〈서편제〉,5,홍송화 굿,홍지윤님 나오는 걸로 관람했습니다.연기도 자연스럽고 소리 또한 대단합니다.홍지윤님 걸로 한 번더 보고 싶네요,2022.10.03
뮤지컬 〈서편제〉,5,유리아는 신이다,너무 잘한다 정말...,2022.10.03
뮤지컬 〈서편제〉,5,재밌었어요,감독적이었습니당,2022.10.03
뮤지컬 〈서편제〉,5,감동과 영광의 딥디 내주세요,혼자라 슬퍼하진 않아  돌아가신 엄마 말 하길  그저 살다보면 살아진다  그말 무슨 뜻인진 몰라도  기분이 좋아지는 주문 같아  너도 해봐 눈을 감고 중얼거려  그저 살다보면 살아진다  그저 살다보면 살아진다  눈을 감고 바람을 느껴봐  엄마가 쓰다듬던 손길이야  멀리보고 소리를 질러봐  아픈내마음 멀리 날아가네  소리는 함께 놀던 놀이  돌아가신 엄마 소리는  너도 해봐 눈을 감고 소릴 질러  그저 살다보면 살아진다  그저 살다보면 살아진다  눈을 감고 바람을 느껴봐  엄마가 쓰다듬던 손길이야  멀리보고 소리를 질러봐  아픈내마음 멀리 날아가네,2022.10.03
뮤지컬 〈서편제〉,5,최고예요,혼자라 슬퍼하진 않아  돌아가신 엄마 말 하길  그저 살다보면 살아진다  그말 무슨 뜻인진 몰라도  기분이 좋아지는 주문 같아  너도 해봐 눈을 감고 중얼거려  그저 살다보면 살아진다  그저 살다보면 살아진다  눈을 감고 바람을 느껴봐  엄마가 쓰다듬던 손길이야  멀리보고 소리를 질러봐  아픈내마음 멀리 날아가네  소리는 함께 놀던 놀이  돌아가신 엄마 소리는  너도 해봐 눈을 감고 소릴 질러  그저 살다보면 살아진다  그저 살다보면 살아진다  눈을 감고 바람을 느껴봐  엄마가 쓰다듬던 손길이야  멀리보고 소리를 질러봐  아픈내마음 멀리 날아가네,2022.10.03
뮤지컬 〈서편제〉,5,재밌습니다,재밌습니다 최고에요,2022.10.03
뮤지컬 〈서편제〉,5,좋아요!,양지은 배우님 소리 너무 잘하시네요,2022.10.03
뮤지컬 〈서편제〉,5,재밌었어요,재밌었어요,2022.10.03
뮤지컬 〈서편제〉,4,서편제 최애극,최애극 서편제 넘버도 좋고 너무 재밌어요,2022.10.03
뮤지컬 〈서편제〉,5,송원근 동호 너무 좋아요!!,송원근 동호 너무 좋아요!! 특히 사랑이여 감정 무엇ㅠㅠㅠㅠㅠㅠ 한참 울었네요,2022.10.03
뮤지컬 〈서편제〉,5,좋아요,다들 너무 잘하시네요,2022.10.03
뮤지컬 〈서편제〉,5,좋아요,넘재밌었어요ㅠㅠㅠ최고!!,2022.10.03
뮤지컬 〈서편제〉,5,사랑해요 서편제,ost 주고 가요 제발,2022.10.03
뮤지컬 〈서편제〉,5,마음에 많이 남네요,ㅠㅠ 정말 마음에 많이 남는…,2022.10.03
뮤지컬 〈서편제〉,5,자람런태한다정ㅠㅠ,이 공연을 어찌 잊을까요 마음에 천년만년 새기고 살아가겠습니다 자람송화 런동호 태한유봉 다정엄마의 페어합을 사랑했어요 고맙습니다,2022.10.03
뮤지컬 〈서편제〉,4,재밌었어요,재밌었어요,2022.10.03
뮤지컬 〈서편제〉,5,정말 좋은 극이었습니다 대만족이에요,정말 좋은 극이었습니다 대만족이에요,2022.10.03
뮤지컬 〈서편제〉,5,최고,미쳤어요,2022.10.03
뮤지컬 〈서편제〉,4,한의 정수,오랜만에 봐도 여전히 구슬프고 아름다운 넘버들이 가슴을 울립니다. 송화와 동호의 서로를 향한 그리움의 한도 사무치게 와닿습니다,2022.10.03
뮤지컬 〈서편제〉,4,ㅠㅠ,좋다 ㅠㅠ,2022.10.03
뮤지컬 〈서편제〉,5,좋다,준수배우 뮤지컬에서 더 볼수있었으면좋겠다,2022.10.03
뮤지컬 〈서편제〉,5,bbbbb,"배우들 연기, 넘버 완벽했던듯",2022.10.03
뮤지컬 〈서편제〉,4,마지막시즌,마지막이라니까 더 애뜻한 마음입니다  다시는 이분들 심청가를 못듣는다고 생각하니 한회한회가 소중하네요    제작사는 각 페어별로 dvd좀 내주면 좋겠는데요 ㅠㅠ,2022.10.03
뮤지컬 〈서편제〉,5,차지연 배우님 너무 대단,차송화 송화 그자체!꼭 보세요,2022.10.03
뮤지컬 〈서편제〉,4,서편제 마지막시즌,막 취향은 아니지만 아름다운 작품이에요 배우들 소리 할 때마다 소름이 돋습니다. 존경합니다..,2022.10.03
뮤지컬 〈서편제〉,5,송원근 짱,최고예요 최고  짱,2022.10.03
뮤지컬 〈서편제〉,5,잘봤습니다,재밌었어요,2022.10.03
뮤지컬 〈서편제〉,5,최고였어요..,다시보고 싶은 페어입니다.. 아직도 이 날의 감상을 생각하면 먹먹해요 왜 마지막 시즌인가요..ㅜㅜ,2022.10.03
뮤지컬 〈서편제〉,5,최고입니다!!!!!,자람송화 준수동호 역시 레전드!!,2022.10.03
뮤지컬 〈서편제〉,5,소리꾼페어는 사랑입니다,급! 잡은 소리꾼페어역시 명불허전!!!!,2022.10.03
뮤지컬 〈서편제〉,5,최고최고최고최고,bbbbbbbbbbbbbb,2022.10.03
뮤지컬 〈서편제〉,5,자람신,"괜히 자람""신""이 아닙니다. 평생 송화 해주실거죠?!!",2022.10.03
뮤지컬 〈서편제〉,5,최고최고최고최고,bbbbbbbbbbb,2022.10.03
뮤지컬 〈서편제〉,5,최고최고최고최고,bbbbbbb,2022.10.03
뮤지컬 〈서편제〉,5,볼 때마다 울고 나오게 하는 서편제,진짜... 볼 때 마다 울고 나와서 머리가 너무 아프지만  그래도 또 보고싶게 만드는 마성의 서편제 ㅜㅜ  이번 시즌이 끝이라니 안돼요 ㅜㅜ,2022.10.03
뮤지컬 〈서편제〉,5,그저 살다보면 살아진다,눈을 감고 바람을 느껴봐 엄마가 쓰다듬던 손길이야,2022.10.03
