musical_title,rate,review_title,review_text,review_date
뮤지컬 〈마틸다〉,5,여윽시.. 마틸다 ㅠ 탄탄한 스토리 + 아역배우 연기천재,남자친구랑 진짜 3시간가까이 엄마미소를 띄우면서 봤어요ㅠㅠ 세상에 어쩜 아역들이 이리 깜찍뽀쨕하면서 연기까지 잘하죠? 계속 내가 저 배우들엄마라면 얼마나 뿌듯할까 얼마나고생했을까 생각하면서 감정이입이되서 눈물이자꾸 나려고하더라고요 ㅠ 어른이되면 넘버부를때는 진짜 눈물이 나서 참느라 혼났어요 ㅠㅠ 주인공을 포함 모든 아역배우 하나하나가 다 주인공이였고 어른들보다 훨씬 발음도 좋고  잘들리고 연기도 뒤지지않았어요 ㅠㅠ 최재림배우님은..말할것도없어요.. 존재감 자체만으로 그냥 압도하고 그냥 최재림배우님은 평생따라다닐거여요 ㅠㅠ~  아역배우님들 정말 최고 박수 오만번 보냅니다. 감동+재미 모두를 갖춘 마틸다 ㅠ 최고~,2022.10.31
뮤지컬 〈마틸다〉,4,가족과 함께 보기에 안성맞춤인 뮤지컬,구정을 맞아 엄마 아빠와 보기 위해서 예매했어요. 아무래도 아이들이 나오는 뮤지컬이다보니 재미있게 관람하실 것 같았거든요. 역시나 애들을 엄청 귀여워해주시면서 재미있게 보셨다고 하더라구요. 정말 어찌나 사랑스럽던지... 관객 중에도 아이들이 많았는데 부모님과 아이들이 함께 보기에 딱 좋은 뮤지컬이 아닌가하는 생각이 들었습니다. 최재림 배우님 최고!!,2023.01.26
뮤지컬 〈마틸다〉,4,너무 멋진 공연이었는데 마이크 음향이 아쉬웠어요,최재림 배우님 팬이어서 공연 보러 갔는데어린이 배우님들도 너무 잘하시고 즐거운 공연이었어요다만 마이크 음향이 자꾸 오류가 있었던 건지 대사 첫마디마다 3초 정도씩 마이크가 늦게 켜지더라구요저는 앞자리라 들리긴 했지만 몰입에 방해가 되어서 개선되면 좋을 것 같아요,2023.01.26
뮤지컬 〈마틸다〉,5,마틸다의 영향력??,평소 스마트폰과 친했던 딸이 마틸다를 보고 온 다음날 책을 꺼내 읽더니 책 속의 내용을 이야기해 줍니다. ^^,2023.01.26
뮤지컬 〈마틸다〉,5,사랑해 마틸다,로또 맞은 기분이야 너희를 만나서??,2023.01.26
뮤지컬 〈마틸다〉,5,어른이되면,콜라 실컷 몬먹구.. 제로콜라 먹구... 출근은 내 맘대로 할구 없어요... 하지만 마틸다 친구들 모두 사랑해요??,2023.01.26
뮤지컬 〈마틸다〉,5,은영틸다??,은영틸다 소후 브루스 도롱뇽팀 만났는데 정말 모두 다 잘해서 눈물 좔좔 흘리고 왔어요...,2023.01.26
뮤지컬 〈마틸다〉,5,어른들이 보면 더 좋은 뮤지컬!,"설연휴 할인도 하고 남편 생일이기도 해서 보고왔는데 진짜 기대 이상으로 너무 좋았습니다. 최재림 트런치블 캐스팅 하나 보고 예약했거든요.  역시 실망시키지 않는 무대였고 마틸다(연우틸다였어요.)도 너무 똑소리나고 귀엽더라구요. 어떻게 그 많은 대사를 외우고 노래를 부르는지...연습량이 대단했겠구나, 대견하다는 생각까지 들더라구요. 주인공뿐만 아니라 같이 무대에 서는 앙상블도 누구 하나 빠질 것 없이 잘 하고 에너지가 넘쳐서 좋은 기운 받고 온 기분이었어요. 넘버는 말 할 것도 없고요^^ 처음 보시는 분이면 ott로 뮤지컬 마틸다 보고 오시는 거 추천드려요~ 더 재미있게 볼 수 있습니다. 다른 뮤지컬에 비해 아이들 손님이 많았는데요. 아이들이 많이 보는 뮤지컬이라 관람하는데 힘들수도 있다고 해서 걱정했는데, 제가 본 날은 아이들 너무 얌전하게 관람하더라구요. 게다가 순수하게 웃긴 부분에서는 크게 웃고 감동받으면 누구보다 열심히 박수치는 모습에 저도 더 열심히 웃고 박수 칠 수 있어서 오히려 좋았어요. 나중에 기회가 되면 다른 캐스팅으로 또 한 번 보고 싶은 정도로요~",2023.01.26
뮤지컬 〈마틸다〉,5,어른이들과어린이가 함께 즐기는 뮤지컬,너무 좋은 시간 이였습니다어른이들도 함께 웃는 시갘 이였습니다다시 한번 보고 싶네요 기회가 된다면요^^끝까지 화이팅,2023.01.26
뮤지컬 〈마틸다〉,5,재밌었습니다.,작은 아이들의 넘치는 에너지에 행복한 시간이었습니다. 분명하게 대사치고 노래부르는 마틸다가 기특하더라구요. 아역 배우들을' 배려하며 극을 올리느라 두배로 힘들 성인배우들도 고생많으셨습니다.,2023.01.25
뮤지컬 〈마틸다〉,4,공연은 좋았지만...,어제 보고 왔습니다 배우들 모두 잘하고 작품도 나쁘진 않은데 공연중에 옆에 아이가 어쩌구저쩌구 정말 민폐가 되었어요저 정도로 민폐가 된 적은 처음이에요보호자들은 반드시 주의를 해주셨으면 좋겠고 어셔분들도 꼭 강조하셨으면 좋겠어요,2023.01.25
뮤지컬 〈마틸다〉,5,마틸다 역시,"아이들이 끝나고 나서도 너무 재미있었다해요..  모든 배우들 엄지척 그중 최재림, 아역배우 진연우가 최고였어요",2023.01.25
뮤지컬 〈마틸다〉,5,두번째 관람. 세번째 관람도 기대,아...마틸다들 너무너무 똘망하고 사랑스러워서 세번째 관람도 예매했답니다. 공연 볼수록 놀라워요.,2023.01.25
뮤지컬 〈마틸다〉,5,역시??,조카가 어느날 영화를 보고와서는 뮤지컬ㄷ느 보고싶다하여 초5학년이되는 조카와 다녀온 무지컬 영화그대로의 내용과 에피소드들 다 좋았어요,2023.01.25
뮤지컬 〈마틸다〉,5,재밌게 잘 보고 있어요,관크 때문에 때론 괴롭지만,2023.01.25
뮤지컬 〈마틸다〉,5,그네씬 조금 더 길게보고싶다,볼때마다 함께 고개가 올라가며 감동받는 장면 퓨,2023.01.25
뮤지컬 〈마틸다〉,5,여윽시.. 마틸다 ㅠ 탄탄한 스토리 + 아역배우 연기천재,남자친구랑 진짜 3시간가까이 엄마미소를 띄우면서 봤어요ㅠㅠ 세상에 어쩜 아역들이 이리 깜찍뽀쨕하면서 연기까지 잘하죠? 계속 내가 저 배우들엄마라면 얼마나 뿌듯할까 얼마나고생했을까 생각하면서 감정이입이되서 눈물이자꾸 나려고하더라고요 ㅠ 어른이되면 넘버부를때는 진짜 눈물이 나서 참느라 혼났어요 ㅠㅠ 주인공을 포함 모든 아역배우 하나하나가 다 주인공이였고 어른들보다 훨씬 발음도 좋고  잘들리고 연기도 뒤지지않았어요 ㅠㅠ 최재림배우님은..말할것도없어요.. 존재감 자체만으로 그냥 압도하고 그냥 최재림배우님은 평생따라다닐거여요 ㅠㅠ~  아역배우님들 정말 최고 박수 오만번 보냅니다. 감동+재미 모두를 갖춘 마틸다 ㅠ 최고~,2022.10.31
뮤지컬 〈마틸다〉,5,마틸다,마틸다만이 줄 수 있는 행복함과 위로가 너무 특별해서 계속 보러가게 되는 것 같아요,2023.01.25
뮤지컬 〈마틸다〉,4,아이들이 정말 잘하네요!!!,은영틸다 아이와 엄마와 삼대가 같이 보았습니다!! 마틸다 주인공뿐만아니라 모든 배우들이 정말 잘하고 또잘하네요!!! 노래도 좋고 계속 흥얼거리게 되요~!사실 대사나 노래가사는 안들리는부분이 없지않았지만 예상했던터라 괜찮았는데 아이는 좀 안들렸을수도 있을거같아요... 공연자체는 좋았는데 관의문제인건지ㅜㅜㅜ 브이아이피석임에도 단차가ㅜ좁아서 앞부분 머리가 계속 눈앞에 보여서 반은 가렸고 겨울이라 옷이 두꺼운데 옷이랑 가방을 전부 무릎앞에 두고 발도 못움직이고껴서봐서 다음날까지 다리가 후들거렸습니다 ㅠㅠ,2023.01.25
뮤지컬 〈마틸다〉,5,초등학교 입학선물로 딱 좋은 뮤지컬!,"아이 초등학교 입학 기념으로 생에 첫 어른 뮤지컬?! 보고 왔습니다. 아이가 너무 재미있어 했고집에 와서도 계속 마틸다 얘기만 하네요. 무대 장치, 소품, 배우 동선도 모두 잘 짜여진뮤지컬이었습니다.",2023.01.25
뮤지컬 〈마틸다〉,5,최고입니다!,공연을 이끌어가는 아이들이 대단합니다.  내용도 무대도 노래도 훌륭합니다.,2023.01.25
뮤지컬 〈마틸다〉,5,부모님들 아이 잡담 제지를 강화해주세요,공연은 정말 좋았어요어린이관객이 많을 거라고 예상했고 어리니 당연히 관극매너가 부족할 거라고도 예상했어요그런데 노력조차 안보이더라구요..아이를 제지하지 않는 부모들이 많았어요잘 제지하는 부모들도 있었지만요아이들의 토론소리..를 10만원 가량 주고 듣고 오다니그럴 수 있단 걸 알지만요.. 알지만 화가 나더라고요아이에게 직접 얘기도 했는데 고개를 끄덕이고는 아랑곳않고 계속 떠들었습니다곧 공연 시작인데 착석하지 않아 직원이 착석해달라고 얘기하니‘앉히고 있잖아요’ 퉁명스럽게 대답하고선공연시작 30초 전까지 서서 아이와 대화를 계속하던 어머니그러지 맙시다ㅠㅠ제발요,2023.01.25
뮤지컬 〈마틸다〉,5,어른이되면,어른이되어도 아이들이 노래부르던 것들을 아직도 많이 할 수 없는 어른인 저는 울다가 나왔네요ㅜㅜ 극 자체도 재밌고 배우들도 모두 너무너무 잘합니다!,2023.01.25
뮤지컬 〈마틸다〉,5,뜀틀 위 집나간,교장쌤 춤바람을 찾습니다,2023.01.25
뮤지컬 〈마틸다〉,3,배우들의 호연에 박수,배우들 연기 좋음 수시로 배우들이 객석으로 내려와 퇴장하고  통로에서 등장한다.  재미는 있으나 뮤지컬 치고는 대사 분량이 많은 듯  트런치불 역의 최재림 배우 최고!,2023.01.25
뮤지컬 〈마틸다〉,5,추천합니다.,트런치불이 될 뻔했지만 마음을 다잡으며 뮤지컬을 볼 수 있다면 회전문도 추천하는 뮤지컬. 관람등급이 8세 이상이라는게 조금 아쉽긴 하지만...,2023.01.25
뮤지컬 〈마틸다〉,5,마틸다 관람후기,아이때문에 마틸다 보게 되었는데 생각한것보다 엄청 재밌습니다ㅎㅎ 꼭 보세요 강추 쾅쾅쾅,2023.01.25
뮤지컬 〈마틸다〉,3,좋았지만,시야가 별로였는데도 15만원이라는 건 너무한 것 같습니다. 중딩이고 친구들과 아침 일찍 만나서 갔는데 15만원짜리 자리 시야가 안 좋아 너무 아쉬웠습니다. 그나마 청할이 있어서 다행이지만 10만원이 넘는 금액은 결코 적은 돈이 아닌데 시야가 잘 안 보인다는 것이 너무 억울하네요. 4년만에 다시 본 마틸다 재림트런치불 역시 좋았고 중간중간 아역 배우 실수도 귀엽고 다 좋았지만 마틸다 초능력 부분은 너무 아쉽고 별로입니다. 첨에 힘겹게 트런치불 컵 넘어뜨리고 바로 분필로 쓱쓱 그어버리는 거 너무 약간 뜬금없는 감이 없지않아 있었어요여러모로 아쉬웠습니다ㅜㅠ 담엔 제발 고쳐주세요ㅠ,2023.01.25
뮤지컬 〈마틸다〉,5,마틸다!,잊고있었던 동심을 찾아주는 뮤지컬이에요ㅠㅠ마틸다 최고!,2023.01.25
뮤지컬 〈마틸다〉,5,마틸다,마틸다 너무 좋아요 끝나가는게 너무 아쉽습니다 ㅠㅠ,2023.01.25
뮤지컬 〈마틸다〉,5,환상적인 무대연출 뮤지컬마탈다,설연휴 마지막날~ 아이와 함께 본 뮤지컬마틸다아이가 OTT서비스에서 마틸다를 보고 노래가 좋다고 반복적으로 들었을때가 있었다.마침 마틸다 공연이 있었고 설연휴기간에 늦은 예매를 했디만 좌석이 마음에 들지가 않았다.아이는 R석 나는 시야제안석 전반공연이 끝나고 쉬는시간에 옆 커플이 말을 걸어왔다.아이에게 좋은 공연인데 좌석을 바꿔드리겠다고.. 아마 아이가 한쪽이 잘안보이니깐 고개를 많이 움직였나보다.. 너무 고맙게 후반공연은 자리를 바꿔서 보게 되었다. 너무 감사했다. 공연은 무대연출이나 노래 춤 어느것 하나 빠지지않고 감동을 주었으며 뜻하지 않은 자리양보에 더할나위없는 행복을 느낀 공연이었다. 이 자리를 빌어 다시 감사합니다.,2023.01.25
뮤지컬 〈마틸다〉,5,최고의 공연,아이들과 정말 재미있게 보았습니다. 어린 배우들이 하나같이 성인 못지 않은 연기와 노래 춤으로 감정선을 너무 잘 들어내 물개박수가 절로 나왔어요. 함께 공연을 본 아이들도 최고의 공연이라 손꼽았습니다. 다시 한 번 보고 싶네요.,2023.01.25
뮤지컬 〈마틸다〉,5,여윽시.. 마틸다 ㅠ 탄탄한 스토리 + 아역배우 연기천재,남자친구랑 진짜 3시간가까이 엄마미소를 띄우면서 봤어요ㅠㅠ 세상에 어쩜 아역들이 이리 깜찍뽀쨕하면서 연기까지 잘하죠? 계속 내가 저 배우들엄마라면 얼마나 뿌듯할까 얼마나고생했을까 생각하면서 감정이입이되서 눈물이자꾸 나려고하더라고요 ㅠ 어른이되면 넘버부를때는 진짜 눈물이 나서 참느라 혼났어요 ㅠㅠ 주인공을 포함 모든 아역배우 하나하나가 다 주인공이였고 어른들보다 훨씬 발음도 좋고  잘들리고 연기도 뒤지지않았어요 ㅠㅠ 최재림배우님은..말할것도없어요.. 존재감 자체만으로 그냥 압도하고 그냥 최재림배우님은 평생따라다닐거여요 ㅠㅠ~  아역배우님들 정말 최고 박수 오만번 보냅니다. 감동+재미 모두를 갖춘 마틸다 ㅠ 최고~,2022.10.31
뮤지컬 〈마틸다〉,5,연기 최고,너무 멋있는 공연이었습니다,2023.01.25
뮤지컬 〈마틸다〉,5,기대이상!!,아이들과 함께 본 첫 뮤지컬!!어린이 뮤지컬만 봤던 초등생 아이들이 너무 좋아했어요. 오는길에도 ost 검색해서 들어보고요. 가까운 자리에서 또 보고 싶다고 하네요,2023.01.25
뮤지컬 〈마틸다〉,5,가족모두가 행복한 공연,"아이와 함께 봤는데 모두 재밌었구요, 집에 와서 넘버들 같이 듣고 따라부르니 좋네요. 배우도 무대도 음악도 다 감동였어요.",2023.01.25
뮤지컬 〈마틸다〉,5,초등 아이들과 2번째 관람!!,"1월초에 마틸다를 초등 아이들과 보고 관람후기 쓰고 1월말에 두번째로 본 후기 입니다. 마틸다를 너무 좋아하는 저희집 아이들은 이미 책과 영화를 섭렵하여 그 다음 장면에 어떤 대사가 나올지 어떤 음악이 나올지 좋아하는 음악과 장면이 아주 확고한 초4,5 여아 입니다.  1월초에 마틸다를 예매하고 160분이나 되는 긴 시간 동안 아이들이 집중하며 잘 볼 수 있을까 우려했지만 저의 우려는 아주 쓰잘데기 없었습니다. 오히려 마틸다를 보고와서 유투브로 1대 마틸다 영상까지 찾아보며 마틸다 덕질을 아주 열심히 했드랬죠.   그리고 아이들은 강력하게 아주 강력하게 한번더 관람할 것을 외치며 결국 1월말에 다시한번 마틸다를 보러가기로 합니다. 두번째 보는 마틸다 역시 감동과 에너지가 느껴지는 공연이었지요.  그 다음 장면이 어떤게 나올지도 어떤 대사가 나올지도 너무나 잘알고 있었지만 알고 보는 것 또한 너무나 또 다른 즐거움이었습니다.   특히 최재림 배우는 꼭 봐야 한다고해서 다른 배우보다도 최재림 배우가 출연하는 날 갔습니다. 코로나로 공연 준비하시느라 힘드셨을 배우분들 너무나 존경합니다. 아역 배우들의 파워와 에너지가 객석까지 그대로 느껴지는 감동의 여운이 잊혀지지 않는 너무너무 멋진 공연이었습니다. 계속 흥하세요! 응원합니다.",2023.01.24
뮤지컬 〈마틸다〉,4,너무 즐거웠지만 한편으론 불편했던 관객매너,"공연은 최고였어요. 그동안 마틸다를 미뤄왔던 걱정거리가 오늘 드디어 경험을 하고 말았네요. 뮤지컬을 사랑하는 사람으로 ㅠㅠ 마틸다는 어린이 뮤지컬이 아님에도 부모님들의 너무 성의없는 공연예절땜에 불편함이 없지않아 있었어요. 8세 이상이고 내용이 아무래도 귀여운 어린친구들이 주인공이라 예상은 했지만, 너무 큰소리로 사적인 이야기하는 친구들, 음악이 흥에 겨워 즐거운건 알지만 몸을 이리저리 머리를 헤드뱅잉 하는 친구(그옆 아버님은 한두번 말리시지만 2막끝까지 흥을 주체못하고 움직이는 친구-어려보이지도 않는데 ㅠㅠ) 공연에 20%정도는 집중을 할 수 없던게 넘 아쉬워요. 그리고 정말 마지막에 놀란건, 커튼콜 포함 촬영금지라는 안내는 입장하실때 다 들으셨을텐데…. 어른들이 카메라를 죄다 켜더라고요.. 동영상이며 사진이며… 몰상식한 느낌은 제 아이도 황당해할 정도였습니다. 이런광경은 처음본다며…그외에 연기자분들은 너무너무 훌륭했어요. 관객들이 더 성숙한 공연 매너를 지켜주시면 좋았을 공연이라 더 더 아쉬웠던 … 그 점만 빼면 정말 완벽한 공연인데 말이죠. 평일 저녁시간이었으면 나았을까 하는 아쉬움이 남았던 오늘이네요^^;;;;;음악 스토리 연기 빠지지 않아요.귀엽고 사랑스러운 어린 배우친구들은 정말 칭찬이 아까울정도로 너무 잘하고 멋있었어요!",2023.01.24
뮤지컬 〈마틸다〉,5,정말 감동적인 하윤틸다~~♡,아이와 데이트 다녀왔다가 제가 반해버렸어요ㅜㅜ저희아이보다 한살많은 하윤틸다ㅜㅜ너무 사랑스럽고 대견하고ㅜㅜ 눈물이 펑펑이었답니다ㅠ저희딸과 함께 항상 응원하고 있을께요~^^재관람 예정인데 운명처럼 또 함께하길 바라요~^^,2023.01.24
뮤지컬 〈마틸다〉,5,마틸다정말 재밌어요,하윤틸다 넘 귀엽고 잘하고 현준브루스 다른아이들도 넘 잘합니다,2023.01.24
뮤지컬 〈마틸다〉,5,라벤더 최고 ♡ ,단아라벤더 볼때마다 넘 사랑스러워요 ㅠㅠ,2023.01.24
뮤지컬 〈마틸다〉,5,재밌었어요,화려하고 볼거리가 많아 좋았습니다~,2023.01.24
뮤지컬 〈마틸다〉,5,마틸다 어른도 감동받고 배울게 있는 뮤지컬,"첫 마틸다는영화 마틸다를 아이들하고 보고그 다음은  책으로 읽고다음은 넷플xx 뮤지컬영화 본 후 드디어 8살 딸하고 보게 되었습니다.너무 당당한 아이에 모습에 저도 제 딸도 마틸다에 편이었고, 이미 많은 음악들은 알고 있었지만,160분 시간동안 쉼없이 즐거웠고 감동했고 웃을 수 있었습니다.아이들이 어른과 함께 호흡을 맞춰 몰입하는 모습에서 제 스스로의 열정이 없어진 모습도 돌아 볼 수 있었던 시간이었네요.둘째가 7살이라 이번엔 함께 못했지만, 내년 이후 기회가 될때 함께 셋이서 함께 가야겠네요",2023.01.24
뮤지컬 〈마틸다〉,5,마틸다 최고네요,기대하던 공연을 드디어 보게 되었는데 이름값 제대로 하는 공연이었습니다. 무대연출을 기대했었는데 디자인이나 세트구성도 훌륭했습니다.최재림 배우가 연기하는 트런치볼 교장과 임하윤양이 연기한 마틸다도 매력적이었습니다.딸아이와 행복한 시간이었습니다.,2023.01.24
뮤지컬 〈마틸다〉,5,은영틸다??,유튜브에서 은영틸다 모습보고 푹 빠져버러서 예매했어요! 1열에서 그렇게 똑부러지게 옳지 않아! 하는데 어찌나 그렇게 귀엽고 똑순이던지요ㅠㅠㅠ 흑흑 너무 귀여워요,2023.01.24
뮤지컬 〈마틸다〉,5,마틸다 처음 봤어요!,"신비틸다로 처음 봤는데 어찌나 그렇게 귀엽던지 ㅜㅜ그리고 마틸다 뮤지컬..정말 어른들을 울리는 군요 주륵주륵 모든 연출이 다 좋았지만 특히! 주인공들이 1층 통로로 등장하는 것과 삐삐머리 아만다를 돌려서 날리는 장면, 2막에 어른이 되면 부르는 장면, 브루스의 초코케이크 너무너무 좋았답니다??",2023.01.24
뮤지컬 〈마틸다〉,4,마틸다,가격이 많이 비싸서 부담스러웠지만 잘 봤습니다,2023.01.24
뮤지컬 〈마틸다〉,5,마틸다~ 대박입니다,무대부터 연출력 연기력 모두 대단합니다.9살 아이와 함께했는데 160분이 길면 어쩌나 엄청 긴장했는데 너무~~~너~~무 재밌어서 한 순간도 놓치지않고 집중하더라구요. 단 오랜시간때문인지 엉덩이가 너무 아파서 조금 힘들구요 2층 관객석 밑에 자리여서 그런지 사운드가 아쉬웠습니다. 다음에 또 보고싶을 정도로 극찬한 뮤지컬이었습니다. 모두 기립박수를 치는데..공감..어린 배우들의 연기력도 걱정이었지만 절대~~와~~~극을 끌어가는 집중력 표현력 모두 만점입니다.아이가 집중 못할까봐 R석에 앉았는데 다시 보면 꼭 VIP석에 앉을겁니다. 무조건. 돈이 아깝지 않았어요.,2023.01.24
뮤지컬 〈마틸다〉,5,여윽시.. 마틸다 ㅠ 탄탄한 스토리 + 아역배우 연기천재,남자친구랑 진짜 3시간가까이 엄마미소를 띄우면서 봤어요ㅠㅠ 세상에 어쩜 아역들이 이리 깜찍뽀쨕하면서 연기까지 잘하죠? 계속 내가 저 배우들엄마라면 얼마나 뿌듯할까 얼마나고생했을까 생각하면서 감정이입이되서 눈물이자꾸 나려고하더라고요 ㅠ 어른이되면 넘버부를때는 진짜 눈물이 나서 참느라 혼났어요 ㅠㅠ 주인공을 포함 모든 아역배우 하나하나가 다 주인공이였고 어른들보다 훨씬 발음도 좋고  잘들리고 연기도 뒤지지않았어요 ㅠㅠ 최재림배우님은..말할것도없어요.. 존재감 자체만으로 그냥 압도하고 그냥 최재림배우님은 평생따라다닐거여요 ㅠㅠ~  아역배우님들 정말 최고 박수 오만번 보냅니다. 감동+재미 모두를 갖춘 마틸다 ㅠ 최고~,2022.10.31
뮤지컬 〈마틸다〉,5,재밌었어요,무대 장치도 화려하고 보는 즐거움도 있었어요! 아이들 너무 귀엽습니다ㅎㅎ 잘 봤어요!,2023.01.24
뮤지컬 〈마틸다〉,5,아이가 너무 좋아해요!!,"마틸다 너무 보고 싶어한 공연이라 책도 읽고 보러 간 우리 아이~ 너무 좋아했어요! 역시나 뮤지컬의 현장감과 어린 배우들의 열정, 너무 멋있었습니다.",2023.01.24
뮤지컬 〈마틸다〉,5,마음이 따뜻해지는 뮤지컬,"내용은 책이나 영화로 많이 봤지만, 뮤지컬로 보니 또다른 감동인 것 같아요.어린 배우들도 너무 즐겁고 열심히 잘 하고, 노래들도 다 너무 좋았어요!",2023.01.24
뮤지컬 〈마틸다〉,5,관람후기 ,배우분들 연기도 너무 잘했고 자리도 불편하지 안고 좋았다 배우분들도 목소리가 커서 뒤에 있는 사람들한테 다 들릴만 했고 너무 재밌게 해주셨다 저 꼭 뽑아주세요????,2023.01.24
뮤지컬 〈마틸다〉,4,어쩜 이렇게 잘 하는지!,"주연을 맡은 아이는 어쩜 이렇게 연기와 발성, 발음 모두 잘 하는지 대단하더라구요. 담임선생님 역으로 나온 배우분도 너무 잘 하시고 볼거리가 참 많았습니다. 다만 아이들이 함께 부르는 부분은 시끄럽기만 하고 대체 무슨 가사인건지 무슨 말을 하는건지 전혀 알 수가 없어서 아쉽네요",2023.01.24
뮤지컬 〈마틸다〉,5,볼 때마다 울컥,진짜 볼때마다 울컥어른이 되면.. 은 들을 때마다 눈물이 나요,2023.01.24
뮤지컬 〈마틸다〉,5,모든 엔터테인먼트의 총 집합,볼거리 들을거리 풍성. 감동과 대 서사시까지.안되는게 없는 최고의 뮤지컬! 이었습니다.환상적인 꿈을 꾸고 깬 듯한 시간이었어요~^^,2023.01.24
뮤지컬 〈마틸다〉,5,에너지 넘치는 공연,최고였어요.,2023.01.24
뮤지컬 〈마틸다〉,5,간만에 울었네요,넘버만 듣고 줄거리에 대해선 모르고 갔는데처음 아역배우님들의 열정에 순간적으로 울컥했고 허니 선생님의 이야기가 또 저를 울렸네요 어린 동심의 이야기를 느낄 수 있는 정말 좋은 뮤지컬이었습니다,2023.01.24
