musical_title,rate,review_title,review_text,review_date
블루맨그룹 월드투어,5,역시 블루맨그룹,"15년 전쯤 시카고 여행 중에 처음 본 블루 맨 그룹 공연! 넌버벌 공연이라는 장르도 처음이었지만 그 퍼포먼스에 압도되어 오랫동안 기억에 남았던 공연을 한국에서 다시 보게 되어 너무 좋았다! 특히, 한국 공연은 관객과 소통하는 무대가 많아 가족&연인 관람객들에게 더 즐거운 공연이 될 것 같다!",2022.07.24
블루맨그룹 월드투어,4,블루맨!,의외로 시간가는줄 모르구 유쾌한 공연!!,2022.07.24
블루맨그룹 월드투어,5,굉장히 알찬 무대였습니다.,공연 내내 즐거웠고 많이 웃었습니다~ 스트레스도 풀리고 좋은 공연이었어요~,2022.07.22
블루맨그룹 월드투어,4,아이와 함께 즐거운 추억,여름방학 전 아이와 함께 기대하며 기다린 시간이 아깝지 않은 공연이었습니다. 관객과 함께 즐기는 공연이 있다는 걸 아이에게 알려주고 즐기도록 해주는 즐겁고 유쾌한 공연이었습니다.,2022.07.22
블루맨그룹 월드투어,5,아이들과 함께 즐긴 블루맨,"어제 관람한 블루맨그룹 월드투어를 아주 즐겁게 보고왔습니다.15년전에 라스베가스 갔을때 보고 나중에 한국에서 투어가 있으면 꼭! 다시한번 보겠다. 라고 생각했는데 이제서야 아내와 아이들과 함께 보게되었네요.전체적인 평은 기본적인 큰틀은 본토의 쇼와 비슷하지만 스케일 자체가 조금 축소되어 있었네요. 세션 스탭들도 대폭 축소가되어있었지만 크게 부족하다고 느낄정도는 아니였네요.또한 국가별로 투어시 유면한노래를 배관으로 연주하는 파트가 있는데, BTS의 다이너마이트가 나와서 국뽕 한모금했구요.ㅎㅎ아이들도 6세이상 관람이 가능하고 Rock. Laugh. Party. 라는 컨셉의 넌버벌퍼포먼스라아이들도 큰어려움 없이 웃으면서 잘보았네요.ㅎㅎㅎ가족들이 즐겁게 공연을 즐기는걸보니 미리 예매하고 2달을 기다린 보람이있네요.Ps. 스플래쉬석인데 물이 많이 안튀긴건 좀 아쉬웠네요~",2022.07.22
블루맨그룹 월드투어,5,최고최고 ,초1아들과 함께 보러갔어요. 십몇년전에 맨해튼에서의 공연이 매우 인상적이었는데 오늘 아들과 함께 한국에서 공연을 즐길 수 있어서 매우 감동적이고 잊지못할 추억이 되었어요. 아들도 너무 즐거웠다고 하네요. 우비는 입었으나 거의 튈것은 없었고 우비를 입고있어 약간 더웠던것 말고는 매우 훌륭한 공연이었습니다. 최고입니다.,2022.07.20
블루맨그룹 월드투어,4,아이가 매우 좋아해요,7살 아이인데도 집중해서 잘 보고 재미있다며 또 보고싶다는 얘길 몇 번 합니다.^^ 즐거운 추억이 됐어요~,2022.07.20
블루맨그룹 월드투어,5, 50살에  15 살로  돌아간,50이 다 된 나이에  15살로 돌아가 신나게 웃고 즐거워 햇던 시간이였습니다.조금 아쉬웠던 점은  빠른 진행으로 인해  중간중간  소통이 끊겨서  놓치게 된  기발함들입니다.15 살의 마음으로 본다면 황홀하다 할만큼의  시간을 즐기시게 될것입니다,2022.07.20
블루맨그룹 월드투어,5,재미있었어요!,너무 재미있고 흥미진진했어요. 태어나서 처음으로 그런 공연을 봤어요. 계속 신기하고 재미있는 공연 버여주세요~~,2022.07.19
블루맨그룹 월드투어,5,코로나도 날려버릴 신나는 공연,"블: 블루맨 그룹 월드 투어 공연은 루: 루시퍼 같은 겉모습에 무서운 얼굴을 하고 있지만  맨: 맨날 보고 싶을 정도로 엄청나게 신나고 흥이나는 공연이었다.  월: 월클의 공연은 역시 말없이도 훌륭한  드: 드라마와 서사를 보여주기 때문에 다른 공연들과는 다른 완전 알찬  투: 투어 공연이었고,  어: 어린이, 어른 할 것 없이 모두가 함께 즐길 수 있는 공연을 오랜만에 신나게 관람했다.",2022.07.18
블루맨그룹 월드투어,5,사춘기 날려버릴 시원한 공연!,"중2 아이들과 함께 관람했어요.  가기 싫다고 시원한 집에서 유튜브나 볼거라고 불평을 불평을....엄마 어렸을 때 재밌게 봤던거라고 하니 너무 올드한거 아니냐... 등등 온갖 이유를 갖다 붙였는데, 시작하기도 전부터 재밌다고 하면서 억텐, 저메추 무슨 말인지 물어보니 가르쳐 주지도 않고 자기들끼리 너무 재밌게 즐기다가 갑니다! 제가 관람했던게 15년 전인 것 같은데 프로그램도 계속 바뀌는군요. 팀 모두에게 박수 보냅니다~",2022.07.18
블루맨그룹 월드투어,5,너무너무 재미있었어요,"스플래시석에서 봤는데 표정 연기 하나하나가 다 보여서 너무 좋았고, 관객이 참여하는 쇼라 더 좋았던것 같아요",2022.07.18
블루맨그룹 월드투어,5,체기를 내리는 시원한 공연~!,기다리고 기다리던 블루맨 공연~! 후기에 웃다 지쳐 나오는 공연이라기에 정말 큰 기대감을 가지고 갔는데 기대감을 뛰어넘는 재미였습니다!! 얼리버드 예매했다가 취소하고 고민하다가 다시 정가?주고 예매했는데 이건 뭐... 안봤으면 후회했을 듯. 스플레쉬존 정가운데서 관람했는데 무대이탈이 많아서 뒤도 돌아보느라 목아팠습니다 ㅎㅎㅎㅎㅎ 뒤에서 봐도 재미있었을 듯....하는 마음에 슬쩍 뒷좌석을 다시 알아보고 있는 나...와 아들..... 코로나로 2년동안 소극적 문화생활을 하다가 이제 적극적으로 나서려고 하니.. 사춘기가 와서 어디 가자고 하면 반항하는데 최근에 공연이랑 전시는 다 소년의 마음에 흡족했는지 또 보고 싶다고 난리가 ㅎㅎㅎ 물 한번 맞아보겠다고 소심하게 다리 한쪽 디미는 아이를 보니 재구매하긴 해야겠구나... 하는 생각이 들었습니다~ 살짝 체한 상태로 공연 들어갔는데 공연 보고 나오니 소화불량이 싹 다 나았다는!!!! 미국식 유머를 이해 못할까봐 혹은 비주얼이 무서워서?!;; 아니면 티켓값이 부담되서!? 다 극복할만큼 재미있으니 공연 끝나기 전에 필관람 추천드려요 ^^ 원래 소심해서 무대에 끌려나가는 거 극도로 두려워하는데 이번 공연만큼은 무대로 끌려나가고 싶었음... 그리고 다들 후기에서 드럼언니 칭찬하던데... 진짜 칭찬이 아닌 극찬할만해요~~  반하고 옴 ㅎㅎㅎ 관람 기회가 있으면 또 보러갈게요~~^^,2022.07.18
블루맨그룹 월드투어,5,이렇게 웃는게 얼마만인가!!,&#128077;&#128077;&#128077;&#128077;&#128077;&#128077;&#128077;&#128077;&#128077;&#128077;&#128077;&#128077;&#128077;&#128077;&#128077;&#128077;&#128077;&#128077;&#128077;&#128077;&#128077;&#128077;&#128077;&#128077;&#128077;&#128077;&#128077;&#128077;&#128077;&#128077;&#128077;&#128077;&#128077;&#129776;&#127995;&#129776;&#127995;&#129776;&#127995;&#129776;&#127995;&#129776;&#127995;&#129776;&#127995;&#129776;&#127995;&#129776;&#127995;&#129776;&#127995;&#129776;&#127995;&#129776;&#127995;&#129776;&#127995;&#129776;&#127995;&#129776;&#127995;&#129776;&#127995;&#129776;&#127995;&#129776;&#127995;&#129776;&#127995;&#129776;&#127995;&#129776;&#127995;&#129776;&#127995;&#129776;&#127995;&#129776;&#127995;&#129776;&#127995;&#129776;&#127995;&#129776;&#127995;&#129776;&#127995;&#129776;&#127995;&#129776;&#127995;&#129776;&#127995;&#129776;&#127995;&#129776;&#127995;&#129776;&#127995;,2022.07.18
블루맨그룹 월드투어,5,아이들에게 최고의 하루,"저와 제 처는 오래 전에 미국에서 본 적이 있었습니다. 이번에 한국에서 공연한다길래 초등학교 아이들 데리고 관람하였는데, 아이들이 너무 좋아하네요. 첫째는 또 보고 싶다고 하길래, 나중에 커서 친구들이랑 보라고 했습니다.  예전에 볼 때에도 재미있다는 느낌 외에 참신하고 새롭다는 느낌이었는데 십몇년이 지나서 봐도 그렇네요. 비싼감이 없진 않지만 한번쯤 꼭 추천드립니다.",2022.07.18
블루맨그룹 월드투어,5,가족과 함께,스플래쉬석이라고해서 엄청 젖는건가 싶었는데 우비옷 안입어도 될만큼 몇방울 튄게 전부였어요 ^^ 우비 더워서 벗어놔도 될듯했어요. 블루맨은 신기한 캐릭터였네요. 성별은 없지만 인간에게 호기심많은 외계인아닌 외계인ㅎ음악의 어머니를 상징하는듯한 윗층 드러머 ㅎㅎ심오한 의미는 몰라도 어른들보다 더 즐거워하며 아무때고 웃어버리는 딸래미의 웃음소리 때문에 관객들이 더 웃었던거 같아요. 드럼연주는 참 멋져요.재밌는 추억이 되었네요. https://naver.me/FijmHSeZ,2022.07.18
블루맨그룹 월드투어,4,공연후기,"처음보는 스타일의 공연이라 신기해요, 어떤 콩트가 연속되는건 아니지만 파이트를 이용한 난타 공연같은 느낌에 흥이 나더라구요 5학년인 딸도 엉덩이가 들썩 들썩 하지만 딱 거기까지에요 그러니까 큰 기대 하지 마시고 신나는 타악기 소리 들으러 다녀오세요. 저는 그래도 만족감에 핀도 사고 캠핑 머그도 사서 돌아왔습니다~~~",2022.07.18
블루맨그룹 월드투어,5,블루맨그룹 월드투어,재미있었습니다. 말한마디없이 행동과 퍼포먼스로 웃기는게 힘든데 재밌게 잘 봤습니다.  공연과 거리가 너무 가까웠고 공연장이 더운것 말고는 좋았습니다.,2022.07.18
블루맨그룹 월드투어,5,7세 9세와 함께 즐긴 공연,"공연을 보면 “내용이 뭐냐?!” “뮤지컬, 연극 뭐냐?!” 리는 틀에 박힌 생각에 갇혀있던 스스로를 깨뜨리는 계기얐습니다rock laugh party에 딱 걸맞는 시간한글을 빨리 읽지 못하는 7세는 사실 65분 즈음부터 집중력이 떨어졌지만한글을 빨리 읽어나가는 9세는 끝까지 뛰고 박수치고 소리지르고 리듬을 느끼다 왔습니다글로벌 난타 느낌의논버벌 공연아이 있는 가정에게도 강추합니다!",2022.07.18
블루맨그룹 월드투어,2,블루맨그룹 월드투어,블루맨그룹 월드투어 아주아주 재밌어요,2022.07.18
블루맨그룹 월드투어,5,초등 아이들이 더 좋아한 공연,코로나때문에 공연장 찾은지도 오래 된 것같아서 재밌는 기억이 되어 줄 공연을 찾던 차에 블루맨그룹 월드 투러를 보고 5월부터 예매하고 기다렸네요... 관객과 하나가 되는 공연 너무 재밌었고 아이들도 집중해서 웃고 박수치며 함께했던 신나는 공연이어었습니다~~~,2022.07.17
블루맨그룹 월드투어,5,초등 아이들이 더 좋아한 공연,코로나때문에 공연장 찾은지도 오래 된 것같아서 재밌는 기억이 되어 줄 공연을 찾던 차에 블루맨그룹 월드 투러를 보고 5월부터 예매하고 기다렸네요... 관객과 하나가 되는 공연 너무 재밌었고 아이들도 집중해서 웃고 박수치며 함께했던 신나는 공연이어었습니다~~~,2022.07.17
블루맨그룹 월드투어,5,신나는 공연!,"간만에 남편과 보러갔는데 관객참여로 재밌게 이끌어가고 음악이랑 영상,퍼포먼스도 신나는 공연이었어요!!90분이 순식간에 지나갔네요~강추합니다♡",2022.07.17
블루맨그룹 월드투어,5,왜 두번이상 보는지 알겠다!!,다시보고싶다!!  앞좌석 티켓 끊어서 이공연은 필히 앞좌석에서봐야한다 이런 이색공연은 처음^^드러머 미쳤슴다! 저는 강렬한 타악기와 드럼비트!기발한 아이디어에 박수를!!  앞에서볼걸ㅜㅜ,2022.07.17
블루맨그룹 월드투어,5,모든 사람한테 추천 하고 싶은 쇼,재미이고 멋있고 신기하고 놀라운 쇼 였습니다 . 여러분 다 보셔으면 합니다~,2022.07.17
블루맨그룹 월드투어,5,감동,너무 감동적이였어요.,2022.07.17
블루맨그룹 월드투어,5,스트레스 최고로 풀림!,&#128077;&#128077;&#128077;&#128077;&#128077;&#128077;&#128077;&#128077;&#128077;&#128077;&#128077;&#128077;&#128077;&#128077;&#128077;&#128077;&#128077;&#128077;&#128077;&#128077;&#128077;&#128077;&#128077;&#128077;&#128077;&#128077;&#128077;&#128077;&#128077;&#128077;&#128077;&#128077;&#128077;&#129776;&#127995;&#129776;&#127995;&#129776;&#127995;&#129776;&#127995;&#129776;&#127995;&#129776;&#127995;&#129776;&#127995;&#129776;&#127995;&#129776;&#127995;&#129776;&#127995;&#129776;&#127995;&#129776;&#127995;&#129776;&#127995;&#129776;&#127995;&#129776;&#127995;&#129776;&#127995;&#129776;&#127995;&#129776;&#127995;&#129776;&#127995;&#129776;&#127995;&#129776;&#127995;&#129776;&#127995;&#129776;&#127995;&#129776;&#127995;&#129776;&#127995;&#129776;&#127995;&#129776;&#127995;&#129776;&#127995;&#129776;&#127995;&#129776;&#127995;&#129776;&#127995;&#129776;&#127995;&#129776;&#127995;,2022.07.17
블루맨그룹 월드투어,5,관객 참여도 많고 재기발랄한 공연이었습니다.,코로나 이후 처음으로 공연관람 해보네요.  코로나 여파로 공연장 분위기가 경직되어있을줄 알았는데  생각보다 관객이 참여하는 부분도 많고 공연분위기도 재기발랄하고 좋았습니다~!,2022.07.17
블루맨그룹 월드투어,5,관객 참여도 많고 재기발랄한 공연이었습니다.,코로나 이후 처음으로 공연관람 해보네요.  코로나 여파로 공연장 분위기가 경직되어있을줄 알았는데  생각보다 관객이 참여하는 부분도 많고 공연분위기도 재기발랄하고 좋았습니다~!,2022.07.17
블루맨그룹 월드투어,5,신혼여행에서 보고 두 번째는 아이와 함께,"10년전 올랜도에서 신혼여행할 때 보고6살 아이와 한국에서 두 번째 볼지는 몰랐네요.부부는 추억에 잠기고, 아이는 너무 좋아했습니다.올랜도처럼 기념품이 많지 않아서 아쉬웠어요.",2022.07.16
블루맨그룹 월드투어,1,"무례한 공연, 지나친 관객 유도",처음에는 기대를 하고 갔지만 선넘는 관객 유도와 개그로 너무 실망했네요 미국식 개그에 재미도 없고 감동도 없었습니다. 관객을 초청하는게 두 번이 있었는데요 개그랍시고 관객을 끌고 가 페인트칠을 한뒤 사람 거꾸로 매달아 던져 캔버스에 칠하는게 있었는데 참여한분의 애인 인분이 공연내내 안절부절 못한체 화가 나있었는데 이게…맞아요..?공연도 아니고 마술도 아니고 행위예술도 아닌 애매한 공연,2022.07.16
블루맨그룹 월드투어,1,"무례한 공연, 지나친 관객 유도",처음에는 기대를 하고 갔지만 선넘는 관객 유도와 개그로 너무 실망했네요 미국식 개그에 재미도 없고 감동도 없었습니다. 관객을 초청하는게 두 번이 있었는데요 개그랍시고 관객을 끌고 가 페인트칠을 한뒤 사람 거꾸로 매달아 던져 캔버스에 칠하는게 있었는데 참여한분의 애인 인분이 공연내내 안절부절 못한체 화가 나있었는데 이게…맞아요..?공연도 아니고 마술도 아니고 행위예술도 아닌 애매한 공연,2022.07.16
블루맨그룹 월드투어,5,No Joke!,이건 진짜 장난이 아닌 공연이었다. 세명의 블루맨들과 관객이 만들어내는 공연으로 웃다가 감탄하다가 다시 웃다가 감탄을 반복했고 공연의 구성과 무대의 구성이 와 이걸 어떻게 생각하지 라는 감탄까지! 멋진 공연이고 진짜 모든이에게 강추한다,2022.07.16
블루맨그룹 월드투어,4,이색적이고 색달랐던 경험!,"''ROCK LAUGH PARTY''라는 슬로건처럼 재미있게 즐기면서 웃다 보면 시간순삭이었던 공연이었다! 공연은 정말 이색적이어서 동심으로 돌아간 듯 ''우와~''하면서 보게 되었다. 볼 거리도 풍성하고 시각 효과에 마음을 빼앗김:D 관객 참여, 소통도 색다른 경험이었다.  러닝타임이 좀더 길었으면 좋았을텐데 하는 아쉬움이 있다.",2022.07.16
블루맨그룹 월드투어,1,역대급 실망,지방에서 어렵게 코엑스아티움까지 기대하고 갔는데 기대했던 이하로 별 재미있는 포퍼먼스가 없었다 관객을 유도하는데 시간만 끌고 몇가지 파이프으로된 난타와 EDM 음악... 그리고 끝 정말로 이 비싼돈 주고 왜 왔는데  홍보에 엮이다,2022.07.16
블루맨그룹 월드투어,5,어디서도 보지못한 쇼!,처음엔 무슨 공연일까 감이 안잡혀서 예매를 망설였는데 보는내내 우아!!를 연발했습니다 라스베가스 다녀온 느낌이네요! 강추! 남자친구 생일선물로 서프라이즈 이벤트 준비한건데 남자친구도 너무 좋아했네요!  고민하고 계신 분들 일단 한 번 다녀오면 반할 겁니다!!,2022.07.16
블루맨그룹 월드투어,5,18년전 미국 보스톤에서 본 공연을 아이와 함께,"블루맨 그룹이 내한한다는 소식에 18년전 너무 재밌게 본 기억이 있어 아이와 남편과 함께  보고싶어 예매를 했습니다. 미국에 가서 보면 좋겠지만, 아직은 코로나로 여행이 자유롭지는 않아서요~ 아이들과 같이 온 분들은 아마도 저처럼 아주 예전의 공연의 추억으로 다시 가족과 함께 온 것 아닌가 하는 생각이 들었어요.  오랜만에 한시간 반동안 즐겁고, 신나게 보았습니다.  또 전광판에 이름이 불리는 행운이 있었어서, 오랜만에 부끄럼도 모르고  일어서서 열심히 손을 흔들었네요~~ 여름에 볼만한 흥겨운 공연으로 추천합니다.",2022.07.15
블루맨그룹 월드투어,5,볼까말까 망설이신다면 보세요!!,말없이도 충분히 흥겹고 신나는 공연이에요.딸들과 시원하고 즐거운 시간 보냈네요^^롹킹한 드럼 사운드에 순간순간 코믹하고... 너무 진지하게 웃었네요. ㅎㅎ내한공연팀의 무대를 놓치지 않고 보게 되어감사합니다.,2022.07.14
블루맨그룹 월드투어,4,아이와 함께 봤어요,월드투어 공연이라고 해서 아이와 함께 관람했어요. 미국식 유머는 아직 적응이 어려운건지 모르겠지만 중간 불편한 장면은 있었지만 인상적이였던 여성드러머와 공연은 재밌었어요. 코엑스는 여러번 가봤지만 아티움은 첨이라 가는길에 헤메긴 했네요.,2022.07.14
블루맨그룹 월드투어,5,☆4번째 블루맨,우리가족은 네번째 블루맨이 되고 말았습니다.3년만에 귀국한 아이와 함께 보기위해 선택한 첫번째 공연인데 비언어극 공연이라 아이도 어렵지 않게 즐길수 있었으며 아빠 점수 톡톡히 땄습니다.,2022.07.13
블루맨그룹 월드투어,5,초등학생 딸이 만족하는 공연! ,"초등 3학년 딸아이와 추억을 쌓고싶어 5월달에 미리 예매하여 오늘 드디어 보았습니다!! 여러 매체를 통해 블루맨에 대한 정보가 있었기에 정말 기대를 하고 오늘을 기다렸습니다! 역시는 역시입니다! 90분 시간가는 줄 모르게 푹 빠져 보았습니다! 웅장한 사운드, 퍼포먼스, 관객과 함께한 위트있는 무대!! 신나는 댄스타임!! 딸아이가 너무 만족합니다! 집에 오는 동안 계속 얘길 하네요~^^ 정말 좋은 추억 쌓은 것 같아 좋습니다!!",2022.07.13
블루맨그룹 월드투어,4,워낙 유명한 공연,라스베가스 갔을때 보고 싶었는데 라스베가스는 워낙  봐야할것이 많아서 O''Show를 보고 헬기 투어를 하느라 미뤄뒀던 공연을 한국에서 편안하게 봤는데요. 생각했던거보다는 점잖았?지만 잼나게 잘봤어요. 다만 아쉬운거는 kt통신 할인받는걸 모르고 할인 못받고 티켓을 구매했네요. 속상하드라구요. 워낙 할인이 크던데...그치만 잘 봤습니다.,2022.07.12
블루맨그룹 월드투어,5,신박하고 이색적인 블루맨!,관객과 소통하고 생각지못한 전개가 매우 이색적이었습니다. 매번 비슷한 공연에 식상함을 느끼고 있었는데 블루맨공연으로 새로운 경험치 하나 생겼습니다! 웃고 즐기며 너무 신나고 기억에 남는 공연이었습니다. 신랑과 10살아이와 오랜만에 신나게 같이 즐겼습니다. 공연 끝나고 기억에 남아서인지 저희 부모님도 보여드렸는데 무엇보다 엄마가 엄청 좋아하셨습니다. 드럼소리에 스트레스가 풀리고 이렇게 신나고 색다른 경험을 하는 공연은 처음이라고 소녀처럼 좋아하시더라구요. 저희 아이가 20살이 되서도 블루맨을 볼 수 있으면 좋겠습니다! 기억에 남는 신박한 공연!! 위트가 넘치는 공연 !! 이었습니다.,2022.07.12
블루맨그룹 월드투어,5,심장 박동 요동치는…,락콘서트 같은 드럼과 타악기의 조합 연주 신났음또한 관객참여의 다양함도 만끽할수 있는 만족스러운 공연..!!,2022.07.12
블루맨그룹 월드투어,5,관개과의 어울림이 자연스러웠고 좋았다,오랜만에 관개과의. 교감을 나누고 스트레스가 뻥뚤리는음악에 마춰 난타와같이 신나게 공 연을 감상할 수밌어 행복한 하루였습니다.,2022.07.12
블루맨그룹 월드투어,5,너무 재밌고 신나는 공연이었어요.,간만에 유쾌한. 공연이었습니다!,2022.07.11
블루맨그룹 월드투어,4,가족끼리 가는 것도 추천,유머러스하고 재미있었어요,2022.07.11
블루맨그룹 월드투어,5,"초2,3 너무나 좋아했어요! 깜짝 놀랬어요~ ㅋㅋ","어른보다 아이들이 좋아할줄은 몰랐는데, 역시 말이 없는 넌버벌이다보니 그런가봐요^^ 외국인들도 많았구요. 처음엔 시끄러워했던 아이들도 분위기가 무르익어갈수록 빠져들며 몸을 흔들고 깔깔거리는 모습이.. 저희 애들이지만 낯설었어요 ㅋㅋ 그만큼 깊이가 있는 즐거움이었다고 하겠습니다. 강추!",2022.07.11
블루맨그룹 월드투어,5,신나요~~,신나게 즐기고 봤네요,2022.07.11
블루맨그룹 월드투어,5,즐거운 시간이었습니다,흥이 절로 나는 신나는 공연이었어요,2022.07.11
블루맨그룹 월드투어,4,관객들이랑 소통,관객들이랑 소통을 많이 하려고했고 매순간 재미를 주려고했어요! 재미고있었구요! 부모님들도 좋아하셨어요!,2022.07.11
블루맨그룹 월드투어,5,너무 신나요,스트레스가 확!!! 풀리는 신남ㅋㅋ,2022.07.10
블루맨그룹 월드투어,5,고민된다면 꼭 가세요,비언어 퍼포먼스지만 처음부터 끝까지 너무 재밋었어요.  지인이 추천해서 가봤는데 가길 잘한거같아요  관람하신다면 1층에서 하세요 관객석으로 여러번 왔다갔다 거립니다.,2022.07.10
블루맨그룹 월드투어,5,공연장소가 유일한 아쉬움이었던 공연,이 공연은 돈이 좀 들더라도 무조건 스플래쉬존에서 보아야 할 것 같아요.VIP석도 아쉽더라구요. 공연이 아쉬운게 아니라 좀 더 가까이에서 공연에 함께하지 못하는 것이 아쉬웠던 공연입니다.관객과 함께하는 요소도 좋았고 공연 후반부엔 촬영도 허용되고 음악을 온 몸으로(문자 그대로의 의미라는 걸 공연을 보시면 아실거예요) 즐기는 락콘서트적인 시간들도 환상적인 경험이었습니다.콘서트를 보는 느낌으로 아니면 클럽에 놀러 가는 느낌으로 보실 때 더 만족스러울 수 있을 것 같아요. 추천드립니다.,2022.07.10
블루맨그룹 월드투어,5,강추,라스베가스에서 못봐서 내내 아쉬웠는데집 가까운 곳에서..그것도 뱅기표안끊고도 쇼를 볼수있다니.. 넘 좋았어요. 온가족이 신나게 즐기고 왔어용,2022.07.09
블루맨그룹 월드투어,5,가슴이 울리는 흥분 전도사 블루맨그룹!!,0709 코엑스아티움에서 블루맨그룹 월드투어를 관람했습니다! 처음에는 물감에 젖는게 싫어 Splash존 피해서 좌석 예매했는데 공연보거 진짜 찐으로 후회 했습니다!!여러분 무조건 splash석에서 보세요! 진짜 전  그 뒤에 VIP석이었는데 splash석이 더 재미있을거 같더라고요!평소에 음악이나 리듬에 별로 흥미가 없었는데 어느순간 빠져들어서 같이 들썩거리고 있더라고요!! 관객도 같이 참여할 수 있는 공연은 많지 않은데 관객들도 다 같이 참여할수 있어서 너무 즐거웠어여!! 몸속 깊이 울리는 사운드에 회련 조명과 퍼포먼스까지!! 진짜 왜 더 길게 안했는지 너무 아쉬웠어요!!진짜 처음에는 이게 무슨공연인가 싶으셔도 진짜 한번 보도나면 한번으로 만족할수 없을거같은 공연이 되어있을거에요!! 최근 본 공연중에서 최고네요 진짜!,2022.07.09
