musical_title,rate,review_title,review_text,review_date
블루맨그룹 월드투어,5,블루롹 콘서트,처음엔 별 기대하지 않고 감 근데 사람이 너무 많았음 근데 맨 앞자리라 물감 튀긴다는 안내에 우비만 꼭 뒤집어 씀 시작!! 멘트로 가볍게 웃김 샤갈 작품인가 입으로 물감을 뿌려서 그림을 그리는 행위예술 너무나 인상적임 아 근데 드럼에 물튀기는 건 어디서 본 난타다. 근데 물감을 뿌려서 하니까 수준이 더 높아 보였음 아 근데 매드맥스 드럼머가 나온다 미쳤다. 찰리채플린 무성영화를 보는듯한 판토임도 들어간 공연은 너무 흥미롭다. 지루하다면 어쩔 수 없지만 확실히 맨 앞에서 본게 표정을 봐서 그런가 생생한 느낌이 지룰할 틈이 없다. 야광 물감 파이프 소리 90분감 파워풀은 정말 인생작이다. 즐거웠습니다.,2022.06.27
블루맨그룹 월드투어,5,코로나 이후로 뼈때리는 감동,"코로나로 블루한 나날이였는데, 블루맨이 와서 나의 블루한 감정을 레드 라이트로 바꿔줫네요! 미국식 사고방식이라 호불호가  있을 수 있지만, 충분히 90분간 즐거움은 잊을 수 없습니다.",2022.06.27
블루맨그룹 월드투어,5,파랑 얼굴인사람 3명과 여성드러머의 합작!!!,음향과 시각의 조화!!!  7세 아이와 관람을 하였고 아이도 재밋어서 눈에 하트가 뿅!!! 개인적으로 처음에 물감을 드럼에 붙고 치는게 너무 멋졌음. 아직도 생각이 계속 남. 오랜만에 가족과 함께 즐겁게 볼수 있고 신나는 공연이라 다음에 내한하면 또 볼 거 같음. 왜 태양의 서커스에서 인수한지 알듯한 공연!!!!멋짐!!!!,2022.06.27
블루맨그룹 월드투어,5,또 보고싶은 공연,아이와 보고싶어요. 기대됩니다.,2022.06.26
블루맨그룹 월드투어,5,신나고 잼나요~~^^,잼있어요~~~ :),2022.06.26
블루맨그룹 월드투어,5,애들이 안좋아할지도 몰라서…,애들이 안좋아할지도 몰라서… 2층 예매했는데요. 너무 재밌어서 다시 스플래쉬석으로 예매했어요~고민이신 분들은 1층으로 예약하세요. 훨씬 몰입도가 크고 재밌어요~~,2022.06.26
블루맨그룹 월드투어,5,구통이 싸악,즐거운 공연에 두통이 사라졌습니다 ㅋㅋ(이름이 나와 깜짝 놀랬어요 ^^)아이들과 좋은 시간 보냈습니다. 스플래쉬석 강추!우비 없이 그냥 맞죠!!! ^^,2022.06.26
블루맨그룹 월드투어,4,새롭고 신박한 공연입니다.,아이들하고 보러오신 분들이 많았네요. 기대 만큼은 아니었지만 재미있었어요~,2022.06.26
블루맨그룹 월드투어,2,약간 실망,"뉴욕공연, 세종문화회관 공연을 보고 기대에 차서 세번째 공연을 기대했으나, 이번 코엑스 공연은 많이 실망. 놀라움이 하나도 없었다",2022.06.26
블루맨그룹 월드투어,5,매드맥스를 좋아한다면 더더욱 강추,"박진감 넘치는 타악 음악이 압도적입니다. 블루맨은 정말 눈만 빼고 다 파란색이어서 생각보다 비주얼이 강렬해 놀랐어요  처음엔 쇼킹했는데, 행동은 장난끼 가득해 웃고 즐겁게 놀다 왔습니다. 진지하게 보거나 메세지를 하나하나 해석하려하지마세요 이건 그냥 신나고 배꼽빠지는 공연입니다!!",2022.06.26
블루맨그룹 월드투어,5,기대만큼 재미있었어요.,10살 아들 생일 맞이 인생 첫 공연관람인데 무대 진출까지 해서 너무 뜻깊고 흥분이 가시지 않네요. 덕분에 애미도 목청 높여 소리도 지르고 지루할틈 없이 엉덩이 들썩거리고 스트레스 날리고 왔어요. 흥많은 우리 모자 너무 즐거웠습니다~,2022.06.26
블루맨그룹 월드투어,5,가족과 함께 잼있게 봤어요,아이들이 너무 신기하고 재미있어 했어요,2022.06.26
블루맨그룹 월드투어,5,단순히 음악공연인줄 알았는데 너무 웃겼어요,요즘에 맞는 각종 자막 드립에 블루맨 크루들의 코미디 덕에 정말 유쾌하게 보고 나왔습니다. 관람객을 보니 가족단위로 많이 오셔서 놀랐는데 그럴만한 이유가 이유가 있는것같아요. 정말 재밌게 봤습니다.,2022.06.26
블루맨그룹 월드투어,5,어머니께서 즐거워하셨습니다,활동적인 걸 좋아하시는 어머님께  공연을 보여드렸어요  다녀오신 뒤로 계속 공연이 어땠는지 이야기 해주시면서  즐거워하셨습니다  오랜만에 젊은 사람들과 어울린 것 같다고도 말씀하시고  공연내내 즐거웠다고 하세요  앉아서 관람하는 공연이 아니였더라구요   좋은 공연 선물이 되었어요,2022.06.26
블루맨그룹 월드투어,5,정말 재밌어요~!,여자친구와 함께 관람했는데 관객과 함께 참여도 하고 다채롭게 볼게 많아서 좋았어요~,2022.06.26
블루맨그룹 월드투어,5,소리와 빛이 더해져.,"소리와 색깔이 있는 공연 상상하지 못했던 하나가, 소리가 되고-그 소리에 빛이 더해져  관객의 눈과 귀를 흥분시겼던 공연이었다.  사랑하는 자녀와 함께 뛰고, 소리지르며-신나게 즐긴 감사했던 하루♡  블루맨그룹내한공연 코엑스아티움 22.6.15~8.7",2022.06.26
블루맨그룹 월드투어,5,좋은 선물이 되었어요,부모님 공연 보여 드렸습니다 너무 좋아하셨어요,2022.06.26
블루맨그룹 월드투어,5,신선하고 새로웠어요 :),"원초적인 웃음에 , 새롭고 독특한 전달방식이 신선했어요  관객참여 부분이 많아서 재밌었어요 ㅋㅋ  볼거리도 있고,  드럼치는언니 진짜 짱멋...♡ 매드맥스 생각나는 파워였어요  남녀노소 다 즐길수있는 공연이에요",2022.06.25
블루맨그룹 월드투어,5,스트레스 해소용으로 굿!,해외관람 후 거의 10년만에 본 블루맨그룹! 해외에서 꽤 큰 무대에서 봤었는데 한국에서의 작은 무대도 나름 매력이 있네요~ 서사 없이 흘러가니 머리 쓸일도 없고 시원시원하게 울리는 드럼 소리는 스트레스 해소용으로 제격입니다~!,2022.06.24
블루맨그룹 월드투어,5,한국에선볼수없는 신선한공연!,이런맛에 내한공연 예약하고 봅니다!ㅋㅋ,2022.06.24
블루맨그룹 월드투어,5,기분전환 확실한 공연이었어요,"라스베이거스에서 본 후 내한공연이 있어 와이프 보여주러 다시 찾은 공연이었는데, 와이프가 너무 흥겨워하며 좋아해서 잘했다 싶었습니다 :)",2022.06.24
블루맨그룹 월드투어,5,남녀노소 즐길수있는 눈과 귀가 즐거운 공연,예전부터 유튜브 영상으로 자주 접했던 블루맨 그룹이었는데 역시나 현장에서만 느낄 수 있는 바이브를 따라올 수는 없었나봅니다. 보는 내내 다양한 색으로 연출한 시각적 효과들과 끊임없는 타악기 연주 혹은 침묵으로 이어가는 공연 흐름 등. 말이 없는 콘서트지만 누구나 즐길 수 있는 컨텐츠들로 구성되어 있어 가족들이 보러 오셔도 정말 즐거울 것 같습니다.,2022.06.24
블루맨그룹 월드투어,5,23일 목요일 공연 최고였습니다!,오늘 공연 정말 재밌게 봤습니다! 미국식 농담과 관객도 공연의 일부로 참여를 많이 유도하는 편이라서 호불호 갈릴 수 있는데 저희는 너무 제대로 즐겼네요! 특히 오늘 앞으로 나오신 어머님 두분 너무너무 감사합니다! 덕분에 공연을 더 다채로워지고 즐거웠던것 같아요!! 너무 멋있으셨어요!!,2022.06.24
블루맨그룹 월드투어,5,블루맨그룹 월드투어 너무나도 이색적이고,블루맨그룹 월드투어 너무나도 이색적이고 멋진 공연이였습니다. 시간이 어떻게 지나가는지도 몰랐네요. 기회가 된다면 다시 예매해서 보려고 생각중입니다. 스트레스가 모두 해소된듯한 그런 기분좋은 느낌입니다. 정말 정말 멋져요. 굿입니다.,2022.06.24
블루맨그룹 월드투어,3,가격 대비 별루에요,13만원 주고 볼 공연은 아닌듯...비추!!!,2022.06.23
블루맨그룹 월드투어,1,정말 돈아까워요...,"유명한공연이라해서 부모님모시구갔는데,전 심지어 20%할인받아서 공연관람했는데도 돈아깝더라구요...관객참여형이라지만....흠....공연반 관객이랑 노는시간반...근데 문제는 재미가없음 ㅠㅠ좀더공연위주였으면 그나마 나았을것같긴해요..지인들한테 추천의사묻는다면 진짜 비추했을것같아요차라리 이돈으로 좋은곳가서 식사하거나 쇼핑하라고했을것같아요너무아쉽습니다 ㅠㅠ",2022.06.23
블루맨그룹 월드투어,5,진정한 관객 참여형 공연,보는 내내 흥이 넘치고 지루할 틈이 없는 공연이었습니다. 앞자리로 다시 예매해서 다시 보고싶어요 !!,2022.06.23
블루맨그룹 월드투어,1,비싸고 재미 없었어요 ㅠㅠ,공연 엄청 많이 보러 다니고 특히 태양의 써커스 좋아해서 블루맨 들어온다길래 엄청나게 신나서 예매했어요.몰입도하려고 하면 끊기는 이상한 구성과특정 부분은 너무 길게 끌며음악은 단조로웠고볼거리도 들을 거리도 별로였어요.게다가 비싸서 평을 더 낮게 줄 수 밖에 없었어요.,2022.06.23
블루맨그룹 월드투어,2,큰 기대만큼 실망도 큽니다,"엄청난 홍보로 큰 기대를 안고 갔는데, 가학적인 부분이 많아서 인상을 찡그리게 되었습니다. 기대보다 무대는 심심한 편이었고, 연주한 음악도 기억에 남지는 않았습니다. 공연 후반에 드라이아이스가 들어간 비누방울을 터트리는 재미를 제외하고는, 금액과 시간이 아깝다는 생각이 들었습니다.",2022.06.23
블루맨그룹 월드투어,4,멋진 드러머!,"넌버벌 공연이고, 즉흥성과 관객참여를 요구하기 때문에 관객 취향에 따라 호불호가 갈릴거 같다. 다만 중간에 폭죽이 쏟아지고, 비누방울이 내려오고 마치 클럽을 연상케 하는 순간이 있었고, 아이들이 굉장히 좋아했던 것 같다. 볼거리가 많은 공연이다.",2022.06.23
블루맨그룹 월드투어,5,블루맨 후기,스플래쉬 존에서 공연을 보게 되었는데요 너무 재밌게 봐서 너무 추천 드립니다!  평일 낮에 마티네 할인으로 관람했는데 관객분들도 다같이 하나가 된 기분으로 즐겁게 관람했습니다 고민중이시라면 다들 꼭 보셨으면 해요  세 블루맨들이 매력이 넘칩니다bb      남녀노소 연령대 상관없이 다들 재밌게 보실꺼 같아요 오랜만에 너무 즐겁게 관람했습니다!!,2022.06.23
블루맨그룹 월드투어,5,역시!!,너무 좋았어요!!  이름부터 특별했는데 관람하고 나서 더 특별하게 느껴졌었어요!!!  특별한 날이 필요할땐 블루맨 그룹 월드투어를!!!   추천해 주고 싶어요!!,2022.06.22
블루맨그룹 월드투어,5,흥이 멈추지 않아요!!,"라스베가스에서도 보고 왔던 공연인데 한국 내한 한다길래 냉큼!! 보고 왔습니다. 거두절미하고 진짜 단 한번도 본 적 없던 쇼! 딱 그대로 입니다!  직접 봐야 이 흥과 텐션을 제.대.로, 표현 할 수 있어요.ㅋㅋㅋ 남녀노소 관계 없이 진짜 다 재밌게 볼 수 있는 공연이에요!  찐텐 블루맨 안본 사람 없게 해주세요!!ㅋㅋ 개꿀잼!!",2022.06.22
블루맨그룹 월드투어,4,블루맨의 매력..,관람 대기 중 많이 어린 친구들이 너무 많아서 불안해하며 입장했지만... 아이든 어른이든 상관없었다.. 블루맨의 매력에 빠지는데는....  드럼 연주가 좀 더 있었으면 하는 아쉬움도 있었지만.. 충분히 멋진 공연이었따!!,2022.06.21
블루맨그룹 월드투어,4,좋았던점과 아쉬웠던점 몇개... ,"특별한 날, 아내와 함께 즐거운 시간 보냈습니다14년만의 내한이라 반가웠고배우들의 합과 숱한 연습과 땀이 느껴졌어요여성 드러머의 미친듯한 퍼포먼스도 좋았고관객 참여를 유도하는 공연이라 더 몰입됐어요-아쉬웠던 점은공연 후반부 관객을 불러내어 무대뒤에서 거꾸로 매달아 캔버스에 충돌시키는 장면이있는데 사전합의도 없어보였는데 충격적이었어요 그분 괜찮으시길 빕니다. 공연중반 관객 핸드백을 이용하는 쇼에서도 미리 준비한 핸드백 소품을 쓰던걸 보면 페인팅시퀀스도 합의나 대역이 아닐까 싶기도한데 무탈하시길 빕니다. 그리고 공연 중간중간 쉽사리 공감가지않는 비디오아트와 문구로 꽤 많은시간을 허비하는데 다른 방식으로 무대를 꾸미면 어떨까 싶네요",2022.06.21
블루맨그룹 월드투어,5,재밌고 신선했어요,지금까지 보지 못한 신선한 컨셉에 적절한 웃음코드까지!!  넘 재미 있었어요 같이간 딸도 재미있었다고 계속 얘기하네요 가족 관람 추천해요!,2022.06.20
블루맨그룹 월드투어,3,십여년전 공연이 대박나서~ 궁금해서 봤네요 ^^,약간 사이키한 장면도 많고~   웃기기도~  즐겁기도~ 씬나고 흥나고!  즐기는 쇼에 무리는 없었어요!  ^^  덕분에 목요일 스트레스 다 날렸답니다~~~~~~,2022.06.20
블루맨그룹 월드투어,5,잊을 수 없는 최고의 공연,제가 태어나서 본 공연 중 과연 최고의 공연이었습니다. 예전부터 좋아하던 예술가들을 직접 만나서 너무 설레었어요 ㅜㅜ 공연 관람하신다면 스플래시석 강추합니다! 정말 관객과 같이 즐기는 공연이기에 남녀노소 누구나 배꼽 빠지게 웃고 즐길 수 있는 공연이었습니다! 올해 10월달에 예정되어 있는 태양의 서커스도 무지 기대되게끔 하는 최고의 공연이었습니다 !!!,2022.06.20
블루맨그룹 월드투어,3,미국식 유머,미국 출장도 많이 가보고 미국에서 공연도 몇번 봤는데 미국 특유의 향수가 있는 공연이네요  한국이 문화적으로 열등했을 때 봤었으면 상당히 충격적이고 신선했을텐데 확실이  우리 수준이 높아져서 ^^    나름 나쁘진 않았지만 wow ! 정도는 아니었습니다.    역설적으로 문화 강국 대한민국의 높아진 시선을 느낀 하루네요 ~~,2022.06.20
블루맨그룹 월드투어,5,너무재밌어요,아이랑 같이갔는데 의외로 애들데꾸온 사람부터 나이드신분들까지 많은 공연이었어요외국에서 유명한 공연인만큼 나이를불문하고 모두가즐길수있는 공연인거같아요.저희 아이는 마치콘서트간것처럼 방방 뛰고 너무 신나했네요. 비싸지만 역시 알찬공연이었기에 대만족입니다아이는 아이방석원하면 표검사하시는분께 부탁하면 앉은키도 높힐수있어요.,2022.06.20
블루맨그룹 월드투어,5,고생 끝에 낙,"저도, 같이 가기로 한 친구도, 갑자기 일이 몰리고 게다가 몸도 안좋아서 취소해야하나 정말 고민이 많았습니다. 공연 시간에 맞춰 달려갔는데, 정말 고생 끝에 낙이었어요. 안보면 어쩔뻔 했나 싶습니다.",2022.06.20
블루맨그룹 월드투어,5,미국에서 본 공연을 한국에서!,미국에서 본 공연을 한국에서 볼 수 있는 기회가 생겨 너무 좋았습니다. 다만 블루맨 전용극장이 아니다보니 조금 아쉬운 부분들은 있었네요 그래도 초3 아들하고 같이 갔는데 재미있어 했습니다 강력 추천합니다,2022.06.20
블루맨그룹 월드투어,5,오늘보고왓는데 또보고싶네요,너무너무재밋어오 남녀노소 모두즐길수잇어요,2022.06.19
블루맨그룹 월드투어,5,즐거워요,신나요! 남녀노소 누구나 즐길 수 있어요. 현 시대에 알맞은 인터랙티브 공연이에요.,2022.06.19
블루맨그룹 월드투어,5,블루맨그룹,무슨 공연인까? 너튜브를 보니 대충 이해가 갔지만대사없이 소통한다는게그러나 모션하나로 1시간 반이 순간지나가네요사운드도 좋고,2022.06.19
블루맨그룹 월드투어,5,너무너무 재밋게 잘봤습니다/```~~,와이프랑 힐링 데이트로 관람했는데  너무 재밋었어요~~~,2022.06.19
블루맨그룹 월드투어,5,기말고사로 스트레스 만빵아들이 완전 즐기고 왔어요,흥이 있는 아이가 고등학생이 되면서 매일 책상앞에만 앉아 있더니 스트레스를 많이 받더라구요 오랜만에 리듬에 몸을 맡기고 신나게 논 기분이래요~예매한 보람이 있었습니다~,2022.06.19
블루맨그룹 월드투어,5,같이 웃고즐길수 있어요,8살 아들과 같이 관람 했어요   즐거웠다며 잠들기전에 또다시 유투브로 찾아보고 잤네요 ^^,2022.06.19
블루맨그룹 월드투어,4,신선한 즐거움,블루맨들이 연기도 잘해서 무척 신선했어요. 마치 외계인이 지구에 놀러온 느낌이었어요,2022.06.19
블루맨그룹 월드투어,4,추억의 블루맨!,거의 15년만에 보게된 블루맨! 남편과 처음 봤을땐 풋풋한 신혼이었는데 이번엔 초등학생 애들 둘을 데리고 보게되니 참 감회가 새롭고 인생을 다시금 돌아보게 되었습니다 한국 방문해주셔서 감사해요!!,2022.06.19
블루맨그룹 월드투어,5,색다른 공연이었어요,대사 한마디 없어도 이렇게 신나게 즐기고 올수있구나  관객 체험형 넘 신선하게 잘보고 왔습니다.,2022.06.19
블루맨그룹 월드투어,5,너무 멋진 공연이였어요~,결혼전에 처음 블루맨공연을 보고 멋지고 재밌는 공연이라서 나중에 꼭 한번 다시보고 싶다고 생각했었는데 요번에 다시 볼수 있는 기회가 생겨서 아이들과 가족 다같이 보러갔었네요 가족 다같이 즐기고 멋진 공연을 봐서 너무 행복했어요,2022.06.19
블루맨그룹 월드투어,2,그냥 그래요,과거 블루맨그룹 공연을 해외에서 관람 경험 있구요 이번에 오랜만에 내한한대서 가족에게 새로운 경험 시켜주고 싶어서 예매했어요 음.. 티켓가격이 아깝다는 생각을 참 오랜만에 해봤네요 준비가 좀 덜 되어보이고 산만한 느낌이 강했습니다 다시 안보러 갈것같네요,2022.06.19
블루맨그룹 월드투어,5,눈과 귀가 행복한 경험!!,"잊지 못할 색감과 조명, 신나는 음악까지 중간 중간 지루할 틈 없는, 이벤트까지 코로나 기간동안 쌓였던 스트레스를 한꺼번에 날려버릴 블루맨그룹 공연 강추드립니다.^^",2022.06.19
블루맨그룹 월드투어,5,아아들에게 권장할 만한 공연인가?,공연 내용은 참 좋았습니다.  적어도 청소년(12세이상)에게는 신나고 즐겁고 위트있고 활기찬 공연이었습니다.  다만 오늘 공연에서 유치원생과 초등학교 저학년 학생들이 있었는데 공연의 흐름을 깨는 큰 소리와 앞사람을 배려하지 않는 발차기 등등 민폐를 볼 수 있었습니다.  그리고 공연 내용 중에 피임도구를 물풍선으로 사용하는 장면이 있었는데 아이들이 보기에 적당한지 의문입니다.  관객에게 페인트를 칠해서 거꾸로 매달아 캔버스에 던지는 장면은 성인에게는 재미이지만 아이들에게는 바판없는 모방이 될 수 있을 것 같습니다.  아이들을 공연에 참가하고 싶으신 부모님들은 참고하시기 바랍니다.,2022.06.19
블루맨그룹 월드투어,5,행복한 하루,두 달전에 예매하고 드디어 관람 했어요왜 세계적인 공연인지.....죽기전에 꼭 봐야하는 공연 관람으로 너무 행복한 하루였습니다가슴 벅참이 무엇인지 흥이 무엇인지 알게 해준 공연또 보거 싶네요,2022.06.18
블루맨그룹 월드투어,5,또 보고싶은 공연,관람객이 같이 참여하며 즐길 수 있는게 너무 좋았단 공연!!!스트레스 풀고싶어 신나는 공연 찾는 중 보고싶었던 블루맨그룹이 한국에서 공연한다는 소식 듣자마자 예매했고 중간중간 관람객이 참여할수 있는 부분에 직접 참여도 할 수 있는 기회가 있어서 너무 즐겁게보고 왔어요!!! 기억에 남는 추억이 될 수 있어서 정말 좋았습니다!!!,2022.06.18
블루맨그룹 월드투어,5,눈과 귀가 행복한 경험!,"잊지 못할 색감과 조명, 신나는 음악까지중간 중간 지루할 틈 없는, 이벤트까지코로나 기간동안 쌓였던 스트레스를 한꺼번에 날려버릴 블루맨그룹 공연 강추드립니다.^^",2022.06.18
블루맨그룹 월드투어,5,또 보고싶은 공연,관람객이 같이 참여하며 즐길 수 있는게 너무 좋았단 공연!!!스트레스 풀고싶어 신나는 공연 찾는 중 보고싶었던 블루맨그룹이 한국에서 공연한다는 소식 듣자마자 예매했고 중간중간 관람객이 참여할수 있는 부분에 직접 참여도 할 수 있는 기회가 있어서 너무 즐겁게보고 왔어요!!! 기억에 남는 추억이 될 수 있어서 정말 좋았습니다!!!,2022.06.18
블루맨그룹 월드투어,5,"초등학생 아이도, 부모도 참 흥겨웠던 시간..","코로나로 공연관람 경험이 없던 아이들과 정말 재미있게 잘 보고 왔습니다. 비트도 신났고~~ 중간에 한국 관람객을 배려한 B*S 곡의 짧은 연주~!! 블루맨들의 쎈스^^인터타임없이 90분 풀로 진행된다고 해서 좀 지루해질까..걱정했는데 시간가는줄 몰랐습니다~~ 각 주제별 스토리가 어떤부분은 애들이 이해하기 어려웠지만 즐기는데 문제는 안되었네요~~사진말고 눈과 마음에 담으려했지만, 포토타임에는 참을수가 없었네요~~^^",2022.06.18
블루맨그룹 월드투어,4,7세아이와도 꽤 즐겁게 관람,아이가 무서워할까봐 걱정하는 마음으로 갔는데 처음 시작부터 신나는 음악이 곁들여지고 관객 참여가 다양해서 아이가 즐겁게 봤네요 막판에 아이가 나가자고 할때쯤 포토타임으로 넘어가며 비눗방울 나오고 음악나오며 손흘들고 춤추고ㅎㅎ 흥겨웠어요,2022.06.18
블루맨그룹 월드투어,4,재밌었습니다.,처음에 스플래쉬존도 아닌데 남자친구한테 과녁주길래 식겁했네요밑에분 후기처럼 목안에 카메라넣는다거나 과자 씹고 가방에 뱉는 퍼포먼스는 저도 좀ㅠㅠ나머지는 클럽처럼 다같이 신나게 즐기는 분위기라 재밌었음위에서 드럼치는 여자분 너무 멋졌어요,2022.06.18
블루맨그룹 월드투어,3,독특한 공연이긴 했으나,기대했던 것 보단크게 유쾌하거나 재미가 있진 않았어요10%로 부족했던 공연입니다소형카메라로 목 안까지 넣어서 찍던퍼포먼스는 왜 했는지....ㅜㅜ받아 먹던 과자를 가방 속에 넣는 등윽... 했습니다,2022.06.18
블루맨그룹 월드투어,3,첫번째 관람자는 좋겠지만..,과거에 블루맨그룹 해외공연 본 사람입니다  이번 내한공연보고..  표가 좀 비싼거같단 생각을했네요 :(,2022.06.18
블루맨그룹 월드투어,4,괜찮았어요,공연시간 : 1시간 40분내용 : 저는 조금 아쉽네요,2022.06.18
블루맨그룹 월드투어,4,괜찮았어요,연기진들의 뛰어난 연기와 아이디어가 빛난던 공연.  그러나 구성한지 오래된 만큼 임팩트가 큰 것들은 기대하기 어려웠습니다.  오히려 중장년 층에서 재미있게 볼 수 있을것 같아요. 아이들이나 최근 공연을 많이 본 분들은 다소 새롭지 않을 수 있어요.  그래도 열연과 마지막 뭉대뭉개 비눗방울 타임은 정말 즐거웠답니다.  :) 한 번은 볼 만한 공연이었어요.,2022.06.18
블루맨그룹 월드투어,5,재밌어요,관람객참여형 콘서트 및 퍼포먼스,2022.06.18
블루맨그룹 월드투어,5,관객과 양방향으로 소통하는 퍼포먼스 공연,"한시도 긴장을 늦출 수 없는 통쾌, 발랄, 스트레스프리 퍼포먼스 공연.  무엇보다 출연배우들의 진지한 표정과 자연스러운 제스쳐 그리고 수준 높은 난타공연은 압권.  다시 없을 이 공연의 한국 초연을 관람한 건 행운.",2022.06.16
블루맨그룹 월드투어,5,색다른 즐거움,색다르고 신선한 퍼포먼스 덕에 눈과 귀가 모두 즐거웠던 공연이였다 한국에서 쉽게 접하지 못할 분위기의 공연이라 신선하고 즐거웠던 것 같다 관객 참여도가 높은 공연을 좋아하시는 분들은 더 즐겁게 즐길수 있을 것 같은 느낌,2022.06.16
블루맨그룹 월드투어,3,신선한 퍼포먼스,오랜만에 공연관람이라 관객으로써의 무대호응은 쉽지않았습니다. 타악 퍼포먼스는 훌륭하였네요. 다만 기타 공연 테마 중 우리나라 정서상 어울리지 못하는 컨셉도 보입니다.,2022.06.16
