musical_title,rate,review_title,review_text,review_date
블루맨그룹 월드투어,5,가족과함께 잊지못할 추억을 만들고 온 공연,코로나 이후 처음우로 보러 간 공연이었습니다. 가족과함께 잊지못할 추억을 만들고 왔습니다. 아이들도 너무너무 좋아합니다.지난번 공연이 코로나때문에 취소가 되어 무척 안타까웠는데 이번에 볼 수 있어서 다행이었습니다. 90분 러닝타임동안 정말 많이 웃었어요 관객참여형 공연이라 더 즐거웠던것 같아요. 넌버벌 퍼포먼스라 아이들도 쉽게 이해할 수 있는 유머코드가 가득 담겨있습니다. 마지막에 포토타임도 있어서 너무 좋습니다. 못보신 분들은 한국에서 공연하는 동안 꼭 보셨음 좋겠습니다.진짜 최고!!,2022.07.09
블루맨그룹 월드투어,4,블루맨 공연,적절한 유머와 센스에 스트레스를 뻥날릴수있는 락콘서트까지 나이불문하고 즐길수있는 유일한 공연이 아닐까싶다.,2022.07.09
블루맨그룹 월드투어,5,오랜만의 공연,말 한마디 없이 이어지는 공연이라 걱정됐지만 블루맨들이 관객석 곳곳을 누비고 다니고 신나는 음악도 있고 오랜만에 재미 있었네요,2022.07.09
블루맨그룹 월드투어,5,신박하고 신나는 공연,오랜만에  실컷 웃고 박수치고 신나게 즐겼네요넘 재밌게 봣어요~~^^,2022.07.08
블루맨그룹 월드투어,3,펜티엄3,펜티엄3!!!!!!!!!!!!!!!!!,2022.07.08
블루맨그룹 월드투어,5,너무 좋은 공연,블루맨그룹 공연이 너무 좋았습니다. 강력하게 추천합니다. 자리 거의 어느데나 앉아도 상관없습니다.또한 블루맨그룹의 파란 페이스 페인트 분장 뿐만 아니라 물감 튕기면서 연주 까지도 있어서 매우 다양합니다.블루맨그룹 뿐만 아니라 니콜 패트릭도 드럼 공연이 매우 뛰어났습니다.남녀노소 상관없이 누구나 즐길수 있는 공연입니다,2022.07.08
블루맨그룹 월드투어,5,90분이 너무 짧아요.,"관람전에는 인터미션도 없고 90분동안 앉아있기 좀이 쑤실 거 같았는데, 공연중에 갑자기 불켜져서  왜 이러나 시계를 봤더니 90분 지나가있었네요.",2022.07.08
블루맨그룹 월드투어,4,유치하지만 즐거운 공연입니다!,유튭으로만 접하다 드디어 현장공연으로 마주하게 됐는데.. 처음엔 좀 당황스러웠습니다.시작은 하지않고 관객들을 놀리는데 처음 몇번은 호응도하고 재미있었습니다. 본공연전 분위기띄우려나보다했는데 그게 생각보다 너~무 길어지면서 약간 지루해지려고하는데 시작하더군요^^전체적으로 즐겁고 신나는 공연이였으나 난타연주부분이 생각보다 적어서 아쉬웠어요ㅠ그리고 개그코드?는 그냥 생각을 놓으시고(난 초딩이다..) 보시면 웃깁니다. ㅋ,2022.07.08
블루맨그룹 월드투어,5,블루맨과 함께 나도 주인공,"시작을 북소리로 마음을 두드리더니 북, 드럼, 파이프 관을 악기로 변신시키는 연주로 시종일관 다양한 상상력과 소재들을 등장시키며 마음을 훔친다. 또한 색채와 음악과 유모를 총망라하는 총체적 행위예술이 가만히 앉아있지 못하게 만든다싶었는데…  아니나 다를까.관객 중 누구라도 공연 속 주인공으로 끌어 당긴다. 3명의 블루맨은 대사 한 마디 없는 공연(넌버벌 퍼포먼스라고 한다)을 펼치면서도 관객 모두를 일으켜세운다. 좌우 화면에 붉은 빛 글자로 ‘관객공연모드#6’ 를 올린다. 아이들의 깔깔거리는 웃음소리가 번지는 가운데 관객 모두가 일어서서 한 마음으로 외치고 소리지르고 춤을 즐기게 되는 묘한 끌림이다.  정말 많이 웃고 많이 즐기며 스트레스를 확 날려버린 멋진 공연이다. 공연을 즐길 줄 아는 모든 이에게  강추하고 싶을만큼…",2022.07.06
블루맨그룹 월드투어,4,한번은 볼만하네요,여아 초등학생 3학년과 관람했습니다. 약가 무섭다고 했지만 상호작용하는 공연덕에 재미있게 관람했네요.  마지막 콘서트 형식으로 진행된 부분은 아이에게 신나는 경험이었던 것 같습니다.,2022.07.06
블루맨그룹 월드투어,5,색다른 재미와 감동,"지인추천으로 우연히 보게되었는데 정말 즐겁게 즐기다온 공연이였어요..! 블루맨 모두 사랑하는일을 하고있구나!라는 느낌에 감동받았고, 퍼포먼스와 재미까지 그리고 관객참여까지! 어느하나 빠지는 것 없이 너무 좋았습니다ㅠㅠ오랜만에 가슴벅찬 공연이였습니다:)",2022.07.06
블루맨그룹 월드투어,5,다시 봐도 넘넘 좋았던 공연! ,"코로나 시작 전에 올랜도에서 보고 신랑이랑 다시 보러가야지 다짐했던 공연이였어요 국내내한 한다고 해서 손꼽아 기다렸었는데 코로나로 지연되어 슬퍼하다 이번에 예매해서 같이 보고 왔었네요 :)  국내에서도 볼수 있게 되어 넘넘 좋았어요!! 덕분에 신랑이랑 행복한 공연 관람 하였습니다 아래에 왜 리뷰가 안좋은지 모르겠지만 다시봐도 넘넘 행복하게 만들어주는 마법같은 공연이였습니다 :) 특히나 제가 관람했을때 관객참여 하셨던 어머님아버님 때는 정말 배꼽 빠지는 줄 알았어요 ㅋㅋ 어머님 센스가 진짜 보통이 아니셨는데 두분 정말 기억에 남는 추억을 만드셨을꺼같아요! 커플을 뽑으신거같은데 , 젊은 커플이 아닌 어머님아버님이라 감동이 추가 된거 같아요!   마지막은 진짜 축제같은 분위기 속에 너무너무 좋았어요 또 가고싶어요!",2022.07.05
블루맨그룹 월드투어,5,▶말이 필요없는 환상적인 퍼포먼스 공연◀,"2022 무더위를 한 방에 날려버릴 만큼~~!!!  눈과 귀와 마음까지 모두 즐거웠던 공연이었습니다.  7살 아이와 함께 세식구가 스플래쉬zone 에서 우비 입고 관람했는데요, 신명나는 비트며, 형광 특수 페이트의 난타향연 정말 눈을 뗄 수 없이 화려하고 재밌고 신나는 공연이었어요.  공연 시작과 동시에 전광판으로 소개되어지는 에피소드들 한글 땐 7살 아이까지도 깔깔 거리면서 웃었습니다.  중간 중간 관객이 참여 할 수 있는 이벤트도 있어서~ 살짝   기대를 했지만, 기회는 오지 않았어요~  하지만, 그럼에도 불구하고 너무너무 재미있게 관람했어요. 코로나로 움추려 있었던 제 안의 본능을 깨워주기 충분한   공연 이었습니다.  신랑과 저와 아이도 함께 남녀노소 모두가 스트레스 제대로  풀 수 있었던 공연이었어요~!   포토타임도 마련해주셔서 공연도 잘 담았습니다.  아직도 아이와 자기전에 블루맨그룹 공연을 재생하면서  이야기 나누고 있어요~^^   공연장, 배우분들, 음향, 무대, 스토리 모두 잡은 공연임에 틀림이 없습니다. 왜 세계적인 공연인지 알겠더라구요~^^♡",2022.07.04
블루맨그룹 월드투어,2,음.. 아무래도 이런공연을 처음보는 분들은 만족할거같고,"무언, 표정과 행동으로 우끼는 공연.난타와 화려한 조명들이 좀 지루하고 가격이 아까웠던 느낌입니다.올드하다고 해야할까요.같이간 초등학생 딸은 오랜만의 공연이라 즐겁게 관람했습니다. 블루맨들의 행동을 어린아이들은 즐거워했어요.특별한부분이 별로 없었고 강렬한 조명과 색감 연출이시간이 지날수록 질렸어요.. 기계음, 화려한 조명연출을 줄이고 연기와 공트를 더 많이 넣었으면 좋았을것같기도..어른들은 비추,",2022.07.04
블루맨그룹 월드투어,5,블루맨그룹 짱짱 ,"더운 여름을 시원하게, 스트레스까지 날려주는 공연입니다. 관객 참여도에 따라 분위기가 달라지는듯한데요, 주말에 가니까 아이동반 가족이 많았는데살짝 어수선하긴 했지만. 괜찮았습니다.",2022.07.04
블루맨그룹 월드투어,3,생각 보다 무대가 작아요,어렸을때 내한공연 광고만 봤었는데 너무 재미 있을꺼 같아서  이번에 내한한다고 해서 기대 하고 갔는데 생각 보다 무대가 너무작고 음악이 제가 생각 했던 음악이 아니였어요 좌석은 너무 좋았어요,2022.07.04
블루맨그룹 월드투어,3,재밌어요,재밌어여,2022.07.04
블루맨그룹 월드투어,5,블루맨 월드투어 관람후기,"역시 월드클래스! 공연시간 내내 시간가는줄 모르게 웃고 즐기고 춤추고 너무 즐거운 시간이였습니다.  공연중에 사진찍는 시간이 있습니다! 공식적으로 가능해요~ 그러니까 사진 찍고싶으셔도 그 시간까지는 참아주세요~ 공연이 방해되지않게 플래시는 금지!   엄청 재밋었습니다, 블루맨들이 공연 중간중간 객석을 휘젓고 다니며 유쾌한 장난을 칩니다 제가 관람한 시간에는 수줍으신 분들이 많아서 블루맨들이 조금 당황한 느낌이였는데 그래도 즐겁고  저는 혹시 나한테도 장난치려나~? 하는 기대를 갖고 공연을 관람했답니다.   아쉬운점은 외국인 분들도 관람 하시던데 공연 관계자분들은 외국인분들께는 따로 한번더 사진 촬영관련 안내사항 얘기해줬으면 좋겠어요. 촬영허가 시간 외 공연 중에는 사진촬영 금지라고 전체적으로 안내 했지만, 공연시작부터 계속 찰칵찰칵찰칵... 공연 외적인것이 조금 아쉬웠지만 기억에남는 유쾌한 인생공연 이였어요.",2022.07.04
블루맨그룹 월드투어,4,신선한 공연,코미디쇼? 드럼쇼? 난타? 마술쇼? 를 섞어 놓은 느낌 처음 보는 공연의 유형이라 초반에는 잘못 왔나 싶었는데 후반으로 갈수록 재미있어졌습니다.  락페스티벌에서 하는 손 동작을 알려준게 기억에 남네요. 여자 드러머 엄청 멋있었고 시원하고 통쾌한 공연이었습니다. 관객 연령대가 다양했는데 좀 더 뛰놀 수 있는 분위기면 좋을 것 같아요 ㅎㅎ,2022.07.04
블루맨그룹 월드투어,5,즐거운 주말~,온가족 주말 나들이로 오랫만에 다 함께 공연 관람했습니다. 가족들이 즐기기에 개그코드가 맞았어요. 아티움 공연장 생각보다 넓지 않았지만....공연 규모가 딱 알맞다고 느껴지는~ 공연자들과 가까이 할수 있어 더 좋았던 것 같아요~. 재미있게 즐기다 왔습니다.,2022.07.04
블루맨그룹 월드투어,5,오래도록 보고 싶었던 공연!!,십년이 넘도록 보고싶었던 공연인데 역시나예요~! 요즘 자극적인 콘텐츠가 여기저기 넘쳐나지만 역시  구관이 명관~ 아이도 너무 좋아하고 관객참여 공연인데 관람객들도 적극적으로 즐기는 모습 너무 좋았어요. 오래간만에 하는 문화생활에 심장이 바운스~!!,2022.07.03
블루맨그룹 월드투어,5,와...시원한 사운드에 속이 뻥 뚫리네요,처음 다소 마스크가 생소하여 적응이안되었지만 공연이 시작되고 정말 경이로운 퍼포먼스와 웅장한 사운드에 몸까지 울리네요 ㅎㅎ 관객참여 퍼포먼스가 많은데 제가 걸리면 어쩌지하고 눈을 못 마주쳤는데 지금 와서는 못해본게 아쉽 ㅎㅎ 평생 추억 소장각!!  아이들이랑 같이 봤는데 너무좋아하네요!! 킹왕짱 강추입니다,2022.07.03
블루맨그룹 월드투어,5,넌버벌 타악 공연의 원조,"최초 공연을 시작한지 20년이 넘었는데도 여전히 흥미로운 블루맨 그룹.  아마 이번에 본 것이 20여회가 넘은 것 같은데, 공연의 내용은 여전한데 기술의 발전으로 더욱 세련되어졌네요.  스톰프와 함께 넌버벌 타악 공연의 장르를 창조한 블루맨 그룹의 공연은  지금도 신선한 재미를 선사합니다.",2022.07.03
블루맨그룹 월드투어,5,상상 그 이상의 무대!,"미국 여행을 계획하던 몇년 전, 브로드웨이에 가게되면 블루맨그룹 공연을 꼭 보라는 주변의 추천이 기억납니다. 당시 학생이었던 저에겐 만만치 않던 티켓 가격과 빡빡한 여행일정이 부담이 되어 결국 공연을 보지 못하고 돌아왔습니다. 늘 아쉬운 마음을 품고 있었는데, 이번에 세계적인 블루맨그룹이 내한공연을 온다는 소식에 망설임 없이 티켓을 예매했습니다. 블루맨 특유의 재치가 넘치는 공연 안내와 함께 유쾌하게 시작된 공연은 90분간 한치 앞을 예측할 수 없는 전개, 화려한 볼거리와 가슴을 울리는 웅장한 사운드로 가득 채워졌습니다. 블루맨 덕분에 특별한 날 소중한 사람과 함께 잊을 수 없는 추억을 만들 수 있어서 감사합니다. 모두 많이 보러 가세요!!",2022.07.03
블루맨그룹 월드투어,1,기대 이하,"나름 기대하고 관람하러 갔는데 생각했던 공연과 많이 달랐습니다. 유머코드가 맞지 않으면 지루하고 짜증나는 공연... 저는 중간에 드럽고 짜증나서 인상을 쓰기까지 했네요; 관객참여형 공연인데 관객참여를 너무 많이 시켜서 이건 뭐 공연을 보러 간건데  모르는 사람들을 놀리고 블루맨들과 노는 모습을 보러간 기분~ 가족관객이 많아서 애들이 많은 공연입니다. 확실히 시끄러워요. 공연가격 생각하면 진짜 괜히 봤다고 생각되는 공연입니다. 그나마 공연 마지막에 아예 공연을 오픈하고 사진, 동영상을 찍을수 있게 해줘서  멋진?!사진을 건질수 있습니다.",2022.07.03
블루맨그룹 월드투어,5,정말 색다른 공연이었습니다!,색다른 공연 새로운 퍼포먼스 신선한 재미! 와이프 생일을 맞아서 갔는데 이벤트를 못해줘서 아쉬웠지만 다른분들의 이벤트를 보는것 만으로도 즐거웠고 모두가 참여하는 주인공이 된듯한 공연이었습니다!,2022.07.03
블루맨그룹 월드투어,4,"9살, 15살 아들둘 같이갔는데 정말 좋아했어요!!",개그코드가 호불호가 있더고해서 살짝 걱정했는데 아이들이 정말 좋아했어요.15살 아들은 기말고사 끝나고 좀 지쳐있었는데 공연내내 아이 웃음소리들으니 저도같이 행복해지더라구요.9살아들도 오늘 힘든 치과치료해서 다운되어있었어요. 근데 공연 내내 즐거워하더라구요.공연 중간에  한번씩  이게뭐지...하는 순간도 있긴했지만  마지막까지 웃고 즐겁게 즐겼습니다. 뭔가를  재고 해석하려하는 그런 마음은 잠시 비우고 있는 그대로 그냥 즐기면 될거같아요.,2022.07.02
블루맨그룹 월드투어,5,뉴욕에 이은 2번째 관람!!!,처음 본 건 2008년 오프브로드웨이에서!!그 때와 많이 바뀌었지만 더 재밌었다. 나는 14년 늙었는데 작품은 더 파워업했네. 독특한 구성과 아이디어는 여전히 빛이 난다.아내가 보기 전에 계속 무슨 내용이냐고 물어봤는데 이걸 어떻게 설명해ㅋㅋㅋ나이 지긋하신 분들도 많고 어린 친구들도 있었고 누구나 즐길 수 있는 극이다. 이 후기를 보는 당신이 몇살이든 완전 추천,2022.07.02
블루맨그룹 월드투어,4,시간 가는 줄 몰랐던 쇼타임!,"공연 시작부터 재치있는 문구로 웃음을 터트리더니, 몸개그(?), 악기 연주, 절묘한 편집영상과 관객참여까지 ㅋㅋ 더할나위 없이 신나게 즐길 수 있는 쇼였습니다! 드럼치는 언니 멋짐폭발!!",2022.07.02
블루맨그룹 월드투어,4,색다른 공연,중간중간 살짝 루스한 부분도 있지만 전체적으로 한번 볼만 합니다. 초등 아이와 관람했는데 엄청 재밌다고 하네요. ^^ 추천합니다~,2022.07.02
블루맨그룹 월드투어,5,블루맨그룹 덕분에 행복했던 하루,특별한날 행복한 기억과 순간이되도록 해주셔서 감사합니다저에게 앞으로도 잊지못할 공연이 될것같습니다공연을 제대로 즐기고싶으신분들은2층 말고 1층으로 예매하시는것을 추천드립니다블루맨그룹 최고 ♥?,2022.07.01
블루맨그룹 월드투어,5,소리와 색과 빛의 조화,"블루맨들의 파이프 드럼, 그 다양한 소리의 질감, 그 파이프에 덧칠해지는 초록과 빨강의 빛,  또한 현실의 도화지에 직접적으로  칠해지는 색깔들. 현대적인 디스플레이에서 보여지는 다양한 표정들, 장면들, 빛과 색과 현장의 어지러움들, 조화들. 이것이 아방가르드 예술적이면서 남녀노소 공감을 불러 일으키는 힐링의 시간이었음.",2022.07.01
블루맨그룹 월드투어,5,후기 처음 남깁니다 강력추천,매번 뮤지컬만 보다가 퍼포먼스식 공연은 처음이었는데 너무 좋았어요 친구랑 가서도 즐거웠고 가족들 생각났는데 부모님도 보여드리니 정말 좋아하셨습니다! 스트레스 풀리고 즐거운 시간 보내시고 싶으신 분들 강추드립니다!,2022.07.01
블루맨그룹 월드투어,5,개그가 취향에 맞으면 재밌음,20분 늦은 관객있었는데 성대하게 놀리는게 대유잼 ㅋㅋㅋㅋㅋㅋㅋ,2022.07.01
블루맨그룹 월드투어,2,생각보다 별로...,유명하다고해서 본건데 생각보다 별로였어요 좀 지루해서 계속 시계를 봤네요,2022.07.01
블루맨그룹 월드투어,5,세상에 없던 공연,"타 공연에서 볼 수 없었던 표정,몸짓,기획센스로 감탄을 연발하며 보았습니다.  7세아이는 갑자기 불꺼지는 퍼포먼스에 무서워했지만 다음에 또 보자고 할 정도로 만족했습니다.  마음같아선 주변사람 다 보여주고 싶은 공연이었습니다.",2022.07.01
블루맨그룹 월드투어,3,"어디에서도 못 보는 공연이긴한데,,?","제가 겪은 느낌은 딱 그 정도였어요. 그냥 어디에서도 못 본 공연,,, 그 구성과 코드가 원초적인데, 까놓고 말하면 유치합니다. 본질이 그렇다고 엄청난 퀄리티와 전율적인 연출로 포장이 되어 있냐? 그것도 아닙니다. 나름 메세지와 풍자. 해학을 담아놓긴했는데, 내가 코드가 안 맞는지 수준이 낮은건지 그렇게 막 다가오지는 않더라구요.그래서 테마만 신선했고 그 내용은 너무 얉게 느껴졌습니다. 애기들은 정말 좋아할꺼 같아요. 가족들과 보기 좋은 공연",2022.06.30
블루맨그룹 월드투어,4,재밌지만 5% 부족한..,"흥 넘치고 재미는 있어요. 많이 웃고 왔지만 관객 고르러 다니는 시간이 너무 길고, 자주이고, 이 과정이 지루하네요. 악기시간도 좀 짧네요..기대이하여서 아쉬웠어요.",2022.06.30
블루맨그룹 월드투어,4,ㅎㅎ,Show가 instantly interactive한 걸 보았고 그래서 나도 distinctively reactive하게 쇼를 관람했습니다 조아용 수고하세용,2022.06.30
블루맨그룹 월드투어,5,너어무 흥이 나요!!!,애들이 무서워할까봐 2층 예약한걸 너무 후회했어요.  1층에 블루맨들이 돌아다녀서 훨씬 흥이 나더라고요~ 그래서 친구들이랑 다시 8월에 예약했네요. 또 봐도 넘 재밌을꺼 같아요!!!,2022.06.30
블루맨그룹 월드투어,5,생각보다 애들이 너무 좋아했어요!!!,좀 무서워하지 않을까. 심심하면 어쩔까 했는데… 너어무ㅜㅜㅜㅜㅜ 좋아했어요.  혹시나 해서 2층 예매했는데. 다시 8월에 친구들과 스플래쉬석으로 예매했답니다.  망설이시는 분이 계시면. 바로 예약하세요.  2층보다는 1층이 참여가 가능하고 훨씬 더 재밌어요!!,2022.06.30
블루맨그룹 월드투어,1,지루한 공연,너무 지루한 공연 이었음 왜 splash석을 구매한 고객들에게 우비를 주는지 모르겠음 1시간 28분동안 한번 물뿌림 드럼치는 여자분만 멋짐 얼리버드로 구매하였지만 너무 돈아까움 기대를 너무 많이 했나?,2022.06.30
블루맨그룹 월드투어,4,관람후기,유머코드가 저와 안 맞았는지 깔깔거리고 웃을정도는 아니었지만 엉뚱한 행동이 재밌었고 관객을 동원하여 공연한  점이 재미있었습니다. 악기가 아닌 다른 도구로 연주하는것이 신기했고 신나는 음악공연이 가장 볼만했어요,2022.06.30
블루맨그룹 월드투어,3,기대와는 조금다른,뭔가 미국공연에 큰 기대감이 있었을까요 흥이 오를만하면 애매하게 끝난다는 느낌이었어요. 참여형 공연은 좋지만 공연의 재미가 조금 덜했어요.,2022.06.29
블루맨그룹 월드투어,5,말이 필요없는 최고의 공연,10년전 라스베가스에서 강하게 남은 기억으로 오픈런 하듯 열리자마자 1열에 예약을 했습니다.무대 곳곳에 숨어있는 재미있는 요소들과 블루맨들이 대사 하나 없이 관객과 소통하며 퍼포먼스를 펼치면서 이어져 나가는 공연이 정말 즐거움을 주었습니다.올 한해 상반기에 쌓인 스트레스를 한순간에 날릴 수 있었던 좋은 공연 이였습니다!,2022.06.29
블루맨그룹 월드투어,5,참신하고 놀라운 넌버블퍼포먼스!,"미국식 유머도 그리 어색하지 않게 풀어내고, 블루맨그룹이 지향하는 3no(피부색, 머리, 언어)에 맞춰 누구나 행복하게 관람할 수 있는 최고의 쇼였습니다.",2022.06.28
블루맨그룹 월드투어,5,드디어 관람,블루맨그룸 공연은 와이프가 미국에 있을때 봤던 공연이라 이야기를 많이 들었던 공연입니다.  환경과 다양한 사회적 메시지도 전달하고 내용도 재미있고 공연을 보면서 어떤 사회적  문제를 이야기 하는지 찾아보는 것도 재미를 더합니다.   그냥 생각없이 보셔도 괜찮습니다. 그냥 드럼 소리의 즐거움을 느끼고 오셔도 됩니다.   이공연을 추천해 준 와이프에게 고마움을 전합니다.,2022.06.28
블루맨그룹 월드투어,5,관객참여공연,"관객이 함께 어울러져 참여하고 호흡하는 공연이었습니다. 가족과 연인, 친구 누구와 봐도 좋을 공연입니다  적극추천 ^^",2022.06.28
블루맨그룹 월드투어,5,멋진 퍼포먼스 공연 입니다.,가족과 함께 크게 웃으메 재미있는 시간 보냈습니다  비슷한 공연 자꾸 찾아보게 되네요... 강추.,2022.06.28
블루맨그룹 월드투어,5,순삭된 시간 환상적인 쇼,오랫동안 보고 싶었지만 볼 수 없었던 쇼를 보게 되어서 좋았습니다. 오프닝부터 신 나는 드럼 비트에 몸이 들썩거렸습니다. 관객들이 참여하는 부분들은 때로 약간 지루하게 느껴질 수도 있을 거 같습니다. 하지만 생각지도 못한 물건들로 연주를 하는 부분과 마지막에 사진 찍으며 음악에 맞춰 신나게 몸을 흔들 수 있던 부분은 정말 압권입니다. 한 시간 반이 어떻게 지나갔는지 모르겠네요. 강추입니다.,2022.06.27
블루맨그룹 월드투어,5,블루맨그룹 월드투어,"광고 보고 홀린듯이 예매했는데 탁월한 선택이었습니다.  음악도 신나고, 크코 작은 웃음 포인트도 많고. 또 보고 싶습니다:)",2022.06.27
블루맨그룹 월드투어,3,새로운 장르의 공연이었습니다_호불호가 있어요,"남편이랑 같이 봤는데, 남편은 너무 만족스러워 하더라구요. 저는 그냥 그랬습니다. 일단, 가족단위로 오신 어린이들이 많아서 약간  어린이 공연 보러온 어른 느낌이 나기도 했고. 관객 참석형 공연은 저도 선호하는 편인데  이 공연은 러닝타임이 좀더 길어야 하지 않나 했습니다. (관객 특정하는데 까지 기다리는 시간이 좀 길어서;)  개그 코드, 웃음 코드가 안맞는 분들은 별로이실수도..",2022.06.27
블루맨그룹 월드투어,4,재밌어요,좋았습니다~~,2022.06.27
블루맨그룹 월드투어,4,좋아요!!,재밌습니다.,2022.06.27
블루맨그룹 월드투어,5,굿굿굿~~,넘 잼났어요~~  8살 아들이랑 신랑이랑 신나서 뛰놀다 왔어요~ ㅋㅋ 아들이는 블루맨들 보고 첨엔 좀 무서워하더니 금방 같이 웃으면서 재미있게 보고 왔네요~  끝나고 나서도 신나서 얘기하는 아들이 보면서 뿌듯했네요~ 앞으로 아들이랑 공연 많이 보러다녀야겠어요~ ^^*,2022.06.27
블루맨그룹 월드투어,3,너무 기대를 했는지....,"전체적으로 신나고 재미있는 공연입니다.  2년 전에 예매했다가 코로나로 취소되어 엄청 아쉬웠는데,  다시 내한한다고 하여, 바로 예매하고 어제 봤어요.  오랜 기다림 때문인지... 너무 기대를 해서인지, 아쉬움이 남습니다.  다만 저희 딸은 기대를 전혀 안하고 갔는데, 너무 재미있었다고 하네요.",2022.06.27
