musical_title,rate,review_title,review_text,review_date
뮤지컬 〈브로드웨이42번가〉,5,24년만에 무대에서 다시 본 오소연 배우 주연의 브로드웨이 42번가,코로나 사태를 뚫고 한 달에 한 번은 뮤지컬 직관하기.이달은 뮤지컬 브로드웨이 42번가입니다.보신 분들 많을 것 같은데요.전 페기 소여 역을 오소연 배우 편으로 봤습니다. 키큰 다른 배우들 사이에서 밝고 앙증맞게 춤추고 연기하는 모습이 보기에 참 좋았습니다. 배역에 참 잘 어울리더군요. 이번이 세번째 출연이라 그런지 탭댄스 실력도 빼어나구요.배우에 대한 궁금증으로 검색을 해보다가 흥미로운 사실을 알게 되었습니다. 1996년에 오리지널팀이 내한해서 예술의전당 오페라극장에서 공연한 레미제라블은 우리나라 뮤지컬 공연 역사에서 신기원이 되었던 공연인데. 해외 배우들 사이에서 유일한 한국 배우로 섰던 사람이 당시 11세였던 오소연 배우였다고 합니다. 어린 코제트 역이었고 그 유명한 넘버인 Castle on a Cloud 노래를 잘 소화해 관객의 우레와 같은 박수를 받았죠. 그때 그 어린이가 이렇게 성장했군요.단발머리의 작은 몸집의 여배우가 밝은 표정으로 춤추고 노래하는 모습을 보니 제가 가장 좋아하는 미국 뮤지컬 배우인 데비 레이놀즈가 떠올랐습니다. 영화 Singing in the Rain의 히로인이죠.이렇게 뮤지컬 한 편 관람으로 행복해지는 한 주가 지나갑니다.,2020.08.08
뮤지컬 〈브로드웨이42번가〉,5,군무랑 탭댄스가 최고였어요!!,"사실 큰 기대를 안하고 엄마랑 같이 보러갔는데, 정말 재밌게 봤습니다!! 무엇보다 정말 많은 배우들과 앙상블 배우분들의 탭댄스가 미쳤어요ㅜㅜ 수많은 군무가 딱딱 맞아떨어지는데 진짜 사람들이 이런 무대를 만들수있다는게 신기할 정도더라구요 기존에 스토리나 노래중심의 뮤지컬만 봤던터라 더 인상적으로 다가왔습니다 이게 뮤지컬이다!!!를 보여주는 작품인것 같아요 엄마랑 데이트할때 자신있게 추천합니당!!",2020.08.08
뮤지컬 〈브로드웨이42번가〉,5,잘봤어요~,모처럼 혼자보는42번가...편안하게잘봤네요관객호응도가만점~~~^^,2020.08.08
뮤지컬 〈브로드웨이42번가〉,5,결국 다시 봐버렸다...,다시 봐도 가슴 두근 대고 설레는 뮤지컬입니다! 이번엔 다른 캐스트로 봤는데 대본이 조금씩 바뀌는 매력도 느낄 수 있었습니다 ㅎ 특히 도로시 브룩인 최정원님 그리고 메기 존스 홍지민님이 제일 좋았습니다! 웃음을 제일 많이 주시고 노래도 대박이었습니다. 이 뮤지컬을 꼭 봐야하는 이유: 1. 이야기 x 춤 중심의 뮤지컬: 뒷자리여도 놓지는 것 없이 즐길 수 있는 공연 2. 자연스러운 번역: 어색한 대사와 가사 없는 공연 + 한국인만 이해할 수 있는 대사 가득한 초월 번역 3. 실력있는 캐스트: 춤추면서 안정적인 노래 부르는 캐스트! 앙상블도 대단합니다 4. 신나는 탭댄스: 이 공연의 화룡점정 ㅎ  결론: 끝나기 전에 꼭 보러 가세요!!! 후회 안합니다,2020.08.08
뮤지컬 〈브로드웨이42번가〉,5,경이로움의 순간!! 잊지못할 뮤지컬~,"먼저 내용도 보기전에 평소 실력있고 탄탄한 출연진을 보고 뮤지컬을 결정했습니다. 아니나다를까 기대보다 훨씬 멋진 무대와 공연에 찬사를 보낼 수 밖에 없었습니다. 화려한 의상, 열정적인 댄스, 무대를 찢어놀듯한 가창력, 그리고 틈틈히 관객과 일치하는 무대 연출 등~ 아무튼 귀호강, 눈호강 하는 잊지 못할 뮤지컬이었습니다.",2020.08.08
뮤지컬 〈브로드웨이42번가〉,4,화려했던 뮤지컬,탭댄스를 중심으로 처음부터 끝까지 화려한 볼거리를 제공해주었어요! 솔직히 줄거리와 노래는 그냥 그렇지만 그래도 신나는 탭댄스로 두시간 즐겁게 관람했습니다 다만 아쉬운건 줄리안마쉬역의 탭댄스부분이 없다는건 조금 아쉬웠네요ㅠ 그래도 모든 배우분들이 얼마나 수고했을지 느꺄져서 감동이었습니다!^^,2020.08.08
뮤지컬 〈브로드웨이42번가〉,5,찐 감동,평소에 흥이 별로 없는 중년 관객인데 브로드웨이 42는 너무 박수를 보내서 공연이 끝난 후에는 손바닥이 아플 정도로 찐 감동...,2020.08.08
뮤지컬 〈브로드웨이42번가〉,5,굿굿,처음 본 뮤지컬이었는데 정말 좋았어요! 160분 너무 길거라고 생각했는데 단 한순간도 한눈 팔 겨를이 없이 배우들이 연기도 노래도 환상적이네요,2020.08.08
뮤지컬 〈브로드웨이42번가〉,5,눈과 귀가 대박으로 호강한 화려함과 즐거움의 극치를 제대로 보여준 작품이었다!,"24년간 흥행불패 신화의 쇼뮤지컬계의 최고봉이라는 작품의 명성에 걸맞게 단순하게 화려하고 볼거리 많은 쇼를 넘어서는 진정한 쇼뮤지컬의 장르가 무엇인지를 제대로 보여주었다. 쇼와 뮤지컬이 잘 융합되어 본 작품 첫 관람이었는데 매니아가 될 것 같다. 시간 허락하는 한 캐스팅별로 관람할 계획을 갖게 만든 흥미만점인 작품이었다.   압도적인 탭댄스와 수십명의 앙상블은 이 작품의 주요 차별화 요소인데 공연내내 즐거움과 흥의 폭발, 화려함의 극치를 제대로 관객들에게 선사하였다. 또한 그동안의 공연에서 보여준 중독성있는 넘버들은 과연 어떻게 업그레이드 되었는지 매우 궁금했는데 기대이상이었다. 일반 노래보다 춤과 어울어진 넘버들은 훨씬 중독성이 강하게 다가왔다.  스펙타클한 무대와 압도적이고 화려한 퍼포먼스의 향연이 펼쳐진 바, 어느 뮤지컬 대작에도 밀리지 않은 장연들이 연출되었으며 어떤 작품보다도 눈요기를 더 시켜준 것 같다.  열정적인 탭 댄스로 시작하여 시종일관 화려한 탭 댄스로 끝나면서 탭댄스는 이렇게 하는 거라는 표본을 보여준 것 같아 탭댄스의 매력에 빠지게 하였다.  화려하고 예쁜 무대 장치와 의상,소품을 보는 재미도 덤이었고...  무엇보다 자연의 거대한 위험에 크게 노출되어 하루 하루 불안한 삶을 살고 있는 우리에게 희망과 꿈을 갖고 끊임없이 노력하면 언젠가는 승리 할수 있다는 메시지를   연약하지만 강인한 소녀는 상징적으로 잘 표현한 것 같다,  같이 관람한 중년에 만난 멋진 여친은 과거에 본 작품을 관람하였는데, 가기 싫다는 것을 제가 설득하여 관람한 의미를 둘다 충분히 느낄 수 있는 공연이었다. 여친도 남은 공연기간내 캐스팅별로 본 작품을 같이 추가로 관람하기로 하였다.",2020.08.07
뮤지컬 〈브로드웨이42번가〉,4,스트레스 해소,신나고 즐거웠어요.홍지민씨 실력도좋지만 팬서비스에 감동받아 눈물날뻔. . .감사합니다.,2020.08.07
뮤지컬 〈브로드웨이42번가〉,5,첫 장면보고 감동의 눈물,딸과 함께 뮤지컬 첫 나들이 첫 장면보고서 둘다감동에 눈물이 났어요열심히살고서 가끔나에게 선물을 줘야겠네요,2020.08.07
뮤지컬 〈브로드웨이42번가〉,5,"탄탄한 쇼뮤지컬의 정석, 금빛 무대는 금메달감!","쇼뮤지컬의 정석인 작품입니다.  화려한 볼거리와 음악, 신나는 탭댄스가 탄탄한 스토리안에 그대로 녹아있습니다.   입체적인 캐릭터들과 화려한 캐스팅이 돋보이는 엄청난 배우들.  가족, 커플, 친구와 함께 웃을 수 있는 작품입니다. 오래된 이 뮤지컬이 어떻게 아직까지 사랑을 받는지 알수 있는 <브로드웨이 42번가>.  무대를 수놓은 금빛 물결을 보면, 금메달을 줘도 아깝지 않은 최고의 뮤지컬입니다!  환희소여배우 사랑해요~",2020.08.07
뮤지컬 〈브로드웨이42번가〉,5,어제 친구와 보고왔어요,이렇게 크고 화려한 뮤지컬을 본건 처음이었습니다. 맨 처음 탭댄스를 보는 순간 뭔가 울컥하더라구요 뮤지컬에 대해 관심이 없었고 볼줄도 몰랐었는데 어제 정말 너무 재밌게 보았습니다. 기회가 된다면 또 뮤지컬을 보러 가고싶네요. 나의 첫 웅장한 뮤지컬 ! 재밌었습니다 그리고 배우분들이 얼마나 피땀흘려 연습하셨는지 대사하나하나를 외우기 까지 얼마만큼 노력하셨는지 다는 아니지만 조금은 알겠더라구요 너무나 재밌는 공연 감사했습니다.,2020.08.07
뮤지컬 〈브로드웨이42번가〉,4,군무압권,스토리의 진부성에도 불구하고 군무는 눈과귀를 즐겁게 해준다  어린아이들도 많이 보러왔는데 ~~ 부모님모시고 오면 딱좋을 뮤지컬인듯 ~~~ 이기회에 효도를,2020.08.07
뮤지컬 〈브로드웨이42번가〉,5,화려한 군무를 보고 싶은가?,"이공연을 처음 본것은 20년 7월 24일 이었다.. 와이프와 단둘이.. 송일국, 홍지민, 배해선, 오소연.. 등등.. 송일국배우의 카리스마는 멋졌지만 지속적인 공연탓에 목소리가 쉬어서.. 살짝 아쉬웠다.. 그리고 앞자리를 무척이나 선호하는 와이프를 만족시키기 위해서 앞에서 2번째에서 봤는데..  이런!!! 이공연은 앞자리의 생생한 현동감보다는 약간 뒷자리에서 전체적인 모습을 보는것이.. 물론 앞자리도 좋다.. 배우들의 생음을 들을수 있으니... 근데 뒷자리에서 전체적인 동선, 모습들을 보고 싶었다.. 너무나도.. 그래서 와이프를 설득해서 아들 둘과 20년8월4일에 2층 맨 앞자리로 예매.. 역시~!!!  양준모의 노래실력은 역시~~!!! 정영주배우는 배해선 배우와 또다른 매력을 보였으며 각각 다른 귀여움을 보여주는 오소연 배우와 기모한희 배우의 연기를 보는것도 매우 즐거웠다. 샤롯데 공연장이 많이 크지 않아서 (예술의 전당과 비교했을때 ㅎㅎ) 뒷자리에서 전체적인 모습을 보는것도 나쁘지 않다. 벌써 탭댄스의 그 멋진 칼군무가 다시 보고싶다.",2020.08.07
뮤지컬 〈브로드웨이42번가〉,5,재미있습니당,너무 재미있게 잘 봤어용,2020.08.07
뮤지컬 〈브로드웨이42번가〉,5,너무재미있어요,매년 가서 보는데 신나고 좋아요,2020.08.07
뮤지컬 〈브로드웨이42번가〉,5,8살 아이도 즐거워할 수 있는 공연!!!,"화려한 탭댄스, 무대장치, 의상 등으로 우울한 기분을 떨쳐버리고 왔어요. 심지어 8살 아이조차 그 긴 공연을 즐거워했답니다. 기대 이상으로 흥겨웠습니다. 꼭 보시길 추천드려요^^   특히 오늘 공연 배우분들 너무 배역에 잘 맞아서, 연기보면서 많이 웃었답니다.",2020.08.07
뮤지컬 〈브로드웨이42번가〉,5,오랜만에 즐거운 공연을 봐서 너무 좋았어요,요즘 우울한 일 들의 연속이였고언니의 생일을 기념하려고 언니랑  봤는데저절로 기분도 좋아지고모든 배우들의 노력이 느껴지고즐기는 모습에 감동 받았네요공연 보고 내내 너무 행복했네요모든 배우분들께 감사하네요(다른 공연도 많이 봤지만배우분들의 노력과 열정이 많이 느껴져서 감사하고 좋았습니다)언니에게 좋은 선물이 된 것 같아서 저도너무 좋네요,2020.08.06
뮤지컬 〈브로드웨이42번가〉,5,너무 멋지고 다 좋은데 이종혁님은 대사를 너무 절어용,그만 절었으면!,2020.08.06
뮤지컬 〈브로드웨이42번가〉,5,내 얘길 한번 들어봐~,너를 부르는 브로드웨이~,2020.08.06
뮤지컬 〈브로드웨이42번가〉,5,힐링 관람 하였습니다.,"생각보다 사회적거리 두기가 어려웠던 점 빼고는,  진행하시는 분들 마스크 착용 안내에 노력해주시고 무엇보다 공연하시는 배우분들 정말 존경합니다.  지치고 힘들때 또 보고 싶어질 것 같습니다. 고맙습니javascript: CheckWriteForm()다. ^^",2020.08.06
뮤지컬 〈브로드웨이42번가〉,4,인생첫 뮤지컬인데 넘 좋았습니다.,"사전 정보 없이 많이 들어 본 뮤지컬이라 그냥 예매했어요.  시간 가는 줄 모르고 정말 재미있게 보았습니다.  다만 조금 아쉬운 부분은 이종혁님은 얼굴마담 역할인지 대사 실수가 너무 많고, 담당하는 파트도 너무 적네요.  물론 여주가 주인공이긴 하지만.. 다른 분들에 비해서 많이 쳐지는 느낌이었어요.",2020.08.06
뮤지컬 〈브로드웨이42번가〉,5,볼거리 많은 뮤지컬,탭댄스와 무용에서 배우들의 연습량을 느낄 수 있었고 무대구성이 화려하고 다양하기 때문에 보는 즐거움이 있었습니다 그에따라 처음 관람하는 부모님께서도 재밌게 관람하셨습니다,2020.08.06
뮤지컬 〈브로드웨이42번가〉,5,눈이 즐거운 기분좋은 관람이었습니다!,볼거리가 많아 즐거운 관람이었습니다. 엄마와 함께 관람했는데 엄마도 정말 멋진 무대들 덕분에 재미있었다고 주변에 적극 추천시더라구요!  주연배우들 뿐만 아니라 전 출연진들이 함께 어우러지는 무대들이 더욱 기억에 남습니다!,2020.08.06
뮤지컬 〈브로드웨이42번가〉,5,화려하고 리드미컬한 공연!!,텝댄스 공연을 본적이 없어서 어떨까하고  호기심과 설레임을 안고 공연장에 들어섰습니다~  베테랑 배우들의 무대매너가 순식간에 관객들을 몰입시켰고 화려하고 실력출중한 배우진들이 또한번 관객을 사로잡았습니다! 처음으로 뮤지컬 공연을 보는 우리 남편에게 첫 결혼기념일 선물로 보여준 뮤지컬! 너무 만족스럽고 벅찬감동이였습니다!  다른배우들 또다른 공연도 보고싶네요~,2020.08.05
뮤지컬 〈브로드웨이42번가〉,5,역시 쇼뮤지컬의 진수!!!,부모님 모시고 보기에 최적의 공연입니다! 너무나 멋진 무대와 아름다운의상 눈을 뗄수없는 환상적인 탭댄스를 볼 수 있어요. 강츄!!!,2020.08.05
뮤지컬 〈브로드웨이42번가〉,5,와우~ 화려하고 신나고!!,군무에 걸맞는 신나는 탭댄스에 화려한 무대의상까지 코로나 블루 스트레스가 날아가버렸어요!  8월 공연이 끝나기 전에 한 번 더 보고 싶네요. 좋은 작품 감사합니다~~,2020.08.05
뮤지컬 〈브로드웨이42번가〉,5,만족율 100% 아주 좋아요3,기대가 컸는데... 만족도는 더 크네요!! 괜히 관객이 많은게 아님을 다시 한번 실감!!!  막 내리기 전에 다들 관람하시면 좋을것 같아요,2020.08.05
뮤지컬 〈브로드웨이42번가〉,4,폭우가 치는날 보고온 뮤지컬,"공연은 다 좋았습니다. 출연진의 에너지도 좋았고, 탭댄스도 화려했고, 소품이랑 무대구성도 좋았습니다. 양준모씨의 솔로는 특히 감동이었습니다! 그런데 샤롯데홀 좀 낡은건 알았지만...비가 이렇게 많이 오는데 지하주차장이랑 연결 통로가 없어서 비 다 맞으면서 차까지 달려갔네요 ㅋㅋㅋ",2020.08.05
뮤지컬 〈브로드웨이42번가〉,5,브로드웨이42번가 관람후기,와이프 생일 기념으로 온 가족이 처음으로 함께 본 뮤지컬이라 더욱 뜻깊었습니다. 아직 초딩 아들은 긴 공연시간에 끝까지 완전집중은 못했지만 현란한 텝댄스는 기억에 남는다고 합니다. 주연 및 조연 모두 얼마나 연습을 많이 했는지 알 수 있었으며 정말 멋진 공연이었습니다. 다시 한 번 배우분들께 경의를 표하며.......또 공연 후 집중성 호우로 쫄딱 맞을뻔 했는데 기다리다 포기하고 차로 가는순간 거짓말처럼 그쳐서 마무리까지 넘 좋고 기억에 더 남을거 같네요!,2020.08.05
뮤지컬 〈브로드웨이42번가〉,5,"탭댄스,,,,","출연진 모두가 주인공인 뮤지컬이었어요  탭소리가 공연후에도 계속 귓가에 들립니다 역시 믿고 보는 양준모배우의  묵직함과 김환희배우의 사랑스러움에 행복했어요조금 아쉬웠던건 커튼콜때 배우들을향한 박수가 인색한 관객의  모습이,,,,,그래도 저와 옆옆자리 혼자오신 관객은꿋꿋하게  기립해서 신나게 박수치고 환호해 드렸어요 우울한 요즘 신나는 시간이었습니다",2020.08.05
뮤지컬 〈브로드웨이42번가〉,5,인생뮤지컬,진짜 관객을 사로잡은 살면서 꼭 봐야하는 뮤지컬 안보면 손해보는 뮤지컬 !,2020.08.05
뮤지컬 〈브로드웨이42번가〉,5,역시 브로드웨이42번가다! (재관람 후기),"브로드웨이42번가를 워낙 좋아하는지라 매 시즌마다 찾곤 하는데 지난번에는 제가 좋아하는 이종혁 줄리안 마쉬-오소연 페기소여로 관람을 했고, 이번에는 이번 시즌에 처음으로 들어온 배우님들을 본다는 의미에서 양준모 줄리안 마쉬-서경수 빌리-김환희 페기 페어로 관람을 했네요.  역시 브로드웨이42번가는 브로드웨이42번가다 라고 할 만큼 경쾌하면서도 흥겨운 리듬의 향연과 화려한 볼거리 배우분들의 연기와 노래까지 흠잡을 때가 없는 공연이네요.  이제 종료까지 얼마 남지 않아 아쉽지만, 다음 시즌에 더 멋진 모습으로 또 우리 곁으로 돌아오기 바랍니다.",2020.08.05
뮤지컬 〈브로드웨이42번가〉,5,볼 때마다 신나요!,이번이 다섯번째 관람이었는데도 볼 때마다 신나요. 탭댄스는 정말 매력적인 것 같아요. 첫 장면에서 탭댄스를 추는 배우들의 현란한 발 군무는 제 심장을 두근거리게 해요. 배우분들이 얼마나 힘들게 연습했을지...정말 감동적이기까지 합니다. 발목에 파스를 붙여주고 싶은 마음이 굴뚝 같아요^^ 이 뮤지컬은 정말 앙상블 배우분들까지 모두 소중해요. 막공까지 모두 부상없이 홧팅!! 정말 응원합니다.,2020.08.05
뮤지컬 〈브로드웨이42번가〉,5,잘봤습니다.,잘봤습니다.,2020.08.05
뮤지컬 〈브로드웨이42번가〉,5,잘봤습니다.,잘봤습니다.,2020.08.05
뮤지컬 〈브로드웨이42번가〉,5,경쾌한 탭소리가 시원했어요,페기가 성장하는 모습도 좋았고 그런 페기를 옆에서 지켜봐주는 빌리도 멋있었어요 무대가 화려해서 볼거리가 많아서 좋았습니다,2020.08.05
뮤지컬 〈브로드웨이42번가〉,4,눈요깃거리가 많았던 뮤지컬!,"뮤지컬계에서 유명하신 배우분들이 많이 나오신다고 하시구 탭댄스를 주제로 한 뮤지컬이라기에 궁금해서 보고왔어요!!이 극을 통해 김환희 배우님을 새로 알게 되어 너무 영광이에요 ㅠㅠ 정말 지켜주고 싶은 캐릭터엿어요 ㅠㅠ 흐엉 탭도 잘하시고 노래도 잘하시고 ㅠㅠ 대체 부족한게 뭔가요 배우님 ㅠㅠ그리고 홍지민 배우님 완전 감초역할 너무 귀여우셨어요!! 다른 뮤지컬에서도 꼭꼭 만났으면 좋겠어요!!! 브로드웨이 42번가는 정말 볼 것도 많고, 앙상블 배우분들이 한분한분 눈에 띄는 뮤지컬이더라구요! 앙상블 한분한분에 이름을 입히고 표현하는 뮤지컬은 제가 지금까지 본 것 중에서 렌트?정도? 그래서 더 의미있는 뮤지컬이었던 것 같아요!!다만 뮤지컬에서 아쉬웠던 건 표현이 너~무 과감해요!! 의상도 동작이나 대사에서의 표현도! 중간중간 웃기긴 했지만 가끔은 이렇게까지 표현한다고? 싶었던 장면들도 있었거든요..ㅠ 이날따라 어린 관객이 많었는데 조금 신경이 쓰이더라구요~그래도 성인인 저는 재미있게 보고 나왔습니다!!ㅋㅋㅋㅋㅋ",2020.08.05
