musical_title,rate,review_title,review_text,review_date
뮤지컬 〈보디가드〉,5,콘서트같은 뮤지컬,"보는  맛, 듣는 맛이  살아있는 뮤지컬이었습니다.",2020.01.10
뮤지컬 〈보디가드〉,2,음... 저는 초대로 봤는데요,뮤지컬 조아하는데  지인의 초대로 9일 공연을 보게됐습니다. 일단 많이 실망스러웠어요 배우들이 노래는 잘했지만 음향이 뭔가 계속 부족한 느낌? 프랭크 연기도 아쉽고 대사 전달도 그렇고 아무래도 연기자들이다보니 많이 아쉽더라구요. 1부 내내 듣는데 이거뭐지? 소리왜이러지 시작도 음향문제땜에 늦게 시작했는데 공연 내내 뭔가 듣는데 거슬리고 배우들 모두 노래부르기 보단 레이첼위에 기대어 가는 공연이라 지루함도 있고 영화가 워낙 어렷을때 스치듯 봤지만 음악을 좋아했어서 기대했는데 공연중에 실수가 많이 보여서 안타까웠네요.  비싼 금액을 지불하고 볼 계획을 하신다면 많이 생각해 보시고  결정하시는게 후회가 없으실거 같아서 들어와서 적어봅니다.,2020.01.10
뮤지컬 〈보디가드〉,2,졸작입니다.,원작자체가 스토리 개판인데도 불구하고 흥행을 했던지라 뮤지컬도 똑같이 스토리가 단순합니다. 노래는 한국어 영어 다 섞어서 불러서 전혀 몰입이 안됩니다. 평점 9점이 상당히 의아합니다. 뮤지컬 팬들은 만족하는 기준이 굉장히 후한가봐요..,2020.01.10
뮤지컬 〈보디가드〉,4,해나의 원맨쇼 뮤지컬 보디가드,내생애 첫번째 뮤지컬 보디가드를 보러 대구에서 서울로 4시간을 열심히 달려 왔다. 너무 좋았고 고교생 딸래미랑 함께여서 더 좋았다. 앞으로 점점 발전하는 뮤지컬여배우가 되길 진심으로 소망한다. 이해나 화이팅!,2020.01.10
뮤지컬 〈보디가드〉,4,레이첼,"레이첼의 노래엔 기대이하였다. 그외 무대,연기,음악은 감동적이라서 많이 즐겼음",2020.01.09
뮤지컬 〈보디가드〉,4,레이첼,레이첼(김선영)의 노래엔 다소 실망.낮공연이라서 그랬나? 별로 감동을 주지 못했음. 차라리 언니의 성량이 더 좋았고 감미로왔음. 신문에의 평과 다르게 무대는 크지는 않았지만 아주 변화 무쌍하며 나무랄때 없었고 그외 출연진의 연기들엔 만족.,2020.01.09
뮤지컬 〈보디가드〉,4,원작도 원곡도 잘 모르고 갔었는데,너무 잘 즐기고 왔습니다! 쇼무대도 이야기도 다 재밌었어요,2020.01.09
뮤지컬 〈보디가드〉,4,공연 즐겁게 잘 봤어요,가창력하면 손승연이라 일부러 손승연 출연날을 예매해 다녀왔어요. 공연이 시작하면서 예전에 보았던 영화의 장면과 노래들을 떠오리며 참 좋았네요. 저는 손승연씨의 공연을 처음보는거라 연기를 기대 안했는데 잘하시더라구요 휘트니(레이첼)역을 잘 소화하시며 노래를 너무 잘하셔서 즐겁게 잘 봤습니다. 레이철의 언니 역을 맡은 최현선씨도 손승연씨 못지않게 노래를 잘하셨답니다.  공연내내 나오는 익숙한 노래들에 절로 고개가 끄덕여지고 중간중각 시각효과도 적절히 잘 나왔고 무대 효과도 좋았답니다.  *뮤지컬 배우가 아닌 가수로서의 손승연씨를 보고 싶어지는 공연이었답니다.,2020.01.09
뮤지컬 〈보디가드〉,5,엘아센ㅠㅜ,음향이 김선영배우를 감당을 못함ㅠㅠ 아역 춤 진짜 잘추구요ㅋ,2020.01.09
뮤지컬 〈보디가드〉,5,손승연 레이철 최고입니다. 국내 탑 가수의 뮤지컬 공연..,"뮤지컬을 여러번 보았는데~ 보디가드는 타 뮤지컬처럼 앙상블의 화려한 무대는 없지만  국내 최고의 가수 손승연님께서 멋진 노래와 무대를 하시는것만 보아도 돈 안아깝고 단연 최고입니다.  생각보다 연기도 잘하셔서 놀랬습니다.  손승연님의 노래는 진짜 말해 뭐해..??? 귀 호강 잘하고 왔고, 기회되면 재관람하고 싶네요^^   커튼콜도 아주 좋았습니다~~! 저는 추천드립니다.",2020.01.09
뮤지컬 〈보디가드〉,5,저번에 양파 껄로 보고 이번에 김선영 껄로 봤는데,두분 다 잘하지만 김선영씨의 공연이 더 좋았습니다. 김선영씨가 어떻게 팝을 소화해낼지 궁금했는데 노래 들으면서 몇번 소름 돋았어요. 보디가드 별로 재미없을것 같지만 보시면 생각보다 훨씬 재밌는 뮤지컬입니다. 꼭 보시길 추천드립니다.,2020.01.09
뮤지컬 〈보디가드〉,5,보길 너무 잘했다!!!,"초연에 못본 아쉬움에 재연만을 기다렸는데 어제 승연레이첼로 보고왔어요. 노래 잘하는거야 당연히 알고 있었는데 연기도 잘하셔요ㅠㅠ 다른 작품에서도 만날 수 있으면 좋겠어요. 시작부터 한명,한명 눈을 뗄 수 없는 파워풀한 앙상블의 모습에 공연장이 후끈후끈!! 뮤지컬과 콘서트를 동시에 보고 온 기분입니다. 막공이 오기전에 친구들 데리고 한번 더 즐기고 싶어요.  제 탁월한 선택을 칭찬합니다^.~",2020.01.09
뮤지컬 〈보디가드〉,4,잠깐 동백이 생각이 났어요,"레이첼과 니키, 자매와 레이첼의 아들 프레쳐가 살아가고, 살아남는 이야기의 뒤에. 이 여자들과 아이를 지키고 지켜낸 프랭크가 있어요. 주요 넘버는 레이첼, 니키, 프레쳐에 몰려있고, 이들의 재능을 지켜보며 행복을 느끼면서, 이들이 꼭 오래도록 살아남아 더 노래했으면 좋겠다고 기도하게 되어요. 프랭크도 비슷한 마음이었을 것 같고. 그렇게 마음이 모이는 이야기에, 훌륭한 사운드, 장면과 캐릭터를 드러내기에 적절한 무대장치. 볼만한 공연이었습니다. 스토커 역 배우도 호연이었고, 연극적 느낌이 잘 살아있더라구요. 다만 쇼뮤라기엔 연극적이고, 연극이라기엔 쇼뮤라서, 꼭 기대했던 걸 본 느낌은 아니에요. 그래도 배우들의 호연에 마음이 따뜻해지고, 각 넘버들, 커튼콜은 너무나 신났어요. 입장하시기 전에 MD부스에서 야광봉을 구입해 들어가시는 걸 추천합니다.",2020.01.09
뮤지컬 〈보디가드〉,5,유튜브 짤 보고 생각보다 너무 별로면 어떡하지 걱정했는데,아닙니다. 익숙한노래들이고 보컬도 출중해서 보는내내 즐거웠습니다.  무대효과도 저거는 도대체 어떻게 한건가 싶게 신기한것도 있고(연기에다가 그림자 쏘는거)  다른 관람후기에 스토리가 별볼일 없다는 말들이 좀 있어서 걱정했는데 그렇게 구리진 않았어요  사실 이 뮤지컬은 스토리보러 가는게 아니져. 걍 90년대 팝의 향수를 느끼러 가는거져  그점에 있어서는 후회 없습니다! 추천!  공연내내 노래를 하는 사람은 여주인공하고 여주언니밖에 없음.  남주는 별로 하는게 없어보임. 노동한만큼 페이를 준다면 일당 10만원만 줘야댐.   이동건은 잘생기고 비율이 좋아서 외모점수를 더 줘서 5만원 더 15만원 줘야댐.  그만큼 하는게 없네요 썩어문드러진 웬다이아 잘 들었습니다.(물론 극중역할때문에 일부러 못부른거 알아요)  암튼 보는동안은 바보같이 입벌리고 우와~하면서 너무 재밌게 봤어요! 추천합니다,2020.01.09
뮤지컬 〈보디가드〉,5,배우들이 무대를 뒤집어놓으셨다!,소리벗고 팬티질러~~~~!  방송국에서 문화현장 취재를 위해 갔었는데 카메라 촬영하면서 노래를 듣자니 몸이 근질거려 죽는 줄 알았어요. 결국 제 돈 주고 티켓을 구매해서 보러왔습니다! 하이라이트만 볼 때보다 더 소름이 끼치는 무대입니다. 폭발적인 가창력과 배우들의 연기는 단연 최고이고요. 아역배우 실력에도 감탄하고 갑니당!,2020.01.09
뮤지컬 〈보디가드〉,5,3년만에 다시 관람,역쉬 보디가드~~ 폭발적인 가창력으로 감동 2배♡커튼콜땐 모든 관객들 다 일어나 신나게 즐김!!,2020.01.09
뮤지컬 〈보디가드〉,1,관람오기전 깨끗이 좀!!!!!,일주일만에  이번엔 손승연 보러 감급하게 예매한거라 원하는 자리가 아니였지만다행히 공연전 도착하여 기분좋게 자리에 앉는순간...냄새  진동ㅠ으악 웬 악취??? 문화생활 다닐 정도의 여유이면  좀  씻고 다니고 옷도 좀 빨아입고 다녀야지냄새때문에 계속 코를 막고 관람함!! 이건 완전 1시간반 내내  민폐!!! 공연에 집중할수가 없었음!?!?! 그리고 본인이 과체중이면 양심껏 뒷자리로 예매하든지시야 가리고 악취풍기고...도대체 왜  온건지!!! 담부턴 마스크랑 탈취제 필수템 해야 겠음!!내자리근처는 뭐 복불복이니  오늘은 똥밟은걸로!!!!그나마  손승연 가창력 덕분에 돈은 안아까웠음~^^,2020.01.09
뮤지컬 〈보디가드〉,5,소름끼치는 140분!!! 출연진의 열정과 팀웍이 고스란히 느껴지는 무대 ♥♥♥,"휘트니 휴스턴의 팬이자 손승연님 팬인 나!!! 탑밴드 시절부터 보이스코리아를 거쳐 불후의 명곡까지 늘 온라인으로만 응원을 하던 중 보디가드 제작 발표회를 보고 기억에 담아뒀다가 캐스팅에 맞춰서 예매를 했다. 무려 15곡의 넘버를 부른다는데 내손이 저절로 움직일밖에. 뮤지컬 좀 봤다는 지인은 다른 날의 공연을 추천했지만.....비디오스타에서 손승연님이 하는 얘기를 듣고 믿고 있었다. 분명 좋을 것이라고~~그래서 사실 다른 캐스트는 신경쓰지 않고 있었다. 하지만!!!! 공연은 나의 예상을 뛰어넘었다. 물론 손승연님은 말할 것도 없고 프랭크역의 이동건님, 니키 마론역 최현선 배우님의 소름끼치는 연기와 노래, 사이역 최현중 배우님의 유머러스한 연기, 빌역 한동규 배우님의 원숙한 연기, 스토커역 이율님의 대사 한마디 없이 소름끼치는 연기, 레이역 김대령 배우님의  적재적소에 들어오는 연기, 플레쳐역 홍승연 배우의 탄탄한 발성과 능청스런 연기, 토니역 전재현님의 감초같은 연기, 앙상블 여러분의 연기와 춤까지 너무나 만족스러웠다. 더구나 댄싱9 때 열렬히 응원했던 손이현님의 등장은 마치 선물과도 같았다. 제발 이번 공연에서는 다치는 일 없이 무사히 마치시길...연출도 음악도 영화에서는 볼 수 없었던, 무대를 통해서만 느낄 수 있는 생동감이 내 심장을 더욱 뛰게 했다. 커튼콜도 너무나 유쾌했고~~~~물론 손승연님 연기에 민족하지 못하는 분들도 있을거라고 생각한다. 하지만 그동안의 땀과 눈물이 고스란히 느껴지는 무대를 보고있자니 그저 온마음을 다해 응원할 수 밖에......더불어 다른 캐스트 공연도 궁금해졌다. 이 부분을 다른 배우님들은 어떻게 표현할까.....아무래도 내일의 내가 취켓팅에 혈안이 된 모습이 눈에 아른거린다.",2020.01.09
뮤지컬 〈보디가드〉,3,보디가드,신문에의 평과 반대로 무대는 나름 다양하고 아름다웠음.그러나 주인공 레이첼의 노래실력에 좀 실망...이동근과 그외의 배우들의 연기력은 좋았음.,2020.01.08
뮤지컬 〈보디가드〉,4,오프닝!!!,오프닝과 엔딩 커튼콜이 젤멋있고 신나고 재밌었어요~~~!!!,2020.01.08
뮤지컬 〈보디가드〉,5,한 번더 보고 싶은 보디가드,엄마와 함께 보러갔는데 집에 오면서 여운이 계속 남아있어서 한 번더 보러 오고 싶다고 생각이 들었다. 이동건 배우가 정말 멋있었고 노래가 웅장하고 신이 나는 음악이어서 재미있었다. 노래도 계속 기억이 났고 아깝지 않은 금액이었다.,2020.01.08
뮤지컬 〈보디가드〉,5,재미있게 보고 왔습니다.,"배우들의 노래와 연기도 좋았고, 콘서트 같은 느낌의 뮤지컬 공연이었습니다. 덕분에 즐거운 문화생활을 하고 왔네요.",2020.01.08
뮤지컬 〈보디가드〉,5,박기영 재발견,가수 박기영의 새로운 모습을 보게되어 즐거운 하루 였습니다. 박기영 화이팅~~! 이동건 슈트발 장난아님.ㅋㅋ,2020.01.08
뮤지컬 〈보디가드〉,5,재밌어요!!!!,화려한 오프닝부터 무대효과 넘 좋았어요. 배우분들 노래도 잘하시고.... 연기도 최고최고!!!! 강력 추천합니다!!,2020.01.08
뮤지컬 〈보디가드〉,5,다시 보고싶은 보디가드~^^,뮤지컬은 잘 접하지 못했지만 이번 기회에 계속 보고 싶은 충동이 생겼습니다.,2020.01.08
뮤지컬 〈보디가드〉,5,보디가드,"주인공 가창력은 기대이상이다. 이동건은 비주얼 담당,박기영은 가창력은 굿~~",2020.01.08
뮤지컬 〈보디가드〉,5,박기영 목소리로 휘트니휴스턴을 부활시킴,오늘 공연 보고 왔는데 아직도 가슴이 뜁니다.하이라이트 곡..은 라이브가 진짜 감동.공연 진짜 재밌어요.추천해드려요.. 또 보고싶다..♥?♥?,2020.01.07
뮤지컬 〈보디가드〉,5,"여왕 레이첼, 여왕 김선영",감동적인 극이었습니다.마치 단독 콘서트 같기도 했습니다.1인 콘서트 같기도 하면서도레이첼의 감정을 그대로 표현할 수 있는 분이 몇이나 있을까요?,2020.01.07
뮤지컬 〈보디가드〉,5,역시 뮤지컬 <보디가드>,"남자친구와 처음 보는 뮤지컬이라 어떤 공연을 볼까 고민하다 선택했던 뮤지컬<보디가드>. 손승연 님을 좋아해서 뮤지컬<보디가드>을 골랐지만, 김선영배우님과 정대희배우님의 호소력 짙은 목소리, 강경준배우님과 조연배우들의 개성 있는 연기 및 감정 전달까지 관람 내내 감동적이였습니다. 한 곡 한곡 파워풀한 가창력이 좋았던 공연이어서 몇 번이나 소름돋고 눈과 귀가 호강했네요~ 아직도 목소리가 계속 귓가에 맴도는 거 같네요, 최고의 공연 잊지 않겠습니다! 승승장구하세요^-^",2020.01.07
뮤지컬 〈보디가드〉,5,휘트니휘스턴의 명곡에 손승연의 명품 보컬을 끼얹음!!,"손승연 배우의 목소리가 휘트니휘스턴의 노래에 너무 잘 어울렸던것 같아요.  원곡이 너무 잘 알려진 곡들이라서 개사 한 부분이 조금 어색한 부분도 있었지만, 손승연 배우의 화려한 보컬 덕에 공연에 잘 집중 할 수 있었습니다.  휘트니휘스턴의 노래를 좋아하시는 분들이라면 뮤지컬? 콘서트? 같은 기분으로 즐기실 수 있을 것 같아요~",2020.01.07
뮤지컬 〈보디가드〉,5,손승연 최고,연기도 좋았고 무대연출도 좋았어요,2020.01.07
뮤지컬 〈보디가드〉,3,공연관람후기,여 주인공의 노래는 좋았으나 보디가드역인 상대역이 전혀 노래없이 진행하다보니 타 뮤지칼보다 재미가  반감되었습니다.,2020.01.07
뮤지컬 〈보디가드〉,5,보고싶어요~기대해봅니다~!!,보고싶어요~기대해봅니다~!!,2020.01.07
뮤지컬 〈보디가드〉,4,재밌었습니다.,뮤지컬은 첨보는거라 신랑이랑 기대많이하구갔습니다.영화두 솔직히 안봐서 조금 걱정은했는데 걱정을 왜했나싶을정도로 역시 노래실력이며 배우들 연기력 무대연출력 정말 멋있었습니다.저희부부는 완전만족 기회가된다면 또한번 보고싶어요.박기영님 넘이쁘구 노래짱입니다.언니역할하신 배우분두 노래짱이구요.정말좋았던 뮤지컬이었습니다.,2020.01.07
뮤지컬 〈보디가드〉,2,보디가드 후기,생각보다 실망스러웠어요 ㅠ 뮤지컬이란 느낌보다는 팝가수 콘서트같아서.. ㅠ  뮤지컬 발성의 노래가 극의 상황전달이나 몰입도를 높여주는데 노래는 엄청 잘부르셨지만 너무 팝가수소울로만 부르셔서.. 아쉬윘어요 ㅠ재미나 몰입도도 떨어지고..ㅠ,2020.01.07
뮤지컬 〈보디가드〉,4,동건프랭크님~ 눈호강 했네요^^,승연레이첼님도~ 시원시원한 노래 들려줘 고맙구요~♡ 영화를 다시 보고싶게 해서...다시보기 했네요. 다음 시즌은 프랭크 노래씬 꼭 몇개...들어가면 좋겠어요. 자세한후기는~아래!^^https://m.blog.naver.com/PostView.nhn?blogId=ifsally&logNo=221761916932&afterWebWrite=true,2020.01.07
뮤지컬 〈보디가드〉,5,보디가드,좋았어요~,2020.01.06
뮤지컬 〈보디가드〉,2,생각보다 별로,기대이하였어요... 스토리도 엉성하고.. 연기도 오글거리고.. 노래는 좋았습니다,2020.01.06
뮤지컬 〈보디가드〉,5,뮤지컬 보디가드,김선여어어어어엉!!,2020.01.06
뮤지컬 〈보디가드〉,5,보고싶어요~기대되는 공연입니다~,보고싶어요~기대되는 공연입니다~,2020.01.06
뮤지컬 〈보디가드〉,5,재밌어요!,잘 봤습니다~,2020.01.06
뮤지컬 〈보디가드〉,1,부모님이 못 보셨대요 ..,제가 여행가면서 연말에 보여드릴려고 예매해서 드렸는데 예매자를 잘 못 말씀하셔서 못 보셨대요 ..헛걸음에 환불도 안되서 너무 속상합니다 ..,2020.01.06
뮤지컬 〈보디가드〉,4,손승연 목소리 실물 영접,진짜 명품 보컬입니다! 대박!!,2020.01.06
뮤지컬 〈보디가드〉,3,그럭저럭볼만해요,그런데 노래가 자꾸 원곡이 생각나서;;;;;;그냥 휘트니휴스턴 노래는 원곡그대로 불렀으면 어땠을까싶네요.집에와서 보디가드영화 한번 더봤네요.그리고 뮤지컬인데 가수가 주인공인 연극을보는 느낌이 강하네요.뮤지컬에서 노래부르는 사람이 딱2명;;;;;;,2020.01.06
뮤지컬 〈보디가드〉,4,성량최고~,손승연님 주연으로 관람했는데 정말 온몸에서 소리가 나오는 것 같았어요^^,2020.01.06
뮤지컬 〈보디가드〉,4,너무 좋았어요,손승연의 가창실력이 돋보이는 좋은 공연 이었습니다.,2020.01.06
뮤지컬 〈보디가드〉,5,생애 첫 뮤지컬이었어요,지방에 살아서 뮤지컬에 관심없다가 서울에 갈 일이 생겨서 뮤지컬 한 번 보고싶은 마음에 예매했어요! 무대연출 진짜 신기하고 대단했어요! 배우분들 연기도 좋고 특히 손승연님 노래 정말 잘하시더라구요! 아들 역의 배우분도 너무 귀엽고 좋았어요! 처음 본 뮤지컬인데 기억에 오래 남을 것 같아요,2020.01.06
뮤지컬 〈보디가드〉,4,좋았어요,덕분에 친구랑 좋은 추억 만들고 왔어요~ㅎㅎ 이동건 배우님의 노래도 들어보고 싶었는데 그 점은 아쉽ㅠ_ㅠ,2020.01.06
뮤지컬 〈보디가드〉,2,여주인공 노래실력이...,"주연 박기영씨로 되어있길래, 가수는 그래도 기본이 되어있곘지 하고 4인가족이서 관람을했는데, 성량도 딸리고, 가사전달도 전혀 안되고 몰입하기가 힘들었습니다. 언니 니키역이 훨씬 노래를 잘하더군요 보디가드 내용은 괜찮은데, 주연 캐스팅을 보고 결정하심이 좋겠습니다.",2020.01.06
뮤지컬 〈보디가드〉,5,이것은 뮤지컬인가 영화인가. 말 그대로 최고의 뮤지컬.,뮤지컬인지 영화인지 헷갈릴 정도의 몰입감이 있었으며 말 그대로 최고의 뮤지컬이었습니다. 영화로도 나왔다고 하지만 본 적이 없었기 때문에 내용 이해가 되지 않을까 하는 걱정이 되었지만 그럴 걱정 없이 이해도가 100프로였습니다.소름돋는 연기와 노래.그리고 연출까지 모든 것이 완벽했고 그 자체였습니다.니키마론의 슬픈 짝사랑과 짝사랑으로 인한 표정연기가 제 마음에 사로잡혔었고 저도 모르게 역할에 심취 했던 것 같습니다.그리고 레이첼마론을 사랑했던 사이코의 소름끼치는 연기력. 연기와 연출력으로 봤을 때 온몸이 닭살이 돋았던 것이 느껴졌습니다.주인공 이야기로 넘어가자면 레이첼마론의 시크하면서도 서투른 사랑방식도 웃음 포인트가 되었습니다. 그녀를 사랑하던 프랭크. 그 또한 인상깊었습니다.평소에 봤던 뮤지컬은 아이가 등장하지 않았기 때문에 보디가드 뮤지컬은 더 더욱 즐거움을 더했던 것 같습니다.가창력 뿐만 아니라 연기력과 연출력 또한 완벽했기에 기회가 된다면 재관람 하고싶어지는 뮤지컬입니다:),2020.01.06
뮤지컬 〈보디가드〉,5,최고의 페어,최고의 페어에 푹 빠졌습니다,2020.01.06
뮤지컬 〈보디가드〉,5,신나는 공연!,배우님들의 노래를 듣고 있으면 속이 뻥 뚫리는 기분이에요. 잘 봤습니다. 감사합니다~,2020.01.06
뮤지컬 〈보디가드〉,5,커튼콜이랑 앵콜이 너무 신나요!,막 몸이 들썩들썩합니다. 무대 위 배우분들 행복해보여서 보기 좋아요!,2020.01.06
뮤지컬 〈보디가드〉,5,깊어지는 감정들,점점 깊어지는 배우님들의 감정에 감탄하며 봤습니다. 감사합니다.,2020.01.06
뮤지컬 〈보디가드〉,5,새해 첫날 보디가드와 함께!,새해 첫날 보디가드 보니 뭔가 힘과 행복을 가득받은 기분이에요. 익숙한 노래들을 멋진 배우님들 통해서 직접 들을 수 있어서 참 좋았습니다.,2020.01.06
뮤지컬 〈보디가드〉,4,아니 생각보다 재밌잖아!,의외로 재밌어서 놀램 시간이 슈루룩 지나가요,2020.01.06
뮤지컬 〈보디가드〉,5,잼나게 보고온 보디가드,호프이후로 오랫만에 만난 김선영배우님♡역시나 무대장악하는 파워 짱짱!!아역하고의 케미도 쵝오였네요~♡이율배우의 스토커연기는..... 말그대로 소오오오름~~~ 넘 잘보고 왔습니다^^,2020.01.06
뮤지컬 〈보디가드〉,5,김선영 배우의 내공이 돋보이던,레이첼이 가수뿐만 아니라 한 아이의 엄마로서 느끼는 감정들이 따뜻했고 언니 니키에게 느끼는 감정도 맘이 아팠습니다,2020.01.06
뮤지컬 〈보디가드〉,5,새해 첫날의 신나는 공연,2020년 새해 첫날을 보디가드와 함께 해서 더 힘나고 즐거웠습니다,2020.01.06
뮤지컬 〈보디가드〉,5,즐거운 공연,공연의 넘버들 무대연출들 다 멋지지만 특히 커튼콜이 넘 신나서 즐겁습니다,2020.01.06
뮤지컬 〈보디가드〉,5,원작을 안 봐도 충분히 재밌다.,"원작인 영화가 너무나 유명하지만 본 적이 없습니다. 그래서 비교를 할 수는 없지만 뮤지컬만을 놓고 봤을 땐 굉장히 대만족이었습니다. 정말 공연을 보는듯한 화려한 연출, 설명이 필요없는 배우들의 연기와 노래.영화를 안 봐 뮤지컬을 볼까 망설였는데 안 봤으면 후회할 뻔 했어요. 커튼콜까지 신나는 보디가드. 돌아가는 발걸음이 아쉬웠습니다.",2020.01.06
뮤지컬 〈보디가드〉,5,굿,최고에요,2020.01.06
뮤지컬 〈보디가드〉,5,보디가드,재밌어요!!!! 노래 좋아요!!!!!,2020.01.06
뮤지컬 〈보디가드〉,5,음악도 좋고 배우도 좋고!!!,주인공 노래를 이렇게 원없이 라이브로 들을 수 있다니 진짜 귀정화 제대로 함,2020.01.06
뮤지컬 〈보디가드〉,5,최고였어요,최고였습니다!! 김선영배우님 최고였고 다른 배우분들도 정말 좋았습니다! 재밌었어요!,2020.01.06
뮤지컬 〈보디가드〉,5,재미있었습니다!,최고였습니다!! 김선영배우님 최고였고 다른 배우분들도 정말 좋았습니다! 재밌었어요!,2020.01.06
뮤지컬 〈보디가드〉,5,손레이첼,오늘도 천장을 뚫는 성량,2020.01.05
뮤지컬 〈보디가드〉,5,뮤지컬 보디가드  박기영 & 이동건 출연,"2020년 1월 4일 토 요일 ...  문화생활 하기가 이렇해 힘든줄 몰랐습니다 ...  서울살다가 화성으로 이사오면 문화생활 을 많이 할것 같았는데 ...  한달이 뭡니까 , 1년에 영화 한편 보는것도 겨우 보고 있으니 ...  그런데 지인분의 초대로 , 세상에 뮤지컬 을 그것도 제가 좋아하는 ...  가수 박기영 님 과 배우 이동건 의 출연인 보디가드 입니다 ~~~  오랜만에 봐서 이기도 하지만 , 보디가드 뮤지컬 은 한편의 콘서트 같아서 너무너무 좋았습니다 ...&#8203;  원래 노래잘하는 걸 알았지만 , 오늘  레이첼 마론의 박기영 의 노래는 예술이었습니다 ... &#8203;  그리고 , 연기를 잘하고 사람좋아 보이는 이동건 의 프랭크 파머 역활은 첫 뮤지컬 이라는게 , &#8203;  믿기지 않을정도로 차분하고 , 손짓 , 몸짓 , 눈빛으로 집중하게 만들었습니다 ...&#8203;  2020년 에는 길빈맘 과 문화생활 을 자주 해야 겠다는 생각을 했습니다 ...   https://blog.naver.com/eocrfdm/221760921728",2020.01.05
