musical_title,rate,review_title,review_text,review_date
뮤지컬 〈보디가드〉,5,명곡과 명배우들의 향연,"이동건, 손승연 캐스팅 관람 했습니다. 명곡들의 향연으로 세대차이가 있는 사촌동생들도 너무 좋아하네요 오늘부터 보디가드 팬이랍니다. 적극 추천 합니다.",2019.12.16
뮤지컬 〈보디가드〉,5,보디가드,스토커로 나오시는 분 잠깐 나오는데 연기 너무 잘해서 반했습니다.,2019.12.16
뮤지컬 〈보디가드〉,5,김선영 이동건 캐스팅,"직장동료들과 송년회로 관람했습니다 티켓팅에 운좋게 성공해서 앞에서 3번째줄 중앙쪽 로얄석에서 관람해서 감동이 더 크게 느껴졌습니다. 후기에서 음향문제가 좀 있었다는 이야기에 걱정이 되기도 했지만, 제가 관람했을때는 특별한문제가 없는듯하여 멋진공연 잘 보았습니다. 다만 뮤지컬에서 남자주인공의 노래가 없는것은 좀 아쉬웠습니다. 이동건 배우의 노래도 궁금했는데, 커튼콜에서라도 잠깐 보여줬으면 하는 아쉬움이 있네요 그래도 연말을 좋은 공연과함께 마무리할수 있었던것 같아 행복합니다",2019.12.16
뮤지컬 〈보디가드〉,5,연말을 행복하게 만들어준 공연,"직장동료들과 송년회로 관람했습니다 티켓팅에 운좋게 성공해서 앞에서 3번째줄 중앙쪽 로얄석에서 관람해서 감동이 더 크게 느껴졌습니다.후기에서 음향문제가 좀 있었다는 이야기에 걱정이 되기도 했지만, 제가 관람했을때는 특별한문제가 없는듯하여 멋진공연 잘 보았습니다. 다만 뮤지컬에서 남자주인공의 노래가 없는것은 좀 아쉬웠습니다. 이동건 배우의 노래도 궁금했는데, 커튼콜에서라도 잠깐 보여줬으면 하는 아쉬움이 있네요그래도 연말을 좋은 공연과함께 마무리할수 있었던것 같아 행복합니다",2019.12.16
뮤지컬 〈보디가드〉,5,명곡 퍼레이드,좋았어요.,2019.12.16
뮤지컬 〈보디가드〉,5,씐나씐나,커튼콜 최고로 씐나네요!,2019.12.16
뮤지컬 〈보디가드〉,4,"김선영, 강경준, 최현선 캐스팅","송년모임으로 김선영, 강경준, 최현선 캐스팅 보고 왔습니다.  저는 보디가드 영화를 아는 세대였는데, 같이 간 동료 중에는 모르는 사람이 더 많아서 살짝 당황했네요.  김선영씨 너무나 파워풀했고, 최현선씨 성량에 또 한번 놀랐습니다.  강경준씨는 연기가 살짝 어색했는데 일부러 그랬을 수도 있다는 생각이 들더군요. ㅎㅎ 여튼 수트핏은 최고였습니다.  이쯤되니 손승연, 이동건씨 연기도 궁금해지더군요.  보디가드는 여성배우들이 이끌어 가는 공연 같았고, 특히 무대장치가 좋았습니다.  다시 볼 기회가 있다면 다른 캐스팅으로 또 볼 생각입니다.",2019.12.16
뮤지컬 〈보디가드〉,4,"김선영, 강경준, 최현선 캐스팅 관람","송년모임으로 김선영, 강경준, 최현선 캐스팅 보고 왔습니다.  저는 보디가드 영화를 아는 세대였는데, 같이 간 동료 중에는 모르는 사람이 더 많아서 살짝 당황했네요.  김선영씨 너무나 파워풀했고, 최현선씨 성량에 또 한번 놀랐습니다.  강경준씨는 연기가 살짝 어색했는데 일부러 그랬을 수도 있다는 생각이 들더군요. ㅎㅎ 여튼 수트핏은 최고였습니다.  이쯤되니 손승연, 이동건씨 연기도 궁금해지더군요.  보디가드는 여성배우들이 이끌어 가는 공연 같았고, 특히 무대장치가 좋았습니다.  다시 볼 기회가 있다면 다른 캐스팅으로 또 볼 생각입니다.",2019.12.16
뮤지컬 〈보디가드〉,4,"김선영, 강경준, 최현선 캐스팅 보고 왔습니다.","송년모임으로 김선영, 강경준, 최현선 캐스팅 보고 왔습니다.  저는 보디가드 영화를 아는 세대였는데, 같이 간 동료 중에는 모르는 사람이 더 많아서 살짝 당황했네요.  김선영씨 너무나 파워풀했고, 최현선씨 성량에 또 한번 놀랐습니다.  강경준씨는 연기가 살짝 어색했는데 일부러 그랬을 수도 있다는 생각이 들더군요. ㅎㅎ 여튼 수트핏은 최고였습니다.  이쯤되니 손승연, 이동건씨 연기도 궁금해지더군요.  보디가드는 여성배우들이 이끌어 가는 공연 같았고, 특히 무대장치가 좋았습니다.  다시 볼 기회가 있다면 다른 캐스팅으로 또 볼 생각입니다.",2019.12.16
뮤지컬 〈보디가드〉,4,멋진 공연,사촌동생 보여줬는데 너무 재미있었다고 하네요.,2019.12.16
뮤지컬 〈보디가드〉,5,"익숙한 멜로디, 익숙한 이야기, 향수를 불러 일으킨다.","어릴적 보았던 영화가 무대로 옮겨졌다. 시간이 지났어도 명곡은 빛을 바래지 않는 법! 여전히 좋은 넘버들에 귀가 호강한다. 다만, 뮤지컬 전문배우가 아니다보니 무대에서의 어색함은 아직 지울 수 없나보다.",2019.12.16
뮤지컬 〈보디가드〉,5,이토록 흥미진진하다니!!!,연말연시를 아름답게 장식해 줄 작품!!!,2019.12.16
뮤지컬 〈보디가드〉,4,너무 행복한 날이었습니다.,"오랫만에 관람한 뮤지컬~, 출연진들의 시원한 가창력에 스트레스 해소한 하루였습니다.",2019.12.16
뮤지컬 〈보디가드〉,5,유머와 감동이 있는 뮤지컬,최고의 뮤지컬이라고 생각합니다. 정말 기대를 안했는데 배우 구성 부터 노래가 특히 너무 좋았어요!!,2019.12.16
뮤지컬 〈보디가드〉,4,추천,재미있습니다 볼 만해요,2019.12.16
뮤지컬 〈보디가드〉,5,배우분들의 연기가 돋보이는 공연입니다.,정말 재밌게 봤습니다.,2019.12.16
뮤지컬 〈보디가드〉,5,즐거운 공연!,커튼콜이 정말 신나네요! 스트레스가 다 날아가는 기분입니다. 감사합니다.,2019.12.16
뮤지컬 〈보디가드〉,5,화려한 공연!,연말연시에 보기 참 좋은 공연입니다. 화려하고 재밌슺니다.,2019.12.16
뮤지컬 〈보디가드〉,5,보디가드 재밌게봤어요,어머니와 좋은 추억 쌓고 가게해준 뮤지컬 보디가드 감사합니다.! 엘리베이터에서 강경준 배우님 계셨는데 나가실때 인지해서 너무 아쉬웠어요ㅠ 좋은 연기 멋있습니다!! 해나 님 처음봤는데 노래며 춤이며 다음에 또 찾아서 볼게요 응원합니다~!,2019.12.16
뮤지컬 〈보디가드〉,4,최고입니다.,최고였습니다/,2019.12.16
뮤지컬 〈보디가드〉,5,감동이였어요~,노래도 너무 잘하고 공연도 너무 재미있게 잘 봤습니다.  감동감동~!,2019.12.16
뮤지컬 〈보디가드〉,5,스토커,너무 무서움..,2019.12.16
뮤지컬 〈보디가드〉,5,보디가드 추천이요!,어머니와 좋은 추억 쌓고 가게해준 뮤지컬 보디가드 감사합니다.!엘리베이터에서 강경준 배우님 계셨는데 나가실때 인지해서 너무 아쉬웠어요ㅠ 좋은 연기 멋있습니다!!해나 님 처음봤는데 노래며 춤이며 다음에 또 찾아서 볼게요 응원합니다~!,2019.12.16
뮤지컬 〈보디가드〉,3,누군가는 항상 누군가를 떠나죠,"화려한 볼거리  뛰어난 연기와 가창력  익숙한 스토리  주말, 연말 가볍게 즐길만한 공연",2019.12.16
뮤지컬 〈보디가드〉,5,보디가드,보디가드,2019.12.16
뮤지컬 〈보디가드〉,4,보디가드,"처음부터 끝까지 춤, 노래, 연기를 끊임없이 해내는 !! 멋지게잘 보았어요",2019.12.16
뮤지컬 〈보디가드〉,5,레이첼의 실제 공연을 보는 듯!!,실제로 레이첼 마론이 공연을 하는 것처럼 정말 화려합니다. 볼거리가 풍성해요. 넘버도 다 좋아요. 이번에 맨 앞자리였는데 2층에서 전체적인 무대를 다시 한번 더 보고싶어요.,2019.12.16
뮤지컬 〈보디가드〉,5,"레이첼마론 김선영, 경호원 강경준의 환상적인 보디가드","오늘 최고의  배우는 역시나 김선영 배우다. 마지막곡을 부르면서 앞에 네모난 주인공 단상?이 위로 올라오면서 부르던 노래의 최고의  뮤지컬을 마무리하였다. 인어공주가 위로 올라오듯  최고의 디바인 김선영 배우 정말 최고임에 확실하다. 휘트니 휴스턴의 ‘I Will Always Love You’, ‘I Have Nothing’, ‘Queen Of The Night’ ...  여러곡들의 소화해내주었다. 사실 더 잘 부르는듯 빠져들었다. 처음부터 김선영 레이철 등장에 박수치고 또 쳤다. 내가 너무나 좋아하는 강경준 배우 걸어나오는 자체부터 와우 대박 멋졌다. 오늘의  보디가드는 최고의 보디가드였다. 나도 강경준배우에게  경호를 받는다면 정말 상상만으로 행복하게 만든다. 사랑, 자기일을 위해 최선을 다했고 사랑하는 여인의 아이를 잘 대하고 사랑해주는 모습들이 현재 강경준 배우의 모습과 비슷한듯 해서 이 역할에 딱 맞는 배우다. 최현선 배우는 다른 작품에서 보았을때보다 잘해주셨고 따뜻하고 포근해보였다. 모든것을 희생하는 언니 다웠다. 특히 이번 보디가드에서 레이철의 아들 이준용배우 당차고 노래도 넘 잘 불러주었다. 보는 내내 귀여웠다. 앙상블과 배우들이 하나가 된 멋진 작품이었다. 여러 역할에 나온 배우들  한분한분 자기 역할에 충실했기에 더욱더 멋진 작품이 탄생한듯하다.무대가 주는 매력은 사각형 모양의 변화들이었다. 이쪽저쪽 사각으로 변화를 주면서 무대가 변했다. 작아질수록 집중했다. 커졌다하면서 매력적이었다. 2층이지만 단차가 좋아서 잘 보였다. 오페라클래스를 3.000원에 대여받아 배우들 모습들까지 가까이 보게되니 더욱더 행복했다.  레이철이 불르는 노래의 파워는 정말 대단했다. 먼곳에서도 잘 들리고 황홀하기까지 했다. 기쁨과 슬픔을 같이 하면서 관객과 배우들 모두 하나가 되었다. 이미 휘트니 휴스턴의 보디가드 명곡들을 알기에 더욱더 친근감이 있었고 라이브로 정말 잘부르는 허스키 보이스의 매력적인 목소리의 소유자인 김선영배우가 있기에 더욱더 좋았다.  음악의 연주, 연출, 안무가 더욱더 멋스러웠다.  앙상블님들의 댄스는 역시나 보디가드를 더욱더 멋스럽게 만들었다. 마지막 커튼콜때 다 일어나 따라부르고 흔들고 무대 조명이 정말 환상적이었던 매력적인 보디가드였다. 꼭 다시보러가고 싶다. 추천한다. 다른 레이첼  마론분들의 노래도 들어보고싶다. 물론 김선영배우의 무대도 여러번 보아도 최고일 듯하다. 정말 행복한 밤이었다. 좋은공연 감사합니다.",2019.12.16
뮤지컬 〈보디가드〉,5,노래,누군가에게 사랑노래를 불러주고 싶은 공연이예요여왕님은 언제나 나의 여왕님이십니다,2019.12.16
뮤지컬 〈보디가드〉,4,화려하고 반짝반짝.,"조명과 불빛등이 화려하고 멋졌습니다.훌륭한 배우들의 연기, 멋있었던 춤과 노래잘 봤습니다.",2019.12.16
뮤지컬 〈보디가드〉,5,스토커를 향한 연출들이 재밌습니다,스토커의 존재감이 대단한 극인데 그 스토커가 주는 긴장감이 참 재미있네요,2019.12.16
뮤지컬 〈보디가드〉,5,해나 레이첼 좋아요,지킬앤하이드 루시 때부터 봤는데 연기 노래 그리고 보디가드에선 춤까지 넘 좋네요!,2019.12.16
뮤지컬 〈보디가드〉,5,김선영 레이첼 좋아요,연기가 넘 좋아서 10살짜리 아들을 둔 엄마이자 가수의 마음이 잘 느껴졌습니다,2019.12.16
뮤지컬 〈보디가드〉,5,재밌습니다,박기영 레이첼 대사톤이 넘 좋네요,2019.12.16
뮤지컬 〈보디가드〉,5,커튼콜위크 넘 좋아요,극 재밌게 보고 커튼콜 촬영할 수 있어서 넘 좋네요,2019.12.16
뮤지컬 〈보디가드〉,5,박기영♡이동건 쵝오,어릴 때 영화로 봤던 보디가드 뮤지컬은 어떨지 너무 궁금했는데박기영님 노래와 연기 그리고 이동건님 연기도 최고였어요기억에 남을 연말 공연 ♡♡♡☆☆☆,2019.12.15
뮤지컬 〈보디가드〉,4,나쁘지 않았어요.,스토리가 좀 그렇긴한데... 배우님들 연기가 좋아요,2019.12.15
뮤지컬 〈보디가드〉,5,좋아요♡,"엄마 모시고 간 공연이었는데 예전 추억이 생각난다며 좋아하셨어요^^ 즉석 연주자들이 보이지 않아서 조금 아쉬웠지만 너무너무 좋았어요! 휘트니 휴스턴의 주옥같은 곡들을 현장에서 들을 수 있으니 감회가 새로웠습니다. 인터미션을 포함한 140분 동안 쉴틈없이 전개되서 배우분들께 감탄, 또 감탄하며 즐겼습니다. 커튼콜 기간이라 사진도 찍고 함께 호흡해서 더 좋았어요:) 부모님과 함께하면 특히 추천합니다~~~",2019.12.15
뮤지컬 〈보디가드〉,5,해나님 짱!!,해나님의 노래 들으러 갔는데 역시나...지앤하때 팬이 되었는데 모든 노래를 다 불러서 좋았습니다 ㅜㅜ커튼콜의 폭발적인 열기까지 ㅎㅎ사람들이 초반부터 안 일어나서 아쉬웠지만...ㅎㅎ 호응을 유도하는 모습도 멋졌어요~~해나님을 언제나 응원합니다 ㅎㅎ,2019.12.15
뮤지컬 〈보디가드〉,4,뮤지컬 보디가드를 보고,저는 R석을 구매해서 1층에서 봤습니다. 비교적 맨뒤쪽자리였지만 LG아트센터가 워낙 시야각이 좋고 무대가 잘보이기로 소문이 난지라 마치VIP자리처럼 너무 잘보였습니다. 뒤쪽 중앙자리인지라 거리가 멀것으로 생각되었지만 마침내 공연이 사작되고 나니 배우들과 무대가 마치 너무 가까이에 있는것처럼 너무 잘보였습니다. 약 120분의 공연으로 60분 공연후 인터미션 20분 또 60분 공연 지루하지도 않고 적당한 길이의 공연이었습니다. 휘트니휴스턴의 노래를 알고 있고 보디가드 영화를 보신분이라면 노래와 스토리가 눈과 귀에 쏙 들어올것입니다. 여주인공의 파워풀한  노래와 앙상블들의 율동과 춤 그리고 마무리 커튼콜까지 마치 콘서트에 온거 같은 분위기를 느낄 것입니다.,2019.12.15
뮤지컬 〈보디가드〉,1,그냥그래요,동료들이랑 봤는데박기영 노래 잘한다 이런 느낌만 있어요지루했네요,2019.12.15
뮤지컬 〈보디가드〉,1,그냥그래요,박기영 콘서트처럼다른배우들이 노래하는건 조금 밖에 없네요,2019.12.15
뮤지컬 〈보디가드〉,5,모든 스텝들 열정적인 모습에  박수~~^^,지금까지 본 뮤지컬 중 당연 탑이였어요. 즐겁고 행복한  시간이 됐답니다. 박수 박수~~^^,2019.12.15
뮤지컬 〈보디가드〉,3,기대만큼은 아니었다.,첫번째로는 스토리가 너무 단조롭다.물론 원작영화도 있고 노래도 정해진 걸로 해야하니 이해는 한다.두번째로는 넘버를 번역을 하다 말았다. 한국어로 부르다가 영어로 부르다가. 홀이 음향이 울려서 가사전달도 잘 되지 않는데 한국어 영어 섞어부르니 무슨 말을 하는지도 모르겠다. 참 아쉬운 뮤지컬이었다.,2019.12.15
뮤지컬 〈보디가드〉,3,기대에 다소 못 미친 뮤지컬,여자 주인공의 노래는 나무랄데가 없는데 왠지 매력을 느끼지는 못했고 오히려 보조 출연자들 특히 남성들의 파워풀한 댄스가 맘에 들었다. 뒤쪽 R석에 앉았는데 출연자들의 얼굴은 거의 보이지 않아 들인 돈이 아까웠고 vip석도 뒷쪽은 거의 그럴거라 보여 티켓거품이 상당해보인다. 나에게는 전반적으로 그리 매력적인 상품은 아니었고 기대한 것에 비해 실망스런 선택이었다. 퀸 뮤지컬에 기대를 해보아야할 듯,2019.12.15
뮤지컬 〈보디가드〉,5,신나는 뮤지컬 콘서트같아요,콘서트가고싶은데 힘들고.. 뮤지컬보고싶은 사람 강추!! 보디가드 추억소환!! 야광봉도 사서 잘즐기고왔어요♡ 배우들도 너무멋지고 신기했어요,2019.12.15
뮤지컬 〈보디가드〉,5,와우 대박 공연^^,"오랜만에 신랑과 즐거운 시간 보냈어요! 사실 손승연씨 때문에 선택한 시간이었는데~  워낙 방송을 통해 알고 있었던 손승연씨는 역시나 엄청난 성량과 가창력의 가수였고,,  저희는 생각치 않았던 니키역에 최현선씨에게 반했답니다.ㅎㅎ 이동건씨는 키도 크고 어찌나 얼굴도 조막만하신지~ 신랑이 감탄하더라고요ㅋㅋ 화려한 무대와 익숙한 멜로디가 연말에 즐겁게 볼 수 있는 공연이었어요^^",2019.12.15
뮤지컬 〈보디가드〉,5,열정적인 커튼콜의 보드가드,"영화 보디가드와 휘트니 휴스턴을 떠오르게 하는 뮤지컬 보디가드.성연 레이첼, 다희 니키의 멋진 노래, 공연장을 연상시키는 노래와 춤이 흥을 돋구었습니다.동건 프랭크의 무뚝뚝함이 노래없이 남주로도 손색이 없었습니다.스토킹, 협박과 죽음, 이별 등의 스토리를 보니 다시 영화를 보고 싶습니다.마지막 커튼콜은 무대인사+공연으로 멋진 앤딩이었습니다.다른 가수로도 보고 싶습니다.",2019.12.14
뮤지컬 〈보디가드〉,4,좋은 공연이였어요~,영화의 여운이 있어서 보게되었어요~  기대이상으로 배우 연기와 노래가 좋아서 즐거운 관람하였습니다 :),2019.12.14
뮤지컬 〈보디가드〉,5,정말잼썼어요,신나신나!!이동건씨 해나씨 나오는 걸로봤어요맨앞줄로봤는데 콘서트처럼 신나고 재밌었어요,2019.12.14
뮤지컬 〈보디가드〉,5,기대를 1도 않했는데..,영화로 이미 유명한 작품이라 사실 기대는 1도 않하고 갔었는데..정말 최고의 공연이었습니다.많이 신경쓴 것을 바로 알것 같았던 정교한 무대도 좋았구요 손승연님의 파워풀한 댄스와 가창력은 말할것도 없거니와 강경준님의 멋진 보이스도 최고였습니다.집에 와서도  계속 여운이 남아 지금은 보디가드 영화를 다시 보고 있습니다.연말연시 조금은 쓸쓸했는데 행복핫 시간을 만들어 주셔서 정말 감사합니다,2019.12.14
뮤지컬 〈보디가드〉,4,"좋은 무대, 하지만 다소 아쉽네요","손승연씨의 매력이 아주 흠뻑 느껴지는 공연이었습니다. 노래를 정말 잘하세요. 그럼에도 불구하고 몇 가지 아쉬움이 있었는데, 먼저 보디가드라는 공연의 내용은 거의 다 알되 휘트니 휴스턴 노래의 감동을 객석에서 느끼고 싶을 관객들이 많은 만큼 노래를 원어를 많이 살려 불렀으면 어떨까 하네요. 번역이 좀 와닿지도 않고 굳이 번역한 가사로 부를 만큼 스토리가 그렇게 몰입도 있던 게 아니라서요.",2019.12.14
뮤지컬 〈보디가드〉,5,조화로운 공연이네요.,"아는 음악에서 오는 익숙함과 편안함이 있는 공연이네요.음악팀 넘 멋졌구요~  김선영님, 강경준님 유쾌한 연기와 화려한 노래 너무좋았어요~ 레이첼 언니역의 부드너운 음색과 아들배역 맑은 목소리도 공연의 msg역할을 톡톡히 하는 조화로운 무대였습니다. 뮤지컬에 늘 큰 기대를 하지않는편인데, 이번공연 통해서 좋아할것같아요~",2019.12.14
뮤지컬 〈보디가드〉,5,공연 너무 재밌어요~^^,"오랜만의 공연 나들이었는데, 너무 재밌게 봤어요~ㅎㅎ 예전에 봤던 영화 생각도 나고 커튼콜때 신나게 박수치고 춤추고 왔습니다.   여주인공이 김선영님, 강경준님이었는데 두 분 다 멋졌어요~~! 언니 역할을 하셨던 배우님도 기억에 남고, 아역 배우도 너무 귀여워서 엄마 미소 띄고 봤습니다.  또 보고 싶어요~~~^^",2019.12.14
뮤지컬 〈보디가드〉,5,믿고 보는 선영 레이첼 공연 너무 좋았어요~ㅎ,"영화 ''보디가드''를 그 시대에 한번이라도 본 사람들은 알죠.  그 영화가 얼마나 대단한 영향력이 있었는지~ㅎ 삽입곡들도 정말 유명했고, 스토리도 좋았고, 출연 배우들도 당시 top이었던 사람들이었기에 이 작품을 무대에 올린다고 했을때 사실 그렇게 챙겨보진 않았습니다.  그런데!!! 이번에 김선영 배우님이 레이첼 마론 역으로 캐스팅됐다는 소식에 가슴이 뛰기 시작했어요. 10년이 넘는 뮤지컬 관람을 하는 동안 꾸준한 작품 활동과 압도적 존재감을 가진 배우님이었기에 망설임없이 예매했고 관람했습니다.  역시 더할나위없는 레이첼 마론이었어요~~!! *^^* 정말 영화에서 튀어나온 듯한 모습으로 무대를 활보하는 배우님을 보고있자니 흥이 차오르더군요~ㅎ 요즘 쇼뮤지컬은 별로 챙겨보지 않았는데, 막 어깨도 들썩거리고 가사도 잘 모르지만 리듬을 따라부르고 했네요~~ㅎㅎㅎ 조연 배우님들(특히 최현선 배우님 멋졌어요!!!)도 너무너무 좋은 연기와 노래를 보여주셔서 ''또 보고싶다''는 생각을 했습니다.   망설이고 있는 분이 계시다면 뮤지컬 보디가드 추천합니다!!! ^^",2019.12.14
뮤지컬 〈보디가드〉,5,멋져요~~,손승연씨 이동건씨 넘멋지구 잘했습니다~,2019.12.14
뮤지컬 〈보디가드〉,5,&#65279;연말공연으로 추천!!! 한편의 콘서트 같았던 뮤지컬 ''보디가드'',"보디가드의 내용은 예전에 영화를 봐서 대충 알고는 있었지만   오랜만에 다시 만나니 새롭더라구요   이 날 평일이었는데도 불구하고 객석이 거의 꽉찰 정도로 관객들이 정말 많았답니다.  마침 제가 간 날 커튼콜 촬영이 허락되어 열심히 사진과 동영상도 찍을 수 있었구요    첫 음만 들어도 아! 소리가 나올 노래 ..  I Will Always Love You 부터   Run to You, I Wanna Dance with Somebody..   I Have Nothing 등..   무려 16곡의 휘트니휘스턴 명곡이 나오는 뮤지컬 보디가드.   아는 노래가 너무 많아 더욱 좋았던 뮤지컬이예요    어떤 분이 말씀하신 뮤직 블록버스터라는 말이 확 와닿았어요.    주인공인 레이첼 마론의 역할이 가수이다 보니 노래가 빠질 수 없는데요   대사보다 노래의 비중이 훨씬 커서 왠만한 성량과 노래실력으로는  주인공 역할을 따내기 힘들었을 거예요   그런 의미에서 손승연은 역할에 딱맞는 캐스팅이었던 것 같아요   레이첼의 언니인 니키 역할을 했던 최현선님도   목소리가 너무 좋고 성량도 풍부하시더라구요~   특히 마지막에 불렀던   I Will Always Love You 는 휘트니 휘스턴이 환생해서 다시 부르는 듯한..  너무 소름돋고 감동이었어요.  손승연은 정말 노래의 신!!   뮤지컬 발성에는 아직 완벽해보이지 않아보였지만 역할에 정말 충실히 이행했다고 봐요   뮤지컬 배우이신 김선영님의 무대도 굉장히 궁금해지더라구요   보디가드 역할 맡은 강경준 님은 사람이 어쩜그리 훤칠한지..  저도 모르게 시선이 계속....ㅋㅋ     초반인가 노래하는 중간에 마이크가   살짝 끊겼던 적이 있어서 음향은 조금 아쉬웠던 부분이구요...  그 외의 모든게 완벽했습니다.   뮤지컬을 보고나니 예전에 봤던 보디가드 영화가 또다시 궁금해지더라구요   나이가 좀 있으신 분들은 뮤지컬과 함께 추억에 젖으실 수 있을 것 같아요   배우들의 멋진 연기와 함께 휘트니 휘스턴의 명곡으로 눈과 귀를 호강시켜 보아요    아직 안 보신 분들에게 정말 강추 합니다.",2019.12.13
뮤지컬 〈보디가드〉,4,드뎌 또 봤다..,재미와 감동 즐건 시간이었습니다..,2019.12.13
뮤지컬 〈보디가드〉,5,박기영님 너무 멋있어서 반했어요..,이동건님 정다희님도 너무잘하심..굿,2019.12.13
뮤지컬 〈보디가드〉,3,조금 아시웠지만...수고 많았슈....,1부(전막)에서는 마이크 문제인지....배우들의 노래가 영영아시움ㅇ..... 2부(후막)에서는 마이크...음향을 조정해서인지....만족할만한....사운드였어요.. 고생한 배우분들을 위해서라도...음향에 신경을 더 써야할 듯해요 옛 영화를 회상하며....좋은 시간 보냈습니다... 배우님.스텝님들 수고 많았슈....,2019.12.13
뮤지컬 〈보디가드〉,4,기대보다 훨씬 멋진!!,"초연 때 안 보고 넘겼던 작품인데, 이번에 보길 정말 잘했어요. ^^ 추억 돋는 노래들을 김선영 배우의 멋진 무대와 함께 들을 수 있어 행복했습니다. 스토리가 좀 아쉬웠지만, 깨알같은 웃음도 있고 화려한 무대도 멋지고, 배우들도 참 좋았어요!!",2019.12.13
뮤지컬 〈보디가드〉,4,콘서트에 다녀온 느낌이어요,콘서트 장을 방불케 하는 열정을 느낄수 있는 멋진 무대였습니다 하지만 음향은 조금 부족한 듯 느꼈어요 그리고 남 배우의 노래를 못 들어 본게 아쉽네요,2019.12.13
뮤지컬 〈보디가드〉,5,뮤지컬 〈보디가드〉,어른들이랑 보기에 좋아요,2019.12.13
