musical_title,rate,review_title,review_text,review_date
뮤지컬 〈귀환〉 온라인 생중계 - 온라인 관람권,5,잘봤습니다,DVD 발매해주세요,2020.09.28
뮤지컬 〈귀환〉 온라인 생중계 - 온라인 관람권,5,좋았어요,좋았습니다,2020.09.28
뮤지컬 〈귀환〉 온라인 생중계 - 온라인 관람권,5,좋았어요,좋았습니다,2020.09.28
뮤지컬 〈귀환〉 온라인 생중계 - 온라인 관람권,5,좋았어요,좋았습니다,2020.09.28
뮤지컬 〈귀환〉 온라인 생중계 - 온라인 관람권,5,잘 봤습니다,"공연장에서 보지 못한 아쉬움을 생중계로나마 풀 수 있어서 좋았어요 좋은 넘버와 연기, 메세지까지 뜻 깊은 시간이었습니다 이런 기회가 자주 있었으면 좋겠어요",2020.09.28
뮤지컬 〈귀환〉 온라인 생중계 - 온라인 관람권,5,귀환,본공연을 예매했는데 취소되어 못봐서 너무 아쉬웠는데 온라인으로 볼수 있어서 좋았습니다  현장에서 보고 싶네요  DVD 팔아주세요,2020.09.28
뮤지컬 〈귀환〉 온라인 생중계 - 온라인 관람권,5,엉엉ㅇ엉어엉 너무 좋다,이지숙ㅠㅠㅠㅠ이정열ㅠㅠㅠㅠ백동혀뉴ㅠㅠㅠ현석준ㅠㅠㅠㅠ너무 좋다 진짜 자첫을 온라인 중계로 했는데도 펑펑 울었네 아 본공 와줘요 국방부 빨리 민간 기업에 팔아줘요 나 자주 보고 싶어ㅠㅠㅠ,2020.09.28
뮤지컬 〈귀환〉 온라인 생중계 - 온라인 관람권,5,엉엉ㅇ엉어엉 너무 좋다,이지숙ㅠㅠㅠㅠ이정열ㅠㅠㅠㅠ백동혀뉴ㅠㅠㅠ현석준ㅠㅠㅠㅠ너무 좋다 진짜 자첫을 온라인 중계로 했는데도 펑펑 울었네 아 본공 와줘요 국방부 빨리 민간 기업에 팔아줘요 나 자주 보고 싶어ㅠㅠㅠ,2020.09.28
뮤지컬 〈귀환〉 온라인 생중계 - 온라인 관람권,5,엉엉ㅇ엉어엉 너무 좋다,이지숙ㅠㅠㅠㅠ이정열ㅠㅠㅠㅠ백동혀뉴ㅠㅠㅠ현석준ㅠㅠㅠㅠ너무 좋다 진짜 자첫을 온라인 중계로 했는데도 펑펑 울었네 아 본공 와줘요 국방부 빨리 민간 기업에 팔아줘요 나 자주 보고 싶어ㅠㅠㅠ,2020.09.28
뮤지컬 〈귀환〉 온라인 생중계 - 온라인 관람권,5,엉엉ㅇ엉어엉 너무 좋다,이지숙ㅠㅠㅠㅠ이정열ㅠㅠㅠㅠ백동혀뉴ㅠㅠㅠ현석준ㅠㅠㅠㅠ너무 좋다 진짜 자첫을 온라인 중계로 했는데도 펑펑 울었네 아 본공 와줘요 국방부 빨리 민간 기업에 팔아줘요 나 자주 보고 싶어ㅠㅠㅠ,2020.09.28
뮤지컬 〈귀환〉 온라인 생중계 - 온라인 관람권,4,너무 잘 봤어요,평범한 사람들의 힘들었던 시절이라 많이 울면서 봤어요ㅠㅠ 꼭 극장가서 다시 볼 수 있길 기다립니다,2020.09.28
뮤지컬 〈귀환〉 온라인 생중계 - 온라인 관람권,5,군뮤로 남기 아까워요,너무 멋진 작품이에요,2020.09.28
뮤지컬 〈귀환〉 온라인 생중계 - 온라인 관람권,5,귀환,공연장에서 볼 수 있는 날이 빨리 왔으면 좋겠어요,2020.09.28
뮤지컬 〈귀환〉 온라인 생중계 - 온라인 관람권,4,감동적이에요,보고싶던 극이었는데 온라인중계를 해서 보게됬어요. 감동적인 극이었습니다.,2020.09.28
뮤지컬 〈귀환〉 온라인 생중계 - 온라인 관람권,5,타악,ㅠㅠㅠㅠㅠㅠㅠㅠㅠㅠㅠ 이건 아니다ㅠㅜㅠㅠㅠㅠㅠ본공 처음 올린건데 이렇게 잘 하는데ㅠㅠㅠㅠㅠㅠ너무 아깝다ㅠㅠ 먹지 깔 사람들 있던데ㅠ 제발 이 시국 안정되고 극장에서 다시 만나길ㅠ,2020.09.28
뮤지컬 〈귀환〉 온라인 생중계 - 온라인 관람권,5,동현진구 사랑해,다시 와주세요 인사이트,2020.09.28
뮤지컬 〈귀환〉 온라인 생중계 - 온라인 관람권,5,현장에서 봤어야 하는데 ㅠㅠㅠㅠ,지난 번에 불호였던 장면이며 배우들도 다 안정감 있던데그래서 공연장에서 직접 볼 수 없는게 너무너무 아쉽고ㅠㅠ그래도 온라인으로나마 봐서 정말 다행이다 싶었다ㅠ,2020.09.28
뮤지컬 〈귀환〉 온라인 생중계 - 온라인 관람권,3,좋은 넘버,현장가서 보고싶다,2020.09.28
뮤지컬 〈귀환〉 온라인 생중계 - 온라인 관람권,5,숮해성 보고싶어요,재균해일 수진해성 도라와,2020.09.28
뮤지컬 〈귀환〉 온라인 생중계 - 온라인 관람권,5,잘봤습니다,너무좋았어요,2020.09.28
뮤지컬 〈귀환〉 온라인 생중계 - 온라인 관람권,5,어린 학도병들의 모습이 아직도 어른거려요,시대의 아픔을 조금이나마 공유하게 해준 고마운 작품입니다,2020.09.28
뮤지컬 〈귀환〉 온라인 생중계 - 온라인 관람권,5,즐거운 관람,잘봤어요! 막공만 봐서 너무 아쉬워요ㅠ 일요일공연도 있었더라면 다른 캐스팅으로 또 봤었을텐데 그래도 잘봤습니당,2020.09.28
뮤지컬 〈귀환〉 온라인 생중계 - 온라인 관람권,5,감동적이었어요,"배우들 연기랑 노래도 좋았고, 메시지도 감동적이었습니다. 몇 번만 더 해줬으면ㅠㅠ",2020.09.28
뮤지컬 〈귀환〉 온라인 생중계 - 온라인 관람권,5,잘봤습니다,잘봤습니다,2020.09.28
뮤지컬 〈귀환〉 온라인 생중계 - 온라인 관람권,3,좋았어요,처음이라 배우들의 감정을 잘 이해하진 못했지만 그래도 볼 수 있어서 좋았습니다.지숙배우 목소리는 여전히 멋지네요,2020.09.28
뮤지컬 〈귀환〉 온라인 생중계 - 온라인 관람권,5,백동현 배우님 보려고,시청한건데 너무 재밌게 잘봤습니다! 이런 기회를 만들어주셔서 감사해요 ㅎㅎ 다음에는 실제 무대에서 봤으면 좋겠어요ㅠㅠ,2020.09.28
뮤지컬 〈귀환〉 온라인 생중계 - 온라인 관람권,5,좋았습니다,이렇게라도 볼 수 있어서 좋았어요,2020.09.28
뮤지컬 〈귀환〉 온라인 생중계 - 온라인 관람권,5,공연장에서,이 배우들로 꼭 다시 한 번 보고 싶습니다,2020.09.28
뮤지컬 〈귀환〉 온라인 생중계 - 온라인 관람권,5,재연 꼭 다시 돌아오세요,너무 너무 좋았어요 생동감이 없어서 속상했지만 ㅠㅠㅠ 얼른 실제 공연으로 만나고싶어요,2020.09.28
뮤지컬 〈귀환〉 온라인 생중계 - 온라인 관람권,5,또해주세요,정말 좋았답니다,2020.09.28
뮤지컬 〈귀환〉 온라인 생중계 - 온라인 관람권,5,온라인 관극,현장에서 볼 수 있었다면 더 좋았을텐데 아쉽습니다,2020.09.28
뮤지컬 〈귀환〉 온라인 생중계 - 온라인 관람권,5,좋았어요!,초연봣었는데 약간 바뀐 부분들이 있더라구요 스토리상 아쉬운 부분이 있었지만 배우들 연기로 커버된 거 같았어요. 동현진구 너무 좋았고 특히 석준해일 기대했는데 기대 이상으로 너무너무 잘해주셔서 좋았습니다!ㅠㅠ 이렇게 잘하시는데 공연이 너무 짧을 수밖에없는 이시국이 너무 아쉽네요ㅠㅠㅠㅠ,2020.09.28
뮤지컬 〈귀환〉 온라인 생중계 - 온라인 관람권,5,재미있어요,생중계좋았습니다,2020.09.28
뮤지컬 〈귀환〉 온라인 생중계 - 온라인 관람권,4,온라인 중계로 보는 색다른 경험이었습니다,궁금했던 작품을 온라인 스트리밍으로 볼 수 있어 신기했습니다. 언젠가 실제 무대에서 볼 수 있었으면 좋겠습니다.,2020.09.28
뮤지컬 〈귀환〉 온라인 생중계 - 온라인 관람권,5,귀환,좋아요,2020.09.28
뮤지컬 〈귀환〉 온라인 생중계 - 온라인 관람권,5,이렇게라도 볼 수있음에 감사..,중간 중간 아쉬운 점들이 있었으나 너무 좋았습니다,2020.09.28
뮤지컬 〈귀환〉 온라인 생중계 - 온라인 관람권,5,현석준 최고,현석준!!!!!,2020.09.28
뮤지컬 〈귀환〉 온라인 생중계 - 온라인 관람권,5,현석준 최고,현석준!!!!!,2020.09.28
뮤지컬 〈귀환〉 온라인 생중계 - 온라인 관람권,5,현석준 잘생겼다,이해일 그 자체다ㅠㅠㅠㅠㅠㅠㅠㅠㅠㅠㅠㅠㅠㅠㅠㅠㅠㅠㅠㅠㅠㅠㅠㅠㅠㅠㅠㅠㅠㅠㅠㅠㅠㅠㅠㅠㅠㅠㅠㅠㅠㅠㅠㅠㅠㅠㅠㅠ,2020.09.28
뮤지컬 〈귀환〉 온라인 생중계 - 온라인 관람권,5,제발 디비디 팔아주세요,소원입니다 제발요,2020.09.28
뮤지컬 〈귀환〉 온라인 생중계 - 온라인 관람권,5,기다렸던 재연 귀환!,앵콜로 돌아오기만을 간절히 기다립니다+_+,2020.09.28
뮤지컬 〈귀환〉 온라인 생중계 - 온라인 관람권,5,재밌어요!!!,현장에서 못보는게 너무 슬퍼요ㅜㅜ,2020.09.28
뮤지컬 〈귀환〉 온라인 생중계 - 온라인 관람권,5,제발 dvd 팔아주세요,네? 부탁하는거예요,2020.09.28
뮤지컬 〈귀환〉 온라인 생중계 - 온라인 관람권,5,훌륭합니다,우리 경수.민석 덕분에 좋은 작품알게되고 감상할 수 있어서 좋았습니다ㅎ,2020.09.28
뮤지컬 〈귀환〉 온라인 생중계 - 온라인 관람권,3,잘봤습니다,처음봐서..배우들의 감정을 잘 이해하진 못했지만 잘봤습니다.가지 못하는데 온라인으로라도 만날 수 볼 수 있어서 좋았어요.이지숙배우님 목소리는 역시 멋있었습니다.,2020.09.27
뮤지컬 〈귀환〉 온라인 생중계 - 온라인 관람권,3,현장에서 다시 보고싶은 공연이었어요.,큰 기대는 안하고 봤는데 생각보다 재밌었고 역시 온라인 생중계다 보니 현장감이 없어서 아쉬웠습니다. 공연기간이 다 끝나기 전에 현장에서 한번 더 관람하고 싶네요. 이정열 배우님 너무 멋있으시고 다른 배우분들도 좋은 연기 보여주려고 노력하시는 모습 보였어요ㅎㅎㅎ,2020.09.27
뮤지컬 〈귀환〉 온라인 생중계 - 온라인 관람권,5,멋진 공연 잘봤습니다,"귀환 온라인 공연 전 회차 다 봤는데요,  두시 공연이 제일 기억에 많이 남아요. 그리고 다른분 후기처럼 무료로 공개되었을 때보다 카메라 구도도 좋고 버퍼링도 별로 없고  음향도 깨끗하고 등등 여러모로 편히 잘 봤습니다 물론 실제로 보는 게 제일 좋겠지만, 상황이 상황인지라 이렇게 온라인만으로 배우님들이 준비하신 공연을 볼 수 있다는 것에 감사하네요 ^^",2020.09.27
뮤지컬 〈귀환〉 온라인 생중계 - 온라인 관람권,5,못 볼 줄 알았는데 봐서 너무 좋아요,감사합니다! 인사이트 측은 딥디도 내주셨으면 좋겠어요! 음원도요~~~~~,2020.09.27
뮤지컬 〈귀환〉 온라인 생중계 - 온라인 관람권,5,정말 잘 봤습니다~,"귀환 9월 25일 8시회차를 관람하였는데요 현민역할의 시우민(김민석) 배우 공연보려고 관람했는데 정말 잘하네요 작년 초연 때는 승호역할을 하였는데, 올해는 다른 역할로 어떻게 다른 연기를 할지 기대가 되었습니다. 노래와 성량이 더 커진것 같고 역할도 손자역할답게 너무 귀엽게 잘하네요 멋진 공연 감사합니다 ^^",2020.09.27
뮤지컬 〈귀환〉 온라인 생중계 - 온라인 관람권,5,감동과 여운이 깊네요,분단의 아픔과 전쟁의 참혹함을 느끼게 해준 명작 뮤지컬이였어요,2020.09.27
뮤지컬 〈귀환〉 온라인 생중계 - 온라인 관람권,5,재미있게 잘 보았습니다~!!,"배우분들 한 분 한 분 다들 열심히 준비해주셨을 텐데 직접 극장에서 관객들 앞에서 하지 못해서 배우분들도, 직접 극장에서 관람하지 못한 관객들도 아쉬움이 많이 남는 공연이었을 것 같아요ㅠ! 하지만 이렇게 온라인으로라도 볼 수 있서 좋았습니다! 배우분들 외에도 스태프분들도 온라인 생중계 방송으로 준비하신다고 고생이 많으셨을 것 같아요.  배우분들도 스태프분들도 모두 수고 많으셨습니다:)",2020.09.27
뮤지컬 〈귀환〉 온라인 생중계 - 온라인 관람권,5,최고,온라인으로라도 볼 수 있어서 너무 감사하고 온라인 생중계를 몇번 더 해줬으면 좋겠습니다. 코로나가 빨리 잠잠해져서 오프라인으로도 만날 수 있기를 간절히 바랍니다 그게 안 된다면 디비디라도..........,2020.09.27
뮤지컬 〈귀환〉 온라인 생중계 - 온라인 관람권,3,극은 좋았지만 아쉬웠습니다,귀환의 넘버를 너무 좋아하기도 해서 기대가 너무 컸던듯 하네요. 물론 내용은 너무 좋았습니다. 근데 한분의 실력이 너무나도 부족해서 아쉬웠습니다. 그 부분만 빼면 넘 좋았습니다. 다음번에 다른 캐스팅으로 보고 싶네요.,2020.09.27
뮤지컬 〈귀환〉 온라인 생중계 - 온라인 관람권,5,귀환 배우들의멋진무대&#128077;,넘버도 너무좋고 배우들의 멋진 연기에 무대가좋았습니다. 도경수와 김민석을 같은무대에서 보다니 너무 행복한순간이었어요!!,2020.09.27
뮤지컬 〈귀환〉 온라인 생중계 - 온라인 관람권,5,눈물이 가득한 극,1부는 과거 인물들의 뽀짝함에 2부는 전쟁의 참혹함에 눈물 가득했던 극이었어요 온라인이라 현장감은 좀 떨어졌지만 대신 음질이나 배우들 표정을 자세히 볼 수 있어서 좋았어요!,2020.09.27
뮤지컬 〈귀환〉 온라인 생중계 - 온라인 관람권,5,온라인으로라도 볼 수 있어서 좋았어요!!!,우려했던 끊김도 별로 없고 좋은 시간이었습니다.,2020.09.27
뮤지컬 〈귀환〉 온라인 생중계 - 온라인 관람권,5,영화같은 고퀄리티 뮤지컬~,"기다리고 기다렸던 공연이었다. 공연을 한다 안한다 워낙 이야기가 많았고, 작년에 보았지만 올해 재연이 너무 기대되었기애 비대면으로라도 이렇게 볼수 있음에 너무 감사했다.  지난 생중계에는 카메라가 극을 잘 모르고 촬영한 듯 놓치는 장면이 많았고, 아쉬움이 남았지만 스토리가 워낙 좋고 배우들의 연기를 기대하며 관람하였다.  그러나 첫장면부터,,정말 놀라움을 금치 못했다.  음향, 영상, 카메라까지 어느 디테일 하나 흠잡을 곳이 없었고, 심지어 작은 대사까지 표정까지 전달되고 직접 볼수 있다면 사람들 더이상 공연장 찾아가지 않고도 엄청난 퀄리티의 뮤지컬을 집에서 관람할 수 있겠구나 싶었다. 실제 뮤지컬을 보다보면 합창이나 앙상블 부분은 소리가 너무 커서 놓치거나 들리지 않던 대사가 많았는데, 이번 공연은 합창에도 솔로에도 한마디 한마디가 영화같은 퀄리티로 배우들의 노래사이 숨소리와 대사딕션까지 들리는 최고급 음향퀄리티를 느낄 수 있었다. 앙상블부분 발란스나 음정까지 정확하게 들리니 뮤지컬 라이브를 보는지 후작업한 녹화방송을 보는지 구분하기가 힘들었다.  코로나로 공연장을 찾기 어려운 요즘, 현장감이 생명인 뮤지컬공연계에  엄청나게 큰 한 획을 그은 공연이 아니었나 싶다.  하루종일 음악이 귓가에 맴돌아, 잠을 이루기 힘들었고, 모처럼 나에게 준 행복한 시간이었다.",2020.09.27
뮤지컬 〈귀환〉 온라인 생중계 - 온라인 관람권,5,공연해주신 모든분들 감사합니다.,한번도 못본 뮤지컬이라 꼭 보고싶었던 뮤지컬중 하나였는데 보는 내내 보면서 먹으려고 사둔 음식들은 못먹었네요 보면서 계속 울었고 다보고나니 눈이 부어있었어요ㅋㅋㅋ 온라인이라 사람들이 못본것에 다행이라 생각하네요 공연해주신 배우님들과 스테프분들 모든분들께 너무나도 감사드리고 다시한번 보고싶다는 생각이 너무너무너무너무 드네요 다시한번 감사드립니다,2020.09.27
뮤지컬 〈귀환〉 온라인 생중계 - 온라인 관람권,5,보길 잘 했다!,"경수랑 시우민 나온다고 해서 본건데, 귀환에 대한 좋은 취지도 너무 좋고 내용도 좋아서 너무 너무 재미있고 뜻 깊었어요. 또한 넘버들도 하나하나 다 좋고 배우들의 연기력이 너무 좋았어요. 온라인이라서 현장감을 느낄수 없다고 생각했는데 카메라가 배우들을 클로즈해서 보여줘서 표정연기가 잘 보여서 더 현장감 있고 몰입감이 좋았습니다.",2020.09.27
뮤지컬 〈귀환〉 온라인 생중계 - 온라인 관람권,4,온라인 생중계에 어울리는 극,워낙 화려한 볼거리가 많아서 영상으로 보는 게 아쉬웠지만 이 극은 온라인 생중계로 보는 것도 괜찮겠구나 싶었습니다. 주연 배우 팬 분들이 도란도란 채팅창에서 대화하시는 걸 보니 요즘 극장에서 환호성도 못지르는데  오히려 공연 소회를 적극적으로 온라인에서 나누시니 잘되었구나 싶었어요,2020.09.27
뮤지컬 〈귀환〉 온라인 생중계 - 온라인 관람권,4,뮤지컬 〈귀환〉 온라인 생중계,이렇게라도 뮤지컬을 볼 수 있다니.... 우선 모든게 감동적이었습니다.  실제 무대위의 연기자들을 보며 박수 갈채를 보냈으면 너무 좋았겠지만 모니터를 보며 박수 갈채를 보냈네요~  한국전쟁의 쓰라린 역사를 전해 주어 젊은이들에게 많은 관심이 되었을 것 같아 좋았고  점점 잊혀져 가는 한국전쟁의 희생자들을 다시한번 생각하게 되는 계기가 되었습니다.  이런 공연이 또 있었으면 좋겠네요. 감동적이었어요~! 눈물 났습니다...,2020.09.27
뮤지컬 〈귀환〉 온라인 생중계 - 온라인 관람권,5,2020년 최고의 공연,2020년 들어 최고로 행복했던 순간입니다.공연 너무 최고였어요 주연배우들 최고^^~!스토리도 너무 좋았습니다.기다림과 기다림이 만나는 그날까지!,2020.09.27
뮤지컬 〈귀환〉 온라인 생중계 - 온라인 관람권,5,정말 잘봤습니다,지난번 무료 라이브 공연때랑 비슷하겠거니 하고 결제했거든요. 그런데 왠걸 카메라도 정말 여러각도에서 상황과 분위기에 맞게 딱딱 잡아주시고 음향도 훨씬 빵빵하고.. 무엇보다 이정열 배우님의 내가 술래가되면 넘버.. 들을때마다 울컥합니다. 도경수 배우 목소리도 너무 좋고 다른 배우들도 너무 잘 하셔서 얼마나 고생하면서 노력하셨을까 감동적이네요. 직접가서 보진못했어도 보면서 기립박수 쳤습니다.,2020.09.27
뮤지컬 〈귀환〉 온라인 생중계 - 온라인 관람권,5,재밌게 잘 봤어요!,처음 네이버 중계때보다 스토리도 좀 더 다듬어지고배우분들 합도 훨씬 좋아져서 보기 좋았아요!!근데.....솔직히 카메라 계속 타이밍 안맞게 엉뚱한곳들 비춰줘서 좀ㅠㅠㅠㅠㅠ아쉬웠어요....ㅠㅠㅠㅠ그래도 이시국에 중계해주시느라 고생많으셨고 감사합니다~,2020.09.27
뮤지컬 〈귀환〉 온라인 생중계 - 온라인 관람권,5,감동적인 공연이었습니다.,스토리와 넘버가 굉장히 감동적인 공연이었습니다. 배우분들의 연기도 인상적이었어요.,2020.09.27
뮤지컬 〈귀환〉 온라인 생중계 - 온라인 관람권,5,너무좋았어요ㅠㅠㅠㅠㅠ,초연이랑 좀 달라진부분들은 아쉽긴하지만스토리바뀐거 빼면 이번 막공이 지금까지 본 회차중에제일 좋았어요ㅠㅠ 카메라 음향도 좋았고 배우분들 합도 완벽했어요!!! 이걸 극장가서 못보는게 너무 아쉽지만ㅠㅠㅠㅠ 중계해주셔서 정말 감사합니다ㅠㅠㅜ!!!,2020.09.27
뮤지컬 〈귀환〉 온라인 생중계 - 온라인 관람권,5,귀환 강추!!!!,26일 2시 공연 귀환....나의 최애 경석이들의 무대였다  됴승호 슈현민 노래면 노래! 연기면 연기! 부족한 것 하나 없이 너무 잘했다,2020.09.27
뮤지컬 〈귀환〉 온라인 생중계 - 온라인 관람권,5,도경수 김민석,그리고 모든분들 수고하셨고 감사합니다.,2020.09.27
뮤지컬 〈귀환〉 온라인 생중계 - 온라인 관람권,5,정말 멋진 공연이였습니다!!,직접 접하지 못했던 6.25전쟁에 대해 한번 더 생각해 보는 시간이 되었고 뮤지컬에 나오신 모든 분들에 감정이입이 되서 보는 내내 마음이 울컥했습니다.  앞으로도 우리의 역사를 절대 잊지 말아야 겠다고 생각했습니다. 정말 멋진 공연을 온라인으로 볼 수 있어서 영광이였습니다!,2020.09.27
뮤지컬 〈귀환〉 온라인 생중계 - 온라인 관람권,4,이홍기 도경수 이정열 현석준 이지숙 조합,이홍기 도경수 이정열 현석준 이지숙 이 조합으로 다시 한번 현장에서 보고싶은데 도경수배우가 전역을 하니까 불가능 하다는게 슬프네요. 코로나로 아쉽군요. ㅠ ㅠ귀환에대한 공부를하고 보면 더 재밌고 배우들이 회를 거듭할수록 긴장이 풀려서 더 스토리 전달이 잘 되는것같습니다.세정배우님 목소리 너무좋고 앞으로 기대됩니다.,2020.09.27
뮤지컬 〈귀환〉 온라인 생중계 - 온라인 관람권,5,잘 봤습니다!,중간에 한 배우 마이크 음향이 흔들렸던 거 말고는 만족스러웠어요.  시우민과 디오 팬이어서 이 회차를 예매했는데 즐겁게 잘 봤습니다.,2020.09.27
뮤지컬 〈귀환〉 온라인 생중계 - 온라인 관람권,5,잘 봤습니다!,중간에 한 배우 마이크 음향이 흔들렸던 거 말고는 만족스러웠어요.  시우민과 디오 팬이어서 이 회차를 예매했는데 즐겁게 잘 봤습니다.,2020.09.27
뮤지컬 〈귀환〉 온라인 생중계 - 온라인 관람권,5,초연도 상영해주세요,봄 넘버가 듣고싶어요ㅠㅠ 초연때 찍은 영상도 풀어주세요ㅠㅠ,2020.09.27
뮤지컬 〈귀환〉 온라인 생중계 - 온라인 관람권,5,초연도 상영해주세요,봄 넘버가 듣고싶어요ㅠㅠ 초연때 찍은 영상도 풀어주세요ㅠㅠ,2020.09.27
뮤지컬 〈귀환〉 온라인 생중계 - 온라인 관람권,5,초연도 상영해주세요,봄 넘버가 듣고싶어요ㅠㅠ 초연때 찍은 영상도 풀어주세요ㅠㅠ,2020.09.27
뮤지컬 〈귀환〉 온라인 생중계 - 온라인 관람권,5,디비디 제발ㅠ,"ost, dvd 제발 내주세요ㅠㅠ",2020.09.27
뮤지컬 〈귀환〉 온라인 생중계 - 온라인 관람권,5,귀환 온라인생중계를 보고,귀환온라인생중계를 보고 현장에서 봤으면 더더욱 좋았을껄 이 코로나를 탓하게 되네요 ㅠㅠ 가슴아픈얘기지만 배우들의 열연에 잼있게 봤습니다.,2020.09.27
뮤지컬 〈귀환〉 온라인 생중계 - 온라인 관람권,5,최고의 공연,뜻깊고 감동적이었던 귀환,2020.09.27
뮤지컬 〈귀환〉 온라인 생중계 - 온라인 관람권,5,너무 좋았어요,두번째 귀환 공연 공연장으로 보러 갈려고 했는데 코로나 때문에 못가게 되서 너무 아쉬웠는데 이렇게 온라인으로나마 공연을 하게되서 다행이네요ㅠㅠ 너무 감동적이고 배우분들 연기도 다 좋았어요!!,2020.09.27
뮤지컬 〈귀환〉 온라인 생중계 - 온라인 관람권,5,좋았어요,직접 눈으로 못 본 건 아쉽지만 ㅜㅜ 좋은 공연 잘 봤씁니다!,2020.09.27
뮤지컬 〈귀환〉 온라인 생중계 - 온라인 관람권,5,감동받았습니다!,의미 있는 작품을 보면서 정말 경험할 수 없는 소중한 경험을 간접적으로  해서 정말 좋았습니다!  극의 한사람 한사람에게 몰입하게 되면서 생각해 볼 수 있었던 시간을 갖기도 했습니다! 보면서 웃기도 하고 울기도 하면서 굉장한 선물을 받은 기분이였습니다,2020.09.27
뮤지컬 〈귀환〉 온라인 생중계 - 온라인 관람권,5,백동현 배우님의 진구가 너무 인상적이었어요,백동현 배우님ㅠㅠㅠ 환상동화부터 눈여겨보고있는데 앞으로 더 크게 되실 거예요 항상 응원합니다!!!,2020.09.27
뮤지컬 〈귀환〉 온라인 생중계 - 온라인 관람권,5,재미있어요,온라인으로 뮤지컬을 봐도 현장에서 보는 것 같았어요 너무 재미있어요,2020.09.27
뮤지컬 〈귀환〉 온라인 생중계 - 온라인 관람권,5,펑펑 울었어요,관극할 때는 소리내지 못해서 끅끅 거렸었는데 온라인은 펑펑 울었네요... 초반부터 마음이 너무 아팠어요 숨바꼭질만 하면 수도꼭지 ㅠ,2020.09.27
뮤지컬 〈귀환〉 온라인 생중계 - 온라인 관람권,5,좋은 관람이었습니다.,카메라 워킹도 좋았고 음향도 괜찮게 잘 송출된것 같아 별 탈 없이 즐겁게 봤습니다.,2020.09.27
뮤지컬 〈귀환〉 온라인 생중계 - 온라인 관람권,4,귀환,기다림과 기다림이 만날 수 있도록,2020.09.27
뮤지컬 〈귀환〉 온라인 생중계 - 온라인 관람권,5,꼭 극장에서 보고 싶어요,꼭 극장에서 다시 보고 싶네요,2020.09.27
