musical_title,rate,review_title,review_text,review_date
뮤지컬 〈브로드웨이42번가〉,5,정말 탁월한 선택이었어요!!,"코로나로 지루했던 일상에 힐링 제대로 했습니다.정말 단 한순간도 눈을 뗄 수 없었어요. 신나는 음악에 칼군무 탭댄스~ 배우들의 노래와 완벽한 연기가 이 무대를 위해 얼마나 많은 시간과 땀을 흘렸을지 소름으로 느껴졌습니다. 초등학생 아이 둘과 함께 관람했는데요.끝나고나서 집에와서까지 공연이야기로 종일 재잘재잘^^배우들의 탭댄스도 흉내내가며, 가족간의 이야깃거리도 풍성하게 만들어주는 공연이었어요~홍지민 배우가 극을 시작하며 티켓값이 아깝지않은 공연을 하겠다고 애드립을 하셨는데요~ ㅋㅋ 정말 십원도 아깝지 않았던.. 여태껏 관람한 중에 손에 꼽게 즐거운 공연이었습니다. 같은 역할 다른 배우들의 연기도 기대가 되어서 다른 캐스팅으로 한번 더 관람하려고해요^^주차장이 넓어 주말인데도 주차가 힘들지않아서 좋았구요.즐거운 시간 만들어주셔서 정말 감사합니다~^^",2020.07.26
뮤지컬 〈브로드웨이42번가〉,5,당장 보러가세요!,드디어 탭댄스를 내 눈으로 직접 보다니ㅠ 화려한 연출이 전혀 지루하지 않아요!!,2020.07.26
뮤지컬 〈브로드웨이42번가〉,5,"화려한 무대와 칼군무, 유머 다 누릴수 있는 뮤지컬!","일단 전체적으로 탭댄스가 첨부터 끝까지 나오는데 배우들의 엄청난 연습량이 조금이나마 예상되더라구요, 어마어마했어요, 당연히 엄청 멋지고 칼군무! 완전 최고, 화려함의 끝판왕같은 무대!!   전수경 배우님의 유머와 최정원 배우님의 그르릉? 소리 ㅋㅋㅋㅋㅋㅋ잊히지가 않아요, 두분이야 뭐 말이 필요없고 김환희 배우님의 목소리가 최정원님의 낮고 보이시한 목소리를 듣다가 쨍하니 높은 목소리라 사실 적응이 잘 안되다가 노래 부르실땐 너무 좋드라구요, 아무튼 줄리안마쉬 배역이 주연인지는 모르겠는데 그 매력을 사실 잘 모르겠고, 줄리안보다는 빌리 로러의 매력이 더 두드러지는 느낌?! 이외 코러스맡은 분들의 통통튀는 연기와 노래 너무 좋았습니다.  다음에는 다른 배우들이 연기하는 브로드웨이 42번가를 또 보고 싶어요, 정말 좋은 시간이었습니다!!!!",2020.07.26
뮤지컬 〈브로드웨이42번가〉,5,"화려함, 댄스 그리고 유머?!!!","일단 전체적으로 탭댄스가 첨부터 끝까지 나오는데 배우들의 엄청난 연습량이 조금이나마 예상되더라구요, 어마어마했어요, 당연히 엄청 멋지고 칼군무! 완전 최고, 화려함의 끝판왕같은 무대!!전수경 배우님의 유머와 최정원 배우님의 그르릉? 소리 ㅋㅋㅋㅋㅋㅋ잊히지가 않아요, 두분이야 뭐 말이 필요없고 김환희 배우님의 목소리가 최정원님의 낮고 보이시한 목소리를 듣다가 쨍하니 높은 목소리라 사실 적응이 잘 안되다가 노래 부르실땐 너무 좋드라구요, 아무튼 줄리안마쉬 배역이 주연인지는 모르겠는데 그 매력을 사실 질 모르겠고, 줄리안보다는 빌리 로러의 매력이 더 두드러지는 느낌?! 이외 코러스맡은 분들의 통통튀는 연기와 노래 너무 좋았습니다, 다음에는 다른 배우들이 연기하는 브로드웨이 42번가를 또 보고 싶어요, 정말 좋은 시간이었습니다!!!!",2020.07.26
뮤지컬 〈브로드웨이42번가〉,5,"양준모, 최정원 배우를 보러 갔던 공연에서 김환희 배우의 매력을 알게 되었습니다.","다른사이트에서 예매해서 관람일시가 안적혀있지만, 20년 7월 25일 14시 공연이었습니다. (후기가 깁니다)  저는 뮤지컬을 볼때, 노래를 잘하는 배우를 좋아합니다. 그래서 양준모 배우, 최정원 배우를 보려고 예매를 했습니다.  올해 8월에 개막하는 뮤지컬 킹키부츠, 그곳에 오디션을 거쳐 주연 배역을 한자리 차지하고 있는 많은 배우분들 중 제가 처음 보는 이름이 ''''김환희''''였는데, 그것 때문인지 몰라도 ''''어떤지 궁금한데 미리 볼까?''''하는 기분으로 페기 배역? 을 맡으신 배우분을 보게되었습니다. 그런데, 이 뮤지컬 ''''브로드웨이42번가'''' 공연에서 생각지도 않던 김환희 배우분의 매력을 처음 알게되었습니다. 이분 모습이 ''''어디서 많이 보던 연예인 모습인데?'''' 이생각을 수십번 하면서 보고, 집에와서도 생각하다가, 잘때 즈음에 누군지 알게 되었습니다. 탤런트 이윤지였습니다. 진짜 똑같은 느낌이었어요. 그런 와중에 보여주는 배역의 연기는 귀엽고, 재밌었으며, 춤도 잘추고 노래도 잘하는 모습을 보며 새로운 매력을 느낄 수 있었습니다. 킹키부츠 공연도 기대할게요!  뮤지컬 빌리 엘리어트에서 잠깐 나오는 정도의 탭댄스, 뮤지컬 캣츠에서 고양이를 소개하는 과정중에 나오는 탭댄스만 보았던 저는 진정한 탭댄스의 보고 듣는 재미가 뭔지 이 뮤지컬을 통해 알 수 있었습니다.  최정원 배우의 ''''크흠~'''' 하면서 한손을 앞으로 뻗고, 걸어서 퇴장하는 그런 모습도 누적되가니 보는 관객 입장에서 계속 웃을 수 있었습니다. 그 흰색 옷입고 처음 노래할때는 온몸의 감각이 살아나는 것처럼 닭살돋듯이 자극 되었습니다. 노래는 진짜 좋았습니다.  생각보다 양준모 배우의 배역이 보여주는 모습이 무대위에서 적었습니다. 뮤지컬 보디가드에서 보디가드 역할 배역의 모습처럼. 그래서 좀 많이 아쉬웠습니다. 뮤지컬 영웅에서 보았던 모습이 너무 강렬하게 기억에 남아, 양준모 배역의 카리스마 넘치는 연기와 노래를 기대했었는데 스토리상 어쩔 수 없이 노래가 적었던 것 같습니다.  전수경 배우님도 예전에 뮤지컬 오!캐롤에서 작품 하시는건 봤지만 공연을 본적은 없었는데,(최정원 배우님 공연만 본...) 이번에 연기와 노래를 보고 배역이 보여주는 재미와 노래를 느낄 수 있었습니다. 관객이 감초라고 생각할 수 있는 그런 배역. 이런 배역은 뮤지컬 어디에서도 항상 있었는데, 진짜 찰떡같았습니다. 너무 인상적이었어요. 캐스팅이 잘된것 같았습니다.  그리고 앙상블! 무대를 빛내주신 많은 분들의 매력과 노력을 다시 한번 볼 수 있었습니다. 레베카를 4번이나 본 저는, 주연 배우가 맡은 배역의 연기, 노래가 주를 이루는 그러한 뮤지컬을 주로 봐왔기 때문에, 이 뮤지컬 ''''브로드웨이42번가''''는 앙상블 분들의 노력이 엄청나게 크다는것을 알 수 있었습니다. 주연 배우보다 더 많이 나와서인지, 극이 내려갈 즈음에는 누가 누군지 어느정도 알겠더군요. 여려명이서 박자 맞춰 추는 탭댄스는 기억에 남을 정도로 좋은 추억이 되었습니다. 감사합니다.  음... 보면서도 약간 숭한 느낌이 드는게 있었는데, 앞줄에서 보다보니... 무대위에서 공연하시는 배우분들이 다리를 들때 치마 안쪽이 보이고, 제가 볼 무대 시야를 계속 가려서 앞줄에서 본 사람 입장에서는 좀 숭하면서도 좀 그랬습니다. 차라리 2층에서 볼걸 그랬다는 생각이 들기도 했습니다.  그것만 아니라면 볼거리 많고 귀가 재밌는 그런 공연이었습니다!",2020.07.26
뮤지컬 〈브로드웨이42번가〉,4,탭댄스 칼 군무의 향연&#128077;,"텝댄스 얘기는 들었지만 기대 이상의 화려함에 반했습니당!! 160분 동안 화려한 공연을 선사해 주신 모든 배우 분들에게 박수를 보냅니다. 뮤지컬이 노래만이 아니란 것을 보여주는 공연인듯 했어요. 텝댄스가 너무 화려해서 사실 음악은 잘 기억나지 않지만,  최정원 배우님의 독창은 잊을 수가 없네요! 역시&#128077; 주변의 공연을 볼지 고민하는 분이 있다면 추천하고 싶어요~ 전체적인 화려한 연출과 춤을 보기에 2층 좌석이 참 좋았던 것 같아요~^^",2020.07.26
뮤지컬 〈브로드웨이42번가〉,4,액자식 구성의 화려한 뮤지컬,"눈을 뗄 수 없는 귀여움, 화려함, 섹시함이 담긴 뮤지컬입니다. 무대 연출도 좋고, 신나는 탭댄스를 보는 재미도 있습니다. 뮤지컬 속의 뮤지컬이 신기한 구성으로 서사 보다는 보는 즐거움이 큰 뮤지컬! 추천합니다.",2020.07.26
뮤지컬 〈브로드웨이42번가〉,5,너무 좋았어요 추천합니다!!+,배우분들이 얼마나 열심히 연습하셨을까 생각도들고 프로들이시구나 싶었어요. 너무너무 멋졌습니다. 이번에는 와이프랑 보고왔는데 부모님 모시고 한번 더 다녀오고싶네요 추천추천입니다!,2020.07.26
뮤지컬 〈브로드웨이42번가〉,5,탭댄스 열정,보고 싶었던 뮤지컬인데 드디어 봤어요 역시 배태랑 배우들이라 믿고보는 뮤지컬 엄마 모시고 갔는데 엄마도 좋아하시고배우들의 열정적인 탭댄스에 더운 여름 시원하게 확 풀리는 속이 뻥 뚫리는 기분이었어요 저도 덩달아 몸과 발이 들썩강추입니다,2020.07.26
뮤지컬 〈브로드웨이42번가〉,4,브로드웨이 42번가,"이번에 여름 휴가 데신에 브로드웨이 42번가를 관람 했습니다. 이번 관람이 42번가로는 3번쩨인데 그 어느떼보다 화려한 공연이 었습니다. 뮤지컬 장인인 최정원 배우 님과 모든 배우 들이 열연하셨고요, 이번에도 정말 감명 깊은 공연 이었던것 같습니다.",2020.07.26
뮤지컬 〈브로드웨이42번가〉,5,브로드웨이 42,뮤지컬을 많이 관람 하면서 느낀게 대부분 비슷하다였습니다. 그래서 사실 많은기대없이 브로드웨이42를 보러가게되었는데 최정원/김환희/전수경/양준모님이 연기하시는 회차를 보게되었고 다시 뮤지컬이 주는 즐거움이 생각났습니다. 1층 11열에서 보았는데 생각보다 가까워서 오글없이도 줄겁게 관람할 수 있었지만 배우분들의 열연을 보니 좀 더 자세히 보고싶어 오글을 준비할 껄 살짝 후회했습니다. 군무들도 많아서 다시보게된다면 2층에서도 관람하고싶습니디. 최정원님의 깊이있는 연기와 김환희님의 현란한 탭댄스와 음악를 들으며 절로 신이 났고 극에 집중할 수 있었습니다. 오랜만에 재밌고  좋은 뮤지컬을 보게되어 너무좋고 열연하신 배우분들께 감사드립니다~,2020.07.26
뮤지컬 〈브로드웨이42번가〉,5,양준모 배우님 공연 보고 왔습니다. 최고의 화려함!!,브로드웨이 42번가는 제 생애 첫 뮤지컬이었는데요. 이번에 개인적으로 팬이신 양준모 배우님께서 공연하신다니 당연히 또 봐야죠!!ㅎㅎㅎ 화려한 탭댄스와 신나는 노래가 어우려져서 볼거리가 다양하더라고요. 역시 이번에도 즐겁게 관람하고 왔습니다. 어깨가 절로 들썩 들썩 거렸어요. 아주 유명한 넘버가 있는 뮤지컬은 아니지만 소소한 웃음코드로 꿈을 돌아볼 수 있는 희망찬 이야기예요! 브로드웨이 42번가만의 매력이 있어 좋았어요. 제가 봤던 어떤 공연보다 화려해서 눈과 귀가 아주 즐거웠어요. 그리고 양준모 배우님 솔로는 역시 하..ㅠㅠ 최고예요. 너무 짧아서 아쉬울 따름이요..ㅠㅠㅠㅠㅠ게다가 앙상블 한명 한명 다 역할이 있어서 보는 재미가 배가 되었답니다. 코로나로 지친 요즘 좋은 공연으로 힐링 했어요. 감사합니다~~~,2020.07.25
뮤지컬 〈브로드웨이42번가〉,5,또 봤는데도 재미있는 탭댄스~,두 번째 관극인데도 탭댄스가 더 재미있게 느껴지네요~다음달에 또 봐야겠네요! ㅎㅎ,2020.07.25
뮤지컬 〈브로드웨이42번가〉,5,즐겁게 잘봤습니다!,사실 시간이 비어서 찾다가 망설이다가 예매한거였는데 17년도 쯤인가 멀리서도 재밌게 봤던 경험도 있고 마침 가까이 자리도 있어서 예매해서 본거였는데 후회하지 않게 좋은 공연 보여주셔서 감사합니다! 앙상블 배우분들 특이 여자 배우분들이 너무 칼로 춤을 잘 춰주셔서 감탄하면서 보고 나가면서 캐스트보드 한번 더 보고 나갔네요!! 모든 배우들 진짜 멋있고 잘 추셨지만 진짜 특히 더 감탄하면서 보고 본전 생각 안나게 해주셔서 감사합니다! 이번에는 혼자봤지만 다음에는 엄마랑 같이 또 오고싶은 공연이였어요!!!,2020.07.25
뮤지컬 〈브로드웨이42번가〉,5,너무 재미있게 잘 봤습니다,보는 내내 즐거웠습니다연출 정말 잘 하셨구요배우 분들 정말 고생 많이 하셨습니다 연기와 춤 노래 모두 좋았습니다얼마나 연습을 많이 하셨을까 하고 생각 됩니다좋은 공연 보게 해주셔서 감사합니다,2020.07.25
뮤지컬 〈브로드웨이42번가〉,2,내용은 즐거웠으나 관크네요,"내용은 즐겁고 좋은데 마스크만 제재하시고 공연중 에티켓이 설명을 안하시네요 앞으로 숙이는 건 기본, 자리 옮기고 공연중에 아기들 빅수치고 쿵쿵거리고 마스크만 뭐라할것 아니라 에티켓을 제재해야하는게 아닌지",2020.07.25
뮤지컬 〈브로드웨이42번가〉,5,정말 또 보고 싶은 공연입니다.,"뮤지컬을 좋아하는 아내를 위해 매년 적어도 한 편 이상을 관람합니다.  워낙 유명한 작품이기에 괜찮겠다 생각해서 예매했고, 아내에게 알려 주었습니다.   아내가 사전에 구글링을 좀 했는데, ""스토리보다는 탭댄스가 흥미인 작품""이라는 평이 있어 그런줄 알고 갔습니다.   그러나, 그렇지 않았습니다. 유명한 뮤지컬을 적지 않게 본 저의 경험에서도 브로드웨이42번가는 정말 넘버원 뮤지컬로 손색이 없었습니다.   일단, 화려한 무대와 탭댄스는 기본이고, 여타의 뮤지컬에 손색없는 스토리와 전개가 돋보이는 작품이었습니다. 뿐만 아니라, 한국 출연진들의 연기력은 더욱 몰입을 선사하기에 조금도 부족함이 없었고, 유튜브에서 검색해본 오리지날 배우들에 비해서도 오히려 한국정서에는 훨씬 낫다는 생각이 들정도였습니다.   눈과귀와 마음이 너무나도 즐거웠던 공연! 모두에게 강추이고, 아내와 또 한 번 더 이  행복한 시간을 가졌으면 좋겠습니다.",2020.07.25
뮤지컬 〈브로드웨이42번가〉,5,굳굳,뮤지컬이란게 화려하고 듣는귀도 즐겁게 그 중에서도 브로드웨이는 라인업부터 짱짱,2020.07.25
뮤지컬 〈브로드웨이42번가〉,4,현장에서 느낄 수만 있는 감동,뮤지컬을 보고나서 영국실황을 봤습니다.영국실황은 정말정말 좋았습니다.하지만 현장에서만 느낄 수 있는 감동은 부족하더군요.브로드웨이 42번가를 몸으로 느낄 수 있는 공연입니다,2020.07.25
뮤지컬 〈브로드웨이42번가〉,3,춤만 추고 노래할땐 노래만 함,탭댄스는 좋은데 제취항 아니여서 지루했어요,2020.07.25
뮤지컬 〈브로드웨이42번가〉,5,신나는 무대!,황홀한 무대연출과 탭댄스였습니다ㆍ,2020.07.24
뮤지컬 〈브로드웨이42번가〉,5,관람후기,"온 무대를 단숨에 장악해 버린 탭댄스의 화려하고도 균형감 있는 안무 덕분에, 보는 내내 몰입감이 더해지면서, 그 날을 기억하기 위한 감동과 유쾌함으로 제 기억 속에 깊은 인상을 심어주었습니다. 내 인생 최고의 브로드웨이 42번가를 통하여, 뮤지컬에 대한 새로운 인식을 심어준, 최고의 화제작, <뮤지컬 브로드웨이 42번가>가 앞으로도 쭉 승승장구하는 세계 최고의 브로드웨이 42가로 남았으면 하는 바램입니다.  아자아자, 화이팅!!!.",2020.07.24
뮤지컬 〈브로드웨이42번가〉,5,멋져요~,"엄청나게 감동이 있는건 아니지만, 소소한 감동도 있고,멋진 공연이예요~배우분들의 노력이 고스란히 묻어나는 볼거리많고 화려한 뮤지컬입니다.. 강추요!!다음주에 재관람 예매했어요",2020.07.24
뮤지컬 〈브로드웨이42번가〉,5,시원한 여름날 밤!,탭탠스 소리를 들으면 시원하게 여름을 날려버렸네요  역시 샤롯데 시어타 어느자리 어느 각에서 봐도 잘 보여서 좋았구요  배우님들의 연기와 노래실력도 매우 좋았고요  매우 행복한 공연이었습니다.,2020.07.24
뮤지컬 〈브로드웨이42번가〉,4,조금 낡은 부분이 있었어요,전체적으로 좋았고 볼거리가 많았지만 관객 얼굴 지적을 하는 듯한 모션 등 고칠 부분이 조금 있어서 아쉬웠습니다,2020.07.24
뮤지컬 〈브로드웨이42번가〉,5,배우들의 노력이 엄청난 뮤지컬!,탭댄스! 너무 신나는 공연이였습니다ㆍ,2020.07.23
뮤지컬 〈브로드웨이42번가〉,5,눈을 뗄수없는 공연,말그대로 눈을 뗄수없는 멋진 공연이었습니다!!@,2020.07.23
뮤지컬 〈브로드웨이42번가〉,5,브로드웨이 42번가,너무너무 재미있게 &#48419;습니다. 남녀노소 다 재미있게 볼수있습니ㅏㄷ.,2020.07.23
뮤지컬 〈브로드웨이42번가〉,5,감동,배우들 모두 화려하고 멋진 무대!!,2020.07.23
뮤지컬 〈브로드웨이42번가〉,5,첫 뮤지컬!,친구와 7/22에 함께 봤습니다. 뮤지컬은 처음인데 다양하게 꾸며지는 무대가 너무 재미있었습니다. 배우분들의 밝은 기운을 받아가는 것 같아요. 감사합니다!,2020.07.23
뮤지컬 〈브로드웨이42번가〉,5,너무너무재미있었어요,너무너무 재미있었습니다!,2020.07.23
뮤지컬 〈브로드웨이42번가〉,5,첫 뮤지컬이였는데 앞줄에서 재미있게 봤습니다!,첫 뮤지컬이였는데 앞줄에서 재미있게 봤습니다!,2020.07.23
뮤지컬 〈브로드웨이42번가〉,5,브로드웨이 42번가를 보고,마음을 살찌우는 공연인생을 풍요롭게하는 공연입니다.,2020.07.23
뮤지컬 〈브로드웨이42번가〉,5,보물상자같은 공연,배우들의 연습량이 눈에 보입니다.화려하고 현생을 잠시 놓아둘 수 있는 유쾌한 극이었어요.,2020.07.23
뮤지컬 〈브로드웨이42번가〉,5,멋진 공연,신나고 즐겁고 볼거리가 많은 멋진 공연이었습니다  배우들이 몰입해서 하는 연기와 노래 모두 훌륭하였습니다 다시 기회가 된다면 또 보고 싶어요 힘든 시기 힐링되어 모두 감사드립니다,2020.07.23
뮤지컬 〈브로드웨이42번가〉,5,브로드웨이 42번가 후기,스토리도 좋고 노래..춘..연기 모두 좋아여~~,2020.07.23
뮤지컬 〈브로드웨이42번가〉,5,다시 보고 싶은 뮤지컬,워낙 유명한 뮤지컬이라 따로 설명이 필요없을 정도로 재미있고 유쾌한 극이었어요! 너무 재미있어서 친구들이랑 또 보러 오자고 했어요~ 탭댄스 무대 너무 장관이고 한편으로는 배우분들 너무 힘드실텐데 웃음 잃지 않고 하시는거 보면서 정말 티켓값이 하나도 아깝지 않았어요! 주변분들께 꼭 추천하고 싶은 공연이었습니다.,2020.07.22
뮤지컬 〈브로드웨이42번가〉,5,재미있어요,재미있어요,2020.07.22
뮤지컬 〈브로드웨이42번가〉,5,역시 재미있네요,두번째 보는건데 역시 뮤지컬은 화려한게 좋은 것 같습니다.,2020.07.22
뮤지컬 〈브로드웨이42번가〉,5,첫 뮤지컬 브로드웨이42번가~,"내 인생 첫 뮤지컬로 선택한 브로드웨이 42번가!! 기대 반 설렘 반으로 예약, 예매 후 말로만 듣던 샤롯데씨어터 첫 방문~ 처음 가보는 멋진 극장에 나도 모르게 근사한 사람이 된것 같았다.  캐스팅 라인업을 보고 선택 한 7.18(토) 14시!! 전수경, 최정원  이 말로만 듣던 뮤지컬 대장의 연기를 직접보게 될 줄이야ㅎㅎ 역시 선택은 훌륭했다~~ 그리고 이종혁 배우님도 평소 드라마의 가벼운 모습과 달리 진지하고 무거운 연기를 멋지게 잘 해주셨다ㅎㅎ  특히, 이들 배우들에 뒤지지 않았던 페기 소여 역의 오소연 배우님ㅎㅎ 목소리도 너무 예쁘고, 춤도 너무 잘 추셔서 앞으로 더위 기대되는 배우였다~  여튼 브로드웨이 42번가는 춤, 노래, 재미 등등 모든것을 다 갖춘 뮤지컬인거 같다. 눈, 귀가 쉬지 않고 즐거웠던~ 160분이 16분 같이 느껴졌던~ 그런 첫 뮤지컬이어서, 기억에 오래 남을것 같다!!",2020.07.22
