musical_title,rate,review_title,review_text,review_date
뮤지컬 〈브로드웨이42번가〉,5,멋찜~♡♡,중간중간 재치있는 행동과 말투는 공연의 재미를 더하고 텝댄스는  짱짱 멋졌어요 ♡♡열정과 희망을 가지고 내가 할 일것을 해가는 것과 그들을 중심으로 희망을 찾는 모습도 보여주는 좋은 무대였습니다.,2020.07.11
뮤지컬 〈브로드웨이42번가〉,5,소름,최고에요,2020.07.11
뮤지컬 〈브로드웨이42번가〉,5,최고,줄거리도 모르고 유명한 작품이라 그냥 믿고 예매했는데. 예상안하고 봐서 그런지 너무너무 재밌었어요 탭댄스 장면이 너무 몰입하게 만들고 신나고 신기했어요! 또 중간중간 배우들의 코믹 연기와 멘트들이 너무 재밌었어요~~~,2020.07.11
뮤지컬 〈브로드웨이42번가〉,5,시종일관 즐거워서 보는 내내 행복했던 뮤지컬.,"오래 전 봐서 내용은 익히 알고 있었지만 화려한 의상, 무대, 조명, 안무와 맞춤옷을 입은 듯한 배우들의 매력에 푹 빠져들지 않을 수 없었습니다.",2020.07.11
뮤지컬 〈브로드웨이42번가〉,5,환희배우님 최고에요!!!,진짜 너무너무 신나고 재미있었어요!! 환희배우님 목소리도 너무 예쁘시고 탭댄스도 너무 잘 추시고 진짜 반해서 왔어요ㅠㅠ 그리고 최정원배우님 아우라...미쳤습니다..!!! 보는내내 행복했어요!!,2020.07.11
뮤지컬 〈브로드웨이42번가〉,5,탭댄스 군무는 단연 발군입니다...,브로드웨이의 화려함과 탭댄스 군무의 향연이었어요... 재작년에 이어 두번째 보는데 여전히 현란하군요... 제밌게 잘봤습니다...,2020.07.11
뮤지컬 〈브로드웨이42번가〉,3,춤은굿 노래는 별로,송일국의 형편없는 노래실력에 놀랐다노래가 어느것 하나 귀에 꽂히는게 없었다탭댄스는 신나고 좋았다,2020.07.10
뮤지컬 〈브로드웨이42번가〉,5,너무너무 재밌었어요!,신나는 탭댄스에 중간중간 재밌는 대사들까지  아주 재밌었습니다!  A석에서 관람했는데도 눈과귀가 즐거웠는데   다시봐도 재밌을 것 같은 정말 내용+음악+무대연출 모두 훌륭한 작품이었어요~~!  아는 지인들에게 브로드웨이42번가 완전 추천중이에요 ㅎㅎ  다른 배우님들도 기대되고 또 보고싶어요~~!,2020.07.10
뮤지컬 〈브로드웨이42번가〉,5,현란한 탭댄스!,내용도 알차고 다들 너무 이쁘시고 멋있고 탭댄스에  빠저 시간가는줄모르고 봤네요 또보고싶어요ㅎㅎ,2020.07.10
뮤지컬 〈브로드웨이42번가〉,5,와 심장 두근거려요,와 진짜 배우분들도 다 연기 잘하시고 노래도 좋은데 진짜 앙상블 너무 멋있었어요!! 음탕하고! 찬란하고! 화려한!  멋진 무대 너무 감사합니다! 연출에 두근거리고! 의상에 놀라고! 연기에 감동하고! 노래에 사랑빠졌던 뮤지컬이였어요! 꼭 또 보러 갈게요!,2020.07.10
뮤지컬 〈브로드웨이42번가〉,4,신나는 탭댄스,매번 공연마다 보기는 공연인데  항상 실망시키지않아 좋아요. 배우님들이 최고라 공연에서도 연륜이 묻어나네요.   조만간 부모님 모시고 또 보러갈꺼예요~~^^,2020.07.10
뮤지컬 〈브로드웨이42번가〉,5,탭댄스로 시작 탭댄스로 끝나는 칼 같은 무대,"도대체 얼마나 춤 연습을 한거예요?  탭댄스의 매력에 한껏 빠졌다 왔습니다.  내용 어렵지 않고, 쉽게 이해할 수 있는 공연이고요, 볼거리 너무 화려합니다.  스트레스 많은 분들 보시길 권합니다.",2020.07.10
뮤지컬 〈브로드웨이42번가〉,5,매일 검색하는 브로드웨이..,공연을 보고... 모든 배우님들의 연기에  푹 빠져 버렸네요.. 너튜브검색 네이놈 검색.. 볼수록 매력있는 공연입니다.,2020.07.10
뮤지컬 〈브로드웨이42번가〉,5,꿈의 무대,환상적인 몸짓의 향연... 좋은 공연입니다.,2020.07.10
뮤지컬 〈브로드웨이42번가〉,5,역시 신나고 광란의 무대~~,"머 예전에도 보고 지금도 보고 앞으로도 볼  요즘 코로나때문에 우울하고 힘들었는데, 신나고 행복하게 해주는 무대였습니다..  사랑합니다~",2020.07.10
뮤지컬 〈브로드웨이42번가〉,5,모든것이 다 좋아,남자 주인공을 잘고른듯 유명한 분이 아니라 걱정했는데 노래 넘 좋았다 노래 분량이 넘 아쉬울뿐,2020.07.10
뮤지컬 〈브로드웨이42번가〉,4,흥겨운 공연!,뮤지컬 초보자들이 보기에 극도 화려하고 내용도 심플해서 좋습니다. 탭 댄스의 흥겨움이 아 대극장 뮤지컬이구나 하는 기분입니다.,2020.07.09
뮤지컬 〈브로드웨이42번가〉,5,브로드웨이42번가 후기,뮤지컬 사상 넘나 감동의도가니 였던 공연이였습니다~^!탭댄스에 미쳐버린 1인배우들의 실력에 반해버립니다,2020.07.09
뮤지컬 〈브로드웨이42번가〉,5,반짝이는 별들,화려한 무대는 기본이고 위트와 재미 의미도 담뿍 담은 뮤지컬.2층에서 봤는데 1층 중앙에서 다시보고싶습니다.^^,2020.07.09
뮤지컬 〈브로드웨이42번가〉,4,기대 이상!,"무대, 의상, 탭댄스 모두 화려하고 너무 멋있었어요 배우들도 완벽했고 생각보다 웃음포인트가 많아서 많이 웃으면서 봤네용ㅎㅎ",2020.07.09
뮤지컬 〈브로드웨이42번가〉,3,코로나 여파속에서도 수많은 관중과 함께 즐겨본 브로드웨이42번가,생각보다 내용이 단순하고 메인의 노래실력도 별로인데 나머진 소소하게 즐겁게 봤어요,2020.07.09
뮤지컬 〈브로드웨이42번가〉,5,볼거리가 가득해요.,"화려한 넘버는 없지만 극의 감동과 희망적인 메세지덕일까요?은근히 계속 흥얼대게 되네요. ㅎㅎ신나는 분위기와 탭탭탭 소리가 보는 내내 즐거웠어요.무대장치나 의상, 헤어 등 끊임없는 볼거리가 황홀했어요!",2020.07.08
뮤지컬 〈브로드웨이42번가〉,5,"칼군무와 탭댄스, 그리고 소연♡","워낙 유명한 작품이라 올해는 꼭 봐야지봐야지벼르고 예매했어요. 역시 후회없네요.화려한 무대, 신나는 탭댄스가 눈과 귀를 즐겁게해요.홍지민님과 김호님의 맛깔나는 입담 넘 좋았어요.다른 배우분들도 호화로운 출연진답게 케미가 철철.ㅜ극에 몰입된 탓일까요? 코러스분들까지 전체가 하나하나 다 다시 보게되고 빛났어요. 그치만 뭐니뭐니해도 아.. 페기소여는 오소연님 그자체가 아닌가요? 한줌도 안되는 작고 여린 몸으로 땀이 송글송글 하시면서 어찌나 돌고돌고 스탭을 밟아대시는지.. 감격했어요.재관람 확정♡",2020.07.08
뮤지컬 〈브로드웨이42번가〉,5,아직도 예매 안했어요?,그럼 제가 할게여 울 영주언니 꽃 길만 걸어요,2020.07.08
뮤지컬 〈브로드웨이42번가〉,5,추천 추천해요,이종혁님 공연으로 봤어요~~~ 신나고 누구에게나 추천할 만한 브로드웨이 42번가 다시봐도 후회없을 공연이예요~^^,2020.07.08
뮤지컬 〈브로드웨이42번가〉,5,감동적인 브로드웨이42번가,7월3일 금요일 3시공연 봤습니다~ 이루말할 수 없을 만큼 감동적입니다. 얼마나 많이 탭댄스 연습을 했을지  배우들의 피땀눈물이 고스란히 보이는 작품입니다. 공연보고 김환희 배우님 팬됐어요~!,2020.07.08
뮤지컬 〈브로드웨이42번가〉,4,후기,화려한 볼거리가 있는 부대~~탭댄스는 압권~~너무 유쾌한 뮤지컬이에요~~,2020.07.08
뮤지컬 〈브로드웨이42번가〉,5,신나는 쇼뮤지컬,탭댄스 군무가 역시 최고네요앙상블들이 최고 멋진 뮤지컬인것같아요중간중간 이장면 왜들어가있는거지 의아한 부분도 잇었지만즐겁게 관람했습니다,2020.07.08
뮤지컬 〈브로드웨이42번가〉,5,진짜 대박 짱입니다 ~~♡,가족들과  너무 즐겁게 공연보고왔어요3년전인가 박상원씨꺼보고 요번에 송일국씨꺼봤는데두번봐도 재미있고 신났어요~~~뮤지컬이있어 행복합니다~~,2020.07.08
뮤지컬 〈브로드웨이42번가〉,5,티켓값이 아깝지않다!!,티켓값이 아깝지않다!!,2020.07.08
뮤지컬 〈브로드웨이42번가〉,5,탭 댄스의 매력에 푸욱 빠지다,"유명 배우님만 기억하다가 오늘 김환희 배우님을 또렷하게 기억하게 된 브로드웨이42번가 였습니다 열정적인 탭댄스와 표정이 살아있는 연기 너무 잘봤어요~ 다만, 샤롯데의 냉방시스템이 좀 아쉬웠어요 마스크를 써서 그런지 보는 내내 약간 더웠는데 배우님들이 더운 환경에서도 밝은 표정으로 탭댄스 추는걸 보고 역시 프로는 다르다는걸 느꼈습니다 앞 좌석이어서 땀 흘리는 모습도 생생하게 다 보였는데 냉방만 조금 됐음 정말 완벽한 공연이었어요~",2020.07.07
뮤지컬 〈브로드웨이42번가〉,5,노래보다 춤에 빠지다,공연내내 밝고 신나는 군무와  배우들의 활기찬 에너지로 시간 가는줄 모릅니다 배우들의 땀과 노고가 느껴지는 공연이네요 뮤지컬이라기보다 쇼를 관람한 느낌이네요 눈과 귀가 호강한 공연이에요~,2020.07.06
뮤지컬 〈브로드웨이42번가〉,4,신나는 무대와 스토리,무대 연출과 화려한 탭댄스 군무가 엄청 멋있는 극입니다. 군무를 위에서 거울로 비춰 싱크로나이즈처럼 보여준다거나 인터미션을 극 중 극안에서 실수해 공연 중단하는 것과 연결하여 발표하는 등의 연출은 좋았습니다. 특히 배우분들의 체력이 걱정될 만큼 의상 체인지가 잦아 보는 눈은 즐거웠고 또 격정적인 탭댄스 씬에서는 듣는 귀와 보는 눈 모두를 즐겁게 해주었습니다. 또 캐스팅이 화려한 만큼 배우분들의 연기가 정말 좋았습니다. 감정 이입을하고 극에 몰입할 수 있었고 또 극의 유머러스함이 배가 되었습니다. 아쉬운 점은 양준모 배우님의 노래가 궁금했는데 넘버가 적어서 조금 아쉬웠습니다.,2020.07.06
뮤지컬 〈브로드웨이42번가〉,5,남녀노소 누구나 즐길 수 있는 최고의 쇼뮤지컬,처음 뮤지컬을 접하는 이들에게 가장 추천하고 싶은 뮤지컬. 내용도 쉽고 재미있는데다 볼거리도 풍부해 누구나 즐길 수 있다.,2020.07.06
뮤지컬 〈브로드웨이42번가〉,5,언제 보아도 재미있어요~,탭댄스에 푸욱~배우님들 다들 너무 잘하셔서 눈호강 귀호강 하는 작품!,2020.07.06
뮤지컬 〈브로드웨이42번가〉,4,탭댄스에 빠지다,으아아아아 탭댄스 신나!!!!!,2020.07.06
뮤지컬 〈브로드웨이42번가〉,5,잘봤습니다,화려하고 현란한 탭댄스가 눈을 사로잡는 무대가 재미와 감동을 선사하네요 꼭 보러오세요~,2020.07.06
뮤지컬 〈브로드웨이42번가〉,5,관람후기,재미있었어요..유쾌한 뮤지컬이에요,2020.07.06
뮤지컬 〈브로드웨이42번가〉,5,재밌어요,연기 넘버 뿐만아니라 탭댄스까지 완벽한 뮤지컬!!,2020.07.06
뮤지컬 〈브로드웨이42번가〉,5,브웨,페기랑 빌리 너무 사랑스러움!!,2020.07.06
뮤지컬 〈브로드웨이42번가〉,5,브웨,서사는 좀 많이 이상하지만.... 배우들의 노력은 잘 느껴졌어요,2020.07.06
뮤지컬 〈브로드웨이42번가〉,5,시작부터 소름!!!,탭소리가 꼭 제 심장소리 같았습니당!!,2020.07.06
뮤지컬 〈브로드웨이42번가〉,5,정말 최고의 공연입니다.,볼때마다 짜릿합니다.탭댄스도 너무 좋구요.배우님들 노래실력 너무좋구요ㅠㅠㅠ그리고 특히 오소연 페기소여 넘 사랑스럽고정민 빌리도 짱이에요!!!!꼭 또보고싶어요ㅜㅜㅜ,2020.07.06
뮤지컬 〈브로드웨이42번가〉,5,클래식은 영원하네요,뮤지컬의 집대성이랄까.....많이 봐도 절대 질리지않을 무대네요,2020.07.06
뮤지컬 〈브로드웨이42번가〉,5,강력추천 이에요,처음 시작 할때 탭댄스로 시작 하는 부분부터 소름으로 시작해서 끝날때 까지 소름으로 끝나서 다시보고 싶어지는 뮤지컬이였습니다.,2020.07.06
뮤지컬 〈브로드웨이42번가〉,4,보세요 춤추는 다리,답답하고 무더운 날 시원한 공연,2020.07.06
뮤지컬 〈브로드웨이42번가〉,4,날 부르는 멋진 브로드웨이,화려한 조명 속 현란한 탭댄스  신나는 음악과 시원한 스토리,2020.07.06
뮤지컬 〈브로드웨이42번가〉,5,"경쾌한 탭소리에 묵은 스트레스가 쫙~~, 이 작품이 20년 넘게 사랑 받는 바로 그 이유","보세요 춤추는 다리~ 바로 여기서만 볼 수 있죠 ♬♪♩ 42nd Street …… 아니, 샤롯데씨어터에서  파이브, 식스, 세븐, 에잇! 막이 오르고, 매력적인 다리가 객석에 점차 드러나며 들리는 경쾌한 소리에  제 심장도 그에 맞춰 ‘탁.탁.탁.탁.’ 두근거렸어요.  ‘춤추는 다리’를 자랑하는 예사롭지 않은 오프닝인 오디션 탭댄스 씬부터 턴테이블에 누운 앙상블이 아름답게 군무를 뽐내는 거울 씬, 그랜드 피아노 위에서 페기 소여가 펼치는, 탄성이 절로 나오는 고난도 솔로 탭 등 <브로드웨이 42번가>의 상징인 화려한 탭댄스는 시작과 끝이요, 알파와 오메가라고 말해도 과언이 아닐 정도죠. 탭 소리가 탁탁 들어맞을 때의 그 쾌감이란! 캬  거기에 환상적인 팀워크를 보여주는 캐스트는 물론이고 재지한 스윙 리듬으로 관객들의 내적 댄스를 유발하는 음악과 의상 체인지, 다양한 무대장치로 지루할 틈을 안 주는 볼거리도 언급을 안할 수가 없네요. 진심으로... 공연 보며 묵은 스트레스 쫙~ 풀고 왔어요!!  그런데 <브로드웨이 42번가>가 단순히 화려한 탭댄스만을 보여줬다면 이토록 롱런하진 못했을 거라고 생각해요. 시골 출신 페기 소여가 뮤지컬 <프리티 레이디>에 캐스팅 되며 브로드웨이 스타로 발돋움한다는 큰 플롯 이면에는  뮤지컬을 올리고자 고군분투하는 연출, 제작자, 작곡가, 안무가, 배우 등 여러 인간 군상이 그려져요. 모난 악역 없이 다양한 인물들이 하나의 목표를 위해 저마다 구슬땀 흘리며 합심하는 모습도 이 작품에서 느낄 수 있는 인간적인 매력인 것 같아요.  특히 극 중에선 1930년대 대공황 시대를 배경으로 공연을 올리기 어려운 혹독한 쇼비즈니스 세계를 보여주는데 현재 코로나19로 인해 공연이 취소되거나 중단되는 등 어려운 공연업계의 현실이 오버랩 되면서 극이 더 피부로 와 닿더라고요.  “줄리안 마쉬가 새로운 뮤지컬을 만든대!” “다시 일할 수 있어!”   이전에 봤을 때는 그냥 놓쳤던, 누군가 외치는 ‘다시 일할 수 있다.’는 그 대사가 여느 때보다 절실히 이해가 됐어요.   저는 평소 공연 관람이 취미일 정도로 한 달에 수 회에서 수십 회 관극을 했었어요. 작년까지만 해도요. 그러나 올해는 코로나19 여파로 예매해두었던 공연이 취소되거나 수도권 감염 확산에 따라 자의반 타의반 휴식기간을 가지던 차, 실시간으로 진행 됐던 ‘힘내라 공연 유튜브 토크 콘서트’를 통해 이번 시즌 배우들을 보게 됐어요.  2017년 시즌 디큐브아트센터 공연 당시, 이 작품을 굉장히 만족스럽게 관람했던 기억이 있어서 이번 캐스트는 어떨까 궁금했었는데... 토크 콘서트 시작부터 진짜 빵빵터지고, 연륜있는(?) 배우들의 끝없는 수다행렬과 배우들의 유쾌한 케미에  (원래 한 시간 예정됐었는데 토크가 길어져서 넘버가 뒤로 밀려 한 시간을 꽤 넘기고 끝났던 걸로 기억해요. 근데 진짜 웃기고 정말 정말X100 재밌었어요.) 이거 ‘꿀잼각이다(!)’라는 생각에 유튜브 방송이 끝나자마자 바로 예매를 했답니다ㅎㅎ  3년 전에 봤을 땐 작품 속 배경이 1930년대다 보니 여성 관객으로서 듣기에 좀 껄끄러운 가사들도 있었는데  이번 시즌에서는 대사나 가사들도 사회적인 변화에 맞게 수정했는지 마음 편하게 관극할 수 있어서 흡족했어요.   캐스트야 뭐 이미 이름 들으면 다 알만한 분들이지만...  양준모 배우는 진짜 의외였어요! 처음에 캐스팅 발표를 보고 깜짝 놀랐습니다. 안중근, 장발장, 팬텀 같은 굵직한 역으로만 만나서 쇼 뮤지컬 속 양준모 배우는 상상이 안됐었는데 카리스마 있는 브로드웨이 뮤지컬 연출가 줄리안 마쉬 역을 무게있고도 진실되게 표현하시더라고요!  ‘42nd Street reprise’를 내지르며 피날레를 장식하는데 희열이 막. 어우. 역시 믿보배b  도로시 역에 최정원 배우님. 말해 뭐해요, 입만 아프지. 극 캐릭터처럼 최고의 뮤지컬 스타!  정원 배우가 농염하게 그려내는 넘버와 가볍게 던지는 유우머에 제 맘은 무장해제 당했네요ㅎㅎ  띠용. 여기 좀 보세요! 무대에서 웬 조그맣고 사랑스러운 종달새 한 마리가 춤추며 노래해요! (3년 전 첫 관극 때... 미친 듯이 기량을 뽐내던 오소연 배우를 봤을 때의 충격이란! #잊지_모태ㅎㅎ) 메기 존스의 대사처럼 오소연 배우에게서 정말 “반짝반짝 빛이나”요. 페기 소여 바로 그 자체! 더욱이 작은 체구로 두 시간 넘게 바닥을 두드리며 춤추는데, 아니 어디서 어떻게 그런 에너지와 파워가 나오는지 너무 대단해요.   빌리 역의 서경수 배우, 탭댄스는 처음이라고 들었었는데...  워낙 춤을 잘 추는 배우라 관극 전부터 기대했어요. 와우. 기대를 200% 충족해주더라고요.  저렇게 거대한 사람이 어찌 그리도 유연하고 리드미컬하게 춤을 추는지ㅋㅋㅋ 무대 위에서 즐기는 모습이 밝고 유쾌한 빌리 역에 찰떡이었어요. 게다가 역시 믿(고)듣(는)배(우). 부드럽고 로맨틱하게 소화하는 넘버로 귀호강 했네요^^  메기와 버트 역의 홍지민, 임기홍 배우의 맛깔나는 코믹 연기는 극에 감칠맛을 더해줬고,  애니타임~ 애니 역의 이효진 배우는 탭댄스도 훌륭하고 목소리도 고와서 인상 깊었어요!  그리고 무엇보다 이곳 저곳에서 쉬지 않고 춤추며 무대를 가득채우는 앙상블 배우분들이 보여주는 칼군무 진짜 대박이에요bb   국내에서 1996년도 초연 이후... 역시 20년 넘게 사랑받는 이유가 있는 것 같아요.  어깨를 절로 들썩이게 만드는 탭댄스나 무대 연출 같은 볼거리 뿐아니라 작품이 가진 밝은 힘과 희망을 던지는 메시지는 요즘같이 힘든 시대에 많은 사람들에게 위로와 격려가 되지 않을까 생각합니다.  지친 심신에 새로운 에너지를 공급받고 싶은 모든 분들께 강력 추천합니다.^^b",2020.07.06
뮤지컬 〈브로드웨이42번가〉,5,너무좋았습니다,개인적으로 탭댄스만 기대하고갔었는데 생각보다 배우분들 칼군무도 좋았고 앙상블분들이랑 원캐분들 연기랑 노래를 너무 잘 보고왔어요 스토리도 좋았습니다,2020.07.06
뮤지컬 〈브로드웨이42번가〉,5,세상에서 가장 빛나는 별을 봤어요,빌리 로러,2020.07.06
뮤지컬 〈브로드웨이42번가〉,5,반짝반짝 빛나는 빌리,정민 빌리 무대위에서 너무 빛나고 행복해보여서 제가 다 행복했습니다!,2020.07.06
뮤지컬 〈브로드웨이42번가〉,5,멋진 볼거리가 가득한 열정의 무대,즐거웠어요~ 역시 관록 넘치는 배우들의 열연이 최고,2020.07.06
뮤지컬 〈브로드웨이42번가〉,4,재밋어요,스토리가 오래되긴 했지만 재밋게 볼 수 있습니다.,2020.07.06
뮤지컬 〈브로드웨이42번가〉,4,굿굿,"김환희 페와 서경수 빌리로 관람했는데 두 배우다 탭탠스와 연기 정말 멋있고 좋았어요! 정영주, 전수경 배우의 관록있는 연기도 무척 좋았습니다. 앙상블의 탭댄스 군무도 대단! 약간 불편한 장면들이 1,2막에 좀 있어서 별하나는 뺐어요..",2020.07.06
뮤지컬 〈브로드웨이42번가〉,5,너무신나요,그러면 안되지만 몸 들썩이고 싶은 신나는무대,2020.07.06
뮤지컬 〈브로드웨이42번가〉,5,브로드워이42번가,관객들은 새롭고 열정적이고 눈부시게 빛나는걸 원해 정민빌리,2020.07.06
뮤지컬 〈브로드웨이42번가〉,5,브로드워이42번가,혜성처럼 떠오르는 브로드웨이의 스타 정민빌리 사랑해,2020.07.06
뮤지컬 〈브로드웨이42번가〉,4,주조연 앙상블까지 열정 넘치는 무대,정말 좋았어요,2020.07.06
뮤지컬 〈브로드웨이42번가〉,5,브로드워이42번가,내눈빛속에 오직 그대 난 눈이 멀었죠 정민빌리,2020.07.06
뮤지컬 〈브로드웨이42번가〉,5,브로드워이42번가,정민빌리없이 내가 어떻게 살겠어,2020.07.06
뮤지컬 〈브로드웨이42번가〉,4,신나요,스토리 전개는 별로였지만 탭댄스 군무 너무 좋았어요! 뮤지컬보다는 쇼를 보는듯한!!,2020.07.06
뮤지컬 〈브로드웨이42번가〉,5,정민 사랑해 혜성처럼 떠오르는 브로드 우ㅔ이의 스따,"넌 밤하늘의 별이지, 스따~~~~~~~~~~~~~~~ 하트핫트",2020.07.06
뮤지컬 〈브로드웨이42번가〉,5,30명의 배우들의 군무가 아주 감동이었습니다! 한국인이라면 꼭 봐야할 쇼뮤지컬!,"이 시국에 올라와서 관객이 적다는 게 참으로 안타까웠습니다.ㅠㅠ 탭댄스 보는 것만으로도 너무 신났고, 브웨42번가를 대표하는 2막 후반부의 계단형 무대에서 신나게 안무하는 배우들 보면서 감동의 눈물을 얼마나 흘렸는지 모릅니다. 다 좋았으나 한 가지 아쉬운 점은,여배우분들께서 굳이 저렇게 노출이 심한 수영복을 입어야 하는지.. 보는데 조마조마 했어요. 남배우들은 오히려 더 꽁꽁 감싸서 나오는데 여자분들만 노출이ㅜㅜ",2020.07.06
뮤지컬 〈브로드웨이42번가〉,4,시대/문화보정 잘했네요,지금 원작대로 올리기엔 낡은 고정관념 투성이인데 이정도면 크게 불편하지 않게 잘 다듬었네요,2020.07.06
뮤지컬 〈브로드웨이42번가〉,5,재밌어요,소연페이 사랑스럽고 정민빌리 멋있음탭추는 배우들 다들 너무 잘하고 갓상블배우들 다잘해요,2020.07.06
뮤지컬 〈브로드웨이42번가〉,5,너무 재밌었어요!,"어머니, 동생과 함께 관람했는데 모두 만족한 공연이었습니다! 탭댄스 소리가 아직도 가슴을 두근두근 뛰게만드네요. 다시 조고싶은 공연입니다. 중간중간 웃음을 주는 코믹 포인트도 좋았구요. 만족스러운 공연이었습니다^^",2020.07.05
뮤지컬 〈브로드웨이42번가〉,5,"브로드웨이 42번가, 여름을 시원하게 나는 법","정말 공연 내내 웃으면서 봤습니다. 브로드웨이 42번가>야 말로 이 더운 여름을 시원하게 보내는 방법 아닌가 싶네요. 송일국, 정영주, 전수경 등 캐스팅으로 봤는데 더할 나위 없이 행복한 시간이었습니다. 일상에 지치신 분들은 이 뮤지컬을 활기찬 생활을 할 수 있을 것이고 이미 활기차게 지내고 계신 분들은 더 긍정적으로 이 여름 날 수 있을 것이라 생각합니다. 저는 벌써 이 뮤지컬을 또 보려고 예매했습니다. 여러분들도 이 뮤지컬을 통해 긍정의 힘을 팍팍 받아가 올 여름 건강하게 지내셨으면 좋겠습니다!!",2020.07.05
뮤지컬 〈브로드웨이42번가〉,5,너무 멋진 공연이었어요~,"아이들과 부모님까지 모시고 모처럼 뮤지컬 나들이 잘 하고 왔어요~ 웅장한 스케일과 음향에 훌륭한 연기력까지 갖춘 배우 연기까지 모든게  완벽한 공연이었답니다^^  시간가는 줄 모르고 빠져들어서 봤어요~  송일국, 정영주, 전수경님 등 캐스팅이었는데, 담에 기회가 되서 또 보게 된다면 다른 배우들의 공연도 함 보고 싶다는 생각도 들었습니다. 샤롯데 시어터 주차가 좀 힘들어서 그렇지,, 공연장도 너무 멋졌고~ 관객들도 매너있게 잘 관람해주어서 좋았답니다^^ 브로드웨이 42번가 앞으로도 승승장구하길 바랄께요~ 화이팅!!",2020.07.05
뮤지컬 〈브로드웨이42번가〉,5,브로드웨이 42번가,첫 장면부터 설레고 신났던 42번가!!!다시 볼 수 있어서 좋았어요!,2020.07.05
뮤지컬 〈브로드웨이42번가〉,5,너무 재밌어요. 지루할 틈이 없는 공연,춤이나 음악에 조예가없고 뮤지컬의 라닝타임이부담되던 분들도   가볍고 재밌게 즐길수 있는 공연인것 같습니다.,2020.07.05
뮤지컬 〈브로드웨이42번가〉,4,살짝 아쉬움,배우분들 연기도 엄청 잘하시고 중간중간에 웃기는 장면도 많았어요. 근데 정작 노래는 그닥 끌리지 않았어요 ㅠㅠ,2020.07.05
