,musical_title,rate,review_title,review_text,review_date
740,비틀쥬스,5,비틀쥬스 비틀쥬스 비틀쥬스!,무대장치가 너무 신기하고 배우들도 너무 멋있었어요! 다만 웃음코드 살리는 부분이ㅋㅋㅋㅋㅋ안웃겨서 혼났네요 중간에 무대장치가 안나와서 중단했는데 금방 재게되어서 잘 보고 나왔습니다!,2021.07.26
741,비틀쥬스,5,좋아요,좋아요,2021.07.26
742,비틀쥬스,5,재밌어요 ㅎㅎ,또 보고싶어용… 연장해주세요… 아님 빨리 재연…,2021.07.26
743,비틀쥬스,5,비틀쥬스,무대도 좋고 스토리도 재밌고 넘버도 좋아용,2021.07.26
744,비틀쥬스,5,테마파크에 온 기분,무대장치가 정말 화려해요 재밌었습니다,2021.07.26
745,비틀쥬스,5,비틀쥬스비틀쥬스비틀쥬스,기괴하지만 너무 재밌는 비틀쥬스 짧은 공연기간이 아쉽다,2021.07.26
746,비틀쥬스,5,3회차 전캐찍었어요,"정성화, 홍나현 배우님 너무 캐릭터에 찰떡이라 좋았어요",2021.07.26
747,비틀쥬스,4,저세상 텐션,재밌었어요! 무대도 예쁘고!!,2021.07.25
748,비틀쥬스,5,코시국 현생을 잊게 해주는 행복전도사 델리아와 저세상텐션 가이드 비틀쥬스가 온다.,세종 문 열자마자 팀버튼 냄새 솔솔 벌써 극에 몰입이 되게끔 세트장 같은 극장에 가슴이 설레고 쉴틈없이 요동치는 조명에 눈이 살짝 아팠지만 점점 커져가는 소리에 나도 모르게 빠져들게 되는 비틀쥬스. 쉴틈없이 쏟아지는 대사와 춤과 연기. 에버랜드 롯데월드 갈 필요없음. 비틀쥬스 보세요.. 위키드보다 더 화려한 무대세트. 돈맛 폴폴 풍기는 연출. 왜 연기됐는지 짐작이 가는..공연. 꼭 보세요!,2021.07.25
749,비틀쥬스,5,비틀쥬스,비틀쥬스 비틀쥬스 비틀쥬스 ~ 기분좋아지는 뮤지컬,2021.07.25
750,비틀쥬스,5,다양한볼거리,무대도 화려하고 조명은 더 화려하고 소품 활용도 잘되는 공연유령나오는 뮤지컬 답게 공중부양도 하고 분신술도 쓰고 몸도 분리하는데 소화하는 바우님들 멋있으시다 특히 앙상블 배우님들 분장도 많고 무용도 많은데 실수한번없이 너무 잘하시고 노래까지 잘하셔서 놀랐어요 앙상블 맛집이에요,2021.07.25
751,비틀쥬스,5,화려한 연출,"자꾸 연기가 되어서 걱정했는데, 기대보다 훨씬 화려하 연출에 무척 재미있게 봤어요. 다른 페어로 또 보고싶네요.",2021.07.25
752,비틀쥬스,5,즐거웠어요~,여름에 딱 어울리는 뮤지컬이었어요무대장치 볼거리도 많았고. 캐스팅 너무 좋았어요웃음. 감동도 있어서 만족했어요!,2021.07.25
753,비틀쥬스,5,재미있어요,코로나로 더 앞에서 볼수 있었는데 취소 되고 다시 예매 할수 있어서 볼수 있었다 초연으로 너무 잘 만들었고 볼게 많은 작품이다,2021.07.25
754,비틀쥬스,5,재밌어요~,미국식 유머가 가득한 극이에요 무대장치도 멋져서 보는 재미가 있습니다,2021.07.25
755,비틀쥬스,4,오랜만에 쇼 뮤지컬이네요,개막도 늦춰지고 코로나로 어수선한 때 힘들게 올려져 이제야 관람했는데 정말 오랜만에 쇼뮤지컬을 본거네요 배우들의 대사량도 엄청많고 얼마나 노력해서 준비했는지가 그대로 무대에 나타나는 공연이었네요 세트도 역시 화려하고 좋더라구요^^,2021.07.25
756,비틀쥬스,5,bbbbb,bbbbb,2021.07.25
757,비틀쥬스,4,볼거리가 많지만,사이드블럭은 피하세요~! 시각 효과가 반감되어 거의 없디시피해요. 무대전환 효과가 제일 강조된 뮤지컬인 것 같은데 그걸 제대로 못봐서 아쉽습니다. 중앙에서 봤으면 훨씬 좋았을 것 같아요~ 후반부 급하게 내는 결론은 별로지만 가볍게 보기 좋아요~!,2021.07.25
758,비틀쥬스,3,간간이 퍼포먼스는 볼 만 하지만 전체적으로 중구난방,"이미 원작이 유명한 작품을 뮤지컬로 구현하기가 쉽지 않은데... 역시 <비틀쥬스>도 마찬가지였다. 일단 뮤지컬은 노래가 좋아야 하는데 꽂히는 노래가 없었으며, 전체적으로 스토리 라인은 좀 중구난방이었다. 팀버튼의 영화(한국 제목은 ''유령 수업'')는 1980년대 영화임에도 불구하고 예측 불가한 상상력 자체가 엄청났고, 개별 캐릭터와 이를 연기한 배우들 하나 하나가 워낙 매력적이어서 이를 보는 맛이 있었는데, 뮤지컬에서의 캐릭터와 배우는 그냥... 열심히 따라하는 수준이었다. 배우들의 캐릭터 구현이 어려웠을 수도 있고, 스토리 라인 자체가 영화와 달리(많이 각색됨) 개연성이 떨어지고 감정선이 많이 튀어서 몰입하기 어려웠을 수도 있을 것 같다. 등장인물들의 감정 곡선이 종잡을 수가 없고, 그래서인지 연기 자체도 매우 오바스럽다. 뮤지컬 연기 자체가 오바스러워서 뮤지컬을 좋아하지 않는다는 사람들을 종종 보는데, 이 뮤지컬이 단연 그러했다.  그래도 1부 끝이나 2부 초반에 퍼포먼스는 나름 흥미롭게 볼 만 했다. 영화와 비교하면 영화가 훨씬 낫지만, 그럼에도 불구하고 뮤지컬 보기 전에 영화를 보고 가길 추천한다. 그래야 그나마 스토리를 따라갈 수 있을 것 같기 때문이다. 전체적으로 많이 아쉽지만 별 3개를 주는 이유는 그래도 내가 뮤지컬을 좋아하기 때문이다.",2021.07.25
759,비틀쥬스,5,이번이 두번째 곧 세번째,어렸을 적 어렴풋이 영화로 본 기억이 있어 중고딩 때 다시 한번 영화로 본 비틀쥬스 네이* 탐험하다 한쪽에 발견한 비틀쥬스 뮤지컬 광고 배우도 정성화님 유준상님이 나오신다 고민없이 정성화배우님 네이* 검색해서 7월 6일 예매 이것이 개막공연이 될 줄이야~~!! 이 때 처음 홍나현배우님을 봤는데 청아한 목소리 첫 노래에 온몸이 소름이 돋았다  안되겠다 유준상배우님으로 대시 예약 물론 홍나현배우님 다시 보고  다시 듣고 싶기도 하고 하지만 네이버 VIP석 매진ㅠㅠ 어쩔수 없다 플랜B 인터파크로 가요~~!!(약간 스포???ㅋㅋㅋ) 그렇게 7월 24일 예약대기 다행히 자리가 나왔다 하지만 코로나 4단계 혹시 예약 취소 되는 것 아닌가 하는 두려움도 있었다  다행히 취소는 없었고 이번엔 여러 굿즈상품도 구매~~!! 넘나 좋은거~~!! 처음보고 다시보니 대사 가사가 들리니 더욱 재미 감동이 급상승  이대로 뭔가 아쉽 다시 보고 싶다 또 보고 싶다~~!! 결국 다시 예매 곧 만나러 가요~~!!  PS : 처음 C 50번대 두번째 C 130번대 곧 세번째 C 160번대 ㅜㅜ 점점 멀어져가요~~!!ㅠㅠ 가까이 보고싶다,2021.07.25
760,비틀쥬스,4,음향이 아쉬웠지만 즐기다 왔어요!,"무대를 깊게 사용하지만 세트나 장치때문인 것 같았고, 대체적으로는 배우들의 동선은 거의 무대 앞쪽에서 진행됩니다. 그래서 광활한 세종문화회관의 저세상석에 앉지 못해서 다소 시야가 멀어질까봐 걱정했는데 괜찮았어요! 연기하는 배우들은 모두 베테랑에 딕션도 좋으신 것 같았는데.. 아무래도 음향시설이 좋지 못한 것 같아요. 음향이 웅웅대서 대사나 노랫말이 잘 안들려 파악하기 힘든 부분이 생각보다 많았고, 어떤 부분은 시끄럽다고까지 느껴졌어요. 내용상 분명 필요한 대사고 넘버일텐데, 다음번에는 좀 더 음향이 좋은 시설에서 공연하심이 좋을 것 같습니다.  영화 비틀쥬스와 맥락을 같이 하지만, 뮤지컬적으로 각색된 부분이 많고 이야기 전개방향도 조금 다릅니다. 하지만 영화를 보고 가시면 더 이해가 편하실 거예요. 음향이..정말...정말...별로라...저 영화 안보고 갔으면 그곳에 나오는 모든 인물의 서사를 이해하기 힘들었을거예요@_@;;  재연을 준비하실 계획이라면, 음향이 조금 더 괜찮은 곳에서 함께 하길 바랍니다. 장민제배우님, 신인이라고 보았는데 정말 잘하시네요. 다음번에 배우님 공연하시게 되면 보러갈게요! 그 외 베테랑배우님들의 열연은 최곱니다. 정말 저세상 텐션이라는 말이 괜히 나온말이 아님 ㅎㅎ 올 여름 정말 더운데, 비틀쥬스덕분에 2시간 행복했어요~",2021.07.25
761,비틀쥬스,5,호불호가 있는 공연같아요,놀이공원 공연을 보는 듯 합니다,2021.07.25
762,비틀쥬스,5,최고의 쇼 뮤지컬,코시국에 쌓여가는 스트레스를 한 번에 날려버릴만큼 강렬한 공연이었어요,2021.07.25
763,비틀쥬스,5,왕뱀이 너무 귀여워요,놀이공원에 온 듯 너무 신나고 재밌어요,2021.07.25
764,비틀쥬스,5,비틀쥬스! 비틀쥬스! 비틀쥬스!,너무 재밌었습니다~ 2막은 너무 갑자기 전개된 느낌이 있었지만 재밌었어요~,2021.07.25
765,비틀쥬스,5,올만에 힐링,"무더위가 기승인 시기.  나른하고 의욕없는 하루 하루에 무언가 희열을 느낄 수 있는 화점이 절실한 시점이다.  볼만한 무언가를 써칭중에 찾은 비틀쥬스.  다행히 인터파크에서 좋은 자리를 겟하고, 일찍 세종문화회관에 도착해 티켓팅과 사진도 찍고…좀 늦으면 줄서서 기다려야해서…. 공연 초반의 전개는 이야기의 구도를 잡기위해 조금 나른한 면은 있지만 중반으로 갈수록 멋진 군무와 잘 짜여진 무대장치 그리고 배우들의 열정이 돋보였다.  코로나로 꽉 채우지 못한 좌석이 엄중한 현실을 대변하지만,  배우들의 열연과 멋진 스토리가 한여름 밤에 즐겁고 행복한 희열을 느낄수 있는 좋은 작품인 듯 하다.",2021.07.25
766,비틀쥬스,5,7/23,"무대 장치 보는 재미도 있지만 배우님들이 너무너무 잘해서 조금 엉성한 스토리 마저도 집중하게 만들어주셨습니다. 유리아,장민제,전수미 그리고 앙상블 배우님들 ㅠㅠㅠㅠㅠㅠㅠㅠ 정성화 배우님도 말할것없이 너무너무 좋았습니다. 마지막 공연까지 무탈히길!",2021.07.25
767,비틀쥬스,5,볼 가치가 있는 뮤지컬,무대장치만으로도 볼 가치가 충분히 있는 뮤지컬이라 생각합니다~! 하지만 배우들의 연기도 너무너무 좋았습니다@,2021.07.25
768,비틀쥬스,5,코로나 속을 뚫고,코로나 속을 뚫고 드뎌 보고 왔습니다. 넘 행복한 시간이었습니다.,2021.07.24
769,비틀쥬스,5,장민제를 알 수 있어서 좋았던 극,물론 서사는 부족하지만 엄청난 빛과 무대장치로 꽤 만족했다. 특히 정성화 비틀쥬스와 유리아 바바라 찰떡이었다. 신영숙 델리아는 어떻고. 특히 장민제 리디아가 완전 잘 어울려서 처음 본 배우였는데 깜짝 놀랐다. 한 번만 보려고 했는데 장리디아 다시 보러 갑니다..,2021.07.24
770,비틀쥬스,5,저세상텐션 인정인정!!!!,한번 더 보고 싶어지네요ㅎㅎ 행복하게 해주셔서 고맙습니다^^,2021.07.24
771,비틀쥬스,5,재밌었어요,특히 무대가 생각했던것보다 더 화려했습니다 항상 무거운 극만 보다가 간만에 신나고 재밌는 극 잘 보고 왔습니다,2021.07.24
772,비틀쥬스,5,기대만큼..,"후기보고 솔깃하고, 정성화/유준상 배우님 주연이라 보게된 공연인데...홍나현 배우님의 재발견이었습니다...신인상을 노려보셔도 될듯한...자칫 지루하게 될수도 있는 부분을 이배우님 역할때매...너무 신이났습니다....(전 왜자꾸 가수 윤하가 오버랩이..)가창력, 역할소화 정말 대박이시고... 다른배우분들도 연기, 노래 다...흠잡을데가 없네요....이번엔 볼수있는 시간이 정성화배우님 공연이었는데..보는내내 유준상배우님은 어떻게 소화를 할까 궁금해지게 하더군요....끝나기전에 꼭 유준상배우님꺼로 다시한번 볼예정입니다. 아, 물론 리디아는 홍나현 배우님꺼로 ㅎㅎ",2021.07.24
773,비틀쥬스,5,적어도 한번은 꼭 봐야 할 뮤지컬,"눈이 심심할 틈이 없다!!! 이렇게 개성적인 무대를 또 어디서 볼 수 있을가 싶다. 삐까뻔쩍한 조명과 무대장치를 보다보면 꼭 놀이공원 퍼레이드를 보는 것 같다. 여기저기서 등장하는 퍼펫들 중 아주 중요한 역할을 담당하는 거대한 모래뱀인 왕뱀이는 너무 귀엽다.스토리는 템포가 아주 빠르고, 갑자기? 싶은 면이 없잖아 있다. 하지만 얼레벌레 전개가 매력인 개그 뮤지컬이라는 정체성을 생각하면 아주 큰 마이너스 포인트는 아니다.그도 그럴 것이 공연시간 내내 웃을 수 밖에 없는 요소들을 끊임없이 던져댄다. 미국 시트콤식 개그와 한국식으로 로컬라이징한 유머를 듣다보면 이게 뭔 혼종인가 싶은 느낌도 들긴 하지만 어쨌든 재밌다. 아주 재밌다.와 또 보고싶다",2021.07.24
774,비틀쥬스,3,쇼뮤지컬이라 서사는 부실한 게 맞지만,번역 질이 안 좋아서 그걸 더 티내서 아쉬웠음,2021.07.24
775,비틀쥬스,5,볼수록 재미있음,"볼거리 맛집! 볼수록 더 보고싶은 뮤지컬이네요. 배우님들 다 잘하고 무대, 의상, 조명, 음악... 뭐하나 아쉬운게 없어요. 미국식 유머도 적응되니 웃겨요!하하하 공연기간 너무 짧은데..연장은 안될까요?",2021.07.24
776,비틀쥬스,4,볼 거리가 엄청 많아요,"뮤지컬에 볼 거리가 많다는 게 무슨 말이냐 ! 이런 저런 효과들, 소품들로 인해 마치 놀이동산에 와있는 것 같은 느낌을 받을 수가 있었습니다 :)  홍나현 리디아가 너무 잘해서 깜짝 놀랐어요 ㅠㅠ 한 번쯤 보시는 걸 추천합니다",2021.07.24
777,비틀쥬스,5,화려한 쇼 뮤지컬의 표본,"무대가 정말 화려하네요. 오랜만에 잘 만들어진 대극장 뮤지컬을 본 느낌입니다. 스토리 부분에서는 다소 아쉽지만, 공연을 보는 동안 놀이공원 퍼레이드를 보는 착각이 들 정도였어요. 뮤지컬 관극 생활을 1년 넘게 해보면서, 무대 장치로 소름 돋은 적은 처음이네요! 다만 음향이 조금 아쉬웠습니다.",2021.07.24
778,비틀쥬스,5,신박한 무대효과,무대효과랑 세트 진짜 신박하고 예쁘고 신경써서 만든게 느껴졌어요. 스토리가 살짝 부족한 부분도 있지만 이번이 초연이니 앞으로 보완해나가면 더욱 재미있는 작품 될 것 같습니다.그리고 정성화배우님 비틀쥬스 그 자체 너무 찰떡입니다. 자칫 조금 어색하고 오글거릴 수 있는 부분도 익살맞게 커버하시네요 ㅋㅋ 그리고 전수미배우님 진짜 멋있었습니다!,2021.07.24
779,비틀쥬스,5,너무나 웃다 나온 뮤지컬,즐거운 공연이였습니다 감사합니다:),2021.07.24
780,비틀쥬스,4,비틀쥬스~ x 3,약간 미국식 코미디인가? ㅎㅎ2부 너무 재밌게 봤어요 찡함도 있고~중간중간 나오는 괴물? ㅋㅋ 진짜 웃겨용,2021.07.24
781,비틀쥬스,5,최고의 뮤지컬,왜 무대 세트 때문에 개막이 연기된 건지 충분히 알게됨....,2021.07.24
782,비틀쥬스,5,참 미국스러운 뮤지컬,일단 신영숙 배우님 봬서 너무 좋아요ㅎㅎ  자본의 맛이 느껴지는 무대와 조명이 좋았어요.,2021.07.24
783,비틀쥬스,5,"비틀쥬스, 비틀쥬스, 비틀쥬스!!!","비틀쥬스, 유머러스한 부분이 많아서 마냥 무서운 존재가 아니라고 느꼈어요.정성화 배우님 비틀쥬스 찰떡!!홍리디아 너무 귀여워요 ㅎㅎㅎ 작은 체구에 그렇지 못한 성량;창용 아담, 지우 바바라 너무 착한 부부 ㅋㅋㅋㅋ두 부부의 케미가 환상입니다.마마님의 델리아는 의외였어요! 이렇게 재밌으신 분이였다니 ㅇ0ㅇ 놀랐습니다김용수 배우님과 잘 어울렸어요 ㅋㅋㅋ흥겹게 본 뮤지컬 비틀쥬스! 재연으로 또 돌아오길 바랍니다.무대장치와 조명 미쳤움!!!!",2021.07.24
784,비틀쥬스,4,"무대 효과 맛집, 비틀쥬스!",로비부터 객석까지 정성이 듬뿍 느껴지는 공연이었어요.배우님들도 너무 잘하시고 특히 무대 효과가 대박이었습니다~!,2021.07.24
785,비틀쥬스,4,비틀쥬스 비틀쥬스 비틀쥬스!,정말 오래 기다린 끝에 드디어 봤어요 솔직히 엄청 기대한 만큼은 아니지만 유쾌하고 재밌게 봤어요,2021.07.24
786,비틀쥬스,5,여름에 어울리는 신나고 시원한 뮤지컬!,진짜 재밌어요 -  그리고 사람이 귀신보다 나빠요 ㅋ,2021.07.23
787,비틀쥬스,5,여름에 어울리는 신나고 시원한 뮤지컬!,진짜 재밌어요 -  그리고 사람이 귀신보다 나빠요 ㅋ,2021.07.23
788,비틀쥬스,5,"용아담 채고,,","나오기만 하면 어린이 채널 되는 매직 ㅋㅋㅋㅋㅋㅋㅋ 저 선배,,, 완전,,, 상담 필요해!!",2021.07.23
789,비틀쥬스,5,유머코드가 안맞긴 하지만 재밌어요,"음향이 안좋은데다 너무나 서양식 B급 코미디,,, 내용 따라가기 벅찼지만 눈이 즐거워요",2021.07.23
790,비틀쥬스,5,눈뽕 대박,역시 돈이 좋긴 좋군요..,2021.07.23
791,비틀쥬스,5,평이조아서...,새로 하는 작품이라....평과 주연배우님(정성화배우님)에 대한 신뢰도만으로 보게된 공연인데.....역시나 만족이거니와........홍나현배우님의 새발견이네요............정말.......신인상...아직 안받은 분이면..받으실듯......,2021.07.23
792,비틀쥬스,5,또 보고 싶어요,후기 안 좋은 평 이해가 안 갈 정도로 재밌게 봤어요. 같이 본 애인도 재밌다고 해서 또 볼 생각입니다!호와 불호는 개인의 자유지만 그래도 열심히 계획한 관계자분들도 계시는데 최악이니 어쩌니는 좀 아닌 것 같아요,2021.07.23
793,비틀쥬스,5,기대이상으로 재밌어요!,"엄마와 함께 너무 재밌게 관람했습니다~한번 취소되고 재예매로 본 공연이지만, 새로 알게된 배우님들과 기존 팬이였던 배우님들 덕에 재밌는 공연 관람했어요~ 비틀쥬스 최고네요~",2021.07.23
794,비틀쥬스,1,양심은 있나요? 생각은 있나요?,너무하네...,2021.07.23
795,비틀쥬스,1,끔찍하다,최악이야... 정말...,2021.07.23
796,비틀쥬스,5,3층이 너무 아쉬웠지만 ㅠ,브로드웨이 못지 않는 한국 뮤지컬의 저력을 다시 한 번 느꼈습니다.최고였습니다 bb,2021.07.23
797,비틀쥬스,5,동화에서 삶과 죽음을,"언뜻 TV에서 비틀쥬스 영화 한 장면을 보고 지나갔다. 그리고 공연을 보게 되었다. 공연을 보면서 가장 감탄을 많이 한 것은 무대 장치와 특수효과였다. 우리나라 무대 예술이 그 정도일 줄은 생각도 못했다. 한정된 공간에서 지루할 틈 없이 바뀌는 무대와 애니메이션을 보는지 실제 모습을 보는지 분간이 가지 않을 정도였다. 일단 무대가 동화처럼 아름다웠고 인물들도 예뻤다. 비록 죽은 자와 악마가 나오지만 신나는 음악 속에서 깊에 울림이 되어 나오는 외로움과 언젠가는 겪게 될 이별이 아주 어둡지 않게 표현되었다. 즐거운 춤과 노래 속에서 나의 죽음에 대해서도 밝게 생각할 수 있는 시간이었고, 주요 배우들의 열과 성을 다한 연기, 춤, 노래는 존경스러웠다. 영화 화면 속의 인물들이 그대로 무대에서 입체적으로 구현되는 공연을 보면서 교육계에 종사하는 사람으로 우리 학생들에게 보여주면 참 좋겠다는 생각을 했다. 물론 성인 내용을 빼면 창의력과 상상력을 무한히 줄 수 있는 훌륭한 공연이라고 생각했다.",2021.07.23
798,비틀쥬스,5,죽음을 통해 삶을 노래하는!,"3층에서 봐서 텔레비전 보는 것 같은 느낌이긴 했지만..ㅎㅎ 팀버튼 작품 워낙 좋아해서 재밌게 봤습니다. 나쁜 캐릭터 하나도 없이 죽음을 통해 삶을 노래하는 작품이라 너무 좋았어요. 겉모습은 기괴하고 개구지게 보이지만, 이해하고 사랑하게 되면서 모든 관계들이 회복되는 참 예쁜 작품이었습니다. 물론 중간에 손발 오글 하던 순간도 있었지만요. ^^; 다음에 또 볼 기회가 있다면 저세상관광석에서 함 보고 싶네요. ㅋㅋ",2021.07.23
