,musical_title,rate,review_title,review_text,review_date
446,비틀쥬스,5,뮤지컬에서 브로드웨이를 본듯,"우선 비틀쥬스가 우리나라에서 처음 브로드웨이에서 가져온 작품이라 조금 걱정도 되고 기대도 되었던 것 같아요. 그렇지만 기대를 정말 넘어선 뮤지컬, 아니 공연이었습니다!  저는 정성화, 홍나현 배우님의 비틀쥬스를 관람하였는데요, 두분의 연기력은 정말 물론이고, 뮤지컬 넘버들이 정말 다 좋았던 것 같아요! 브로드웨이의 미국적 감성이 담긴 넘버들의 가사들을 한국적 느낌으로 바꾼 것들이 너무 재치있고 친근하게 다가왔고, 배우님들 모두 캐릭터의 느낌을 정말 잘 살려서 노래를 불러주셨습니다.  그리고 특히나, 홍나현 배우님의 연기력에 놀라기도 했습니다! 어린 나이임에도 감정씬이 사이사이 있었던 것들을 몰입이 잘 되게끔 도움을 주었던 것 같아요,, 정성화 배우님은 말이 필요없이 믿고 보았구요!  넘버들 뿐만이 아니라 스토리 라인도 매끄럽게 잘 이루어졌고 이해가가도록 잘 설계해주었던 친절한 뮤지컬이라고볼 수 있었겠네요!! 그래서 저는 이 뮤지컬이 뮤지컬 입문 작품으로 아주 적합하다고 생각합니다! 저와 같이 간 친구도 뮤지컬을 처음 본 친구였는데 정말 만족스럽다고 말해주어 내심 뮤덕으로서 뿌듯했답니다**><** 아무튼 누구나 남녀노소 보기 좋은 뮤지컬임에 확실합니다 @ 강력히 추천해요 !!!! 마지막으로 감정적으로 힘든 시기를 겪던 저에게 울림을 준 짧은 대사하나 두고 끝낼게요! ‘죽으나 사나 와로운건 같더라고,’-비틀쥬스",2021.08.02
447,비틀쥬스,3,홍보에 비해 별로,자본주의의 맛이 느껴지는 대극장 극이긴 하나 홍보했던 것 만큼의 기대치는 나오지 않아 아쉬웠어요. 무엇보다 개막을 두번이나 미루고 저또한 몇번이나 썰리고 겨우 봤기에 큰 감흥은 없던 거 같아요. 그정도의 값어치가 없었달까. 그리고 제작사의 대처방식도 크게 실망해서 괜히 봤다는 생각이 들었어요.,2021.08.02
448,비틀쥬스,5,재밌어요~,"지난번 2층에서 볼 땐 소리가 너무 울려서 대사, 가사가 잘 안들렸는데 1층은 울림이 덜해서 2층보다는 대사전달이 잘 되는 것 같습니다. 재밌고 신나는 극이고 브로드웨이극 느낌이 물씬~ 요즘 뮤지컬들이 거의 무대이동 없이 영상으로 변화를 주는데 비틀쥬스는 무대 이동이 많아서 더 생동감이 느껴져요. 이래서 개막을 미루면서까지 무대를 신경썼구나 싶은 생각이 들더라구요. 마지막까지 배우님들 화이팅 하세요. ^^",2021.08.02
449,비틀쥬스,4,연출이 끝판왕,"연출이 그냥 미쳐버렸어요, 리디아 역으로 나온 배우님도 노래 너무 잘하시고 그냥 연출이 다했어요",2021.08.02
450,비틀쥬스,5,재밌어요.,밀리다 겨우 봤는데 효과도 배우분들 노래 연기도 좋아요.,2021.08.02
451,비틀쥬스,4,즐거운 시간이었습니다.,좌석도 마음에 들고 공왼 시간 동안 즐거웠습니다.,2021.08.02
452,비틀쥬스,4,2분동안 인간으로~,"시람으로 살면서 2분은 너무나도 짧은 찰나이지만.. 그 어떤 존재에게는 정말 길고도 소중한 시간이라는 걸 생각하게 해준 내용 노래, 춤 바삐 움직이는 무대, 뱀에게 박수를!~",2021.08.02
453,비틀쥬스,4,숨 쉴 틈이 없는 공연,"노래도 빠르고 움직임도 많고~ 정말이지 배우들이 넘 힘들었을 것 같은 무대! 하지만 그만큼 지루함도 없고 신나고~ 부분적으로 화음이 이상타~ 싶은 곳도 있었지만 배우들의 개인 노래실력도 좋고, 앙상블도 넘나들 잘하시고~ 신나는 공연이었어요",2021.08.02
454,비틀쥬스,5,가족과 함께,공연보려고 큰 맘먹고 찾으면 늘 막내아들이 문제였습니다. 가족과 함께 뭔가를 하고 싶었는데 아들이 초6이라서 함께 볼수있는극이 별로 없었어요. 너무 시시하거나 어렵거나.. 그치만 비틀쥬스는 그런고민을 잘 이해하는 극 같았어요. 여러가지 화려한 무대를 보는것 만으로 눈호강이었고 배우님들의 노래를 듣는것만으도 확실히 귀호강하고 있었어요. 스토리도 크게 어렵지 않고 마지막 전하는 메세지도 훈훈합니다. Md샾과 포토존에 줄서있는것 빼고는 다 굿굿이에요. 부스를 늘리고 장소를 좀 고민해야할듯해요. 거리두기가 어렵습니다. 자고나서도 비틀쥬스이야기 계속합니다. 이여름 가족과 강추입니다. 배우님들 최고입니다.,2021.08.02
455,비틀쥬스,5,비틀쥬스,아동극같지만 무대는 좋았어요,2021.08.02
456,비틀쥬스,4,ㅈㅔ작사는 별로..,공연은 좋았어요,2021.08.02
457,비틀쥬스,5,비틀쥬스 보러 갔다가 리디아 에게 반하고 왔다!,"""비틀쥬스"" (극본:스캇 브라운, 앤서니 킹 작사,작곡:에디 퍼펙트 한국연출:심설인 한국어 대본:김수빈 음악음악감독:원미솔 한국안무감독:이현정 무댁수퍼바이저:이엄지 조명수퍼바이저:박민수 음향수퍼바이저:김기영 영상수퍼바이저:박준 의상수퍼바이저:조문수 소품수퍼바이저:최혜진 출연:정성화, 장민제, 김지우, 이창용, 김용수, 신영숙, 오종훈, 장예원, 전재현, 이자영, 유민영, 김준오, 오홍학, 서경수, 백승리, 장진수, 김명주, 신채림, 이재희, 이한주 제작:CJ ENM 극장:세종문화회관 대극장 별점:★★★★★) 원작은 팀 버튼 감독의 1988년도 영화이다. 영화에서는 17살의 위노나 라이더가 리디아 역을 맡았다. 위노나 영화인데 이걸 왜 안 봤지? 아무튼 두 번이나 연기 되었던 뮤지컬을 보고 왔다. 와우! 연기될 만 했구나... 무대효과가 정말 놀랍고 신기했다. 공중 부양 어떻게 한 거야? 극장에 입장하면 저세상관광석 이라 눈 앞을 바로 비추는 조명 때문에 눈이 부시지만 그래도, 하우스 음악과 더불어 분위기는 잘 살려준다. 내용은 그렇게 복잡하지 않고 ""쿠로이 저택엔 누가 살고 있을까 ?"" 가 생각 나기도 한다. 쇼뮤지컬 답게 그냥 즐겁게 볼 수 있다. 다만 세종의 음향은 좀 아쉽다. 가사를 알아 들을 수 없다. 다음 배우 얘기로 넘어가면 ""비틀쥬스"" 역의 전작 ""웃는 남자"" 의 정성화 배우님! 역시나 제일 많이 웃긴다. 이 공연 에서의 최대 수확! 리디아 역의 장민제 배우님! 어디서 이런 배우가 튀어 나왔을까? 그 넓은 극장을 어떻게 저 자그마한 체구로 휘어 잡을 수 있지? 다음 공연 꼭 보러 가야 겠다. ""빅 피쉬"" 에서 보았던 김지우 배우님도 좋았다. 전작 ""엑스칼리버"" 의 신영숙 배우님! 역시 실망 시키지 않는다. 다른 배우로 더 보고 싶지만 좋은 자리가 없구나... 비틀쥬스 보러 갔다가 리디아 에게 반하고 왔다!",2021.08.02
458,비틀쥬스,4,good,good!!!!!!!!!!!!!!!!good!!!!!!!!!!!!!!!!good!!!!!!!!!!!!!!!!good!!!!!!!!!!!!!!!!good!!!!!!!!!!!!!!!!,2021.08.02
459,비틀쥬스,4,잘 봤습니다.,무대가 화려하네요~ 바나나송 계속 생각나요 ㅋㅋ,2021.08.02
460,비틀쥬스,5,추천합니다,너무 유쾌한 공연,2021.08.02
461,비틀쥬스,3,눈은 즐거운 공연,눈은 즐겁지만 스토리가 없달까 급전개 중에서도 급급급전개라고 느껴지네요 배우님들 다 잘하시는 분들이지만 세종 음향때문에 가사가 제대로 들리지 않았고 랩형식의 넘버가 많아서 취향이 아니었던....ㅠ 선예매 50퍼로 1열에서 봤는데도 무대와의 거리와 음향때문에 좀 아까웠어요,2021.08.02
462,비틀쥬스,5,환상의 뮤지컬,보는내내 짜릿한 연출로 즐거웠습니다,2021.08.02
463,비틀쥬스,5,정말 재밌어요,무대 연출도 정말 좋았고 공연 내내 전혀 지루하지 않고 재밌게 봤습니다!,2021.08.02
464,비틀쥬스,5,비틀쥬스,나현 리디아 최고!!!,2021.08.02
465,비틀쥬스,5,진-짜 재밌어요,"정성화 배우님의 비틀쥬스 너무 재밌어요!!! 신영숙 배우님의 델리아와 미스아르헨티나 역시 국내 탑 배우의 저력을 보여주시고, 진짜 재밌었습니다!",2021.08.02
466,비틀쥬스,5,재밌어요!!!!,역시 자본주의의 국가에서 온 뮤지컬이라 그런지 화려하고 재밌었어요! 유쾌하고 행복해지는 뮤지컬입니다!,2021.08.02
467,비틀쥬스,5,07/31,델리아의 넘버 가사가 너무너무 좋아요 한국어판 OST 내주세요!!!!,2021.08.02
468,비틀쥬스,5,이보게 주서방,걘 열여섯살이야,2021.08.02
469,비틀쥬스,4,영화와는 다른 무대가 주는 독특하고 기괴한 재미,"팀 버튼 감독의 <비틀쥬스(1988)>는 기괴했다.팀 버튼 답게 영화 속엔 워낙 독특한 부분이 많았지만 나에게 가장 인상적인 장면은 이사온 가족의 식사장면이었다. &#10240; 검색해 보니 뮤지컬 <비틀쥬스>를 쓴 사람 중 한 명인 앤소니 킹이 내 최애 뮤지컬 중 하나인 <구텐버그>를 쓴 사람이란다. 갑자기 뮤지컬에 대한 기대감이 높아졌다. <구텐버그>처럼 얼마나 기발한 작품일까? &#10240; 막이 오르고 리디아 엄마의 관앞에 비틀쥬스가 등장해 노래한다. 관객들에게 말을 거는 비틀쥬스의 주변으로 신기한 장치들이 등장했다 사라지며 눈을 휘둥그레지게 만든다. &#10240; 마치, ‘자 봤지! 공연은 영화랑 달라!!’라고 온 몸으로 표현하는 것 같다. &#10240; 무대 세트로 브로드웨이에서 여러 상을 휩쓴 만큼 화려하고 독특한 무대는 끊임없이 전환된다. 그리고 무대 위, 무대 밖, 무대 안에서 정신없이 쏟아져 내리는 조명은 이런 화려함에 정점을 찍는다. &#10240; 뮤지컬 속 최고의 장면은 2막이 시작하고 리디아가 저주를 풀어줘서 사람들에게 보이기 시작한 비틀쥬스와 리디아가 사람들을 골탕 먹이는 장면이었다. &#10240; 또 예상했던 브로드웨이의 화려한 무대와 별개로 나의 생각을 사로잡은 건 ‘각색’과 ‘번역’이었다. &#10240; 1988년 영화를 2018년 무대로 옮겨지며 지금의 관객이 공감할 수 있도록 캐릭터의 성격과 대사들이 바뀌었다. 그리고 한국 관객과 우리의 현황에 맞춰 대사들이 번역되었다. 꼭 영화의 내용과 캐릭터를 몰라도 충분히 즐길 수 있는 뮤지컬이니 많은 사람들이 봤으면 좋겠다.",2021.08.02
470,비틀쥬스,4,괜찬앗어오,화려하네요,2021.08.02
471,비틀쥬스,4,좀 유치해요,ㅠㅠㅠ,2021.08.02
472,비틀쥬스,5,쟈밋어요,ㅇㅇㅇ,2021.08.02
473,비틀쥬스,5,복잡하게 생각안하고 즐기면 되는 뮤지컬,"이렇게 화려한 뮤지컬은 처음 봅니다~서사가 중요하신분은 불호 있을 수 있지만,저는 개인적으로 재밌게 관람했네요",2021.08.02
474,비틀쥬스,5,기대이상의 무대,정말 다른 세계로 떠난 것 겉은 기대이상의 무대였습니다.  이렇게 여러번의 취소를 겪지 않았다면 여러번 봤을 것 같아서 아쉽네요.,2021.08.02
475,비틀쥬스,5,재밌어요,재밌게 관람했습니다,2021.08.02
476,비틀쥬스,5,너무 잘봤습니다.너무 잘봤습니다.너무 잘봤습니다.너무 잘봤습니다.,너무 잘봤습니다.너무 잘봤습니다.너무 잘봤습니다.너무 잘봤습니다.너무 잘봤습니다.너무 잘봤습니다.너무 잘봤습니다.너무 잘봤습니다.너무 잘봤습니다.너무 잘봤습니다.너무 잘봤습니다.너무 잘봤습니다.너무 잘봤습니다.너무 잘봤습니다.너무 잘봤습니다.너무 잘봤습니다.너무 잘봤습니다.너무 잘봤습니다.너무 잘봤습니다.너무 잘봤습니다.너무 잘봤습니다.너무 잘봤습니다.너무 잘봤습니다.너무 잘봤습니다.너무 잘봤습니다.너무 잘봤습니다.너무 잘봤습니다.너무 잘봤습니다.너무 잘봤습니다.너무 잘봤습니다.너무 잘봤습니다.너무 잘봤습니다.너무 잘봤습니다.너무 잘봤습니다.너무 잘봤습니다.너무 잘봤습니다.너무 잘봤습니다.너무 잘봤습니다.너무 잘봤습니다.너무 잘봤습니다.너무 잘봤습니다.너무 잘봤습니다.너무 잘봤습니다.너무 잘봤습니다.너무 잘봤습니다.너무 잘봤습니다.너무 잘봤습니다.너무 잘봤습니다.,2021.08.02
477,비틀쥬스,5,"무대, 연기 등 나무날 데 없는 공연!","다양한 무대 및 조명효과, 배우들의 열연, 재미있고 감동적인 스토리 등 최근 본 공연 중 최고였습니다!  정성화 배우의 연기야 두말할 필요없고, 특히 리디아역의 장민제 배우의 연기가 인상적이었습니다.  강추!!!",2021.08.02
478,비틀쥬스,5,&#128077;,기대안하고 봤는데  잘보고왔어요 배우들 역시 잘하네요,2021.08.02
479,비틀쥬스,5,역시 정성화,능글맞으면서도 자연스러운.. 그리고 재치까지 겸비한.. 그리고 장민제 배우 처음이였는데 잘하더군요,2021.08.02
480,비틀쥬스,5,비명 소리 한 번 질러봐,달콤하게 한 번 질러봐 비명 소리 한 번 질러봐 달콤하게 한 번 질러봐 비명 소리 한 번 질러봐 달콤하게 한 번 질러봐 비명 소리 한 번 질러봐 달콤하게 한 번 질러봐 -That Beautiful sound-,2021.08.02
481,비틀쥬스,5,비틀쥬스!!!!,역시 여름에는 시원한 뮤지컬!! 엄청난 무대 스케일과 배우님들의 연기를 볼 수 있었습니다.,2021.08.02
482,비틀쥬스,5,재밌어요,재밌어요,2021.08.02
483,비틀쥬스,5,재밌어요,재밌어요,2021.08.02
484,비틀쥬스,5,저세상석 꿀잼,"무대전환 빠르고, 화려하고, 넘버좋고, 스토리 재밌고  기승전결 확실한데 한국적 정서도 넣어서 공감도 되네요~ 비틀쥬스 연기하는게 꽤나 힘들거 같은데, 정성화 유준상 두 배우 모두 잘하고  번역은 좀 아쉽지만 고심한게 보입니다~",2021.08.02
485,비틀쥬스,5,재밌엇어요,굿ㅎㅎㅎ,2021.08.02
486,비틀쥬스,5,"넘버가 너무 좋아서, 자꾸만 찾아 듣게 됩니다.","처음 봤을 땐, 조금 유치한가? 싶기도 했는데... 볼수록 매력이 있네요.  넘버가 좋아서  자꾸만 흥얼거리게 되는데... 이 기세로 OST가 나왔으면 좋겠다는 생각이 듭니다.   1막과 2막, 느낌이 참 다른데...  2막에선 우리 정서와 참 맞는 부분도 있고 참 다른 부분도 있어서...  처음 볼 땐 당황스러운 느낌도 있는데요.   보면 볼 수록... 넘버에 집중을 하게 되서  매력적이네요.",2021.08.02
487,비틀쥬스,5,아담바바라 부부 박제 주세요...,Ready set not yet이나 바바라2.0 박제 플리즈ㅠㅠㅠ 이부부들 귀여운거 다 알아야하는데ㅠㅠㅠㅠㅠㅠㅠㅠ 리디아도 너무 잘하고 앙상블들도 합이 너무 잘맞아요,2021.08.02
488,비틀쥬스,5,비틀쥬우우스!!!,재미있어요!,2021.08.02
489,비틀쥬스,5,친구할까 우리!,좋아요좋아요!,2021.08.02
490,비틀쥬스,4,무대 짱멋있다,무대미술 짱짤 넘버도 좋아요 근데 번역 개구림,2021.08.02
491,비틀쥬스,5,좋았어요,어떻게 이런걸 구현하신건지 ㄷㄷ 잘봤습니다,2021.08.02
492,비틀쥬스,5,너무 재밌게 봤어요,검은 사제들에서 장민제 배우 너무 인상적이어서 차기작 따라 왔는데 정말 재밌게 봤습니,2021.08.02
493,비틀쥬스,5,좋아요,좋아요,2021.08.02
494,비틀쥬스,5,좋아요,좋아요,2021.08.02
495,비틀쥬스,5,좋아요,좋아요,2021.08.02
496,비틀쥬스,5,이제 겨우 일주일 밖에 남지 않았다는게 아쉬워요..,중간에 예상치 못한 상황으로 안그래도 짧던 공연이 더 짧아져서ㅠㅠ 관객인 저도 이렇게 아쉬운데ㅠㅠㅠㅠㅠㅠ  그래도 매 공연마다 최선을 다하시는 모습 보면서 공연 재미있게 보고 있습니다!,2021.08.02
497,비틀쥬스,5,리디아들 너무 안쓰럽고 짠하고ㅠㅠ,그리고 너무 잘해요ㅠㅠ 비틀쥬스들도 그렇고  아담과 바바라랑 아빠 / 델리아  그리고 같이 무대에 서는 배우분들 모두 매 무대마다 최선을 다하고 즐겨주시는 모습 보여주는 것 같아서 보고올 때마다 에너지를 얻고 갑니다.,2021.08.02
498,비틀쥬스,5,"어쩌다가 금요일부터 3연공을 하게 되었는데,,","아니 3일 동안에도 점점더 좋아지더니 ㅠㅠ 일요일 밤공은 정말 너무 좋았어요ㅠㅠㅠㅠ 적당하게 객석에 호응 유도한 것부터 각 등장 인물들의 캐미까지,, 넘버 소화하는 거야 진작 알고 있었는데 와.. 정말 재미있었습니다. 이제 막공까지 일주일도 채 남지 않았다는게 너무 아쉬워요ㅠㅠ",2021.08.02
499,비틀쥬스,5,비틀쥬스,무대효과가 진짜 봤던 뮤지컬 중에 제일 화려했음무대효과 보는 재미가 있었다,2021.08.02
500,비틀쥬스,4,비틀쥬스 비틀쥬스 비틀쥬스,1막은 지루한가 했는데  2막은 좀 신났네요ㅋ서사 따위 생각하지 말고 그냥 아무 생각없이 봐서 나름 잘보고왔어요 ㅋㅋ 어느 후기글에 xx랜드 페스티벌 보는것 같다는거에 동감하게 되는 연출들도 있었고 ㅋ 다른 캐스트로 한번 더 보고싶어요.,2021.08.02
501,비틀쥬스,5,비틀쥬스,비틀쥬스처럼 예쁘고 기묘하고 또 화려한 무대를 본 적이 없다 완벽한 조명과 완벽한 무대 장치의 콜라보... 왕뱀이 너무 귀여워요......,2021.08.02
502,비틀쥬스,5,비틀쥬스,비틀쥬스! 비틀쥬스! 비틀쥬스! 그의 이름을 세 번 부르고 나면 무슨 일이 생기는지 너무 궁금해서 견딜 수가 없었다 환상적인 무대 장치와 그 화려한 조명들...,2021.08.02
503,비틀쥬스,4,유옵도 살리지 못하는 저세상 텐션...,진짜 너무 저세상 텐션ㅇㅣ라 유옵에게도 조금 많이 힘들어보이더라구요..... 관객 호응이 자유로운 시국이라면 좋을텐데 넘 아쉬울 따름.....,2021.08.02
504,비틀쥬스,5,재미있어요,비틀쥬스!!!,2021.08.02
505,비틀쥬스,5,좋은 공연입니다,화여한 무대 잘 보고 왔어요,2021.08.02
506,비틀쥬스,4,비틀쥬스,무대효과가 좋아요 넘버가 딱 꽂히는건 없었지만 시각효과 좋아하면 만족할듯,2021.08.02
507,비틀쥬스,4,비틀쥬스 비틀쥬스 비틀쥬스,영화의 내용이 무대에 어떻게 옮겨질까 궁금했는데보는 내내 눈이 즐거웠습니다배우들의 에너지도 너무 좋았고재연이 올라온다면 세종말고 다른 극장에서..^^,2021.08.02
508,비틀쥬스,5,또 가고싶어요,무대무엇대박,2021.08.02
509,비틀쥬스,5,저세상석,예대터져서 다행히도 다녀왔는데 정말 잘 다녀옴,2021.08.02
510,비틀쥬스,5,흥겨운 저 세상 텐션으로 이 세상도 행복하게~,눈과 귀가 즐거운 뮤지컬 비틀쥬스!화려한 볼거리와 중독성 있는 넘버들이 가득하고삶에 대해 많은 생각을 하게 하는 뮤지컬이다,2021.08.02
511,비틀쥬스,5,한주남았네요,이제슬퍼요,2021.08.02
512,비틀쥬스,4,비틀쥬스 비틀쥬스 비틀쥬스,비틀쥬스가 개막한다는 소식에 무슨 작품일까 궁금해서 원작 영화와 브웨 영상을 많이 봤다.그래서인지 부작용으로 번역이 넘 어색하게 들리기 시작함….번역의 아쉬움이 전체적인 만족도보다 커서.. 두번은 안볼듯 하다,2021.08.02
513,비틀쥬스,5,뮤지컬 비틀쥬스,넘 재밌어요~,2021.08.02
514,비틀쥬스,5,무대장치 좋네여ㅎㅎ,공연기간이 짧아서 너무 아쉬워요ㅠㅜ무대장치 너무 좋고 재미있습니다~!,2021.08.02
515,비틀쥬스,5,기대만큼 재밌었어요,영화를 너무 재밌게 봐서 이번에 올라온다고 했을 때 기대 많이 했는데 더 좋았습니다!! 공연기간이 일주일 밖에 남지 않았다는 게 너무 아쉽습니다,2021.08.02
516,비틀쥬스,4,자본냄새나는 무대,정말 무대장치가 너무 신기했어요 돈을 많이 쓴 티가 나더라구요  이번에 못보면 언제다시 볼 수 있을지 몰라서 막 내리기전에 부랴부랴 예매해서 보고왔는데요 볼거리는 확실히 많아서 만족했습니다 근데 세종 대극장 너무 음향이 안좋아요  1층 저세상석 제외하고 3열이었는데 시야는 아주 좋았지만 가사를 많이 못알아들었어요 분명 소리는 짱짱한데 발음이 잘 안들리네요…,2021.08.02
517,비틀쥬스,5,보는 재미가 많은 공연,우여곡절 끝에 공연 보게 되었는데 너무 재밌었습니다. 번역 조금 아쉽기는 했는데 넘버도 신나고 무대 장치가 너무 재밌어서 시간 가는 줄 몰랐네요.,2021.08.02
518,비틀쥬스,4,유머코드 유머코드 유머코드,한국과는 거리가 있던 유머코드가 아쉬운 작품희극에 베이스를 둔 정성화 배우가 출연한 회차여서 그나마 웃포를 선방해주었다고 생각한다영화보다 순한맛이 되었지만 즐거운 시간이었다신영숙 배우의 호수의 여인이 다시 보고싶어졌다,2021.08.02
519,비틀쥬스,5,화려하고 재밌아요,신기한 무대장치들이 많고 배우들도 연기 너무 잘해서 재밌었어요ㅜㅜ 볼거리가 엄청 많았음!! 재밌어ㅛ어요,2021.08.02
520,비틀쥬스,4,비틀 쥬스 후기,오랜 기다림끝에 비틀쥬스를 보게 되었습니다. 비틀쥬스 역할을 맡은 정성화 배우님을 포함해 모든 배우들이 얼마나 열심히 준비하고 공연하는지 아는 시간이었습니다. 한 분 한 분 연기에 집중할 수 있었고 재밌게 보았습니다. 다만 서사적으로 1막 이후 2막에서 진행되는 부분 중 매끄럽지 않은 부분도 있어 조금 아쉬웠습니다.  즐겁고 신나는 공연 잘 보고 왔습니다.,2021.08.02
521,비틀쥬스,5,재미있었어요,무대화려함의 극치! 유머가 있는 뮤지컬입니다,2021.08.02
522,비틀쥬스,5,재밌었어요,재밌었습니다,2021.08.02
523,비틀쥬스,5,재밌었어요,재밌었습니다,2021.08.02
524,비틀쥬스,5,재밌었어요,재밌었습니다,2021.08.02
525,비틀쥬스,5,씬나요~~,노래도 좋고 무대도 화려해서 넘 좋네요,2021.08.02
526,비틀쥬스,5,재밌어요,개막부터 기다렸는데 공연이 연달아 취소되어 정말 오래 기다렸는데 재밌어서 다행이네요...,2021.08.02
527,비틀쥬스,5,씬나요~~,노래도 좋고 무대도 화려해서 넘 좋네요,2021.08.02
528,비틀쥬스,5,정성화 팬으로 정성화  장민재라는 배우를 알게 되다.,"정성화는 내가 가장 좋아하는 뮤지컬 배우다.영웅, 맨오브라만차, 레미제라블 등등 묵직하고 진지한 역할 위주로 본거 같다. 헤드윅이나 킹키부츠 같이 가볍고 통통 튀는 작품도 있었는데 이런 작품들은 아쉽게도 아직 보지 못했다.마침 기회가 되어 비틀쥬스로 간만에 정성화를 보러갔다.정말 즉흥적으로 보러가서(공연 당일 예매) 시놉시스도 안보고 갔는데, 처음에는 캣츠마냥 난해한거 아닌가 하는 우려가 생겼다. 그러나 정성화의 리드로 그런 불안은 금방 진화되었다.삶과 죽음의 경계를 논하면서 철학적이면 재미가 반감될 수도 있지만 위트와 코미디 그리고 해학적인 요소들이 즐비하고, 참으로 시의적절하게 현재 코로나 사태로도 개그가 가능하다는건 정성화의 개그맨 시절의 순발력을 생각나게 만든다. 정성화가 출연한 황산벌의 신라병사 역할도 생각나는데. 욕쟁이로 거기나온 신라병사들의 합과 백제병사들의 합보다. 여기 배우들의 합이 더 좋았다.그리고 다같이 합창을 하거나 노래로 주고 받는 부분에서 베테랑인 신영숙 배우와 김지우 배우에도 안밀리는 신예베우 장민제 배우를 새롭게 알게되어 너무 좋았다.나온 배우들 노래들 진짜 잘하는데 그중에서도 장민제 배우는 신인답지 않은걸 넘어서서 낭중지추이다!",2021.08.02
529,비틀쥬스,5,비틀쥬스 최고,유준상배우님 정말 최고에요 너무 좋았어요,2021.08.02
530,비틀쥬스,3,화려한 볼거리,화려한 볼거리가 많아서 즐거웠습니다! 그리고 배우들이 너무 잘하네요.,2021.08.02
531,비틀쥬스,5,비틀쥬스,인생은 짧고 죽음은 길더라~,2021.08.02
532,비틀쥬스,1,여러가지로...,실망만 하고 온..제작사의 준비부족으로 공연도 밀리고 음향도 안좋고 대극장 무대 중앙만 사용하고 앞에 벽 세울거면 시제석 공지라도 해야했을듯 하네요무대에서 배경 바뀌는 것과 조명은 좋았어요,2021.08.02
533,비틀쥬스,5,잘 봤어요,쇼뮤지컬의 미덕을 잘 보여주는 작품입니다,2021.08.02
534,비틀쥬스,4,재미있어요!,꽤 흥미진진하고 멋있었어요,2021.08.02
535,비틀쥬스,5,짱,무대 장치며 뭐며 돈냄새 나요 짱재밌어요,2021.08.02
