,musical_title,rate,review_title,review_text,review_date
954,비틀쥬스,4,호불호가 강할 듯한 뮤지컬이네요~,화려한 무대가 궁금해서 미리 영화를 찾아보고 공연을 보러 갔어요.  영화 속 기발한 상상력이 무대로 표현된 부분들이 화려하고 인상적이기도 했지만 전체적인 유머코드나 캐릭터 구현이 너무 단순화된 것 같아 아쉽기도 했어요.  음향적인 부분에서도 좀 답답해서 성량 좋은 배우님들의 넘버가 그닥 감흥이 덜했어요. 그래도 한번은 호기심으로 볼 만 했는데 회전하기에는 취향이 아니었어요.,2021.07.16
955,비틀쥬스,3,볼거리가 많은 무대,"볼거리는 많았지만 서사나 개그코드가 읭? 스러울 때가 많았어요ㅠㅠ 그래도 넘버가 너무 좋았고 .. 3층은 가지 마세요 여러분 ㅠㅠ 마치 공연 하는거 훔쳐보는 느낌이 들어요,,",2021.07.16
956,비틀쥬스,5,저세상텐션 너무 즐거웠습니다~,비틀쥬스라는 영화를 보고 뮤지컬을 관람했습니다~무대에서의 생생한 라이브와 즐거움이 가득한 무대였습니다~~,2021.07.16
957,비틀쥬스,5,최고였어요,좋은 공연 감사합니다!!!!!! 최고였어요,2021.07.16
958,비틀쥬스,5,모는 게스트들의 열연에 기립박수를 보냅니다~~♡♡,믿고보는 배우들의 멋진 열연에 혼신을 다해서 연기하시는게 저같은 사람눈에도 보이는데 다른분들은 어쨌을까요 말이 필요없는 그런 배우 유준상님을 비롯해서 명성황후때의 분위기와는 다른 배역에 전 신영숙배우님이 동명이인인줄 ㅋ 너무나 멋지고 열정적인  모습에 반했습니다~~  엑스칼리버에서 또다른 모습 기대하겠습니다~~♡♡,2021.07.16
959,비틀쥬스,4,아이와 함께 본,9살 딸아이와 같이 본 뮤지컬 볼꺼리도 많고  곳곳에 개그와 유쾌한 음악 거기에 출연진들의 연기력까지.. 홍나현 배우님 노래는..  완전 &#128077;,2021.07.16
960,비틀쥬스,4,볼거리 많은 뮤지컬~,"무대전환과 앙상블 분들 등장효과나 매직같이 뭐가 튀어나오는 효과들도 많아서 볼게 많았어요~ 배우분들도 구멍없이 노래와 연기가 다 좋았어요~ 웃음이 터지는 장면과 대사도 많았고요~ 전체 앙상블이 나오는 1막 마지막부분과 2막 중간도 화려하고 재밌었어요~ 세종문화회관이 뮤지컬극장은 아니어서 음향이 좀 아쉽긴한데.. 그래도 뒤에서 소리나게 하는 부분도있고 노력한 점들이 보이네요~ 그리고 안내하시는 분들 진짜 엄청 친절하심~ 자기가 뒷자리 예매한건데, 안보인다고 자리 바꿔달라고 어이없는 얘기 하는 관객도~  달래주면서 기분 안 상하게 대처하는데.. 대단하심~ 관크만 안 걸리면 유쾌하고 재미있게 볼 수 있는 뮤지컬이에요~ㅎ",2021.07.16
961,비틀쥬스,4,스토리가 별로지만 무대는 볼만,아직 엉성한 느낌도 있지만 한번은 볼만한 무대입니다.중2병 걸린 캐릭터가 별로고 2막 스토리라인이 많이 별로예요,2021.07.16
962,비틀쥬스,5,재밌게 봤어요!!,배우들흥에 저도 같이 내적들썩들썩ㅋㅋㅋ이승에 대해 좀 더 나답게 살자를 다짐하게 했어요저는 3주남겨놓고 예매해서 잘 몰랐는데선예매하신분들이나 여러예측못한 상황으로 불발로좋은좌석예매취소당하신분들 리뷰가 안타깝습니다ㅠㅠ배우님들 스탭님들 힘내세요!,2021.07.16
963,비틀쥬스,5,잘봤습니다,재밌고 신나는 무대였어요다시 보고싶은 마음이 드네요 무대가 정말 멋져요,2021.07.16
964,비틀쥬스,4,아쉽습니다..,배우들 발음 하나도 안들리고 생동감도 없고??음향 제발 선명하고 조금 더 크게 안되나요…극장의 한계인가 ㅠㅠ 샤롯데나 다른데서 열었으면인기 더 많았을텐데 ㅠㅠㅠ첫 뮤지컬로 이걸 선택하시려고 하신다면제에발 다른 유명한거 보러가세요..(지금 시즌엔 딱히 추천할 작품은 없지만..)뮤지컬 여러번 봤지만 그냥… 음향도 넘버도..다만 배우분들은 언제나 그렇듯 좋았습니다연기도 너무 잘하시고 노래도 너무 잘하세요ㅠㅠ 명불허전????그리고 아이들 많이 데려오셨던데딱히 어린 아이들 데리고 볼 뮤지컬은 아닌 것 같아요초등생 정도는 같이 볼 만 할 것 같구요무대효과는 뛰어나고 좋습니다,2021.07.15
965,비틀쥬스,4,와우,이승과 저승을 왔다갔다 하는 경험을 하고 싶으신 분들께 추천.  심장약하신 분들은 신중하게 선택하시길 권합니다.,2021.07.15
966,비틀쥬스,4,비틀쥬스,유리아 최고,2021.07.15
967,비틀쥬스,5,저세상갈뻔한 자리,가변석 잡았는데 가변석 바로 다음날부터 취소된대서 하루만 늦었어도 좌석 저세상갈뻔했네요ㄷㄷ 진짜 화려하구 영화에서나 볼법한 CG를 눈앞에서 실물로 보여주네요 대박... 나현리디아 노래도 예쁘고 멋있고  감정도 확확 전해져서 좋아여ㅠ 앙상블들 재밌어서 다음장면에선 뭘로나올지 막 기대되고 자영걸스카웃 넘귀여워요ㅠㅠㅠㅠㅠㅠ,2021.07.15
968,비틀쥬스,5,익살스러운 연기 + 가창력,익살스러운 연기 보면서 재미있었고요  저는 2부에서 가창력 뿜뿜이 더 느껴져서 너무 좋았던거 같아요~  오랜만에 데이트 잘 했습니다 ㅎ,2021.07.15
969,비틀쥬스,5,너무너무너무 재밌어요,눈 깜짝할 새에 지나가버린 러닝타임,2021.07.15
970,비틀쥬스,5,"아직 유명하지않기도하고,코로나 땜에 사람은 많이 없었어요",빈 좌석이 많았는데 왜 빈좌석이 많은지 모르겠어요.뮤지컬 너무너무 재밌고 애들이 정말로 좋아할만해요??진짜 1번째 정확히는 비틀쥬스가 부른 2번째 노래부터 계속 웃고 공연 중간내내 너무 웃기고 신났어요????노래들도 신나서 처음들어보는 노래인데 어깨가 들썩거리더라고요.그리고 정성화님 진짜 최고!!!진짜 캐스팅도 너무 좋고 여러분 꼭 보세요.그리고 that beautiful sound는 진짜 정말 좋은노래에요???2막에 나오는데 브로드웨이편으로 유튜브에 검색해서 꼭  보고가세요.전 돈 더 모아서 또 보러갈예정입니다?진짜 비틀쥬스 꼭 보세염????,2021.07.15
971,비틀쥬스,5,재밌어요,배우들 다 잘하고 무대도 화려하고 넘버도 좋아요~,2021.07.15
972,비틀쥬스,5,너무 재미있는 공연!,초연임에도 불구하고 너무 재밌습니다. 무대 장치가 너무 화려하고 볼맛 났습니다,2021.07.15
973,비틀쥬스,4,독특하다!!!,호불호가 갈릴거  같은 공연...처음 접해본 독특함이 매력있다...뒤에서 보면 솔직히 집중도와 전달력이 떨어지는게 당연 할듯..그래서 앞쪽에서 한번더 재관람하고 싶을정도로 매력있다...!!,2021.07.15
974,비틀쥬스,5,신나는 공연,넘버도 좋고 배우들도 좋고 코로나19만 아니었다면 다같이 싱어롱 댄스타임으로 더 신났을 공연 무대장치들도 재밌고 좋음,2021.07.15
975,비틀쥬스,5,이래서 비틀쥬스 비틀쥬스 하나봄,일단 무대장치가 신기하고 스케일감 대박. 극장 분위기가 다른 뮤지컬들과 다르게 돈냄새가 엄청남.  기괴하고 황당한 설정인데 묘하게 공감가는 내용과 신나는 음악도 요즘 답답한 시기에 좋은 선택인듯 이건 봐야 함.,2021.07.15
976,비틀쥬스,5,흥이 차오르는 유쾌함 누구도 막을 수 없다,"신영숙 배우님의 재발견?이라 할 만큼 파격적인 역할이라 원작의 캐릭터보다 훨씬 재밌었습니다. 지금과 같은 코로나 시국이 아니었더라면 무대와 객석이 함께 몇 배는 즐거웠을 공연입니다. 좋은 시기에 재연으로도 기대해요. 단, 영화와는 살짝 결이 다른 사모곡(?)이라 좀 의아했어요.",2021.07.14
977,비틀쥬스,2,"대사 웅얼웅얼, 노래도 별로…재미없었어요","기대를 많이 했던걸까요..? 아니면 유독 제가 본 회차가 그랬을까요. 리디아 배우 대사, 노래가사 전달력이 많이 안좋았습니다. 노래 가사도 웅얼웅얼 잘 안들리고, 노래도 감탄 나올만한 노래도 아니고.. 그냥 어린이 뮤지컬 노래 듣는 느낌. 고음도 안좋았네요. 극 전개도 너무 루즈했습니다. 1부 전반은 졸리더라구요ㅎ 웃음 포인트가 있긴 했지만 타 뮤지컬처럼 빵터지는 유머코드는 아니에요. 어린이 뮤지컬 같았습니다. 10여만원 주고 볼 뮤지컬은 아닌거 같았어요. 무대디자인은 퀄리티가 좋았습니다.",2021.07.14
978,비틀쥬스,5,찐잼,너무 재밋네요~,2021.07.14
979,비틀쥬스,5,찐잼,너무 재밋네요~,2021.07.14
980,비틀쥬스,5,찐잼,너무 재밋네요~,2021.07.14
981,비틀쥬스,5,찐잼,너무 재밋네요~,2021.07.14
982,비틀쥬스,5,흥겨운 저세상 파~~리,"죽음, 악마, 유령이 소재인데 이렇게 흥겨울수가!! 위트와 재치!!! 비틀쥬스의 대사처럼 장례식이 우울할 필요가 있나~~  근데 비틀쥬스 불쌍해.. 이용만 당하잖아!!!",2021.07.14
983,비틀쥬스,5,찢었다!!!,"미쳤다 이건 그냥 미쳤다는걸로밖에 설명이 안된다 마술쇼를 보고 온 기분이고, 진짜 너무 재밌다ㅜㅜ 왜 한달밖에 안하냐구요ㅜㅜ",2021.07.14
984,비틀쥬스,5,너무 재밌었어요!!,첫 뮤지컬인데 정말 즐거운 경험이었어요!멋진 무대 보여주셔서 정말 감사드려요!!,2021.07.14
985,비틀쥬스,5,너무 재밌었어요!!,첫 뮤지컬인데 정말 즐거운 경험이었어요!멋진 무대 보여주셔서 정말 감사드려요!!,2021.07.14
986,비틀쥬스,5,너무 재밌었어요!!,첫 뮤지컬인데 정말 즐거운 경험이었어요!멋진 무대 보여주셔서 정말 감사드려요!!,2021.07.14
987,비틀쥬스,5,너무 재밌었어요!!,첫 뮤지컬인데 정말 즐거운 경험이었어요!멋진 무대 보여주셔서 정말 감사드려요!!,2021.07.14
988,비틀쥬스,5,너무 재밌었어요!!,첫 뮤지컬인데 정말 즐거운 경험이었어요!멋진 무대 보여주셔서 정말 감사드려요!!,2021.07.14
989,비틀쥬스,5,너무 재밌었어요!!,첫 뮤지컬인데 정말 즐거운 경험이었어요!멋진 무대 보여주셔서 정말 감사드려요!!,2021.07.14
990,비틀쥬스,1,할많하않,할많하않,2021.07.14
991,비틀쥬스,1,할많하않,할많하않,2021.07.14
992,비틀쥬스,5,재미있었어요,비틀쥬스의 대사가 마음에 남았습니다델리아랑 리디아 배우에게 반했어요,2021.07.13
993,비틀쥬스,5,믿고보는 정성화,관람평이 호불호가 있지만 최고의 연출과 음악.정성화 배우님 보러 갔다가 김지우님과 신영숙님께 감탄한 무대,2021.07.13
994,비틀쥬스,3,홍나현이 심폐소생술한듯,대사도 안들리고 어색한 유머코드에 저승에선 실수인지 아빠대사도 어색하고..홍나현 없었으면 폭망했을듯...,2021.07.13
995,비틀쥬스,4,재밌네요,화려한 볼거리와 현 시대를 살짝 가미한 센스있는 대사들 재밌었습니다. 힘든 시기에 가볍게 가서 재밌고 유익하게 볼 수 있는 뮤지컬이에요. 추천추천 합니다,2021.07.13
996,비틀쥬스,2,대사 잘 안들려요,대사 많고 위트 넘치는 작품으로 알고 있는데 세종 음향이 너무 안 좋아서 빠른 대사들은 거의 못 알아들었어요.. 홍나현 리디아는 딕션이 너무 좋아서 대부분 들렸어요. 처음 뵙는 배우님이셨는데 너무 잘하셔서 인상 깊었습니다. 그와 별개로 생각할 게 많은 작품인지도 잘 모르겠어요… 막판에 의미심장한 대사가 몇 줄 있었지만 앞 대사들이 잘 안 들려서 그런 건지 그렇게 와닿지도 않았어요.,2021.07.13
997,비틀쥬스,5,이야 쥑이네,ITS SHOW TIME!,2021.07.13
998,비틀쥬스,5,스케일 큰 무대,아주 흥겨운 무대였다. 배우들의 성량은 하늘을 찌를듯하고,2021.07.13
999,비틀쥬스,1,휴 재미없었어요,시간어렵게내서 갔는데 아쉬워요옆사람도 재미없다고ㅜㅜ,2021.07.13
1000,비틀쥬스,5,보고싶은 공연!,궁금함니닽!!!,2021.07.13
1001,비틀쥬스,4,생각보다 ㅠㅠ,흐름이 정신이없고 .. 혼란스럽 ..,2021.07.13
1002,비틀쥬스,4,너무 기대했던걸까요,정말 좋아하는 작품인데 음향때문에 뭐라하는지 잘 안들리고 매료되지도 못했어요 다음엔 더 좋은 음향으로 다시 공연을 한다면 재관람하고싶어요 그래도 너무 재밌게 봤습니다 관크만 빼면 참 좋았었을것 같은 공연이에요,2021.07.13
1003,비틀쥬스,4,귣...,다른 캐스팅으로 다시 보고싶은 공연!,2021.07.13
1004,비틀쥬스,4,저세상텐션!,진짜 저세상텐션이 뭔지 보여주는 뮤지컬,2021.07.13
1005,비틀쥬스,5,재밌네요~,재관람하고싶습니다.,2021.07.13
1006,비틀쥬스,5,재밋네요,또 보고싶어요.,2021.07.13
1007,비틀쥬스,5,재밋네요,또 보고싶어요.,2021.07.13
1008,비틀쥬스,5,재밋네요,또 보고싶어요.,2021.07.13
1009,비틀쥬스,5,재밋네요,또 보고싶어요.,2021.07.13
1010,비틀쥬스,5,재밋네요,또 보고싶어요.,2021.07.13
1011,비틀쥬스,5,재밋네요,또 보고싶어요.,2021.07.13
1012,비틀쥬스,5,재밋네요,또 보고싶어요.,2021.07.13
1013,비틀쥬스,5,재밋네요,또 보고싶어요.,2021.07.13
1014,비틀쥬스,5,재밋네요,또 보고싶어요.,2021.07.13
1015,비틀쥬스,5,재밋네요,또 보고싶어요.,2021.07.13
1016,비틀쥬스,5,재밋네요,또 보고싶어요.,2021.07.13
1017,비틀쥬스,5,재밋네요,또 보고싶어요.,2021.07.13
1018,비틀쥬스,5,재밋네요,또 보고싶어요.,2021.07.13
1019,비틀쥬스,5,재밋네요,또 보고싶어요.,2021.07.13
1020,비틀쥬스,5,재밋네요,또 보고싶어요.,2021.07.13
1021,비틀쥬스,5,재밋네요,또 보고싶어요.,2021.07.13
1022,비틀쥬스,5,관람후기,재낫습니다.,2021.07.13
1023,비틀쥬스,5,관람후기,재낫습니다.,2021.07.13
1024,비틀쥬스,5,정말 신나고 재미있었어요,무대장치가 너무 신기하고 볼거리도 많았고공연내내 즐거웠어요,2021.07.13
1025,비틀쥬스,5,신나고 좋았어요!,정성화 배우님 너무잘하십니당뮤지컬도 재밌고 스토리도 좋아요~,2021.07.13
1026,비틀쥬스,5,좋았어요!,무대효과 너무 좋았고 배우님들 합도 잘맞아서 연습 많이한거 느껴졌어요 근데 극장 음향이... 대사 흘려들은게 꽤있네요,2021.07.13
1027,비틀쥬스,5,비틀쥬스!비틀쥬스!비틀쥬스!,유쾌하면서도 생각할 것들이 생기는 극이에요! 무대도 화려하고 각종 드립들이 즐겁게 해주네요. 정성화 배우님 진짜 비틀쥬스 하시려고 태어나신 분처럼  찰떡같이 소화하시고 장민제 배우님 시니컬한 소녀연기 아주 인상적이었어요.  가족들끼리 보러오기 좋은 극인 것 같아요!,2021.07.13
1028,비틀쥬스,5,눈이 즐겁고 재밌어요,처음 들어가기 전부터 조명이 여기 저기서 움직이고 있어서 새로웠어요. 관람석까지 공연의 일부인 느낌을 받았어요. 여러 소품을 쓰는 것도 재밌고 무대도 보는 재미가 있었어요. 유쾌하고 신나는 음악에 내용이 가벼울 것 같지만 농담을 던지듯이 살아가는 것에 대해 생각을 하게 해줘요. 또 보러 가고 싶지만 거리두기 단계가 높아져서 쉽지가 않네요. 재연한다면 또 볼 거예요!,2021.07.13
1029,비틀쥬스,5,특히 여름에 보기 좋은 비틀쥬스,"유튜브 영상 하나만으로 예매까지 하게 됐습니다. 처음 보자마자 뭔가 깬다?는 느낌의 충격을 받고 너무 보고 싶다는 생각이 들어 충동적으로 예매를 했습니다. 그리고 가장 비슷하게 연기해주실 것 같은 캐스트로 관람을 하게 되었고, 무대 연출과 효과를 더불어 너무나 멋지고 유쾌한 공연을 보게 되어 즐거운 시간이었습니다. 운 좋게 핀 뱃지 세트도 증정받는 마지막 날에 관람했는데 초연작의 기념품이 될 것 같습니다. 짧은 기간동안만 공연하는 게 아쉽고, 다음에 또 기회가 생기면 또 보러 가고 싶습니다 ! 좋은 공연 감사드리고, 남은 공연도 응원하겠습니다.",2021.07.12
1030,비틀쥬스,5,오래 기다린 보람이 있었네요!,개막일이 계속 밀려서 걱정하였는데 왜 그리 미뤄졌던 이유를 알것 같았습니다. 무대장치가 정말 어마어마 했습니다 보는 내내 눈이 즐거웠던 극이였네요,2021.07.12
1031,비틀쥬스,4,음향빼곤 완벽,위트가 있고 원작을 생각하면 충분히 재밌지만 아이들이 보기에는 조금은 부적합하다고 생각합니다 그리고 음향은 좀..,2021.07.12
1032,비틀쥬스,5,강력추천♡.☆,정성화 김지우 신영숙 장민제 이창용 배우로 봤어요>< 제가 좋아하는 배우들 몇 분과 새롭게 알게 된 몇 분 그리고 알고만 있었지만 매력을 알지 못했던 배우분들까지!!! 사실 브로드웨이 영상 볼 때마다 우리나라 세종에서 어떻게 이런 무대를 구현할까 배우들이 어떤 연기를 보여줄까 번역을 어떻게 했을까 엄청 기대하고 나름 걱정?도 했거든여ㅎㅎ 근데 제 걱정이나 헤야겠어요...ㅎㅎㅎ 배우분들 연기 하나도 안 어색하고 멋있고 매력 터지고ㅠㅠ 짧은 기간 동안 공연이라 너무 아쉽지만 더 많은 사람들이 봤으면 하는 공연이에용:) 무대 때문에 걱정하고 잠 못 이루셨을 제작진과 배우분들 너무 고생하셨겠어요ㅠㅠ 합이 정말 중요한 공연 같은데 정말 잘 맞아보였거든요*.* 오케스트라도 너무 멋있고 시작 전에 나오는 노래도 너무 좋구 연기도 다 너무 좋구 암튼 다 좋았어요ㅠㅠ 조~금 더 앞에서 보면 좋았겠지만 무대 전체를 보는게 좋은 공연이라서 2층 맨 앞 줄이 젤 좋을거같아여>< 비틀쥬스 남은 공연까지 화이팅☆.♡,2021.07.12
1033,비틀쥬스,3,기대보다는,기대를 너무 많이 해서 그런지 기대에 미치지 못 한듯 합니다.음향도 좋지 않아 전달력도 떨어지고...배우분들은 정말 잘하셔서 좋았고무대는 화려해서 보는 재미는 있었습니다,2021.07.12
1034,비틀쥬스,2,기대를 너무 했나봅니다,엄청 활기차고 신날거 같아 기대엄청 했는데   기대에 못미쳤네요 두번은 안볼거 같아요   2막 첫 넘버 대사나 노래 가사 전달 전혀 안되고 세종문화회관 음향이 이상했었나   의문이 들었네요   한번 본걸로 만족합니다,2021.07.12
1035,비틀쥬스,5,재밌었습니다.,정성화 배우님꺼 보고싶다고 노래노래 부르다가드디어 봤어요^^정성화님 영화 속 비틀쥬스 캐릭터보다훨씬 피지컬도 좋으시고연기도 어찌나 잘하시고 재밌으시던지ㅋㅋㅋ배우분들 다 연기 좋으시고 넘버도 다들 잘 부르셔서귀호강했습니다. 특히 리디아 역 하신 장민제 배우님 대박적.무대연출도 뻔쩍뻔쩍 눈부시고 무대 세트도 볼 게 많았어요.,2021.07.12
1036,비틀쥬스,5,화려한 무대장치에 매 순간 놀라는 뮤지컬,"무대 장치 문제로 공연이 자꾸 늦춰졌을 땐 이해가 안 됐는데 공연을 보니 바로 이해가 갔습니다. 뮤지컬에서 벌써 이렇게까지 가능하구나 싶어서 놀랐고 기대만큼 스토리도 재밌었습니다. 가족들과 보기에도 좋은 내용이고 볼거리가 화려해서 가족, 친구들과 보기에 좋습니다.",2021.07.12
1037,비틀쥬스,3,그럭저럭,기대를 너무 많이해서 그런지  잘모르겠음 .. 다시볼생각은 없음,2021.07.12
1038,비틀쥬스,4,재미있게 봤어요~,"1막은 시간 가는줄 모르고 봤어요. 무대장치나 기획도 괜찮고 재미있었어요  근데 2막에서 약간 개연성이 부족한 느낌이랄까..ㅜ 예를 들어, 엄마 찾으러 지옥문(?)도 열고 들어갔고 주노가 니가 생각하는 엄마가 아닐 수 있다고 얘기해서 뭔가 엄마를 만났는데 엄마가 생각했던 사람이 아니어서 아빠랑 같이 돌아간다는 내용이 있을 줄 알았는데 갑자기 엄마를 열심히 찾다가 아빠랑 조금 얘기하더니 돌아간다고 해서.. 그 부분이 조금 아쉽더라구요.  살짝 시야가 방해되는 위치에 앉아있긴 했는데, 그래도 대부분의 이야기가 가운데에서 진행되어서 나쁘지 않게 봤습니다.",2021.07.12
1039,비틀쥬스,3,오랫만에 뮤지컬 봤는데,정말 오랫만에 뮤지컬 봤는데... 나이가 들었는지.. ㅎㅎ 생각보다는 공연이 잼있지 않았습니다.  개인적으로 그냥 그랬습니다.  그래도 배우분들이 열심히 준비 해주신 것은 잘 느낄 수 있었습니다.   다른 분들은 나오면서 너무 잼있었다고 하셨어요~,2021.07.12
1040,비틀쥬스,5,기대보다 더 좋았어요!,"초연이고 정보도 없어서 걱정 반 기대반이었는데, 정말 재밌게 봤습니다 :) 공연보기 전에 영화보고 가면 더 좋은것 같아요!",2021.07.12
1041,비틀쥬스,5,기대보다 더 좋았어요!,"초연이고 정보도 없어서 걱정 반 기대반이었는데, 정말 재밌게 봤습니다 :) 공연보기 전에 영화보고 가면 더 좋은것 같아요!",2021.07.12
1042,비틀쥬스,5,화려한 무대와 신나는 넘버!,간만에 신나고 유쾌한 쇼뮤지컬이었습니다 무대세트도 진짜 화려해서 자본의 힘을 느꼈습니다,2021.07.12
1043,비틀쥬스,5,앞자리 앉았다가 목이,앞자리 앉아서 목이 너무 아팠지만 ㅎㅎㅎㅎ화려한 무대도 좋았고 유준상님도 보고 잘 즐기다 왔습니다,2021.07.12
1044,비틀쥬스,5,앞자리 앉았다가 목이,앞자리 앉아서 목이 너무 아팠지만 ㅎㅎㅎㅎ화려한 무대도 좋았고 유준상님도 보고 잘 즐기다 왔습니다,2021.07.12
1045,비틀쥬스,5,앞자리 앉았다가 목이,앞자리 앉아서 목이 너무 아팠지만 ㅎㅎㅎㅎ화려한 무대도 좋았고 유준상님도 보고 잘 즐기다 왔습니다,2021.07.12
1046,비틀쥬스,5,비틀쥬스x3,신나는 뮤지컬. 뭔가 허전해 지는 느낌...  왜??? 나도 신나게 소리지르면서 보고싶다고요~~^^,2021.07.12
1047,비틀쥬스,5,뮤지컬 비틀쥬스,화려한 무대와 멋진 배우들 한달밖에 안 해서 아쉬울뿐...,2021.07.12
1048,비틀쥬스,4,비틀쥬스,무대장치에 감탄하면서 보게 된 오랜만에 본 대극장 작품이다. 와우!하고 그저 감탄하게 된다. 앙상블 배우들을 포함한 모든 배우들의 연기와 노래가 즐거웠다.,2021.07.12
1049,비틀쥬스,4,재밌습니다,"원작을 좋아해서 뮤지컬을 봤는데 뮤지컬로 옮겨지면서 스토리는 살짝 달라졌지만, 그 만의 매력이 있습니다. 무대 장치나 화면 전환도 탄성 나올 만큼 멋집니다. 배우들 연기와 노래는 물론 10점 만점에 10점 이었고요. 추천합니다",2021.07.12
1050,비틀쥬스,5,저세상 텐션!!!!,&#128077;&#128077;&#128077;진짜 최근에 본 공연중에 최고로 재미있었어요 다들 연기 케미 무엇?!?! 현실이 적절히 섞인 애드립에 보다가 빵빵 터졌네요ㅋㅋㅋㅋ,2021.07.12
1051,비틀쥬스,5,자본주의 냄새나는 개쩌는 공연,이라고 지인이 재밌게 보셨다네요 저는 8월달에 가려고요 기대중,2021.07.12
1052,비틀쥬스,5,추천,"오랜만에 대극장맛을 봤는데  역시 이게 대극장극이었지 싶었어요 멋있는 무대, 배우분들의 신나는 노래와 연기 정말 최고입니다!!!!!",2021.07.12
1053,비틀쥬스,5,눈이 즐거운 뮤지컬!,"-웃으면서 즐길 수 있는, 비틀쥬스의 대사처럼 ‘쇼타임’ 이었던 뮤지컬. 볼거리도 많고 넘버들도 좋았다.(근데 넘버가 어려운 것들이 상당해보였다. 그런 넘버들을 소화해내시는 배우분들…????)",2021.07.12
1054,비틀쥬스,5,재미있던 뮤지컬,한국 초연이여서 기대가 많이 되었었는데 재미있게 보았어요,2021.07.12
1055,비틀쥬스,5,정성화의 매력과 홍나연의 재능에 박수를,삶과 죽음에 대한 생각을 할 기회 경쾌하지만 진지한 고민거리,2021.07.12
1056,비틀쥬스,5,화려한 무대 신나는 음악,실력있는 믿보배 배우님들과 화려한 무대가 어우러져 시간가는줄 모르고 봤어요!,2021.07.12
1057,비틀쥬스,5,재관의사 100%,신나고 좋아요.. 역시 기대를 저버리지 않았어요!!!,2021.07.12
1058,비틀쥬스,4,음향이......ㅠㅠ,공연 자체는 재밌고 볼거리도 많고  배우들 연기나 넘버소화도 좋았는데..... 세종문화회관 대극장 음향이  이렇게 안좋은건 이번에 처음 알았네..... 2층이어서 그런건지.... 아님 원래 전체적으로 그런건지..... 목욕탕 에코에다 모든 소리가 거의 잘 안들림 소리 자체도 작은 편이고 울림도 심해서 진짜 저세상 사운드....ㅠㅠㅠㅠㅠ 더 예매 해 놓은게 있는데 그때는 잘 들릴려나.......,2021.07.12
