,musical_title,rate,review_title,review_text,review_date
1546,팬텀,5,팬텀을 넘은 팬텀,"뮤지컬에 입문한지 얼마 안되는지라 이번 공연에서 박은태님, 이지혜지님을 알게 되어 넘 좋았어요넘버도 쏙쏙 들어오고, 무대 장치도 멋있었고슬프도록 아름다운 공연이었어요샤롯데도 넘 좋구요!!",2021.04.19
1547,팬텀,5,팬텀을 넘은 팬텀,"뮤지컬에 입문한지 얼마 안되는지라 이번 공연에서 박은태님, 이지혜지님을 알게 되어 넘 좋았어요넘버도 쏙쏙 들어오고, 무대 장치도 멋있었고슬프도록 아름다운 공연이었어요샤롯데도 넘 좋구요!!",2021.04.19
1548,팬텀,5,팬텀을 넘은 팬텀,"뮤지컬에 입문한지 얼마 안되는지라 이번 공연에서 박은태님, 이지혜지님을 알게 되어 넘 좋았어요넘버도 쏙쏙 들어오고, 무대 장치도 멋있었고슬프도록 아름다운 공연이었어요샤롯데도 넘 좋구요!!",2021.04.19
1549,팬텀,5,최고의 공연,박은태 임선혜배우 공연은 정말 최고였어요ㅜ,2021.04.19
1550,팬텀,5,팬텀,몇 년전 휴덕기에 별 기대없이 봤다가 뮤지컬에 재입덕하게 된 작품 오페라의 유령이 워낙 유명해서 크게 기대 안했는데 들을수록 중독되는 넘버 극이 끝날때까지 주연배우 얼굴 한 번 제대로 볼 수 없는 극이지만 천상의 목소리 은팬텀!,2021.04.19
1551,팬텀,5,언제봐도 멋있는 뮤지컬 팬텀!!,제 첫 뮤지컬이 2018년도에 봤던 팬텀이었는데 보고나서도 너무 잊혀지지않아 이번에도 팬텀 공연 뜬거 보고 바로 예매했네요! ㅎㅎ 역시 언제봐도 소름돋고 멋있는 팬텀ㅠㅠㅠ 김소현배우님 보러 갔다가 전동석배우님한테 빠졌네요 진짜 최고입니다!,2021.04.19
1552,팬텀,5,박은태 배우님의 연기와 노래에 감동받는 뮤지컬,개인적으로 좋아하는 넘버들이 많은 뮤지컬이어서 많은 기대를 하고 갔는데 역시나 너무나 잘 소화해주시는 배우님 덕분에 시간과 돈이 아깝지 않게 너무 잘 즐기고 공연장을 나올 수 있어서 행복했습니다.,2021.04.19
1553,팬텀,5,무대스케일이 정말 장난없어요..,"팬텀이라는 뮤지컬을 처음접해봤는데, 진짜 스케일하며 배우님들 가창력하며, 연기하며  뭐하나빠지는게 진짜 한개도없어요 ... 한번 더 보러갈 계획입니다. 꼭보세요 여러분 !!!!!",2021.04.19
1554,팬텀,5,전동석안보는사람유죄,전동석님 진짜 얼굴 노래 연기 빠지는게 하나도 없으시네요... 이번 작품으로 처음 뵀는데 다음 작품 보러가겠습니다. !!,2021.04.19
1555,팬텀,5,너무 좋았어요,뮤지컬 팬텀 음악이 일단 너무 좋고.. 거의 3시간을 지루하지 않게 봤어요.. 볼거리도 많고.. 주연배우 팬텀역의 전동석씨의 노래 연기 성량 모두 다 좋았습니다... 이지혜배우의 크리스틴도 참 예쁘고 좋았어요,2021.04.19
1556,팬텀,5,좋아ㅠ,나모 좋아요,2021.04.19
1557,팬텀,5,좋아ㅛ,너무좋아요,2021.04.19
1558,팬텀,5,좋아ㅛ,너무좋아요,2021.04.19
1559,팬텀,5,최고로 좋았어요,"박은태, 이지혜 배우님 조합 진짜 최고 였어요  감정선도 너무 좋았고 다른 배우분들도 다 좋았요  너무 멋진 무대, 감동적인 무대였어요",2021.04.19
1560,팬텀,5,팬텀(임선혜님)을 보고..,요즘 우울해 하는 저를 위로하겠다고 음악을 좋아하는 동생이 오랫만에 뷰지컬 공연을 가기로 했습니다. 저는 부랴부랴 대전에서 출발했습니다. 오랫만에 롯데씨어터에 왔습니다 코로나 예방접종도 했는데 실내에서 음식을 먹는 것이 두려운 저는  엔젤리너스 야외에 앉아 카페라떼에 집에서 준비해온 빵을 먹고 공연을 관람했습니다. 뮤지컬 팬텀은 최고였고 작은 체구에 임선혜님 사랑스러웠습니다. 저에게 선물한 시간이 고마웠습니다. 뮤지컬 팬텀팀 그리고 임선혜님 감사합니다!!,2021.04.19
1561,팬텀,5,첫 관람,그냥 앉아서 무용 보는 것만으로도 본전은 뽑습니다.,2021.04.19
1562,팬텀,5,아직도 감동이 가시지 않네요~,몇년만에 다시본 팬텀~ 그때랑 같은 페어로 봤는데 그때보다 더 감동이 배가된듯해요~ 여전히 명불허전 동릭과 쏘크리의 감정연기는 최고였고 홍경수배우님 연기도 넘 깊어서 절 오열하게 만들었어요~ 반면에 악역인데도 불구하고 신영숙배우님과 정철호배우님  케미가 어찌나 귀엽고 좋으시던지 귀요미와 쪼꼬미.. 찰떡케미라 전혀 밉지않은 악역이었어요~ 아직도 감동이 가시지 않네요~ 너무 잘봤습니다~,2021.04.19
1563,팬텀,5,역시 팬텀~,몇년만에 다시본 팬텀~ 그때랑 같은 페어로 봤는데 그때보다 더 감동이 배가된듯해요~ 여전히 명불허전 동릭과 쏘크리의 감정연기는 최고였고 홍경수배우님 연기도 넘 깊어서 절 오열하게 만들었어요~ 반면에 악역인데도 불구하고 신영숙배우님과 정철호배우님  케미가 어찌나 귀엽고 좋으시던지 귀요미와 쪼꼬미.. 찰떡케미라 전혀 밉지않은 악역이었어요~ 아직도 감동이 가시지 않네요~ 너무 잘봤습니다~,2021.04.19
1564,팬텀,5,재밌어요,무대 화려해서 보는게 즐거워요,2021.04.19
1565,팬텀,4,팬텀,팬텀 잘 받습니다,2021.04.19
1566,팬텀,5,정말 재밌게 보았습니다.,공연의 주연배우님과 다른 앙상블 분들이 힘든상황에서도 열심히 준비해서 정말 재밌게 봤습니다.,2021.04.19
1567,팬텀,5,팬텀,동릭 & 쏘크리 최고예요~,2021.04.19
1568,팬텀,5,너무너무 재밌게 봤습니다!,2층이지만 시야도 괜찮았고 오페라 글라스를 빌리면 배우의 표정연기까지 하나하나 볼 수 있었기에 너무 좋았습니다. 바로 다다음주 공연도 얘매했어요 또 기대하고 있습니다.,2021.04.19
1569,팬텀,4,역시 크리스틴은 이지혜,크리스틴이 되기에 손색이 없는 미모와 정말 천상에서 내려온듯한 목소리... 처음부터 팬텀한테 레슨 받을 필요도 없으실듯ㅎㅎㅎ 간만에 고막 힐링하고 왔어요.,2021.04.19
1570,팬텀,5,최고였습니다..,기다리고 기다린 보람이 충분히 넘치는 무대였습니다.. 또 관람하고 싶네요 ㅠㅠ,2021.04.19
1571,팬텀,4,잘 보고 왔습니다,배 운전하는거 어렵나봐요,2021.04.19
1572,팬텀,5,역대급 최고의 무대,"제가 뮤지컬을 많이 보진 않았지만 레베카 이후에 최고의 작품이었던거 같습니다. 규현,이지혜,신영숙 배우.... 집에 가서 잠들기 전까지 계속 생각나게 했던것 같네요. 딕션도 무지하게 좋고 사정상 가지못하게 될까 전전긍긍 했고.. 혹시라도 코로나가 심해져서 못보게 될까 조마조마했던 작품 보고오니 와 이런작품 포기 했다면 후회많았을듯 했습니다. 정말 다음에도 또 보고 싶게 만드는 뮤지컬이었습니다! 꼭 보세요!!!강추!!!",2021.04.19
1573,팬텀,5,재밌게 잘 봤어요,무대도 이쁘고 많은 배우들이 열연한 모습이 돋보였습니다. 또 발레하는 장면이 제일 인상깊었어요,2021.04.19
1574,팬텀,4,팬텀,감미로운 넘버들 최고의 배우님들과 함께해서 너무 즐거운 시간이였어요!!!,2021.04.19
1575,팬텀,5,너무 멋진 공연,재밌게 잘 봤습니다!^^ 또 볼게요,2021.04.19
1576,팬텀,5,행복한 시간,귀가 황홀했어요 카팬텀 최고,2021.04.19
1577,팬텀,5,최고의 무대였습니다,배우님들 모두 최고였습니다.,2021.04.19
1578,팬텀,5,전동석 배우 황홀 그 자체,어떻게 커튼콜까지 그 얼굴 한번 안보일수있죠ㅠ가면써도 황홀 그 지체입니다,2021.04.19
1579,팬텀,5,재밌어요,강추합니다,2021.04.19
1580,팬텀,5,까를로타 사랑합니다.,발레라는 공연이 이렇게 멋진지 팬텀을 보고 알게됐어요. 사실 그전만 해도 지겨운 공연이라고 생각만 했었는데 어쩜 이렇게 우아하고 멋지고 춤만으로도 감정이 완전 잘 전달 될 수 있을까요.  화려한 볼거리도 많고 특히 까를로타 역의 신영숙 배우님 ㅠㅠ 너무 너무 멋지고 잘하시는데 환호 할 수 없어서 안타까울 뿐이에요.  화려한 공연 좋아하시면 완전 적극 추천합니다.,2021.04.19
1581,팬텀,5,넘버 최고,넘버가 너무 좋아서 또보고 싶네요,2021.04.19
1582,팬텀,4,팬텀 관람 후기,"뮤지컬 팬텀 관람 후기 입니다.  일단 저는 관람 전에 오페라의 유령에서 모티브를 따온 것만 알고 보러 갔었는데 생각치도 못한 반전? 포인트가 있어서 놀랐어요 ㅎㅎ  그리고 팬텀 역 맡으신 규현 배우님 노래 잘 부르시는건 알고있었는데 이번에 보고 진짜 감탄했습니다. 진짜 노래 잘 부르시더라구요 탈 아이돌급,,그리고 크리스틴역 맡으신 이지혜 배우님도 말할 것 없이 노래 실력이 너무 출중하셨어요. 두 주연 배우님들 실력은 두 말 할 것 없었고 무대 세트도 퀄리티가 엄청 높아서 극에 몰입이 더 잘되었던 것 같습니다 :)  그런데 조금 아쉬운점은 좌석마다의 사각지대가 있는 것 같아요, 어쩔수없는거겠지만..ㅎㅎ",2021.04.19
1583,팬텀,5,너무 즐거웠네요,"딸2명과 진정한 뮤지컬은 처음봤네요.음향사고로 30분 지연이 됐지만 그걸다 잊어버릴만큼 너무 좋은 공연이었네요. 규현님은 좀 미흡했으나 여주 김수분 너무 잘 하시드라고요. 너무도 청량하면서도 발랄한20대의 상큼함을 느낄수 있는 무대였네요앞으로가 더 기대되는 성악가 인 듯해요.노래가 좋아서 인터넷에 찾아서 파리의 멜로디 다시듣기도 하고 있네요. 까를로따 였던가 암튼 그 분은거의 음악을 가지고 노시더라고요, 관록과 노련미가느껴지는 배우였었고요. 정말 역할과 혼연일치 된듯정말 최고였네요. 발성과 딕션등 모든점에서 만족스런 무대였네요. 다음에 기회가 된다면 N차 관람도 해볼듯 합니다. 팬텀 화이팅!!",2021.04.19
1584,팬텀,5,넘버 좋네요,샹동백작님 너무 잘해요오??,2021.04.19
1585,팬텀,1,하 ㅠ,좀 많이 실망했어요주연 노래는 잘하는 데나머지는... 음악 가사 합창 대사 연기 안무 스토리 다....저는 오페라의 유령 외전을 기대했는데 그냥 오페라의 유령 해적판 보고 나온 기분입니다. 저처럼 기대하신 분은 안보시는게진짜 죄송하지만 인터미션때 나왔어요....,2021.04.19
1586,팬텀,5,너무너무 잘 봤습니다!!!,역시 갓극은 갓극이네요 재밌게 잘 봤습니다~~,2021.04.19
1587,팬텀,4,에녹샹동백작님&#128154;,커튼콜때 길게 부르시던 에녹배우님이 계속 생각나네요 다들 에녹샹동 보러오세요!,2021.04.19
1588,팬텀,5,박은태배우님 최고!,"물론 배우님들 모두 노래와 연기가 훌륭하셨지만, 역시 박은태배우님! 정말 최고셨습니다!  팬텀은 처음 관람했는데 좋은 넘버들이 많네요~~~ 한 번 관람으로는 부족한 듯하여... 5월에 또 보러 가려고 합니다...  좋은 공연 감사합니다!!!",2021.04.19
1589,팬텀,4,바꾼 가면 못생겨서 별 하나 뺌,전동석 이지혜 신영숙 캐스팅으로 봤고 세 배우 다 이 이상 잘 할 수 없게 멋진 연기를 보여줬습니다그런데 가면 너무 못생김얼굴 다보이는데 못생김가면땜에 웃겨서 별 한개 빼요,2021.04.19
1590,팬텀,5,팬텀,너무나 웅장하고 재밋는 극 이였습니다,2021.04.19
1591,팬텀,5,팬텀 최고,배우들 연기합이야 말할 것도 없고 귀호강 제대로 하고 왔어요. 거기다 멋진 발레공연까지...! 발레는 잘 모르는데 나중에 발레 공연도 꼭 가봐야겠다 싶었습니다&#128077;&#127995;,2021.04.19
1592,팬텀,4,"볼거리, 들을 거리 모든 것이 풍성한 공연","볼거리, 들을 거리 모든 것이 풍성한 공연",2021.04.19
1593,팬텀,4,이지혜 크리스틴 때문에,계속 회전문을 돌게 돼요!!,2021.04.19
1594,팬텀,4,갈수록 깊어지는 공연,갈수록 깊어지는 공연,2021.04.19
1595,팬텀,5,들을때마다,마음을 울리는 팬텀의 넘버들 주연배우 두분의 음색이 너무 잘 어우러져 성악적 팬텀 넘버들이 정말 아름다웠습니다 칼롯타와 카리에르의 연기와 넘버도 좋았습니다,2021.04.19
1596,팬텀,4,팬텀,잘 봤습니다~!,2021.04.19
1597,팬텀,5,최고,전동석 배우님 이지혜 배우님 최고였어요눈물 좔좔....,2021.04.19
1598,팬텀,5,윤전일-김주원의 아름다운 발레도 멋집니다.,"전동석 팬텀과 이지혜 크리스틴의 목소리도 멋졌지만, 2막 윤전일-김주원 페어의 발레도 더할나위 없이 멋졌습니다. 말없이 동작만으로도 절절한 감정을 다 전해주는, 가장 아름다운 젊은 카리에르와 벨라도바가 아닌가 싶어요.",2021.04.19
1599,팬텀,5,팬텀 역시!,넘 좋네요 역시 명극!!,2021.04.19
1600,팬텀,5,그어디에 정말,동굴저음이당,2021.04.19
1601,팬텀,5,팬텀 최고,너무 재밌었고 다시 보고 싶은 공연이에요,2021.04.19
1602,팬텀,5,팬텀최고,최고최고,2021.04.19
1603,팬텀,5,녹샹동 샴페인의 왕자,샴페인에게 샴페인을 ??,2021.04.19
1604,팬텀,5,녹샹동 어레인지 사랑혀,최고여 아주,2021.04.19
1605,팬텀,5,공연최고!!!,팬텀 극 내용도 음악도 너무 다 좋아요!  위로가 되는 극입니다!,2021.04.19
1606,팬텀,5,좋아요,"클래식한 넘버와 스토리 넘 좋았어요. 박은태, 이지혜 배우님 최고입니다.",2021.04.19
1607,팬텀,5,너무좋았어요,너무재밌어요ㅠㅠㅠ또볼꺼에용!!!!!!,2021.04.19
1608,팬텀,5,너무좋았어요,너무재밌어요ㅠㅠㅠ또볼꺼에용!!!!!!,2021.04.19
1609,팬텀,5,정말 최고ㅠㅠㅠ,배우님들 정말 다 최고입니더ㅠㅠ낮공텐션 맞나요ㅠㅠ대박,2021.04.19
1610,팬텀,4,세상이 무너진 이 순간 나의 음악이 되리라,알 수 있어 환상이 아니야 그대는 내게로 와 나의 음악이 되리라!  다시 다시 다시!! 집중 집중!! 내가 꼭 화를 내야 됩니까? 내가 턱을 살짝 내려야 된다고 몇번을 얘기합니까!! 브라바 브라바 브라바 브라바~ 놀라워 정말 많이 좋아졌어요! 기분이 아주 좋습니다! &#128578;  히히 넘넘 귀여운 마에스트로~~ Kai ㅋㅋ,2021.04.19
1611,팬텀,5,팬텀,재밌어요,2021.04.19
1612,팬텀,5,배우분들 너무 잘하세요!,계속 이야기만 듣다가 드디어 보게 되었는데 기대했던 것 이상으로 너무 좋았습니다. 무대 효과도 좋고 배우분들의 노래가 진짜 최고였습니다!,2021.04.18
1613,팬텀,5,신영숙님 쵝오~!!^^,김소현님과 규현님의 공연! 장작 3시간의 공연!! 모두들 애쓰셔서 너무너무 멋진 공연이었습니다 신영숙님 연기 노래 최고였어요~  또 보고싶습니다 팬텀이 이렇게 안쓰럽다니.. ㅠ,2021.04.18
1614,팬텀,2,글쎄...,"카이씨의 땀과 눈물, 연기와 노래는 훌륭했지만상대역 배우의 노래는 듣기가 힘들었어요노티나는 성악발성의 노래도 듣기 힘들었지만,남주인공의 연인이 아닌 어머니 같아서 보는사람은 몰입이 안되더군요. 뮤지컬계에서 많은 좋은작품을 하셨겠지만, 나이가 있어도 젊은역할 할수있다고 생각하지만, 연인으로 보이지가 않으니 뮤지컬이 다 끝나도 느껴지는게 없었어요  후기엔 감동적이었다는 평들이 많아서, 다른 페어로도 봐봐야겠네요",2021.04.18
1615,팬텀,4,믿고보는 뮤지컬 팬텀,정말 너무너무 궁금했던 뮤지컬 팬텀!박은태 배우님의 믿고듣는 목소리는 역시나 좋네요모든 배우님들의 열정 가득한 열연에 보는내내 긴장을 멈출 수 없었습니다!!남은 기간 회전문 돌아야죠~~,2021.04.18
1616,팬텀,5,규현 팬텀 너무 좋네요,캐릭터 해석도 연기도 마음에 들고 넘버 소화는 두 말 할 것 없이 좋네요~ 잘 봤습니다,2021.04.18
1617,팬텀,4,아름다운 무대와 더 아름다운 노래!,규현 이지혜 신영숙 최성원 홍경수 정철호 캐스트로 관람하였습니다  졔크리의 연기 목소리 모두 최고였습니다!! 진짜 팬텀 넘버는 난이도가 너무 극악이에요....ㅎㅎ 규팬텀도 너무나도 좋았지만 팬텀이라는 캐릭터 특성 상 미성보다는 중저음의 목소리가 조금은 더 잘 어울리겠다 싶은 생각이 들었어요. 이건 캐릭터와의 어울림 이야기지 규팬텀의 실력은 최고였습니다! 커튼콜 때 가면 벗는 모습보고 소름이 돋았네요ㅎㅎ 마마로타... 그저 빛이었어요.... 노래를 못한다는 설정이 솔직히 마음으로 받아들일 수 없었습니다ㅎㅎ 최성원 홍경수 정철호 배우님 모두 너무 좋았어요  개인적으로 뮤지컬이 아닌 무용 공연도 굉장히 좋아하는데 팬텀은 뮤지컬과 무용 공연 두편을 동시에 보는 느낌이었어요. 확실히 정통 발레여서 그런가 선이 아름다웠습니다! 무대도 역시 emk 자본의 맛이 빵빵하게 느껴졌고 샤롯데 시어터의 시야와 음향 더이상 말할 필요도 없을 것 같습니다!!  막을 내리기 전에 한번쯤은 더 보고싶은 공연입니다~,2021.04.18
1618,팬텀,5,은릭 사랑해요♡,박은태 배우님 외모가 가면을 뚫고 나와요ㅠ목소리는 왤케 좋습니까!!뮤지컬 보면서 안 울려고 하는데.. 은릭 때문에 눈물이 저절로 나요ㅠ눈물한바가지 흘리고 갑니다.,2021.04.18
1619,팬텀,5,은릭 사랑해요♡,박은태 배우님 외모가 가면을 뚫고 나와요ㅠ목소리는 왤케 좋습니까!!뮤지컬 보면서 안 울려고 하는데.. 은릭 때문에 눈물이 저절로 나요ㅠ눈물한바가지 흘리고 갑니다.,2021.04.18
1620,팬텀,5,팬텀.후기,"다양한 무대구성, 화려한 음향, 배우들의 연기, 넘버 모두 좋았습니다 엄마 모시고 간 공연이었는데 엄마도 너무 좋아하셨어요 행복했어요~♡",2021.04.18
1621,팬텀,5,은에릭은 최고,최고지 말해 뭐해요..박은태 배우님는 최고예요..눈물나요... 보는내내 행복했어요..은에릭..최고..+에녹 배우님 성량 대박..진짜 대박..,2021.04.18
1622,팬텀,5,Amazing Show,"Overall, the show was wonderful. The music flowed really well with the story and the cast sang amazingly. The stage, setup, props, and overall production was top notch and helped immerse the audience into the story. The overall story was told well and I really enjoyed this version of Phantom of the Opera.",2021.04.18
1623,팬텀,5,규졔 페어 최고였어요,"규현 배우님 이번에 팬텀 첫 합류라 하셨는데 연기 무엇 ,, 현장에서 듣는 노래 장난아니더라구요.. 무대를 찢었숨다ㅠㅠㅠㅠ 진짜 팬텀에 푹 빠져서 저도 같이 눈물 흘렸어요 졔크리스틴은 진짜 크리스틴 그 자체 ㅠ 너무 사랑스럽고 예뻤습니다 신영숙 배우님도 말해 뭐해!!! 너~~~무 재밌게 봤어요 기회가 되면 또 보고싶네요",2021.04.18
1624,팬텀,5,또 보고싶어오,동릭 최고ㅠㅠㅠㅜ,2021.04.18
1625,팬텀,4,귀호강하고왔습니다!!,작년에 오페라의 유령 내한 공연 보고 올해는 팬텀까지!! 새로운 내용들도 많이 있어서 재밌었습니다~~ 입장 전에 대기하면서 로비에 예고편 영상속에서 나오던 노래를 무대에서 들으니 반갑고 중독성이 꽤나 있어서 집에 오는 내내 생각났어요~ 전동석 배우님 공연 처음보는데 목소리가 너무 잘생기심... 또 보고싶은 뮤지컬이었습니다~,2021.04.18
1626,팬텀,5,오랜만에 가족끼리 재미난 뮤지컬 보았네요~ㅎ,모처럼 주말을 가족셋이서 뮤직컬 보고왔네요~ㅎ 오래전에 뮤지컬을 봐서 그런지 팬텀 무대장비나 음향 그리고 연출등 엄청 화려하고 눈을 뗄수없는 볼꺼리들이 풍성해서 즐거운 하루 보내어 감사드립니다.ㅎ,2021.04.18
1627,팬텀,5,넘 감동,역시 박은태님이시네요 한번보면 몰랐을 이 느낌감동받았어요 예전엔 울지않았는데 이번 공연볼땐 나두 모르게 주르륵~~행복했습니다,2021.04.18
1628,팬텀,5,감동 그 자체입니다~~,너무 재밌게 봤습니다. 규현이 노래잘하고 연기도잘해서 몰입도 최강! 다른배우분들도 너무 좋았습니다,2021.04.18
1629,팬텀,3,음,"1막은 너무 좋고, 재밌고 흠잡을 데가 없지만....2막이 약간 얼레벌레 하고 끝나는 건 아닌지....라는 생각을 했습니다. 그리고 배우님들이 넘 잘하셔요 흑흑... 신영숙 카를은 레전이다...",2021.04.18
1630,팬텀,5,진짜 강추☆,"재미와 감동을 다 담은 작품이고, 배우분들이 연기면 연기 노래면 노래 다 잘하셔서 ??. 중간중간 발레가 나와서 공연미 업그레이드!!! 시간만 있었으면 다른 페어로도 보고싶을 정도로 ♡",2021.04.18
1631,팬텀,5,관람후기,제가 생전 처음 뮤지컬을 봤는데 예상했던것보다 연출이 좋고 배우분들의 연기력과 가창력이 정말 경이롭다고 느꼈습니다.,2021.04.18
1632,팬텀,5,슬픈 팬텀의 삶 ㅜㅜ,팬텀 자둘 ~ 팬텀 너무 슬픈거 같아요 ㅠㅠ 지하무덤에서 오페라로 세상을 배웠다는 것이 맘아파요 얼마나 음악이 소중하고 필요했을까 크리스틴 다에의 목소리가 그 세상을 행복하게 만들었을텐대 얼굴때문에 도망치는 그녀를 보았을때.. 얼마나 ㅠㅠ 너무 슬프잖앙ㅅ ㅠㅠㅠㅠㅠ  박은태 배우님 절규하는 순간 같이 울었어요 맴찢.... ㅠㅠㅠㅠㅠ,2021.04.18
1633,팬텀,5,감사합니다,행복한 하루였어요 그 무대 스케일에 놀라고 규현배우에게 감탄하고 배우들의 열연에 빠져들다가 마지막에 규현배우 땜에 울컥한 하루,2021.04.18
1634,팬텀,5,감동이었어요,멀리 지방에서 큰 맘 먹고 올라갔는데 돈과 시간 아무것도아깝지 않았어요.사실 카이님에 대한 기대를 많이 품고 갔는데 카이님도 물론멋졌지만 다른 모든 배우님들 다 정말 좋았어요.제 다친 마음까지 어루만져 주는 것 같아 펑펑 울었습니다.또 보고 싶어요.멋진 공연 선물해주셔서 고맙습니다!,2021.04.18
1635,팬텀,4,선크리에게 반한 공연 :),임선혜 소프라노의 노래를 한번 더 듣고 싶어서 예매한 공연이었어요. 선크리의 비스트로는 정말 다시 들어도 진짜 진짜 좋았어요. 젠틀맨스 가이드에서 좋은 인상을 줬던 윤나리 배우님 역시 정말 좋았습니다. 어느 장면에서든지 디테일하게 연기하시는 모습이 정말 인상적이었고 그녀의 화음은 정말이지 아름답다는 말로는 부족하네요! 조만간 주연을 맡은 모습을 극장에서 보고 싶었어요!!,2021.04.17
1636,팬텀,5,또 보고싶네요,오랜만에 본 뮤지컬팬텀이라 더욱 좋았던거 같습니다소름돋게 노래 잘하시더라고요눈물도 흘리고 또 보고싶네요,2021.04.17
1637,팬텀,3,음...저는 별루 였어요 ㅠㅠ,여자 주연 배우님이 노래가 생각보다 별루였어요 스토리가 조금 지루하고 메인 곡이 나오지 않아서 실망했어요 ㅠㅠㅠㅠ,2021.04.17
1638,팬텀,5,너무 좋았어요,2층 끝이라 시야 걱정했는데 생각보다 너무 잘보였어요. 실루엣만 간신히 보일 줄 알아서 거의 반포기 상태였는데 입모양도 어느 정도 보여요 ㅎㅎ 근데 이왕이면 앞자리 잡으세요. 목은 조금 아플 수 있는데 그래도 좋아요 ㅠㅠ 그리고 배우님들 연기 너무 잘하시고 성량 대단하십니다.. 조금 슬프기도 하고 몰입 진짜 잘되요 ㅠㅠ 10명 중 8명이 만족합니다..,2021.04.17
1639,팬텀,5,카이 진짜 최고ㅜㅜ,"노래 잘하는 배우, 성량 큰 배우 많지만카이는 그 두가지에 더해 연기까지... 에릭 그 자체로 느껴져서 보는 내내 몰입하고 눈물 흘렸네요ㅜㅜ 정말 최고입니다",2021.04.17
1640,팬텀,5,대체불가 카이..굿굿굿,재공연 보러가려 광클중입니다.완벽을 넘어 황홀에 가까운 카이의 연기와 노래..꼭 보시길..,2021.04.17
1641,팬텀,5,"처음보는 대극장뮤지컬, 무대보다 화려했던 노래들",대극장 직관은 처음인데 확실히 화려하고 볼거리가 많더라구요. 오페라의 유령 원작이니 그런 연출이 있는 거 알고 갔는데도 눈 앞에서 벌어지니까 너무 놀라웠어요.카이 분과 임선혜 분 공연이었는데 귀가 너무 호강해서 할 말을 잃어버렸습니다.... 성악발성이 주가 되는 극에 성악으로 손꼽히는 분들을 가져다 놓으니 소리가 너무 호화로운데 너무 호화로워서 좋았어요 ㅎㅎ 또 보러 가야지 ㅎ,2021.04.17
1642,팬텀,4,종합 무대 예술의 극치.,너무 좋았는데 크리스틴 맡으신 배우님은 적응 기간이더 필요한듯.,2021.04.17
